,chunk_label,chunk_text,uuid
27,discussion2," Indeed, reported intakes at the 12-week point in the control group were lower than those reported in these previous national surveys. In a study of African American men, Wolf et al. found that they were not aware of, nor meeting, dietary recommendations due to a lack of knowledge and perceived barriers [35]. Similarly, McGee et al. [14] found that individuals in the lower Mississippi delta felt that they lacked knowledge and skills to prepare meals with healthful food choices. However, our subject population was provided with education on developing meals plans and tips for making healthy eating easier. This dietary education, coupled with the high education level of the individuals enrolled in the current study, should have resulted in their meeting Dietary Approaches to Stop Hypertension (DASH) recommendations. Based on our data, we suggest that behavior change for an extended time period, even for highly educated individuals, is difficult.",e61db25c-73d4-41fd-b953-e451c1e1fed0
28,discussion3," Studies suggest that beneficial changes in behavior for even motivated individuals require intensive, extended behavioral counseling, relapse prevention training, incentives, self efficacy and social support [36,37]. Results from a meta analysis conducted to evaluate the overall effectiveness of behavioral interventions to promote dietary change in fruit and vegetable intake were not conclusive [38].  Our results confirm that dietary training alone is not enough to elicit change; this finding underscores the need for new modalities to encourage beneficial dietary modification. Guenther et al. [31] and Casagrande et al. [7] emphasize the need for broadening interventions beyond increasing individual awareness of the value of vegetables and education toward altering eating behavior. While several studies have shown successful improvements in vegetable consumption through various dietary behavior change programs [37,39], others have not reported these benefits [40,41].",d0b66f43-3e11-4109-9924-079043925d91
29,discussion4," More effective intervention possibilities may include increasing access to vegetables [42]. The need for lower calorie, nutrient dense, convenient [12], inexpensive [43] methods to increase vegetable consumption are important for future public health campaigns. Our data suggests that vegetable juice may serve as a portable and convenient method to aid individuals in meeting dietary vegetable recommendations.  Although vegetable consumption was enhanced in those consuming juice, no significant changes were observed over the 12-week test period for any of the measured vascular health parameters listed in Table 1. The vegetable juice in the study provided a one to one ratio of sodium to potassium and thus it is important to note that blood pressure measurements did not change in any of the groups over the 12 week period.",78be35c7-2da7-4cd8-b7c0-a22edf91cff9
30,discussion5," The group blood pressure results obtained in the current study are consistent with previous reports that show total dietary mineral intake is a consideration relative to blood pressure [44-46]. To further probe this issue, we analyzed the data from the subset of individuals whose initial blood pressures were over 120/80 mm Hg (pre-hypertensive but less than hypertensive range). In the vegetable juice group, this subgroup showed a significant decrease in blood pressure over the 12 week intervention period (the number of pre-hypertensive subjects in the no vegetable juice group was too low (N = 7) to allow for meaningful statistical comparisons for this specific subgroup). While preliminary in nature, our finding that the consumption of the vegetable juice was associated with a reduction in blood pressure in pre-hypertensive subjects is consistent with the putative positive vascular health effects of diets rich in vegetables, which are good sources of dietary potassium.",2cc61d4e-c026-4b1c-b107-d4d9997251b0
31,discussion6," This differential blood pressure response between normotensive and pre-hypertensive individuals has been seen in other intervention studies [47,48].  Svendsen et al. [49] reported improvements in blood pressure following an intervention promoting very high levels of vegetable and fruit intake. Those improvements were seen in a more compromised population exhibiting a higher baseline body mass index and included some individuals with cardiovascular risk factors such as hypertension and diabetes mellitus, smokers, and those with a prior cardiovascular event [49].  In several papers, the concept has been raised that vegetables or their respective extracts can result in an improvement in the oxidant defense system, with a consequential reduction in tissue oxidative damage [50-52]. While the measurements are controversial [53], numerous investigators have used plasma thiobarbituric acid reactive substances (TBARS) as a general indicator for oxidative damage [54,55].",498031be-2f3e-46fb-810b-c8384a6388ca
32,discussion7," For the above reason, this measurement was included in the current study. However, consistent with our expectation, the consumption of the vegetable juice product did not result in significant changes in this parameter. We think it is important to note, however, that the above finding does not rule out the possibility that the vegetable juice intervention could have improved select parameters of the oxidative defense system. For example, it is possible that phytochemicals present in vegetable juice could reduce the extent of the oxidation of select targets, such as low density lipoproteins (low density lipoproteins (LDL)) [22] and deoxyribonucleic acid (deoxyribonucleic acid (DNA)) [56,57]. However, it is likely that these phytochemicals are acting, in part, through mechanisms that are independent of the direct antioxidant properties of the phytochemicals.",50a5b4b0-0850-4237-a558-5383be5e2749
33,discussion8," For example, it has been suggested that certain phytochemicals can inhibit enzymes that produce reactive oxygen and nitrogen species [58,59]. Additional research similar to that conducted by Valtueña et al. [60], correlating the intake of adequate vegetables, containing dietary antioxidants, to functional antioxidant and oxidative stress parameters is needed.  An important consideration for our study is that the subject selection does not reflect the general population because it was a fairly homogenous, highly educated, Caucasian, healthy population with very high adherence and willingness to volunteer for a study that included drinking vegetable juice. The current findings need to be replicated in a larger, more diverse population group, and ideally it needs to be conducted over a longer period of time.  Conclusion Our results show that the consumption of vegetables, even in an educated, healthy population, remains lower than recommendations.",fa48b70d-f865-4845-89cf-2dde2b28ed1f
34,discussion9," Registered dietitians can help clients enhance vegetable intake and bridge the vegetable gap by recommending the incorporation of 8 fluid ounces of vegetable juice into their diets. Interestingly, increasing daily vegetable intake through the incorporation of vegetable juice was associated with reduced blood pressure in a subset of pre-hypertensive subjects. Future research should be done to examine other at risk subgroups, including minorities and individuals with pre-existing cardiovascular risk factors to better define the cardiovascular risk reductions that are associated with the chronic consumption of vegetable juice.  Competing interests This work was supported in part by resources from the Campbell Soup Company and in part by resources provided from the UC Davis Center for Health and Nutrition Research which was established with funding from the State of California Vitamin Price Fixing Consumer Settlement Fund.",56e9c473-2f39-4fdd-bb94-f2c51c694fff
35,discussion10," CS Khoo and BL Winters are employees of Campbell Soup Company and hold stock there. CL Keen and JP Foreyt are members of Campbell Soup Company's Vegetable Plant Advisory Panel. SF Shenoy, WSC Poston, RS Reeves, AG Kazaks, RR Holt, HJ Chen, CK Haddock and ME Gershwin do not have any financial interests to declare.  Authors' contributions SFS acquired and interpreted data, drafted and critically reviewed the manuscript, and gave final approval of the version to be published. WSCP analyzed and interpreted data, drafted and critically reviewed manuscript and gave final approval of the version to be published. RSR interpreted data, drafted and critically reviewed manuscript, and gave final approval of the version to be published. AGK acquired and interpreted data, drafted and critically reviewed the manuscript, and gave final approval of the version to be published.",e7b2d550-17de-4b7f-9b23-2c40463ea411
36,discussion11," RRH made substantial contributions to conception and design of study, acquired and interpreted data, drafted and critically reviewed the manuscript, and gave final approval of the version to be published. CLK made substantial contributions to conception and design of study, interpreted data, drafted and critically reviewed the manuscript, and gave final approval of the version to be published. HJC acquired data, drafted and critically reviewed the manuscript, and gave final approval of the version to be published. CKH analyzed and interpreted data, drafted and critically reviewed manuscript and gave final approval of the version to be published. BLW made substantial contributions to conception and design of study, interpreted data, drafted and critically reviewed the manuscript, and gave final approval of the version to be published.",7a0ce7af-d9b4-44a6-aea0-73b260c2a7cf
37,discussion12," CSK made substantial contributions to conception and design of study, interpreted data, drafted and critically reviewed the manuscript, and gave final approval of the version to be published. JPF made substantial contributions to conception and design of study, interpreted data, drafted and critically reviewed the manuscript, and gave final approval of the version to be published. MEG interpreted data, critically reviewed manuscript and gave final approval of the version to be published.  Acknowledgements This work was supported in part by resources from the Campbell Soup Company and in part by resources provided from the UC Davis Center for Health and Nutrition Research which was established with funding from the State of California Vitamin Price Fixing Consumer Settlement Fund. We thank Jodi L.",cab8c62c-031b-49b6-8061-e1451b98af2e
38,discussion13," Ensunsa and Calliandra Harris for phlebotomy support, Kerri Green for technical support, undergraduate student assistants for sample preparation and database entry, and all the participants in the Vegetable Juice Study. =",57a285fc-9eeb-47ee-bb1e-8aaf679e03fc
