,chunk_label,chunk_text,uuid
0,background0,"For almost two decades, the United States Department of Agriculture (United States Department of Agriculture (USDA)) has recommended that Americans consume a minimum of 5 servings of vegetables and fruits a day [1]. These recommendations are based on numerous studies showing that meeting the recommended daily intake of fruit and vegetables is associated with a reduced risk for a number of chronic diseases, with the evidence for cardiovascular disease and stroke being particularly strong [2-5]. In 2005 the Department of Health and Human Services updated the Dietary Guidelines which recommended an increase in fruit and vegetable intake and changed the recommendations from servings to cups [6]. The new goal was 2-6.5 cups (equivalent to 4 - 13 servings) according to an individual's sex, physical activity and age [6].",a1dad9bc-de18-4dd3-8fb8-975dd0599951
1,background1," For this study, which focuses on vegetable consumption, the Dietary Guidelines suggest that 2½ cups of vegetables per day are recommended for a reference 2,000-calorie intake [6].  Despite numerous intensive public educational campaigns, surveys examining trends in vegetable consumption from 1988 to 2002 show that 7 out of 10 Americans consume less than the United States Department of Agriculture (USDA) recommended servings of vegetables each day and suggests that 25 percent of respondents had no daily vegetable intake at all [7]. There are multiple reasons for low vegetable intake in the United States, including perceived high costs [8], lack of awareness of the benefits of vegetable consumption [9-11], low availability of fresh products in certain areas [12], taste concerns [13], and limited food preparation time and skills [14].",923880e1-3abd-4cce-be3c-7382d7ff2500
2,background2," A consequence of low vegetable consumption can be a low intake of essential nutrients that are key factors for vascular health such as potassium and vitamin C, as well as decreased sources of phytochemicals, such as flavonoids and carotenoids, which have a number of putative positive vascular health benefits [15,16]. Given these factors, there is a need to develop new strategies that can close the gap between what is recommended for vegetable intake, versus what is actually occurring in the general population. Logically the solutions that are advanced for closing the gap between intake and recommendations should be convenient, calorie appropriate, cost effective, and supported by sound science [17].  The Dietary Approach to Stop Hypertension (Dietary Approaches to Stop Hypertension (DASH)) diet was originally designed for those with cardiovascular risk factors, such as hypertension [18,19], but it was subsequently recommended as one of two healthy eating patterns for the general U.S.",ff9e4110-6f13-4aaf-bfba-a0c511b552f9
3,background3," population in the 2005 Dietary Guidelines [6]. Adherence to the Dietary Approaches to Stop Hypertension (DASH) diet has been shown to be associated with improved vascular health in a number of trials [9,20,21].  The primary objective of the current study was to determine if the incorporation of a vegetable juice is a practical way for individuals to help meet dietary recommendations for daily vegetable intake as described by the 2005 Dietary Guidelines and the Dietary Approaches to Stop Hypertension (DASH) diet. Other goals were to obtain preliminary evidence about the impact of vegetable juice consumption on cardiovascular health by measuring blood pressure, lipid profiles and other related parameters. ",90af1973-9b0b-4f21-a660-a2c0f05e882e
4,methods0,"Study Population Adult men and women (age 40-65 years) were recruited from the University of California, Davis, campus and surrounding Sacramento, Solano and Yolo counties using newspaper advertisements. One hundred and sixty two individuals were screened at the Ragle Human Nutrition Research Center for the study, of which 90 (66 women and 24 men) were enrolled into the study. The ethnicities of those enrolled were representative of the recruitment area and included: 63% Caucasian, 9% Asian, 10% Hispanic, 5% other, and 13% not reported. Exclusion criteria were: use of medications that affect blood clotting and vascular reactivity such as anti-depressants, anti-anxiety medications, and aspirin, blood pressure ≥ 140 mm Hg systolic or ≥ 90 diastolic, BMI < 18 or ≥ 35 kg/m2, uncontrolled diabetes or hypertension, history of heart disease, and a Beck Depression Inventory® (Beck Depression Inventory® (BDI)) depression scale score of 21 or above (Pearson Education, Inc., San Antonio, Texas).",770fafaf-b31c-4f19-abfe-4dd3718d329c
5,methods1," With the exception of basic multivitamin/mineral supplements, subjects were instructed to refrain from using dietary supplements, including herbs and omega-3 fatty acids during the study period. Participants were instructed to refrain from using nonsteroidal and anti-inflammatory medication for the week prior to a clinic visit. All subjects provided written informed consent at the time of screening, and the Institutional Review Board at the University of California, Davis, approved this study.  Design Eligible subjects were randomized in a three-arm parallel design to drink 8 fluid ounces (1 cup) or 16 fluid ounces (2 cups) of vegetable juice or no juice for a 12-week period. Visits were at baseline (week 0), week 6 and week 12 of the study. Subjects were instructed to follow a low carotenoid diet for the week prior to study day 1 so that all subjects started with the same approximate baseline carotenoid level [22] and a low flavonoid diet 24 hours prior to each visit.",967c5085-b74f-4215-9e8d-699597d35996
6,methods2," During the low flavonoid diet, subjects continued to consume their vegetable juice. Previous studies have shown that these dietary phytochemicals can have an impact on vascular function [23-25]. Three day diet records were collected during the low carotenoid diet period to assess adherence to the diet restriction.  All participants were asked to follow the Dietary Approaches to Stop Hypertension (DASH) diet plan which emphasizes vegetables, fruits, whole grains, lean meats and low fat or fat free milk [6]. It is rich in magnesium, potassium, calcium and fiber. In line with the United States Department of Agriculture (USDA) Food Guide, the Dietary Approaches to Stop Hypertension (DASH) diet defines a serving of vegetables as one cup of raw leafy vegetables or half a cup of vegetable juice, cooked vegetables or raw vegetables [26,27]. In this paper, we report vegetable intake as Dietary Approaches to Stop Hypertension (DASH) servings.",d51d0ef8-8704-446a-90d8-f42a3c6a8f2d
7,methods3," The Dietary Approaches to Stop Hypertension (DASH) diet training emphasized inclusion of vegetables, and specifically did not instruct subjects to consume vegetable juice in place of mealtime vegetable servings. On the first study day all subjects were counseled about the diet in small groups. The curriculum for the study was based on six objectives and during the session participants were expected to:  1. Identify the key aspects of the Dietary Approaches to Stop Hypertension (DASH) eating plan.  2. Calculate the appropriate number of servings for each food group according to a personal calorie goal.  3. Describe ways of measuring appropriate serving sizes of foods.  4. Develop realistic personal goals and meal plans.  5. Discuss tips to make healthy eating easier.  6. Demonstrate how to use a checklist to track their individual progress towards meeting the Dietary Approaches to Stop Hypertension (DASH) goals.",1f422a70-65fd-4fa5-b7b1-07c3449ee927
8,methods4,"  For each objective, appropriate handouts were provided and filled out during the instruction period and participants were given the material to take home.  Participants randomly assigned to the vegetable juice groups were supplied with vegetable juice to last for the 6 weeks between visits. The juice was packaged in 46-fluid ounces bottles with a plain black and white label. The same lot was used for all subjects for the 12-week study period. A clear plastic glass with an 8 fluid ounce marker was provided for ease of juice measurement. Eight fluid ounces of the vegetable juice (V8®; Campbell Soup Company, Camden NJ) provided 50 calories, 0 g of total fat and cholesterol, 480 mg of sodium, 470 mg of potassium, 2 g of protein, 20 mg lycopene, and 10 g of total carbohydrate of which 2 g were dietary fiber, and 8 g of sugars.",57a1fad0-9756-497f-a20a-3b860a032e70
9,methods5," The juice provided 40% of the Daily Value of Vitamin A from naturally occurring beta-carotene in the vegetables (1000 IUs = 300 micrograms RAEs (Retinol Activity Equivalents)), 120% of Vitamin C, and 4% of calcium and iron.  Data Collection and Measures Baseline self-reported demographic and dietary characteristics were collected at the start of the study. At weeks 6 and 12, subjects who consumed the juice turned in self-reported questionnaires to indicate their daily consumption of the vegetable juice.  Three-day food records were collected from 2 weekdays and 1 weekend day before study visits at baseline (during the carotenoid washout period), week 6 and week 12. Baseline vegetable intake was not used for statistical analyses; instead the data provided information on low carotenoid diet adherence. The food records were reviewed by a registered dietitian and were entered in duplicate into a database and analyzed with Food Processor software (Version 10.2.0, ESHA research, Inc.",4c8d9245-c11c-41f5-b1c8-8112dbb33ead
10,methods6,", Salem, OR). Vegetable servings were quantified according to the Dietary Approaches to Stop Hypertension (DASH) diet recommendations. One Dietary Approaches to Stop Hypertension (DASH) diet serving of vegetables corresponds to 0.5 cups of MyPyramid vegetables [26] or 4 fluid ounces of vegetable juice [27].  Clinical measurements included blood pressure, weight, height, and waist circumference. Blood pressure measurements were the average of 2 measurements and were taken using an automated system (Vital Signs 300, Welch Allyn Protocol Inc., Beaverton, OR) after the subject was seated for 5 minutes. Mean arterial pressure (Mean arterial pressure (MAP)), or average arterial pressure during a single cardiac cycle, was calculated using the formula: Mean arterial pressure (MAP) = [((systolic - diastolic)/3) + diastolic]. Normal Mean arterial pressure (MAP) range is 70-110. For weight and height measurements, subjects were fully dressed, with the exception that their shoes were removed.",c5c77567-324a-4c8c-8196-7cf71d6fa987
11,methods7," Height was recorded on their first visit only using a wall-mounted stadiometer (Ayrton S-100, Prior Lake, MN). Weight was recorded every visit using an electronic scale (Scale-tronix Inc., White Plains. NY). At the baseline visit and at week 12, 24-hour urine samples were collected. The 24-hour urine collection period started immediately after consumption of the assigned vegetable juice treatment and ended 24 hours later. Urine was stored during the 24 hours in insulated bags with ice packs. At baseline, week 6 and 12, blood samples were drawn for comprehensive metabolic panel (chemistry, liver, fasting blood glucose), high sensitivity C-reactive protein, and lipid panel. High sensitivity C-reactive protein, lipid and comprehensive metabolic panels and 24-hour urine analysis were performed by the Clinical Pathology Laboratory of the University of California, Davis Medical Center.",6c783aa9-1280-4223-85c7-754831011a2c
12,methods8,"  Given previous reports on the potential effects of vegetable intakes on the antioxidant status of subjects [28,29], we measured plasma thiobarbituric acid reactive substances (thiobarbituric acid reactive substances (TBARS)) as a marker for oxidative stress; thiobarbituric acid reactive substances (TBARS) were determined as previously described [30].  Statistical Analyses Data were analyzed for the 86 subjects who completed the 12-week study. The vegetable intake data are for the 80 subjects who completed their diet records at both 6 and 12 weeks. For continuous variables, analysis of variance (and 12 weeks For continuous variables analysis of variance (ANOVA)) and Fisher's PLSD (Statview 5.0.1, SAS Institute Inc., Carey, NC) were employed using 3 groups (0, 8 and 16 fluid ounces of vegetable juice daily) or 2 groups (daily vegetable juice consumption or no vegetable juice consumption).",d23c8f4f-a0db-4319-a796-0d15524d5f44
13,methods9," Analysis for categorical variables was conducted using the Chi square test to compare the two exposures (vegetable juice or not). Blood pressure data were analyzed using repeated measures and 12 weeks For continuous variables analysis of variance (ANOVA) with Tukey's post hoc for multiple comparisons or Friedman's repeated measures and 12 weeks For continuous variables analysis of variance (ANOVA) where appropriate (Sigma Stat 3.5, Systat Software Inc, San Jose, CA). Subjects were stratified into normal and pre-hypertensive groups (diastolic blood pressure > 80 mm Hg and/or systolic blood pressure > 120 mmHg) and subjects consuming 8 or 16 fluid ounces of vegetable juice were grouped together to increase statistical power. For all statistical analyses, a p-value < 0.05 was considered statistically significant. Data are presented as mean ± standard deviation. ",2765830d-63d6-4742-ba50-b14c57ec88d9
14,results0,"A total of 90 subjects were enrolled and randomized to one of three treatment groups. Thirty subjects were assigned to drink 8 fluid ounces of the vegetable juice, 30 subjects were assigned to drink 16 fluid ounces of the vegetable juice, and 30 subjects received no vegetable juice. Of the 90 enrolled, 86 subjects completed the 12-week study. The four subjects who did not complete the study were all within the vegetable juice treatment groups. Two subjects withdrew from the study due to the development of a mild rash, and one subject withdrew due to mild heartburn that they associated with the consumption of the juice. The data for one subject was excluded due to non-compliance (Figure 1). A total of 48 out of 53 participants, who completed beverage consumption logs, indicated that they consistently consumed the juice (≥ 6 days per week of juice consumption), representing a high level of adherence to the protocol.",cb7b4637-66ef-472f-8522-0e70e16dc78a
15,results1," Dietary intake data from six subjects were not analyzed because they had incomplete food records. A total of 80 subjects were included in the analysis of dietary data (n = 27, 26, 27 respectively for 0, 8, and 16 fluid ounces).  Figure 1 Enrollment and Randomization.  Apart from systolic blood pressure and insulin levels, no significant differences in baseline characteristics were observed among the randomized groups. As a matter of chance, baseline systolic blood pressure was significantly higher in subjects randomly assigned to the 8 fluid ounces group than in the other groups. Baseline insulin levels were significantly higher in subjects who were in the 16 fluid ounces group (Table 1). A demographic characteristic of note is the education level of participants; all had completed high school or higher education. Seventy-three percent were college graduates and, of these, 62% had master's, doctoral, or law degrees.",61986d24-b733-4ba6-bf30-8df975734e2f
16,results3,"2**	 Fasting Blood Glucose⌂ (mg/dL)	92.9 ± 7.4	92.7 ± 8.8	93.4 ± 5.3	 Values are mean ± standard deviation.  * Significantly different from 16 ounce group p = 0.02; **significantly different from 8 ounce group (p = 0.01), and no beverage (p = 0.04)  BMI = Body Mass Index; BP = Blood Pressure; Chol = Cholesterol; HDL = High Density Lipoprotein; hsCRP = high sensitivity C-reactive protein; low density lipoproteins (LDL) = Low Density Lipoprotein  Despite being counseled on the Dietary Approaches to Stop Hypertension (DASH) diet and being encouraged to increase their consumption of vegetables, apart from vegetable juice consumption, the majority of people enrolled in the study had a vegetable intake that was lower than public health recommendations, of at least 4 daily servings, or 2 cups, of vegetables (Figure 2). Average vegetable intake for all groups, without counting vegetable juice, was 2.6 servings per day after 6 weeks and 2.3 servings per day after 12 weeks.",83928b0d-d23f-46f7-b8c5-03831324e1ba
17,results4," There were no significant differences among groups in dietary vegetable intake at 6 or 12 weeks (apart from vegetable juice consumption). These intakes are well short of Dietary Approaches to Stop Hypertension (DASH) recommendations of 4-6 servings/day for the subjects' calorie requirements of between 1600-3000 calories per day. Adding 8 fluid ounces (2 Dietary Approaches to Stop Hypertension (DASH) diet servings of vegetables) of vegetable juice to the diet increased the average daily vegetable servings to 4.3 after both 6 and 12 weeks. The addition of 16 fluid ounces (4 Dietary Approaches to Stop Hypertension (DASH) diet servings) of vegetable juice to the diet resulted in an average daily vegetable consumption that met the minimum recommendation for vegetable intake (6.5 and 6.4 servings per day at weeks 6 and 12, respectively). These results were in marked contrast compared to individuals who received only Dietary Approaches to Stop Hypertension (DASH) education.",73175937-e829-42f1-8d85-6e0d8f83ff80
18,results5," Their vegetable intake averaged 3 servings per day at week 6, and 2.1 servings per day at week 12. Apart from vegetable juice consumption, only 7.7% of subjects in the 8 fluid ounces and 18.5% in the 16 fluid ounces group met daily vegetable intake recommendations at week 6. At week 12, 19.2% in the 8 fluid ounces group and 11.1% in the 16 fluid ounces group met the recommendations. In contrast, when vegetable juice was incorporated into the diet, 50% of participants in the 8 fluid ounces group and 100% of those consuming 16 fluid ounces of vegetable juice achieved daily vegetable recommendations at 6 weeks. At week 12, 53.8% in the 8 fluid ounces group and 100% of those in the 16 fluid ounces group met recommendations. For those in the control group, who received only Dietary Approaches to Stop Hypertension (DASH) diet instruction and consumed no vegetable juice, 22.2% at 6 weeks and 7.4% at 12 weeks achieved daily vegetable intake recommendations.",99f2f080-3987-4e5e-9201-dd8ec179a14d
19,results6,"  Figure 2 Comparison of vegetable intake (servings per day) among vegetable juice consumption groups at weeks 6 and 12. * a Significantly different from no vegetable juice c at 6 weeks and d at 12 weeks p ≤ 0.01, b significantly different from 8 fluid ounces and no vegetable juice groups at 6 weeks, and at 12 weeks p ≤ 0.0001. Vegetable consumption in the week 12 no vegetable juice group was significantly decreased from week 6 p ≤ 0.01. 8 fluid ounce group n = 26; 16 fluid ounce group n = 27; no vegetable juice n = 27.  The addition of the vegetable juice added vegetable servings to the diet and significantly increased dietary potassium and sodium intake at 6 and 12 weeks in those consuming 16 fluid ounces daily (Table 2). These additions coincided with corresponding increases in the concentrations of urinary sodium and potassium excreted by those consuming the juice (Table 3).",245c1dee-4855-4b38-bc8f-dea9d1abefe4
20,results7, Consuming vegetable juice resulted in a dose response increase in dietary vitamin C at 6 and 12 weeks among groups (Table 2) and those consuming 16 fluid ounces of vegetable juice had higher dietary vitamin A than the control group at 12 weeks. This increase in vitamin A came in the form of β-carotene present in the juice. There were no changes in nutrient composition in the reported dietary intakes in any group between 6 and 12 weeks (Table 2).  Table 2 Summary of Dietary Data from All Subjects,25a0b7fc-90bf-479b-8175-67409cdbc7b8
21,results11,"9 ± 10.3	28.4 ± 13.0	36.2 ± 16.8***	 	 Urinary Sodium Concentration--12 weeks	58.2 ± 20.8	62.4 ± 23.5	79.0 ± 27.8****	 *Significantly different from no vegetable juice group (p = 0.01); **significantly different from no vegetable juice group (p < 0.01); ***significantly different from no vegetable juice group p < 0.01; ****significantly different from 8 fluid ounce group (p = 0.02), and no vegetable juice group (p < 0.01)  Values are means ± SD.  There were no significant differences in systolic or diastolic blood pressure within groups or among all treatment groups, when all subjects were included, over the 12-week period. However, significant differences in blood pressure were observed in a subset of individuals who drank the juice.",a8144a64-d0e5-44a9-915f-03a24240c189
22,results12," Figure 3 compares those individuals who drank the juice for 12 weeks (8 and 16 fluid ounces data combined), and had blood pressures at the start of the study over 120 mm Hg systolic or 80 diastolic (panels A, C, E) with those who had normal blood pressure (panels B, D, F). Those who began the study with normal blood pressures had no significant change in blood pressure throughout the study. In those subjects who started the study with blood pressure in the pre-hypertensive range, a significant within group decrease in all blood pressure parameters was observed after 12 weeks of juice consumption. Systolic blood pressure significantly decreased after 12 weeks of juice consumption (128.1 ± 8.0 at baseline vs. 123.4 ± 9.5 at week 12; Figure 3A; p < 0.05). After 12 weeks of vegetable juice consumption, diastolic blood pressure was significantly reduced from baseline and 6 weeks (82.6 ± 5.6 at baseline and 81.8 ± 5.2 at week 6 compared to 79.0 ± 4.5 at week 12; Figure 3C; p < 0.05).",2e7461d4-fe68-4a4f-a07b-fa7a3f7c802a
23,results13," Similarly, mean arterial pressure was significantly reduced after 12 weeks of juice intake from both baseline and at 6 weeks (97.8 ± 5.3 at baseline, 96.8 ± 5.7 at week 6, and 93.8 ± 5.4 at week 12; Figure 3E; p < 0.05).  Figure 3 Twelve Weeks of Vegetable Juice Consumption Decreases Blood Pressure in Individuals with Diastolic Blood Pressure > 80 mm Hg and/or Systolic Blood Pressure > 120 mmHg. Subjects consuming 8 or 16 fluid ounces of vegetable juice were combined into a single group to examine systolic (A), diastolic (C) and mean arterial pressures (E). Systolic (A and B), diastolic (C and D), and mean arterial (Mean arterial pressure (MAP); E and F) pressure of subjects who consumed either 8 or 16 fluid ounces of vegetable juice for 12 weeks. Those who started the study with blood pressures greater than 120 mmHg systolic (A) and/or 80 mmHg diastolic (C) demonstrated a significant decrease in blood pressure over the 12-week period, including Mean arterial pressure (MAP) (E).",9cb3fbcf-197d-42b5-987d-6566f6479f3f
24,results14," Those who had normal pressures at the start of the study demonstrated no significant change in blood pressure over the 12-week period (B, C and F). * Significant from baseline p < 0.05 (Repeated Measures and 12 weeks For continuous variables analysis of variance (ANOVA), Tukey post hoc). ** Significant from baseline, and 6 weeks (p < 0.05; Repeated Measures and 12 weeks For continuous variables analysis of variance (ANOVA), Tukey post hoc).  There were no significant differences within groups over the 12 week intervention, or among groups, in BMI, waist circumference, plasma insulin, measures from the comprehensive metabolic panel (chemistry, fasting blood glucose, and liver panel), lipids, high sensitivity C-reactive protein or plasma thiobarbituric acid reactive substances (TBARS) (data not reported). ",698940a1-56bb-4b83-99cb-48b48de8cc4c
25,discussion0,"Relative to current public health recommendations, the majority of Americans consume inadequate amounts of vegetables (minimum of 4 servings) in their diet [7,31,32]. Consistent with this report, our subjects' average daily intake of vegetables did not meet recommendations (for either Dietary Approaches to Stop Hypertension (DASH) or 2005 Dietary Guidelines) at any time during this study despite Dietary Approaches to Stop Hypertension (DASH) diet education. Importantly, the dietary intake of vegetables apart from the juice was similar among the three groups. However, the incorporation of the vegetable juice significantly increased the total daily intake of vegetables to an average of 4.3 and 6.5 servings of vegetables in the 8 and 16 fluid ounce groups, respectively. The Dietary Approaches to Stop Hypertension (DASH) diet instruction emphasized inclusion of vegetables, and did not instruct subjects to consume vegetable juice in place of mealtime vegetable servings.",9b4fab77-7b59-4726-b778-0a5329a0c89f
26,discussion1," These results support the concept that the daily consumption of a vegetable juice is a feasible way for an individual to help meet their dietary recommendation for vegetable intake. During the study we obtained information from participants related to their perceptions on including vegetable juice into their diets. The majority of those drinking the juice self-reported that they enjoyed the taste, felt they were doing something good by drinking it, were satisfied they had a diet that provided the right vitamins and minerals, and were satisfied with the ease of getting vegetables in their diet.  The data from the current study were obtained from a population of healthy, well-educated adults in California. Similar to what is found in various sectors of the U.S. population [33-35], the majority of people enrolled into this study did not consume the recommended daily servings of vegetables.",08f4406a-bb89-4d5d-98b4-7785566be92f
