,chunk_label,chunk_text,uuid
0,methods0,"2.1. Participants Participants enrolled in this cross-sectional study were men from Northern–Eastern Poland who attended the centre of reproductive medicine in Olsztyn (Poland) or voluntarily joined the study in 2014–2018. The eligibility criteria for the participation in the study was being aged 20–55 years, the absence of a specific clinical condition, willingness to undergo examinations, and the absence of acute or chronic reproductive tract diseases or diagnosed hormonal disorders. Initially, the study population consisted of 541 men who gave their consent to share available results of the semen analysis with the study personnel. However, only 233 (43.1%) men were willing to participate in further stages of the study. During the data verification, subjects were excluded due to missing (n = 11) or unreliable (n = 15) data. Finally, 207 (38.3%) men were enrolled in the study.",792904ec-1b72-4960-b8b1-4d8e0f9a69d2
1,methods1,"  The study protocol was approved by the institutional review board of the Bioethical Committee of the Warmia-Mazury Medical Chamber in Olsztyn (no. 9/2015). All participants gave written informed consent.  2.2. Dietary Data Collection All participants filled out a semi-quantitative 165-food-item food frequency questionnaire (food frequency questionnaire (FFQ)) validated for the Polish population [18]. During the face-to-face interview, participants were asked about the average portion size and frequency of food consumption ranging as times per day, week, month, or year, and “never”, “I do not know how often”, or “I do not know if I ate”, within a year prior to involvement in the study. Food items from the food frequency questionnaire (FFQ) were reduced to 23 food groups on the basis of origin and similar nutrient content, and this was used for further analysis.  Adherence to the dietary approaches to stop hypertension (DASH) diet was assessed with the index developed by Günther et al.",c6eaf34b-058b-4202-820d-11eff096c5c1
2,methods2," [19]. dietary approaches to stop hypertension (DASH) diet score is composed of eight food groups. Six components (fruit, including juices; vegetables, including potatoes; meat, poultry, fish, and eggs; nuts, seeds, and legumes; fats and oils; sweets) were on a 10-point scale (0–10) and four components were on a 5-point scale (0–5) (grains: total and high-fibre; dairy products: total and low-fat). Adherence to the dietary approaches to stop hypertension (DASH) diet was based in the overall score, ranging from 0 to 80. Servings intake between a minimum and maximum level were scored proportionally. Individuals received the maximum score if their intakes met the recommendation. In the case of intakes of sweets, fats, and oils, and meat, poultry, fish, and eggs, where lower intakes are favourable, components were reverse-coded and received a maximum score of 10 if their intakes were at or below the target level.",00f733ac-c92d-4b18-ae7d-1913a797cfcd
3,methods3," The number of each food group servings was assigned on the basis of the energy levels (Table S1) [19,20]. For each individual daily energy intake, we assigned to the closest literature-based energy intake category (1200, 1400, 1600, 1800, 2000, 2600, and 3100 kcal/day) recommended by the National Health Institute [20].  2.3. Physical and Sedentary Activity The procedure for assessing physical activity (PA) and sedentary time were described previously [21]. In brief, PA was evaluated by the validated International Physical Activity Questionnaire (IPAQ)—long version [22]. Participants were asked about average duration (in minutes) and frequency (days) they spent on four PA domains (work-related, transport-related, domestic and gardening (yard), leisure time) during the week prior to the appointment. PA was expressed as a sum of all activities (MET (metabolic equivalent of task) min/week) and as weekly time in which individuals spent on each type of PA intensity (min/week).",43246219-8cbd-4b01-a715-4c3b5d041fbb
4,methods4," A sum of the average time per week spent on sitting (at work and home, and while driving) expressed the sedentary time (h/week).  2.4. Semen Analysis Details of the semen sample analysis were described previously [21]. Briefly, samples were collected at the clinic by masturbation. Before analysis, the samples were liquefied for 30 min at 37 °C. Macroscopic examination of raw semen samples was performed manually [23]. Microscopic measurements were determined with the use of computer-aided semen analysis (computer aided semen analysis (CASA)) by the system composed of a bright-field microscope (Olympus CX41, Tokyo, Japan), a digital camera to capture images (Olympus U-CMAD3, Tokyo, Japan) and professional software (SCA Microptic S.L., Barcelona, Spain). Sperm concentration and motility were determined with a four-chamber GoldCyto slide (10 μm depth) by applying 4 μL of semen, and analysed under phase-contrast optics at ×100 magnification.",24a82a31-1328-46a9-ba34-33eb20942a4d
5,methods5," Morphology of at least 50 spermatozoa was assessed on semen smears stained with Diff-Quick method, using a bright-field optics at 600× magnification. To evaluate abnormal values of semen quality parameters, the WHO [23] cut-off points were used. All analyses were performed by an experienced technician.  2.5. Other Measurements Bodyweight (with accuracy to 0.1 kg) and height (with accuracy to 0.1 m) were measured in light clothing and barefoot using a digital scale and stadiometer, respectively. Body mass index (Body mass index (BMI)) was calculated as the ratio of body weight and squared height, and evaluated according to the WHO cut-off points [24].",cb6df096-7159-4cc4-90db-8f6c73b1f9d0
6,methods6," All participants provided answers regarding their economic status (below average, average, above average), educational level (basic and vocational, intermediate, high), place of residence (village, less than 50,000 citizens, 50,000–100,000 thousand citizens, more than 100,000 citizens), smoking status (current, past, or never), and sleep duration (average hours).  2.6. Statistical Analysis The normality of the data was assessed by the Shapiro–Wilk test. All continuous variables had nonparametric distribution and were presented as the median and interquartile range (interquartile range (IQR)). Differences between tertiles of the dietary approaches to stop hypertension (DASH) diet and PA were evaluated using the Kruskal–Wallis test and Dunn’s post-hoc test. Categorical variables were expressed using number and percentage and compared between tertiles using chi-square or Fisher’s exact test.",4e54fce1-56d7-4b0d-858f-b33d8a6721b2
7,methods7,"  To extract the participants’ adherence to a low, medium, or high subgroup of the combination of the dietary approaches to stop hypertension (DASH) diet and PA, the matrix based on tertiles distribution of these two factors was created (Scheme S1). Participants with low adherence to the combination of the dietary approaches to stop hypertension (DASH) diet and PA were characterised by a low score of the dietary approaches to stop hypertension (DASH) diet and low or moderate PA, or moderate score of the dietary approaches to stop hypertension (DASH) diet and low PA. Participants with moderate adherence to the combination of the dietary approaches to stop hypertension (DASH) diet and PA were characterised by a high score of the dietary approaches to stop hypertension (DASH) diet and low PA, a high or moderate score of the dietary approaches to stop hypertension (DASH) diet and moderate PA, or moderate or low score of the dietary approaches to stop hypertension (DASH) diet and high PA.",f4fcccc9-ccca-4fcb-9920-10703557a2f9
8,methods8," Participants with high adherence to the combination of the dietary approaches to stop hypertension (DASH) diet and PA were characterised by a high score of the dietary approaches to stop hypertension (DASH) diet and a high PA.  The association between semen parameters and the dietary approaches to stop hypertension (DASH) diet, PA, and their combination was evaluated by the general linear model. Semen parameters were log-transformed before inclusion in analyses. Linear trends were assessed by assigning the median value (excluding the combination of the dietary approaches to stop hypertension (DASH) diet and PA) within each tertile and modelling this variable continuously. Two adjustment sets were considered: model 1—unadjusted and model 2—adjusted for age, Body mass index (BMI), and energy intake to total energy expenditure ratio (EI/TEE) (as continuous variables), and smoking status (yes/no) and socioeconomic status (low/medium/high) (as categorical variables).",2e4832d6-7efc-4cc9-8de6-73064de87f13
9,methods9," Results were presented as backtransformed least square means of semen parameters (and their corresponding standard errors) and their cross-tertile differences (ΔT3-T1).  Separate models including single components of the dietary approaches to stop hypertension (DASH) diet and PA were fitted to identify those which contributed to the effects observed in main analyses. The applied model was adjusted for age, Body mass index (BMI), EI/TEE ratio (as continuous variables); and smoking status (yes/no) and socioeconomic status (socioeconomic status (SES)) (low/medium/high) (as categorical variables), and respectively for other components of the dietary approaches to stop hypertension (DASH) diet score or a sum of other PA intensities. All p-values were two-sided and an alpha level of <0.05 was considered as significant. All statistical tests were performed using STATISTICA software (version 13.1 PL; StatSoft Inc.: Tulsa, USA/Inc: Krakow, Poland)  3.",6f6903a9-db21-476d-be1a-0337fb32e1db
10,methods10," Results Table 1 shows socioeconomic and semen quality characteristics of study participants by tertiles of the dietary approaches to stop hypertension (DASH) diet and PA. The majority of participants, with a median age 26.0 (23.9; 29.0) years and Body mass index (BMI) 24.8 (23.1; 26.8), had a normal weight (53.1%), were non-smokers (75.8%), urban residents (73.4%), and had basic or intermediate education (59.9%). In tertiles (T1, T2, T3) of the dietary approaches to stop hypertension (DASH) diet and PA, there were no differences for socioeconomic parameters. None of the semen parameters differed across tertiles of the dietary approaches to stop hypertension (DASH) diet. According to the PA, men in T3 had higher sperm count and concentration, total and progressive motility, as well as morphology compared with men in T1. Significantly more participants with abnormal total and progressive sperm motility were observed in T1 (38.2% and 61.8%, respectively) compared with in T2 (19.1% and 45.",ec503bee-ff86-4aef-9e33-c7463d693087
11,methods11,"6%, respectively) and T3 (18.3% and 42.6%, respectively).  Table S2 shows diet and physical activity characteristics among tertiles of the dietary approaches to stop hypertension (DASH) score and PA. Medians of consumption frequency of vegetables, fruits and nuts, seeds, legumes, and percentage of high-fibre grains and low-fat dairy in the dietary approaches to stop hypertension (DASH) T3 were higher compared with the dietary approaches to stop hypertension (DASH) T1 (3.8 vs. 1.6 times/day, 1.8 vs. 0.6 times/day, 3.7 vs. 0.8 times/week, 32.5% vs. 7.3%, and 80.7% vs. 69.3%, respectively). Median consumption frequencies of meat, fish, eggs, fats and oils, and sweets in the dietary approaches to stop hypertension (DASH) T3 were lower compared with the dietary approaches to stop hypertension (DASH) T1 (3.5 vs. 3.8 times/day, 1.9 vs. 2.7 times/day, and 4.9 vs. 7.2 times/week, respectively). However, none of the consumed food groups were found to differ across PA tertiles.",d12a159d-bb4e-4735-bc2b-1014b7cd4664
12,methods12," Men in the dietary approaches to stop hypertension (DASH) T3 spent more time on total and moderate PA than men in dietary approaches to stop hypertension (DASH) T2 (205 vs. 116 min/week and 73 vs. 38.5 min/week, respectively), and spent less time sedentary than men in dietary approaches to stop hypertension (DASH) T1 (1.8 vs. 2.9 h/week), but there was no difference in total PA (p = 0.598). As expected, we observed the highest total PA and the total time of PA in PA T3, and differences were significant across all tertiles (p < 0.001).  Table 2 shows the association between semen parameters and adherence to the dietary approaches to stop hypertension (DASH) diet, PA, and their combination. There were a substantially higher sperm concentration and count across tertiles of dietary approaches to stop hypertension (DASH) diet adherence in the both crude and adjusted model (sperm concentration: ΔT3-T1 = 24.6 mln/ej; sperm count: ΔT3-T1 = 82.1 mln/mL and 85.",ca88692e-5677-4ad9-92b7-4662903e8b71
13,methods13,"4 mln/mL in the crude and adjusted model, respectively). However, adherence to the dietary approaches to stop hypertension (DASH) diet was not associated with other semen parameters. A significant positive association was observed in sperm parameters across tertiles of PA. Higher PA was directly associated with sperm count (ΔT3-T1 = 69.4 mln/ej, ptrend = 0.043), total motility (ΔT3-T1 = 11.9%, ptrend < 0.001), progressive motility (ΔT3-T1 = 8.5%, ptrend < 0.001), and morphology (ΔT3-T1 = 2.8%, ptrend = 0.003) in the crude model. Except for sperm count, these effects remained significant after adjusting for age, Body mass index (BMI), EI/TEE, smoking status, and socioeconomic status (SES). A key point of the analysis was to compare sperm parameters across tertiles of the dietary approaches to stop hypertension (DASH) diet and PA combination. Both in crude and adjusted models, positive cross-tertile trends were observed in sperm concentration (ΔT3-T1 = 17.5 mln/ej; ptrend = 0.",51e4bc23-3539-40b7-87db-fbd7afbd07b4
14,methods14,"016), sperm count (ΔT3-T1 = 98.1 mln/mL; ptrend = 0.036), total (ΔT3-T1 = 11.8%; ptrend = 0.002), and progressive motility (ΔT3-T1 = 10.0%; ptrend = 0.003) and morphology (ΔT3-T1 = 3.3%; ptrend = 0.004).  The results of the analysis for individual dietary approaches to stop hypertension (DASH) diet components (after adjustment for multiple confounders) (Table 3) indicated a negative association between grains and sperm concentration (β = −0.162; p = 0.028) and total motility (β = −0.162; p = 0.030), as well as dairy and sperm concentration (β = −0.147; p = 0.037). A significant positive association was found between low-fat dairy and sperm volume (β = 0.186; p = 0.009); nuts, seeds, and legumes and sperm concentration (β = 0.158; p = 0.033); and fats and oils and sperm count (β = 0.188; p = 0.011). Sweets scoring was also positively associated with sperm concentration (β = 0.190; p = 0.010), but reverse coding needs to be taken into account.",8319f0c3-f18e-4d48-9f01-79c484e5a45c
15,methods15," We also evaluated the link between semen parameters and each level of PA intensity (Table 3). The results indicate that vigorous PA was positively associated with sperm count (β = 0.188; p = 0.009), total (β = 0.182; p = 0.009) and progressive (β = 0.182; p = 0.010) motility, and morphology (β = 0.195; p = 0.007). Moderate PA was positively associated with total sperm motility (β = 0.143; p = 0.049).  4. Discussion In this study, we investigated the association between semen quality and dietary approaches to stop hypertension (DASH) diet, PA, and their combination. We found that greater adherence to the dietary approaches to stop hypertension (DASH) diet was associated with higher sperm count and concentration, whereas higher PA level was associated with better total and progressive motility and morphology. To our best knowledge, this is the first study assessing the cluster of diet and PA in relation to semen quality.",36c899db-15f2-40fe-857b-7bd919ff95e0
16,methods16," Our study provides evidence that assessing the effect of a healthy diet combined with a higher level of PA may be a better indicator of semen quality than evaluation of individual factors in separation.  Studies assessing the effect of healthy dietary patterns, regardless of whether they were data- or hypothesis-driven, presented a positive relationship with sperm quality [25]. Healthy dietary patterns, including the dietary approaches to stop hypertension (DASH) diet, correlated positively with the intake of foods or nutrients, which have a favourable effect on maintaining or improving semen quality [26]. In our study, we did not observe differences in semen parameters across tertiles of the dietary approaches to stop hypertension (DASH) diet. However, higher adherence to this diet was associated with higher sperm count and concentration.",a286a1fb-d83c-4257-a500-a6513e50b505
17,methods17," Additionally, analysis of single components of the dietary approaches to stop hypertension (DASH) diet showed that sperm concentration was positively correlated with nuts, seeds, and legumes and inversely with sweets, total dairy, and total grains. Sperm volume and count were positively associated with low-fat dairy and fats and oils, respectively, whereas total sperm motility was inversely associated with total grains. Our results are partially consistent with Cutillas-Tolin et al. [27] where higher adherence to the dietary approaches to stop hypertension (DASH) diet was associated with higher sperm concentration, total sperm count, and total motile sperm count in healthy young Spanish students. Some similarities may also be found with observations made by Efrat et al. [13], where higher adherence to the dietary approaches to stop hypertension (DASH) diet was associated with higher sperm concentration and morphology among men attending an Israeli fertility centre.",dc9e3c7f-8875-41c1-a467-87b4b40c4544
18,methods18,"  The dietary approaches to stop hypertension (DASH) diet, similar to the Mediterranean diet and prudent dietary style, assumes a higher intake of fruit, vegetables, whole grains, and legumes. These food groups are positively associated with sperm count, concentration [28], sperm motility [29,30], and morphology [28]. As a naturally rich source of vitamins, minerals, and polyphenols, the dietary approaches to stop hypertension (DASH) diet may be perceived as antioxidative and anti-inflammatory. The antioxidants in male reproductive health may be positively associated with semen parameters [31,32,33], fertilization rate [34], decreasing oxidative damage to spermatozoa [35,36], DNA maintenance, transfer RNA, protein synthesis [37], and the reduction of the negative effects of inflammation [36,38].",fad8a6b2-2815-4c54-afd1-e19cd7ef906c
19,methods19," Moreover, the dietary approaches to stop hypertension (DASH) diet recommends a reduction in sweets, meat, eggs, and fat consumption that, due to the content of sugars, saturated/trans fatty acids, and sodium, may adversely affect sperm count [28], concentration [39,40], sperm motility [29,40,41], and morphology [40,41].  In our study, semen parameters differed across PA tertiles and were positively correlated with PA. Analysis of the impact of individual PA components on semen parameters indicated that the obtained results were mostly affected by vigorous PA. In our study, the type of PA that corresponded to this effect was work-related activity. This result suggests that a high cumulative effect of PA from the whole day could be as important as recreational PA.  Ibanez-Perez et al. [4] in their meta-analysis revealed that moderate or high recreational PA could have a beneficial influence on semen quality.",b48689fb-2fed-4466-9f3d-ff2aed2817c1
20,methods20," Authors also highlighted that different types of PA did not modify that association. On the other hand, elite PA was correlated with a decline in volume, concentration, total motility, and morphology [4] and affects sperm DNA fragmentation [42]. However, some studies present that PA was not related to semen quality in young men and those from infertile couples [4,17,43,44]. Nevertheless, the promotion of moderate-to-vigorous PA may improve semen parameters, sperm DNA integrity, impaired seminal markers of inflammation, and oxidative stress [45,46]. Interestingly, the impact of different intensities showed an inverted U-shape association between PA and semen quality [47,48]. Also, other studies supported this finding, suggesting poorer semen quality in sedentary [7,16,49] or highly active men [42] compared with recreationally or moderate physically active men.",6b288c4e-68d3-4b47-9281-8df3e90b3508
21,methods21,"  The possible mechanisms through which PA might exert its effect on semen are oxidative stress, impaired hypothalamus-pituitary-testicular (hypothalamus pituitary testicular (HPT)) axis function, and hormonal imbalance [50,51,52]. Exercise naturally increases oxygen consumption, resulting in a general increase in reactive oxygen species (reactive oxygen species (ROS)) production. With increased exercise intensity, the body can no longer eliminate the increasing reactive oxygen species (ROS) concentration, which leads to oxidative stress and damage of cellular components [50,51]. These effects can be explained by the so-called hormesis theory. Regular moderate PA improves antioxidant enzyme activity and resistance to oxidative stress. Simultaneously, forceful exercise results in an increase of oxidative stress, reactive oxygen species (ROS), and oxidative damage, whereas the activity of antioxidant enzymes and the capacity of oxidative damage repair are impaired [50].",dc89e695-4526-4ca2-8bb9-773d230f3a0a
22,methods22," The impact of PA on hypothalamus pituitary testicular (HPT) axis functioning can be miscellaneous and depends on activity levels [52,53]. A moderate PA could be related to higher follicle-stimulating hormone (follicle stimulating hormone (FSH)), luteinizing hormone (LH), and testosterone (T) level in comparison to the sedentary controls [54]. High-intensity exercise may lead to a decrease in plasma LH, follicle stimulating hormone (FSH), and T concentration, as well as sperm parameters [55]. The suppression of the hypothalamus pituitary testicular (HPT) axis could be caused by decreased production of gonadotropin-releasing hormone and a reduced response of gonadotropins during acute prolonged physical exercise [53,56].  The major strength of this study was the use of validated questionnaires for assessing food consumption and PA.",8176cc2e-838b-45c4-9bf6-87afbacbab6d
23,methods23," Also, the food frequency questionnaire (FFQ) measures food intake during the past 12 months, which minimises risk of misclassification of the dietary approaches to stop hypertension (DASH) score and overlaps with spermatogenesis time for the taken sample. Additionally, the use of hypothesis-based dietary patterns more closely reflects real food consumption, and it could be easily applicable by other researchers or dietitians and physicians in their practice.  However, some limitations of the study should be acknowledged. First, the nature of the cross-sectional study limited the identification of causal relationships between diet, PA, and semen quality. Secondly, we assessed the semen quality based at a one-time point, which does not consider the within-person variability in semen parameters. Third, the usage of the questionnaire to assess PA could be a source of bias, whereas the use of accelerometers is a recommended method to objectively measure PA.",ece2a651-a77e-479b-b8c1-da89f42c2c12
24,methods24," Our study measured the semen condition only in the context of six parameters and did not include the viability, acrosomal reactivity, and spermatozoa kinematics parameters, which are useful for evaluating semen quality and its fertilization capacity. Also, the number of participants with low PA was relatively small, which did not allow for the selection of a subgroup strongly adherent to a sedentary lifestyle.  5. Conclusions Adherence to the dietary approaches to stop hypertension (DASH) diet was related to higher sperm count and concentration, whereas their combination with physical activity was also positively correlated with sperm motility and morphology. Furthermore, we observed that daily physical activity was firmly associated with semen parameters. Following our novel findings, we would recommend the use of the dietary approaches to stop hypertension (DASH) diet and physical activity together as a better indicator of semen quality compared with both factors analysed separately.",b08bc509-65a2-432d-9486-b40a11e0104a
25,methods25," However, our findings need to be confirmed by further prospective observational and clinical studies. Because the management of infertility involves many different treatment strategies, cooperation between physicians, dieticians, and public health educators might be of great importance.  Supplementary Materials The following are available online at https://www.mdpi.com/2072-6643/12/1/39/s1: Table S1: List of components of the dietary approaches to stop hypertension (DASH) score and their description; Table S2: Diet and physical activity characteristics among tertiles of dietary approaches to stop hypertension (DASH) score and physical activity; Scheme S1: Matrix of the dietary approaches to stop hypertension (DASH) diet and physical activity tertile distribution.  Supplementary File 1 Click here for additional data file.   Supplementary File 2 Click here for additional data file.   Author Contributions Conceptualization, A.D., J.M., and K.E.P.; data curation, A.D. and J.M.",88f66028-0441-4e71-8e71-7ef15ce38374
