,chunk_label,chunk_text,uuid
0,abstract0," Background: Inflammation is the key pathophysiological mechanism of the initiation and progression of atherosclerosis. The study objective was to assess the effects of a dietary intervention based on the model of the dietary approaches to stop hypertension (dietary approaches to stop hypertension (DASH)) diet on the levels of chemokines RANTES and CXCL4 in patients with non-obstructive coronary artery disease. Methods: As part of Dietary Intervention to Stop Coronary Atherosclerosis in Computed Tomography (DISCO-CT) study, patients were randomised to an intervention group (n = 40), where the dietary approaches to stop hypertension (DASH) diet was introduced along with optimal pharmacotherapy, and to a control group (n = 39), with optimal pharmacotherapy alone. In the dietary approaches to stop hypertension (DASH) group, systematic dietary counselling was provided for the follow-up period. RANTES and CXCL4 levels were determined using ELISA.",25612bff-a666-4133-aebd-5a0ff24261d6
1,abstract2," Conclusions: A 12-month-long intensive dietary intervention based on dietary approaches to stop hypertension (DASH) diet guidelines as an addition to optimal pharmacotherapy causes changes in the levels of chemokines CXCL4 and RANTES and their mutual relationship in comparison to conventional treatment.  dietary approaches to stop hypertension (DASH) diet chemokine CXCL4 chemokine RANTES atherosclerosis inflammation ==== Body 1. Introduction  Studies on the dietary approaches to stop hypertension (dietary approaches to stop hypertension (DASH)) diet show the efficacy of this nutrition model in the prevention and treatment of arterial hypertension [1,2] and reduction in the risk of common cardiovascular diseases (CVDs), such as coronary artery disease (coronary artery disease (CAD)), stroke and heart failure [3,4,5,6].",403032bc-9bae-4e24-8587-7321500a12cb
2,abstract3," The dietary approaches to stop hypertension (DASH) diet is characterised by a high amount of fruits, vegetables, whole grains and low-fat dairy products and low content of saturated fats, cholesterol, cereals with low fibre content (high glycaemic index) and sweets [7]. One of the potential mechanisms underlying a positive effect of the dietary approaches to stop hypertension (DASH) diet on the cardiovascular system may be via modification of the inflammatory process [8,9]. Inflammation is the key pathophysiological mechanism of the initiation and progression of atherosclerosis [10]. Studies conducted so far point to platelets as a probable link between inflammation and clotting activation, which is involved in atherosclerotic plaque destabilisation. Activated blood platelets secrete numerous chemokines, including CXCL4, CCL5, CXCL12 and others, which initiate or promote local inflammatory processes at the sites of vascular damage [11].",72a5f41b-ed6a-4d93-a9aa-a14c1e3e0822
3,abstract4," RANTES (also known as CCL5) belongs to the family of CC chemokines and has strong chemoattractive activity for T lymphocytes and macrophages [12], and its role in the development of atherosclerosis has been confirmed in numerous studies [13,14]. It was reported that subjects with metabolic syndrome and no clinically manifested cardiovascular disease show activation of blood platelets and increased serum RANTES levels [15]. However, studies on the correlation between serum RANTES levels and the severity of coronary artery disease (CAD) are inconclusive. An increased RANTES level was observed in patients with myocardial infarction, especially complicated by left ventricular dysfunction [16,17], while the level of this chemokine in stable coronary artery disease (CAD) decreased [18]. In other studies, in contrast, low levels of RANTES correlated with more advanced coronary atherosclerosis and were an independent predictor of increased cardiovascular mortality [19].",5c7a5d7a-299b-47bf-9189-415404733087
4,abstract5,"  CXCL4, another platelet-derived chemokine, may cooperate with RANTES in the development and destabilisation of atherosclerotic lesions. CXCL4 (also known as platelet factor 4) is abundantly released after platelet activation. CXCL4 foster absorption of oxidised low-density lipoprotein (low density lipoprotein (LDL)) from macrophages, fostering formation of foam cells and promoting development of the lipid core of atherosclerotic plaque [11]. CXCL4 increases chemotaxis using RANTES and vice versa by creating CXCL4–CCL5 heterodimers, which triggers monocyte recruitment and adhesion [11,20]. Animal studies showed that injection of a peptide inhibitor of CXCL4-CCL5 heterodimer formation (MKEY), significantly reduced myocardial infarction size [21]. Nevertheless, similarly to RANTES, studies on the plasma CXCL4 level in patients with coronary artery disease (CAD) have provided inconsistent results [22,23].",65c781e8-7156-4b65-beda-a969169405a7
5,abstract6,"  There is little research in the literature on the possibility of modifying the levels of chemokines RANTES and CXCL4 with dietary intervention. Considering that the co-presence of CXCL4 and RANTES increases monocyte recruitment to the endothelium more than CXCL4 or RANTES alone [24], documenting the effect on both chemokines seems pertinent. The current studies confirm the effect of Mediterranean diet variants on the reduction in RANTES concentration but do not explore its effect on the levels and proportions of CXCL4 [25].  The objective of the present study was to assess the effects of a dietary intervention based on the model of the dietary approaches to stop hypertension (DASH) diet on the circulating levels of chemokines RANTES and CXCL4 in patients with known coronary atherosclerosis.  2. ",42569d13-da62-40f1-b62f-41b79f776a04
6,methods0," The study involved 97 participants of the Dietary Intervention to Stop Coronary Atherosclerosis in Computed Tomography (DISCO-CT) study, a pilot, single-centre, randomised study, who underwent coronary computed tomography angiography (computed tomography angiography (CTA)) as part of a routine diagnostics of coronary artery disease (CAD), which confirmed the presence of non-occlusive atherosclerotic lesions in at least two segments of the coronary arteries. All patients were carefully evaluated in terms of clinical status and supplementary tests and qualified to conservative treatment after no evidence of coronary artery obstruction had been found; subjects with clinical indications for expanded diagnostics of coronary artery disease (CAD) and/or coronary revascularisation were not included. Patients with active neoplastic disease and diagnosed autoimmune disease were excluded from the study.",135a12d0-bacf-46be-9849-92a4956a267f
7,methods1," The primary outcome of the trial was the reduction of percentage atheroma volume (percentage atheroma volume (PAV)) measured between baseline and follow-up CT scans, whereas the secondary outcome was a change in pericardial fat distribution between baseline and follow-up CT scans. This article involves an analysis of additional data (serum inflammatory markers) regarding which research protocol was extended after 1 month upon commenced patient recruitment.  The inclusion criteria were as follows: coronary artery stenosis of <70% in at least two segments of the coronary arteries on computed tomography angiography (CTA) (according to the American College of Cardiology/American Heart Association classification) qualified for conservative treatment, age of >18 years, informed consent to take part in the study, declaration and willingness to cooperate and adherence to the doctor’s instructions.",8510c172-2f7f-45fb-b251-222b635d9e60
8,methods2," The following exclusion criteria were used: valvular heart disease requiring cardiac surgery (or expected intervention within 1 year), diagnosed dilated or hypertrophic cardiomyopathy, known genetic disorders affecting the development of atherosclerosis (e.g., familial hyperlipidaemia), factors that may affect the quality and safety of computed tomography angiography (CTA), women of childbearing potential and insufficient quality of data obtained from computed tomography angiography (CTA).  In this study, 92 subjects between 35 and 74 years of age (5 resigned during the course of the study) were randomly allocated to an experimental group with dietary intervention or to a control group, using 10 randomisation blocks with 10 subjects each at the ratio of 1:1. Patients from both groups received optimal medical treatment according to the European Society of Cardiology guidelines [26].",6474c237-c007-4571-84d0-0ca50dde4e01
9,methods3," However, 1 subject withdrew consent, and 12 subjects were excluded from the final analysis (11 were diagnosed with rheumatoid arthritis, and 1 was excluded due to liver damage). The course of the study is shown in Figure 1.  2.1. Dietary Intervention  Dietary counselling involved the following visits: at the baseline and after 1, 3, 6, 9 and 12 months. Each subject was given the dietitian’s contact information (telephone number, e-mail address) so as to provide additional consultations. In the study group, the basal metabolic rate (basal metabolic rate (BMR)) was assessed on the basis of the patients’ body composition. In the intervention group, emphasis was placed on an increase in the number of meals to 5 and intervals between meals no longer than 3 h.",6638def5-9446-468f-a7c4-cf055c6e9b8c
10,methods4," On the basis of the basal metabolic rate (BMR) and the level of physical activity, the patients were assigned an individual dietary approaches to stop hypertension (DASH) plans at the following caloric levels according to need: 1600, 1800, 2000 and 2600 kcal. The energy deficit in patients with obesity did not exceed 200 kcal a day and resulted from increased physical activity recommended for both groups. dietary approaches to stop hypertension (DASH) diet plans supplied the following energy proportions at each energetic level: 52–55% from carbohydrates, 16–18% from proteins and 30% from total fats.  As part of the study, basic assessment of dietary habits was planned, including a survey of the meal frequency and a 24 h nutrition history. The assessment of diet quality and adherence was conducted in both groups with the use of the dietary approaches to stop hypertension (DASH) index, according to the methodology described by Guntner et al. [27].",cd8e9dc5-93a3-4bcf-b0b1-e0cfede071a7
11,methods5," The dietary approaches to stop hypertension (DASH) index comprises 8 food groups being part of the dietary approaches to stop hypertension (DASH) diet: cereals, vegetables, fruits, dairy products, meat, nuts/seeds/pips, fats/oils and sweets. The maximum score in each food group can be 10.  2.2. Physical Activity  The patients in both groups were encouraged to perform increased physical activity throughout the study, and the instructions were compliant with the European Society of Cardiology guidelines [24]. At each follow-up visit, a history of physical activity during leisure time was taken. The patients were asked to classify their physical activity as regular (at least 3 sessions of 30 min per week), irregular or none.  2.3. Anthropometric Measurements  The patients’ height and body weight were measured at the baseline and after 6 months of intervention with the use of an electronic BSM370 device to the nearest 0.1 cm and 0.05 kg, respectively.",d9ba5c87-b938-4e64-8a61-c4e5c37cc3ab
12,methods6," The measurement of body composition was conducted twice, at the beginning of the study and after 12 months, with no shoes and minimum clothes using Body Water Analyzer InBody S10. The analysis included total body fat (total body fat (TBF)), total body fat percentage (total body fat (TBF)%) and visceral fat area (visceral fat area (VFA)) defined as the intra-abdominal cross-sectional area of visceral fat expressed in centimetres-squared. The measurements were conducted on an empty stomach, with at least a 12 h interval from physical activity.  2.4. Biochemical Analyses  Blood for biochemical tests was collected from fasting patients at the baseline visit, after 6 months and after 12 months. Plasma levels of CXCL4 and RANTES were assayed using ELISA (Human CXCL4 ELISA Kit; Biorbyt, Cambridge, UK, and Human RANTES ELISA Kit; Biorbyt, Cambridge, UK) according to the manufacturer’s protocol.  2.5. Calcium Score  The calcium score was assessed with dedicated software (syngo.",fcd47245-34f8-496f-8cc5-dc6b3657fb29
13,methods7,"via; Siemens, Erlangen, Germany) using non-contrast computed tomography scans and expressed in Agatston units.  2.6. Statistical Analysis  Statistical analysis of the results was performed using STATISTICA 13 software. Correlation was determined by calculating Spearman’s rank correlation coefficient. Means were compared using the t-test. Categorical data were compared using the Mann–Whitney U test.  The study was approved by the bioethics committee at the Institute of Cardiology in Warsaw (IK-NP-0021-51/1514/15). Written informed consent was obtained from each patient. The study protocol conformed to the ethical guidelines of the 1975 Declaration of Helsinki, as reflected in a priori approval by the institution’s human research committee. The trial was registered at clinicaltrials.gov (accessed on 7 October 2020) (NCT02571803).  3. Results  The characteristics of the study group and the control group are presented in Table 1.",900922e2-f2d5-442b-94d7-ca1cff1f5748
14,methods8,"  During the 12 months of the study, all participants received the treatment according to the European Society of Cardiology guidelines [24]. The number of patients on statin treatment increased from 25 to 32 in the dietary approaches to stop hypertension (DASH) group vs. from 29 to 33 in the control group. The study included 5 patients (6%) with documented statin intolerance and 9 patients (11%) who were unwilling to start pharmacotherapy of dyslipidaemia during the study. The dietary approaches to stop hypertension (DASH) group revealed high adherence to the instructions of the dietary approaches to stop hypertension (DASH) diet during the study, which resulted in significant improvement in the patients’ diet quality. The dietary approaches to stop hypertension (DASH) index in the dietary approaches to stop hypertension (DASH) group increased from 34.33 ± 14.7 to 60.47 ± 9.1 (p = 0.0001), while in the control group, such change was insignificant (increase from 34.56 ± 13.6 to 38.",70b5e0a3-902c-4b7f-9851-3993897d8716
15,methods9,"13 ± 12.3). Detailed changes in the specific components of the dietary approaches to stop hypertension (DASH) index are presented in Table 2.  The number of patients declaring regular physical activity in the dietary approaches to stop hypertension (DASH) group increased from an initial 22 (55%) to 32 (80%) (p = 0.04) vs. from 9 (23%) to 20 (51%) in the control group (p = 0.08). As a consequence of the intervention, we observed changes in the body composition. In the dietary approaches to stop hypertension (DASH) group, a decrease in the total body fat percentage (total body fat (TBF)%) from 33.05 ± 9.1 to 30.10 ± 8.1 (p = 0.00015) was observed, while in the control group, there was a slight increase from 32.84 ± 7.34 to 33.51 ± 8.9 (p = 0.246). An important benefit of the dietary intervention was a reduction in the visceral fat content by 19.90 ± 29.2 cm2 in the dietary approaches to stop hypertension (DASH) group (p = 0.",2d5d5c5d-94ec-43fb-beae-1c24ad840f76
16,methods10,"0001), while in the control group the reduction was insignificant. In addition, a beneficial effect on the lipid profile was observed in the dietary approaches to stop hypertension (DASH) group, with paired reductions by ca. 12% in total cholesterol and 16% in low density lipoprotein (LDL), approximately twofold greater than in the control group.  3.1. Changes in Inflammatory Marker Levels  The analysis of selected demographic and clinical data by RANTES level quartiles and the coefficients of correlation with the RANTES level are presented in Table 3.  In the dietary approaches to stop hypertension (DASH) group, no significant baseline correlation was observed between the RANTES level and the parameters of body composition and most of the analysed biochemical parameters, except for CXCL4 and homocysteine. For the high-sensitivity C-reactive protein (hsCRP), a significant correlation was observed between visceral fat (r = 0.252; p = 0.027) and the visceral fat percentage (r = 0.",b1dd8786-d5b1-47a4-a319-0cb97c0097b9
17,methods12," Correlation analysis showed that for all the patients in both groups, a change in the RANTES level was correlated with a change in the CXCL4 level, which is shown in Figure 2A.  3.2. Correlation with dietary approaches to stop hypertension (DASH) Index, Body Composition, Physical Activity and Calcium Score  Changes in the chemokine levels were significantly correlated with a change in the dietary approaches to stop hypertension (DASH) index among all the patients (for CXCL4, r = −0.412, p = 0.003; for RANTES, r = −0.293, p = 0.04). In specific groups, they did not significantly correlate with a change in the total dietary approaches to stop hypertension (DASH) index in any of the analysed groups. However, the dietary approaches to stop hypertension (DASH) group revealed significant inverse correlations for a change in the CXCL4 level and a change in the index for vegetables (r = −0.310), the RANTES level for cereals (r = −0.",e97af3a8-1a1c-4502-ae99-bf3c4d3b8fa9
18,methods13,"363) and the RANTES/CXCL4 ratio for cereals, vegetables and fruits. Table 5 shows detailed results of the analysis regarding the correlation between changes in RANTES and CXCL4 levels in both groups and the dietary approaches to stop hypertension (DASH) index, as well as its particular components.  Analysis of the correlation of the chemokine level change with the change in the total fat and visceral fat content showed a significant correlation only for RANTES and changes in the total fat content (r = 0.241; p = 0.03) in all the patients, but it was not confirmed in specific groups. The data scatter chart is shown in Figure 2B.  Correlation analysis did not show any relationship between physical activity and changes in the levels of both chemokines and their mutual relationship. Additionally, analysis of the correlation of chemokine levels with the calcium score was performed. After 12 months of study, the RANTES level was not significantly correlated with the calcium score (r = −0.",989aa9ec-2964-4ec0-8acd-8772021df106
19,methods14,"135; p = 0.235), similar to the CXCL4 level (r = 0.059; p = 0.602). In addition, a change in both chemokines was not correlated with a change in the calcium score (for RANTES, r = −0.181, p = 0.107; for CXCL4, r = −0.02, p = 0.836).  4. Discussion  To the best of our knowledge, this is the first study showing the effect of an intensive dietary intervention based on the dietary approaches to stop hypertension (DASH) diet on serial plasma levels of RANTES and CXCL4 in a long-term observation of patients with coronary artery disease (CAD). Reduced inflammation expressed as a decreased concentration of hsCRP and other inflammatory markers, such as interleukin 6 (IL-6), resulting from the use of the dietary approaches to stop hypertension (DASH) diet has been confirmed by many previous studies. None of them, however, involved RANTES and CXCL4, and the follow-up period was usually 3 to 24 weeks [8].",bf0764d2-19ce-4c87-8f21-6aa310a5723f
20,methods15," Our observations show that a declining trend in inflammatory markers can be maintained beyond 24 weeks. Secondly, none of the up-to-date studies have aimed to investigate changes in chemokine levels over time. Last but not least, our study proves that the dietary approaches to stop hypertension (DASH) diet is a good target nutritional model, since it may be used for a long time with satisfactory adherence.  Even though there is no doubt that RANTES and CXCL4 are important in the process of the formation and destabilisation of atherosclerotic plaque, much controversy around the predictive value of the discussed chemokines has been raised. In some studies, low RANTES levels (<19 ng/mL) were observed in healthy subjects, for example in a study by Parissis et al. [16] and Nomura et al., [15]. Other authors, however, indicate that low RANTES levels may predict negative cardiovascular events.",38055ab5-aa27-4659-b26a-0f1552d22fd5
21,methods16," Specifically, the literature on the clinical significance of the chemokine concentration in patients with coronary artery disease (CAD) is inconsistent. For example, a study by Cavusoglu et al. demonstrated a significant increase in cardiovascular mortality in subjects who underwent coronary angiography with RANTES values in the lowest third (i.e., <19.49 ng/mL) [19]. In a study by Erbel et al., CXCL4 concentrations did not differ among patients with coronary artery disease and healthy controls [23]. Numerous studies have indicated that increased RANTES levels are associated with larger atherosclerotic lesions [28,29,30]. Moreover, in the Viriani study, an increased RANTES level was correlated with an increase in the total lipid-rich core volume but only in patients who did not use statins [29]. In a study by Versteylen et al., a higher level of RANTES predicted the presence of coronary stenosis of ≥50% assessed by coronary angiography [28].",f9f4376b-4920-4803-bebc-936489614d35
22,methods17," Different results were obtained in the study by Podolec et al., which showed that the RANTES concentration was higher in subjects with less advanced atherosclerotic lesions (<50%) [31]. Such discrepancies may stem from differences in the study populations, methods of chemokine determination and assessment of atherosclerotic lesions. Additionally, Koper-Lenkiewicz et al. point to numerous factors that may affect the RANTES concentration, such as age, sex, platelet activation and race. They also hypothesise that serum RANTES levels are biomarkers of atheromatous lesion presence rather than markers of its severity [32]. Nevertheless, none of the previous studies focused on serial observation of chemokines over time, which is a novelty of our investigation.  We observed a significant decrease in the CXCL4 level in the dietary approaches to stop hypertension (DASH) group by as much as 32% in the last 6 months of the observation (to 8.36 ng/mL).",d9ce6764-cac5-49fc-9971-3f968138321d
23,methods18," This seems to be a positive effect, considering the fact that in other studies, the CXCL4 level was in the range of 4.3 ng/mL to 8.7 ng/mL in healthy subjects and 5.8 ng/mL to 16.0 ng/mL in patients with coronary artery disease (CAD) [22,33]. Contrarily, in the control group, there was a significant increase in the CXCL4 level by 18.8% in the last 6 months of the observation. As reported previously, the increase in the CXCL4 level in the first half of the study in the control group was only insignificant [34].  As for RANTES levels, we did not observe significant changes in any group, but the interchanges difference reached statistical significance (p = 0.03), which is worth noting. Baseline RANTES levels showed a significant inverse correlation with homocysteine and a positive correlation with the CXCL4 level. Moreover, changes in the RANTES concentration correlated with changes in the CXCL4 concentration, and changes in the RANTES/CXCL4 ratio strikingly differed in both groups.",e595cb93-4599-416b-83de-b29392860b2b
24,methods19," As previously mentioned, platelet CXCL4 forms heteromers with RANTES, which results in increased adhesion of monocytes to endothelial cells, while disturbing this interaction inhibits the formation of atherosclerotic plaques in hyperlipidaemic mice [35]. It seems, therefore, that a significant change in the ratio of both chemokines in the dietary approaches to stop hypertension (DASH) group may have a beneficial effect with respect to atherosclerosis progression and destabilisation. This is also confirmed by our analysis of computed tomography angiography (CTA) results, in which a decrease in the vulnerable plaque component volume was twofold greater in the dietary approaches to stop hypertension (DASH) group than in the control group [36].",8dadfa29-568a-4eaf-b5f4-1e68b14850a2
25,methods20,"  More pronounced differences between the analysed groups observed for CXCL4 compared with RANTES may result from the fact that according to the current state of knowledge, statins modify RANTES concentrations but have no significant effect on CXCL4 levels [37,38], and in the present study, most patients were treated with statins (32 subjects in each group). CXCL4 might have been less prone to the impact of concomitant medication, as the only drug relevantly affecting its levels is warfarin (used by only one patient in the control group); acethylsalycic acid, commonly used in both groups, is not considered a confounding factor [39].  The study of the relationship between changes in the RANTES concentration and dietary approaches to stop hypertension (DASH) diet elements revealed only a correlation with the consumption of whole grains in the dietary approaches to stop hypertension (DASH) group. The mechanism of this action is not known.",6eb48c28-f3fc-4be0-995b-ef0c728f3134
