,chunk_label,chunk_text,uuid
26,methods21," It is suspected that it may stem from the increased intake of magnesium, which is abundant in whole-grain products. An inverse correlation between dietary Mg intake and biomarkers of systemic inflammation, including hsCRP, interleukin-6 (IL-6) and tumor necrosis factor α (TNF-α), has been repeatedly confirmed both in cross-sectional and in prospective cohort studies on various populations [40]. This activity may also be attributed to high contents of dietary fibre, which may reduce the inflammatory process by slowing down the absorption of glucose, changing the intestinal microflora and stimulating the production of short-chain fatty acids [8].  A change in the CXCL4 level was significantly correlated with other components of the dietary approaches to stop hypertension (DASH) diet, rather than with the RANTES level, i.e., with a change in vegetable consumption.",24e0fd27-b1e0-4a74-92ce-687d046f212e
27,methods22," The correlation of the change in the RANTES/CXCL4 ratio was significant for the consumption of vegetables, fruits and whole grains. Fruits and vegetables, aside to their dietary fibre content, may also reveal anti-inflammatory properties, thanks to specific antioxidant compounds [41,42]. However, there have been no literature reports on studies concerning the effects of consumption of particular nutrients on the levels of the analysed chemokines.  The change in the RANTES concentration in all the subjects was significantly correlated with a change in the total fat content, but it was not correlated with changes in hsCRP nor visceral fat. The analysis of specific groups revealed no significant correlation. It has been confirmed that RANTES is released by human subcutaneous adipose tissue in vivo, and RANTES concentrations in slim subjects (median 14.5 ng/mL) are lower than in obese subjects (median 29.4 ng/mL) and subjects with morbid obesity (median 57.",38bf2fb3-040e-411e-b8d5-e1a1d4dd64a0
28,methods23,"0 ng/mL), but their share in the total concentration of circulating RANTES produced by various types of adipose tissue deposits is not decisive. According to the authors, ex vivo secretion of RANTES was higher from fat collected from the visceral area (gastric bulb) than from subcutaneous tissue (p = 0.001) [43]. Numerous studies have confirmed that excessive deposit of visceral fat is related with an increased risk of coronary artery disease (CAD) [44]. One of the mechanisms of such action is probably the accumulation of leptin and the reduced number of its receptors, which leads to the production of proinflammatory cytokines (e.g., TNF-α and IL-1) and blocks the production of anti-inflammatory cytokines (e.g., IL-4) [45]. So far, there have been no detailed studies on the effect of a change in the visceral fat deposit on plasma RANTES concentrations.",db1adfb3-0a1f-480b-af5c-6d2fe5294114
29,methods24," Therefore, it is difficult to assess to what extent the declining trend observed in the dietary approaches to stop hypertension (DASH) group results from a decrease in the visceral fat deposit.  5. Conclusions  It may be concluded that a 12-month-long intensive dietary intervention based on the dietary approaches to stop hypertension (DASH) diet guidelines, as an addition to pharmacotherapy causes, changes the levels of chemokines CXCL4 and RANTES and their mutual relationship in comparison to patients receiving conventional treatment. To confirm these results and for a more detailed explanation of the mechanism, it is necessary to conduct further studies on larger groups with controlled physical activity.  6. Study Limitations  Patients treated with statins were not excluded from the study, since this pharmacotherapy is standard coronary artery disease (CAD) treatment.",cb4f7536-a53e-4e50-8232-2e0681e5ac1f
30,methods25,"  The study was not conducted as a cross-over study due to the long follow-up aiming to create a permanent change in patients’ lifestyle habits.  The intervention related to physical activity was not fully objectified in this study. All the patients were given the same instructions, but our analysis was based on the patients’ declarations provided during the interview concerning compliance with the instructions.  Since it was a pilot study, the sample size was quite small. ",db5e7316-70ec-4369-8054-1964cd722896
