,chunk_label,chunk_text,uuid
0,introduction0," Impaired mental health comprises a wide range of conditions that affect the quality of life (QoL) and associate with an increased mortality rate in recent years. Considering the economic costs and the great burden they impose to the health system and individuals, prevention strategies for these conditions should be of significant importance [1].  In addition to genetic and environmental factors, diet has been suggested to play an important role in the development, and treatment of some psychological disorders. For instance, it has been reported that a diet rich in fish, folate and B-vitamins can alleviate the manifestations of depression. An established association was also shown between the dietary glycemic index (GI) and psychological diseases, depressive disorder, and mental functioning [2–4].",39484f64-faa4-4898-b926-6fa4fd791239
1,introduction1," Diets containing of “junk foods” (high energy and low nutritional) have been shown to increase the risk of mental illness, but a healthy diet is associated with less depressive symptoms and can improve mood [5, 6]. Nutritionists are now emphasizing the importance of assessing dietary patterns, rather than single nutrients or foods, to better understand diet-related disease correlations.  The Dietary Approaches to Stop Hypertension (dietary approaches to stop hypertension (DASH)) diet which was developed to reduce blood pressure, is characterized by high consumption of whole seeds, fruits, vegetables, leguminous plants and nuts, and only small amounts of low fat dairy, red meat, desserts, sweet and sugar-containing beverages [7]. Several studies have reported that a dietary approaches to stop hypertension (DASH) diet has beneficial effects on different medical conditions, that include cardiovascular and renal disease [2, 3].",3d77caa1-e60c-47f7-a7c2-9acb4b4c6df6
2,introduction2," However, the existing data on the impact of the dietary approaches to stop hypertension (DASH) dietary pattern on mental distress is still limited. In two previous studies, adherence to the dietary approaches to stop hypertension (DASH) dietary pattern was reported to be inversely related to depression score [6, 8]. Furthermore, Torres et al. reported that a dietary approaches to stop hypertension (DASH)-type diet could improve mood in postmenopausal women [9].  There have been few studies regarding to the effects of the dietary approaches to stop hypertension (DASH) diet on mental health, particularly in young women, who are reported to be more prone to mental disorders such as depression and anxiety. We have therefore undertaken the current study to evaluate the relationship between adherence to a dietary approaches to stop hypertension (DASH) diet and neuro-psychological function in healthy young women.",c71064dc-8518-47fe-bddc-6a3cec16234b
3,introduction3,"  Methods and materials  Study design  In this cross-sectional study, 181 women were enrolled from 5 different universities in Birjand, South Khorasan, Iran in January 2020. The sample size was calculated to achieve 80% power and α′ = 0.05 (z value of 1.96) using data from a previous investigation (r = 0.24 for correlation between dietary approaches to stop hypertension (DASH) score and depression) [10]. According to these assumptions a minimum of 140 participants was needed. Since we wanted to perform our project on a homogeneous population, to control for potential confounding factors, only unmarried, apparently healthy women, aged between 18 to 25 years were recruited. We excluded women with any established acute or chronic disease or those who were smokers. The Ethics Committee of Birjand University of Medical Sciences approved the study. All participants provided written informed consent.",22de672f-19a5-4cb2-942f-e5078691964f
4,introduction4,"  Dietary assessment  We used a validated semi-quantitative food frequency questionnaire (food frequency questionnaire (FFQ)) to assess the food intake of subjects over the previous year [11, 12]. An experienced dietitian asked participants to describe their food consumption frequency for each item during the previous year on a daily, weekly, monthly, rarely or never basis. Food analysis was done using Diet Plan 6 software (forest field Software Ltd., Horsham West Sussex, UK). The dietary approaches to stop hypertension (DASH) dietary pattern score was determined according to the method of Fung et al. [13]. The dietary approaches to stop hypertension (DASH) score was calculated based on 8 food components such as: high intake of vegetables, fruits, legumes and nuts, whole grains and low intake of sodium, low-fat dairy products, red and processed meats, and sweetened beverages.",464cf771-eea0-470d-9573-40817d699907
5,introduction5," For the composition of dietary approaches to stop hypertension (DASH) score, values of 1 or 5 were assigned to each nutritional component using the quintiles as cut-off values. For vegetables, fruits, legumes and nuts, whole grains and low-fat dairy products the lowest quintile was scored 1 point and the highest quintile was scored 5 points. For red and processed meats, salt and sweetened beverages the scoring was inverted. Finally, the score of each group was integrated between a value of 8 (minimal adherence) to 40 (maximal adherence).  General and clinical characteristics  Demographic and anthropometric data including age, parent death/divorce, height, and weight were collected in all participants using standardized protocols. Body mass index (Body mass index (BMI)) was computed as weight in kilograms divided with height in meters squared [8].",a0e5509b-6631-400e-99df-74a0e52fea45
6,introduction6,"  Neuropsychological analysis  Cognitive ability assessment (Cognitive ability assessment (CAA))  The Cognitive Abilities Questionnaire (Cognitive Abilities Questionnaire (CAQ)) is a valid and reliable tool which estimates 7 distinctive functions including: memory, inhibitory control and selective attention, decision making, planning, sustained attention, social cognition and cognitive flexibility [14]. This instrument is composed of 30 items, each that is rated on a scale of 1–5, to yield a total score ranging from 30 to 150. Higher scores reflect better cognitive performance [15]. A score below the median cut off for the cognitive abilities score was considered o be cognitive impairment.  Depression anxiety stress scales (Depression anxiety stress scales (DASS))  Depression, Anxiety and Stress Scale (Depression anxiety stress scales (DASS)-21) is a valid and accurate tool to measure negative well-beings status [16].",66d57ec1-677c-45f2-a666-b8eab72b66aa
7,introduction7," This questionnaire consists of 21 items with 3 subscales (each consist of 7 questions) in which each item is rated on a 4-point Likert scale (0–3) to determine the severity of depression, anxiety and stress. Because DAS-21 is the brief version of DAS-42; the total score of each sub-class must be doubled. A higher score indicates more severe negative emotion. The validity and reliability of the Depression anxiety stress scales (DASS)-21 has previously been validated for Iranian population [17]. Depression, anxiety, and stress scores were divided into two categories (No/Minimal state and some degree of disorder) according to the scores obtained for each subscale as follows: No (≤9) or some degree of depression (> 9); No (≤7) or some degree of anxiety (> 7); and No (≤14) or some degree of stress (> 14).  Quality of life (QoL)  The Short Form health survey (SF-12) derivative from the SF-36 is a widely reliable tool for measuring of physical and mental components of QoL.",157894ae-0a3c-420d-a55a-6e573b56e07f
8,introduction8," Validity and reliability from this tool has been established in Iranian population [18]. The SF-12 consists of 12 questions, covering 8 health domains, and higher scores show a better health dependent QoL [19]. A score below the median cut off for the QoL score was considered to be a low QoL.  Insomnia severity index (Insomnia severity index (ISI))  The Insomnia Severity Index (Insomnia severity index (ISI)) is a brief self-report instrument which quantitatively measures severity of insomnia based on patient’s own perception. The questionnaire contains 7 question related to sleep disorder intensity, satisfaction with present sleep pattern, and anxiety-associated sleeping disturbance. Each item is rated on a zero to 4 measure (0 = no problem; 4 = many problem) to provide a total score ranging 0–28. Higher point indicates more degree of insomnia. Based on acquiring scores, individuals were categorized as: no clinically significant insomnia (0–7), mild to severe degree of insomnia (8–28).",81214868-283e-4734-a9ca-9781995ea39e
9,introduction9," The Persian version of this tool with good reliability and validity for Iranian population was used in current study [20, 21].  Epworth sleepiness scale (Epworth sleepiness scale (ESS))  The Epworth sleepiness Scale (Epworth sleepiness scale (ESS)) is an approved and validated simple method for measuring the general level of daytime sleepiness. The Epworth sleepiness scale (ESS) is a brief, self-administered questionnaire estimates the probability of falling asleep in a variety of situations. Epworth sleepiness scale (ESS) scores give a helpful measure of average sleep tendency, comparable to the results of all-day tests [22]. It consists of eight items with 4-point Likert scale (0–3) that requires the subject to estimate on a scale of 0–3 the frequency they have dozed in common daily situations. The sum of scores can range from 0 to 24 and higher scores specify worsen sleepiness [23, 24].",69588fd3-68d1-4ac3-befc-d75e254c2eb8
10,introduction10," The severity of sleepiness was defined as: normal (score ≤ 10), mild to severe degree (score > 10).  Short sleep duration and difficult sleep initiating  Sleep signs were evaluated based on 2 asks, reporting to sleep during the past month: (1) “Do you have difficulty falling asleep at night?” (2) “How many times have you woken up early and, have trouble getting back to sleep?”. Short sleep duration was determined if a subject slept for fewer than 5 h/day, once or more a week [25]. Difficulty in sleep initiation was assessed as having problems falling asleep within half an hour once or more times per week [26]. ",240cf2a7-55df-43e9-938b-26e1e626a960
11,background0, The adherence to a Dietary Approaches to Stop Hypertension (dietary approaches to stop hypertension (DASH)) diet may have a bidirectional relationship with mental wellbeing. We aimed to evaluate the association between compliance with a dietary approaches to stop hypertension (DASH) diet and neuro-psychological function in young women. ,5c864634-3702-4806-b8ac-6b6eb64bb5f9
12,methods0," In this cross-sectional study, a total of 181 girls aged between 18 and 25 years were recruited. The dietary intakes of study participants were evaluated using a valid and reliable food frequency questionnaire (food frequency questionnaire (FFQ)) containing 65 food items. Neuropsychological function of participants was evaluated using standard questionnaires. ",45aab94f-0dc8-4ae3-b5fd-4b0e0dc033fe
13,analysis0," All statistical analyses were conducted by using SPSS, version 16 software packages. Data were evaluated for normality by applying the Kolmogorov-Smirnov test. One-way a p value from analysis of the variance (ANOVA) test was used for comparison of continues variables with normal distribution across tertiles of dietary approaches to stop hypertension (DASH)-style diet score. Depression, anxiety, stress, insomnia and sleepiness scores were divided into two categories (No/Minimal state and some degree of disorder) regarding to scores. Acquiring a score below median cut of QoL score was considered as low QoL. The correlation between component of the dietary approaches to stop hypertension (DASH) diet score and neuro-psychological test scores was evaluated using Pearson correlation analysis.",27e5ad09-d869-4f3c-9c53-de32bcfd8a92
14,analysis1," Multinomial logistic regression was used to evaluate the association between adherence to dietary approaches to stop hypertension (DASH) diet and neuropsychological difficulties and we adjusted all variables for age, Body mass index (BMI) and energy intake. A P-value < 0.05 was set as being significant. ",3100ed2e-0c8d-4f40-96a0-9cb0873a682d
15,results0," Demographic, anthropometric and clinical characteristics of the participants according to the dietary approaches to stop hypertension (DASH) dietary pattern score tertiles  The mean age of the participants was 20.7 ± 2.2 years. The dietary approaches to stop hypertension (DASH) diet scores were used to categorized the subjects into tertiles, with T1 being defined as the lowest tertile (least adherence; range: 12–22; n = 56), T2 (n = 63; range: 22–26), and T3 as highest tertile (highest adherence; range: 22–33; n = 62). There was no significant correlation among the demographic and anthropometric variables among the participants (P > 0.05; Table 1). But significant differences were found in Body mass index (BMI) for participants in the 1st tertile compared to 3th tertile of adherence to the dietary approaches to stop hypertension (DASH) dietary (P < 0.05).",8461f65f-2fb4-4fcd-8383-346e6af39642
16,results2,60	 Abbreviations: Body mass index (Body mass index (BMI))  Data presented as Mean ± SD  a p-value from analysis of the variance (a p value from analysis of the variance (ANOVA)) for groups comparison  Dietary intakes of participants in different tertiles of the adherence to the dietary approaches to stop hypertension (DASH) dietary pattern scores  The comparison between the mean of dietary intakes of participants in different tertiles of the adherence to the dietary approaches to stop hypertension (DASH) dietary pattern scores are shown in Table 2.,4c9385c5-6093-4186-a57a-b62618cd20c2
17,results3," The intake of folate, fiber, fruits, magnesium, potassium, vegetables, nuts, legume, whole grain, seed and low fat dairy were higher among individuals in the highest tertile of adherence to dietary approaches to stop hypertension (DASH) diet than others in the lowest tertile and the value of sweetened beverage and sodium were higher among subjects in the first tertile of adherence to dietary approaches to stop hypertension (DASH) diet compared to the participants in the third tertile. Table 2 Dietary intakes of participants in different tertiles of the adherence to the dietary approaches to stop hypertension (DASH) dietary pattern scores  Variables	dietary approaches to stop hypertension (DASH) diet adherence	 T1	T2	T3	P value	 dietary approaches to stop hypertension (DASH) score, Median (IQR)	20 (17–21)	24 (23–24)	28 (27–29)	–	 Dietary nutrient intake	  Total energy (kcal)	2170 ± 840	2166 ± 658	2177 ± 816	0.99	  Carbohydrate (g/1000Kcal)	64.8 ± 39.5	57.5 ± 28.1	63.6 ± 31.2	0.",9985a5ff-a062-4878-8cf7-1ee43ec83967
18,results5,"44	  Sweetened beverage (serving)	1.1 ± 1.4	0.6 ± 0.7	0.4 ± 0.9	0.004	  Sodium (mg/1000Kcal)	1727 ± 640	1512 ± 900.9	1272 ± 812	0.018	 Data presented as Mean ± SD  †obtained from a p value from analysis of the variance (ANOVA) test  Correlation coefficient between neuropsychological tests and components of dietary approaches to stop hypertension (DASH) score  The score range obtained was from 0 to 39 for depression, 0–30 for anxiety, 0–42 for stress, 0–28 for insomnia, 0–19 for daytime sleepiness, for cognitive abilities, 19–44 for QoL as well as 4–11 h for sleep duration. There was a significant negative correlation between total cognitive abilities score with red and processed meat (r = − 0.168; P < 0.05), QoL score with sodium (r = − 0.151; P < 0.01) and depression score with vegetables (r = − 0.174; P < 0.05). There was a significant positive correlation among QoL by nuts, legume, seed (r = 0.183; P < 0.05), insomnia with sweetened beverage consumption (r = 0.205; P < 0.",65b70e4d-6c83-4ebb-9839-17c2cffc4699
19,results7,"001  Multivariate adjusted odds ratios (95% CIs) for neuropsychological disorders across tertiles of dietary approaches to stop hypertension (DASH)-style diet scores  In multivariate multinomial logistic regression analyses adjusted for age, Body mass index (BMI) and energy intake, adherence to dietary approaches to stop hypertension (DASH) style-pattern was associated with a lower stress score (OR = 0.32; 95%CI: 0.14–0.71, p = 0.009; 2sttertile with 1stdietary approaches to stop hypertension (DASH) tertile) and less difficulty in initiating sleep (OR = 0.46; 95%CI: 0.21–1.00, p = 0.017; third tertile versus first dietary approaches to stop hypertension (DASH) tertile) (Table 4). Table 4 Multivariate adjusted odds ratios (95% CIs) for neuropsychological disorders across tertiles of dietary approaches to stop hypertension (DASH)-style diet scores  Variables	Tertiles of dietary approaches to stop hypertension (DASH) score	 T1 (n = 56)	T2 (n = 63)	T3 (n = 62)	 Cognitive impairments	Ref.	1.",bb09c7bb-0bc4-4252-b775-2a227e5a1178
20,discussion0," In the present study, we have shown that a high adherence to a dietary approaches to stop hypertension (DASH) dietary pattern, characterized by high consumption of fruits and vegetable, as well as low intake of red and processed meat, sugar-containing beverages and sweets, is associated with lower odds of stress and sleep disturbance in young women.  Although the relationship between dietary patterns and mental health is unclear, it is possible that psychological stress and eating habits are related. Cartwright et al. showed that children who eat fatty foods and snacks frequently, and consume low amounts of fruits and vegetables, had greater levels of stress [27]. Excessive stress can affect the QoL and a previous study reported an inverse association between stress score and QoL among university students, those who face an increased risk of mental conditions due to different stressors [28].  Improvements in diet and lifestyle may have beneficial impacts on depression symptoms.",f4b33686-d3a4-4ab6-a668-4a9a1a3da5c7
21,discussion1," We found that depression score was negatively associated with vegetables intake and this is in line with the findings of previous studies [29, 30]. A meta-analysis of eighteen studies with 446,551 participants has indicated that fruit and vegetable consumption is inversely associated with the risk of depression [29]. Additionally, a prospective cohort study reported that frequent use of vegetables can play a protective role against depression in the elderly [30].  The mechanisms by which vegetables, or ‘healthy dietary patterns, decrease the risk of depression is not completely clear [30], but some nutrients including B group vitamins, n-3 fatty acids and antioxidant have been thought to be related with depressive behavior [31]. Oxidative stress and inflammation can both increase depressive symptoms by their effects on neurons of the autonomic nervous systems.",db41d448-5702-4723-96ff-f7998d6706a1
22,discussion2," Folate and B group vitamins, with their beneficial effects on inflammation and oxidative stress, are necessary for neuronal function and their deficiency is associated with depression, anxiety and dementia [32]. Non-nutrient phytochemicals with antioxidant activities found in vegetables could be another probable mechanism for this improvement [30].  Nuts are a part of the human diet and are considered to be health-promoting nutrients. Our result showed that the consumption of nuts, legumes and seeds is associated with a higher QoL. These nutrient-rich foods contain substantial amounts of polyphenol antioxidants, macro- and micro-nutrients and other beneficial bioactive compounds which it’s intake decrease oxidative stress and inflammation, so can prevent several human disorders and increase the QoL [33].  We found an inverse relationship between sodium intake and QoL.",644ca2dc-be2f-411b-b5c2-7a11715de8d7
23,discussion3," Previous studies reported that excessive salt intake not only can lead to hypertension, but also plays an important role in endothelial dysfunction and cardiovascular and kidney disease progress as well as reduce life expectancy [34, 35]. Therefore, a diet containing low amounts of salt may be considered a potential strategy to control hypertension, decreases cardiovascular morbidity and improve the QoL.  We found a positive relationship between dietary whole grain intake and sleep duration which is consistent with the study of Grandner et al, who showed that short sleepers report higher intakes of protein and carbohydrate, but low dietary fiber consumption; altered sleep duration is probably associated with changes in the secretion of appetite-related hormones [36].  Diet plays an important role in cognitive function, especially in childhood and the growth period, due to providing the components for nerve formation and brain development [37].",94afa630-66f8-44d7-9f21-624dd51f3d02
24,discussion4," In the current study, we have found an inverse relationship between cognitive abilities score and red/processed meat consumption. Consistently, it has been show that Western dietary pattern, characterized by high intake of processed foods, sweet and red meat, has been found to be associated with greater levels of mental distress in adolescents [38]. Additionally, a cross-sectional study conducted on the adult population in UK demonstrated that higher consumption of red meat is related to weaker cognitive functions such as reasoning ability and short-term memory [39].  Due to the importance of sleep on QoL and its impact on psychological wellbeing, it is essential to identify the main factors that may effect this cycle. Eating habits modification is a potential approach to prevent sleep complications. Rostami and co-researchers demonstrated that greater commitment to a dietary approaches to stop hypertension (DASH) diet is associated with lower prevalence of insomnia [40].",2b3101af-989f-4b3a-9bbf-735ed6c69c7a
25,discussion5," Results of the present study indicated that sweetened beverage intake was associated with grater odds of insomnia. Caffeine, as an important active component of sweetened beverages, has been showed to be inversely associated with sleep duration and may disturb sleep, leading to difficulty falling asleep, insomnia, day time sleeplessness [41].  Indeed, one of the most significant findings of the current study was that adherence to a dietary approaches to stop hypertension (DASH)-type diet decreased the likelihood of difficulty in initiating sleep. High intake of sweets can increase the glycemic response and induce oxidative stress. Long-term sugar intake has been showed to negatively affect brain serotonin 5-hydroxytryptophan receptor sensitivity in laboratory animal models [42, 43]. In another study, adherence to higher fat/lower carbohydrate diet was associated with a reduction in serotonin release in the hypothalamus of Wistar rats [44].",d05551aa-d16f-4d4c-ba9b-01eed6c01a1c
26,discussion6," There is a high likelihood that the consumption of vitamins, minerals and fibers may improve sleep quality. Tryptophan is an essential precursor to serotonin syntheses, a neurotransmitter known for controlling the sleep cycle and inducing feeling of sleepiness. Group B vitamins are also required for serotonin synthesis. Therefore, a balanced and diverse diet that can provide fruits, vegetables and whole grains, like dietary approaches to stop hypertension (DASH), can improve sleep [45].  We showed that individuals with a greater adherence to a dietary approaches to stop hypertension (DASH)-style diet had a higher intake of potassium, magnesium, and fiber. Because of the content of green leafy vegetables, nuts, seeds, legumes and whole grains, the dietary approaches to stop hypertension (DASH) has a high amount of magnesium. Also, fruits and vegetables in the dietary approaches to stop hypertension (DASH) diet provide a high content of potassium and fiber.",9197bd69-0dcc-4ddd-8700-43548dacb1e1
27,discussion7," Dietary fiber has low energy because it is resistant to breakdown by gastrointestinal enzymes, and fiber-containing foods i.e. whole grains, vegetables and fruit have a low energy density [46]. On the other hand, as is consistent with our results, Davison et al. reported that higher levels of energy (Kcal), fiber, B vitamins, calcium, phosphorus, potassium, and magnesium intakes were associated with better mental health [47].  To the best of our knowledge, this is the first study examining the correlation between adherence to dietary approaches to stop hypertension (DASH) diet and neuropsychological functions in young women. But, the present study has a number of limitations. First, we used a cross-sectional design that cannot demonstrate causality. Difficult sleep initiating was evaluated using self-reported questionnaires which may be predisposed to bias. Moreover, a food frequency questionnaire (FFQ) is an unreliable tool for assessing the sodium intake.",5a1a12e7-bde3-4b23-b9de-6ae20ef5fee3
28,discussion8," Finally, we did not evaluate physical activity in our population.  Conclusion  We found a significant relationship between adherence to a dietary approaches to stop hypertension (DASH) diet and lower stress scores and difficult sleep initiating among young women. It seems that following a healthy diet pattern can decrease mental distress, and enhance quality of sleep. Further longitudinal studies are necessary to confirm these results with larger population.  Abbreviations  dietary approaches to",ff546611-1352-43bd-9e17-c14a72550079
