,chunk_label,chunk_text,uuid
0,introduction0,"The mechanisms by which a successful aging occurs in humans, i.e. aging in good psychophysical conditions [1], are immunologically characterized by preserved lymphoproliferative responses and Natural Killer (NK) cell cytotoxicity as well as conserved antigen presentation (reviewed in [2,3]). BELFAST nonagenarians show evidence of a competent immune system, programmed with increase in the number and/or the proportion of NK cells to scan presumably for virus-infected, stressed and malignant cells [4]. In others studies, an increase in NK cells showing a mature phenotype was found in healthy elderly donors who had an NK cytotoxic capacity of total peripheral blood lymphocytes preserved [5,6]. Such preservation in healthy elderly may be due to a high number of NK cells in order to compensate low NK cell cytotoxicity and cytokine and chemokine production [7].  The decline in immune function with age is unanimously recognized and supported by epidemiologic and clinical studies [8].",ccc1880f-4bbf-4dd3-8f05-5cee8772f1a1
1,introduction1," We have reported that several metabolic and nutritional factors, including insulin, retinoic acid or carotenoids affect the immune response in function of age in healthy volunteers [9-13]. However, the development of age-related changes in health status in elderly men have led to conflicting results and these discrepancies may be partially ascribed to the population tested, i.e. presence of concomitant pathologic disorders or nutritional deficiencies that may affect the immune status (reviewed in [14-17]). To overcome this problem, volunteers in the present study were recruited according to the SENIEUR protocol, which used strict clinical and biological inclusion criteria (i.e. good nutritional status, absence of disease, no sign of inflammation or infection, no drug delivery) as well as rigorous exclusion criteria with detailed measurement of the immune markers [18].",b01d941a-b4d8-42af-9a8c-56628d98dcb3
2,introduction2,"  In Europe, the prevalence and the geographical variation of symptoms associated with a putative “aging syndrome” have never been documented. A recent multi-centre study was designed from male volunteers to specify age-related changes in hormone levels, socioeconomic and lifestyle factors that exist across Europe [19]. However, the effects of aging on biomarkers of immune status, measured at baseline in healthy individuals from different European countries, have never been reported. The geographical comparisons are of particular interest, since in addition to the immunological status, various potential predisposing risk factors such as the dietary, lifestyle habits, genetic and socioeconomic factors are different from a country to another [20,21].",d7cdbe51-1a74-4376-b101-4bf59a871bf4
3,introduction3,"  The aim of the present work was to provide descriptive information on the biomarkers of immune status in 300 healthy volunteers aged between 20–75 years recruited in Austria, Spain and France and having participated in our previous EU-funded studies [22-25]. The number of about 100 subjects in each country has been chosen on the basis of the results of power calculations for those biomarkers with known distribution in humans, and assuming to detect biologically significant differences in each case. The decision to limit this project only to male subjects has been based on the observation that changes in hormonal status that occur in women, both within and between subjects of this wide age range, may affect the immune status [26].  Our preliminary and primarily descriptive analyses showed that there are moderate differences in the immune status of middle-aged to older inhabitants of the three European centres.",33cdc8e8-90f3-4260-9ade-e3e1e24821ac
4,introduction4," Moreover, blood leukocyte phenotypes, especially NK and CD8 cell distribution, were markedly increased in elderly volunteers from the Spanish centre, thus suggesting a specific immune pattern possibly in link with environmental factors such as the Mediterranean diet and the lifestyle. ",9a85f644-e000-4151-8fe1-9863f5948995
5,methods0,"Subjects and experimental procedure Three-hundred healthy male non-smoking subjects, aged 20–75 years (stratified by age), were recruited in Clermont-Ferrand, France (n = 99), Graz, Austria (n = 101), and Reus, Spain (n = 100), as part of the European Commission-funded Research and Technology Development (Research and Technology Development (RTD)) project of the 5th Framework Program, specific Research and Technology Development (RTD) Program “Quality of Life and Management of Living Resources”, Key Action#1, “Food, Nutrition, and Health”, entitled “Vitamin A, Vitamin E, and Carotenoid Status and Metabolism during Ageing: Functional and Nutritional Consequences”, acronym VITAGE (Contract QLK1-CT-1999-00830) [22,23]. The study protocol was approved by the local Ethics Committee of the three recruiting centres and was performed in accordance with the ethical standards of the Declaration of Helsinki.",12671470-376c-4dfb-a332-30c26887c745
6,methods1," A written informed consent was obtained from all participants prior to their inclusion in the study. After informative sessions, a trained medical doctor conducted a personal interview to obtain information on anthropometric measurements, personal history, lifestyle, use of medications, physical activity, smoking habits, and use of dietary supplements containing vitamins or trace elements. Exclusion criteria were familial hypercholesterolemia, chronic diseases (including diabetes, cancer, cardiac insufficiency, neurological diseases, inflammatory diseases and chronic diseases of the liver, lung, or thyroid, non stable hypertension, dementia, and infectious diseases known to affect the immune system, such as human immunodeficiency virus and hepatitis C), vaccination during the past 2 months, alcoholism or drug addiction, competitive sport activities, and the consumption of special diets or dietary supplements in the past 3 months.",510a5937-9e50-4cf1-9f28-acb89cf09c80
7,methods2," All volunteers from a given centre had the usual diet of their respective country, which is the diet of the general population. Venous blood samples were collected from subjects in the fasting state for serum and leukocyte isolation and storage until analysis. The SENIEUR protocol standardized the selection of the volunteers for immunological studies [18].  The mean age ± SEM of the volunteers from France, Austria and Spain was 46.8 ± 1.5 y, 45.6 ± 1.5 y and 46.3 ± 1.6 y, respectively (no significant difference). In each country, the volunteers were classified in six different age groups: 20–29 y (n = 59), 30–39 y (n = 55), 40–49 y (n = 59), 50–59 y (n = 51), 60–69 y (n = 56) and 70–75 y (n = 20). This approach allowed us either to directly compare two age groups or to describe the evolution of the study variables as a function of age.",f2f161a9-b8b7-47c0-b92e-33df8fa307cf
8,methods3,"  Determination of systemic biomarkers of immune status Serum immunoglobulin (IgG, IgA, IgM) and complement fraction (C3, C4) concentrations were quantified by immunonephelemetry (Array protein system, Beckman-Coulter, Villepinte, France), using human antibodies (Beckman-Coulter). Values are expressed in g/l.  Serum soluble interleukin 2 receptor (sIL-2R) concentration (pmole/l) was assayed by ELISA (Immunotech kit, Beckman-Coulter).  Determination of delayed-type hypersensitivity skin test response To determine delayed type hypersensitivity (DTH) skin response, we used the Multitest CMI® skin applicator (Pasteur-BioMérieux, Lyon, France) against seven antigens (Tetanus, Diphteria, Streptococcus (C group), Tuberculin, Candida Albicans, Trichophyton, Proteus Mirabilis) and a glycerin negative control. Multitest® was applied on healthy arm skin for at least 5 seconds.",04a36040-9911-4e53-97fc-cb48bc881109
9,methods4," The skin tests were read at 48 h after application by measuring for each antigen the induration response (mean of two perpendicular diameters) using a gradual scale. Induration ≥2 mm was recorded as positive response and corrected by substracting the negative control, if any [60]. The cumulative score was calculated as the sum of all antigen indurations. This score was considered as “hypoergic” (<10 mm with at least one positive response ≥2 mm) or “anergic” (no response greater than 2 mm) or “normal” (≥10 mm with at least one positive response ≥2mm) according to Kniker et al. [29].  Determination of blood leukocyte phenotype In each recruitment centre, blood leukocytes were isolated using Ficoll density gradient (Histopaque®1077 and 1119, Sigma-Aldrich) and then cryopreserved [61]. Briefly, cells were progressively frozen in a Cryo-Med liquid nitrogen freezer and conserved at -196°C during at most 6 months. Such cryopreservation did not affect the cell surface markers [62].",590b1327-2df1-45b6-904a-43b1a1a9b0c7
10,methods5," All analyses were done in the same laboratory: lymphocyte subpopulations were measured, as previously described [13], using flow cytometry with an Epics XL (Beckman-Coulter) after labelling with fluorochrome-conjugated monoclonal antibodies (Beckman-Coulter) : CD3-PC5, CD4-RD1, CD8-ECD, CD45RA-FITC, CD45RO-FITC, CD19-ECD, CD56-PE (Beckman-Coulter) corresponding to total T cells (CD3+), T helper/inducer (CD4+), T suppressor/cytotoxic (CD8+), B lymphocytes (CD19+) and NK cells (CD56+), respectively. Results were expressed in percentages of total leukocyte populations. PMN CD expression was determined by flow cytometry using anti-CD11b-FITC and anti-CD18-FITC (Beckman-Coulter) and reported in percentage of total PMN population. Appropriate controls i.e. conjugated isotypes and compensation settings in case of multiple labellings were done and intra- and inter-assays were recorded as previously reported [13].  Statistics All statistical analyses were run on Statview SAS, version 5.",ed9a2c34-5b54-44e7-a074-2b2211e6eae4
11,methods6," The experimental design comprised two cross-fixed factors with the factor “aging” as six groups and the factor “country” as three groups. This design allowed statistical analysis by two-way measures analysis of variance (analysis by two way measures analysis of variance (ANOVA)) in order to discriminate between the age effects and the country-related effects. The level of significance was set at p ≤ 0.05 for this test. When the analysis by two way measures analysis of variance (ANOVA) indicated significant interactions, the Newman-Keüls post-hoc test was used to identify differences between individual means. When no significant interaction was found, the marginal means were calculated and compared with a one way analysis by two way measures analysis of variance (ANOVA) followed by a Newman-Keüls test. Results are expressed as means ± SEM and various superscript letters (a, b, c, d, e) are significantly different (p < 0.05).",fa6e3dc2-62bb-4ae4-8421-184ff90ea2fc
12,methods7," To assess the correlations between baseline immune parameters and age, Spearman’s rank correlation tests was used for dependent groups and the Kruskal–Wallis test was performed for independent groups.  Competing interests The authors declare that they have no competing interests.  Authors’ contributions The authors’ responsibilities were as follows: M-PV, JR, BW-R and ER: coordination and design of the experiments; M-PV, M-CF, NG-M, JT, ER and AR: collection and analysis of data; M-PV: writing of the manuscript and provision of significant advice. All authors read and approved the final manuscript.  Acknowledgements The authors thank the volunteers who participated in the study. They are also greatly indebted to the clinical staff from the three European centres.",2d0a8642-f15a-4667-be01-bd21e492be01
13,methods8,"  Supports This study was carried out with financial support from the Commission of the European Communities, specific Research and Technology Development (RTD) program “Quality of Life and Management of Living Resources”, QLK1-CT-1999-00830, VITAGE. =",19fcd89f-cfac-45c1-9ed5-9b13a2b2b70a
14,results0,"Determination of systemic biomarkers of immune status The measurements of all immune biomarkers tested (IgG, IgA, IgM, C3, C4, sIL-2R) were in the usual physiological range observed in others European countries [27,28] and there was no biological difference from a country to another (Table 1). In France, Spain and Austria, individuals had IgA levels positively correlated with age (r2 = +0.2, p = 0.04). Accordingly, an age effect was found for IgA serum levels which were significantly higher in subjects aged 40 years old or more compared to younger individuals (Figure 1). Comparison between age groups showed no difference among the others serum immune biomarkers tested (IgG, IgM, C3, C4, sIL-2R, data not shown).  Table 1 Baseline immune parameters for the 3 populations   	France	Austria	Spain	Total	 (n = 99)	(n = 101)	(n = 100)	(n = 300)	 IgG (g/l)	11.1 ± 0.2	11.0 ± 0.2	11.1 ± 0.3	11.1 ± 0.1	 IgA (g/l)	2.60 ± 0.10	2.20 ± 0.10	2.72 ± 0.12	2.50 ± 0.06	 IgM (g/l)	1.20 ± 0.06	1.00 ± 0.04	1.",191d1746-f9e9-4a8c-99f4-733483191ab9
15,results1,"18 ± 0.07	1.10 ± 0.03	 C3 (g/l)	1.00 ± 0.02	1.00 ± 0.01	1.09 ± 0.02	1.00 ± 0.01	 C4 (g/l)	0.20 ± 0.01	0.20 ± 0.01	0.25 ± 0.01	0.20 ± 0.00	 sIL2-R (pmol/l)	38.3 ± 1.7	36.0 ± 2.1	39.3 ± 2.0	38.8 ± 1.4	 Means ± SEM.  Two-way analysis by two way measures analysis of variance (ANOVA) was performed to discriminate among the two factors age-group, country and their interactions. No interaction was obtained between the two factors and no effect was observed whatever the factor.  Figure 1 IgA serum levels in function of age of the volunteers from the 3 countries. Results are presented as means ± SEM. Two-way analysis by two way measures analysis of variance (ANOVA) was performed to discriminate among the two factors age-group, country and their interaction followed by a post-hoc Newman-Keuls test. A significant age group-related effect was observed independently of the country-related factor. Means sharing different superscript letters are significantly different: a≠b≠c, p < 0.05.",b9df504e-c4bb-447c-b74c-11bbe56a39eb
16,results2,"  Determination of delayed-type hypersensitivity Considering the delayed-type hypersensitivity (delayed type hypersensitivity (DTH)) responses, the cumulative score and the number of positive reactions were higher in Austria (22.7 ± 1.2 and 6.9 ± 0.1, respectively) than in France (17.7 ± 0.9 and 3.4 ± 0.2, respectively) and in Spain (7.1 ± 0.8 and 1.1 ± 0.1, respectively) (Table 2). For both Austria and France, the cumulative score was in the normal range while it was slightly hypoergic in Spain as defined by Knicker et al. [29]. In each of the three countries, the number of positive responses was more frequent for tetanus and tuberculin. In Spanish volunteers, a positive correlation was found between age and the cumulative score (p = 0.04). Accordingly, the cumulative score was significantly lower in the age group 20–29 y (2.6 ± 0.9) compared to the oldest age groups 40–49 y (8.7 ± 1.7), 50–59 y (8.3 ± 2.2) and 60–69 y (9.4 ± 2.3).",14325364-860b-4d1d-a01e-e4427fe002f8
17,results4,"  Two-way analysis by two way measures analysis of variance (ANOVA) was performed to discriminate among the two factors age-group, country and their interactions followed by a post-hoc Newman-Keuls test. A significant country-related effect was observed independently of the age-group: a≠b≠c, p < 0.0001.  Determination of lymphocyte phenotypes CD4 and CD8 T cell distribution The proportion (in %) of total lymphocytes was not different either between the three countries (Table 3) or between the age groups for each country (data not shown). However, the distribution of CD4 lymphocytes was significantly higher in Austria (44.0 ± 1.1) than in France (41.1 ± 0.7) or in Spain (36.7 ± 0.9) while the opposite was observed for CD8 lymphocytes whose percentage was higher in Spain (34.8 ± 1.1) than in France (29.7 ± 0.8) or in Austria (27.7 ± 0.7) (Table 3). These findings were markedly observed in volunteers aged 40 years old or more (Figure 2).",53e832f8-ac70-4c99-b0b2-ace8541da6aa
18,results6,"0001	 Means ± SEM.  Two-way analysis by two way measures analysis of variance (ANOVA) was performed to discriminate among the two factors age-group, country and their interaction followed by a post-hoc Newman-Keuls test. A significant country-related effect was observed independently of the age-group: a≠b≠c, p < 0.01, NS: not significant.  Figure 2 T lymphocyte distributions and ratio. CD4 (a) and CD8 (b) lymphocyte distributions and CD4/CD8 ratio (c). T lymphocyte distribution and CD4/CD8 ratio were compared for each age group between the three countries (A = Austria; F = France; S = Spain). Data are reported as means ± SEM, one way analysis by two way measures analysis of variance (ANOVA) followed by a Newman-Keuls test, different superscript letters indicate a statistical difference between country (a≠b≠c, p < 0.05).  B and NK cell distribution The lowest percentage of B lymphocytes was observed in the Spanish individuals (Table 3), especially in those above 50 years old (Figure 3a).",7fa399d7-c803-4915-a72d-6e003bf557ec
19,results7," Conversely, the percentage of NK cells was significantly higher in Spain (23.1 ± 1.0) than in France (14.8 ± 0.7) or Austria (16.2 ± 0.7) (Table 3). This increase was observed in the Spanish population at any age group over 30 y (Figure 3b). Age was negatively correlated with B cell distribution in Spanish volunteers (r2 = -0.436, p < 0.0001). In contrast, age was positively correlated with NK cell distribution in Spanish (r2 = +0.345, p = 0.0004) and French (r2 = +0.349, p = 0.0004), but not in Austrian subjects.  Figure 3 B and NK lymphocyte distribution. B (a) and NK (b) cell distribution were compared for each age group between the three countries (A = Austria; F = France; S = Spain). Data are reported as means ± SEM, one way analysis by two way measures analysis of variance (ANOVA) followed by a Newman-Keuls test, data that share different superscript letters indicate a statistical difference between country (a≠b≠c, p < 0.05).",8d6c7a69-719c-4ad2-be92-09cb9093a433
20,results8,"  Comparison between age groups showed that B cell distribution was significantly impaired in elderly Spanish subjects over 60 years old (Figure 4c). The same age cut-off (60 y) was observed for NK cell increase in Spanish and French (Figure 4c and a) but not in Austrian subjects (Figure 4b).  Figure 4 B lymphocyte and NK cell distribution. The B and NK cell distribution was compared for each age group in each country. Statistical analysis was done by one way analysis by two way measures analysis of variance (ANOVA) followed by a Newman-Keuls test; p < 0.05 was considered significant and data with different superscript letters are significantly different (a≠b≠c≠d).  CD45RA and CD45RO CD4 lymphocyte distribution CD45RA and CD45RO CD4 cell distributions (in %) were markedly higher in Austria (74.9 ± 1.1 and 68.8 ± 1.0, respectively) than in France (70.1 ± 0.8 and 60.8 ± 0.1, respectively) or Spain (70.3 ± 1.1 and 55.4 ± 1.9, respectively).",ef3b9fbe-d0b2-4079-b527-ebd3cda936a5
21,results9," Distribution between naïve (CD45RA) and memory (CD45RO) CD4 cells was modified by aging (Figure 5). As expected, percentages of CD45RA CD4 were higher in young adults than in elderly subjects, and conversely, percentages of CD45RO CD4 cells were lower in young adults than in older subjects. Age was negatively correlated with CD45RA CD4 cell distribution in Austria (r2 = -0.376, p = 0.0001) and Spain (r2 = -0.430, p < 0.0001) but not in France. On the other hand, age was positively correlated with CD45RO CD4 cell distribution only in France (r2 = +0.289, p = 0.0036).  Figure 5 CD45 lymphocyte distribution. Naïve (CD45RA+) and memory (CD45RO+) CD4+ lymphocyte distribution was compared for each age group in each country. Values are means ± SEM. Statistical analysis was done by one way analysis by two way measures analysis of variance (ANOVA) followed by a Newman-Keuls test, p < 0.05 was considered significant.",ded7fa4e-17d3-4f8e-ac50-bddb459d170d
22,results10," Values with different superscript letters are significantly different (a≠b≠c≠d≠e; a'#b'#c').  CD11b and CD18 PMN distribution Adhesion antigens (CD11b, CD18) expression (in %) of polymorphonuclear neutrophils (PMNs) was not affected, neither by the geographical location (France: 99.5 ± 0.1; Austria: 99.9 ± 0.02; Spain: 99.9 ± 0.01 for CD11b and France: 99.8 ± 0.1; Austria: 99.9 ± 0.02; Spain: 99.9 ± 0.01 for CD18), nor by the age of the volunteers (data not shown). ",ce97c8a7-c04b-47ee-89e7-27daf7b28344
23,discussion0,"The purpose of this work was to determine the biomarkers of immune status in healthy volunteers and to provide a geographical comparison of these biomarkers between three European countries. Despite different dietary habits, lifestyle, genetic and socio economic factors, we found only moderate variations in the biomarkers, the most striking being an increased distribution of NK cells in Spain, compared to France and Austria, while a higher delayed type hypersensitivity (DTH) response and an enhanced CD4/CD8 ratio were found in Austria. Interestingly, the immune parameters in our French volunteers had constantly intermediate values between those measured in Austrian and Spanish individuals, thus reflecting the importance of a geographic variability on the immune status and possible gradual differences in the dietary, lifestyle habits, environmental, genetic and socio-economic factors between Southern and Northern Europe. Immunosenescence affects all compartments of the immune system.",029946d4-ebd7-4ff3-b738-8fc84bbe9697
24,discussion1," Age changes were demonstrated in T lymphocytes and in innate immunity, including NK cells. A decline in CD4 count, a rise in CD8 compartment and an increase in the NK cell numbers with well-preserved [30] or reduced cytotoxic function [31,32] has been considered as a “remodelling” of the immune compartment with aging [30].  NK cell status and longevity In our Spanish population (mean age 46.3 y), we observed an increase in the percentage of NK cells in elderly people when compared to young controls (32.3 ± 3.4 in elderly over 70 y vs 19.1 ± 2 in young aged 20 to 29 y). This is consistent with the findings of Borrego et al. who also observed a significant increase in the percentage of CD56+ cells in aged Spanish donors when compared to the young controls (29.1 ± 10.1 in elderly over 81 y vs 14.8 ± 5.3 in young aged 32 y) [33].",0459e06d-147a-417c-a9f0-e3762067c919
25,discussion2," Moreover, we found that the percentage of NK cells was significantly higher in Spanish than in French or Austrian subjects, and this was observed at any age group above 30 years. The NK cell status is thought to be an important component of the aging immune system [5,7] and can predict morbidity and mortality in the elderly. Low NK cell number and function are associated with increased mortality and greater risk of severe infections in elderly subjects [34,35]. Conversely, a well preserved functional status of NK cells until very advanced age is linked to healthy ageing and longevity [5], emphasizing the importance of innate as well as adaptive immunity in ensuring healthy longevity [30] and possibly cancer resistance [36,37]. Thus, our results may be related to the fact that life expectancy at birth is greater in Spain (over 80 y) as compared to France or Austria (below 80 y) [38].",0ef321d2-2dd4-49a9-ac39-d2725a3220e4
26,discussion3,"  Environmental factors and immune biomarkers An aging-related deficiency in the immunosurveillance system (especially NK cells) may play a role in pathogenesis and in particular, in cancer. Since many environmental factors are mutagenic and promote cancer, we can speculate that aging is clearly related to the duration of exposure to these factors and their effects on immune system. For example, pollution affects the number of NK cells but also of CD4+, CD8+ and B lymphocytes [39]. As such, we cannot rule out that the differences in lymphocyte distribution observed between the three countries may be explained by differential environmental factors such as pollution or others.  Impact of diet on immune aging As the consumption of fruits and vegetables is higher in Spain than in the other European countries [40,41], an important role for the dietary patterns in the healthy aging of the elderly has been suggested [42,43].",3c0a5de7-6d93-4238-b2a0-db8f08a69259
