,chunk_label,chunk_text,uuid
27,discussion4," In Europe, prospective studies have shown that adherence to a typical Mediterranean diet is associated with lower mortality and increased longevity [41,44-46]. The effects of such a diet on immune status have not been reported. In one recent study conducted in patients with high risk of cardiovascular diseases, the Mediterranean diet, compared to a control low-fat diet, seems to down-regulate immune cell activation but not T lymphocyte percent change [47]. In the meta-analysis of 12 prospective studies [48], a two-point increase in a score of Mediterranean diet adherence was associated with improved health status, as shown by a significant reduction in mortality (9%), cardiovascular diseases (9%), cancer (6%), and the incidence of Parkinson’s and Alzheimer’s disease (13%). However, as this benefit was also apparent in non-Mediterranean populations [47,48], a direct role of diet on aging remains unclear and cannot fully explain our results.",c4e0c7f3-db04-43ce-acc9-7aefc9d6de8b
28,discussion5," NK cells and their cytolytic activity have also been related to nutrition including vitamin D and anthropometric markers [49]. Preliminary results from an Irish study indicate a small negative relationship between NK cell number and body mass index [4].  Age effect on immune status In our well-defined healthy population, we found serum IgA levels were correlated with age, which is in agreement with other studies [27] and suggests either a complex derangement of B cell function with age [50] or a remodelling of the immune system rather than a deterioration [51]. Comparison between age groups showed that IgA levels were higher in subjects above 40 y. It is noteworthy that the same cut-off was observed for other immune biomarkers (B, CD4 and CD8 cell distribution, CD4/CD8 ratio), suggesting that a decline in immune function leading to the healthy aging process may start in the early age.",6ec34eb4-34b9-43bd-825d-14814dc86162
29,discussion6," By recruiting only male volunteers in our study, we have excluded any possible influence of immune status by hormonal changes that occur with age in women. We also found alterations in the immune capacity reflected by a greater proportion of NK cells, a decrease in B lymphocytes but a stable number of T cells. When all European volunteers were classified as a function of age, NK distribution was significantly increased with age (17% in 20–29 y vs 24% in 70 y), in agreement with previous findings ([52]: 18% in 29 y vs 30% in 86 y; [53]: 14% in 20–29 y vs 20% in 70–75 y). Although the alterations of NK cells and other innate immune cells with aging are generally less marked than those seen with T cells [16,54], we observed that in our subjects, a greater correlation with age was found for NK cells (r2 = +0.21, p = 0.0002) than for CD4/CD8 ratio (r2 = +0.14, p = 0.01). A similar positive correlation between age and CD4/CD8 ratio in Irish individuals was reported by Rea et al. [4].",52252dfd-4081-4a8e-a138-2384892ab823
30,discussion7," Moreover, we observed a shift from a predominance of naïve T cells towards T cells expressing memory phenotypes from the youngest to the oldest age groups, as previously reported [12,55]. This shift may result from the age-related repetition of antigenic challenges.  Vaccination and immune response The mechanisms of vaccination are complex and may differ depending on the allergen and the route of immunization. We observed that the most frequent delayed type hypersensitivity (DTH) responses were observed for tetanus and tuberculin which represent two common antigens. As the vaccination coverage against the different antigens used in our study has not been reported in Europe, it is unclear why we observed enhanced delayed type hypersensitivity (DTH) responses in our Austrian volunteers, as compared to the subjects from the other two European centres. Whether this finding could be explained by a better vaccination status or linked to booster doses in elderly people in Austria is unlikely.",7d020d0c-4866-490e-bb13-17ee9e0fecdf
31,discussion8," Based on the influenza vaccination coverage rate in the general population (aged 14 to 75 years), it was of 26.4% in France and 23.7% in Spain, during the period 2007-2008 [56]. By comparison, the vaccination coverage rate during the same period was significantly lower in Austria (16.0%), where vaccination is costly and results in socioeconomic inequalities regarding immunization in the general population [57]. In addition, adherence to vaccination programs may differ between European countries. For example, tuberculin skin testing to make decision about BCG revaccination was described to be routinely performed in France but not in Austria [58]. Moreover, independently of the vaccination policy, the low cutaneous reactivity in Spain might be in part linked to dietary habits particularly fruits and vegetables consumption as previously published [59].",c094b4f3-16a7-4a88-ae27-6489ace2c245
32,discussion9,"  Conclusion This study compares for the first time the immune status in three European countries and describes the effects of aging on immune cell distribution. The differences observed from a country to another can be explained by genetic, environmental, dietary and socioeconomic variations. This variability should be taken into account when estimating, in future nutrition research studies, the actual immune status of healthy individuals with different geographical origins. ",a487d823-dd89-4a3b-a84f-74d29afd674d
