,chunk_label,chunk_text,uuid
26,methods26,"06 ppm), scyllo-inositol (peak at about 3.34 ppm), and stachydrine (peak at about 3.11 ppm). Inositols are present in many vegetable species as minor components and have a positive physiologically activity in human [36]. Many important studies have demonstrated the importance of inositols in the treatment of several diseases such as the polycystic ovary syndrome [37]. Furthermore, myoinositol content and myoinositol/fructose ratio have been found to provide information on the quality and genuineness of orange juice [38]. Stachydrine is an osmoprotectant or osmoprotective compound, which helps organisms to survive extreme osmotic stress [39]. Our evaluation of stachydrine content (about 0.6 mM) (see Table 2) in both Interdonato lemon juices agrees with that of a recent work on the effect of stachydrine on endothelial cell senescence under high glucose stimulation [39]. Finally, the methanol peak at about 3.",64b88727-b943-4cb6-8a46-73e32e01f6e5
27,methods27,"36 ppm is well evident in the spectrum of Interdonato Turkish lemon but it is not so intense in that of the Protected Geographical Indication (PGI) Interdonato lemon of Messina. Even if we are dealing with low concentrations we want to stress that an excess of methanol is not well tolerated by the human body since it interferes with liver metabolism where it is oxidized.  Also in the phenolic region (Figure 6) we were able to identify and quantify a good number of metabolites. Here we observe signals coming from nucleosides compounds (33), trigonelline (31), tryptophan (37), tyrosine (34), phenylalanine (38), gallic acid (38), and so forth. Note that phenolic compounds possess antitumoral and health properties [40, 41]. In particular, we want to stress the relatively high concentration, for both hybrids, of gallic acid which is a hydroxybenzoic acid present in food of plant origin and exhibit antioxidative properties [42].",587c0239-7d28-4a2f-aeb3-96203a80f8f3
28,methods28," Gallic acid is one example of metabolite identified by means of HSQC experiments.  In Table 2, we report the molar concentration, together with the standard deviation, of those metabolites whose p value is below 0.005 and so that can be taken into account for sample differentiation. In particular, the metabolic differences can be considered due to the different geographical origin of the two hybrids of Interdonato lemon.  3.3. Protected Designation of Origin (PDO) Extra Virgin Olive Oil of Sicily Olive oil is the principal source of fat in the Mediterranean diet. Olive oil contains a large proportion of monounsaturated fat, is relatively low in saturated fat, and is another source of the antioxidant vitamin E [43]. These characteristics make olive oil preferable to animal fats just from the standpoint of health [44, 45].",5e2e2629-0f2d-49ca-b8f3-3fce84daf445
29,methods29," In fact, diets high in monounsaturated fat seem to reduce the risk of atherogenesis and coronary heart diseases, because they increase the concentration of high-density lipoproteins (HDLs) without increasing that of the low-density lipoproteins (LDLs) [46].  Several cultivars of Sicilian eVOOs have been certified with the Protected Designation of Origin (Protected Designation of Origin (PDO)) certificate by the European Commission such as Valdemone, Valle del Belice, Valli Trapanesi, and Val di Mazara. We aim to study their peculiar characteristics in terms of fatty acids concentration and of minor compounds such as terpenes and aldehydes [47].  We have studied the fat composition of several eVOOs produced in Sicily by means of proton HR-magic angle spinning (MAS) Nuclear Magnetic Resonance (NMR), by means of two different but almost equivalent Nuclear Magnetic Resonance (NMR) methodologies (based on peak integration) described in Section 2.4.",f31bfb3d-98b0-4b35-a76a-d54bd1354245
30,methods30," We obtained essentially the same results, for both methods (Nuclear Magnetic Resonance (NMR)1 and Nuclear Magnetic Resonance (NMR)2) that are reported in Table 3 and compared with the corresponding values obtained by means of Gas Chromatography on some of them [48]. The results are very promising and confirm that 1H Nuclear Magnetic Resonance (NMR) spectroscopy can be considered a very useful tool for assessing virgin olive oil quality and genuineness [49].  Furthermore, we investigate the possibility to discriminate between samples coming from different Sicilian provinces. To this purpose, we executed the Principal Components Analysis (PCA) analysis on the processed spectra and the corresponding score plot is reported in Figure 7.",b7c319d7-333b-47ad-8dc6-3348d51dabea
31,methods31," Even though there is no clear distinction between different Sicilian regions, being the results superimposed to each other, the two samples grown in the province of Trapani, highlighted with an orange ellipse, belong to two Spanish cultivars: Arbosana and Arbequina.  These two samples show a minor concentration of oleic acid and a major concentration of saturated fatty acids with respect to the original Sicilian cultivars. It is noteworthy that oleic acid is considered to be antithrombotic compared with saturated fatty acids [45]. Furthermore, Arbosana and Arbequina eVOOs possess a minor amount of squalene as pointed out by Figure 8 where the comparison between the spectra of Arbequina and Valle del Belice cultivars is reported. Indeed in Figure 8 the expansion on the left side (green arrow) shows that even though the peak at about 2.83 ppm (representing the total amount of fatty acids) (see Methods Section 2.4) has the same intensity for the two cultivars, that at about 2.",db42c776-41fb-4a82-9a12-703d04766b0e
32,methods32,"02 ppm is more intense for the Valle del Belice sample rather than for Arbequina. Moreover, the expansion on the right side (blue arrow) shows that the peak at about 2.83 ppm, corresponding to squalene, is more intense for Valle del Belice rather than for Arbequina. Squalene is a hydrocarbon and a triterpene involved in the synthesis of all plant and animal sterols. It is known that squalene assumption for olive oil consumption reduces the risk of cancer [50].  3.4. Red Garlic of Nubia Garlic (Allium sativum L.) and garlic supplements are consumed in many cultures for their healthy effects. Since the ancient times, garlic was consumed as a remedy for different alimentary disorders and infections [51]. In fact, in literature, there are many studies that investigate garlic preparations and their properties [52].  The most important garlic compounds that have beneficial effects on human health are the organosulphur ones [52].",825725bf-860e-42ed-92cf-2c80a3336cb6
33,methods33," The peculiar garlic fragrance arises from allicin and other oil-soluble sulfur components. However, once garlic is cut or crushed, compounds in the intact garlic are converted into hundreds of organosulfur compounds in a short period of time. For example, alliin is converted to allicin by alliinase. Allicin is an effective antimicrobial agent that can be found in limited amounts only in freshly crushed garlic [53]. Another important allylic compound is S-Allyl Cysteine (S Allyl Cysteine (SAC)) that has a strong antifungal action and that seems to be highly present just in the red garlic of Nubia (see the region at about 6 ppm of Nuclear Magnetic Resonance (NMR) spectra in Figure 9).  We have determined the molar concentration of the main metabolites of the red garlic of Nubia by studying the one-dimensional proton spectrum obtained by means of HR-magic angle spinning (MAS) Nuclear Magnetic Resonance (NMR).",766f9ce4-d179-4fb2-aeea-3fc40b148743
34,methods34," The peak assignment was particularly difficult in the carbohydrates and allylic regions of the Nuclear Magnetic Resonance (NMR) spectra for the superposition of signals belonging to many similar chemical species. Our results confirm and extend those obtained by means of the same technique by Ritota et al. [16] on white and red Italian garlic. In Figure 9 we report the comparison between the HR-magic angle spinning (MAS) Nuclear Magnetic Resonance (NMR) proton spectra of two different Italian red garlics: the red garlic of Nubia (measured by us with a 700 MHz spectrometer) and the red garlic of Sulmona (measured by Ritota et al. [16] with a 400 MHz spectrometer).  In the figure, we have highlighted five different chemical shift regions that are relevant for the comparison. The region centered at about 4 ppm belongs to carbohydrates and is similar for both spectra.",d6707734-fdd9-4e42-bd31-049966eec8b9
35,methods35," The regions centered at about 6 and 8 ppm have instead a different intensity (higher for the Nubia sample) and correspond to allylic compounds and riboflavin, respectively. The major differences between the spectra of the two red garlics are showed in the first two regions. In particular, it is noteworthy that only in the spectrum of the red garlic of Sulmona (black line in Figure 9) there is a sharp triplet at about 1.23 ppm that the authors [16], together with a signal at about 3.95 ppm, assign to an unknown compound. We believe that these signals belong to diethylthiophosphate, that is, an organophosphorus compound widely used as pesticide because of easy degradation in the environment. On the other side, the peak at about 2.4 ppm, belonging to pyruvate, is much more intense in red garlic of Nubia with respect to the other red garlic considered.",bb019274-d9fa-49d4-a51c-3bc2f47bd904
36,methods36," In the following table (Table 4), we report the molar concentration of the identified metabolites that were quantified by means of the above described procedures. We list only the metabolites whose concentration has a standard deviation less than 15%.  4. Conclusions In this work, we have presented our studies, by means of the powerful Nuclear Magnetic Resonance (NMR) technique known as HR-magic angle spinning (MAS), on the characterization of some food products typical of the Mediterranean diet. In particular, we have analyzed the metabolic profile of the Protected Geographical Indication (PGI) cherry tomato of Pachino and we were able to identify few metabolites that can be considered for sample authentication. For example, in this protected foodstuff, we have found a higher concentration of GABA, sugars (fructose and glucose), glutamic compounds (glutamate and glutamine), and phenolic compounds (trigonelline, tyrosine, and tryptophan) with respect to non-Pachino cherry tomatoes.",525dc990-7113-46f5-87b5-2add116e6964
37,methods37," Furthermore, we have characterized the metabolic profile of juice from the Protected Geographical Indication (PGI) Interdonato lemon of Messina and compared it with that of the juice from the same hybrid cultivated in Turkey. We find for both hybrids high levels of sugars (sucrose, fructose, and glucose), citric acid, vitamin C, gallic acid, and inositols (mioinositol and scyllo-inositol).  The major source of fat in the Mediterranean diet comes from the consumption of eVOOs. For this reason, we have studied the fatty composition of several Sicilian cultivars (including few Protected Designation of Origin (PDO) samples) by means of two different methods both based on peaks integration. The results are consistent with those obtained by means of Gas Chromatography and confirm the power of Nuclear Magnetic Resonance (NMR) technique for quick quantitative chemical analysis.",3ec93a66-1df0-4117-8b93-2b50e7616dad
38,methods38," Moreover, we were able to discriminate between cultivars grown in the same province (Trapani) but coming from different nations (Italy and Spain), just for the different amount of oleic and unsaturated fatty acids and also for squalene content.  Finally, we have characterized the metabolic profile of the Product (PAT) red garlic of Nubia, quantifying the principal metabolites. In addition, we have compared its proton HR-magic angle spinning (MAS) Nuclear Magnetic Resonance (NMR) spectrum with that of another Italian red garlic and have revealed that both garlics possess the same amount of carbohydrates. However, the red garlic of Nubia has a bigger amount of riboflavin, pyruvate, and allylic compounds. On the other side, only the red garlic of Sulmona shows a peak that could belong to diethylthiophosphate, a widely used pesticide.",766e281e-8df7-4729-96af-65ba2f1097d8
39,methods39,"  In conclusion, the overall results allow appreciating the enormous potential of the used technique that is able to reveal and quantify a number of metabolites (characteristic of the particular food product condition), even on few amounts of samples and without any chemical treatment. The Nuclear Magnetic Resonance (NMR) technique is a rapid (few minutes of signal acquisition), nondestructive (no need of sample treatment), and reliable methodology to be used in an official method eventually in conjunction with other traditional analytical techniques such as GC. We want to stress that the consequence of insisting on Nuclear Magnetic Resonance (NMR) spectroscopy for food products characterization leads to the reduction of chemical consumption and waste production, which is important from both the economic and environmental points of view. All these characteristics also make the methodology very attractive for industry. ",df9f5527-9a9a-4ec1-aced-b28d97c6d778
