,chunk_label,chunk_text,uuid
0,methods0,"2.1. Instrumental  1H one and two-dimensional Nuclear Magnetic Resonance (NMR) experiments were conducted at atmospheric pressure by using a Bruker Avance spectrometer operating at 700 MHz, 1H resonance frequency, in the experimental configuration known as magic angle spinning (magic angle spinning (MAS)). This technique was developed to reduce the two main line-broadening mechanisms that are important in acquiring spectra of a tissue or cell sample, namely, dipolar coupling and heterogeneous isotropic susceptibility [8]. Spinning the sample at the magic angle θ ~ 54.74° by few thousands of Hertz averages, these interactions to zero and high-resolution spectra can be achieved for semisolids samples.  Our experiments were performed at the temperature of 300 K calibrated against the standard CH3OH reference (4% CH3OH in CD3OD) with an accuracy of 0.2 K. Temperature calibration is very important for this kind of experiments because of the heat produced by the high rotational speed.",c4c4c787-acc5-4281-a16f-f62064bdf04b
1,methods1," In fact, the real sample temperature is higher with respect to that read by the thermocouple. For each experiment we use a 4 mm-diameter zirconia sample holder (rotor) with a spherical insert for a total volume of 50 μL and a Kel-F rotor cap. We use deuterated solvents (D2O and CDCl3) in order to have a lock signal for a chemical shift reference and for a fine optimization of the static magnetic field homogeneity. Furthermore, the use of deuterated solvent is necessary in order to avoid any excessive proton signal from the solvent itself. In aqueous preparation we use a 1 mM solution of D2O with 2,2-dimethyl-2-silapentane-5-sulfonate (dimethyl 2 silapentane 5 sulfonate (DSS)) as an internal standard for the quantification of the assigned metabolites. High purity reagents were bought from Sigma-Aldrich Co. (Saint Luis, MO, USA).",43642c5e-6fd2-4342-be2e-ecd94f56430e
2,methods2," The acquired spectra were processed (Fourier transform, phase correction, and baseline adjustment) by means of the standard routines of the software package Xwinnmr version 3.5 (Bruker Biospin, Deutschland). Peaks assignment was performed by means of literature data and of a well-established software package: Nuclear Magnetic Resonance (NMR) Suite Professional version 7.1 (Chenomx, Alberta, Canada). This latter software is based on a highly sophisticated targeted profiling technology which allows an easy deconvolution of complex Nuclear Magnetic Resonance (NMR) spectra and the corresponding quantification of the identified compounds. For the complete and unambiguous assignment of some compounds we performed standard two-dimensional Nuclear Magnetic Resonance (NMR) techniques such as COSY and HSQC. For those metabolites not included in the software database (such as gallic acid) (see Section 3.",4e70a94d-4e5e-47ae-9c7b-40c96a0810ea
3,methods3,"2) and also for a confirmation of the Chenomx output, we used the standard Bruker program “nmrquant” for the quantification of metabolites. The Nuclear Magnetic Resonance (NMR) technique is less sensitive with respect to other well-established analytical techniques such as GC and ICP-MS (Inductively Coupled Plasma Mass Spectrometry) [19] and can quantify metabolites whose concentration is usually above one part per million. The quantification is obtained by using a reference compound of known concentration within the studied solution (1 mM dimethyl 2 silapentane 5 sulfonate (DSS) in D2O in our case). The area below each proton signal is proportional to the amount of the corresponding substance, so that by the knowledge of the chemical structure and molecular weight of the assigned metabolites, it is possible to obtain the molar concentration by a simple proportion between the peak areas.",c7c40db7-171b-44d8-b502-7fd5f3a76fb7
4,methods4," By means of the Chenomx software, all the spectral contributions belonging to the considered molecule should fit the experimental spectrum whereas by using nmrquant, the most intense and resolved peaks should be used for metabolites quantification. Finally, we can state that the advantages of the used method rely on the rapidity of the analysis without the needs for any sample treatment that allows, at least in principle, the reuse of the sample. Furthermore, the method is precise and allows observing a great number of compounds simultaneously. On the contrary, the method is not very sensitive for the detection of compounds whose concentration is below one part per million. Precise extraction procedures are needed in order to observe particular compounds (or secondary metabolites) at very low concentration.  In the following subsections, we describe the sample preparation and experimental procedures for each single food products we have analyzed.  2.2.",1c8038e9-d728-407a-92aa-ff6bf99b67ae
5,methods5," Protected Geographical Indication (PGI) Cherry Tomato of Pachino The Protected Geographical Indication (PGI) cherry tomato of Pachino is produced within an area located in the south east of Sicily (Italy) that includes the entire municipality of Pachino and Portopalo di Capo Passero and part of the territories of Noto and Ispica. We analyzed 14 cherry tomato samples of Pachino and 14 of dubious provenience (non-Pachino) including 2 coming directly from Beijing (China) [20]. For a statistically significant outcome we analyzed at least 5 samples for each kind of tomato. The Protected Geographical Indication (PGI) cherry tomatoes of Pachino were provided by Istituto Zooprofilattico Sperimentale della Sicilia “A. Mirri” (http://www.izssicilia.it/) which is the official institution recognized by the EU as to able to certificate this food product.  All samples were studied in the red stage which is when more than 90% of the surface, in the aggregate, is red.",c58ed8e1-40d0-4ceb-a941-0dbc443b049e
6,methods6," In doing so we reduce the eventual metabolic differences due to different ripening stage [21, 22]. We diluted 6 mg of freeze-dried tomato in 100 μL of a 1 mM solution of dimethyl 2 silapentane 5 sulfonate (DSS) in D2O. Then, we vortexed for a couple of minutes and put fifty microliters into the rotor that in this case was spun at 6000 Hz. The duration of the hard pulse was of 8 μs with a relative attenuation of 3 dB, the spectral width was 10 kHz, the acquisition time was 2.9 s, the points in the time domain were 64 k, the number of transient was 128, and the relaxation time was 2 s for a total time of about 10 min per experiment. For the reduction of the residual signal of water we use the standard Bruker presaturation pulse sequence zgpr with a presaturation pulse attenuation of 60 dB. When processing the spectra we considered 32 k points in the frequency domain.  2.3.",338ddeaf-1f58-46a2-9fa4-f30e46c2a057
7,methods7," Protected Geographical Indication (PGI) Interdonato Lemon of Messina The Protected Geographical Indication (PGI) Interdonato lemon of Messina is traditionally also known as “limone fino” (fine lemon) and “limone speciale” (special lemon). Interdonato lemons have an oval shape with a yellow peel. Interdonato lemons own a strong fragrance and an acidic taste. They are rich in sugars, vitamin C, and flavonoids, which are very important in human metabolism. We have analyzed 10 different Interdonato lemon samples cultivated in Sicily and 10 cultivated in Turkey at the same ripening stage. For each sample we have repeated the measurements on 6 different replicates in order to have a statistically significant outcome. The Protected Geographical Indication (PGI) Interdonato lemons were provided by 4 different companies belonging to the “Consorzio di tutela del limone Interdonato di Sicilia IGP”.",a77788b3-7fef-48b1-a9aa-a9d93ce72f89
8,methods8," We extracted the lemon juice by a simple mechanical procedure and diluted 20 μL of juice in 30 μL of 1 mM dimethyl 2 silapentane 5 sulfonate (DSS) dissolved in D2O directly into the rotor with a spherical insert and a Kel-F rotor cap. The sample was kept at ambient temperature (300 K) by a cold N 2 flow and a heating element. We used the following experimental parameters: rotor spinning rate 6000 Hz, duration of the hard pulse 8 μs, spectral width 10 kHz, acquisition time 2.9 s, 64 k points in the time domain, 128 transients, and 2 s of relaxation time. We use the standard Bruker presaturation pulse sequence “zgpr” to achieve a reduction of the residual water signal. The total time necessary for each experiment was of about 10 min and we used 32 k points in the frequency domain for processing the spectra.  2.4.",5a258c95-c65d-4e66-919f-f4e7749882e7
9,methods9," Protected Designation of Origin (PDO) Extra Virgin Olive Oil of Sicily 16 samples of different eVOOs were selected from different geographical areas of Sicily and in particular 8 from the province of Trapani (TP), 5 from that of Messina (ME), and 3 from that of Agrigento (AG). Among these we consider the following Protected Designation of Origin (PDO) cultivars: Valle del Belice (TP), Val di Mazara (TP), Valli Trapanesi (TP), and Valdemone (ME). All samples, after being carefully kept away from light and possible temperature changes that would alter the nature of the oils, were analyzed by taking 30 μL of CDCl3 and 20 μL of sample, placed in the rotor. The spectral width used was of 20 ppm (~14 kHz), the repetition time was 5 s, and the number of transients was 128. The duration of the hard pulse was of  5 μs with an attenuation of 3 dB. The rotation speed of the rotor was set to 7000 Hz and the total time was of about 15 min per experiment.",927680e2-2067-40b2-8814-924d60433558
10,methods10,"  The main signals of the typical proton spectrum of eVOOs come from fatty acids [23–25]. We used two different methods based on peaks integration for the determination of the fatty acids composition. In particular, Barison et al. [23] consider that all fatty acyl chains are esterified to a common moiety, glycerol, in order to form triacylglycerols. This means that it is possible to obtain the fatty acid composition by the inherent connection between the areas of the characteristic signals of each fatty acyl chain and one of the glycerol backbone (α) in the 1H Nuclear Magnetic Resonance (NMR) spectra (Figure 1, e.g., signals at 4.27 ppm) [23]. In particular, fatty acids can be esterified up to three times to the same glycerol moiety and this fact must be taken into account in order to calculate the correct amount. For example, it is possible to have up to three linolenic acid groups esterified to the same glycerol moiety so a ratio of 22.",371618c8-d8a2-4692-8f14-8dc7d55bd2c0
11,methods11,"2 α glycerol to 100 linolenic acid hydrogens should be used when integrating the signal E (0.98 ppm) in Figure 1. Special attention should be given to the integral determination (limits, slope, etc.). For example, in our case (700 MHz) the 13C satellites of most intense peaks have to be subtracted by the integrated region in order to obtain correct values (e.g., as shown in the expansion of the linolenic (E) signal at 0.98 ppm reported in Figure 1) [24]. Accordingly, the percentage of linoleic (A) acid can be determined by integrating the signal at about 2.74 ppm (signal IV = A + 2E in Figure 1), which refers to the methylene hydrogens between two double bonds or olefins [23].  Therefore, by setting the integral of the chosen glycerol signal to 33.3, the relative area found for the signal at 2.74 ppm directly gives the percentage of linoleic plus linolenic acids.",e7e0256e-c0a3-4eda-aaee-191dc9efc23f
12,methods12," Since linoleic (A) and linolenic (E) acids have, respectively, two and four methylene hydrogens between olefins, and the percentage of linoleic acid is obtained by subtracting twice the content of linolenic acid that was previously determined [23]. The signal (II in Figure 1) at about 2.02 ppm refers to the methylene α olefin hydrogens of all unsaturated fatty acids, and being the ratio of 2 α glycerol hydrogens to 12 possible α olefin hydrogens, if the signal of α glycerol hydrogens is set to 16.7, the area of the signal at 2.02 ppm provides the percentage of all unsaturated fatty acids: linolenic (E), linoleic (A), and oleic (C). The percentage of oleic acid can be then obtained by subtracting from the value found, the contributions of the unsaturated acids previously obtained [23]. Finally, by setting again the integral of the chosen glycerol signal to 33.3, that of the signal at 2.",18ac6e1b-327c-441d-91ab-bc4b2d245748
13,methods13,"28 ppm (from six α carbonyl hydrogens of all fatty acids esterified to the glycerol moiety) is approximately 100. Therefore, the percentage of saturated fatty acids can then be determined by subtracting from the area of the signal at 2.28 ppm, the contributions of the unsaturated oleic, linoleic, and linolenic acids found earlier.  The second method that we used was introduced by Vigli et al. [25] by considering that the content of linoleic acid can be determined by referring the intensity of its characteristic methyl signal at 0.95 ppm (signal E in Figure 1) to the intensity of the methyl signal at 0.85 ppm (signal labeled I in Figure 1) belonging to all acids except linolenic [25]. Consider  (1) linolenic=EE+I.    The relative amount of linoleic acid can be determined by subtracting from the signal of diallylic protons at 2.",9b2a46fe-bc99-4fa0-84cb-c516da56f0ce
14,methods14,"73 ppm (signal IV in Figure 1) the relative amount of linolenic calculated earlier as well as the oleic acid content that can be determined by referring the allylic protons centered at 2.02 ppm (signal II in Figure 1) to all fatty chains as measured from the intensity of the C-2 protons around 2.3 ppm (signal III in Figure 1) [25]. One has (2) linoleic=3IV−4E3IIIoleic=II2III−linoleic−linolenicsaturated=IE+I−linoleic−oleic−linolenic.    2.5. Red Garlic of Nubia The red garlic of Nubia is cultivated within the municipality of Paceco (Trapani) and in particular in the Integral Natural Reserve of Saline in Trapani. It is a food product registered to the Italian Ministry of Agricultural, Food, and Forestry Policies as a Traditional Italian Food Product (Product (PAT)). We have prepared the garlic samples by accurately cutting a thin strip of about 20 mg, rolling it directly into the rotor together with 30 μL of 1 mM dimethyl 2 silapentane 5 sulfonate (DSS) in D2O.",77e9b243-ba48-4fb9-b9ba-a324189213b2
15,methods15," In our one-dimensional experiments we used 32 k points in the time domain and a spectral width of 14 ppm (~10 kHz). The repetition time was set to 3 s and the number of transients was 256. The duration of the hard pulse was of 6.4 μs with an attenuation of 3 dB. Also in this case, to reduce the residual water signal, we use the standard Bruker presaturation pulse sequence zgpr. The rotation speed of the rotor was set to 7000 Hz and the total duration was of about 20 min per experiment. We have performed the experiments on 6 samples and 6 different replicates in order to have a statistically significant outcome.  3. Results and Discussion 3.1. Protected Geographical Indication (PGI) Cherry Tomato of Pachino Tomato (Solanum lycopersicum) is probably the most consumed fresh vegetable all over the world.",759fd746-f628-446b-acb6-5510113c6e74
16,methods16," Tomato is low in calories and shows antioxidant, antitumoral, and antidepressive properties [26] due to the relatively high concentration of lycopene, ascorbic acid, vitamin E, flavonoids, and so forth. The first tomato accredited by the Protected Geographical Indication (PGI) certificate (Council Regulation (EEC) number 2081/92) and one of the most counterfeit food product is the Sicilian cherry tomato of Pachino. Its special taste comes from the right combination of sugars, organic acids, free amino acids, and salts [20, 27].  We were able to identify and quantify the molar concentration of the main metabolites that can be observable by means of our Nuclear Magnetic Resonance (NMR) technique. In such a way we aim to obtain a metabolic fingerprint of this protected foodstuff that allows for its characterization and authentication.  Figure 2 reports in the main plot the complete typical proton spectrum of a Protected Geographical Indication (PGI) cherry tomato of Pachino sample.",9c4c1613-fe8e-495b-be46-38021be7b2da
17,methods17," The expansions are the enlargement of the phenolic region (left side, blue line) and part of the aminoacidic region (right side, red line). One can note the high resolution of the obtained spectra especially in the phenolic region that is usually characterized by high noise level.  We used for peaks assignment literature data [21, 22, 28] and the above mentioned software package Nuclear Magnetic Resonance (NMR) Suite Professional version 7.1 (Chenomx, AB, Canada) that allows also the determination of metabolites concentration [20]. We followed the same procedures also for the non-Pachino cherry tomato samples in order to execute a multivariate statistical analysis in terms of the Principal Components Analysis (Principal Components Analysis (PCA)). This kind of multivariate statistical analysis, being based on an unsupervised pattern recognition technique, allows the identification of differences and similarities between Nuclear Magnetic Resonance (NMR) metabolic fingerprints.",8c2b0368-07ed-4667-937f-3867297fcfd9
18,methods18,"  In particular, Nuclear Magnetic Resonance (NMR) spectra were processed by means of a custom-written ProMetab 3.3 software [29] in MATLAB version R2009b (The Math Works, Natick, MA, USA); spectra were binned from 0.7 to 10.0 ppm with 0.005 ppm bin size; the residual water signal (4.65–4.95 ppm) was excluded; spectra were normalized to the total area and were generalized by log transformation (with a transformation parameter, λ = 10−6) to stabilize the variance across the spectral bins and to increase the weightings of the less intense peaks [29]. Finally we use the software package Unscrambler X version 10.0.1 (Camo Software AS, Oslo, NO) for the Principal Components Analysis (PCA) analysis with cross validation; data were mean-centered and the singular value decomposition (singular value decomposition (SVD)) algorithm was used.  Our aim is to establish if there are any metabolites that can account for sample differentiation.",544859ac-72c2-4a5e-a9a6-1255a170b40f
19,methods19," We report in Figure 3 the results of the Principal Components Analysis (PCA) analysis in the form of a score plot, where samples that are metabolically similar cluster together. As it can be noticed, the Principal Component 1 (PC1) is able to separate Pachino from non-Pachino cherry tomatoes except for one sample.  The final identification of the metabolites that can account for sample differentiation can indeed be obtained by analyzing the loadings corresponding to the PC1. The loadings of a Principal Component represent the weight by which each standardized original variable should be multiplied to get the component score. In particular, positive loadings values represent metabolites that are predominant in non-Pachino samples and vice versa [20]. Therefore, we were able to identify those metabolites whose concentration can determine the sample clustering. Student's t-test analysis, performed by means of the software package Microsoft Excel (Microsoft Co.",bc7c3ed1-a826-4bac-8367-5465989fbd00
20,methods20,", WA, USA), allows to determine only the statistically significant (p value less than 0.05) changes of metabolites that we report in Table 1. Sugars, GABA, glutamic acid, trigonelline, tryptophan, and tyrosine concentration is higher in Pachino cherry tomatoes whereas that of alanine, guanosine, and methanol is higher in non-Pachino ones.  We want to stress that our result should be independent of factors such as the annual weather variations that can provoke some metabolic changes. In fact, it was shown that despite the marked variability showed only by antioxidants content, greenhouse-growing conditions in Sicily induce the accumulation of relatively high levels of ascorbic acid, phenolic compounds, and carotenoids in cherry tomatoes for most of the year [30].",4f334f83-9d75-4601-95bc-1ea0a2d58c8b
21,methods21," Moreover, very recent studies on the response of tomato to constraining the intensity of solar radiation showed that the tomato plant's metabolism has a strong adaptation to cope with the limitation in light availability such as increasing the specific leaf area and reducing respiration. This was only of little concern to the fruit quality, because no effect of constraining the intensity of solar radiation on the concentration of total dry matter, sugars, and lycopene in the fruits was observed [31].  3.2. Protected Geographical Indication (PGI) Interdonato Lemon of Messina Lemon (Citrus limon (L.) Burm.), similarly to tomato, is one of the most consumed fresh fruit. Lemon is low in calories and displays antioxidant and antineoplastic properties [32] that depend on the relatively high concentration of potassium, magnesium, calcium, vitamin C, phenolic compounds, and so forth.",a14f5342-ea32-4b52-8aaa-8a4f171fd8b3
22,methods22," In particular, lemon is the third most important health-promoting fruit rich in phenolic compounds as well as vitamins, minerals, dietary fiber, essential oils, and carotenoids. Furthermore, it is widely used also by the food industry as raw materials or flavoring additives for a wide variety of products. Indeed, lemons have a strong commercial value for fresh products market and food industry [32].  The cultivar of our interest, known as “Interdonato,” represents a hybrid between a cedar and a lemon. It is cultivated in the province of Messina (Italy) within an area delimited by the Ionian Sea and the Peloritans Mountains and it is one of the few citrus accredited by the European Protected Geographical Indication (PGI) certificate (Commission Regulation (EC) number 1081/2009).",e845ddb2-ed99-4402-9716-be40a36dc46c
23,methods23,"  In particular, we have studied the one-dimensional proton spectrum of lemon juice for different samples of both Protected Geographical Indication (PGI) Interdonato lemon of Messina and Interdonato lemon from Turkey [33]. We have assigned and quantified the main metabolites that are present in these two hybrids by means of literature data [34] and the above mentioned Chenomx software package. In fact, other studies performed on the different tissues of lemon with the HR-magic angle spinning (MAS) technique are present in literature [34] that agree with our results. However, in this mentioned study no metabolites quantification was performed.   Figure 4 reports the comparison between the one-dimensional proton spectrum of the Protected Geographical Indication (PGI) Interdonato lemon (red line) and that of the Turkish one (black line) in the chemical shift region of amino acids.",b2886e48-039d-4136-93cd-e9e5b8abd9d3
24,methods24," In the figure, all the identified metabolites are numbered and the most evident spectral differences are highlighted by means of rectangular shapes. In detail, in Turkish lemon there is a greater amount of both saturated (1) and unsaturated (6) fatty acids, lactic acid (8), arginine (10), and γ-aminobutyric acid or GABA (13). In contrast, asparagine (21) and malic acid signals (20), even if their peaks are cut in the figure, are more intense in Protected Geographical Indication (PGI) Interdonato lemon of Messina.  In lemon juice the major contribution of unsaturated fatty acids comes from oleic, linoleic, and linolenic acids whereas that of saturated fatty acids comes from palmitic and stearic acids [35]. Organic acids such as citric, isocitric, and lactic acids mainly contribute to determine the lemon acidity that plays the major role in the criteria assessing the commercial acceptability of the fruit. Citric acid (peaks in Figure 4 at 2.85 and 3.",8ee24471-5336-483c-81cc-0c53e6e73c81
25,methods25,"00 ppm cut because of their extreme intensity) content in lemon juice is about 5% to 6% [35].  For what concerns the sugars, namely, sucrose, fructose, and glucose, that represent the major component of carbohydrates in citrus fruits and hold the key to sweetness of the juice, the spectral comparison is reported in Figure 5. Fructose and β-glucose have a higher concentration in Protected Geographical Indication (PGI) Interdonato lemon of Messina whereas sucrose content is essentially identical. Another metabolite that is very important for nutritional consideration and that displays the same concentration in the two hybrids is vitamin C. The question mark at about 4.15 ppm in Figure 5 represents a metabolite that displays different chemical shift and that we were not able to assign with certainty but should belong to some malonic compounds.  Some minor but important metabolites that we were able to assign are myoinositol (peaks at about 3.28, 3.53, 3.62, and 4.",655cbb64-6513-45bd-b9a7-a07ff11acb29
