,chunk_label,chunk_text,uuid
0,methods0,"2.1. Cell Culture and Treatments Mouse neuro-2a (N2a) neuroblastoma cells (ATCC® CCL-131™) were purchased from the American Type Culture Collection (Rockville, MD, USA). N2a cells were plated at a density of 34 × 103 cells/cm2; they were cultured in Dulbecco’s modified Eagle medium (Dulbecco’s modified Eagle medium (DMEM)) with high glucose (4.5 g/L), stable glutamine, and sodium pyruvate (Dominique Dutscher, Brumath, France) supplemented with 10% (v/v) fetal bovine serum (fetal bovine serum (FBS), Pan Biotech, Aidenbach, Germany) and containing 1% (v/v) antibiotics (100 U/mL penicillin, 100 mg/mL streptomycin) (Pan Biotech). N2a cells were incubated at 37 °C in a 5% CO2 humidified atmosphere and passaged twice a week. N2a cells are broadly used to study the neuronal differentiation mechanism and neurite outgrowth [45].",6cf840b0-9a27-4941-b50c-692701326846
1,methods1,"  To evaluate the cytotoxicity and the differentiating properties of resveratrol (resveratrol (RSV)), apigenin (apigenin (API)), and retinoic acid (RA), 12 × 104 N2a cells were cultured per well in 6-well plates (FALCON, Becton Dickinson, NJ, USA) or in tissue culture dishes (35 × 10 mm, FALCON) containing 1 mL of culture medium with 10% fetal bovine serum (FBS). After 24 h of cell culture, the culture medium was removed, and the cells were cultured for 48 h in the absence or presence of polyphenol (resveratrol (RSV), apigenin (API)) or RA used in a range of concentrations from 6.25 to 50 µM in culture medium without or with 10% fetal bovine serum (FBS). resveratrol (RSV) (corresponding to trans-resveratrol), apigenin (API), and RA (corresponding to trans-retinoic acid) were from Sigma-Aldrich (St Quentin-Fallavier, France).",30b8a232-9527-474d-866c-8977fcb6aa23
2,methods2," Absolute ethanol (EtOH; Carlo Erba Reagents, Val de Reuil, France) was used as vehicle to dissolve resveratrol (RSV), whereas dimethyl sulfoxide (dimethyl sulfoxide (DMSO); Sigma-Aldrich) was used as vehicle to dissolve apigenin (API) and RA. RA was used as positive control to induce neuronal differentiation as it is well established that all-trans RA induce N2a differentiation into neuronal cells characterized by neurite outgrowth [46].  When the cells were simultaneously treated with the inhibitors H89 (20 µM), U73122 (1 µM), chelerythrine (1 µM) (Sigma-Aldrich), and U0126 (20 µM) (Calbiochem, San Diego, CA, USA), which contain positive control) with different inhibitors H89 (PKA), PLC, protein kinase A (PKA)/phospholipase C (PLC)/protein kinase C (PKC) and MEK inhibitors, respectively, these compounds were introduced in the culture medium 30 min before resveratrol (RSV), apigenin (API), or RA.",4b7f470a-cf63-4e78-9de5-371b39c92c38
3,methods3," H89 was prepared as a stock solution at 1 mM in distilled water; U0126, U73122 and chelerythrine were prepared as a stock solution in dimethyl sulfoxide (DMSO) at 0.1 mM, 0.1 mM, and 1 mM, respectively. To evaluate the involvement of the metabotropic receptor in N2a cell differentiation, the metabotropic receptor antagonist cyclo1–8[DLeu5] OP (10−6M) was added in the culture medium 30 min before resveratrol (RSV), apigenin (API), or RA.  2.2. Evaluation of Neuronal Differentiation with Morphological Criteria Morphological criteria were used to evaluate neuronal differentiation [47,48,49] on N2a cells cultured in 6-well plates. These criteria were defined on N2a cells with the use of octadecaneuropeptide (ODN), which is known to trigger neuronal cytoprotection and is capable of inducing differentiation on N2a cells. It is therefore considered as a neuroprotectin [50].",c5cfa56f-afd7-4992-9546-053a1d33c376
4,methods4," After 24 h of culture in Dulbecco’s modified Eagle medium (DMEM) with 10% fetal bovine serum (FBS), the culture medium was removed and N2a cells were cultured for 48 h in the presence of very low concentrations of octadecaneuropeptide (ODN) (10−14 and 10−12 M) without fetal bovine serum (FBS) (0% fetal bovine serum (FBS)) or with 10% fetal bovine serum (FBS). N2a cells (morphologically evocating neuroblasts) have the ability to differentiate in young immature and mature neurons. Under treatment with octadecaneuropeptide (ODN), differentiated N2a cells with dendrites (D), axons (A) and dendrites + axons (D + A) were observed (Supplementary Figure S1).  These morphological criteria were further used to evaluate the ability of resveratrol (RSV) and apigenin (API) to induce neuronal differentiation comparatively to RA used as a positive control.",661a3c5b-9073-4c51-81f9-18acd79db10e
5,methods5," Morphological changes were evaluated after 48 h of culture, in Dulbecco’s modified Eagle medium (DMEM) without fetal bovine serum (FBS) (0% fetal bovine serum (FBS)), in the absence or presence of resveratrol (RSV) (12.5 µM), apigenin (API) (12.5 µM), and RA (6.25 µM), and in Dulbecco’s modified Eagle medium (DMEM) with 10% fetal bovine serum (FBS) in the absence or presence of resveratrol (RSV) (12.5 µM), apigenin (API) (12.5 µM) and RA (25 µM). Cells were observed by phase contrast microscopy under an inverted Zeiss microscope (Primovert, Jena, Germany) at a 20× magnification (Objective: LD Plan-Achromat, ref: 415500-1614-000). Digitalized images were obtained with a Zeiss camera (5MP HD IP). Neuronal differentiation was determined on 20 images corresponding to 20 microscopical fields (5 × 4) taken at the center of the culture dish. N2a cell differentiation was quantified by neurite outgrowth (dendrites and/or axons).",9786bc8a-d8a4-473b-b812-2b2c4184dfc3
6,methods6," The percentages of differentiated cells with dendrites, axons, and dendrites + axons were determined. All assays were performed at least in four independent experiments.  2.2.1. Cell Counting N2a cells were cultured in 6-well plates. N2a cells previously cultured for 24 h in Dulbecco’s modified Eagle medium (DMEM) were further cultured for 48 h in Dulbecco’s modified Eagle medium (DMEM) without or with 10% fetal bovine serum (FBS) in the absence or presence of resveratrol (RSV), apigenin (API), and RA (6.25 to 50 µM). At the end of the treatment, adherent cells were collected by trypsinization and the total number of cells was determined by using a hemocytometer. All assays were realized at least in four independent experiments.  2.2.2.",6524efef-635d-4e58-94f2-6145bf243d8a
7,methods7," Measurement of Cell Viability with the Fluorescein Diacetate (fluorescein diacetate (FDA)) Test N2a cells, previously cultured for 24 h in Dulbecco’s modified Eagle medium (DMEM) with 10% fetal bovine serum (FBS) in 6-well plates, were further incubated for 48 h without or with 10% fetal bovine serum (FBS) in the absence or presence of resveratrol (RSV), apigenin (API), and RA (6.25 to 50 µM). At the end of the treatment, cells were incubated for 10 min at 37 °C with 15 µg/mL fluorescein diacetate (fluorescein diacetate (FDA), Sigma-Aldrich), rinsed twice with phosphate buffer saline (phosphate buffer saline (PBS)) and lysed with a Tris/HCl solution containing 1% sodium dodecyl sulfate (sodium dodecyl sulfate (SDS)) (Sigma-Aldrich). The fluorescein diacetate (FDA) test is a cell viability test. Fluorescence was measured with excitation at 485 nm and emission at 528 nm using a plate reader (Tecan Sunrise, Tecan, Lyon, France).",ab80a9ad-4367-4465-9663-af28a8afc364
8,methods8," All assays were performed at least in four independent experiments.  2.2.3. Flow Cytometric Analysis of Cell Cycle Flow cytometric analyses were carried out after staining with propidium iodide (PI) to determine the impact of resveratrol (RSV), apigenin (API), and RA on the repartition of the cells in the different phases of the cell cycle. To this end, N2a cells previously cultured for 24 h in Dulbecco’s modified Eagle medium (DMEM) with 10% fetal bovine serum (FBS) were further cultured for 48 h either in Dulbecco’s modified Eagle medium (DMEM) without fetal bovine serum (FBS), in the absence or presence of resveratrol (RSV) (12.5 µM), apigenin (API) (12.5 µM), and RA (6.25 µM), or in Dulbecco’s modified Eagle medium (DMEM) with 10% fetal bovine serum (FBS) in the absence or presence of resveratrol (RSV) (12.5 µM), apigenin (API) (12.5 µM), and RA (25 µM). At the end of the treatment, cell cycle was realized on adherent cells collected by trypsinization.",246ff47e-bd9f-4380-81a1-8f5b96ea89df
9,methods9," Cells were washed with phosphate buffer saline (PBS), and 1–2 × 106 cells were stained with PI as previously described [51]. Cells were resuspended in 80% cold ethanol (2 h, −20 °C), washed in phosphate buffer saline (PBS), and resuspended in 300 µL of phosphate buffer saline (PBS) containing 80 µg/mL PI and 200 µg/mL RNase A. After 1 h of incubation (37 °C, 1 h), 1–2 mL of phosphate buffer saline (PBS) were added, and flow cytometric analyses were performed on a Galaxy flow cytometer (Partec, Münster, Germany). Fluorescence of PI was collected using a 590/10 nm bandpass filter and measured on a linear scale. Subsequently, 10,000 cells were acquired, and data were analyzed with Flomax software (Partec).  2.2.4. Real-Time PCR Analysis Total RNAs from N2a cells obtained after 48 h of treatment with resveratrol (RSV) (12.5 µM), apigenin (API) (12.5 µM) and RA (6.",2b84c863-db70-4fe0-820b-67d4b46e73fa
10,methods10,"25 and 25 µM) without or with 10% fetal bovine serum (FBS), were extracted and purified with the RNeasy Mini Kit (Qiagen, Courtaboeuf, France). The concentration of RNA was measured by spectrophotometry (UV-1800, Shimadzu, Kyoto, Japan) at an absorbance of 260 nm and calculated with UV Probe (Shimadzu software). Then, 1 µg of total RNA from each sample was converted into single-stranded cDNA using the iScript cDNA kit (BioRad, Marne la Coquette, France) according to the protocol reaction provided by the manufacturer: 5 min at 25 °C, 20 min at 46 °C, and 5 min at 95 °C.",c49c0e91-633c-4af5-a1cb-c3ab01f05f81
11,methods11," cDNA was then amplified in the presence of FG Power SYBR Green (Thermo Fischer Scientific, Illkirch-Graffenstaden, France) and 100 µM of forward and reverse mouse primers (Eurogentec, Liége, Belgium):  * Diazepam-binding inhibitor (diazepam binding inhibitor (DBI)) sequences: forward (5′-gaagcgcctcaagactcagc-3′) and reverse (5′-ttcagcttgttccacgagtcc-3′),  * Nerve growth factor (nerve growth factor (NGF)) sequences: forward (5′-acactctgatcactgcgtttttg-3′) and reverse (5′-ccttctgggacattgctatctgt-3′),  * Brain-derived neurotrophic factor (brain derived neurotrophic factor (BDNF)) sequences: forward (5′-atggttatttcatacttcggttgca-3′) and reverse (5′-agctgggtaggccaagttg-3′),  * 36B4 sequences (36B4 was used as reference gene): forward (5′-gcgacctggaagtccaacta-3′) and reverse (5′-atctgcttggagcccacat-3′)  StepOne Plus (Life Technologies/Thermo Fischer Scientific, Courtaboeuf,",c531e18d-86ee-4b57-b496-6d56003651a1
12,methods12," France) was used to detect the real-time quantitative PCR products of reverse-transcribed cDNA samples according to the manufacturer’s instructions. The incubation conditions were as follows: 90 °C for 20 s, followed by 40 cycles (95 °C for 30 s, 60 °C annealing for 30 s) and a cycle from 60 °C to 95 °C. Specific amplification efficiencies were calculated with StepOne software. Results were expressed as means of Ct (threshold cycle value) ± standard deviation (SD).  2.2.5. Statistical Analysis Statistical analysis was performed using the GraphPad Prism5 software (San Diego, CA, USA). An ANOVA test followed by a Mann–Whitney test was used. A p value of 0.05 or less were considered as statistically significant.  3. Results 3.1. Evaluation and Quantification of Resveratrol- and Apigenin-Induced Neuronal Differentiation of N2a Cells N2a cells were previously cultured for 24 h in the following culture medium: Dulbecco’s modified Eagle medium (DMEM) high glucose (4.",1ba6ef9e-e75f-412a-94e6-0aad274355a7
13,methods13,"5 g/L) with stable glutamine and sodium pyruvate containing 10% fetal bovine serum (FBS). They were further cultured for 48 h in Dulbecco’s modified Eagle medium (DMEM) with high glucose and stable glutamine and sodium pyruvate without fetal bovine serum (FBS) (0% fetal bovine serum (FBS)), or with 10% fetal bovine serum (FBS) in the absence or in the presence of resveratrol (RSV) (6.25–50 µM) or apigenin (API) (6.25–50 µM). Ethanol (EtOH) was used as vehicle to dissolve resveratrol (RSV) whereas dimethyl sulfoxide (DMSO) was used as vehicle to dissolve apigenin (API) and RA (6.25–50 µM) used as positive control to induce neuronal differentiation. Neuronal differentiation induced by resveratrol (RSV), apigenin (API), and RA was morphologically evaluated by phase contrast microscopy on 20 images taken with a Zeiss camera under an inverted Zeiss microscope (Figure 1).",f0c77697-6771-4ef4-ac2d-3f29cf2c83fe
14,methods14," In those conditions, cell differentiation was evaluated by neurite outgrowth (dendrites and/or axons) and differentiated cells with dendrites, axons, and dendrites + axons were quantified. In the different conditions of culture, the spontaneous level of total differentiated cells (cells with dendrites, axons, and dendrites + axons) was similar with 0% fetal bovine serum (FBS) and with 10% fetal bovine serum (FBS) (Figure 2).  Without fetal bovine serum (FBS) (0% fetal bovine serum (FBS)), the highest percentage of differentiated cells was observed with RA (6.25 µM; 53 ± 9%) (Figure 2); at the highest concentrations, lower percentages of differentiated cells were detected (Figure 2): this could be due to a dose-dependent decrease of cell growth and/or viability induced by RA revealed by cell counting and staining with fluorescein diacetate (fluorescein diacetate (FDA)), respectively (Figure 3A,B).",2e93faf4-e89e-4575-a529-49aca5fe6741
15,methods15," In the presence of resveratrol (RSV) and apigenin (API), the neuronal differentiation was in the same range of order (28–40%) from 6.25 to 50 µM (Figure 2); at these concentrations, cell growth and cell viability was sometimes slightly but significantly increased with apigenin (API) (Figure 3A,B) whereas a significant decrease in cell growth and viability was found with resveratrol (RSV) (6.25 and 12.5 µM) (Figure 3A,B).  Interestingly, with 10% fetal bovine serum (FBS), the highest percentages of differentiated cells (30–38%) associated with a decrease of cell growth and viability were observed with resveratrol (RSV) in a range of concentration from 12.5 to 50 µM (Figure 2 and Figure 3A,B). Similar differentiating effects (10–30%), in a range of concentration from 12.5 to 50 µM, without or with a slight cytotoxicity, were observed with apigenin (API) and RA (Figure 2 and Figure 3A,B).",ed6d2b5f-5d16-4637-abf5-09601e7d4dac
16,methods16,"  Under treatment with resveratrol (RSV), and especially with apigenin (API) and RA, as the induction of differentiation, as well as the impact on cell growth and viability were different without fetal bovine serum (FBS) and with 10% fetal bovine serum (FBS) (the differentiation was often reduced in the presence of 10% fetal bovine serum (FBS)), N2a cells were treated with resveratrol (RSV), apigenin (API), and RA in the presence of 10% delipidized fetal bovine serum (FBS) to determine the incidence of the lipidic and non-lipidic fraction of the serum on differentiation. Of note, in the presence of 10% delipidized fetal bovine serum (FBS), the differentiating effects of resveratrol (RSV), apigenin (API), and RA were strongly reduced, supporting that the inhibiting effects of the fetal bovine serum (FBS) on neuronal differentiation are due to non-lipidic compounds (Figure 2).",d23a07d9-cdcf-4c71-a411-a46930eb5846
17,methods17,"  Preliminary data on the repartition of the cells in the different phases of the cell cycle have been obtained (Supplementary Figure S2A,B). Without fetal bovine serum (FBS) (0% fetal bovine serum (FBS)), slight modifications of the cell cycle were observed compared to the control and vehicle-treated cells in the presence of resveratrol (RSV), apigenin (API), and RA used at a concentration inducing differentiation. With 10% fetal bovine serum (FBS) at concentrations inducing differentiation, modifications of the cell cycle were mainly observed with resveratrol (RSV) (12.5 µM). However, at a concentration of 25–50 µM, which is used to induce cell death (especially the 50-µM concentration), resveratrol (RSV) and apigenin (API) induce modifications of the cell cycle as previously reported. Thus, resveratrol (RSV) (25–50 µM), in agreement with other studies [51,52], induces an accumulation of the cells in the S phase.",0ceb3809-2b0d-438f-bad8-96c6a0af3474
18,methods18," apigenin (API) (25–50 µM) triggers a less pronounced accumulation of the cells in the S phase than that observed with resveratrol (RSV), whereas its ability to favor an accumulation in G2 + M has been reported [53,54]. RA induces an accumulation of the cells in G2 + M.  For further experiments without fetal bovine serum (FBS) and with 10% fetal bovine serum (FBS), the concentrations of resveratrol (RSV), apigenin (API), and RA that were chosen are a compromise in terms of the ability to induce high differentiation without or with a low toxicity. The lowest concentrations meeting these criteria were selected: resveratrol (RSV) and apigenin (API), 12.5 µM without and with 10% fetal bovine serum (FBS); and RA, 6.25 and 25 µM, without and with 10% fetal bovine serum (FBS), respectively. In those conditions, resveratrol (RSV) and apigenin (API) induce neurite outgrowth, and N2a cells with dendrites, axons, and dendrites + axons were observed (Figure 4).",bed48b24-cc05-4945-bacd-0d0be8bdb4d2
19,methods19," Depending on the compound considered the percentage of cells with dendrites or axons was more or less different without or with 10% fetal bovine serum (FBS) (Figure 4). The highest percentage of axonal cells (20–50%) which can be considered as a sign of terminal neuronal differentiation was observed with RA, whereas the percentage of axonal cells was from 22 to 30% and 16 to 34% with resveratrol (RSV) and apigenin (API), respectively (Figure 4; Supplementary Figure S3).  Altogether, these data show that resveratrol (RSV) and apigenin (API) are potent inducers of neuronal differentiation, inducing neuritis and axon outgrowth (terminal neuronal differentiation). Of note, at the opposite of RA and resveratrol (RSV), these differentiating effects of apigenin (API) were associated with no or slight cytotoxic effects as shown by cell counting and the fluorescein diacetate (FDA) test.  3.2.",8f981cb9-f3e2-4f56-85bd-a8ff74073bd5
20,methods20," Characterization of Resveratrol- and Apigenin-Signaling Pathways Involved in the Neuronal Differentiation of N2a Cells At the moment, little is known about the signaling pathways involved in the neuronal differentiation induced by neurotrophins. As octadecaneuropeptide (octadecaneuropeptide (ODN)), which can be considered as a neurotrophin, has cytoprotective effects via metabotropic receptors involving both the activation of the positive control) with different inhibitors H89 (PKA)/(PLC/protein kinase A (PKA)/phospholipase C (PLC)/protein kinase C (PKC))/(MEK/ERK) signaling pathway [50], we determined whether positive control) with different inhibitors H89 (PKA), PLC, protein kinase A (PKA)/phospholipase C (PLC)/protein kinase C (PKC) and MEK/ERK were involved in the neuronal differentiation induced by resveratrol (RSV) and apigenin (API) (as well as of RA used as positive control) with different inhibitors: H89 (positive control) with different inhibitors H89 (PKA)), U0126 (MEK),",1cd2c769-a185-4142-8346-2a79100a149a
21,methods21," U73122 (PLC) and chelerythrine (protein kinase A (PKA)/phospholipase C (PLC)/protein kinase C (PKC)).  Without fetal bovine serum (FBS) (0% fetal bovine serum (FBS)), when resveratrol (RSV) and apigenin (API) were associated with H89, U0126, U73122, and chelerythrine, a total inhibition of neuronal differentiation (% of total differentiated cells: cells with dendrites and/or axons) was observed (Figure 5A). This supports that these two polyphenols simultaneously stimulate the following signaling pathways PLC/protein kinase A (PKA)/phospholipase C (PLC)/protein kinase C (PKC)/(MEK/ERK) and positive control) with different inhibitors H89 (PKA)/MEK, or that they act via a receptor evocating the canonical metabotropic receptors which simultaneously involves the activation of positive control) with different inhibitors H89 (PKA) and PLC/protein kinase A (PKA)/phospholipase C (PLC)/protein kinase C (PKC), leading to activation of MEK/ERK (Figure 5A).",d3f23cec-e7af-46ca-955e-7ff5525f29c3
22,methods22,"  With 10% fetal bovine serum (FBS), important modifications in the signaling pathways activated by resveratrol (RSV) and apigenin (API) were observed. With resveratrol (RSV), PLC/protein kinase A (PKA)/phospholipase C (PLC)/protein kinase C (PKC) as well as positive control) with different inhibitors H89 (PKA) were required for the induction of neuronal differentiation (Figure 5B). With apigenin (API), the neuronal differentiation was independent of positive control) with different inhibitors H89 (PKA), PLC/protein kinase A (PKA)/phospholipase C (PLC)/protein kinase C (PKC), and MEK/ERK (Figure 5B). With retinoic acid, PLC/protein kinase A (PKA)/phospholipase C (PLC)/protein kinase C (PKC) were only required for the induction of neuronal differentiation (Figure 5B).",a3d8e0e9-a1d8-41d2-b5bd-8e33fc083d37
23,methods23," Thus, with resveratrol (RSV), PLC/protein kinase A (PKA)/phospholipase C (PLC)/protein kinase C (PKC) were activated both with 0% and 10% fetal bovine serum (FBS); with apigenin (API), positive control) with different inhibitors H89 (PKA), PLC/protein kinase A (PKA)/phospholipase C (PLC)/protein kinase C (PKC), and MEK/ERK were activated with 0% fetal bovine serum (FBS), whereas none of these pathways were needed with 10% fetal bovine serum (FBS); RA, positive control) with different inhibitors H89 (PKA), and PLC/protein kinase A (PKA)/phospholipase C (PLC)/protein kinase C (PKC) were activated both with 0% and 10% fetal bovine serum (FBS) (Figure 5A,B).  3.3.",39d401b1-83d5-4e64-b5fc-e6b7a6156257
24,methods24," Evaluation of the Involvement of Octadecaneuropeptide (octadecaneuropeptide (ODN)) Receptor in the Neuronal Differentiation of N2a Cells Induced by Resveratrol and Apigenin Based on the data obtained with resveratrol (RSV) and apigenin (API) without fetal bovine serum (FBS) (0% fetal bovine serum (FBS)), an involvement of the metabotropic receptors of octadecaneuropeptide (ODN) can be suspected. We therefore simultaneously cultured N2a cells with resveratrol (RSV) and apigenin (API), without and with cyclo1–8[DLeu5] OP (an antagonist octadecaneuropeptide (ODN) metabotropic receptor) [50].",31861af1-95ec-4d6e-905c-cd31fe69f1e0
25,methods25," In those conditions, the neuronal differentiation induced by resveratrol (RSV) and apigenin (API) was not reduced (Figure 6) supporting that the direct activity of resveratrol (RSV) and apigenin (API) does not require the metabotropic receptors of octadecaneuropeptide (ODN), or that resveratrol (RSV) and apigenin (API) do not activate the synthesis of diazepam binding inhibitor (DBI), the precursor of octadecaneuropeptide (ODN) [37]. In agreement with this later hypothesis, in comparison to untreated and vehicle-treated cells, no increase of diazepam binding inhibitor (DBI) mRNA levels evaluated with the Ct values were observed by RT-qPCR when N2a cells were cultured with resveratrol and apigenin; similar data were found with retinoic acid (Table 1).",6a703413-076d-40cd-ac15-9197313d04ee
26,methods26,"  In addition, under treatment with resveratrol (RSV) and apigenin (API), no increase of nerve growth factor (nerve growth factor (NGF)) and brain-derived neurotrophic factor (brain derived neurotrophic factor (BDNF)) mRNA levels evaluated with the Ct values was observed by RT-qPCR (Table 1). Similarly, no effect of RA, on diazepam binding inhibitor (DBI), nerve growth factor (NGF), and brain derived neurotrophic factor (BDNF) mRNA level was found (Table 1).  4. Discussion Polyphenols are a broad family of molecules including flavonoids, phenolic acids, lignans and stilbenes (such as resveratrol) [3,4]. Flavonoids include flavones (such as apigenin), flavonols, flavanones, flavanols, isoflavones, and anthocyanins. The polyphenols are found in large quantities in the Mediterranean diet which is rich in fruits and vegetables and which can be associated with a consumption of wine [55].",a227c664-4e39-4069-aab9-057dbdb995e3
27,methods27," Polyphenols are for the most part powerful antioxidants, and some of them, such as apigenin and resveratrol, also have anti-proliferative and anti-inflammatory properties and decrease the production of growth factors as insulin growth factor-1 (IGF-1) and vascular endothelial growth factor (vascular endothelial growth factor (VEGF)) [15,56]. With resveratrol, pro-differentiating activities have also been shown on myoblasts, resulting in the formation of myotubes [57]. Apigenin has also been shown to promote osteogenic differentiation of human mesenchymal stem cells through JNK and p38 MAPK pathways [58,59], to enhance myoblast differentiation by regulating Prmt7 [60], to induce granulocytic differentiation in human promyelocytic leukemia HL-60 cells [61], and to activate morphological differentiation and G2-M arrest in rat neuronal cells [62].",4b99697c-2d61-4f9b-b754-8e53d9616d7c
