,chunk_label,chunk_text,uuid
28,methods28," It has also been reported that apigenin from Croton betulaster Mull inhibits proliferation, induces differentiation and regulates the inflammatory profile of C6 glioma cells [63].  In response to the increase in age-related diseases, particularly neurodegenerative diseases associated with oxidative stress and inflammation [5], polyphenols, because of their anti-oxidant and anti-inflammatory activities, could be used for prevention or even as a treatment. Several studies also reveal a benefit of polyphenols to cognitive functions [22]. Moreover, it is now well established that resveratrol prevents the aggregation of β-amyloid, which is neurotoxic [64]. In the more common neurodegenerative diseases such as Alzheimer’s disease and Parkinson’s disease, neuronal loss is associated with the evolution of these diseases. Promoting neurogenesis could be a means of preventing these diseases.",ce9bfcdf-66fa-4c6a-9b1f-5f6de90a4ff6
29,methods29," In this context, neuropeptides produced by the brain via endothelial cells and astrocytes form a family of molecules called neurotrophins, with cytoprotective and differentiating activities [65]. However, to exert their cytoprotective effects, these molecules must be injected intracerebrally near the lesions [66]. As polyphenols have the ability to cross the blood–brain barrier and accumulate in the brain much more efficiently when administered intravenously than orally [27,67,68], these properties reinforce their interest in preventing certain neurodegenerative diseases.  In this context, it was therefore important to clarify whether some polyphenols (resveratrol, apigenin) present in significant amount in the Mediterranean diet could promote neurogenesis, especially the differentiation of neuroblasts into mature neurons characterized by the presence of dendrites and/or axons.",04e05750-ebab-4ce7-9cbe-d50b423638ab
30,methods30," Using N2a murine neuroblastoma cells, we demonstrated that these cells cultured in the presence of resveratrol and apigenin in a concentration range from 6.25 to 50 μM differentiate into mature neurons with dendrites and/or axons and that the activation of the protein kinase A (PKA)/phospholipase C (PLC)/protein kinase C (PKC) signaling pathway plays an important role in this process. These results, which establish that some polyphenols (resveratrol, apigenin) are able to trigger neuronal differentiation, opening new perspectives in terms of treatments for neurodegenerative diseases where only few molecules are effective.  Interestingly, the differentiation observed with resveratrol and apigenin on N2a cells is as effective as that obtained with retinoic acid (used as positive control), which in humans can be associated with various side effects because of its ability to activate or suppress the expression of many genes [69].",06645e0b-320b-4277-93f1-038224e00726
31,methods31," In the present study, in terms of toxicity, the differentiation induced by resveratrol as well as with retinoic acid is associated with an inhibition of cell growth resulting from a decrease of cell viability, as evaluated with the fluorescein diacetate (FDA) test. On the other hand, with apigenin, neuronal differentiation has only little effect on cell growth and viability, suggesting different mechanisms of differentiation between resveratrol and apigenin. In addition, the differentiation observed in the absence of fetal bovine serum (FBS) (0% fetal bovine serum (FBS)) demonstrates that exogenous factors present in the serum do not contribute to the neuronal differentiation induced by resveratrol and apigenin as well as with retinoic acid.",1fd8e58d-7099-42db-b055-ad6eedf71df8
32,methods32," Moreover, a comparison of the efficiency of resveratrol and apigenin to induce neuronal differentiation in serum-free culture medium (0% fetal bovine serum (FBS)) and in culture medium containing 10% fetal bovine serum (FBS) clearly shows that fetal bovine serum (FBS) attenuates the differentiation induced by the polyphenols and retinoic acid, and that fetal bovine serum (FBS) also contributes to the attenuation of the cytotoxicity, mainly with retinoic acid. As the comparison of the differentiation obtained in the presence of delipidized serum (10% delipidized fetal bovine serum (FBS)) versus 10% fetal bovine serum (FBS) shows a lower differentiation in the presence of 10% delipidized fetal bovine serum (FBS) than in the presence of 10% fetal bovine serum (FBS), our results demonstrate that some serum proteins counteract neuronal differentiation. The identification of these molecules could make it possible to optimize the use of polyphenols for neurodifferentiation purposes in humans.",54fd7fc0-d2a9-4e35-9dba-0645de8dde38
33,methods33," The fractionation of the serum associated with a proteomic analysis must make it possible to answer this question. It has been reported that serum factors such as α1-, α4-, and β-globulin fractions can cause the inhibition of neuronal differentiation and neurite growth [70,71,72], whereas serum deprivation increases the phosphorylation of EGFR, ERK1/2, AKt, and other signaling molecules in N2a cells [72]. On the basis of in vitro tests using patient serum instead of fetal bovine serum (FBS), one can also expect to distinguish between good and bad responders to treatment with polyphenols.",8403a9b3-a113-47cf-8697-b6b475b81add
34,methods34,"  In addition, as the ability of resveratrol (RSV), apigenin (API), and RA to trigger neuronal differentiation occurs without and with 10% fetal bovine serum (FBS), and is associated with modifications of the cell cycle (resveratrol (RSV) and apigenin (API): marked and slight accumulation of the cells in the S phase of the cell cycle, respectively; RA: accumulation of the cells in the G2 + M phase of the cell cycle), the role taken by cell cycle-associated molecules in the neuronal differentiation of N2a cells will require additional investigation.  Altogether, these data underline that in order to promote neurogenesis with polyphenols, it is necessary to identify the signaling pathways involved in this process to develop effective drugs and to optimize the efficiency of resveratrol and apigenin. Hence, we tried to specify which signaling pathways were activated with resveratrol and apigenin but also with retinoic acid used as a positive control.",7472267e-92aa-49ed-ae32-25f792c974df
35,methods35,"  Due to the ability of certain neurotrophic factors (characterized by cytoprotective and differentiating properties) such as octadecaneuropeptide (ODN) to exert their activities via metabotropic receptors (G protein-coupled receptors) [73], some molecules capable of inhibiting the metabotropic receptor-associated response under the effect of octadecaneuropeptide (ODN) were used: H89 (positive control) with different inhibitors H89 (PKA) inhibitor), U0126 (MEK inhibitor), U73122 (PLC inhibitor), and chelerythrine (protein kinase A (PKA)/phospholipase C (PLC)/protein kinase C (PKC) inhibitor) [38,50].",c6ae6ede-f931-4d4c-afe2-5d6f1aed1653
36,methods36," Without fetal bovine serum (FBS), when resveratrol (RSV) and apigenin (API) were associated with H89, U0126, U73122, and chelerythrine, a total inhibition of neuronal differentiation was observed supporting either that these two polyphenols are able to simultaneously stimulate the PLC/protein kinase A (PKA)/phospholipase C (PLC)/protein kinase C (PKC)/(MEK/ERK) and positive control) with different inhibitors H89 (PKA)/(MEK/ERK) signaling pathways, or that they act via a receptor evocating the metabotropic receptors which simultaneously involves the activation of positive control) with different inhibitors H89 (PKA) and PLC/protein kinase A (PKA)/phospholipase C (PLC)/protein kinase C (PKC), leading to the activation of MEK/ERK. However, with 10% fetal bovine serum (FBS), important modifications in the signaling pathways activated by resveratrol (RSV) and apigenin (API) were observed.",2c5573f8-4e1a-4449-87b2-3f292c909402
37,methods37," With resveratrol (RSV), PLC/protein kinase A (PKA)/phospholipase C (PLC)/protein kinase C (PKC) as well as positive control) with different inhibitors H89 (PKA) were activated, whereas with apigenin (API), the neuronal differentiation was independent of positive control) with different inhibitors H89 (PKA), PLC/protein kinase A (PKA)/phospholipase C (PLC)/protein kinase C (PKC), and MEK/ERK. Thus, with resveratrol (RSV), the PLC/protein kinase A (PKA)/phospholipase C (PLC)/protein kinase C (PKC) signaling pathway was activated both with 0% and 10% fetal bovine serum (FBS), whereas with apigenin (API), positive control) with different inhibitors H89 (PKA), PLC/protein kinase A (PKA)/phospholipase C (PLC)/protein kinase C (PKC), and MEK/ERK were activated with 0% fetal bovine serum (FBS). None of these pathways were required with 10% fetal bovine serum (FBS).",cbc21787-95d3-4d56-a70c-b263ae8f53d9
38,methods38," These data bring new evidence supporting that the biological activities of resveratrol (RSV) and apigenin (API) (impact on cell growth, viability, and differentiation) involve different mechanisms. With RA (used as positive control), positive control) with different inhibitors H89 (PKA) and PLC/protein kinase A (PKA)/phospholipase C (PLC)/protein kinase C (PKC) were activated both with 0% and 10% fetal bovine serum (FBS). Altogether, these data support that the early metabolic pathways involved in neuronal differentiation depend on the inducer considered, and that the differentiating activities of polyphenols (resveratrol (RSV), apigenin (API)) could involve plasma membrane receptors.",5a36acba-0531-44ab-a595-14de00bc0bd5
39,methods39,"  In the absence of serum, as the implication of a receptor evoking the metabotropic receptor and simultaneously activating the protein kinase A (PKA)/phospholipase C (PLC)/protein kinase C (PKC) and positive control) with different inhibitors H89 (PKA) pathways was considered [73,74], we attempted to determine whether resveratrol (RSV) and apigenin (API) were able to activate the synthesis of diazepam binding inhibitor (DBI), which is an octadecaneuropeptide (ODN) precursor [37]. In those conditions, the octadecaneuropeptide (ODN) produced could in turn activate the metabotropic receptor in an autocrine or paracrine way. The very low values of Ct obtained for diazepam binding inhibitor (DBI) in the control cells as well as in the cells cultured in the absence or presence of resveratrol (RSV) and apigenin (API), without fetal bovine serum (FBS) or with 10% fetal bovine serum (FBS), excludes this hypothesis.",e261b6ad-0b62-4819-88b3-6365d0448830
40,methods40," In addition, no effects of resveratrol (RSV) and apigenin (API) were observed on nerve growth factor (NGF) and brain derived neurotrophic factor (BDNF) mRNA levels.  As resveratrol (RSV) and apigenin (API) display more ability to differentiate N2a cells than RA, we suggest the following potential mechanism behind this phenomenon. The growth of dendrites and/or neurons requires much energy and mitochondrial biogenesis [75]. In addition, dietary micronutrients (including polyphenols) have been shown to favor mitochondrial/nuclear dialogue, which could favor gene expression such as in those involved in neuronal differentiation [76]. In well-differentiated neuronal cells, a topographical redistribution of mitochondria along the axone is also needed to favor the transmission of the nerve impulse [77].",f4305c88-80fd-4461-890b-064ce2c70a7f
41,methods41," As several polyphenols are recognized as molecules capable of modulating pathways involved in mitochondrial biogenesis (induction of sirtuins), mitochondrial activity (modulating complexes I to V activity, ATP production), and control of the intra-mitochondrial oxidative status (inhibition of ROS formation), the different benefits of this family of compounds (including resveratrol (RSV) and apigenin (API)) at the mitochondrial level might be predominant [78]. In addition, the mitochondria also play key roles in lipid metabolism, especially fatty acids, which are required for the biogenesis of lipids (fatty acids, phospholipids) present in the membrane of dendrites and neurons [79]. In contrast, RA is rather known to favor mitochondrial permeability and transition, leading to apoptosis [80].",654b1852-ecf3-4cba-a204-37469f3fc37b
42,methods42," It is therefore suggested that the different impacts of resveratrol (RSV), apigenin (API), and RA at the mitochondrial level, and also probably in other organelles (lysosome, peroxisome) playing key roles in the control of lipid metabolism and the equilibrium between life and death might contribute, at least in part, to the different neuronal differentiation capacities of these different molecules.  5. Conclusions Our data obtained on murine neuroblastoma N2a cells establish that resveratrol (RSV) and apigenin (API) are able to induce neuronal differentiation and favor neurogenesis characterized by neurite outgrowth. Thus, when treated with resveratrol (RSV) and apigenin (API), the differentiated N2a cells are characterized by the presence of dendrites and axons and less frequently by the simultaneous presence of dendrites + axons.",e2fcf138-7b58-4e6c-b220-27bb36c01fdd
43,methods43," These morphological criteria demonstrate that resveratrol (RSV) and apigenin (API) trigger a neuronal differentiation inducing the formation of mature neurons. Since polyphenols also exhibit cytoprotective, mainly anti-oxidant properties on neurodegeneration models [81,82], their cytoprotective and neuron-differentiating properties suggest that these compounds may mimic neurotrophin activities. These data support that micronutrients such as resveratrol (RSV) and apigenin (API), which are widely represented in the Mediterranean diet, could be of interest for the prevention and/or the treatment of neurodegenerative diseases associated with neuronal loss (Alzheimer’s disease, Parkinson’s disease). These data also reinforce the interest of polyphenols for the treatment of major aged-related diseases associated with neurodegeneration (Alzheimer’s disease, Parkinson’s disease) for which the therapeutic arsenal is reduced. ",5ef37aa5-9dba-4574-8235-a90d1bcd3b5a
