,chunk_label,chunk_text,uuid
28,discussion5," Despite our relatively homogeneous study population, we previously detected significant inverse associations between aMEDr and risks of esophageal squamous cell carcinoma, gastric cardia adenocarcinoma (gastric cardia adenocarcinoma (GCA)), and gastric non-cardia adenocarcinoma (gastric non cardia adenocarcinoma (GNCA)) in men in the Netherlands Cohort Study (NLCS) [46], suggesting sufficient contrast. In female Netherlands Cohort Study (NLCS) participants, associations of aMEDr with risks of gastric cardia adenocarcinoma (GCA) and gastric non cardia adenocarcinoma (GNCA) were also inverse, but did not reach statistical significance.  None of the aMEDr components was individually associated with colorectal cancer risk in the present study. Possibly, the individual effects of the aMEDr components were too weak to be detected. Combining these components into a dietary pattern score increases the likelihood that the potentially weak individual effects are being detected.",94855b05-91c9-4a54-8779-07c631b69969
29,discussion6," Furthermore, by investigating the effect of a dietary pattern, one allows for synergistic or antagonistic interactions between the dietary components, and solves confounding and collinearity problems associated with the analysis of single food groups. Finally, the contrast within the study population in terms of overall healthiness of the diet is possibly increased when considering the MD as a whole, which increases the chance of detecting true effects, if present [31, 47, 48].  The potentially distinct etiological backgrounds of tumors arising in the proximal colon, distal colon, and rectum and varying exposures to (carcinogens in) fecal matter across subsites may cause heterogeneous susceptibilities to (lifestyle) risk factors [21, 49].",937d2ba3-b61b-41d0-aa0e-b5d680ad6b31
30,discussion7," Subsite-specific analyses in the National Institutes of Health (NIH)-AARP and Health Professionals Follow up Study (HPFS) cohorts demonstrated that the inverse association between MD adherence and colorectal cancer risk in men was particularly pronounced for distal colon cancer and rectal cancer [13, 20]. However, associations did not seem to differ across the subsites in men in our study. Additionally, there was no clear evidence for heterogeneity across the anatomical subsites in women, both in our cohort and in most previous studies [13, 15, 20].  In women in our cohort, associations between MD adherence and colorectal cancer risk significantly differed across strata of smoking status, with oppositely directed associations being observed in former smokers (inverse) and current smokers (positive). Smoking status did not significantly interact with MD adherence in female participants of the NHS [20]. However, this study did not differentiate between former and current smokers.",1ad3ff9b-fcf4-445a-adb9-1f0cad64de6e
31,discussion8," A possible explanation for the interaction with smoking status that we observed is chance, considering the large number of tests performed. We recommend that the potentially modifying role of smoking status in the association between MD adherence and colorectal cancer risk, as well as underlying mechanisms, are investigated in future studies. Preferably, these studies should be performed separately for men and women, and distinguish between former and current smokers.  Colorectal cancers usually develop slowly over the course of 10–15 years [3], making the prospective design and long duration of follow-up major strengths of the present study. The large number of cases diagnosed during follow-up facilitated the performance of sex-specific analyses for cancers of the colorectum, colon, proximal colon, distal colon, and rectum with acceptable statistical power, while adjusting for relevant confounders.",7232c8d5-648a-4a4b-ba8c-7764abd932e8
32,discussion9," Additionally, associations were estimated within strata of colorectal cancer risk factors, separately for men and women. Since the national population screening program for colorectal cancer in the Netherlands started after the end of follow-up of our study [50], it could not have influenced the results. Despite the high quality of the dietary information, possible measurement error may have attenuated associations. Another limitation is the single measurement of diet and lifestyle factors at baseline. Changes in diet and lifestyle factors during follow-up may have led to non-differential misclassification and attenuated associations. However, the baseline assessment of the Netherlands Cohort Study (NLCS)-food frequency questionnaire (FFQ) has been shown to be capable of ranking subjects according to their nutrient intakes relatively well for over at least 5 years [28].",f485f113-c1e9-4e25-9466-aea6811a1dd3
33,discussion10," Furthermore, associations between aMEDr and colorectal cancer risk were largely similar, and did not significantly differ, across the three periods of follow-up (≤ 2, > 2 to ≤ 10, and > 10 years). Residual confounding by unmeasured factors also cannot be excluded. Lastly, aMEDr assesses the relative level of MD adherence using population-based cut-offs. Therefore, subjects with high scores do not necessarily adhere closely to a traditional MD, particularly in non-Mediterranean study populations.",101aa5df-fd56-488f-afde-e17c42112cad
34,discussion11," Comparison of diets of the Netherlands and Greece using previously reported intake data from the European Prospective Investigation into Cancer and Nutrition (EPIC) cohort [51] showed that mean daily intakes of food groups typically consumed in large amounts in the MD, such as vegetables, fruits, and legumes, were lower in participants of the Dutch European Prospective Investigation into Cancer and Nutrition (EPIC) cohorts (European Prospective Investigation into Cancer and Nutrition (EPIC)-NL) compared to participants of the Greek European Prospective Investigation into Cancer and Nutrition (EPIC) cohort (European Prospective Investigation into Cancer and Nutrition (EPIC)-Greece). Mean daily intakes of vegetables, fruits, and legumes among men were 131 g, 156 g, and 6 g in European Prospective Investigation into Cancer and Nutrition (EPIC)-NL and 269 g, 234 g, and 33 g in European Prospective Investigation into Cancer and Nutrition (EPIC)-Greece, respectively.",ccadd0ae-14c6-471c-8b2d-1700ece6f015
35,discussion12," Among female participants of European Prospective Investigation into Cancer and Nutrition (EPIC)-NL and European Prospective Investigation into Cancer and Nutrition (EPIC)-Greece, mean daily intakes were 128 g and 211 g for vegetables, 183 g and 218 g for fruits, and 4 g and 21 g for legumes, respectively. As expected, meat consumption was higher in Dutch subjects [European Prospective Investigation into Cancer and Nutrition (EPIC)-NL: 141 g (men) and 80 g (women), European Prospective Investigation into Cancer and Nutrition (EPIC)-Greece: 68 g (men) and 35 g (women)] [51]. Regardless of its use of population-based cut-offs, the model fit of aMEDr was generally comparable to that of the absolute WCRF/Akaike’s Information Criterion (AIC)R diet score in our study.  In conclusion, results of this large prospective cohort study do not support the hypothesis that higher MD adherence is associated with a reduced risk of colorectal cancer.",21b990e4-4711-45f3-b523-b106c9bf4b2a
36,discussion13," MD adherence was not significantly associated with the risk of any of the colorectal cancer subsites in both men and women.   Electronic supplementary material Below is the link to the electronic supplementary material. Supplementary material 1 (PDF 528 kb)     Publisher's Note  Springer Nature remains neutral with regard to jurisdictional claims in published maps and institutional affiliations.  Acknowledgements We are indebted to the participants of the Netherlands Cohort Study (Netherlands Cohort Study (NLCS)) and further wish to thank the Netherlands Cancer Registry and the Dutch Pathology Registry. Additionally, Netherlands Cohort Study (NLCS) staff members are acknowledged for their valuable assistance and advice.  Funding This study was funded by Wereld Kanker Onderzoek Fonds Nederland (WCRF-NL), as part of the World Cancer Research Fund International grant program (Grant No. 2015/1390 to P.A. van den Brandt).",bbe32504-562a-4e56-b7ca-7da1d785171b
37,discussion14," WCRF-NL had no role in the design, analysis, or writing of this article.  Compliance with ethical standards Conflict of interest The authors declare that they have no conflict of interest.  Informed consent Individuals invited to participate in the Netherlands Cohort Study (NLCS) received an invitation letter with details on the study and they received the baseline questionnaire, which included an envelope for returning toenail clippings alongside with the questionnaire. Individuals agreed to participate in the Netherlands Cohort Study (NLCS) by means of returning the baseline questionnaire (response rate 35.5%). =",e45f7999-2969-4e33-b27a-497aac52e2b0
