,chunk_label,chunk_text,uuid
0,introduction0,"Globally, colorectal cancer was an important contributor to the total cancer burden in 2018, ranking third and second in terms of incidence and mortality, respectively [1]. The global burden of colorectal cancer is expected to increase even further in the next decade. In 2030, over 2.2 million people are estimated to be diagnosed with colorectal cancer, whereas more than 1.1 million people are expected to die from this disease [2]. Colorectal cancer is a slow-growing disease [3], which offers the opportunity to intervene during the disease development process using preventive measures. These preventive strategies could for instance focus on maintenance of a healthy diet.  The traditional Mediterranean diet (MD), typical for the olive-cultivating areas bordering the Mediterranean basin in the early 1960s, has been associated with a large variety of health benefits, including decreases in all-cause mortality as well as cardiovascular disease risk and mortality [4–8].",95e0717c-9a22-4c65-a952-f6f970b0750d
1,introduction1," This dietary pattern is characterized by the consumption of large quantities of vegetables, legumes, fruits, nuts, whole grains, and olive oil (rich in monounsaturated fatty acids, MUFA). In contrast, intakes of foods from animal origin (e.g. dairy and meat) are low. Finally, wine is consumed in moderate amounts, particularly during meals [4, 5].  The relation between a priori defined MD adherence and colorectal cancer risk has been evaluated in a number of prospective studies so far, with mixed results. Though some studies reported MD adherence to be associated with a significantly reduced colorectal cancer risk [9–12], inverse associations were absent or only observed in specific subgroups in others [13–20]. Additionally, heterogeneity of associations across the sexes and colorectal cancer subsites was indicated [9, 10, 12, 13, 16, 17, 20].  The colorectum can anatomically be divided in the proximal colon, distal colon, and rectum.",a814818a-ae41-4b7f-8c34-b597a41977cd
2,introduction2," Depending on the anatomical subsite, colorectal tumors may develop through distinct molecular pathways and show varying patterns of (epi)genetic changes [21, 22]. Furthermore, differences have been shown in subsite-specific incidence trends and survival [21, 22]. Because of their potentially distinct etiologies, cancers of the proximal colon, distal colon, and rectum should initially be considered as separate endpoints in epidemiological studies.  In the present analysis, we aimed to investigate associations of MD adherence with risks of colorectal cancer and anatomical subsites (colon, proximal colon, distal colon, and rectum) in the prospective Netherlands Cohort Study (Netherlands Cohort Study (NLCS)). The level of MD adherence was assessed using a priori defined MD scores with and without alcohol component. Moreover, associations were estimated separately for men and women. ",40d68897-3e39-47b1-8bb8-f54de374fcfe
3,methods0,"Study population and cancer follow-up The Netherlands Cohort Study (NLCS) was conducted among 58,279 men and 62,573 women, who were aged 55–69 years [23–26]. At baseline (September 1986), information on diet and other cancer risk factors was gathered via a self-administered questionnaire. Data were processed and analysed using the case-cohort method, in which cases are derived from the entire cohort and person-years at risk are estimated based on a subcohort. Therefore, a random subcohort (N = 5000) was selected immediately after baseline and vital status information of subcohort members was acquired biennially [23, 26, 27]. Follow-up for cancer incidence was accomplished via annual record linkage with the Netherlands Cancer Registry and the nationwide Dutch Pathology Registry (Pathology Registry (PALGA)) [24]. The Netherlands Cohort Study (NLCS) was approved by institutional review boards from Maastricht University and the Netherlands Organization for Applied Scientific Research.",db9d934b-0e3b-4a79-806c-d441162c5230
4,methods1,"  After 20.3 years of follow-up, 4084 subcohort members and 3966 cases with incident and microscopically confirmed colorectal cancer (ICD-O-3 codes: C18–C20) were eligible for inclusion in the present analyses (Fig. 1). Eligible study participants did not have a history of cancer at baseline (except skin cancer), had complete and consistent dietary data, and had data available on alcohol consumption and MD adherence.Fig. 1 Flow diagram of the number of participants of the Netherlands Cohort Study, who are eligible for inclusion in the analyses concerning colorectal cancer (case-cohort design). MD Mediterranean diet    Exposure assessment Habitual dietary intake during the year preceding baseline was assessed using a 150-item, semi-quantitative food frequency questionnaire (food frequency questionnaire (FFQ)) [25, 28].",6b9f71c8-2e7b-4741-b709-65da36ddcbc0
5,methods2," Previously, it has been shown that this food frequency questionnaire (FFQ) performed adequately and that dietary habits were reproducible for over at least 5 years [25, 28]. The 1986 Dutch food composition (NEVO) table was used to calculate nutrient intakes from the food frequency questionnaire (FFQ) data [29].  Mediterranean diet adherence MD adherence was assessed using the alternate Mediterranean diet score (aMED), which is a variant of the traditional Mediterranean diet score (tMED) developed by Trichopoulou et al., that was adapted for usage in the United States [30–33]. aMED assesses relative MD adherence based on energy-adjusted mean daily intakes of nine food groups with typically high or low consumption in the MD [32, 33]. Each food group is scored by 0 or 1 points, creating a sum score with a maximum value of 9 points (highest level of MD adherence).",f078a0b0-e53d-4583-b20a-08e100e849b1
6,methods3," Subjects receive 1 point for: high intakes (≥ sex-specific median) of vegetables (excluding potatoes), legumes, fruits, nuts, whole grains, and fish; a high (≥ sex-specific median) MUFA to saturated fatty acid (saturated fatty acid (SFA)) ratio; a moderate alcohol intake (5–25 g/day); and a low intake (< sex-specific median) of red and processed meats [32, 33].  Moderate and heavy alcohol consumption have been associated with an increased colorectal cancer risk [34, 35]. Therefore, MD adherence was also assessed using a reduced variant of aMED (aMEDr) that does not include alcohol and ranges from 0 to 8 points. Because of the positive association between alcohol consumption and colorectal cancer risk, we will concentrate on results obtained using aMEDr in this article. MD score values were grouped into three MD adherence categories [low (0–3), middle (4–5), and high (6–8 (9))] and were continuously modelled per two-point increment [33].",11a50094-06ad-4367-9660-7d10a1d9a12f
7,methods4,"  Statistical analyses Cox proportional hazards analyses were conducted to estimate hazards ratios (HRs) and 95% confidence intervals (95% CIs) for sex-specific associations of MD adherence with incidences of total colorectal cancer and anatomical subsites (colon, proximal colon, distal colon, and rectum). Duration of follow-up was used as time variable and person-years at risk of subcohort members were calculated from baseline until colorectal cancer diagnosis, death, emigration, loss to follow-up, or end of follow-up, whichever came first. To account for the increased variance inherent to the case-cohort design, we estimated standard errors using the robust Huber–White sandwich estimator [36]. Scaled Schoenfeld residuals tests and –ln(–ln) survival plots confirmed that it was appropriate to assume proportionality of hazards for the exposure variables [37].  MD scores were included as categorical and continuous terms in age- and multivariable-adjusted Cox models.",a444e822-a406-49fd-a14b-68532fa71864
8,methods5," Based on the literature, we included the following predefined confounders in the multivariable-adjusted models: age at baseline, cigarette smoking behaviour (status, frequency, and duration), body mass index (body mass index (BMI)), alcohol consumption (except for models containing the original aMED including alcohol), total daily energy intake, highest level of education, non-occupational physical activity, and family history of colorectal cancer. Other covariates considered were height, history of diabetes, history of chronic bowel irritation, use of hormone replacement therapy (women only), and long-term use of non-steroidal anti-inflammatory drugs. These factors did not change the HR estimates of aMEDr ≥ 10% and were therefore not included in the final model.  P values for trends over the MD adherence categories were obtained by appointing sex-specific median MD score values among subcohort members to each category and fitting these as continuous terms in Cox regression models.",282e1c34-338d-416f-8165-638bcf2d6a9c
9,methods6," Performances of models including MD score variants with and without alcohol (aMED and aMEDr, respectively) were compared using Akaike’s Information Criterion (Akaike’s Information Criterion (AIC)) [38]. Statistical significance of differences in associations with aMEDr across the anatomical locations of colorectal cancer (colon, proximal colon, distal colon, and rectum) was tested using a competing risks procedure, by which standard errors were estimated using a bootstrapping method developed for the case-cohort design [39, 40].  Stratified analyses were performed to evaluate associations of aMEDr with colorectal cancer risk across levels of cigarette smoking status, alcohol consumption, body mass index (BMI), educational level, and family history of colorectal cancer. Interaction terms between aMEDr and these potential effect modifiers were added to the models to test the statistical significance of potential differences.",f120593d-dd8b-4511-b4e7-7cf4cddb9c41
10,methods7," To test the sensitivity of our results, analyses were repeated excluding the first 2 years of follow-up. Furthermore, the total follow-up time was divided into three periods (≤ 2, > 2 to ≤ 10, and > 10 years).  As an additional sensitivity analysis, we compared the population-dependent aMED to the absolute WCRF/Akaike’s Information Criterion (AIC)R diet score, which is based on the dietary recommendations for cancer prevention issued by the World Cancer Research Fund/American Institute for Cancer Research (WCRF/Akaike’s Information Criterion (AIC)R) in 2007 [41].",9fad9bac-a99d-4e9b-9571-a722795c68b8
11,methods8," Our WCRF/Akaike’s Information Criterion (AIC)R diet score is based on the WCRF/Akaike’s Information Criterion (AIC)R score developed in the European Prospective Investigation into Cancer and Nutrition (European Prospective Investigation into Cancer and Nutrition (EPIC)) cohort [42, 43] and operationalizes the recommendations concerning foods and drinks that promote weight gain, plant foods, red and processed meats, (alcohol), and salt. A detailed description of the calculation of the score has been published previously [44]. Score variants were created including and excluding the alcohol recommendation, resulting in sum scores ranging from 0 to 4 (or 5 when including alcohol) points with higher values reflecting closer adherence to the WCRF/Akaike’s Information Criterion (AIC)R dietary recommendations.",885c4217-1740-4fdf-8812-b5a603ef0b3d
12,methods9," Cox regression analyses were performed to estimate multivariable-adjusted associations of the WCRF/Akaike’s Information Criterion (AIC)R diet scores (per SD-increment) with risks of colorectal, colon, and rectal cancer. A similar approach was applied to the aMED indices to be able to compare model performances of both scores using Akaike’s Information Criterion (AIC). Statistical analyses were conducted using Stata (version 15). Statistically significant results had a two-sided P value below 0.05. ",705e3f80-d58c-4e85-bc66-2b92e5bc6692
13,results0,"Sex-specific median daily intakes of the aMEDr components among subcohort members are displayed in Table 1. As expected, median daily intakes of beneficial components increased with higher levels of MD adherence, whereas the opposite was observed for the intake of red and processed meats. Alcohol consumption was constant over the aMEDr categories in men, whereas in women slightly higher intakes were observed with closer adherence to the MD. Distributions of potential (colorectal) cancer risk factors (e.g. smoking status, body mass index (BMI), and physical activity) over the aMEDr categories in the Netherlands Cohort Study (NLCS) subcohort have been described in detail previously [45]. Comparing the highest to the lowest aMEDr category, subcohort members adhering more closely to the MD were less likely to smoke at baseline, had a lower body mass index (BMI), and were more physically active.",fd6904a5-eb7d-4ea7-8c37-06b6d6205c71
14,results1," Generally, comparable levels of MD adherence were observed among colorectal cancer cases and subcohort members of both sexes, with mean aMEDr values of approximately 4 (Table 2). Considering other baseline characteristics, male and female colorectal cancer cases were more often former smokers compared to subcohort members, but less often current smokers (except female rectal cancer cases, Table 2). Additionally, levels of physical activity and alcohol consumption were higher in male, but lower in female, colorectal cancer cases. Furthermore, colon cancer cases were more likely to be highly educated than subcohort members (men only), whereas the opposite was observed for rectal cancer cases. Finally, colorectal cancer cases of both sexes more frequently reported a family history of this disease.",0f5b437f-51be-45fd-a1f8-66af4384be6d
15,results8,"07)	 aMED alternate Mediterranean diet score, PYsubcohort person-years in the subcohort, aMEDr alternate Mediterranean diet score without the alcohol component  aAdjusted for age at baseline (years), cigarette smoking status (never, former, current), cigarette smoking frequency (cigarettes smoked per day, centered), cigarette smoking duration (years, centered), body mass index (kg/m2), alcohol consumption (0, > 0 to < 5, ≥ 5 to < 15, ≥ 15 to < 30, ≥ 30 g/day), daily energy intake (kcal), highest level of education (primary school or lower vocational, secondary school or medium vocational, higher vocational or university), non-occupational physical activity (≤ 30, > 30 to ≤ 60, > 60 to ≤ 90, > 90 min/day), and family history of colorectal cancer (no, yes)  bNot adjusted for alcohol consumption    In men, aMEDr was not significantly associated with colorectal cancer risk in categorical and continuous analyses [HRper two-point increment (95% CI) 1.04 (0.95–1.13)] (Table 3).",d260718a-af84-4c45-a6f0-3bb16e1d2c08
16,results9," Subsite-specific HR estimates per two-point increment in aMEDr (all not statistically significant) ranged from 0.98 for distal colon cancer to 1.11 for rectal cancer and did not significantly differ [Pheterogeneity: 0.566 (proximal vs. distal colon) and 0.518 (colon vs. rectum)]. Similar to men, no significant association was observed between aMEDr and colorectal cancer risk in women [HRper two-point increment (95% CI) 0.97 (0.88–1.07)] (Table 3). However, middle vs. low aMEDr values were associated with a borderline significantly reduced colorectal cancer risk [HR (95% CI) 0.86 (0.73–1.00)]. Though subsite-specific associations were all not statistically significant and there was no evidence of heterogeneity [Pheterogeneity: 0.690 (proximal vs. distal colon) and 0.194 (colon vs. rectum)], results suggested a weak inverse association between aMEDr and rectal cancer risk in women [HRper two-point increment (95% CI) 0.91 (0.76–1.08)].",a2fe4d9e-c2fc-4fd2-8f8d-ce645180af94
17,results10," Comparable results were obtained for the original aMED including alcohol in both men and women (Table 3). For colorectal cancer risk, inclusion of alcohol in the MD score resulted in a worse model fit.  Associations of aMEDr with colorectal cancer risk in women differed statistically significantly across strata of smoking status (Pinteraction = 0.015, Table 4). In female ex-smokers, increasing aMEDr values were associated with a significantly reduced colorectal cancer risk [HRper two-point increment (95% CI) 0.78 (0.63–0.98)]. In contrast, a positive association was suggested in female current smokers, with a significant positive trend over the aMEDr categories (Ptrend = 0.04, data not shown). Finally, there was no evidence of an association in women who had never smoked.",b83b4827-1bc5-4105-9019-9006d81b9226
18,results11," No significant interactions were observed between aMEDr and other potential colorectal cancer risk factors (alcohol consumption, body mass index (BMI), educational level, and family history of colorectal cancer) in men and women, or smoking status in men (Table 4). Simultaneous inclusion of all aMEDr components as dichotomous variables in multivariable-adjusted models showed that none of the individual components was significantly associated with colorectal cancer risk (data not shown). Associations were comparable after exclusion of the first 2 years of follow-up and did not significantly differ across the three follow-up periods (data not shown).Table 4 Sex-specific and multivariable-adjusted associations of aMEDr (per two-point increment) with colorectal cancer risk for various subgroups in the Netherlands Cohort Study  	Colorectal cancer	 Men	Women	 Cases	HR (95% CI)a,b	Cases	HR (95% CI)a,b	 Cigarette smoking statusc	  Never	256	1.11 (0.87–1.41)	915	1.00 (0.88–1.",b07ebb29-90d2-4bfb-a3bc-178f65b29ec9
19,results13,"423	 aMEDr alternate Mediterranean diet score without the alcohol component  aAll HRs were estimated per two-point increment in aMEDr  bAdjusted for age at baseline (years), cigarette smoking status (never, former, current), cigarette smoking frequency (cigarettes smoked per day, centered), cigarette smoking duration (years, centered), body mass index (kg/m2), alcohol consumption (0, > 0 to < 5, ≥ 5 to < 15, ≥ 15 to < 30, ≥ 30 g/day), daily energy intake (kcal), highest level of education (primary school or lower vocational, secondary school or medium vocational, higher vocational or university), non-occupational physical activity (≤ 30, > 30 to ≤ 60, > 60 to ≤ 90, > 90 min/day), and family history of colorectal cancer (no,",33239ec0-1b20-49a5-9fad-d163b06476a1
20,results14," yes)  cNot adjusted for cigarette smoking status  dP values for interaction were obtained by testing the statistical significance of interaction terms between aMEDr and the stratifying covariates in multivariable-adjusted models  eNot adjusted for alcohol consumption  fNot adjusted for body mass index  gNot adjusted for highest level of education  hNot adjusted for family history of colorectal cancer    Like the population-dependent aMED indices, the absolute WCRF/Akaike’s Information Criterion (AIC)R diet scores (including and excluding alcohol) were not significantly associated with risks of colorectal, colon, and rectal cancer in men and women (Table 5). Performances of models containing aMED indices and WCRF/Akaike’s Information Criterion (AIC)R diet scores were mostly comparable.",67e9bc80-f5f4-4514-8af7-043a73b89ef0
21,results16,"19)	0.97 (0.90–1.05)	0.98 (0.90–1.07)	0.92 (0.80–1.06)	 WCRF/Akaike’s Information Criterion (AIC)R World Cancer Research Fund/American Institute for Cancer Research, aMED alternate Mediterranean diet score, PYsubcohort person-years in the subcohort, aMEDr alternate Mediterranean diet score without the alcohol component  aHRs were estimated per SD-increment in the scores  bAdjusted for age at baseline (years), cigarette smoking status (never, former, current), cigarette smoking frequency (cigarettes smoked per day, centered), cigarette smoking duration (years, centered), body mass index (kg/m2), alcohol consumption (0, > 0 to < 5, ≥ 5 to < 15, ≥ 15 to < 30, ≥ 30 g/day), daily energy intake (kcal), highest level of education (primary school or lower vocational, secondary school or medium vocational, higher vocational or university), non-occupational physical activity (≤ 30, > 30 to ≤ 60, > 60 to ≤ 90, > 90 min/day), and family history of colorectal cancer (no,",f1f5e3c2-b407-4181-acaf-3bcdee16c84a
22,results17, yes)  cA lower number of subjects could be included in these analyses as a result of missing values for salt intake  dScore based on the WCRF/Akaike’s Information Criterion (AIC)R dietary recommendations to prevent cancer issued in 2007  eNot adjusted for alcohol consumption   ,6ed7bcc7-5b70-49b9-b0c8-9e64be4c8e6a
23,discussion0,"In this prospective cohort study, a priori defined MD adherence, assessed by aMEDr, was not significantly associated with colorectal cancer risk. Associations were absent for all investigated anatomical subsites and in both men and women. The association between aMEDr and colorectal cancer risk in women was significantly modified by smoking status (Pinteraction = 0.015). A significant inverse association was observed in female ex-smokers, whereas a positive association was suggested in female current smokers. For colorectal cancer risk, the best model performance was obtained when alcohol intake was not included in the MD score.  Various prospective cohorts have investigated the relation of a priori defined MD adherence with colorectal cancer risk and indicated disparate associations for men and women. In men, higher MD adherence has fairly consistently been associated with a reduced colorectal cancer risk (but not always significant) [9, 10, 13, 16, 17, 20].",dc93a713-c152-4199-b00f-eb8c0c0dc60c
24,discussion1," For example, in male participants of the Multiethnic Cohort Study (Multiethnic Cohort Study (MEC)), the National Institutes of Health (National Institutes of Health (NIH))-AARP Diet and Health Study, and the Health Professionals Follow-up Study (Health Professionals Follow up Study (HPFS)), statistically significant HR estimates of 0.84, 0.72, and 0.80, respectively, were obtained when comparing high to low aMED values [13, 16, 20]. Furthermore, high compared to low MD adherence (modified Mediterranean diet score) was associated with a non-significantly reduced colorectal cancer risk in the male part of the European Prospective Investigation into Cancer and Nutrition (EPIC) cohort [HR (95% CI) 0.89 (0.76–1.04)] [10]. With some exceptions [9, 12], studies in women did not support the presence of an inverse association between MD adherence and colorectal cancer risk [10, 13, 15–18, 20]. For comparison, non-significant HR estimates of 0.96 (Multiethnic Cohort Study (MEC)), 0.",f3a57ac8-c276-4d47-b30b-9ad8e0bb7ce8
25,discussion2,"89 (National Institutes of Health (NIH)-AARP), 0.99 (Nurses’ Health Study, NHS), and 0.88 (European Prospective Investigation into Cancer and Nutrition (EPIC)), were reported for high vs. low MD adherence in female participants of the abovementioned studies [10, 13, 16, 20]. In the present analysis of the Netherlands Cohort Study (NLCS), a priori defined MD adherence was not associated with a significantly decreased risk of colorectal cancer in both sexes. Similar to our analysis, the majority of the previously conducted studies used aMED (variants) to assess MD adherence. However, the particular food items included in the aMED components may have differed between studies, which could (partly) explain the contrasting results that we observed for men in our cohort.",2fec64f4-f3e8-4bb7-b282-e6354c3a63d4
26,discussion3," Additionally, the more homogenous nature of the Netherlands Cohort Study (NLCS) study population may have resulted in relatively small contrasts in absolute food intakes between subjects in the highest and lowest adherence categories making it more difficult to detect potentially beneficial effects of the MD on health outcomes. Median daily intakes among male Netherlands Cohort Study (NLCS) subcohort members in the highest and lowest aMEDr categories were for example 266 g and 177 g for vegetables, 230 g and 120 g for fruits, and 101 g and 139 g for red and processed meats, respectively. In male participants of the Health Professionals Follow up Study (HPFS) [20], the mean numbers of servings per day in the highest and lowest aMED quintiles were 4.9 and 2.0 for vegetables, 2.6 and 0.8 for fruits, and 0.7 and 1.2 for red and processed meats. We calculated ratios comparing median/mean intakes in the highest and lowest MD categories.",d9663ab4-e092-4aa1-ad93-a71fcfd96c75
27,discussion4," The ratios showed clearly higher contrasts in intakes of vegetables and fruits in the Health Professionals Follow up Study (HPFS) [vegetables: 1.5 (Netherlands Cohort Study (NLCS)) vs. 2.5 (Health Professionals Follow up Study (HPFS)), fruits: 1.9 (Netherlands Cohort Study (NLCS)) vs. 3.3 (Health Professionals Follow up Study (HPFS))]. The contrast in the intake of red and processed meats was comparable in both cohorts [0.7 (Netherlands Cohort Study (NLCS)) vs. 0.6 (Health Professionals Follow up Study (HPFS))]. We were forced to compare median daily intakes in the Netherlands Cohort Study (NLCS) with mean numbers of servings per day in the Health Professionals Follow up Study (HPFS), because there were no other data available.",6b966c92-1a38-4a8d-87cc-fa27f18d3103
