,chunk_label,chunk_text,uuid
27,discussion3," However, in adult women, healthful dietary patterns are associated with less body mass index (BMI) gain over time [26], especially in genetically susceptible individuals [44]. Thus, it is likely that healthful maternal dietary patterns exert positive effects on offspring weight outcomes through a healthier maternal weight status before pregnancy. Indeed, in the present analysis, the inverse association between the aMED and Dietary Approach to Stop Hypertension (DASH) with offspring overweight risk was no longer observed after adjusting for maternal body mass index (BMI) and lifestyle factors before pregnancy. In addition, a previous study has shown that adherence to healthful dietary patterns as part of an overall healthy lifestyle before pregnancy is associated with a lower risk of gestational diabetes [45] and offspring obesity risk [14].",9d246f4c-48c0-473e-83ec-4a805b4cb0b6
28,discussion4,"  In the present study, we have focused on these well-validated healthful dietary patterns, but results might differ for maternal dietary patterns that are particularly “obesogenic” or for Western dietary patterns that are especially high in saturated fat or added sugars. For example, among the single nutrients that are currently suspected to be involved in prenatal programming of obesity are prenatal sugar and saturated fat intake [18], dietary glycemic index and glycemic load [19], dihomo-gamma-linolenic acid [46] and protein intake from animal sources [20]. Furthermore, associations between higher maternal intakes of sugar-sweetened beverages [21, 47] and higher offspring body mass index (BMI) have also been reported. Murrin et al.",f3499a19-9ff5-40cc-bb2c-d01627fc7235
29,discussion5," [18] showed that a dietary pattern scoring higher in processed foods during pregnancy, comprising of soft drinks, chips, roast potatoes, crisps, pizza, processed meat, sweets and chocolate, was significantly associated with offspring overweight and obesity at the age of 5 years.  We also examined birth weight as an outcome and did not find any associations between maternal diet quality score during the period surrounding pregnancy and offspring birth weight. In line with the published literature, studies on healthy dietary patterns, including the HEI and Mediterranean diet, generally report a lack of an association between maternal diet quality indices and offspring birth weight [28, 48, 49]. However, Rodríguez-Bernal et al. [28] observed an association between the HEI-2010 with higher fat mass but not fat-free mass or overall birth weight, thus an association with neonatal adiposity.",f246a6a6-2be4-4b49-8e0a-309a33e45783
30,discussion6," The Growing Up in Singapore Towards healthy Outcomes cohort study came to the same conclusion; a higher maternal diet quality during pregnancy as measured by the HEI was associated with longer birth length and lower neonatal adiposity but not with birth weight and preterm birth [49].  Our study has several strengths, including the rather large sample size, the longitudinal follow-up of both mothers and their children, the availability of maternal dietary assessments via food frequency questionnaire (FFQ), and well phenotyped maternal profiles in terms of their lifestyle and other risk factors before and surrounding the time of pregnancy. No study to date has examined maternal dietary patterns in relation to offspring weight beyond childhood; the long follow-up of the children covering the ages between 12 and 23 years is therefore novel.",37fd8a3d-fb69-4448-aaa2-9c3361bfa6d3
31,discussion7," The use of the diet quality indices can be seen as an advantage because they capture overall diet quality taking into account the complex nature of the habitual diet [23]; however, any potential effects of individual dietary components [50] could be cancelled out by opposing effects of individual nutrients or food groups.  There are some important study limitations to note. The food frequency questionnaire (FFQ) was not modified for use during pregnancy and it was not necessarily administered during pregnancy; we only selected mother–child pairs where at least a part of the pregnancy was covered by the 12 months period the food frequency questionnaire (FFQ) was enquiring about. Although it has been suggested that dietary patterns change little from before to during pregnancy [51], we cannot exclude the possibility that maternal dietary patterns have changed during pregnancy in our population.",5b56043e-ff71-4d4c-8c3b-6a31bae3df21
32,discussion8," Our study population was comprised of predominantly white US nurses of a slightly higher socioeconomic status than the general population. Mothers in our study sample were in their early thirties when they gave birth, which is slightly above the national average birth age. Thus, our results might not be generalizable to other ethnic or socioeconomic groups, younger mothers or populations where malnutrition is still common.  Further, while we had detailed information on maternal factors that could potentially confound our results, we had no information on paternal factors, with the exception of their education—though husband’s education is considered one of the strongest proxies for socioeconomic status of the family. The influence of paternal dietary patterns in relation to pregnancy and offspring outcomes represents a novel topic warranting future investigation [52]. All weight measures were self-reported in our study.",fbf57cb8-351b-4687-a404-09f05ce4ec54
33,discussion9," Comparisons of measured versus self-reported weight and height in US adolescents suggest a slight tendency for underreporting among adolescents with obesity [53–55]. Such misclassification, if it does exist, might have contributed to an attenuation of the associations examined. We also acknowledge the lack of more detailed adiposity measures as another limitation of this study.  Finally, moderate alcohol intake is considered healthy as a part of an overall healthy dietary pattern and therefore scored positively in the aMED and aHEI [36]. This scoring is contradictory to current dietary guidelines that recommend pregnant women to completely abstain from alcohol [56, 57]. The associations for alcohol and nutritional behaviors are difficult to disentangle, because moderate alcohol drinkers have healthier diets compared to heavy drinkers and abstainers, while heavy drinkers are more often characterized by higher intakes of high-fat meat and lower intake of cereals and fruit [58].",e2ee31f7-2c60-42a1-a556-eb28592857ca
34,discussion10," This clustering of health behaviors has been shown to persist into pregnancy, i.e. light-to-moderate alcohol consumption is associated with adherence to health conscious dietary patterns, while higher alcohol intake and binge drinking is related to higher intake of processed foods during pregnancy [59]. It is an advantage of the dietary pattern analysis to parallel more closely the real world, and take into account complex combinations of nutrients and possible joint and interactive effects [23]. Nonetheless, we conducted a sensitivity analysis among non-drinkers, and associations between adherence to healthful dietary patterns during peripregnancy and offspring risk of overweight were unchanged.  In conclusion, in this well characterized mother–child cohort, we did not find any evidence for an impact of healthful maternal dietary patterns during the period surrounding pregnancy on weight outcomes in their offspring during childhood through early adulthood.",0e6d80c2-a7a2-46f7-bf14-4a4e3a8c1cfb
35,discussion11, Maternal body mass index (BMI) and maternal lifestyle factors prior to pregnancy appeared to be confounders in these associations. Further studies on maternal nutrition during pregnancy and offspring health are warranted in different populations so that women of reproductive age can be provided with evidence-based dietary recommendations that may help to reduce the risk of overweight in their children during later life.  Electronic supplementary material Below is the link to the electronic supplementary material.,79b0c286-beaa-47aa-b25a-5f924904e146
36,discussion12,"Supplementary material 1 (DOCX 25 kb)     Abbreviations Alternate Healthy Eating Index (AHEI)Alternate Healthy Eating Index  aMEDAlternate Mediterranean Diet  body mass index (BMI)Body mass index  CIs95% confidence intervals  Dietary Approach to Stop Hypertension (DASH)Dietary Approach to Stop Hypertension  food frequency questionnaire (FFQ)Food frequency questionnaire  Growing Up Today Study II (GUTSII)Growing Up Today Study II  MDMean differences  MVMultivariable  Nurses’ Health Study II (NHSII)Nurses’ Health Study II  RRsRelative risks  USUnited States  Susanne Strohmaier and Leonie Helen Bogl are contributed equally to this work.  Publisher's Note  Springer Nature remains neutral with regard to jurisdictional claims in published maps and institutional affiliations.  Acknowledgement Open access funding provided by Medical University of Vienna. We thank the thousands of participants in the Growing Up Today Study as well as their mothers, participants of the Nurses’ Health Study II.",cab0cf34-33df-4b26-a306-bc047a723a94
37,discussion13,"  Author’s contribution ES, SS and LHB were responsible for the concept and design of the study. SS performed the statistical analysis under the supervision of ES, SS and LHB wrote the first draft of the manuscript. All authors critically reviewed the manuscript and gave their consent for submission.  Funding This study was supported by the National Cancer Institute grant U01 CA176726. LHB would kindly like to acknowledge the funding from the Austrian Science Fund (from the Austrian Science Fund (FWF)): M 2449. The funding sources had no role in the design and conduct of the study; collection, management, analysis, and interpretation of the data; preparation, review, or approval of the manuscript; and decision to submit the manuscript for publication.  Compliance with ethical standards Conflict of interest No conflict of interest was declared. =",552279d9-dc59-4b3f-893e-14d0c0f01d82
