,chunk_label,chunk_text,uuid
0,introduction0,"The United States has one of the highest childhood obesity prevalence in the world, with about 1 in 3 children and adolescents classified as having overweight and 1 in 6 as having obesity [1]. Due to the numerous negative health consequences of childhood obesity, such as increased morbidity and mortality in adult life, it represents one of the most serious public health challenges of the 21st century [2].  While it is known that genetics and the environment are related to the development of obesity [3], more research is needed to better understand the mechanisms involved in the development of obesity. With regard to environmental factors, suboptimal intrauterine conditions during sensitive periods of development have been suggested to permanently influence long-term disease risk in the offspring, including obesity and metabolic disease [4–7].",623a9538-dad3-4e22-837e-5def6d7131ec
1,introduction1," Perhaps the most influential human studies have been on the Dutch famine, clearly demonstrating that men and women conceived during the Dutch Hunger Winter in 1944–1945 who had been exposed to the famine during the first half of pregnancy had higher rates of obesity in adulthood [8, 9]. However, food shortages are currently not a persistent problem in industrialized countries, where an ever-increasing number of women enter pregnancy overweight or obesity [10, 11]. While research on maternal health behaviors during pregnancy and offspring health outcomes is still in its infancy, the findings so far suggest that a higher maternal pre-pregnancy body mass index (body mass index (BMI)) [12], excess gestational weight gain [12], gestational diabetes mellitus [13], and an unhealthy maternal lifestyle before pregnancy [14] increase the long-term risk of overweight and obesity in their offspring.",15fcc767-8e9b-4984-bfdd-603288fa6d9c
2,introduction2,"  One additional maternal factor that might influence overweight and obesity risk in the offspring is maternal dietary intake during pregnancy. Animal models conducted under isocaloric conditions have shown that maternal high-protein [15] or high-fat intake [16] during critical periods of fetal development can “program” the offspring for a range of long-term metabolic consequences, including, for example, obesity, insulin resistance and decreased total energy expenditure.  Experimental studies suggest that moderate changes in maternal nutrition around the time of conception could signal life-long epigenetic changes in genes regulating energy balance in the hypothalamus [17], lending biological plausibility to the effects of early-life nutrition on offspring weight outcomes.",6113fcc9-fa17-43a2-97c4-feb172fb7c99
3,introduction3,"  While certain individual nutrients and food groups during pregnancy have previously been associated with adiposity risk in the offspring [18–22], research has shifted towards dietary pattern approaches that take into account the potential interactions and synergies of nutrients within the habitual diet [23]. To measure the healthfulness of dietary patterns, three commonly used scores are the Alternate Healthy Eating Index 2010 (Alternate Healthy Eating Index (AHEI)), the Alternate Mediterranean Diet (aMED), and the Dietary Approach to Stop Hypertension (Dietary Approach to Stop Hypertension (DASH)) [24]. Adherence to healthful dietary patterns, as assessed by these three diet quality scores, has been associated with less weight gain, especially in younger women and individuals with overweight [25, 26].  Some initial studies have also explored maternal healthful dietary patterns in relation to pregnancy outcomes and offspring health, describing associations with lower risk of e.g.",c7a3a3ea-62dd-45d9-95ba-932671a974cf
4,introduction4,", gestational diabetes mellitus [27] or delivering a fetal growth-restricted infant [28]. However, previous studies did not find consistent associations between maternal healthful dietary patterns during pregnancy and childhood overweight risk in 4–10 year old children [29–31]. No study, to our knowledge, has examined maternal dietary patterns in relation to offspring weight beyond that age range. To address this research gap, we examined whether a higher adherence to healthful dietary patterns during and around pregnancy is related to a lower overweight risk in their offspring during childhood through early adulthood. ",69b7a27c-c6cf-4414-82b6-75fafa5f3e6f
5,methods0,"Study population For the present analysis, we utilized information on mother–child pairs; mothers were enrolled in the Nurses’ Health Study II (Nurses’ Health Study II (NHSII)) and their offspring participated in the Growing Up Today Study II (Growing Up Today Study II (GUTSII)). Nurses’ Health Study II (NHSII) was established in 1989, when 116,429 female nurses in the US, aged 25–42 responded to an initial questionnaire regarding their lifestyle and health. The study is still ongoing and follow-up questionnaires are mailed biennially to collect updated information on risk factors and major diseases. Growing Up Today Study II (GUTSII) started in 2004, when 17,280 children born between 1987 and 1995 to Nurses’ Health Study II (NHSII) participants, received invitation letters and questionnaires, after obtaining maternal consent.",8b5ab862-68df-4ec4-8631-3e9d7528c66f
6,methods1," A total of 10,918 children completed the original questionnaire and were sent follow-up questionnaires on health, lifestyle and growth indicators in 2006, 2008, 2011 and 2013. The current study comprises all mother–child pairs where the mothers completed a dietary assessment in 1991 as part of the Nurses’ Health Study II (NHSII) study and the food frequency questionnaire (FFQ) covered at least part of the pregnancy with their child who eventually joint Growing Up Today Study II (GUTSII); thus reducing the sample to 2729 mother–child pairs (see exclusion details below). The study has approval from the Committees on the Use of Human Subjects in Research at the Brigham and Women’s Hospital and the Harvard T.H. Chan School of Public Health (Boston, MA, USA). Returning the baseline self-administered questionnaire was assumed to imply informed consent in both cohorts.",4860115c-1bd7-42d2-87d7-4939ff4fa273
7,methods2,"  Ascertainment of dietary patterns among mothers Information on maternal dietary intake was collected for the first time in 1991 (and every 4 years thereafter) using a validated 131-item semi-quantitative food frequency questionnaire (food frequency questionnaire (FFQ)) asking about a mother’s usual diet over the past 12 months. Briefly, a commonly used unit or portion size (e.g. piece, or oz.) was specified for each food and women were asked to report how often, on average, they consumed each type of food or beverage over the past year, with response options ranging from ‘never or less than once per month’ to ‘6 or more times per day’. Nutrient intakes were calculated by multiplying the frequency of intake for each food item by its nutrient content and summing nutrient contributions across all food items. A nutrient database derived from the US Department of Agriculture served as a source for the nutrient content of each food item [32].",8b58bcd9-eb75-4261-acfa-9be75e4da30b
8,methods3," Validation studies comparing intakes assessed by questionnaire with multiple diet records showed that this food frequency questionnaire (FFQ) provides reasonable valid estimates for intakes of a wide range of dietary variables, with mean correlations coefficients of around 0.5 for different foods and nutrients [33–35]. Based on the food frequency questionnaire (FFQ) information we could calculate scores that capture adherence to the Alternate Healthy Eating Index (AHEI), the aMED and Dietary Approach to Stop Hypertension (DASH) dietary patterns. For all 3 dietary patterns, higher scores represent higher adherence to the particular dietary pattern.  The Alternate Healthy Eating Index (AHEI) was based on a comprehensive literature review and includes foods and nutrients that have consistently been associated with lower chronic disease risk [36]. In total, the intakes of 11 components are included and each component is scored from 0 (worst) to 10 (best).",6e7d978e-9323-4327-81e4-3f13670f4f1a
9,methods4," For 6 components (vegetables excluding potatoes, fruit, whole grains, nuts and legumes, long-chain omega-3 fats, polyunsaturated fat) higher intakes obtain higher scores while for 4 components (sugar-sweetened beverages and fruit juice, red/processed meat, trans fat and sodium) lower intakes obtain higher scores. For alcohol, moderate intakes were scored highest. All the component scores are summed to obtain a total Alternate Healthy Eating Index (AHEI) score, which ranges from 0 to 110.  The aMED score was adapted for the US population from a previously published pattern by Trichopoulou et al. [37], based on the traditional Mediterranean diet. It was derived based on the following 9 components: vegetables (excluding potatoes), legumes, fruit, nuts, whole grains, red and processed meat, fish, alcohol, and the monounsaturated-to-saturated fat ratio. Participants were given 1 score point for being below the median intake for red and processed meat.",3c87da69-aac6-483a-8253-c874bb0764a3
10,methods5," For alcohol, one point was assigned if the intake was within the range of 5–15 g/d. For the remaining items, one point was given if the intake was above the median intake. Otherwise, they received 0 points. The components scores are summed and total aMED scores range from 0 to 9 [38].  The Dietary Approach to Stop Hypertension (DASH) score was developed based on foods that were either emphasized or discouraged in the Dietary Approach to Stop Hypertension (DASH) trial, originally put forth by Sacks et al. [39] for the reduction of blood pressure. The points for each of the 8 components were based on the participant’s quintile ranking. For fruits, vegetables, nuts and legumes, low-fat dairy and whole grains, participants in the lowest quintile were awarded one point and those in the highest quintile were awarded 5 points. For sodium, red and processed meat, and sugar-sweetened beverages the scoring was reversed.",bea7dc7a-cedc-4c33-93e0-1334997550d4
11,methods6," Again, the individual component scores are summed to give an overall Dietary Approach to Stop Hypertension (DASH) score with a possible range from 8 to 40.  Ascertainment of weight outcomes among offspring Offspring birth weight was collected on the Growing Up Today Study II (GUTSII) mothers’ questionnaire in 2009. The validity of maternal recall of offspring birth weight recall was found to be excellent [40]. In the 2004 Growing Up Today Study II (GUTSII) baseline questionnaire, participants, then aged 10–17, were asked to recall their body size at age 5. They were presented with eight pictograms (‘somatotypes’) and asked to select the one that would most accurately represent their body shape within a range from 1 = most lean to 8 = most obese. For the purpose of our analyses, we created a binary outcome, defining children with a reported body shape larger than the median of the distribution as cases.",18dfe026-c470-44d0-b095-b0f6cb001569
12,methods7," Further, self-reports on offspring weight and height were collected on each Growing Up Today Study II (GUTSII) follow-up questionnaire. Definitions for normal weight, overweight and obesity throughout follow-up were based on the age-and sex specific cutoffs from the International Obesity Task Force for participants aged 18 years or younger [41]. Beyond age 18, definitions were based on the standard World Health Organization cutoffs (i.e., body mass index (BMI) between 25 and 29.9 kg/m2 overweight and body mass index (BMI) > 30 kg/m2 obesity). We considered the outcome ‘ever having overweight or obesity’ and the more severe outcome ‘ever having obesity’ by defining participants as cases if they ever fell into the described categories at any given time during follow-up [14].  Ascertainment of covariates Total energy intake was derived from the food frequency questionnaire (FFQ), described above.",a483b4c6-ce1a-4b85-a2b4-f3060008db44
13,methods8," Maternal age at birth of the included child was calculated based on mother’s and child´s birth dates. Smoking status and physical activity before pregnancy were based on the information given on the 1989 Nurses’ Health Study II (NHSII) questionnaire. Likewise, pre-pregnancy body mass index (BMI) was based on height and weight measures reported in 1989 for women who were not pregnant at the time of the questionnaire return. Husband’s education, asked in 1999, was considered a proxy for socioeconomic status. Information related to the individual pregnancies was obtained from the lifetime pregnancy assessment in 2009, particularly the number of previous pregnancies, pregnancy-related hypertension, pre-eclampsia, gestational diabetes, mode of delivery, gestational age at delivery and pregnancy multiplicity. If mothers did not return the 2009 questionnaire, a missing indicator was introduced.",51e993bf-2d7a-4609-946d-d65c3bfb059d
14,methods12,"5)	 Alternate Healthy Eating Index (AHEI), Alternative Healthy Eating Index; aMed alternate Mediterranean; Dietary Approach to Stop Hypertension (DASH), Dietary approaches to stop hypertension; SD, standard deviation  aFor simplicity, only quintiles 1, 3 and 5 are shown, Q1 refers to the lowest and Q5 to the highest diet quality. bRecorded on the most recent questionnaire prior to conception of first included offspring. cPercentages are of non-missing values. dRecorded as part of food frequency questionnaire in 1991  Table 2 Relative risks (RR) and 95% confidence intervals (95% CI) for offspring ever having overweight or obesity during follow-up across quintiles of maternal dietary patterns during peripregnancy using data from 2702 participants of the Growing Up Today Study 2 from 2004 to 2013, restricted to singleton births  	Q1	Q2	Q3	Q4	Q5	P trend	 Alternate Healthy Eating Index (AHEI)-2010	  Cases/participants	184/530	190/550	199/560	160/520	180/542		  Basic modela	1.00 (ref.)	0.",2d15363e-19c4-46f8-a6a5-07f609eb89e6
15,methods14,")	1.11 (0.94; 1.30)	1.03 (0.88; 1.21)	1.03 (0.86; 1.23)	0.98 (0.81; 1.19)	0.69	 Alternate Healthy Eating Index (AHEI), Alternative Healthy Eating Index; aMed alternate Mediterranean; Dietary Approach to Stop Hypertension (DASH), Dietary approaches to stop hypertension; CI, confidence interval; RR, relative risk; MV, multivariable model  aAdjusted for maternal total energy intake (continuous), offspring sex (boy/girl) and gestational age (28–36, 37–41, ≥ 42 wks). bAdditionally adjusted for body mass index (BMI) before pregnancy (< 18.5, 18, 0.5 < 25, 25–29, ≥ 30 kg/m2), smoking status before pregnancy (never, current, past), physical activity (0, 1–149, 150–299, ≥ 300 min/week of moderate to vigorous intensity).",ed61fad5-3458-421c-b23e-638e3a8b9b3b
16,methods19," bAdditionally adjusted for smoking status before pregnancy (never, current, past), physical activity (0, 1–149, 150–299, ≥ 300 min/week of moderate to vigorous intensity), maternal age at pregnancy, parity (nulliparous, 1, 2, 3 + previous pregnancies), husband’s education (less than 2 yr college, 4 yr college, graduate school). cAdditionally adjusted for continuous body mass index (BMI) (kg/m2). dObtained from MV Model 2    Final sample for analyses Since maternal diet was assessed for the first time in 1991 while the 10,918 children enrolled in Growing Up Today Study II (GUTSII) were born between 1987 and 1995, we only considered children born surrounding the 1991 diet assessment in our analyses.",d6b27b04-9e79-4745-a625-6a2bdea88f27
17,methods20," More specifically, we estimated the time of conception based on the children´s date of birth and based on that selected mother–child pairs where—based on the questionnaire return date—at least part of the pregnancy was covered by the 12 month period that the food frequency questionnaire (FFQ) was enquiring about (n = 3085 children, n = 3008 mothers). We further restricted the sample to singleton births (n = 2991 children, n = 2954 mothers), children born after at least 28 weeks of gestation (n = 2768 children, n = 2737 mothers) and children with complete maternal exposure information (n = 2760 children, n = 2729 mothers). If two pregnancies of the same mother were covered partially by the 12 months period, we included only the first pregnancy which left us with a total sample of n = 2729 children, born to n = 2729 mothers for analyses. The sample size varies slightly by analysis based on availability of the considered outcomes.",ed6f869c-6ee7-47e6-9c74-c8b3c4f01869
18,analysis0,"Baseline descriptive characteristics were derived for all mother–child pairs eligible for the considered analyses across quintiles of the 3 dietary pattern scores. We estimated mean differences (MD) and 95% confidence intervals (CIs) in offspring birth weight across quintiles of dietary pattern scores considering the lowest quintile as the reference category. We further calculated relative risks (RR) and 95% CIs of offspring reporting a larger than median somatotype at age 5, offspring ever having overweight or obesity, and offspring ever having obesity. Due to the frequency of the considered outcomes we used log-binomial models to estimate RRs and approximations based on Poisson models with robust variance estimators in case of convergence problems [42].  Basic models were adjusted for total energy intake of the mothers, gestational age at delivery, offspring baseline age and sex. We further considered different sets of additional covariates.",135fa04e-c174-4fd6-8088-cd5974cacd65
19,analysis1," First, we added maternal pre-pregnancy lifestyle factors to the model, including pre-pregnancy body mass index (BMI), smoking status and physical activity [multivariable (MV) model 1]. Second, we added maternal age at delivery, number of previous pregnancies and husband’s education (MV model 2). Since maternal pre-pregnancy body mass index (BMI) was previously reported a strong predictor of adverse offspring weight outcomes during adolescence [12], we also investigated potential effect modification by body mass index (BMI). P values for interactions were based on score tests for testing multiplicative interactions of categorical variables. We introduced missingness indicators for covariates with missing values. All statistical tests were two sided and were considered statistically significant at p < 0.05. All analyses were conducted using SAS version 9.4 (SAS Institute, Cary, NC). ",73478aa4-e49f-47ef-a187-93fb705abd26
20,results0,"The average maternal age at birth was 32.8 (SD = 3.6) years (Table 1). Mothers with higher adherence to any of the healthful dietary patterns had a lower body mass index (BMI), were more physically active and were less likely to be current smokers. In addition, women in the highest quintiles of adherence were more likely to be married to husbands with a graduate degree. Their offspring were on average 13.2 (SD = 0.6) years old at enrollment into the Growing Up Today Study II (GUTSII) study. More female offspring (53.6%) than males (46.4%) were included in the analysis.  In basic models adjusted for maternal total energy intake, offspring sex and gestational age, offspring of mothers with higher adherences to the aMED and Dietary Approach to Stop Hypertension (DASH) patterns were less likely to develop overweight or obesity during follow-up (P for trend: 0.02 for aMED and 0.04 for Dietary Approach to Stop Hypertension (DASH)) (Table 2).",8ba30727-1708-4565-9742-e40ab7b6a0a6
21,results1," Compared to offspring born to mothers with the lowest quintile of aMED and Dietary Approach to Stop Hypertension (DASH), the relative risks for having overweight or obesity were RRQ5 vs Q1 = 0.82 [0.70–0.97] and 0.86 [0.72–1.04] among offspring born to mothers with the highest quintiles of these dietary patterns scores. However, after adjustment for additional confounders, including maternal lifestyle factors, pre-pregnancy body mass index (BMI) and socioeconomic status, the effect estimates were attenuated and were no longer significant for any of the three dietary patterns (RRQ5 vs Q1 = 1.03 [0.86; 1.22] for Alternate Healthy Eating Index (AHEI), 0.93 [0.78; 1.10] for aMED and 0.98 [0.81; 1.19] for Dietary Approach to Stop Hypertension (DASH), all p-trend > 0.05; Table 2). There were no associations between maternal adherence to the three healthful dietary patterns and offspring risk for obesity (Supplemental Table 1; RRQ5 vs Q1 = 0.92 [0.63; 1.",f0eeb256-c06a-4f70-95c4-fb8db235f8a5
22,results2,"35] for Alternate Healthy Eating Index (AHEI), 1.06 [0.72; 1.57] for aMED and 1.00 [0.65; 1.54] for Dietary Approach to Stop Hypertension (DASH), all p-trend > 0.05). Thus, after adjustment for pre-pregnancy body mass index (BMI) and lifestyle factors, we did not observe any associations between maternal adherence to healthful dietary patterns and offspring weight outcomes during childhood until early adulthood.  Birth weight appeared to be similarly distributed across quintiles of maternal Alternate Healthy Eating Index (AHEI), aMED and Dietary Approach to Stop Hypertension (DASH) (Supplemental Table 2). Likewise, the risk of having a larger than median somatotype at age 5 was similar across quintiles of maternal dietary pattern scores (Supplemental Table 3).  We then investigated whether associations between maternal dietary patterns and offspring weight outcomes differed between mothers having normal-weight and those having overweight or obesity.",dc1c422a-bf64-4f09-8077-7ab7ed367b65
23,results3, Formal tests for multiplicative interactions showed no indication for effect modification (pinteraction for all outcomes > 0.05). Relative risks for offspring overweight or obesity stratified by maternal weight status are shown in Table 3.  In Supplemental Table 4 we present results for the association between adherences to dietary patterns and offspring overweight or obesity among mothers who did not drink any alcohol. The observed results were similar to those reported in Table 2. ,0db42527-a6f3-42d2-b74e-b570a45460da
24,discussion0,"In this cohort study of generally well-nourished mothers and their children, we found that adherence to healthy dietary patterns during the period surrounding pregnancy was not related to offspring weight outcomes from birth through early adulthood. While in age-adjusted analysis, greater maternal adherence to aMED and Dietary Approach to Stop Hypertension (DASH) (but not Alternate Healthy Eating Index (AHEI)) tended to be associated with a lower risk of overweight or obesity in the offspring, none of the three dietary pattern scores remained significantly associated with offspring overweight or obesity risk after further adjustment for maternal pre-pregnancy body mass index (BMI) and lifestyle factors before pregnancy.  There are few published data on the associations between maternal healthful dietary patterns during pregnancy and weight outcomes in children of any age, yet our results align with those few that are available.",3fa16f89-ad14-44b0-b7a8-c004217a5562
25,discussion1," Among 2695 Dutch mother–child pairs, significant inverse associations were observed between maternal adherences to 2 principal component derived dietary patterns that mainly consisted of healthy components and offspring body mass index (BMI), fat mass index, and the risk of childhood overweight at age 6 years; however none of these associations remained significant after adjustment for socio-demographic and lifestyle factors of the mothers and children [30]. In the Dutch cohort, no independent associations were found between maternal dietary patterns during pregnancy and offspring blood lipids, blood pressure or insulin levels [43].",096a5a6d-d455-42fe-86da-c8d5d00f7e82
26,discussion2," Among 1827 mother–child pairs from the Spanish ‘Infancia y Medio Ambiente’ cohort study, higher adherence to the Mediterranean diet in pregnancy was not associated with offspring overweight at age 4 years, but there was some evidence of an inverse association between diet quality in pregnancy and offspring waist circumference, a marker of abdominal obesity [29]. To summarize, results from our study and from the aforementioned studies suggest that maternal healthful dietary patterns during pregnancy are not consistently associated with offspring overweight or obesity risk during childhood, adolescence or young adulthood.  These findings do not imply that maternal diet quality during pregnancy would be of negligible importance; they only suggest that these maternal healthful dietary patterns are not directly associated with offspring weight outcomes after adjustment for maternal body mass index (BMI) and other lifestyle behaviors.",64415267-b46b-4d74-99ee-2347a943e54c
