,chunk_label,chunk_text,uuid
0,introduction0,"Acquisition of healthy lifestyles during adolescence is critical for the prevention of most non-communicable diseases (hypertension, type 2 diabetes, cardiovascular diseases, and mental illnesses). These diseases commonly occur in adulthood and could be prevented by adopting healthy lifestyles1. In addition, those conditions entail high financial and social costs for the society2.  Numerous studies have shown an association between personality and health status3,4. The behavioural mediation model postulates that the observed association between personality and health would be the result of adopted healthy lifestyles (e.g., healthy diet, physical exercise, etc.), along with the avoidance of behaviours that could be harmful to health (e.g., tobacco, alcohol, etc.).",a8568040-80e1-4f44-963a-34e8283cea7d
1,introduction1," The association between personality and healthy lifestyles begins in early stages of life5 and promoting healthy lifestyles among children or adolescents reinforce the adoption of healthy habits and could delay or prevent chronic illnesses in the future.  The Big Five is a theory of personality traits that identifies five distinct factors as central to personality: extraversion, agreeableness, conscientiousness, openness, and emotional instability (neuroticism). However, is still controversial whether personality traits are stable over time6–8.  High conscientiousness scores have been related with healthier lifestyles in adults9–12. A literature review13 indicated that conscientiousness trait in adults predict health status throughout life and is also associated with a lower risk of mortality.",7aefa9be-7338-41f6-9de8-240c7156a0bb
2,introduction2," Recent research suggests that lower conscientiousness levels in childhood are associated with a lower health status (measured in terms of blood pressure, glucose level, lipid profile, body mass index, and medication consumption) in the adulthood. These associations were maintained even after controlling for conscientiousness in adult life14. These results indicate that the association between conscientiousness and mortality could be mediated by lifetime health-related behaviours15. The mechanisms involved constitute an important field of research, given that lifestyles are potentially modifiable, especially if interventions are performed early.  Promoting healthy lifestyles should have an important impact in the prevention of diseases. All lifestyles factors are potentially modifiable and there is a robust evidence that interventions to promote healthy lifestyles are effective in the prevention of diabetes16, hypertension17 and cardiovascular disease18.",b42e411a-4776-4d2f-b76f-171f3728fc5b
3,introduction3,"  Southern European countries have the highest rate of child obesity in Europe19, one possible cause is the loss of the traditional Mediterranean diet in child and adolescents. The Mediterranean diet is considered one of the healthiest dietary patterns that contributes to the prevention of cardiovascular diseases, hypertension, diabetes, and cancer20,21 and could have a protective effect on the incidence of depression in young adults22,23. Despite all these benefits, in general and especially among children and adolescents, there has been a progressive abandonment of the food pattern based on the Mediterranean diet in our environment24,25.  Regular physical activity entails benefits that contribute to the well-being of individuals with respect to physical, mental and social aspects. Performing physical exercise at least 90 minutes a week reduces all causes of death, including all types of cancer, and there is an increase in life expectancy26.",fa0f52d0-2a23-4dbc-a517-9175de8fb885
4,introduction4," In addition, high levels of physical exercise in childhood and adolescence predicts high levels of physical exercise in adulthood27,28.  Adolescents who are sleep deprived have greater intolerance to stress, emotional dysregulation, behavioural disorders, depression, and other emotional disorders29–31. Different longitudinal studies have indicated that lack of sleep, emotional dysregulation, and depressive symptoms interact with each other simultaneously as causes and consequences29,30. In this way, emotional instability could favour emotional dysregulation responses, increasing cognitive activity and inhibiting sleep. In turn, sleep deprivation would alter emotional processing and, therefore, its regulation30,32.  There is a lack of robust evidence on the association between personality and lifestyles related to health in a large sample of adolescents.",8e74efb8-bc9e-448a-acbf-03fa4dde4a0e
5,introduction5," The aim of the present study was to assess the association between personality traits, parental education, and health-related lifestyles among south European adolescents (aged 14 to 15 years). We hypothesized that high levels of conscientiousness and high parental education would be related to healthier lifestyles among adolescents. ",9c8f106b-b209-4e23-8d30-b119470fd3bd
6,methods0,"Participant recruitment The participants of the present study were adolescents, aged 14 to 15 years, who participated in the ITACA study50,51. The initial sample size of the cohort study included 1,708 secondary students (aged 11 to 12 years) from 16 Spanish secondary schools. The schools were randomly assigned to a multifactorial intervention to reduce the prevalence of smoking or as a control group. The data presented include the second and the third evaluation. In the second evaluation (2014–2015), we collected data relating to sociodemographic characteristics, level of parents’ education, and personality. In the third evaluation (May-June 2016), we collected data on the main lifestyles related to health. This evaluation was completed by 1,123 students from 12 schools, 824 of which had data in both the second and the third evaluation. Finally, there were 695 students with valid data for this analysis.",fdfbf428-2a8e-4e16-8d37-d1e783c4e2e9
7,methods1,"  Procedures and measures The data were self-reported in the classrooms on a school day, during one of the lessons. The students of the third year of secondary education responded to the survey in 60 minutes (second evaluation), and the students of the fourth year in 45 minutes (third evaluation). The surveys were administered by two previously trained interviewers. The teachers were asked to leave the classrooms to ensure the confidentiality of the students. The students who participated and theirs fathers or mothers signed an informed consent form. The study protocol was approved by the Institutional Review Board of the Balearic Islands Health Service (CEI-IB Ref. No. 1146/09). The study was conducted according to the ethical guidelines of the Declaration of Helsinki.",437cb5fa-86e6-4d83-8762-70c5fae26898
8,methods2,"  Personality traits Personality traits were assessed using the Big Five Questionnaire for Children and Adolescents (BFQ-CA)52 designed to assess the five basic personality traits, namely: extraversion, agreeableness, conscientiousness, emotional instability and openness. Extraversion assesses characteristics such as enthusiasm, assertiveness, and self-esteem. Agreeableness assesses sensitivity and concern for others and their needs. Conscientiousness evaluates compliance with commitments and order. Emotional instability refers to feelings such as anxiety, depression, dissatisfaction, and anger. Finally, openness refers to self-reported intellectual capacity -especially in the school domain- cultural interests, fantasy, and creativity52. The Spanish adaptation of the questionnaire included 65 items with five possible answers53. The reliability of this questionnaire, measured by Cronbach’s alpha, was high for the different traits: 0.77 for extraversion; 0.71 for agreeableness; 0.",c7eaeb54-4b66-4e34-8173-38d2bc2cb420
9,methods3,"87 for conscientiousness; 0.77 for emotional instability and 0.82 for opening. Previous studies have already demonstrated good psychometric properties of the BFQ-CA54.  Parental education The measurement of parental education describes their highest educational level. The categories were as follows: (a) incomplete primary education (less than six years); (b) complete primary education (six to eight years); (c) secondary education (four to six years); and (d) university degree50,55. The highest parental education variable was established by taking the highest educational level obtained by either parent. These two variables were transformed into a new variable that contained the highest value achieved by one or both parents, classified into two categories: (1) primary studies, compulsory studies, or lower; and (2) secondary studies, higher degree or university professional training.  Mediterranean Diet The Mediterranean Diet Quality Index was determined using the KIDMED test56.",a02fb2b3-98e2-4933-b7f7-ada7877d76be
10,methods4," The KIDMED index included 16 questions about food habits, and classified individuals according to the scores of the Mediterranean Diet Quality index differentiated into three categories: high adherence, optimal Mediterranean diet (8 and 12 points); medium adherence, need for improvement in the food pattern to adapt it to the Mediterranean model (4 and 7 points); and low adherence, very low quality of the diet (0 and 3 points).  Physical activity The level of weekly physical exercise was assessed with a question about the number of days per week they performed some sport extra-curricularly: (1) never; (2) once a week; (3) twice a week; (4) three times a week; (5) four times a week; and (6) five or more times a week. This variable was categorised as performing weekly physical exercise (yes/no).  Tobacco Smoking was assessed using seven items adapted from a previously validated questionnaire50, which assessed the consumption of tobacco categorised as weekly tobacco consumption (yes/no).",46736037-5bcd-40ff-b36a-3e567c1584b7
11,methods5,"  Alcohol consumption Alcohol consumption was quantified using the following question: How often do you drink alcoholic beverages? = (1) never-almost never; (2) sometimes a month; (3) on weekends; and (4) daily or almost daily. This variable was categorised as weekly consumption of alcoholic beverages (yes/no).  Sleep problems Sleep problems were assessed with the following question: Do you have sleep problems? = (1) never-almost never; (2) sometimes a month; (3) many nights (one or more nights a week); and (4) every night. This variable (yes/no) was categorised according to having sleep problems one or more times per week. In addition, the number of hours they slept on school days and on weekends was recorded.  Screen time and use of social networks Television, screen, and social media hours were collected separately for school days and weekends.",03da4e14-f7aa-46d4-ac19-64106b2acb9f
12,methods6," The variable was categorised as excessive use of screens (yes/no) and/or social networks (yes/no) if more than two hours per day were used on school days.  Statistical analyses The listwise deletion method (with complete case deletion) was used to account for missing data57. Quantitative variables were expressed as mean and standard deviation, and qualitative variables in the form of absolute frequencies and percentages. The analysis of the differences between groups for the quantitative parameters was performed using Student’s t-test. Pearson’s chi-square test was used to assess the differences between the qualitative variables. Listwise deletion method (complete case) were used for handling missing data.",127f7fb4-37d4-46ac-8b01-fab25f43e91b
13,methods7,"  The effect of personality on healthy lifestyle habits was assessed by standardising the values of different personality traits and adjusting different binary logistic regression models in which the dependent variables were: (1) low adherence to the Mediterranean diet (KIDMED < 7); (2) not performing physical exercise at least once a week; (3) weekly tobacco consumption; (4) weekly alcohol consumption; (5) having weekly sleep problems; (6) excessive use of screens; and (7) excessive use of social networks.  A general linear model was also adjusted. The dependent variable was adherence to the Mediterranean diet as a continuous variable, and the independent variables were the levels of conscientiousness, parental education, and age and sex of the adolescents.  Cluster analysis (k-means algorithm) was used to identify groups of students who shared common health-related lifestyles. This technique identifies subgroups of cases in adolescents based on shared characteristics.",80550052-619d-43e7-a88c-33eb104b03be
14,methods8," All variables were standardized before the cluster analysis. This method identifies uniform groups by maximizing inter-group variance and minimizing intra-group variance58. Subsequent analyses (t-test and Chi-Square) were used to identify differences between the clusters and sociodemographic characteristics (gender and parental education) and personality traits.  It was considered that there were statistically significant differences when the p-value was <0.05. All data were analysed using the SPSS Statistics 24 software (IBM Company, Chicago, Illinois, United States).  Publisher’s note Springer Nature remains neutral with regard to jurisdictional claims in published maps and institutional affiliations.  Acknowledgements We are extremely grateful to the teachers and students of the participating schools for collaborating with us and supporting this study.",8f16fa1a-42dc-422e-8c6b-3d2e91d38cf8
15,methods9," This study was funded by the Spanish Ministry of Health, Health Research Funds of the Carlos III Health Institute (PI12/01813) and the Network for Prevention and Health Promotion in Primary Care (redIAPP, RD16/0007/008), and by European Union ERDF funds. ",89fa5a79-4cbb-41cc-8fdf-fd151f2b2588
16,results3," The students whose parents had higher levels of education exhibited better adherence to the Mediterranean diet than those students whose parents had lower levels of education (p < 0.01).  The multivariate logistic regression model indicated that conscientiousness, extraversion, and family educational levels were associated with adherence to the Mediterranean diet, adjusted for age and sex (Table 3). For the general linear model, we considered adherence to the Mediterranean diet as a continuous dependent variable, the level of conscientiousness in terciles (high, medium, and low), and parental educational level as independent variables. In line with the previous analysis, we observed that the increase in the levels of conscientiousness corresponded to a linear increase in the levels of adherence to the Mediterranean diet (p < 0.05), and that higher levels of family education were associated with greater adherence to the Mediterranean diet (Fig. 1).",db32423b-20ea-4df5-bdfc-2129032aabbd
17,results6,"01 for both variables (conscientiousness and family educational level) adjusted by age and sex (General Linear Model).    Physical activity Boys were more likely to participate in sports activities, 85% of the boys and 79% of the girls performed physical activities at least once a week (p < 0.05). Extraversion levels were higher among adolescents who exercised at least once a week (z-score: 40.0 vs. 38.1; p < 0.001), and there were not differences in agreeableness, conscientiousness, openness, and emotional instability. The logistic regression model, adjusted for age and sex, indicated that high levels of extraversion maintained independent significant association with the usual performance of physical exercise (Table 3).  Tobacco Among all the students, 8.8% reported that they were regular smokers (at least once a week) (Table 1). Smoking was associated with lower levels of conscientiousness and higher levels of extraversion and emotional instability.",8abd6c53-052b-44ee-b14a-9203eb96ff87
18,results7," In the multivariate analysis, these associations remained similar (Table 3).  Alcohol One in five adolescents reported that they consumed alcohol weekly (Table 1). The bivariate analysis indicated that weekly alcohol consumption was associated with lower conscientiousness, openness, and higher extraversion and emotional instability. In the logistic regression analysis these associations were maintained (Table 3).  Sleep Four out of ten students reported that they had sleep problems at least once a week (Table 1). This proportion was higher among girls than among boys (47% vs. 28%; p < 0.001). In the bivariate analysis, suffering from sleep problems was associated with greater emotional instability and lower levels of parental education (p < 0.05). The multivariate analysis indicated that these associations were preserved, except for sex, which had no statistical significance.  Screen time and social network sites On average, on school days, the adolescents used the screen 5.",1a94e7af-1937-4fe2-ab39-be99e5ea92d7
19,results8,"3 hours per day, and social networks 5.4 hours per day. In both cases, the use was higher among girls than among boys (Table 1). The logistic regression analysis indicated that lower levels of conscientiousness were associated with excessive use of screens and social networks. Higher levels of extraversion and the female sex were also associated with excessive use of social networks.  Cluster analysis of health-related lifestyles Our cluster analysis of the health-related lifestyles indicated the presence of two different clusters (Fig. 2). This analysis explained the grouping of all 695 adolescents included.",06644e38-f9bb-4955-ab69-0a1008a7d298
20,results9," We characterized these clusters as follows: Cluster 1 (Healthy lifestyles) was shaped by adolescents that were more likely to participate in sports activities, good adherence to the Mediterranean diet, less tobacco and alcohol consumption, less sleep problems, more sleeping time and less use of screens and social networks; and Cluster 2 (Unhealthy lifestyles) was shaped by adolescents were less physical activity, low adherence to the Mediterranean diet, smoking, weekly alcohol consumption, sleep problems and sleeping less hours and excessive use of screens and social networks.Figure 2 Clusters of adolescents’ health-related lifestyles and personality traits.    There were significant differences between clusters according to gender (χ2(1) = 6.447; p = 0.011) and parental education (χ2(1) = 4.507; p = 0.034). Adolescents in Cluster 1 (healthy lifestyles) showed significantly higher scores of conscientiousness and openness and lower levels of extroversion and emotional instability.",d8a0affa-56d9-4efe-aa9b-aa0cd178c423
21,discussion0,"Our study provides important insights about acquisition of healthy lifestyles during adolescence and indicates that personality traits and parental education are associated with health-related lifestyle behaviours among adolescents after adjustment for age, sex and educational level. High conscientiousness scorers were more likely to adhere to the Mediterranean diet, smoked less, consumed less alcohol, and made better use of social networks. High extraversion scorers were more likely to engage in physical exercise; however, they were more likely to smoke and drink regularly, and adhered poorly to the Mediterranean diet. High scores in emotional instability were related to higher consumption of tobacco and alcohol, and sleep problems. The effect size of the association between personality traits and adherence to the Mediterranean diet and physical inactivity were small, however the association between extraversion (d = −0.",2a9dba9b-c9bb-4c64-9862-400d7b9247b7
22,discussion1,"460), emotional instability (d = −0,460) and smoking were of medium effect, and medium to large effect (d = −0.612) for emotional instability and sleeping problems. In addition, the educational level of the parents was also associated to diet and sleep problems.  A previous online survey in the United States found similar results33,34. High conscientiousness was associated with healthy behaviours, such as eating more fruits and vegetables, sleeping enough hours, and using the seat belt, whereas a high score in extraversion was associated with tobacco and alcohol consumption. Previous studies also showed an association between extraversion and increased consumption of tobacco and alcohol35,36.  Conscientiousness is defined as the tendency to be organised, in addition to complying with social norms, controlling impulses, being hardworking and responsible for obligations towards others29.",3bcff002-78da-4020-b9c7-6a18c8351555
23,discussion2," According to a review37, the most important aspect of conscientiousness would be self-regulation that includes impulse control. Self-regulation is originated in childhood and adolescence, and is completely developed in the adult stage38. In our study, the association observed between conscientiousness and adherence to the Mediterranean diet could be mediated by the capacity for self-regulation. Responsible individuals would be able to delay the immediate gratification of less healthy diets and adhere to a healthy diet to minimise future health hazards.  In addition, personality traits could also influence the choice of situations or environment that would facilitate the adoption of healthy lifestyles33. Conscientiousness and healthy lifestyles would provide a positive feedback for maintaining high levels of conscientiousness; thus, personality and health behaviours may be reciprocally related across the lifespan39.",70a0992d-0496-4a02-80fc-107026dcb896
24,discussion3,"  The present study indicated that extraversion would be associated with sports activities. The most extraverted students would search for additional external stimulation, and may be more willing to performance sports, but they are inherently social and could be also engaged in alcohol intake, tobacco consumption, or excessive use of social networks.  The recommended daily amount of sleep for an adolescent (aged 14 to 17 years) is between eight and ten hours29,40. However, we found that on school days most adolescents do not sleep eight hours, these results are in concordance with surveys from different countries29,32. Sleep deprivation increases with age41, although the importance that this finding may have for adolescents is still being discussed31,42,43. In our sample, low levels of parental education and emotional instability were associated with higher prevalence of sleep problems in adolescence.",34cec7cf-6814-43d0-88f4-d87538e6e35c
25,discussion4," The association of parental education and adolescents sleep problems—which has not been previously reported in the literature—could be mediated by reduced ability to effectively protect sleep hygiene and emotional regulation of adolescents, and, perhaps, also their sociability, since the two-way interaction between sleep and social bond has also been described30. Sleep deprivation in adolescents is linked to screens and social networks use44. In our sample, on average, adolescents spent seven hours per day on screens (television, tables, computers, etc). This far exceeds the two hours recommendations of screen use among adolescents40, and most of this time was not devoted to school activities but to social networks (5.4 hours on average).  The results of cluster analysis showed that one of three adolescents had unhealthy behavior patterns.",5d36faa1-a7f3-4a00-b7dd-bb9f1fe83cbf
26,discussion5," Adolescents health-related lifestyles should not be considered as isolated factors, because lifestyles tend to cluster (healthy and unhealthy lifestyles). Considering these results, health promotion interventions in adolescents should focus on multiple behaviors rather than any single behaviour45.  Our findings showed a similar associations, between personality traits and health-related lifestyles, to those reported among adult population12,46,47. Mean levels of conscientiousness increase across adolescence and there are individual differences in the degree and direction of these personality traits changes8. Different strategies for intervention focused on social-context or on increasing conscientiousness have been suggested. Although other actions focused on the behaviours associated with conscientiousness rather than on the underlaying personality trait may be more useful and cost efective48.",409ec9ee-44a7-4ac1-8aff-34a9da1daf99
27,discussion6," Future studies should confirm if early psychoeducational interventions based on personality traits could prevent risk health behaviours to decrease health and mental disorders in adulthood.  Strengths and limitations The present study has some strengths and limitations. First, the measures of health-related lifestyles were self-reported by the adolescents, therefore, we cannot rule out complacency biases, especially in students with higher levels of pleasantness. Secondly, some of the outcome variables could be influenced by parents and the family environment, which could reduce the individual effect of personality traits. Although there is also a shared family component on personality in terms of genetic and environmental influences49.",058522dd-3a35-4001-af89-85b1657e0c15
