,chunk_label,chunk_text,uuid
0,introduction0,"Impaired energy metabolism is one of the cornerstones of heart failure pathophysiology (Rosca and Hoppel, 2013). Normally, 60–90% of energy is generated through fatty acid oxidation (fatty acid oxidation (FAO)) ; however, in the early stages of heart failure, a shift from fatty acid oxidation toward glucose utilization is observed and is a mechanism of metabolic adaptation (Ventura-Clapier et al., 2011). Compared to healthy patients, heart failure patients exhibit decreased fatty acid oxidation (FAO) (Dávila-Román et al., 2002), which correlates with cardiac hypertrophy and reduced ejection fraction . During the progression of heart failure, overall cardiac oxidative metabolism decreases, resulting in energy starvation (Sabbah, 2020). One of the risk factors that lead to disturbances in energy metabolism and further progression of cardiovascular diseases is unhealthy dietary patterns.",de330756-f62d-4b6f-9efa-61ad062c949a
1,introduction1," For instance, high intake of fat, red meat and processed food, as in Western diet, is shown to damage myocardial oxidative capacity, leading to impaired mitochondrial energy metabolism . Moreover, dietary choices determine the composition of intestinal microbiota, which further unambiguously affects the host metabolism . It has been shown that chronic heart failure is characterized by substantial alterations in gut microbiome composition and reduced microbial variety . Previous studies suggest a link between the human gut microbiome and the homeostasis of energy metabolism, however, a clear causal relationship between them remains elusive.",2bb682db-9d7f-4c0d-941d-a8193cb8824d
2,introduction2,"  In 2011, in a targeted metabolomics study, trimethylamine N-oxide (Trimethylamine N oxide (trimethylamine (TMA)O)) was identified as a metabolite, which is both microbiota- and diet-derived, and associated with the incidence of adverse cardiovascular outcomes . Trimethylamine N oxide (trimethylamine (TMA)O) is produced in organisms by gut microbiota during the metabolism of common food constituents, such as carnitine, choline and betaine; this process first leads to the production of trimethylamine (trimethylamine (TMA)), which is subsequently oxidized by the host liver enzyme group called flavin-containing monooxygenases . High intake of Trimethylamine N oxide (trimethylamine (TMA)O) and its precursor has been shown to promote atherosclerosis and exacerbate cardiovascular risks (Wang et al., 2011; Koeth et al., 2013; Ding et al., 2018).",2c17eb92-9170-4557-9c7e-55fef1e136c6
3,introduction3," A positive correlation between the circulating levels of Trimethylamine N oxide (trimethylamine (TMA)O) and the severity of metabolic syndrome has been observed , and elevated Trimethylamine N oxide (trimethylamine (TMA)O) plasma levels were observed in patients with diabetes . Moreover, in heart failure patients, increased Trimethylamine N oxide (trimethylamine (TMA)O) concentrations correlate with heart failure severity, as shown by NYHA class (Tang et al., 2014, 2015; Trøseid et al., 2015) and heart failure-associated mortality .",e1500857-2381-4d93-b2d2-a2720406a9a7
4,introduction4," Although extensive studies of Trimethylamine N oxide (trimethylamine (TMA)O) in various patient populations clearly demonstrate that Trimethylamine N oxide (trimethylamine (TMA)O) can serve as a biomarker, it remains uncertain whether Trimethylamine N oxide (trimethylamine (TMA)O) is directly involved in the pathogenesis of cardiometabolic diseases (Nowiński and Ufnal, 2018).  Diet supplementation with Trimethylamine N oxide (trimethylamine (TMA)O) or its precursors has been shown to exacerbate cardiac dilation, leading to reduced ejection fraction and increased cardiac fibrosis, in an experimental model of heart failure . In addition, a reduction of circulating Trimethylamine N oxide (trimethylamine (TMA)O) levels by 3,3-dimethyl-1-butanol or iodomethylcholine resulted in attenuated cardiac remodeling after aortic banding .",9654ce77-dddb-4998-b6df-b5cfd7a48bdf
5,introduction5," On the other hand, the Mediterranean diet, which is focused on regular consumption of Trimethylamine N oxide (trimethylamine (TMA)O)-rich fish and seafoods , is inversely correlated with fatal coronary heart disease  and is proposed to be a strategy for preventing and reducing the risk of cardiovascular and metabolic diseases (Tørris et al., 2014; Widmer et al., 2015; Estruch et al., 2018). Moreover, it was recently shown that chronic treatment with low-dose Trimethylamine N oxide (trimethylamine (TMA)O) was associated with preserved cardiac hemodynamic parameters in Spontaneously Hypertensive rats and Spontaneously Hypertensive Heart Failure rats (Huc et al., 2018; Gawrys-Kopczynska et al., 2020). Such controversial results raise the question of whether increased availability of Trimethylamine N oxide (trimethylamine (TMA)O) plays detrimental or protective roles in the progression of cardiovascular diseases.",25483842-92a3-4659-81e7-0c77e8ac06fd
6,introduction6,"  It has been shown that both acute and chronic Trimethylamine N oxide (trimethylamine (TMA)O) treatment can cause disruptions in energy metabolism in the heart by impairing pyruvate and fatty acid metabolism (Makrecka-Kuka et al., 2017). However, there is no evidence that Trimethylamine N oxide (trimethylamine (TMA)O)-induced metabolic alterations result in impaired cardiac functionality. It could be hypothesized that long-term Trimethylamine N oxide (trimethylamine (TMA)O) administration could exert preconditioning-like effects, thus improving cardiovascular outcomes after stress conditions, such as hypoxia, pressure overload and altered energy substrate availability. Thus, the aim of the present study was to investigate the effects of long-term Trimethylamine N oxide (trimethylamine (TMA)O) administration in an experimental rat model of monocrotaline-induced right ventricle heart failure.",4eca83fa-4104-4f65-9dad-0994e6e61960
7,introduction7," To mimic the chronic increase in Trimethylamine N oxide (trimethylamine (TMA)O) in plasma and tissues, as observed in cases of regular consumption of seafood, Trimethylamine N oxide (trimethylamine (TMA)O) pretreatment for 10 weeks prior to monocrotaline injection was chosen. The effects of the administration of Trimethylamine N oxide (trimethylamine (TMA)O) on indicators of heart failure severity (cardiac functional parameters, heart failure and hypertrophy-related gene and protein expression) and cardiac mitochondrial energy metabolism were studied.  ",f088094b-568e-4a86-b94b-15f6ee375fbe
8,methods0," Trimethylamine N oxide (trimethylamine (TMA)O) was administered to rats at a dose of 120 mg/kg in their drinking water for 10 weeks. Then, a single subcutaneous injection of monocrotaline (monocrotaline (MCT)) (60 mg/kg) was administered to induce right ventricular dysfunction, and treatment with Trimethylamine N oxide (trimethylamine (TMA)O) was continued (experimental groups: Control; Trimethylamine N oxide (trimethylamine (TMA)O); monocrotaline (MCT); Trimethylamine N oxide (trimethylamine (TMA)O)+monocrotaline (MCT)). After 4 weeks, right ventricle functionality was assessed by echocardiography, mitochondrial function and heart failure-related gene and protein expression was determined.",08005218-a260-4e78-9653-114bc25676a4
9,methods1,"  Experimental Animals Wistar rats (n = 40) weighing 280–380 grams (6–8 weeks old) were obtained from the Laboratory Animal Centre, University of Tartu (Tartu, Estonia) and housed under standard conditions (21–23°C, 12-h light/dark cycle, relative humidity 45–65%) for 2 weeks prior to the start of the experiment. The animals were fed a standard R70 diet (Lantmännen, Stockholm, Sweden) with unlimited access to food and drinking water. All the experimental procedures were performed in accordance with the guidelines reported in the EU Directive 2010/63/EU and in accordance with local laws and policies, and all of the procedures were approved by the Latvian Animal Protection Ethical Committee of the Food and Veterinary Service, Riga, Latvia (Food and Veterinary Service Ethical approval Nr. 105). These studies are reported in accordance with the ARRIVE guidelines .",5e539205-1797-4570-8452-637408ea8ce4
10,methods2," Our previous experiments, in which right ventricular functionality was assessed, indicated that due to interindividual variability, 8–10 animals per group are necessary to obtain significant results; therefore, n = 10 per group was chosen. The data from previous experiments in which mitochondrial energy metabolism was studied were subjected to statistical power analysis, and the calculations indicated that the mitochondrial respiration assay requires at least n = 5 or 6 per group to produce significant results with a power >0.95.  Experimental Design The schematic representation of the study design is shown in Figure 1. The experimental animals were randomly separated into four groups: control (n = 10), Trimethylamine N oxide (trimethylamine (TMA)O) (n = 10), monocrotaline (MCT) (monocrotaline) (n = 10) and Trimethylamine N oxide (trimethylamine (TMA)O)+monocrotaline (MCT) (n = 10).",99fd4780-fe81-476b-af36-42e4c0051b62
11,methods3," One animal in the control group and 2 animals in the other groups died during the experiment due to reasons not related to the experimental protocol and treatment. The samples from these rats were excluded from further analysis; therefore, the final animal count was nine rats in the control group and eight rats in the other groups. The animals in the Trimethylamine N oxide (trimethylamine (TMA)O) group and Trimethylamine N oxide (trimethylamine (TMA)O)+monocrotaline (MCT) group received Trimethylamine N oxide (trimethylamine (TMA)O) (Alfa Aeser, Kandel, Germany) at a dose of 120 mg/kg in their drinking water daily for 10 weeks. To induce pulmonary hypertension and right ventricular remodeling and dysfunction, a single subcutaneous injection of monocrotaline (monocrotaline (MCT)) (Sigma-Aldrich, Schnelldorf, Germany) at a dose of 60 mg/kg was administered to the animals in the monocrotaline (MCT) and Trimethylamine N oxide (trimethylamine (TMA)O)+monocrotaline (MCT) groups.",9a802739-e669-4c0b-87ac-5838c7ac35dd
12,methods4," Trimethylamine N oxide (trimethylamine (TMA)O) treatment was continued in both groups that previously received Trimethylamine N oxide (trimethylamine (TMA)O) until the end of the experiment. The rats were weighed twice a week to monitor their general health condition. Since the time from monocrotaline (MCT) injection to right ventricular failure onset differs markedly , a 4-week time point after the administration of monocrotaline (MCT) was chosen for the echocardiographic assessment of right ventricle functionality based on our pilot experiments in this model. In addition, invasive direct right ventricular pressure measurement was performed. After the assessment of cardiac functionality, the animals were sacrificed, and cardiac tissue and plasma samples were immediately frozen and stored at −80°C for further analysis. In addition, a mitochondrial functionality study was performed using permeabilized cardiac fibers of the right ventricle.",fd61a051-7c8d-4456-a11b-741708f728f0
13,methods5,"  Figure 1 Schematic representation of the study design.  Echocardiography Assessment and Direct Right Ventricle Blood Pressure Measurement The rats were anesthetized using 5% isoflurane dissolved in 100% oxygen. After the onset of anesthesia, the concentration of isoflurane was decreased to 2.5%, the experimental animals were placed in a decubitus position, and the chest and upper part of the abdomen were shaved. The animals were connected to a Philips iE33 ultrasonograph (Philips Healthcare, Andover, USA) to record ECG from the II lead. Then, the rat was placed on the left side, and a four-chamber view was recorded from the apical point of view using a Philips (Philips Healthcare, Andover, USA) S12-4 sector array transducer. Right ventricular (RV) end-diastolic area (RV-EDA) and RV end-systolic area (RV-ESA) were recorded. ECG was used to determine the exact time of RV systole and diastole.",a023f4a3-fe23-4ffd-9681-7bd745bd0d07
14,methods6," Furthermore, RV-EDA and RV-ESA were used to calculate RV fractional area change (RV fractional area change (RVFAC)). The rat was again placed in a decubitus position, and functional parameters of the left ventricle were recorded at the papillary muscle level using a Philips (Philips Healthcare, Andover, USA) linear L15-7io transducer.  After the echocardiographic assessment of ventricular anatomy and functioning, invasive direct right ventricular pressure measurement was performed. The anesthetized rat was intubated using a 16-G intravenous catheter and mechanically ventilated with 2% isoflurane dissolved in 100% oxygen at a tidal volume of 1.5 ml/100 g. The abdominal cavity was opened, and the diaphragm was incised to expose the pleural cavity. The ribs on both sides of the chest were cut to access the heart. An 18-G needle was connected to a pressure transducer (AD Instruments, Sidney, Australia) and inserted into the cavity of the right ventricle through the apex of the heart.",1473fad4-5da8-4948-91a4-a11069438518
15,methods7," The right ventricular pressure was measured until a stable pressure reading was obtained.  Measurement of Organ Mass To calculate the organ-to-body weight indexes, the heart and lungs were excised and weighed. Then, the right ventricle (excluding the septum) was separated from the heart and weighed.  Measurements of Plasma Biochemical Parameters To obtain plasma, the blood samples were centrifuged at 1,000 g and 4° for 10 min and then stored at −80°C until further analysis. The levels of triglycerides and total cholesterol in plasma were measured using commercially available kits from Instrumentation Laboratory (Milan, Italy). The level of free fatty acids (NEFA) was measured using a commercially available kit from Wako Chemicals (Neuss, Germany). All measurements were carried out according to the manufacturer's instructions.",68f1c45d-5e22-408f-9ef9-c20fb7f6eae2
16,methods8,"  Quantification of Trimethylamine N oxide (trimethylamine (TMA)O) in Plasma and Tissue Samples Determination of the Trimethylamine N oxide (trimethylamine (TMA)O) concentrations in the plasma and heart homogenate samples was performed by ultra-performance liquid chromatography-tandem mass spectrometry (UPLC/MS/MS) using the positive ion electrospray mode as previously described . Briefly, obtained tissues were homogenized with water in OMNI Bead Ruptor 24 (Camlab, Cambridge, United Kingdom) at a w/v ratio of 1:10. The obtained homogenates were centrifuged at 20,000 g for 10 min at 4°C. The supernatants were collected and stored at −80°C until further analysis.  Sample preparation was performed by deproteinization with an acetonitrile–methanol mixture (3:1, v/v). The samples were then vortexed and centrifuged at 15,000 g for 20 min. The supernatant was transferred to UPLC vials and used for UPLC/MS/MS analysis. MassLynx 4.1.",6418475f-ef57-4ced-af0f-7a88d516a36d
17,methods9," software with a QuanLynx 4.1. module (Waters, Milford, USA) was used for data acquisition and processing.  Measurements of Tissue Brain Natriuretic Peptide (Brain Natriuretic Peptide (BNP)) A Rat Brain Natriuretic Peptide (BNP) 45 ELISA Kit (Abcam, Cambridge, United Kingdom, ab108816) was used to test the levels of makers of congestive heart failure in right ventricular tissue extracts. Extract preparation and analysis were carried out according to the manufacturer's instructions.  Isolation of RNA and qPCR Analysis Total RNA was isolated from right ventricular tissues using TRI reagent (Sigma, St. Louis, MO, USA) according to the manufacturer's recommended protocol. First-strand cDNA synthesis was performed using the High-Capacity cDNA Reverse Transcription Kit (Applied BiosystemsTM, Foster City, CA, USA) following the manufacturer's instructions.",c3fc40ea-3199-4bb5-92bb-82dbbb90c819
18,methods10," The qPCR mix consisted of SYBR® Green Master Mix (Applied BiosystemsTM, Foster City, CA, USA), synthesized cDNA, and forward and reverse primers specific for VCP, Brain Natriuretic Peptide (BNP), αMHC, and βMHC. These genes were chosen to characterize heart failure severity and cardiac hypertrophy. The reaction was carried out in an Applied Biosystems Prism 7500 instrument according to the protocol provided by the manufacturer. The relative expression levels of each of the genes of interest were calculated with the ΔΔCt method and were normalized to the expression level of the VCP gene. The primer sequences used for the qPCR analysis are available in Supplementary Table 1.  Measurements of Mitochondrial Respiration in Permeabilized Cardiac Fibers Mitochondrial function was assessed in permeabilized cardiac fibers from the right ventricle that were prepared as previously described .",0ce946e9-2255-40bd-ada2-bb7f1492cb65
19,methods11," The mitochondrial respiration measurements were performed in MiR05 media (110 mM sucrose, 60 mM K-lactobionate, 0.5 mM EGTA, 3 mM MgCl2, 20 mM taurine, 10 mM KH2PO4, 20 mM HEPES, pH 7.1, 0.1% BSA essentially free of fatty acids) at 37°C using an Oxygraph-2k (O2k; Oroboros Instruments, Innsbruck, Austria). Mitochondrial functionality measurements were performed using a previously described respirometry protocol (Makrecka-Kuka et al., 2020). Briefly, palmitoylcarnitine (PC) and malate (10 μM and 0.5 mM, respectively) were used to measure fatty acid oxidation (FAO)-dependent mitochondrial respiration (F(N)-pathway) in a substrate-dependent LEAK (L) state. Then, ADP was added to a concentration of 5 mM to initiate oxidative phosphorylation-dependent respiration (OXPHOS state). Next, pyruvate (5 mM, complex I substrate, N-pathway) was added to reestablish FN-pathway-linked respiration.",15b11384-863b-4197-91ca-a02fe80125df
20,methods12," Succinate (10 mM, complex II substrate, S-pathway) was added to reconstitute convergent FNS-linked respiration. Then, rotenone (0.5 μM, complex I inhibitor) and antimycin A (2.5 μM, complex III inhibitor) were added to determine the S-linked respiration and residual oxygen consumption (residual oxygen consumption (ROX)), respectively.  To determine the contribution of each substrate to the respiration rate, the flux control factor was calculated as follows:   1-Resp.rate before the addition of substrateResp.rate after the addition of substrate. To determine the mitochondrial mass in the heart, the citrate synthase activity in tissue homogenates was measured spectrophotometrically as previously described (Srere, 1969).  Statistical Analysis The statistical analysis of the data was performed using GraphPad Prism (GraphPad, Inc., La Jolla, USA) software. All the data are represented as the mean ± standard error of the mean (standard error of the mean (SEM)).",6413051b-def8-4ee9-b4ca-525b2bd8bd20
21,methods13," Data distribution was determined using Shapiro-Wilk's normality test. The statistical significance of the experimental results was verified by one-way ANOVA followed by Dunnett's multiple comparison test (to compare each experimental group to the control group) following an unpaired t-test (to compare the monocrotaline (MCT) group to the Trimethylamine N oxide (trimethylamine (TMA)O)+monocrotaline (MCT) group). If the data were not normally distributed, the Kruskal-Wallis test followed by Dunn's multiple comparison test was used. The results were considered statistically significant if the p-value was < 0.05. ",a4d1fe01-06c3-417d-af02-0c607c46897d
22,results0," Compared to the control treatment, the administration of Trimethylamine N oxide (trimethylamine (TMA)O) (120 mg/kg) for 14 weeks increased the Trimethylamine N oxide (trimethylamine (TMA)O) concentration in cardiac tissues up to 14 times. monocrotaline (MCT) treatment led to impaired mitochondrial function and decreased right ventricular functional parameters. Although Trimethylamine N oxide (trimethylamine (TMA)O) treatment itself decreased mitochondrial fatty acid oxidation-dependent respiration, no effect on cardiac functionality was observed. Long-term Trimethylamine N oxide (trimethylamine (TMA)O) administration prevented monocrotaline (MCT)-impaired mitochondrial energy metabolism by preserving fatty acid oxidation and subsequently decreasing pyruvate metabolism.",61ea0091-b7d7-4d45-8361-6b6b3809ebf0
23,results1," In the experimental model of right ventricle heart failure, the impact of Trimethylamine N oxide (trimethylamine (TMA)O) on energy metabolism resulted in a tendency to restore right ventricular function, as indicated by echocardiographic parameters and normalized organ-to-body weight indexes. Similarly, the expression of a marker of heart failure severity, brain natriuretic peptide, was substantially increased in the monocrotaline (MCT) group but tended to be restored to control levels in the Trimethylamine N oxide (trimethylamine (TMA)O)+monocrotaline (MCT) group.  Conclusion: Elevated Trimethylamine N oxide (trimethylamine (TMA)O) levels preserve mitochondrial energy metabolism and cardiac functionality in an experimental model of right ventricular heart failure, suggesting that under specific conditions Trimethylamine N oxide (trimethylamine (TMA)O) promotes metabolic preconditioning-like effects.",01ebafd9-9b9e-4b18-a5ab-949a27208f7f
24,results2,  trimethylamine N-oxideright ventricular dysfunctionmonocrotalinemitochondrial functioncardiovascular diseasesLatvijas Zinatnes Padome10.13039/501100005375 ==== Body Effects of Long-Term Trimethylamine N oxide (trimethylamine (TMA)O) Administration on Heart Failure Severity Administration of Trimethylamine N oxide (trimethylamine (TMA)O) at a dose of 120 mg/kg in the drinking water for 14 weeks resulted in a 6-fold increase in the Trimethylamine N oxide (trimethylamine (TMA)O) plasma concentrations (up to 100 μM) in both the Trimethylamine N oxide (trimethylamine (TMA)O) and Trimethylamine N oxide (trimethylamine (TMA)O)+monocrotaline (MCT) groups (Figure 2A).,07eb1c0e-8054-4727-a39d-2197a930a912
25,results3," The analysis of the Trimethylamine N oxide (trimethylamine (TMA)O) content in the tissues of the right ventricle revealed that treatment with Trimethylamine N oxide (trimethylamine (TMA)O) resulted in a 14-fold increase in the Trimethylamine N oxide (trimethylamine (TMA)O) tissue content (up to 140 nmol/g tissue) in both groups that received Trimethylamine N oxide (trimethylamine (TMA)O) (Figure 2B).  Figure 2 Trimethylamine N oxide (trimethylamine (TMA)O) concentration in plasma (A) and right ventricular tissue (B) after administration of Trimethylamine N oxide (trimethylamine (TMA)O) at a dose of 120 mg/kg in the drinking water for 14 weeks. The results are presented as the mean ± standard error of the mean (SEM) of 8–9 animals. * Indicates a significant difference from the control group (one-way ANOVA followed by Dunnett's post-test), # indicates a significant difference from the monocrotaline (MCT) group (unpaired t-test), p < 0.05.",297354e0-ce53-4531-ae73-ca2130ac6acb
26,results4,"  The echocardiographic assessment did not reveal any significant differences in cardiac function between the control and Trimethylamine N oxide (trimethylamine (TMA)O) groups. Administration of Trimethylamine N oxide (trimethylamine (TMA)O) at a dose of 120 mg/kg in the drinking water for 14 weeks did not affect direct right ventricular (RV) pressure, RV systolic and diastolic area or RV fractional area change (Table 1) as well as ejection fraction and fractional shortening of the left ventricle (Supplementary Table 2). Compared with the control, administration of monocrotaline induced a significant increase (~50%) in direct right ventricular pressure (Table 1). In addition, dilatation of the right ventricle was observed in the hearts of the animals in the monocrotaline (MCT) group, as indicated by 34 and 83% increases in the RV diastolic and systolic areas, respectively.",fff6fdb8-3358-450b-9c33-5065ad21aed4
27,results5," Subsequently, the right ventricular fractional area change was significantly decreased in the monocrotaline (MCT) group compared to the control group. Compared to those in the monocrotaline (MCT) control group, the direct RV pressure measurement was decreased by 22%, the RV diastolic and systolic areas were decreased by up to 27%, and therefore, the RV fractional area change was increased by 25% in the Trimethylamine N oxide (trimethylamine (TMA)O)+monocrotaline (MCT) group. None of the measured parameters in the Trimethylamine N oxide (trimethylamine (TMA)O)+monocrotaline (MCT) group were significantly different from those in the control group. Overall, these results indicate that chronically elevated Trimethylamine N oxide (trimethylamine (TMA)O) levels in plasma and cardiac tissue do not affect cardiac functionality, while long-term Trimethylamine N oxide (trimethylamine (TMA)O) administration preserves myocardial mechanical function in monocrotaline-induced heart failure.",d4fa04de-4344-4c54-b4f6-7a55289e1af2
