,chunk_label,chunk_text,uuid
28,methods20," In problems that occur during a study, the main objective of Support Vector Machines (SVM) is to find the hyperplane that best separates the examples between high and low degree of adherence to the MD and at the same time to maximise the distance of separation between both examples and the hyperplane. That is it attempts to find the separation hyperplane that generalises in the best possible way (Burges, 1998). To achieve this goal, Support Vector Machines (SVM) introduces a particular mathematical concept known as kernel: it is a mathematical function that allows the conversion of the input space into a higher dimension, which is used to transform a non-separable linear problem into one that is separable. There are different kernel functions, which in general could be interpreted as a measure of similarity between two objects (60), and one of the most used is Gaussian Radial Basis (Radial Basis (RBF)), because basically any surface can be obtained with this function (61).",478795bd-9df6-4a45-b9b6-848b54ed6ecd
29,methods21," In this case, the domain of the parameters used to search for the best model consists of a grid search of two different parameters. The first one (parameter C) is directly related to the model and is used as a balance between the classification errors and the simplicity of the decision surface, while the second (gamma parameter) is the free parameter of the Gaussian function and in particular, Support Vector Machines (SVM) is very sensitive to changes in this parameter. For both parameters, and according to the usual practice, values were evaluated in potencies of two between −12 and 12. To better understand this technique, the following reading materials are recommended (Burges, 1998; Vert, Tsuda & Schölkopf, 2004; Cristianini & Shawe-Taylor, 2000).  Elastic Net (Tibshirani, 1994; Zou & Hastie, 2005) is based on lasso (penalised least squares method) and was specifically developed to solve some of the limitations encountered for this technique (56).",0f0520a3-ec3e-4a5d-a463-3d6df4736d0b
30,methods22," On the one hand, a grid search was performed on two different parameters, the alpha penalty parameter was searched (it has values in the range of 0–1) and in particular the following 0, 0.15, 0.25, 0.35, 0.5, 0.65, 0.75, 0.85 and 1. On the other hand, the best value of the lambda parameter was used, as recommended by the authors of the technique, from values less than or equal to one to negative powers of ten, in particular the following values were used: 0.0001, 0.001, 0.01, 0.1, 1.  Finally, a simple KNN (Hechenbichler & Schliep, 2004) assigned, through a decision rule, an unclassified example belonging to a class by frequency of occurrence to its k-most similar neighbouring examples. Then, in accordance to the distance of Minkowski for each of the examples and following the maximum accumulated kernel densities the weighted KNN are identified (Hechenbichler & Schliep, 2004; Samworth, 2012). In particular, neighbouring values of less than or equal to nine were used.",b6e24937-20dd-48a0-a764-eda5e005faf6
31,methods23," Therefore, this particular and improved implementation of a KNN used kernel functions to measure the degree of similarity of the examples, as previously mentioned in the case of the Support Vector Machines (SVM)s. ",2378654a-715e-40f7-a101-25f7be7893a3
32,results0," The dataset has a total of 38 variables employed to characterise the differences underlying in the data between high and low adherence to the MD. The data has been standardised using the z-score formula to have a mean equal to zero and a standard deviation equal to 1. Four different ML techniques were used to verify the results obtained, in an attempt to identify the technique that provides the best-performing results. Initially, the analysis of the complete set of study variables is carried out. It can be seen in Figs. 1A and 1B how the techniques present a fairly stable behaviour in the prediction. Even a simple a priori technique such as KNN obtains the best results of the entire experimental phase, indicating that almost all variables contain relevant information.",812b05a6-67c8-43bb-9848-5713db01210c
33,results1," In any case, in order to understand whether there is noise or contradictory or correlated information that may be hindering the learning process of the algorithms, a phase of dimensionality reduction will then be carried out.  10.7717/peerj-cs.287/fig-1 Figure 1 Summary of the performance (Area Under the Receiver Operating Characteristic Curve (AUROC)) of the four ML techniques (RF, Support Vector Machines (SVM), GLMNET and KNN) for each one of the subsets of features.  (A) Average of the experiments for each size analysed and (B) boxplot of the results in order to check the behaviour of the techniques through the learning process.  Additionally, a process of feature selection was carried out to reduce the number of variables as much as possible, so that the results could remain similar without statistical differences, if not better, for those obtained using all variables.",b55786da-26b6-4a17-b6b8-685949c850e5
34,results2," Our approach is a filter feature selection using a T-test to quantify the correlation between each feature and the class (high or low adherence to the MD) before the training process. Three subsets of 4, 16 and 32 features were evaluated of the original ordering according to the highest p-value from the T-test. The average Area Under the Receiver Operating Characteristic Curve (AUROC) results of the execution of the ten 10-fold cross-validation experiments are shown in Fig. 1.  As the number of features increases, there is a clear growing tendency in performance and obtained results in Area Under the Receiver Operating Characteristic Curve (AUROC) with 16 and 32 features are very close to those obtained with the full dataset. In any case, a study should be conducted on whether the differences are statistically significant between the subsets of 16, 32 variables and the full dataset to ensure that the subset with fewer features is statistically the best option. Finally, as shown in Fig.",fe16ee42-895e-446a-9917-ec898bca68e1
35,results3," 1A, Support Vector Machines (SVM) is the best model in three out of the four datasets, and manages to reach values closest to 0.94 in Area Under the Receiver Operating Characteristic Curve (AUROC).  However, as previously mentioned, a single mean measure is not enough and it is necessary to analyse the behaviour of the models during the whole experimental phase and to verify how stable they are, as shown in Fig. 1B.  Figure 1B shows that if the number of variables is very small (4), the models are skewed and there is a higher variability in the performance because there is not enough information in the data to find a good classification model. It is also important to note that the results obtained with 16 and 32 features showed that this variability was significantly reduced until reaching average and standard deviation values very similar to those obtained using all the variables.",0a86a50e-8d37-469d-9308-86932dcd705a
36,results4,"  As observed in the two previous figures, the best results in Area Under the Receiver Operating Characteristic Curve (AUROC) were obtained using Support Vector Machines (SVM). The same results in accuracy are shown in Fig. 2.  10.7717/peerj-cs.287/fig-2 Figure 2 Summary of the average performance of the experiments: (A) (Accuracy) and (B) (F-measure) of the four ML techniques (RF, Support Vector Machines (SVM), GLMNET and KNN) for each one of the subsets of features.  To check whether the difference between the three winning models (Support Vector Machines (SVM) with 16, 32 and all variables) is significant or not, a null hypothesis test was applied. Following the experimental methodology proposed in (Fernandez-Lozano et al., 2016a) for the normality condition we used the Shapiro–Wilk test (Shapiro & Wilk, 1965), with a confidence level α=0.05. with the null hipothesis that our results follow a normal distribution. The null hypothesis was not rejected with values W=0.",f2337788-75a3-4344-8e69-9b61db17b4fb
37,results5,"96179 and p-value=0.3438, therefore our results did follow a normal distribution.  Next, a Bartlett test (Bartlett, 1937) was performed, with a confidence level α=0.05 and with the null hypothesis that our data were heterocedastic. The test result indicates that the null hypothesis should not be rejected with a value of Barlett’s K-squared 2.3128 with two degrees of freedom and p-value=0.3146. The result of both tests indicates that a parametric ANOVA test should be conducted, with a confidence level α=0.05 assuming the null hypothesis that our results are statistically equal. The results of the ANOVA test indicates that we fail to reject the null hypothesis and the three ML models are statistically equal with an adjusted p-value=0.1124.",fe2fcf46-b864-42d2-b982-3dc4ccb3ab8c
38,results6," Consequently, a 16-feature model should be considered (basal metabolic rate (BMR), Mini Nutritional Assessment (MNA) total score, weight, height, bone density, waist-hip ratio, smoker, age, EDI-OD, circumference of the arm, activity metabolism, subscapular skin fold, subscapular circumference in cm, circumference of the waist, circumference of the calf, brachial area) as the best-performing one, and half of the initial features that are not relevant for the Support Vector Machines (SVM) were removed. ",26d2720a-278e-46d1-9569-50ba81faec2a
39,discussion0," To check whether our results are relevant and are in accordance with what has been previously published, the state-of-the-art articles published on the topic were reviewed, in an attempt to identify the degree of adherence to the variables most related to a MD. The search results led to previous studies that also found the variables identified by Support Vector Machines (SVM) as the most important, in particular basal metabolic rate (BMR) (Cutillas et al., 2013; Careau, 2017; Srivastava et al., 2017; Bonfanti et al., 2014), Mini Nutritional Assessment (MNA) total score (Farias et al., 2016; Zaragoza Martí et al., 2015; Abreu-Reyes et al., 2017), weight and height (De la Montaña Miguélez et al., 2012; Buckland, Bach-faig & Majem, 2008; Ortega Anta & López Sobaler, 2014; Travé & Castroviejo, 2011), bone density (Romero Pérez & Rivas Velasco, 2014; Savanelli et al., 2017; Melaku et al., 2017; Štefan et al., 2017) or waist-hip ratio (Downer et al., 2016; Estruch et al.",06893883-eabc-4e7e-aee6-634a5f1c28bd
40,discussion1,", 2016; Bertoli et al., 2015) and if the patient is a smoker (Zaragoza Martí et al., 2015; Marventano et al., 2017, Grao-Cruces et al., 2015). Therefore, the results were contrasted, ensuring the ability of ML techniques to identify underlying patterns in the data. According to the feature selection process, the remaining predictors are not relevant for all the ML techniques.  Conclusions  The first model based on ML that was proposed for the prediction of the degree of adherence to the MD depended on information related to different anthropometric variables, socio-demographic variables, nutritional status and self-perception of body image.  Initially, experiments with four different ML methods were performed and feature selection techniques were applied to reduce the dimensionality of the problem.",b8c39d36-eed9-4232-bf9a-c6d92dd8b7b9
41,discussion2," Support Vector Machines (SVM) is the best-performing model according to the experimental design after a null hypothesis test, and our study found that using a feature selection approach, the number of features could be drastically reduced to 16 (less than half of the initial number) achieving an equivalent performance value in Area Under the Receiver Operating Characteristic Curve (AUROC). The best model obtained was an Support Vector Machines (SVM) with an Radial Basis (RBF) kernel as a decision function. The importance of each one of the predictors cannot be studied because a nonlinear Support Vector Machines (SVM) is like a black box and the internal mapping function is unknown. Furthermore, the weight vector cannot be explicitly computed.  Finally, our results are in accordance with the findings of previous publications and have primarily served to establish new factors related to the degree of adherence to the MD.  Supplemental Information  10.7717/peerj-cs.",39b471b7-61ed-4fd0-bdcd-e876c94ef9be
42,discussion3,"287/supp-1 Supplemental Information 1 Raw data with the results of each of the experiments performed with each model.  This dataset was used to make the figures.  Click here for additional data file.  10.7717/peerj-cs.287/supp-2 Supplemental Information 2 Data collection questionnaire example.  Click here for additional data file.  Additional Information and Declarations  Competing Interests  Author Contributions  Ethics  Data Availability  The authors declare that they have no competing interests.  Alba Arceo-Vilas performed the experiments, analysed the data, performed the computation work, prepared figures and/or tables, authored or reviewed drafts of the paper, and approved the final draft.  Carlos Fernandez-Lozano conceived and designed the experiments, performed the experiments, analysed the data, performed the computation work, prepared figures and/or tables, authored or reviewed drafts of the paper, and approved the final draft.",cfe48e27-ad4a-4a07-8759-070226564773
43,discussion4,"  Salvador Pita conceived and designed the experiments, analysed the data, authored or reviewed drafts of the paper, and approved the final draft.  Sonia Pértega-Díaz conceived and designed the experiments, analysed the data, authored or reviewed drafts of the paper, and approved the final draft.  Alejandro Pazos conceived and designed the experiments, authored or reviewed drafts of the paper, and approved the final draft.  The following information was supplied relating to ethical approvals (i.e. approving body and any reference numbers):  The study received written approval from the Regional Ethics Committee for Clinical Research (code 2012/390 CEIC Galicia).  The following information was supplied regarding data availability:  Data is available at Figshare: Fernandez-Lozano, Carlos (2019): Identification of predictive factors of the degree of adherence to the Mediterranean diet through machine-learning techniques. figshare. Dataset. DOI 10.6084/m9.figshare.7628837.v2. =",1b04854e-c6f0-41c1-9489-89b81e6cef6e
