,chunk_label,chunk_text,uuid
0,introduction0," The economic development, urbanisation and industrialisation worldwide have changed individuals’ eating habits and lifestyles, such as smoking, excessive consumption of alcohol, sedentary lifestyle and stress, leading to a nutritional transition which its principle cost in the health sector, is the appearance of non-transmissible chronic diseases.  A consequence of the alteration of dietary patterns is what has been called ‘epidemic obesity’, defined by the World Health Organisation (World Health Organisation (WHO)) as the first non-viral epidemic of the 21st century, with 500 million obese people worldwide (Finucane et al., 2011; Krzysztoszek, Wierzejska & Zielińska, 2015) affecting more than 50% of the adult population in Spain (López-Sobaler et al., 2016; Anta et al., 2013; Rodriguez Rodriguez et al., 2011).",10e28a81-cc67-4327-8eaa-22e3533b0f4d
1,introduction1,"  The assessment of nutritional status of a population is one of the best indicators of the health status of the said population, being a methodology that must include three important aspects: a global assessment, a study of the dimension and a study of body composition (Ravasco, Anderson & Mardones, 2010). With adequate interpretation of the findings, appropriate therapeutic measures should be taken to correct deviations from normality.  In the context of nutrition and public health, the Mediterranean diet (MD) has been forged over the centuries, being characterised by cereal, olive oil, low saturated fats and meat, moderate consumption of dairy and a regular and moderate intake of wine, being a lifestyle in accordance with geographic, climatological, orographic, cultural and environmental conditions within the countries and regions that surround the Mediterranean Sea (Pérez & Aranceta, 2011).",e5e40cdc-0ebe-4e24-adc8-f3b0f913a1c3
2,introduction2,"  There is an increasing interest in the study of the preventive role of MD and also as a treatment for various pathologies associated with chronic inflammation, such as metabolic syndrome, diabetes mellitus, cardiovascular disease (cardiovascular disease (CVD)), neurodegenerative diseases, breast cancer and psycho-organic deterioration, leading to greater longevity and better quality of life (Dussaillant et al., 2016; Chrysohoou et al., 2004; Trichopoulou, 2004; Serra-Majem, Roman & Estruch, 2006; Estruch et al., 2013; Sofi et al., 2014; Della Camera et al., 2017). Moreover, the importance of MD has also been identified as a potential element contributing to the prevention of breast cancer (Shapira, 2017) or in patients carrying the BRCA mutation . In 2010; UNESCO declared this diet an Intangible Cultural Heritage of Humanity (UNESCO, 2010).",665f9bb7-ea6a-46a6-885e-d64e02fc050e
3,introduction3,"  Numerous studies have been published over the past decades, showing the relationship between MD intake and cardiovascular disease (CVD) (Martínez-González et al., 2015; Widmer et al., 2015), and meta-analyses that relate it to general health status . In the Greek cohort EPIC (European Prospective Investigation into Cancer and Nutrition Study) a 2-point increase in adherence to this diet was associated with a 33% reduction in cardiovascular disease (CVD) mortality . Additionally, the analysis of a sub-cohort of 2,700 individuals over 60 years old, with a history of myocardial infarction showed that a greater adherence to MD had an 18% drop in overall mortality . Other studies have confirmed these associations, including the follow-up of a Spanish cohort of 13,600 adults with coronary heart disease.",7fee3dc7-c739-45e6-b626-fab05d8f8903
4,introduction4," After 5 years, it was observed that two points of increase in adherence to MD were associated with a 26% decrease in coronary risk .  Eating disorders are linked to a distorted perception of one’s own body image, as well as to body dissatisfaction. The importance of a study on body dissatisfaction is due to the fact that recent investigations have confirmed that alterations in body image have a causal participation in an eating disorder, rather than being secondary to it (Míguez Bernárdez et al., 2011). Body image is considered a qualitative approximation to the nutritional status of the individual  and can be determining for their nutritional management (Martínez-González et al., 2011).  One of the main fields of application of Machine-Learning (ML) techniques since its origins is in the field of Biomedicine, finding previously published studies in related areas such as biomedical image (Fernandez-Lozano et al.",b5a19bdf-b9fc-4705-b852-60a91573818c
5,introduction5,", 2016b), characterisation of different types of carcinomas , measurement of activity in genetic networks , deformable models for image comparison , gene selection, and classification of microarray data (Díaz-Uriarte & De Andrés, 2006), to name a few.  Moreover, due to the great versatility of ML techniques, they have been used in a wide variety of application areas, to discover hidden patterns in the datasets: identification and authentication of tequilas (Pérez-Caballero et al., 2017), wearable sensor data fusion (Kanjo, Younis & Sherkat, 2018), predicting the outcomes of organic reactions , animal behaviour detection (Pons, Jaen & Catala, 2017) or to measure the visual complexity of images .",e6616eca-b0aa-4896-a406-f5e89422f5c4
6,introduction6," In particular, ML techniques have proven to be able to uncover unimaginable relationships in very diverse fields of application, such as image or voice recognition, sentiment analysis or language translation (Li, Li & Wu, 2015; De Viñaspre & Oronoz, 2015).  The main objective of this work is the development of ML models for the prediction of the degree of adherence to the MD. To this end, information on different anthropometric and socio-demographic variables, nutritional status and self-perception of body image is used in order to identify which of the variables have a greater influence and are key in the adherence to a healthy diet such as MD, allowing our patients to improve their quality of life and to reduce the negative effects of well-known and related diseases.",622100c6-7d3c-457b-9166-008c4149f02f
7,introduction7,"  Taking into account all of the above, the experimental methodology proposed in the development of this study is based on the collection and generation of data to be analysed with our cohort in Galicia (Spain), as well as on the use of ML techniques. The purpose is to extract and explain the underlying information in the data and determine which of these variables are the most important to classify people as having either a good or poor adherence to the MD. As mentioned before, there are several health benefits related to this particular food diet, especially for: chronic inflammation, metabolic syndrome, diabetes mellitus, cardiovascular disease (CVD), neurodegenerative diseases, cancer and psycho-organic deterioration, moreover leading to greater longevity and better quality of life. Thus, this study is relevant for understanding how to measure the degree of adherence, in order to ensure the aforementioned benefits.",8fdbbf84-fc06-4269-b06b-92996287055c
8,introduction8,"  The structure of the article is as follows: in the Materials and methods section, the subjects are presented, the variables are measured for each of them. Next, the machine learning and feature selection techniques are described, along with the experimental design followed to ensure that the results are reproducible and representative of the studied problem. In the next section, the results are presented and discussed, and the final section of the article includes the conclusions of the work.  ",3bf2257a-5fd2-448d-b6ec-35005377ca32
9,methods0," The present study was structured as follows. Initially, a population from our cohort was selected to carry out the study; the population was grouped into two categories: with high and low degree of adherence to the MD. Once the set of the population on which the study will be carried out has been identified, the information is collected from each of the users of the health system. The type of study carried out will be described below, as well as the sample size will be justified and all measurements collected will be explained in detail. Once the dataset is generated, it will be analysed with four different ML techniques and a feature selection phase will be applied for dimensionality reduction.  Population and data description  This is an observational prevalence study, conducted in Northwestern Spain (municipality of Cambre, A Coruña, Spain), which included a randomly selected population aged 40 years and over.",5ca240eb-6098-4451-a24a-1ae9827308b0
10,methods1," The sampling population consisted of individuals residing in Cambre, identified through the National Health System card census. In Spain, the National Health System has universal coverage, and almost all Spanish citizens are beneficiaries of public healthcare services.  The sample size was calculated taking into account the total population of the municipality (n=12,446). After stratification by age and gender, (n=503) persons were selected to participate in the study. Sample size was estimated using the single proportion formula, with 95% confidence Interval. A sample size of (n=503) subjects was estimated based on an adherence to MD rate of 50%. Precision was set at 4.3% and percentage of losses at 10%. Population data is shown in Table 1.  10.7717/peerj.cs.287/table-1 Table 1 Population data of the municipality of Cambre (A Coruña) for the year 2012 and sample data according to age and sex.  Age groups	Population	Sample	 Total	Men	Women	Total	Men	Women	 40–44	2,465	1,202 (26.",93026e4a-727f-4364-8466-eb854cf3fe1b
11,methods3," The patients who could not go to the health centre due to personal or displacement reasons and those who suffer from a cognitive impairment, making it impossible for them to perform the study, were excluded. The study received written approval from the Regional Ethics Committee for Clinical Research (code 2012/390 CEIC Galicia).  The information described below was collected from each selected subject: socio-demographic variables: age, gender, level of education, marital status and relationships of coexistence; prevalence of arterial hypertension and smoking: the systolic and diastolic blood pressure of each patient was recorded at the beginning and at the end of the visit, obtaining the prevalence of arterial hypertension; the smoking habit was recorded according to self-reported information.",04554068-e9ff-4964-a9c8-c8a3a88fcd47
12,methods4," Anthropometric variables: the anthropometric parameters allow us to know the state of the protein and caloric reserves, besides providing guidance to the health professional about the consequences of the imbalances in these reserves.  All measurements were made during the same session, to avoid variations in the environmental or biological conditions. For the measurement of weight and size, the person was barefoot and with light clothing; an MB-201T plus Asimed scale-rod was used with an accuracy of 100 grams (weight) and 1 mm (size). BMI was obtained by means of the BMIratio=weight(kg)height(m2), and grouped according to the World Health Organisation (WHO) classification of BMI<18.5kgm2: low weight; 18.5–24.99 kgm2: normal weight; 25–29.99 kgm2: overweight, and ≥30kgm2: obesity.",cd664bb4-9a25-4862-b015-043011fe3d4e
13,methods5,"  The waist and hip circumference was measured with an inelastic tape measure with the patient standing upright, the abdomen relaxed, the upper limbs hanging at the sides, and with the feet and knees joined together. The waist circumference was measured by taking the mid-point between the lower costal margins and the iliac crests, as it is considered a risk factor for cardiovascular disease (CVD) when it is wider than 80 cm in women and wider than 94 cm in men, and a very high risk if it exceeds 88 cms and 102 cms, respectively .  The hip circumference was measured as the maximum circumference around the buttocks. Based on these two values, the waist-hip ratio was calculated using the cut-off points proposed by the World Health Organisation (WHO), where normal levels of 0.8 are found in women and one in men, higher values indicating abdominal visceral obesity, which is associated with increased cardiovascular risk (Jover, 1997).",caf86363-933c-4efc-a628-49a914ef919f
14,methods6,"  The calf circumference was measured in the widest section of the ankle-knee distance (cuff area) showing a good correlation with fat-free mass and muscle strength (Rolland et al., 2003; Barbosa Murillo et al., 2007; Bonnefoy et al., 2002). The measurement was carried out with an inextensible tape measure in cm.  Subscapular skin fold, this fold measures truncal obesity. The measurement is made one centimetre below the lower angle of the scapula, following the natural furrow of the skin. The scapula protrudes when the arm is carefully placed behind the back and the lower angle can be located this way. The measurement of the fold will be diagonally over an angle of 45° to ensure the correct thickness measurement. The plicometer forceps should be applied 1 cm in the inferolateral position to the thumb and finger that lifts the fold.",6046a380-ecc7-4f81-ada6-f58e7f563205
15,methods7,"  To assess the amount of subcutaneous adipose tissue, the skin folds were measured in millimetres in the tricipital, bicipital, subscapular and suprailiac areas. A digital calliper Trim metre was used, including a double layer of skin and underlying adipose tissue, always avoiding the muscle. The tricipital skinfold was measured longitudinally, at the back of the non-dominant upper limb, at the midpoint between acromion and olecranon, with the limb relaxed, parallel to the axis of the arm; the bicipital fold was measured at the same point as the tricipital, but on the under arm.  The circumference of the arm was measured with an inextensible anthropometric tape measure in cm. The measurement was taken at the midpoint of the non-dominant arm, in the same place where the tricipital skinfold was measured and without compression with the anthropometric tape.",b57027ea-088e-4c97-9339-3850711310cb
16,methods8,"  Once the data of the different measurements were obtained, the mid-arm muscle circumference was found, with which the skeletal muscle mass of the patients (protein compartment) was known and expressed in cm. The arm muscle area indicated that the muscle compartment was based on the brachial circumference and tricipital skinfold measurements. The fat area of the arm indicated that the patient’s fatty compartment used the total brachial area and the muscular area of the arm. The Adipose Muscular Index, which evaluates the nutritional status from the adipose and muscular areas of the arm, was also calculated, being essentially applied in the assessment of obesity.  For the determination of body fat percentage by electrical bio-impedance, a Beurer and BG55 model bio-impedance metre was used, with a maximum capacity of 150 kg and a precision of 0.1% for body fat, body water and muscle percentage, and 100 g for body weight, according to the information provided by the manufacturer.",a42800ed-30eb-4d55-8ec8-a87582959d1c
17,methods9,"  These methods are based on physical principles, such as the different ability of conduction or resistance that the tissues show to the passage of an electric current, with greater conductivity of the lean tissues than the fatty ones . Thus, by means of bio-impedance, the following values were obtained: weight, fat mass, liquid mass, muscle mass, bone density, basal metabolic rate (basal metabolic rate (BMR)) and activity metabolism. Data on socio-demographic variables, such as age, gender (male/female), cohabitation (with whom the live), prevalence of current smokers, ex smokers (patient stopped smoking more than 12 months before entering the study) and non-smokers were estimated. Additionally, blood pressure was recorded.  Adherence to the MD  Consumption of a characteristic food pattern of MD is associated with numerous health benefits.",7d3886a5-42dc-4fe6-ba09-38f0eac4d750
18,methods10," These benefits are attributed to bioactive compounds that exert synergistic effects and decrease the risk for development of chronic diseases.  In order to assess the quality of dietary habits (adherence to a Mediterranean dietary pattern), the MD adherence test was used . It is a questionnaire consisting of fourteen quick questions that allow us to understand whether participants’ usual diet can be considered as following the parameters of the MD. Each question answered affirmatively adds a point. It is considered that a person correctly follows the MD when their score is equal to or greater than nine points.  The assessment of nutritional status was determined using the Mini Nutritional Assessment (Mini Nutritional Assessment (MNA)) questionnaire .",5b9ea146-edc2-46ef-9f40-0174e6fece3f
19,methods11," It is a validated method which, through eighteen short questions, evaluates anthropometric measures, dietary habits, lifestyle, pharmacological treatments and mobility, and performs a subjective evaluation of health and nutritional status. The total value of the Mini Nutritional Assessment (MNA) scale is thirty points, a score <17 being considered malnutrition, there is a risk of malnutrition between 17 and 23, 5, and well nourished subjects obtain scores of 24 points and higher.  A measure of subjective weight is included by asking: ‘I consider that my weight is: (A) higher than normal, (B) normal, (C) lower than normal’, following the model proposed in . Based on the answer, the population is classified into three groups: ‘fairly subjective weight’ those who believe to be at an ideal weight, ‘more subjective kilograms’ for those who believe that they are overweight and ‘less subjective kilograms’ for those who think they weigh less than they should.",5635faed-f64a-461b-b2da-09fc0011cfc0
20,methods12,"  Two of the eleven sub-scales of Garner’s Eating Disorder Inventory (EDI-2) (Garner, 1998) were used to study body image: Body Dissatisfaction (EDI-IC) and Obsession for Thinness (EDI-OD), as they evaluate aspects directly related to perceptual alterations. The body dissatisfaction sub-scale (EDI-CI) measures the dissatisfaction of the subject with the general shape of their body or with those parts of the body that most concern those with eating disorders (stomach, hips, thighs, buttocks). The thinness obsession sub-scale (EDI-O) measures concern about weight, diets and fear of getting fat.  This questionnaire was validated in Spain by . The fourteen items of these two sub-scales were mixed in the questionnaire to avoid the subjects guessing the construct being evaluated. All items were answered and corrected according to the form proposed in the questionnaire manual.",303d121c-36b4-4f21-aeac-000e56e1225e
21,methods13," The MD Adherence test was used to determine the degree of adherence to the MD, being a short specific questionnaire of fourteen items validated for the Spanish population and used by the MD Prevention Group (Prevention Group (PREDIMED)) (Martínez-González et al., 2015).  Machine learning and statistical analysis  The authors tested different ML techniques for solving this problem, using cross-validation techniques to avoid over-training, while ensuring that the generalised capability of the model is the best possible, as well as different runs of the experiments to check the behaviour of the techniques. Thus, all experiments were repeated ten times to check the stability of the results and the observed deviation between the experiments was small, as shown in the results section.",eefac94a-f349-4920-8f84-a3b90263ee38
22,methods14," In particular, a tenfold cross validation was used to divide the dataset in such a way that nine random partitions were used to train and one to validate the results, each time taking a different subset for validation.  In order to compare the performance of the ML techniques, the Area Under the Receiver Operating Characteristic Curve (Area Under the Receiver Operating Characteristic Curve (AUROC)) was used. This is a combined measurement which, besides being independent of the threshold used, includes both Type I and type II errors, ensuring that it is not conditioned by differences in the total number of cases of each class (Fawcett, 2006).  An experimental design was employed (Fernandez-Lozano et al., 2016a), allowing us to divide the data using a cross-validation technique which ensured that the performance results obtained, as mentioned above, were not skewed.",6f13ef03-c484-488f-a88c-cba79d501dfe
23,methods15," That is they were adjusted to the data, and researchers are able to identify which of the hyper-parameters are most suitable to find the best model with each ML techniques, according to its particular hyper-parameter configuration. To this end, the programming environment R (R Core Team, 2016) and the package mlr  were used, which also allowed us to perform the considered experimental design. In addition, another of the objectives pursued by this study was to find as few variables as possible that would yield a performance value as high as possible, preferably at least equal to that obtained using all available variables. This is basically a feature selection approach where the main aims are the following: avoid overfitting and improve model performance, to provide faster and more cost-effective models, and moreover to gain a deeper insight into the underlying processes that generated the data as mentioned in (Saeys, Inza & Larrañaga, 2007).",cd4bafaf-3f04-468b-a7c9-b4c9ee7bbd2d
24,methods16," There are three approaches in ML to perform this process and the use of a filter approximation was chosen, for its velocity and independence of the classifier (Saeys, Inza & Larrañaga, 2007). In general, performing this feature selection process helps to reduce inherently the present noise in such datasets.  The final step of our experimental analysis was a null hypothesis test for choosing the best model in order to ensure whether the performance of a particular ML technique is statistically better than the others or not. In our case, as there were more than two repeated measures, an ANOVA or a Friedman test should be considered. In particular, three different conditions should be checked: normality, independence and homoscedasticity. If our results fulfil the three conditions, a parametric test is applicable, and the ANOVA one should be considered, otherwise the non-parametric version, the Friedman test.",6309a730-eab3-4665-860d-fa656d5a7a59
25,methods17," Finally, a post hoc procedure had to be used in order to correct the p-values for multiple testing.  Machine learning techniques for classification problems  A large number of experiments were carried out in an attempt to identify the best ML model able to solve the problem and to ensure that the results are reproducible, real and obtained under equal conditions. In addition, the search space was explored for the best possible parameters for each technique in the same way, so that all techniques could have the same possibilities of exploration across the same subsets of data and avoid the over fit that could occur. In particular, the following well-known state-of-the-art techniques were implemented: Random Forest (RF) (Breiman, 2001), Support Vector Machines (Support Vector Machines (SVM)) (Cortes & Vapnik, 1995; Vapnik, 1995), Elastic Net (ENET) (Tibshirani, 1994; Zou & Hastie, 2005) and weighted k-Nearest Neighbours (KNNs) (Hechenbichler & Schliep, 2004).",3bf51ac2-1643-4cf3-b9fa-98cb59cd6422
26,methods18,"  Random Forest (Breiman, 2001) is a state-of-the-art ML technique that was used in multiple domains with good results. One of its main strengths is that the results obtained are very easy to understand, it is based on very simple concepts and in general, although it is applied with little experience in the parametrisation of hyper-parameters, good results are obtained. This technique combines multiple decision trees, each of them tuned over a subset of bootstrapped data. In this way, RF combines each of the individual predictions of the decision trees into a global prediction that, in general, is more successful than any of the simple ones. Of all the possible variables in the dataset, a number were randomly selected (with replacement) and a number of trees were constructed based on the set of examples used for the training phase and obtained from the previously selected subset.",e286c4c2-2154-4d94-a0b0-9d0f7d767ff5
27,methods19," When there are classification problems, it is recommended to use a square root number of the total number of variables existing in the dataset. To explore the solution space in the best way possible, in our experiments we used a parameter domain that was adjusted by a grid search and that, for a number of trees (1,000), we explored randomly selected values of variables (2–6). In addition, values that varied (1–4) according to the size of the terminal nodes of the tree were explored.  Support Vector Machines (Cortes & Vapnik, 1995; Vapnik, 1995) is also one of the ML techniques that have been commonly used in different domains in recent years and have obtained good results. In fact, along with RF, it is one of the algorithms considered state-of-the-art, easy to understand, and the results obtained are verifiable.",7e6817ed-7e9b-445b-acf4-e351e2b4ed5a
