,chunk_label,chunk_text,uuid
26,results14," The extent to which rectangles deviate from the diagonal line of no bias indicates the extent of disagreement, and the position (above/below) indicates direction of the disagreement. highly processed foods (HPF): highly processed food  Dietary, lifestyle and cardiometabolic characteristics of PREDIMED-Plus participants according to the sQ-highly processed foods (HPF) score  We aimed to investigate whether changes in highly processed foods (HPF) consumption as estimated from the food frequency questionnaires (FFQ) and the four different systems were also detected when the sQ-highly processed foods (HPF) was used. In addition, we wanted to analyze the dietary profile across tertiles of the sQ-highly processed foods (HPF) score, since this is a tool to evaluate a particular dietary pattern.",7fcbf2a9-b0e5-4194-8557-417570d11d13
27,results15," Dietary characteristics of PREDIMED-Plus participants at baseline are shown in Table 5, grouped by highly processed foods (HPF) consumption tertiles according to the score obtained in the sQ-highly processed foods (HPF) (T1 – lowest score, T3 – highest score). Consumption of food groups included in the questionnaire was the highest for subjects in T3 of the sQ-highly processed foods (HPF) score, which was not the case for vegetables, fruits, and legumes. Dairy products and fish consumption were not different among tertiles. With all the classification systems, subjects in T3 showed the highest highly processed foods (HPF) consumption (percentage over total grams per day: 12.45 ± 8.51 for NOVA, 54.85 ± 11.01 for International Agency for Research on Cancer (IARC), 29.26 ± 12.02 for International Food Information Council Foundation (IFIC) and 30.34 ± 12.40 for University of North Carolina (UNC), 35.05 ± 12.24 for questionnaire estimated highly processed foods (HPF) consumption).",e9bff852-d92e-44fd-9b3d-ce809956ba7f
28,results19," N = 4400  Associations between lifestyle and cardiometabolic parameters and highly processed foods (HPF) consumption have been previously reported, so we next aimed to analyze if we could detect changes in these variables across tertiles of the sQ-highly processed foods (HPF) score. Lifestyle and cardiometabolic characteristics of PREDIMED-Plus participants at baseline grouped by highly processed foods (HPF) consumption tertiles showed differences according to the sQ-highly processed foods (HPF) score (Table 6). Participants ranked in the highest tertile had higher levels of triglycerides (161.05 ± 90.55 mg/dL), higher weight (90.68 ± 13.10 kg) and waist circumference (109.83 ± 9.45 cm) compared to those in the lowest tertile. No significant changes among tertiles were detected in fasting glucose and total cholesterol levels. Subjects in T3 of the sQ-highly processed foods (HPF) score spent more time watching TV than T1 subjects (4.05 ± 2.",a3df9077-e25d-4343-a8d8-0d80602b7a51
29,results22,"05) shown in bold  Body Mass Index (BMI) Body Mass Index, PA Physical activity  1For continuous variables, p-values are adjusted for age, sex, recruitment center, energy intake, physical activity level, medication for blood pressure and diabetes, working status, educational level, and civil status  aNumber of binges per week is calculated for those who answered “yes” to the question “binge eating” (overall n = 313, n by tertiles: T1 = 114, T2 = 80, T3 = 119). N = 4400  Assessing longitudinal changes in highly processed foods (HPF) consumption with the sQ-highly processed foods (HPF)  Longitudinal analysis of highly processed foods (HPF) consumption estimated from the food frequency questionnaires (FFQ) by each classification system revealed significant differences across the first 3 years of the PREDIMED-Plus study. In all cases, mean highly processed foods (HPF) consumption showed a trend towards a decrease that was lower in year 2 than baseline (Table 7).",cfd7778b-b616-4040-8447-82e28eef87a6
30,results24,"22)	14.7 (0.22)	14.8 (0.22)	< 0.0001	 Data are shown as “adjusted mean (standard error, SE)”. Linear mixed model used to assess changes in highly processed foods (HPF) consumption over time, adjusted for age, sex, recruitment center, energy intake, physical activity level, medication for blood pressure and diabetes, working status, educational level, and civil status. Significant linear trend p-values (< 0.05) shown in bold. highly processed foods (HPF) consumption was estimated as the percentage over total grams per day, except for fried foods (data not available). N = 3284 ",86f76431-45a1-4b11-8eda-c20969e73179
31,discussion0," This article presents the sQ-highly processed foods (HPF), a short, integrative, and easy-to-use questionnaire to estimate highly processed foods (HPF) consumption (Table 4). The development process involved a carefully designed statistical analysis and practical considerations for its use in a clinical/epidemiological context. This new tool includes 14 food and beverage items of which the frequency of consumption is recorded, based on a previously validated food frequency questionnaires (FFQ) from the PREDIMED-Plus Trial [38–40]. Each item is scored as 1 if the frequency of consumption corresponds to the highly processed foods (HPF) dietary pattern, according to the calculated thresholds, and as 0 otherwise. Therefore, the higher the score, the higher the consumption of highly processed foods (HPF).",d2487deb-2bf4-4a9e-bfc2-a683275b99e3
32,discussion1," Moreover, this score can be used to estimate the percentage of highly processed foods (HPF) consumption over total intake, avoiding the need to administer a lengthy food frequency questionnaires (FFQ) (Table 4) [63].  The present work demonstrates that statistical approaches such as exploratory factor analysis (EFA) and Cronbach’s analysis are valuable tools for developing integrative tools related to dietary patterns and eating habits. Indeed, analysis of questionnaire items through exploratory factor analysis (EFA) demonstrated that they identified one core construct, the highly processed foods (HPF) dietary pattern (Table 3) [64]. This was expected considering that items were selected based on a positive association with the variable tertile agreement through binomial logistic regression (Table 1). This resulted in 14 questions based on the frequency of consumption of food groups associated with a higher highly processed foods (HPF) consumption.",699f3398-c37f-492f-a6fc-e78c386aed9c
33,discussion2," One of the reasons for this was that, in this way, the questionnaire could identify people with an highly processed foods (HPF) dietary pattern with a focus on the frequency of consumption and not on the specific highly processed foods (HPF) items they consumed, so that the questionnaire could detect different highly processed foods (HPF) dietary patterns. Another reason for the selection of items is that the questionnaire can also provide information on how to intervene to improve health in other populations by identifying the food groups most frequently consumed by the respondent and allowing for customized targeting of the dietary intervention to reduce consumption of those food groups. Finally, this selection was performed to simplify the use and interpretation of the questionnaire. In this way, the questionnaire rapidly results in a score that increases with highly processed foods (HPF) consumption and can be used to categorize the respondent accordingly.",6545e84b-7516-4223-9315-36d443119fac
34,discussion3," Notably, the questionnaire was designed to encompass criteria from four leading food processing-based classification systems – NOVA, International Agency for Research on Cancer (IARC), International Food Information Council Foundation (IFIC), and University of North Carolina (UNC) –, so the categorization as highly processed foods (HPF) consumer occurs according to at least two of these classification systems (tertile agreement) [20]. This is a key asset of the sQ-highly processed foods (HPF), which makes it more comprehensive than other methods that have been proposed and are limited to one classification system [63]. In this regard, the limitations of the NOVA system, the most used classification system, have been widely discussed [65] and it has been shown that the choice of the classification system can have a significant impact on research outcomes [20].",cbc6daa5-7fdd-4dc7-8c10-d415af5c480a
35,discussion4," Therefore, the integrative approach used to create the sQ-highly processed foods (HPF) is undoubtedly a critical advantage contributing towards an objective measurement of highly processed foods (HPF) consumption and its association to disease. In addition, a reason for choosing food groups rather than specific food items was that this would allow assigning specific food items to groups in the questionnaire - even if they were not initially considered because they were not present in the food frequency questionnaires (FFQ) - attending to similar characteristics than one of the 14 food groups.  Another significant advantage of the sQ-highly processed foods (HPF) is its quick and easy administration and interpretation, regardless of the method of administration (i.e., self-reported or interviewer-led).",0eed0ab6-b463-4d35-88af-8d09e2f6f577
36,discussion5," This is particularly useful at the epidemiological level, where a high volume of responses is often collected and the length and subsequent processing of questionnaires is an important aspect of study design [66]. Despite its apparent simplicity, the ability of the sQ-highly processed foods (HPF) to classify subjects according to their highly processed foods (HPF) consumption is comparable to other more involved classification systems (Supplementary Table 2). As a reflection of this, longitudinal changes in highly processed foods (HPF) consumption estimated by the four classification systems were also detected with the same significance by the sQ-highly processed foods (HPF) estimation (Table 7). Furthermore, significant differences among participants grouped according to sQ-highly processed foods (HPF) scores could be detected in weight, waist circumference, and hours spent watching TV, among others (Table 6).",21e79790-ee50-46c8-ab48-6ec3a708690d
37,discussion6," These results indicate the potential of the sQ-highly processed foods (HPF) as an initial tool to evaluate the impact of highly processed foods (HPF) consumption on lifestyle in large-scale intervention trials, such as PREDIMED-Plus. For these reasons, we firmly believe that the consistent use of the sQ-highly processed foods (HPF) in epidemiological studies could contribute to a robust understanding of the relationship between highly processed foods (HPF) dietary patterns and health.  The applicability of the sQ-highly processed foods (HPF) spans not only epidemiological research but also public health and clinical nutrition. The use of “a priori” screening tools to define dietary habits and patterns plays an important role in developing personalized nutrition advice [67].",b46ca3c8-0e06-4540-9b80-7f9f4d7ff5bc
38,discussion7," Several epidemiological studies have shown the importance of using dietary patterns to assess the association between dietary exposure and risk of developing chronic diseases [14], giving rise to valuable screening tools aimed at large populations [68]. Most of the developed scores and indices emphasize the importance of healthy dietary habits – Mediterranean diet [41, 69], Nordic diet [70], “healthy” diet [71, 72] – based on a theoretical rationale. However, some studies have reflected the need to capture deleterious eating habits that present a counteractive distortion over the beneficial effects of these diets [67].",9b8888d1-b95d-4a43-ac40-30c3a1b50842
39,discussion8," In this regard, some approximations focused on the assessment of positive health effects of the diet have included potentially harmful items in their composition, such as the Healthy Eating Index (Healthy Eating Index (HEI)) [73, 74] and the Alternate Healthy Eating Index (HEI) (Alternate Healthy Eating Index (HEI) (AEHI)) [75] to encapsulate the global adequacy to dietary guidelines. The sQ-highly processed foods (HPF) presented here could thus be a complementary tool that counteracts the analysis from questionnaires aimed at healthy dietary effects. In addition, its simplicity makes it easy to be implemented in the clinical practice, for example, at the level of primary care, for disease-preventing purposes. Furthermore, the sQ-highly processed foods (HPF) integrates the divergent ultra processed foods (UPF) and highly processed foods (HPF) definitions through an agglomerative statistical analysis of commonly used criteria, which provides additional consistency to its application.",f70da87b-47b7-406b-8dc7-7c2af3557081
40,discussion9,"  Regarding public health applications, the limitation of the so-called “discretionary foods” consumption has been gradually incorporated into health policies [76–78]. These foods include confectionery, soft drinks, biscuits, snacks, cakes and pastries, among others [76], most of which are considered highly processed foods (HPF) [30]. In keeping with this, we propose the use of the sQ-highly processed foods (HPF) as a screening tool to identify trends in consumption of these types of foods in large populations [79], to consistently identify foods that can be targeted in public health campaigns [19]. This will also contribute to harmonizing the methods of assessing government policies addressing the healthiness of food environments, a well-exposed need for the worldwide prevention of diet-related diseases [11, 19, 80].  One of the main limitations of the ad hoc development of the sQ-highly processed foods (HPF) is that its reproducibility in other populations is necessary.",4f6b5443-08fa-4fc9-8f69-14c3f6e56f88
41,discussion10," The PREDIMED-Plus cohort comprises older adults with metabolic syndrome and overweight or obesity and a limited highly processed foods (HPF) consumption, so the reproducibility of the sQ-highly processed foods (HPF) in populations with different characteristics will require further validation. Another limitation is that the food frequency questionnaires (FFQ) used for the initial development of the questionnaire is not specifically designed to measure highly processed foods (HPF) consumption. However, it contains a considerable number of items categorized as highly processed foods (HPF) and ultra processed foods (UPF) by current food processing-based classifications [20]. These include industrial biscuits, milkshakes, bakery products, cured meats, Ready To Eat (RTE) preparations, snacks, and soft drinks.",39e10f92-3e05-4736-8222-d5a6b814c25a
42,discussion11," Therefore, the sQ-highly processed foods (HPF) was constructed so that specific highly processed foods (HPF) are very likely to fall into one of the groups defined in the questionnaire due to their similar description and characteristics to the items already specified in the questionnaire. The use of an food frequency questionnaires (FFQ) has other limitations, such as recall bias that can impact the accuracy of the data collected [40], but its use to evaluate dietary intake in large epidemiological studies is widely recognized as suitable [39]. We aimed to develop a screener for highly processed foods (HPF) consumption, so it could be used as a tool that allowed rapid screening of a large population and the identification of consumers with a high highly processed foods (HPF) dietary profile.",314b603a-f9e0-4cb5-aa67-20571967eb80
43,discussion12," For an in-depth study of the specific items that make up the dietary pattern of each consumer, it will still be necessary to use more detailed food frequency questionnaires (FFQ)s or dietary recall interviews. Different research teams have developed food frequency questionnaires (FFQ)s aimed to evaluate dietary intake from highly processed foods (HPF)s [81, 82], so it would be of interest to compare these to the sQ-highly processed foods (HPF) through intra-class correlation coefficient analyses. In the case of a good correlation, we think that the sQ-highly processed foods (HPF) would present the advantage of being shorter and more direct regarding the estimation of highly processed foods (HPF) consumption, which will facilitate the work in epidemiological research and clinical practice.",fe55807b-056f-4cc4-b2a5-72787f8e138f
44,discussion13,"  Conclusions  The sQ-highly processed foods (HPF) is an integrative, short, and easy-to-use questionnaire that can be used to screen highly processed foods (HPF) consumption in large populations for epidemiological or public health purposes. Due to the straightforward score calculation and interpretation, it could aid Personalized Nutrition practice and food policy-makers in the implementation of effective strategies to tackle diet-related disorders associated with highly processed foods (HPF) consumption.  Supplementary Information  Additional file 1.  Additional file 2.",3323876d-423e-4b0d-ae06-5b862ba910fc
45,discussion14,"  Abbreviations  er-MedDiet Energy-restricted Mediterranean diet  food frequency questionnaires (FFQ) Food frequency questionnaire  highly processed foods (HPF) Highly processed food  International Agency for Research on Cancer (IARC)-European prospective investigation into Cancer and nutrition (EPIC) International Agency for Research on Cancer - European Prospective Investigation into Cancer and Nutrition  International Food Information Council Foundation (IFIC) International Food Information Council  MetS Metabolic syndrome  Nurses’ Health Study (NHS) Nurses’ Health Study  PA Physical activity  PREDIMED from the Spanish “PREvention with MEDiterranean DIet”  sQ-highly processed foods (HPF) Screening questionnaire of highly processed foods (HPF) consumption  University of North Carolina (UNC) University of North Carolina  ultra processed foods (UPF) Ultra-processed food  Acknowledgements  The authors especially thank the PREDIMED-Plus participants for their enthusiastic collaboration,",9008feb4-8a89-4e96-a268-5264fe3b6554
46,discussion15," the PREDIMED-Plus personnel for their outstanding support, and the personnel from associated primary health care centers for their exceptional effort. Centre for Obesity Physiopathology and Nutrition Network (CIBEROBN) is an initiative of ISCIII, Spain.  Authors’ contributions  M.Á.M.-G., J.S.-S., D.C., H.S., J.A.M., Á.M.A.-G., J.W., J.V., D.R., J.L.-M., R.E., F.J.T., J.L., L.S.-M., A.B.-C., J.A.T., V.M.S., X.P., J.J.G., P.M.-M., J.V., C.V., E.R., J.B., N.B., P.G.-S., M.D.Z., I.A., J.V.-L., F.J.B.-L, S.G.-P., J.K., A.G.-R., M.R.B.-L., J.M.S.-L., M.B.-R., N.K., C.S., K.A.P.-V., M.A.Z., L.T.-S., Z.V.R., M.A.M. and M.M. contributed to study concept and design, research and data collection and debugging. R.S.-C. designed statistical approach. C.C.-M. conducted bibliographic research. C.M.-P. conducted bibliographic research, data preparation, statistical analysis and wrote initial drafts. L.D., R.S.-C. and J.M.O. revised analytical methods, findings, and manuscript.",e6161297-1eb4-46be-bda8-eed91e227ea6
47,discussion16," All authors read and approved the final manuscript.  Funding  The following funding bodies contributed to study concept and design, research, and data collection for the PREDIMED-Plus study. The PREDIMED-Plus trial was supported by the European Research Council (Advanced Research grant 2014–2019; agreement #340918; granted to M.A.M-G.); the official Spanish institutions for funding scientific biomedical research, CIBER Fisiopatología de la Obesidad y Nutrición (Centre for Obesity Physiopathology and Nutrition Network (CIBEROBN)) and Instituto de Salud Carlos III (ISCIII) through the Fondo de Investigación para la Salud (Fondo de Investigación para la Salud (FIS)) which is co-funded by the European Regional Development Fund (coordinated Fondo de Investigación para la Salud (FIS) projects led by J.S-S. and J.V.",f2c026c5-688f-44a2-a2cf-edb9d8de55f8
48,discussion18," gratefully acknowledges the financial support by ICREA under the ICREA Academia program; the SEMERGEN grant; Department of Health of the Government of Navarra (61/2015), the Fundació La Marató de TV (Ref. 201630.10); the AstraZeneca Young Investigators Award in Category of Obesity and T2D 2017 (D.R.); grants from the Consejería de Salud de la Junta de Andalucía (PI0458/2013; PS0358/2016; PI0137/2018), the PROMETEO/2017/017 grant from the Generalitat Valenciana, the SEMERGEN grant; grant of support to research groups 35/2011 (Balearic Islands Government; FEDER funds) (J.A.T.). J.K. was financially supported by the Juan de la Cierva-Incorporación research grant (IJC2019–042420-I) of the Spanish Ministry of Economy, Industry and Competitiveness and the European Social Funds. The following funding bodies contributed to data preparation and analysis, bibliographic research, and manuscript writing.",e3ed2623-984e-4528-a849-a00146fa9422
49,discussion19," The METHYL-UP project was supported by the Spanish Ministry of Science and Innovation (RTI2018–095569-B-I00, Programa de Proyectos Orientados a los Retos de la Sociedad “Projects Toward Society Challenges Program”). R.S.-C. acknowledges financial support from the Juan de la Cierva Program Training Grants of the Spanish State Research Agency of the Spanish Ministerio de Ciencia e Innovación y Ministerio de Universidades (FJC2018–038168- I). C.M.-P. was financially supported by a joint grant from the Community of Madrid and the European Social Fund (PEJD-2019-POST/SAL-15892). C. C.-M. was financially supported by the Formación de Personal Investigador (Formación de Personal Investigador (FPI)) grant from the Spanish Ministerio de Ciencia, Innovación y Universidades (PRE2019–087643).",54829f2e-52a6-4221-9ddf-00e9f217ae7a
50,discussion20,"  Availability of data and materials  There are restrictions on data availability for the PREDIMED-Plus trial due to the signed consent agreements around data sharing, which only allow access to external researchers for studies following the project purposes. Requestors wishing to access the PREDIMED-Plus trial data used in this study can make a request to the PREDIMED-Plus trial Steering Committee chair: jordi.salas@urv.cat. The request will then be passed to members of the PREDIMED-Plus Steering Committee for deliberation.  Declarations  Ethics approval and consent to participate  The study protocol, including study design and data collection, can be found at the PREDIMED-Plus website (https://www.predimedplus.com/en/) and was approved according to the ethical standards of the Declaration of Helsinki by the Institutional Review Boards (IRBs) of all participating centers. All participants provided written consent of their participation in the study.",55423b06-9e85-42f0-b626-1a7088525455
51,discussion21,"  Consent for publication  Not applicable.  Competing interests  J.S-S reports grants from Centre for Obesity Physiopathology and Nutrition Network (CIBEROBN), ISCIII (Spain), during the conduct of the study; non-financial support from Nut and Dried Fruit Foundation, personal fees from Instituto Danone Spain, other from Danone S.A., other from Font Vella Lanjaron, personal fees and grants from Eroski Distributors, grants from Nut and Dried Fruit Foundation, grants from Eroski Distributors, personal fees from Nut and Dried Fruit Foundation, outside the submitted work. E.R reports grants, personal fees, non-financial support and other from California Walnut Commission, grants, personal fees, non-financial support and other from Alexion, personal fees, non-financial support and other from Ferrer International, personal fees from Amarin, personal fees, non-financial support and other from Danone, outside the submitted work. J.",734ae876-e2c6-45b8-bcd1-f61401976c13
52,discussion22," L-M reports personal fees and non-financial support from AMGEN, personal fees and non-financial support from SANOFI, personal fees from MSD, personal fees from Laboratorios Dr. Esteve, personal fees from NOVO-NORDISK outside the submitted work.  Publisher’s Note  Springer Nature remains neutral with regard to jurisdictional claims in published maps and institutional affiliations. =",2effbd83-ccc3-47e8-bda6-ee48ca09b7ac
