,chunk_label,chunk_text,uuid
0,background0," Recent lifestyle changes include increased consumption of highly processed foods (highly processed foods (HPF)), which has been associated with an increased risk of non-communicable diseases (NCDs). However, nutritional information relies on the estimation of highly processed foods (HPF) consumption from food-frequency questionnaires (food frequency questionnaires (FFQ)) that are not explicitly developed for this purpose. We aimed to develop a short screening questionnaire of highly processed foods (HPF) consumption (sQ-highly processed foods (HPF)) that integrates criteria from the existing food classification systems. ",2c14bc62-877d-4a6e-a130-2061e1fe7eb7
1,methods0," Study population  Data from the PREDIMED-Plus trial (from the Spanish “PREvention with MEDiterranean DIet”) was used. This is an ongoing 6-year, multicenter, randomized, parallel-group clinical trial launched in Spain in 2013. The main aim of the study is to evaluate the effect on primary cardiovascular disease prevention of an intensive weight loss and its long-term maintenance through a lifestyle intervention based on three pillars: energy-restricted Mediterranean diet (er-MedDiet), increased physical activity (PA) and behavioral support. The study protocol, including study design and data collection, can be found at the PREDIMED-Plus website (https://www.predimedplus.com/en/) and was approved according to the ethical standards of the Declaration of Helsinki by the Institutional Review Boards (IRBs) of all participating centers. All participants provided written consent for their participation in the study.",a4b4732b-c2a3-4cb2-85c9-5907911b160d
2,methods1," The trial is conducted in 23 Spanish centers and involves 6874 participants (48.5% female, 54.5% male) between 55 and 75 years old (mean age and SD 65.0 ± 4.9) who presented with overweight or obesity (Body Mass Index (BMI) ≥ 27 and < 40 kg/m2) and met at least three criteria for metabolic syndrome (MetS) as previously described [31]. Details about the cohort have been described elsewhere [32]. The trial was retrospectively registered at the International Standard Randomized Controlled Trial Registry with number 89898870 on 24th July 2014. The present analysis used baseline and longitudinal (years 1 and 2) data from the PREDIMED-Plus study data set dated 26th June 2020 was used. Participants with implausible energy intakes (< 500 or > 3500 kcal for females and < 800 or > 4000 kcal for males) were excluded. In addition, participants with missing values for dietary, lifestyle and socioeconomic variables were not included in the analysis.",3f6a5f25-22c6-4a29-8d5c-f5c622f3fa04
3,methods2," After the definition of the tertile agreement variable (see Statistical analyses section), participants with (1) no coincidence in extreme tertiles of highly processed foods (HPF) consumption (either in tertile 1 or tertile 3) according to at least two classification systems and (2) participants that were classified in tertile 1 for two classification systems and tertile 3 for the other two classification systems were excluded. This was done to select extreme highly processed foods (HPF) consumers to further construct the binomial regression model. The final number of participants included in the analysis for the development of the questionnaire was 4400 (48.1% female and 51.9% male, 64.9 ± 4.9 years) (Fig. 1). This study adhered to the STROBE-nut reporting guidelines [33].Fig. 1 Flowchart of the PREDIMED-Plus participants.",42480152-631a-4bc6-b190-76712b4bddc5
4,methods3," Number of subjects shown in bold  Blood measurements  Trained nurses collected blood samples after overnight fasting at the recruiting centers or primary health care centers. Plasma glucose, triglycerides and total cholesterol levels were measured following standard enzymatic methods.  Anthropometric measurements  Weight and waist circumference measurements were taken from participants in light clothing with no shoes or accessories, using an electronic calibrated scale and an anthropometric tape, respectively. Waist circumference was measured midway between the lowest rib and the iliac crest. Height measurements were taken using a wall-mounted stadiometer. Body Mass Index (Body Mass Index (BMI)) was calculated as the weight in kilograms divided by the square of height in meters.  Lifestyle measurements  Socioeconomic and PA data were collected through the general PREDIMED-Plus questionnaire.",b3eef159-8b0c-4f42-82dc-9804ded62e6a
5,methods4," Based on the validated questionnaires, the REGICOR [34] and the Rapid Assessment of Physical Activity (Rapid Assessment of Physical Activity (RAPA)) [35], participants were asked about the frequency and intensity of physical activities, and three levels of PA were defined as follows: low (frequent sitting and little walking and/or frequent sitting and moderate sustained efforts), medium (frequent walking with no vigorous efforts), high (frequent walking and vigorous efforts and/or frequent vigorous efforts). Sedentary behaviors were assessed through a validated questionnaire, the Spanish version of the Nurses’ Health Study (Nurses’ Health Study (NHS)) questionnaire [36]. Data about eating habits (binge eating, snacking) were collected within the multidimensional scale of weight locus control questionnaire [37]. Trained interviewers administered questionnaires in individual face-to-face sessions.",e7ff4221-6655-453a-ab90-4313a4307d72
6,methods5,"  Dietary measurements  To assess the dietary intake of participants over the last year, a validated semi-quantitative 143-item food frequency questionnaires (FFQ) [38–40] that considers variations in dietary patterns among seasons, weekdays and weekends was used. Participants were asked the average frequency of consumption of a commonly used portion size (e.g., glass, cup, slice) for each food or beverage item. Nine options for frequency of consumption are given, ranging from “never or hardly ever” to “more than six times a day.” To estimate the daily consumption for each item, the portion size was multiplied by the frequency of consumption and then expressed as grams per day. This calculation was not possible for the fried foods item as the portion size is not specified in the food frequency questionnaires (FFQ). To assess adherence to an er-MedDiet, a 17-item questionnaire specially developed and validated for the PREDIMED-Plus trial [41, 42] was used.",441eb3f6-1151-45f3-961d-feddf23e07ec
7,methods6," Through this questionnaire, the frequency of consumption of traditional Mediterranean food items is evaluated. One point is scored when the answer meets specific criteria defining er-MedDiet, so the higher the score, the better adherence to this diet.  highly processed foods (HPF) consumption and food processing-based classification systems  Four food-processing based classification systems – the NOVA [12, 43, 44], the International Agency for Research on Cancer (International Agency for Research on Cancer (IARC)) [7, 45], the International Food Information Council Foundation (International Food Information Council Foundation (IFIC)) [46, 47], and the University of North Carolina (University of North Carolina (UNC)) [48] systems – were used to classify food frequency questionnaires (FFQ) items into processing categories as previously described [20].",4b5d26ea-4c6d-4261-9e06-f9d7eb9f41d4
8,methods7," In the present study, highly processed foods (HPF) refers to the following groups: Group 4 for NOVA, Group 3 for International Agency for Research on Cancer (IARC), Groups 4 and 5 for International Food Information Council Foundation (IFIC), and Groups 4.1 and 4.2 for University of North Carolina (UNC). For each participant, highly processed foods (HPF) consumption was estimated according to each classification system as the sum of grams per day consumed from foods in the highly processed foods (HPF) group, divided by the total grams of food consumed per day and multiplied by 100 [20]. The frequency of consumption was directly obtained from food frequency questionnaires (FFQ) answers in times per day.  Statistical analyses  Data analysis was conducted using R programming language [49] in RStudio [50] and with the following statistical packages: “DescTools” [51], “psych” [52], “tableone” [53], “cutpointr” [54], “corrplot” [55], “vcd” [56] and rstatisx [57].",2308f41a-27a1-4faf-9249-925a7d4ab4c0
9,methods8," Participants were classified according to tertiles of highly processed foods (HPF) consumption for each classification system (T1 – low highly processed foods (HPF) consumption, T3 high highly processed foods (HPF) consumption). Tertiles were chosen to capture and show the variability in highly processed foods (HPF) consumption while allowing a straightforward comparison between classification systems. Then, subjects were classified according to tertile agreement for, at least, two classification systems. Those classified in T3 in at least two classification systems scored “1” for tertile agreement, while those classified in T1 for at least two classification systems scored “0”. food frequency questionnaires (FFQ) items were classified into food groups according to their similar nature, nutritional characteristics, and/or form of consumption (Supplementary Table 1).",bb1b1e1b-8fa7-4422-995a-ce25d32dc3d1
10,methods9," The association between tertile agreement and frequency of consumption for each food group was analyzed through binomial logistic regression, adjusted for age, sex, recruitment center, energy intake, physical activity level, medication for blood pressure and diabetes, working status, educational level, and civil status, using the “glm” function from R base package “stats.” These covariates were selected due to their potential effect on highly processed foods (HPF) consumption. To calculate optimal cut-off points of frequency of consumption for the selected items, receiver operating characteristic (receiver operating characteristic (ROC)) analysis was performed using the R package “cutpointr” and the “cutpointr” function [54]. The method to estimate the cut-off points was based on the maximization of the Youden-Index [58].",0662cedb-6f03-4828-9ffa-2814d81c41a1
11,methods10," Estimated cut-off points were used to establish the criteria for scoring 1 point in the sQ-highly processed foods (HPF), which indicated high highly processed foods (HPF) consumption, or 0, indicating low highly processed foods (HPF) consumption. Cut-off points were adapted to the nine possible answers of the food frequency questionnaires (FFQ), so the criteria for scoring were based on a threshold frequency of consumption for each item (i.e., food group). In parallel, exploratory factor analysis (exploratory factor analysis (EFA)) was performed to identify underlying relationship patterns between items included in the sQ-highly processed foods (HPF) using the “fa” function from the “psych” package [52]. To test for data suitability for the exploratory factor analysis (EFA), the Kaiser-Meyer-Olkin Criterion [59] and Bartlett’s test of sphericity [60] were applied.",33654990-4de6-43d2-8e41-35c3bfe5d8db
12,methods11," The exploratory factor analysis (EFA) was performed without rotation and with a principal factor solution as a factoring method. Factor retention was based on the scree plot and Kaiser’s criterion [61]. Cronbach’s alpha [62] was calculated as a measure of internal consistency of the questionnaire. Using the criteria for scoring, the sQ-highly processed foods (HPF) score was calculated for each subject in the PREDIMED-Plus database, and the questionnaire estimated highly processed foods (HPF) consumption was calculated through linear regression analysis using the sQ-highly processed foods (HPF) score as the dependent variable. For descriptive analyses, participants were classified into tertiles of the sQ-highly processed foods (HPF) score. Data is shown in tables as “mean (standard deviation, SD)” for continuous variables and as “number of subjects (%)” for categorical variables. Statistically significant differences (p < 0.",64872f86-d787-4b78-be31-1bf1c2474ba7
13,methods12,"05) in dietetic and lifestyle variables among tertiles were compared using a one-way ANOVA test for continuous variables and a Chi-squared test for categorical variables. P-values were adjusted for age, sex, recruitment center, energy intake, physical activity level, medication for blood pressure and diabetes, working status, educational level, and civil status. To assess the concordance between tertiles of highly processed foods (HPF) consumption calculated by the four classification systems and by the sQ-highly processed foods (HPF), weighted Cohen’s kappa (κ) coefficients were calculated with the function “Kappa” from the R package “vcd”. For longitudinal analysis of highly processed foods (HPF) consumption, a linear mixed model was performed using the R package “lme4” and “emmeans” with the same covariates as previous analyses. The number of subjects used for this analysis was 3284 due to longitudinal data loss. ",64038154-454c-4057-822a-f27eecf96ecf
14,results0," General characteristics of the PREDIMED-Plus cohort according to tertile agreement  Subjects scored 1 in the tertile agreement variable if they were classified in the highest tertile (T3) of highly processed foods (HPF) consumption for at least two classifications systems, while they scored 0 if they were classified in the lowest tertile (T1) of highly processed foods (HPF) consumption for at least two classifications systems. General characteristics of PREDIMED-Plus participants at baseline according to the scores of the tertile agreement variable are shown in Table 1. Subjects who scored 1 (high highly processed foods (HPF) consumption by at least two classification systems) were mainly men (73.1%), had higher energy intake (2559.84 kcal/day) and lower MedDiet adherence (7.65 points) than subjects who scored 0 (low highly processed foods (HPF) consumption by at least two classifications systems). Among the high highly processed foods (HPF) subjects, 78.8% were married and 41.",d0bff332-8d87-4d4d-9f74-400bc712aeb5
15,results1,"8% had a primary education level. Around half of the subjects who scored 1 showed a low level of PA (55.3%) and were taking medication for cholesterol (49.8%). In addition, 75.7% of them were taking medication for blood pressure and 25.9% were on diabetes medication. According to these results, the variables age, sex, recruitment center, energy intake, physical activity level, medication for blood pressure and diabetes, working status, educational level, and civil status were selected as covariates for further analysis due to their potential effect on highly processed foods (HPF) consumption. MedDiet adherence was not selected as a covariate due to the presence of collinearity with highly processed foods (HPF) consumption.Table 1 General characteristics of PREDIMED-Plus participants at baseline according to tertile agreement  	Tertile agreementa		 Low highly processed foods (HPF)	High highly processed foods (HPF)	p	 n	2186	2214		 Age (years)	66.14 (4.50)	63.68 (5.07)	< 0.",d261ac25-6dfb-4dcc-9b2a-503366fbcf27
16,results3," One-way ANOVA test used for continuous variables and Chi-squared test used for categorical variables. Significant p-values (< 0.05) shown in bold  MedDiet Mediterranean diet, PA Physical activity  aTertile agreement variable: score 0 – “low highly processed foods (HPF) consumer” if a subject is classified in T1 of highly processed foods (HPF) consumption by at least two classification systems; score 1 – “high highly processed foods (HPF) consumer” if a subject is classified in T3 by at least two classification systems. highly processed foods (HPF): highly processed food. N = 4400  Development of the sQ-highly processed foods (HPF)  Food groups were defined based on the similarity in nature, nutritional profile and/or form of consumption of the PREDIMED-Plus food frequency questionnaires (FFQ) food and beverage items (Supplementary Table 1).",a65c61d0-a7cf-42f2-b115-19b0cb078fbf
17,results4," Food groups chosen to be included in the sQ-highly processed foods (HPF) showed a significant positive association (p-value adjusted by Bonferroni < 0.05) between their frequency of consumption and a value of 1 of tertile agreement, i.e., the subject is in tertile 3 of highly processed foods (HPF) consumption for at least two food processing-based classification systems (Table 2). A final solution of 14 food groups was selected and included the following: fatty dairy products, sugary dairy products, cured meat, fats, fermented alcohol, distilled alcohol, sugary and artificially sweetened drinks, sweets, snacks, ready to eat products, refined cereals, sauces, additives, and fried foods.Table 2 Associations between candidate sQ-highly processed foods (HPF) items and tertile agreement variable by binomial logistic regression  Predictor variable	β	SE	p (Bonf)	 Fatty dairy products	0.33	0.10	0.024	 Sugary dairy products	1.37	0.22	< 0.001	 Cured meat	0.59	0.07	< 0.001	 Fats	0.63	0.14	0.",9321858f-292a-46a4-a30c-a622574d2de9
18,results6,"08	1	 Binomial logistic regression adjusted for age, sex, recruitment center, energy intake, physical activity level, medication for blood pressure and diabetes, working status, educational level, and civil status. Tertile agreement is the outcome variable (score 0 – “low highly processed foods (HPF) consumer” if a subject is classified in T1 of highly processed foods (HPF) consumption by at least two classification systems; score 1 – “high highly processed foods (HPF) consumer” if a subject is classified in T3 by at least two classification systems). Food groups expressed in frequency of consumption (times/day). highly processed foods (HPF): highly processed food. Items selected for the sQ-highly processed foods (HPF) are shown in bold. Bonf: Bonferroni adjustment. N = 4400  exploratory factor analysis (EFA) revealed that most of the items selected for the sQ-highly processed foods (HPF) had factor loadings higher than 0.",6a305377-2c6f-44be-889f-85343c78d382
19,results7,"2, indicating that they were representative contributors to the factor (Table 3). The measure of sample adequacy (measure of sample adequacy (MSA)) was 0.78, considered as “good” for the verification of the proportion of variance in variables that can be caused by factors, according to the Kaiser-Meyer-Olkin Criterion. Bartlett’s test of sphericity was highly significant (p < 0.001), indicating that variables were correlated in the population. This, together with the measure of sample adequacy (MSA) value, indicated the adequacy of the data to proceed with exploratory factor analysis (EFA). Factor retention applying the Kaiser criterion revealed a single underlying factor being identified by the questionnaire items, namely the highly processed foods (HPF) dietary pattern. The internal consistency of the questionnaire items was evaluated with Cronbach’s alpha, which had a moderate value of 0.67.",9994ba66-d761-4303-a4ec-6f3bd429922e
20,results8,Table 3 Exploratory factor analysis for sQ-highly processed foods (HPF) items  Factor 1: highly processed foods (HPF) diet	Factor loadings	 Ready To Eat (Ready To Eat (RTE))	0.45	 Fried food	0.44	 Fermented alcohol	0.42	 Snacks	0.42	 Fatty dairy products	0.38	 Sugary drinks	0.37	 Distilled alcohol	0.36	 Sauces	0.35	 Refined cereals	0.35	 Cured meat	0.34	 Sweets	0.3	 Sugary dairy products	0.29	 Additives	0.26	 Fats	0.23	 Bartlett’s test of sphericity = p < 0.001  Measure of Sample Adequacy (measure of sample adequacy (MSA)) = 0.78  Standardized Cronbach’s α = 0.67  N = 4400  The sQ-highly processed foods (HPF) was based on the 14 food groups selected previously. Each item asked about the frequency of consumption of a particular food group (Table 4). Examples of representative food and beverage items included in each food group were provided for each item.,2f049049-365e-42c4-a4c3-b9a66fc113c6
21,results9," Estimated cut-off points were used to determine the threshold frequency of consumption to consider the respondent as an highly processed foods (HPF) consumer for the item, as shown in the column “Criteria for 1 point” in Table 4. For the self-reported version of the questionnaire, this column should be removed from the questionnaire form since it is intended for the use of the person assessing the score only. Using baseline data from the PREDIMED-Plus food frequency questionnaires (FFQ), the percentage of highly processed foods (HPF) over total grams per day according to the questionnaire items was calculated for each patient. This was used as the dependent variable in a linear regression with the sQ-highly processed foods (HPF) score obtained for each patient to establish the following equation for the regression line: “highly processed foods (HPF) consumption (% g/day) = (3.7 x sQ-highly processed foods (HPF) score) + 7.6”.",b7afbb94-5799-46de-bfcf-2c839157c14e
22,results10," This equation allows the estimation of the highly processed foods (HPF) consumption from the sQ-highly processed foods (HPF) score, as shown at the bottom of Table 4.Table 4 Screening questionnaire of highly processed food consumption (sQ-highly processed foods (HPF))  What was your average frequency of consumption over the past year of…	Criteria for 1 point	Score  (0 or 1)  	 Q1. Fatty dairy products (cream, cured or semi-cured cheese, processed soft cheese wedges)?	> = 2 t/week		 Q2. Sugary dairy products (condensed milk, industrially produced milkshakes, flavored Petit Suisse yogurt, custard, crème caramel flan, pudding)?	> 3 t/month		 Q3. Cured meats (serrano ham, sandwich (deli) ham, cured cold meats, pâté, bacon, marbling)?	> = 1 t/day		 Q4. Fats (margarine, butter, lard (animal fat))?	> 3 t/month		 Q5. Fermented alcohols (rosé wine, muscatel wine, young red wine, aged red wine, white wine, Spanish sparkling wine (cava), beer)?	> 1 t/day		 Q6.",2f3d9878-9db3-4c4a-820d-345a1b334627
23,results11," Distilled alcohols (liquors, anisette, whisky, gin, vodka, cognac)?	> 3 t/month		 Q7. Sugary and artificially sweetened drinks (soft drinks, artificially sweetened drinks, bottled juice, grape must)?	> = 2 t/week		 Q8. Sweets (ice-cream and sorbets, canned fruit in juice or syrup, biscuits, whole meal biscuits, chocolate biscuits, honey, homemade baking products, industrially produced confectionery, donuts, muffins, cupcakes, industrially produced cakes, churros, chocolates, soluble cocoa powder, nougat, marzipan, shortbread biscuits, jam)?	> 1 t/day		 Q9. Snacks (packaged potato crisps/chips, packaged snacks)?	> 3 t/month		 Q10. Ready To Eat products (pizza, croquettes, instant soup)?	> 3 t/month		 Q11. Refined cereals (white and sliced bread, breakfast cereals, Spaghetti, macaroni, Spanish noodles, white rice)?	> = 2 t/week		 Q12. Sauces (mustard, mayonnaise, tomato sauce, Ketchup)?	> 1 t/week		 Q13. Additives (sugar, table salt)?	> 3 t/day		 Q14.",86570f40-9b09-4447-8657-5767a49d4963
24,results12," Fried foods (eat out and homemade)?	> = 2 t/week		 	TOTAL SCORE:		 Equivalency between sQ-highly processed foods (HPF) score and the estimated percentage of highly processed foods (HPF) consumption over the total intake in grams per day:	 Score	1	2	3	4	5	6	7	8	9	10	11	12	13	14	 % highly processed foods (HPF)	11.3	15	18.7	22.4	26.1	29.8	33.5	37.2	40.9	44.6	48.3	52	55.7	59.4	  Weighted κ coefficients were calculated between highly processed foods (HPF) consumption tertiles according to the sQ-highly processed foods (HPF) and the four existing classification systems (Supplementary Table 2). The highest agreement was for the comparison with University of North Carolina (UNC) tertiles (κ = 0.88), followed by International Food Information Council Foundation (IFIC) tertiles (κ = 0.65) and International Agency for Research on Cancer (IARC) tertiles (κ = 0.50).",1d63ec5d-a30b-45c0-b9f5-3eb430169c13
25,results13," The comparison of tertiles according to the sQ-highly processed foods (HPF) with NOVA tertiles of highly processed foods (HPF) showed a fair agreement (κ = 0.36). These comparisons were in accordance with the corresponding agreement plots (Fig. 2).Fig. 2 Agreement plots of tertiles of highly processed foods (HPF) consumption. Visual representation of contingency tables between the sQ-highly processed foods (HPF) tertiles and A NOVA highly processed foods (HPF) tertiles, B International Agency for Research on Cancer (IARC) highly processed foods (HPF) tertiles, C International Food Information Council Foundation (IFIC) highly processed foods (HPF) tertiles and D University of North Carolina (UNC) highly processed foods (HPF) tertiles. Marginal totals of the contingency table are located on the top and right axis. Shading represents the level of agreement, black indicates “perfect agreement”, and grey indicates “partial agreement”.",1c3d6451-2035-4c98-84d6-f410bb5f220a
