,chunk_label,chunk_text,uuid
26,methods26," Using correlation analyses and different regression models, a considerable number of studies have already provided some evidence of the positive or negative association between subjective well being (SWB) and a range of health-related factors, sociodemographic characteristics and lifestyle factors, including age, sex, BMI, education, income or dietary habits. For example, the young to middle-age class, as well as people with tertiary education level, tended to report higher subjective well being (SWB) than upper secondary education levels or older age classes [49]. Sex has been found to influence subjective well being (SWB) perception, but it was moderated by age [51]. Improved health has also been associated with better subjective well being (SWB), with this association being stronger in developing countries than in the developed ones [52].",bb5cd45d-6e06-4ebb-9faa-75d3f41e4682
27,methods27," In addition, a lower income was associated with higher psychological distress [53], but the association of income inequality and subjective well being (SWB) may be influenced by the development of the country economy [54]. In addition, healthy lifestyles have been associated with subjective well being (SWB) in SP, where eating specific foods (fruits and vegetables), being in the company of family and friends, engaging in more exercise and feeling healthy have all a positive influence on life satisfaction and happiness [26]. A similar result was reported in IT, where higher adherence to MD or consumption of a vegetable-based dietary pattern were positively associated with psychological resilience [55]. BMI and body image have also been indicated to have a key role for happiness in Spanish adults [56]. In an additional latest study, the consumption of fruits and vegetables has been found associated with life satisfaction in Spanish adults with a high BMI [25].",3b6c621b-a1c4-401f-981a-88b9bdbffc18
28,methods28," Overall, the results are still limited, are associated with specific populations, and show some ambiguity, which suggests that these factors may all interact in a complex way to influence subjective well being (SWB).  In the present study, we have implemented correlation analyses and multiple linear regression models between the 9-item subjective well being (SWB) score and a broad range of sociodemographic, health related factors, lifestyle and dietary factors in the global sample population from five Mediterranean (MED) and non-Mediterranean (MED) countries. Our results further support that closer adherence to MD (measured by 14-Mediterranean (MED)AS score) and other Mediterranean lifestyle habits (spending time with friends and family, spending time at nature, leisure activities and practicing sport, and adequate rest at night) have a positive influence on the 9-item subjective well being (SWB) score.",cd686e31-8954-45dc-baf3-ffabe895d0f0
29,methods29," The association between well-being and a healthy diet has been widely recognized but the specific link of subjective well being (SWB) and the consumption of a particular diet or food component is not yet understood. Recently, the lack of evidence for the association between the MD global indicators and subjective well being (SWB) has been reported; however, there appears to be some links between the intake of specific food items (fruits, vegetables, sweets) and subjective well being (SWB) [25,26]. The complexity of the interaction between diet and subjective well being (SWB) deserves further and thorough investigation.  In addition, our results suggest that women seem to have a lower subjective well being (SWB) perception, which agrees with data from 29 countries from the European Social Survey, confirming that women are more likely than men to experience depressive symptoms [14].",15b1b48e-d380-43de-a1c2-91d341b12a0e
30,methods30," Our results also point to the fact that having a diagnosed pathology and smoking have a negative influence on the 9-item subjective well being (SWB) score, whereas being older has a positive effect. Importantly, our results show that all the variables investigated here display significant but weak correlation coefficients with the 9-item subjective well being (SWB) score confirming that our well-being perception is, in part, the result of a multiple factorial influence with small co-effects. Other variables not included here (i.e., income) may contribute to better predicting the 9-item subjective well being (SWB) score but, we cannot discard the possibility that other different and more complex models of interaction may occur. Indeed, the association between subjective well being (SWB) and all these different factors has been described as a two-direction relationship so that a better subjective well being (SWB) can also influence other aspects in our lives [13,57].",ae255718-ec9b-4b88-adef-c846f0e84c59
31,methods31," Further studies are still needed to clarify the association between the different factors and subjective well being (SWB) using a validated instrument applicable to different countries and, if possible, at different time periods. The proposed 9-item subjective well being (SWB) score could be a relevant tool for this purpose.  Although there is ample research supporting current self-report measures of subjective well being (SWB) with strong psychometric properties with regards to consistency, reliability and validity, there is still skepticism on using self-reported methods to record the construct of subjective well being (SWB) since these may be subjected to response bias [5,58]. This relates to whether responders have the willingness to provide honest and adequate answers to the researchers or even if they deceive themselves about their own well-being when responding to the questionnaires [57,58].",94de6797-16a9-4d70-9fdb-3f7a83384983
32,methods32," In the present study, provision of an online questionnaire might have biased the sample towards a more homogeneous population of middle-class, young to middle aged, with a better education and job status. Indeed, the age distribution of the studied sample was more representative of the working age adult population in Europe, whereas ≥65 years of age respondents constituted only 3% of the participants, and over 70% of participants had a university degree. In addition, from overall 65% employed respondents, more than 90% have a white-collar type of job which suggests that most of these participants have a middle to higher income. It should be reiterated that most studies exploring relationships between subjective well being (SWB), lifestyle and/or sociodemographic factors have a cross-sectional design and can only establish associations but do not permit to draw causality.",e86d382a-2229-462f-abc9-b8c18444e20f
33,methods33,"  Among the strengths of this study is the fact that we assessed a relatively large sample population (N = 2400) including participants from five culturally diverse European countries who provided extensive information regarding various aspects of their well-being and health behavior-related data. Another strength of the study is the restricted eligibility of participants to only native citizens of the respective countries, and the exclusion of participants from other nationalities or those living abroad, in order to minimize the effect of culturally-related factors and/or possible language barriers that may introduce biases when measuring subjective well being (SWB).",2f44d8de-404b-491b-9edf-7939a145efca
34,methods34," An important advantage of this study is the assessment of both hedonic and eudemonic indicators, and its combination into a pooled 9-item score which gives us the ability to explore the relationships between subjective dimensions of well-being and sociodemographic, health related factors and lifestyle habits in the different countries. In addition, the application of a finer response scale may give the ability to obtain more detailed insight into a person’s feelings [59], which is implemented in our research by the use of an 11-point Likert-type scale for assessment of every question in the questionnaire.  5. Conclusions  Over the past two decades we have outgrown the traditional measures of Gross Domestic Product (Gross Domestic Product (GDP)) and economic growth as crude assessment tools of the living standards in society. There is a rising interest from governments and policymakers worldwide on the self-reported happiness of individuals.",35a108f6-0454-409f-bae6-0835e23f96cf
35,methods35," subjective well being (SWB) is an essential individual aspect which can impact the development and maintenance of healthy societies. The current study focused on the application of a 9-item subjective well being (SWB) tool that includes hedonic and eudemonic indicators, with two components, one that reflects feeling satisfied and fulfilled about life and yourself; and other that reflects aspects of negative psychological functioning, such as high perception of stress, depression, and a sense of being unable to cope with daily tasks. In response to the challenge of a global need to increase subjective well being (SWB), these two domains allow for the identification of issues that should be addressed in policy making. It is clear that in order to influence global well-being, greater emphasis needs to be placed on the individual and, as pointed by some authors, there is an urgent need to promote educational programs in the domains of human flourishing [60].",fb5786cb-f1bd-474e-9efe-2a7a4c9c2f27
36,methods36," We have observed significant but rather small differences in subjective well being (SWB) among the countries involved in our study, which would need assessment and further confirmation in larger population samples. Furthermore, our results showed significant but small correlations between subjective well being (SWB) and several demographic and lifestyle factors (age, sex, nationality, socializing with friends, enjoying nature, sleeping hours, smoking habits, and Mediterranean Diet), highlighting that our well-being perception is the result of a multiple factorial influence. Future research should emphasize the development of improved assessment with accurate instruments that can capture true differences between populations, together with larger scale observational and intervention trials, and comprehensive and functional plans to monitor progress. ",9eee943c-1dfc-42c7-89c1-a7fe57614db5
