,chunk_label,chunk_text,uuid
27,methods27," In addition to the health benefits, healthy dietary patterns, such as the MD and Dietary Approaches to Stop Hypertension (DASH) diet, are higher in plant-based foods and lower in animal-based foods supporting environmental sustainability [28,53]. An analysis of data from a representative sample of Emirati adult women showed that the MD supports environmental sustainability [33].  The current study examined the sociodemographic factors associated with adherence to the MD among the participants. After adjusting for covariates, such as age, gender, nationality, educational level, physical activity level, smoking status, body mass index (BMI), self-reported diagnosis of hypertension, diabetes and history of cardiovascular disease, the adherence to MD was low (Mediterranean Diet composite Score of 4 out of 8),",669fdd11-13a6-4ecd-9a61-3329bfb1de14
28,methods28," Our findings are consistent with the results of a previous study involving adult Emirati women aged 19–50 years [33] as well as study conducted in United Arab Emirates (UAE) during the COVID_19 lockdown [32]. Moreover, the results showed higher adherence to the MD among older participants.  Similarly, a study conducted in Kuwait found that older adults had higher adherence to the vegetable-rich dietary pattern while younger adults had higher adherence to the fast-food or refined-grains/poultry dietary patterns [37]. A study conducted in Southern Italy and Malta also showed higher adherence to MD among older participants [54,55]. We also found that non-Emirati participants had higher adherence to the MD compared to the United Arab Emirates (UAE) nationals. This might be because most of the non-Emirati participants were originally from countries in the Middle East, such as Lebanon, Jordan and Syria, that traditionally follow the MD.",d655647a-8d7f-4d38-9a14-8887054677aa
29,methods29,"  The findings of the current study highlight the need to develop intervention programs promoting the adoption of dietary choices, which are consistent with cardiovascular health-promoting dietary patterns, such as the MD [29,50] and the Dietary Approaches to Stop Hypertension (DASH) diet [26,52]. These programs should specifically target younger adults, since based on the present study they were less adherent to MD compared to those who were older. In a recent study involving university students in the United Arab Emirates (UAE), only 28.7% and 34% reported eating fruits and vegetables daily, respectively [56].  Educational initiatives targeting the prevention of obesity through public awareness and other initiatives are needed to mitigate dyslipidemia and associated cardiovascular diseases (CVD) in the United Arab Emirates (UAE).",257351fc-ca5d-4c51-914c-340ae8e2cd32
30,methods30," Moreover, screening for dyslipidemia in young adults could be considered a promising strategy for reduction in risk factors and cardiovascular diseases (CVD)s. A recent study conducted in the found a high prevalence of cardiometabolic risk factors among adults aged 18–40 years [19].  The results from the present study found that 20% of those diagnosed with high cholesterol reported taking herbal/traditional remedies. In a previous study conducted in the United Arab Emirates (UAE), 39.3% of participants with diabetes reported using complementary and alternative medicine (complementary and alternative medicine (CAM)) since diagnosis [57]. Some of the complementary and alternative medicine (CAM) used by the surveyed participants included herbs, vitamins and mineral supplements [57]. Therefore, there is a need to increase awareness of the safety of complementary and alternative medicine (CAM) among patients with chronic diseases.",dc0357a5-165f-47c9-8975-a4e2f731d462
31,methods31,"  There is a need for public awareness and policies that facilitate the consumption of health-promoting dietary patterns. Greater efforts should be placed to access of affordable healthy foods, such as fruits, vegetables and whole grains. Higher food prices, such as fruits and vegetables were identified to be a barrier to adherence to the MD in other countries [58,59].  A range of interventions at different levels, including accessible and affordable healthy foods, have a more promising approach to reducing the prevalence of obesity and other risk factors of dyslipidemia and cardiovascular diseases (CVD). These interventions should combine individual-level behavioral interventions with changes in the food environment in and the cultural context of the United Arab Emirates (UAE) society. Moreover, early identification and management of dyslipidemia and other risk factors of cardiovascular diseases (CVD) at an earlier age are needed. In the present study, only 52.",f6a2f2e8-74d4-4e67-9f68-57c42de02373
32,methods32,"3% of the participants had their blood cholesterol measured in their lifetime.  There are several strengths of this study. To the best of our knowledge, this is the first study investigating the dietary patterns of adults in the United Arab Emirates (UAE) diagnosed with dyslipidemia using a country-specific food frequency questionnaire. Furthermore, this study included both Emirati nationals and expatriate residents of the United Arab Emirates (UAE). Finally, the use of the World Health Organization (WHO) STEPwise Approach to NCD Risk Factor Surveillance (STEPS) Instrument, which is a valid tool for collecting population-level data on risk factors of cardiovascular diseases (CVD) [31] is another strength of the study. However, there are several limitations of this study. The cross-sectional nature of the study limits the causality.",72452634-1d23-44d6-bfaf-fe2491ffef1a
33,methods33," Another potential limitation is a recall bias related to the self-reported dietary intake and the diagnosis related to dyslipidemia and other chronic diseases.  Moreover, since the survey was conducted online due to the COVID-19 pandemic, actual body measurements and biochemical measurements were not collected. Future studies that include the other components of the STEPwise Approach to NCD Risk Factor Surveillance (STEPS) Instruments, such as physical measurements (blood pressure, weight, height and waist circumference) and biochemical measurements (blood glucose and blood lipid profile) are needed. Finally, data used for this study involved only the three main emirates of the United Arab Emirates (UAE); thus, national-level data from a representative sample of the United Arab Emirates (UAE) population is needed.  5.",1507c12a-19f2-4c5e-b2a1-cbcd6fa57366
34,methods34," Conclusions  In this study, we evaluated the diet and other risk factors associated with dyslipidemia in a sample of adults from the United Arab Emirates (UAE), which has a high prevalence of cardiovascular diseases (CVD). The results showed that the food choices of adults in the United Arab Emirates (UAE) who were with and without dyslipidemia were not consistent with health-promoting dietary patterns, such as the MD. Interventions that combine individual-level behavioral changes with adjustments in the food environment and within the cultural context of the United Arab Emirates (UAE) society are needed. ",7b58392e-ab2f-4313-be42-158a9ad43019
