,chunk_label,chunk_text,uuid
0,methods0," 2.1. Study Design and Participants  This was a cross-sectional study involving web-based questionnaires. The study aimed to recruit 600 adults from the three main emirates of the United Arab Emirates (UAE) (Abu Dhabi, Dubai and Sharjah). Abu Dhabi and Dubai are the major emirates, and the population of Sharjah is more than 50% of the remaining emirates of the United Arab Emirates (UAE). Using a proportional quota sampling method, the Federal Competitiveness and Statistics Authority (Federal Competitiveness and Statistics Authority (FCSA)) of the United Arab Emirates (UAE), it was calculated to recruit 270 adults from Abu Dhabi, 230 from Dubai and 100 from Sharjah in order to have a representative sample from each of the three emirates.",44c91cc8-70aa-4ec6-9ba6-6772e4aca27c
1,methods1,"  The following inclusion criteria were used for the recruitment: (1) adults 18 years and older (males and females); (2) United Arab Emirates (UAE) nationals and non-nationals; (3) residing in the following three Emirates: Abu Dhabi, Dubai and Sharjah; and (4) fluent in Arabic language. The recruitment targeted three age groups: 18–30 years, 31–49 years and 50 years and older. Data was collected from July to November 2020.  Online recruitment promotion of the survey was sent through social media (including “WhatsApp™”) and emails to inform the targeted community. An email containing a link to the consent form was sent to those who showed an interest to participate. A link to the questionnaire Google document form was shared with potential participants. In addition, a link to the web-based Food Frequency Questionnaire (Food Frequency Questionnaire (FFQ)) was emailed to those who agreed to participate.",f099d8ba-b1d9-4622-8432-3dd025388de7
2,methods2," Out of the 720 who responded, 610 provided complete information and were included in the analyses. The study was approved by the United Arab Emirates University Social Sciences Research Ethics Committee (Protocol # ERS_2020_6191). All procedures were following the principles of the Declaration of Helsinki.  2.2. Data Collection  Data was collected online using the World Health Organization (WHO) STEPwise Approach to NCD Risk Factor Surveillance (STEPwise Approach to NCD Risk Factor Surveillance (STEPS)) for collecting data on NCDs [38] and a quantitative Food Frequency Questionnaire (FFQ).  2.2.1. STEPwise Approach to NCD Risk Factor Surveillance (STEPS) Instrument  The STEPwise Approach to NCD Risk Factor Surveillance (STEPS) instrument developed by World Health Organization (WHO) is a cross-cultural validated tool designed to produce results that enables the comparison of data across countries [39].",d74a8456-fc06-4941-9ed6-87c4d39080df
3,methods3," It was designed for the measurement and surveillance of non-communicable disease risk factors in populations [39]. The STEPwise Approach to NCD Risk Factor Surveillance (STEPS) instrument can be used to collect information about risk factors of NCDs, including physical inactivity and raised blood lipids, increased blood glucose and blood pressure. It covers three different levels of “steps” of risk factor assessment (a questionnaire, physical measurements and biochemical measurements). As the study was conducted online during the COVID-19 pandemic, only the questionnaire component of the STEPwise Approach to NCD Risk Factor Surveillance (STEPS) Instrument was used (i.e., actual body measurements and biochemical analysis were not performed).  Arabic is the dominant language in the United Arab Emirates (UAE); thus, the Arabic version of the STEPwise Approach to NCD Risk Factor Surveillance (STEPS) instrument was adopted in the United Arab Emirates (UAE) setting.",fbf28e20-5a2b-4eae-80a5-22f4ba83a397
4,methods4," The original World Health Organization (WHO) STEPwise Approach to NCD Risk Factor Surveillance (STEPS) questions were modified to make them more compatible with the United Arab Emirates (UAE) context by removing questions related to alcohol, replacing some of the tobacco products with those commonly used in the United Arab Emirates (UAE) and adding additional examples of high sodium processed food items that are commonly used in the United Arab Emirates (UAE). The Arabic version was previously used in the United Arab Emirates (UAE) National Nutrition and Health Survey conducted by the Ministry of Health and Prevention in 2017–2018 [40].",362c77a0-8601-477c-9e4f-44070215c553
5,methods5,"  The following Core sections of the STEPwise Approach to NCD Risk Factor Surveillance (STEPS) Instrument were included in the study: (1) Basic demographic information; (2) Tobacco smoking; (3) Physical activity; (4) History of raised blood pressure; (5) History of raised total cholesterol; (6) History of cardiovascular diseases; and (7) Lifestyle advice. In addition, the expanded section of the STEPwise Approach to NCD Risk Factor Surveillance (STEPS) Instrument was used to assess sedentary behavior.",6814892b-d4fe-41b8-af7d-e350fbbb5bc0
6,methods6,"  The following questions related to dyslipidemia in the STEPwise Approach to NCD Risk Factor Surveillance (STEPS) Instrument were used: (1) Have you ever had your cholesterol (fat levels in your blood) measured by a doctor or other health worker? (2) Have you ever been told by a doctor or other health worker that you have raised cholesterol? (3) Were you first told of this condition in the past 12 months? (4) In the past two weeks, have you taken any oral treatment (medication) for raised total cholesterol prescribed by a doctor or other health worker? (5) Have you ever seen a traditional healer for raised cholesterol? (6) Are you currently taking any herbal or traditional remedy for your raised cholesterol?  The following questions related to the diagnosis of diabetes,",332c6533-32cf-409a-ae4d-322ed397f8df
7,methods7," hypertension and cardiovascular diseases in the STEPwise Approach to NCD Risk Factor Surveillance (STEPS) Instrument were also asked: Have you ever been told by a doctor or other health worker that you have raised blood pressure or hypertension? Have you ever been told by a doctor or other health worker that you have raised blood sugar or diabetes? Have you ever had a heart attack or chest pain from heart disease (angina) or a stroke (cerebrovascular accident or incident)?  Data related to lifestyle advice and dietary modification given to participants by health care professionals in the STEPwise Approach to NCD Risk Factor Surveillance (STEPS) instrument were also collected, including advice on quitting smoking, reducing fat intake, increasing intake of fruits and vegetables and maintaining a healthy body weight.  2.2.2.",394e4756-c58c-4442-943a-53aaef9933be
8,methods8," Quantitative Food Frequency Questionnaire  A validated web-based quantitative food frequency questionnaire (Food Frequency Questionnaire (FFQ)) developed for the United Arab Emirates (UAE) adult population [41] was used to assess dietary intake during the month preceding the interview date. Details of the Food Frequency Questionnaire (FFQ) were previously reported [41]. Briefly, the Food Frequency Questionnaire (FFQ) is in Arabic and contains 135 food items and 12 food groups that are commonly consumed in the United Arab Emirates (UAE): (1) Dairy foods, (2) Composite dishes, (3) Proteins (including vegetarian and animal sources of proteins), (4) Vegetables (fresh and cooked vegetables including potatoes), (5) Cereals (pasta and other cereals), rice and starches, (6) Sandwiches and baked snacks, (7) Bread and savory biscuits, (8) Spreads on bread, vegetables and salads (excluding use in cooking), (9) Soups, (10) Fruits and dried fruits, (11) Beverages and (12) Sweets and other snacks.",3926062f-2e64-4148-9167-55a732d79832
9,methods9,  The Food Frequency Questionnaire (FFQ) contains culturally specific food images depicting the range of distribution of intake among Emirati adults. The food images are presented in a series of three digital food photographs [33]. The food frequency questionnaire contains nine response options: (1) Never or less than once per month; (2) one to two times per month; (3) three times per month; (4) once per week; (5) two times per week; (6) three to four times per week; (7) five to six times per week; (7) Once per day; (8) two times per day; and (9) three times per day.  The daily energy and nutrient intakes of the surveyed participants were calculated from the Food Frequency Questionnaire (FFQ). Macronutrients with established recommended dietary intakes were further examined by generating categorical variables based on those values and the percentage of the population above the recommended levels of saturated fat and cholesterol or below for fiber.,d3fd2060-da1d-47ed-91f0-9522bd764a05
10,methods10," The database used in the Food Frequency Questionnaire (FFQ) for the calculation of energy and nutrients intake has been previously reported [42].  2.3. Assessment Adherence to Mediterranean Diet  Data from the Food Frequency Questionnaire (FFQ) was used to examine participants’ adherence to the Mediterranean Diet (MD) using the Composite Mediterranean score (c-MEDS). In the calculation of the c-MEDS, eight food groups used in a previous United Arab Emirates (UAE) study to determine adherence to the MD [34] were considered: whole grains, refined grains, legumes, fruits, vegetables, fish, sweetened beverages and olive-oil-to-saturated fat ratio. The c-MEDS was assessed by assigning a score of 1 for consuming equal to or above the median intake of the specific food group and a score of zero for consuming below the median intake [33]. Sugar-sweetened beverages and refined grains were reverse coded.",3e165bf7-8c3f-423d-aa19-13afd02761be
11,methods11,"  The sum of the scores of the eight food groups was used to calculate the c-MEDS with a maximum possible score of 8 with higher scores indicating better adherence to the MD. Based on the c-MEDS calculation, participants were categorized either into the “high” or “low adherence” group. Individuals with a c-MEDS below the median score of the population were categorized as a “low adherence” group and those with a c-MEDS equal to or above the median intake of the population were categorized as a “high adherence” group. In addition, intake of eight c-MED food groups of the participants with dyslipidemia and those without were compared.  Food groups were analyzed either as daily or weekly intake. Vegetables, fruit and 100% fruit juice, whole grains and refined grains were calculated as daily intake. Legumes/pulses, fish and sugar-sweetened beverages (SSBs) and the ratio olive-oil-to-saturated-fat were calculated based on the weekly consumption.",8ae276b9-cefa-4927-b653-0f34837ec45e
12,methods12," Composite dishes of the Food Frequency Questionnaire (FFQ) were broken down into individual ingredients by weight and included in the calculation of the corresponding c-MED food groups. The specific food items considered in each of the food groups are provided as Supplementary Table S1.  2.4. Statistical Analysis  Categorical data were presented in frequencies and percentages (n, %). Continuous data were screened for extreme outliers and potential misclassifications by tabulation techniques and the use of scatter plots. K density and P-P plots were used to examine distribution. Normally distributed variables were summarized using means and standard deviations (sd), whereas the medians and range (25th–75th percentiles, to avoid extreme variables) were used for skewed data. Student’s t-test (for normally distributed) or the Mann–Whitney U test (for skewed data) tests was employed to examine significant differences between continuous variables.",11870c34-6348-4389-bd60-a716df734b2f
13,methods13," The Chi-square test or Fisher’s exact test (for small sub-samples; n < 5) was used to examine significant group differences between categorical variables.  Multiple logistic regression was used to assess the association between adherence to the Mediterranean diet and age group, gender, nationality, educational level, employment status, marital status, physical activity level, smoking status, body mass index (BMI), hypertension diagnosis, diabetes diagnosis and history of cardiovascular disease. Statistical analysis was performed using Stata, version 16.1 [43]; p-values < 0.05 were considered to be significant.  3. Results  3.1. Socio-Demographic Characteristics  Table 1 presents the association of sociodemographic characteristics, body mass index (BMI), physical activity levels and reported chronic disease diagnosis of the 610 participants in the study. There were 75 participants with and 535 participants without dyslipidemia.",f1a64908-2654-4b7b-a775-7aaa53ca5233
14,methods14," Participants with dyslipidemia were significantly older than participants without (41.92 vs. 33.49; p < 0.001). There were no significant differences in the gender, nationality and educational level between participants with and those without dyslipidemia.  There was a significant difference in the body mass index (BMI) between participants with and those without dyslipidemia (p = 0.002). A total of 72% percent of participants with dyslipidemia were overweight/obese, while 51.2% of participants without were overweight/obese. Moreover, a larger proportion of participants without dyslipidemia were of normal body mass index (BMI) compared to those with dyslipidemia (43.6% vs. 26.7%). Surveyed participants with dyslipidemia reported a significantly higher prevalence of hypertension (40% vs. 10.8%), diabetes (17.3% vs. 4.5%) and history of cardiovascular disease (12% vs. 1.5%) compared to those without dyslipidemia.  3.2.",d5f29599-522f-48d8-9bc2-4287b2b7cee2
15,methods15," Diagnosis and Treatment of Dyslipidemia  Table 2 shows the proportion of the surveyed participants diagnosed with dyslipidemia and treatment. Of the 610 participants, 319 (52.3%) had their blood cholesterol checked in their lifetime, and out of those, 75 (23.5%) reported that they were diagnosed with high blood cholesterol. Of those treated, 38.7% received medical treatment for dyslipidemia, and 20% were taking herbal/traditional remedies.  3.3. Energy and Nutrient Intakes  Table 3 shows an intake comparison of energy and macronutrients of the surveyed participants with and without dyslipidemia. There was no significant difference in energy intake between participants with and without dyslipidemia (2202.9 kcal and 2247.8 kcal/day, respectively). However, participants without dyslipidemia obtained a larger proportion of their calories from carbohydrates compared to those with dyslipidemia (50.16% vs. 48.04%, p < 0.05).",73a19106-dca4-4653-b15c-2343e87304d8
16,methods16,"  On the other hand, participants with dyslipidemia obtained a higher proportion of energy from total fat compared to those without dyslipidemia (8.38% vs. 5.79%, p = 0.009). There was no significant difference in the proportion of energy from saturated fatty acids between the two groups. However, participants with dyslipidemia reported obtaining a higher proportion of calories from monounsaturated fatty acids (5.16 vs. 2.76, p < 0.001) and polyunsaturated fatty acids (5.16 vs. 2.76, p < 0.001), compared to those without dyslipidemia.  Over 75% of participants in both groups reported an intake of over 200 g/day of cholesterol. On the other hand, 61.31% of all surveyed participants reported a dietary fiber intake of less than 25 g/day. A comparison of the micronutrient intake between participants with and those without dyslipidemia did not show any significant differences (Supplementary Material—Table S2).  3.4.",92ded494-0a01-4f87-b5ee-72affafcb0b7
17,methods17," Adherence to Mediterranean Diet  Associations between adherence to the Mediterranean Diet and the sociodemographic characteristics, body mass index (BMI), physical activity levels and chronic disease diagnosis are presented in Table 4. The median composite MED score (c-MEDS) was 4 with a range between 0 and 8. According to the bivariate (or crude) analysis, age group, nationality, marital status, educational level, smoking status and self-reported diagnosis of dyslipidemia or hypertension were significantly associated with higher adherence to the MD diet.  More specifically, the older the participants were, the higher the likelihood of participants having a higher MD adherence score compared to younger adults (31–49-year old’s: OR: 1.87; 95%CI: 1.26–2.77 and those aged 50+: OR: 4.16; 95%CI: 2.59–6.69 compared to 18–30 years old adults).",94b42c93-d355-457e-b9aa-dd550f7c5e7b
18,methods18," In the fully adjusted model, only participants aged 50+ years had significantly higher odds of MD adherence score compared to 18–30-year-old participants (OR: 2.97; 95%CI: 1.49–5.92).  In terms of nationality, non-Emirati women were 46% more likely to have high adherence to the MD diet compared to non-Emirati. The likelihood further increased (OR: 1.95; 95%CI: 1.33–2.87) when the model was adjusted for all other factors related to MD. Furthermore, participants who were married or divorced/widowed were also more likely to have a higher MD score compared to single (OR: 2.37; 95%CI: 1.69–3.33 and OR: 2.63; 95%CI: 1.13–6.15, respectively); however, the effect was nulled in the fully adjusted model.  High school graduates and those with post-secondary education were 70% and 67% less likely to have a high MD adherence (OR: 0.30; 95%CI: 0.11–0.79 and OR: 0.33; 95%CI: 0.13–0.",2787c653-5534-4311-9651-55fc8c0cfef6
19,methods19,"83, respectively), compared to those with <12 years of schooling; however, the effect was nulled in the fully adjusted model, and no significant associations remained in any of the categories.  Compared to never smokers, current smokers were 34% less likely to have a high MD adherence score, although this was only seen in the bivariate analysis (OR: 0.64; 95%CI: 0.41–0.98). No effect was found for ex-smokers in any of the models. Lastly, in the bivariate analysis, participants with dyslipidemia or hypertension were also more likely to have a high MD adherence (OR: 1.80; 95%CI: 1.07–3.05 and OR: 2.19; 95%CI: 1.32–3.64, respectively), compared to healthy participants, although the effect was not significant in the adjusted model. Overall, in the fully adjusted model, participants with higher MD scores were non-Emirati and those aged 50+.  The daily and weekly median intakes of C-MED food groups of participants with and those without dyslipidemia are presented in Table 5.",4e569a64-4881-4ebe-b746-294d2dad2d01
20,methods20," There was no significant difference in reported median daily intake of fruits and whole grains between participants with and those without dyslipidemia. Participants with dyslipidemia reported a higher median daily intake of vegetables compared to participants without dyslipidemia (230.28 g vs. 170.03 g; p < 0.001). On the other hand, participants without dyslipidemia reported a significantly higher intake of refined grains compared to participants with dyslipidemia (310.85 g vs. 239.96 g, p = 0.017).  There was no significant difference in the reported median weekly intake of legumes/pulses, fish and olive-oil-to-saturated-fats between participants with dyslipidemia and those without. Participants without dyslipidemia reported a significantly higher intake of sugar-sweetened beverages compared to those with dyslipidemia (320.95 mL vs. 122.50 mL, respectively; p = 0.008).  3.5.",19d54716-7b58-46d1-adeb-f251d47fe50c
21,methods21," Advice on Lifestyle and Diet Modifications  Figure 1 shows the proportions of the participants with and those without dyslipidemia who reported receiving lifestyle and dietary modification advice from doctors and other health professionals. A significantly higher proportion of participants with dyslipidemia received advice related to reducing salt (p < 0.001), reducing total fat (p < 0.001), reducing sugar-sweetened beverages SSBs (p = 0.017) and maintaining a healthy weight (p = 0.005).  4. Discussion  Dyslipidemia is a major risk factor for cardiovascular disease [44]. A dyslipidemia prevalence of 72.5% among the adult Emirati adults with a mean age of 42.8 years was reported [18], which is greater than the global incidence of 39% [1]. Diet and obesity are modifiable risk factors for dyslipidemia.",370b4809-4644-4342-a9d4-30f044537bbd
22,methods22," Due to the limited studies on dietary patterns and dyslipidemia in the United Arab Emirates (UAE), we examined the associations of dyslipidemia with dietary intakes, body weight status and sociodemographic factors in a sample of adults in the United Arab Emirates.  The prevalence of dyslipidemia among participants in the present study who reported that they had their blood cholesterol measured in their lifetime (n = 319) was 23.5%, which is much lower than a prevalence of 72.5% reported in a previous United Arab Emirates (UAE) study [18]. Possible reasons for this difference include the younger age of participants in the present compared to the previous survey (34.5 vs. 42.8 years, respectively) [18]. In addition, the present study relied on a self-reported diagnosis of dyslipidemia rather than the biochemical assessments as in the previous study [18].",354763cc-2eb8-47dc-8038-9885b3c573b7
23,methods23,"  Gender, smoking, age, central obesity and diabetes were the significant predictors of dyslipidemia in the previous study [18], while in the present study, gender was not associated with dyslipidemia. Another study conducted in the United Arab Emirates (UAE) involving 5126 young adults, aged 18–40 years found a higher prevalence of dyslipidemia among men compared to women [19]. However, in the above-mentioned two studies, there was a higher proportion of males (51.8% and 62%, respectively) compared to the current study, which involved predominately female participants (64.3%).  Mezhal and colleagues [19] also reported the coexistence of obesity and dyslipidemia with other cardiometabolic risk factors, such as hypertension and diabetes. In the present study, reported dyslipidemia diagnosis was associated with increased age, higher body mass index (BMI) and a history of diabetes, hypertension and cardiovascular disease.",0cd51127-c2a4-4f87-bed1-5957dbe1bf97
24,methods24," The link between obesity and dyslipidemia is well-established [11,44].  Obesity, especially abdominal obesity, is associated with dyslipidemia [45,46]. Among Chinese adults, older age, overweight and obesity were associated with dyslipidemia [45]. Several studies conducted in Saudi Arabia found an association between dyslipidemia with obesity and sociodemographic factors, including high waist circumference, higher body mass index (BMI) and age, within both genders [36] as well as increasing age, male gender and body mass index (BMI) [47].  The United Arab Emirates has undergone major economic changes and urbanization over the past five decades, which is accompanied by nutritional transition changes from the traditional diet to diets higher in fat, sugar and meats and lower in whole grains, fruits and vegetables [7]. This eating pattern is reflected in the results obtained from the dietary intakes of the participants in the current study.",d5663efa-e288-402e-8a13-6dc0397ea031
25,methods25," For example, over 80% of participants with dyslipidemia and those without had a saturated fat intake greater than 10% of their daily total calories, over 70% had dietary cholesterol greater than 200 mg/day, and 61% of them did not meet the dietary fiber recommendation of at least 25 g/day [48].  An analysis of the consumption of food groups in the composite Mediterranean Diet in the present study showed a higher consumption of vegetables among participants previously diagnosed with dyslipidemia. This may be as a result of the advice of increasing vegetable intake received after the diagnosis of dyslipidemia. On the other hand, participants without a diagnosis of dyslipidemia reported consumption of refined grains and sugar-sweetened beverages. It is possible that participants with dyslipidemia adapted healthier dietary habits after the diagnosis by reducing the intake of refined grains and sugar-sweetened beverages.",7070bd70-6f16-4b7e-b952-b496267a85ae
26,methods26,"  In a study by Enani and colleagues, carbonated beverages were associated with an elevated risk of dyslipidemia in males [36]. Among Kuwaiti adults, the risk of metabolic syndrome or dyslipidemia was higher in individuals who adhered more closely to the poultry/refined grains diet pattern than in those who adhered the least [37]. On the other hand, the consumption of a diet high in vegetables was linked to a reduced incidence of dyslipidemia but not the cardiovascular diseases (CVD) risk variables [37].  Research has confirmed the multiple benefits of healthy dietary patterns, including the Mediterranean diet (MD) and the Dietary Approaches to Stop Hypertension (Dietary Approaches to Stop Hypertension (DASH)) Diet, on their protective role against cardiovascular diseases (CVD) [26,49,50,51,52], and these should be recommended for dyslipidemia prevention and management [44].",03b0f8b5-a200-4e8b-8845-5c468d9a9329
