,chunk_label,chunk_text,uuid
0,methods0," 2.1. Study Population  The Mediterranean healthy Eating, Aging, and Lifestyle (Mediterranean healthy Eating Aging and Lifestyle (MEAL)) study is an observational study aimed to evaluate the correlation between Mediterranean dietary and lifestyle habits and non-communicable diseases. The protocol of this study is illustrated in detail in the paper of [38]. In brief, a sample of 2044 men and women aged 18 or more years old, randomly enrolled between 2014 and 2015 in the main districts of Catania, a city of southern Italy, was included in the baseline data, by using the list of registered records of local general practitioners. Data were stratified by 10-year age groups and sex. In order to provide a specific relative precision of 5% (Type I error, 0.05; Type II error, 0.10), considering an anticipated 70% participation rate, the theoretical sample size was estimated to 1500 individuals.",4bee44b5-7b0d-4ade-8486-714d267db188
1,methods1,"  In detail, 2405 subjects were invited to participate in the study, 2044 participants accepted (response rate of 85%), while 361 individuals refused. The aims of the study were carefully explained to all participants, who gave their written informed consent. All the procedures were performed in agreement with the Declaration of Helsinki (1989) of the World Medical Association. The study protocol has been revised and authorized by the concerning ethical committee.  2.2. Data Collection  In order to visualize the response options, a paper copy of the questionnaire was provided to all participants during face-to-face assisted personal interviews. Tablet computers were used by the interviewer to directly register the final answers. Information concerning sociodemographic factors and lifestyle habits was recorded.",0ca763d5-e2f7-4e91-b40f-2e1e652c09cb
2,methods2," The sociodemographic data comprised sex, age at recruitment and educational status [low (primary/secondary school), medium (high school), and high (university)], while lifestyle variables included smoking status (non-smoker, ex-smoker, and current smoker), physical activity [low, moderate, high; determined by using the International Physical Activity Questionnaire (International Physical Activity Questionnaire (IPAQ)) [39], as well as alcohol drinking [none, moderate drinker (0.1–12 g/d) and regular drinker (>12 g/d)].  2.3. Dietary Assessment  Aiming to determine the dietary intake, two food frequency questionnaires (FFQ, a long and a short version) previously proved for validity and reliability for the Sicilian population were adapted [40,41]. For the purposes of this study, only data from the long version were imputed, consisting of a 110-item FFQ.",bd1b231a-ea18-43a3-b04a-30e1bfa268dc
3,methods3," Employing the determination of the food intake, the energy content as well as the macro- and micro-nutrients intake was calculated through a comparison with food composition tables of Council for Research in Agriculture and Analysis of Agricultural Economy (CREA) [42]. Intake of seasonal foods referred to consumption during the period in which the food was available and then adjusted by its proportional intake over one year.  2.4. Food Classification  Based on the NOVA classification, food items have been classified as follow: group 1, unprocessed or minimally processed foods (i.e., rice and other cereals, meat, fish, milk, eggs, fruit, vegetables, nuts, etc.); group 2, processed culinary ingredients (i.e., sugar, vegetable oils and butter); group 3, processed foods (i.e., processed breads and cheese); group 4, ultra-processed foods (i.e., confectioneries, salty snacks, fast-foods, soft drinks, etc.) [9].",416a85fe-6557-483a-a883-3ba64a22c9e6
4,methods4," Based on this classification, all 110 items of the long FFQ were included in the classification and used for the analyses.  2.5. Diet Quality Measures  Several variables have been assessed in order to investigate the relation between Ultra processed food (UPF) consumption and diet quality. Specifically, the proportion of Ultra processed food (UPF) in the diet was related to various dietary patterns and scores, including the Mediterranean diet, the Dietary Approaches to Stop Hypertension (Dietary Approaches to Stop Hypertension (DASH)), the Alternate Diet Quality Index (Alternate Diet Quality Index (AHEI)), and the Diet Quality Index-International (DQI-I). Adherence to the Mediterranean dietary pattern has been assessed through a literature-based scoring system [43], which provides a positive scoring when reporting consumption of food groups in line with the Mediterranean diet (i.e.",d674b37d-66dc-481f-9132-2d9e7bbdfdba
5,methods5,", fruits and vegetables, cereals, legumes, fish, olive oil, moderate alcohol consumption) and negative scoring related to consumption of food groups not in line (i.e., meat and dairy products, excess or no alcohol intake). The nine food groups contribute to build a score score ranging from 0 point (lowest adherence) to 18 points (highest adherence). For the purposes of this study, participants were categorized in 3 groups indicating low (<7 points), medium (7–12 points), and high (>12 points) level of adherence to the Mediterranean diet [44].",f123610f-8692-4aff-bffb-694b2811bdf6
6,methods6," The Dietary Approaches to Stop Hypertension (DASH) diet is a score composed by 9 points calculated based on (i) the consumption of recommended daily servings of six food groups (whole grains, fruits, vegetables, meat and dairy products, nuts/seeds/legumes), (ii) average daily consumption of saturated fat less than the recommended 5% of total energy intake, (iii) average daily consumption of added sugar intake <3% of total energy intake, and (iv) alcohol intake equal or below the recommended 2 drinks/d for men and 1 drink/d for women. Participants were finally categorized in 3 groups indicating low (<4 points), medium 4–5 points), and high (>5 points) adherence to the Dietary Approaches to Stop Hypertension (DASH) diet [45].",15aa1187-7a8d-40eb-bb66-686ef3838d1c
7,methods7," The A-HEI was calculated based on seven food/nutrient items (fruits and vegetables, cereal fiber, nuts, ratio of white to red meat, trans fats, alcohol, ratio of polyunsaturated to saturated fatty acids) each contributing 0 to 10 points indicating no to fully meeting the nutritional recommendation (and intermediate scores proportionally indicating intermediate intakes) and use of a multivitamin contributing either 7.5 or 2.5 points for use/no use, respectively. The total A-HEI score ranges from 2.5 (worst) to 87.5 (best), with participants categorized in 3 groups indicating low (<35 points), medium (35–41 points), and high (>41 points) adherence to the score [46].",b8e4d9ca-8d06-4a2e-bec8-11e9a96a53fd
8,methods8," Finally, the DQI-I was calculated based on food/nutrient items considering (i) variety of consumption of five food groups (fruits and vegetables, meat/poultry/fish/egg, dairy/beans, and grains); (ii) adequacy, considering minimum adequate daily intake for fruits and vegetables, grains, and fiber (dependent on daily energy intake), a proportion of >10% of total energy from protein, and selected cut-off values derived from the recommended daily intakes for Italian adults for iron, calcium, and vitamin C intake; (iii) moderation, considering maximum intake for foods and nutrients that may need restriction; (iv) overall balance, considering the proportion of energy sources and fatty acid composition. The final score ranges from 0 to 100 points, with participants categorized in 3 groups indicating low (<41 points), medium (41–47 points), and high (>47 points) adherence to the DQI-I [47].",b96a54e1-1765-45a1-a0d6-a2530d36e28b
9,methods9,"  Finally, the agreement with dietary recommendations of the European proposed values for macronutrient intake of the European Food Safety Agency (European Food Safety Agency (EFSA)) [48] and those proposed by the Italian Society of Human Nutrition “Livelli di Assunzione di Riferimento di Nutrienti” (LARN) [49] for selected nutrients has been further investigated.  2.6. Statistical Analysis  The mean share of all NOVA food group and subgroups to the total daily energy intake was estimated. The participants were categorized into quintiles of energy shares of Ultra processed food (UPF)s. The energy share of each NOVA food group and subgroup was estimated across quintiles of Ultra processed food (UPF) consumption and differences between groups were tested with Student’s t-test and ANOVA for paired and multiple group comparisons after testing for normality of distribution of the variables. Test for linearity of differences was performed through contrasts analysis.",44efc93a-88c3-4520-8323-a024e48c33c6
10,methods10," The distribution of the mean nutrient intake across quintiles of energy shares of Ultra processed food (UPF)s was also calculated and differences between groups tested. The mean intake of the four NOVA food group by level of adherence to the Mediterranean diet and adherence to dietary recommendations were finally calculated and differences between groups tested. All reported p values were based on two-sided tests and compared to a significance level of 5%. SPSS 25 (SPSS Inc., Chicago, IL, USA) software was used for all the statistical calculations.  3. Results  The average daily energy intake of the sample was 2091.1 kcal, 38.7% of which were from the NOVA group of unprocessed/minimally processed foods, 5.7% from processed culinary ingredients, 38.3% from processed foods, and 17.9% from the Ultra processed food (UPF)s group. An overview of average consumption of foods by processing level is presented in Figure 1, with detailed data reported in Supplementary Table S1.",14346061-cc20-4505-9f9b-9a7ce5f4e7f3
11,methods11," The largest variation in energy shares of Ultra processed food (UPF)s among background characteristics has been observed across age groups, being Ultra processed food (UPF)s more consumed among young individuals and linearly decreasing for increasing categories of age groups (Figure 1). Among other background characteristics showing differences in Ultra processed food (UPF) intake, individuals unmarried (p < 0.001), current smokers (p = 0.046) with higher cultural level (p < 0.001) and medium physical activity level (p < 0.001) reported consuming more Ultra processed food (UPF)s (Figure 1). Ultra processed food (UPF) consumption did not substantially differed by sex and occupational level (Figure 1). Among eating habits, individuals having often snacks (p = 0.001) and out-of-home eating (p < 0.001) reported higher consumption of Ultra processed food (UPF)s, while there were no differences for breakfast habits (Figure 1).",3f093aed-dcf8-4941-b7dd-31c8ea05fb07
12,methods12,"  Among the main food subgroups characterizing the NOVA categories, grains and pasta, fruits, vegetables, and legumes accounted for most of the energy of the unprocessed/minimally processed foods (Table 1). Among processed culinary ingredients, vegetable oils provided the highest energy contribution (Table 1). Within processed foods, most of the energy came from bread and cheese (Table 1). Within the Ultra processed food (UPF) group, the highest energy contribution was provided by fast foods and sweets (biscuits, pastries, cakes, ice creams, confectionery and creams) (Table 1).  The mean energy share of Ultra processed food (UPF)s varied from 6.3% of total daily energy intake for individuals in the lowest quintile of Ultra processed food (UPF) consumption to 34.2% for those in the upper quintile (Table 2).",25cedc4e-855e-45c3-aa02-9092d24d96c0
13,methods13," All specific foods within the Ultra processed food (UPF) NOVA group increased linearly across quintiles of Ultra processed food (UPF) consumption, with the largest variation observed for breakfast cereals, confectionery and creams, salty snacks, carbonated soft-drinks, and confectioned juices, which were rarely consumed in the lowest quintile groups (Table 2). An opposite trend was observed for the unprocessed/minimally processed food group, despite there were no significant decreasing linear trends for individual subgroups of foods, except for fruits (Table 2). An additional analysis has been conducted by age groups (Supplementary Table S2).",cc2aa835-6f71-4d0a-87b3-9c2ef50b8d8b
14,methods14," Interestingly, despite the mean Ultra processed food (UPF) intake is higher in younger than older participants, the extreme categories were not substantially different (in the younger group, the mean intake in the highest quintile of Ultra processed food (UPF)s was even smaller than in the older one) with no large differences in the trends observed for the whole sample, with some difference of consumption of certain foods in the lowest quintile of Ultra processed food (UPF) consumption between younger and older participants (i.e., younger individuals ate slightly more fish, vegetables, fruit, nuts, fast foods than older ones).  The comparison of mean intake of total energy intake and nutrients across energy shares of quintiles of Ultra processed food (UPF) consumption is reported in Table 3.",fd09be51-de5c-4e28-8762-861d838858fc
15,methods15," Compared to the lowest quintile of Ultra processed food (UPF) consumption, individuals in the highest quintile consumed, on average, additional 300 kcals per day; significant increasing trends toward higher consumption of Ultra processed food (UPF)s were observed for all macronutrients, with exception of specific analysis of n-3 polyunsaturated fatty acids (either from plant or seafood sources), and for carbohydrates (Table 3). In contrast, an inverse trend for fiber intake was found, ranging from 38 to 31 g/d between the first and the fifth quintile of Ultra processed food (UPF) consumption.",85fb7c2a-f91c-4064-a585-12e1ff94cd93
16,methods16," Concerning micronutrients, some plant-derived vitamins, such as vitamin A and vitamin C showed an inverse trend toward increasing shares of Ultra processed food (UPF) consumption, while others, such as vitamin E, vitamin D, and vitamin B12 showed a linear increasing trend; also mineral intake was significantly differently distributed across quintiles of dietary shares of Ultra processed food (UPF) consumption, although sodium intake resulted in an increased trend toward higher intakes of Ultra processed food (UPF)s, while potassium intake tended to decrease, although not with a clear trend over categories (Table 3).",68ac9bd7-e905-4b37-a2d6-36fd64199b52
17,methods17," When running again the same analysis by age groups, the observed trends were not identical than in the whole cohort, being the intake of n-3 PUFA, carbohydrates, potassium, vitamin A, vitamin E, vitamin D, vitamin B12 lower in higher consumers of Ultra processed food (UPF)s compared to lower ones among younger individuals while opposite trends were reported in the older age group (Supplementary Table S3).  Consistently, when exploring the mean consumption of Ultra processed food (UPF)s between individuals meeting the European and Italian dietary recommendations and those who did not, there was a significant higher intake in those meeting the recommendations for carbohydrates (p < 0.001), vitamin B12 (p < 0.001 for European Food Safety Agency (EFSA) but not significant for LARN), vitamin D (p = 0.003), and vitamin E (p < 0.001), while Ultra processed food (UPF)s were less consumed among those meeting the recommendations for vitamin A (p = 0.",8d98b316-dc3d-4d0a-9584-20527555b6dc
18,methods18,"009 for LARN but not significant for European Food Safety Agency (EFSA)) total fats (p < 0.001), fiber (p < 0.001), sodium (p < 0.001 for European Food Safety Agency (EFSA) and p = 0.002 for LARN), potassium (p = 0.007 for European Food Safety Agency (EFSA) but not significant for LARN), and vitamin C (p < 0.001) for both European Food Safety Agency (EFSA) and LARN (Figure 2). Detailed data are reported in Supplementary Table S4.  Finally, the energy shares of NOVA food groups by level of adherence to various dietary patterns and indices of diet quality is shown in Figure 3: irrespectively of the dietary score used, individuals displaying a “healthier” dietary profile (meaning higher adherence to either the Mediterranean diet, the Dietary Approaches to Stop Hypertension (DASH) diet, the A-HEI, or the DQI-I) consumed less Ultra processed food (UPF)s and more unprocessed/minimally processed foods, with minor variation in the other NOVA food categories (Figure 3).",de2aac07-a2b9-4598-b955-5cfa398e9b6b
19,methods19," Detailed data are reported in Supplementary Table S5.  4. Discussion  This study aimed to describe the consumption of Ultra processed food (UPF)s in a southern Italian cohort of adults and testing for its relationship with various parameters of diet quality. The average daily intake of Ultra processed food (UPF)s registered in this cohort is in line with the rates reported in the Italian Nutrition & Health Survey (Italian Nutrition & Health Survey (INHES)), a study conducted on 9139 participants aged 5–97 years in which the energy share of Ultra processed food (UPF)s was 17.3% [37]. These average consumption of Ultra processed food (UPF)s are also consistent with those reported for other Mediterranean countries.",a7bdcada-2aa1-4c9e-9c78-12148644e8c9
20,methods20," For instance, the Study on Nutrition and Cardiovascular Risk in Spain (ENRICA) including 12,948 individuals, in which Ultra processed food (UPF)s accounted for about 24% of daily energy intake [32], and another representative Spanish cohort from the Diet and Risk of Cardiovascular Diseases (Cardiovascular Diseases (CVD)) in Spain (Diseases (Cardiovascular Diseases (CVD)) in Spain (DRECE)) study including 4679 individuals reported an average consumption of 24% of energy intake from Ultra processed food (UPF)s [50]. In addition, data from the National Food, Nutrition and Physical Activity Survey (2015–2016) of the Portuguese population including 3852 participants showed an average daily intake of 22% of daily energy share from Ultra processed food (UPF)s, ranging from 6.5% to 44.1% in the lowest and highest quintile of intake, respectively [51].",5dd81e9f-6162-4328-a5fb-ebb66d32878c
21,methods21," In contrast, findings from a French survey from the Étude Nationale Nutrition Santé (ENNS) conducted on 2642 participants, showed substantial higher intake of Ultra processed food (UPF)s than other Mediterranean countries (average of 31.1%, ranging from 12.8% to 51.5% daily energy shares of Ultra processed food (UPF)s in first and fifth quintiles, respectively) [52]. Moreover, studies from non-Mediterranean countries, such as Canada [12], UK [29], Australia [30], and US [53] showed substantial higher intakes of Ultra processed food (UPF)s, with average intakes of more than 50% of total energy share in Ultra processed food (UPF) reaching up to an average 80% in the highest quintiles of dietary shares of energy from Ultra processed food (UPF)s.",52a666f1-9943-457e-81f6-12d39a2e3170
22,methods22," Compared to the aforementioned cohorts and samples, also the preferred consumption of food subgroups reported in the present study was substantially different from those conducted in countries outside the Mediterranean area: in fact, the results from this study showed a peculiar characterization of food subgroup consumption, with a trend toward higher intakes of pasta and carbohydrates among unprocessed/minimally processed foods, vegetables oils among processed culinary ingredients, bread among processed foods, and sweets among Ultra processed food (UPF)s. This pattern of consumption is quite unique compared to the data from other samples worldwide, in which the consumption of pasta (i.e., about 1–2% in US vs. about 10% in Italy), fruits, vegetables, and legumes (i.e., less than 1% in US vs. about 5% in Italy) is reported to be generally much lower, while other food products, such as carbonated soft drinks (i.e., up to 7% in US vs. 0.6% in Italy), salty snacks (i.e.",dad7f85d-9cc0-439b-aa88-cdb2dd94eeca
23,methods23,", almost 5% in US vs. less than 1% in Italy), and breakfast cereals (i.e., 3% in US vs. less than 1% in Italy) among others, is generally higher [53]. Interestingly, we also noted that in the present study the intake of Ultra processed food (UPF)s was much higher in the highest quintile than in all other groups; this may reflect a certain preference for Ultra processed food (UPF)s by a subgroup of the sample that is likely to consume this type of food not just in higher quantity, but probably as part of a dietary pattern poorer in other types of foods (i.e., less processed ones).  A recent meta-analysis pooling together nutritional data from nationally-representative samples worldwide showed a global trend toward a poorer nutritional quality correlated with higher consumption of Ultra processed food (UPF)s (increase in free sugars, total fats, and saturated fats, as well as a decrease in fiber, protein, potassium, zinc, and magnesium, and vitamins A, C, D, E, B12, and niacin) [11].",bf8749e7-502d-4185-a794-1c06f44279f5
24,methods24," The results of the present study are not completely in line with those previously reported, since the consumption of only a few vitamins and sodium was found to be negatively affected by higher intake of Ultra processed food (UPF)s. This may reflect the overall scarce consumption of Ultra processed food (UPF)s in this cohort compared to US, Canadian, and Australian cohorts, with the main contributors being sweet foods rather than other commercially relevant Ultra processed food (UPF)s, which are, in fact, not much consumed in southern Italy [33,54]. It may be possible that since lower consumption of Ultra processed food (UPF)s lead to higher intake of unprocessed ones, the nutritional contribution of the latter remains preeminent compared to the former. Another hypothesis relies on the fact that individuals reporting higher intakes of Ultra processed food (UPF)s (i.e., sweets) may substitute them with selected unprocessed ones with similar taste (i.e.",23b13f39-f669-47c0-96b6-be234deb3f70
25,methods25,", fruits), potentially resulting in only specific nutritional modification of the diet (i.e., decrease in fruit-derived vitamins, such as vitamin C). In contrast, an increasing trend in sodium intake by increased dietary energy share of Ultra processed food (UPF)s was found in the present study. Interestingly, this finding is in line with results reported in another study conducted on the Italian population [37], while was rather not observed in studies exploring dietary nutritional variations by Ultra processed food (UPF) consumption in non-Mediterranean countries. The consistency of this result across the Mediterranean region suggests that a rationale behind it should be explored, despite it is quite unclear why it could not be observed in non-Mediterranean countries.",910554a3-4552-4940-9dff-821cec9fa90f
26,methods26," One can hypothesize that the dietary shares of Ultra processed food (UPF)s in such countries (expressed as dietary energy share from Ultra processed food (UPF)s) might be more influenced by foods not rich in sodium, while in Mediterranean countries the relatively small percentage of Ultra processed food (UPF) consumed might be richer in sodium. However, this hypothesis does not match with our findings, as most of the highest contributors of Ultra processed food (UPF)s are sweet foods. Moreover, when looking at previously published data on major food sources of micronutrients in this cohort [55], about 50% of dietary sodium is derived by grains, with a higher contribution from bread, which has been reported to decrease as Ultra processed food (UPF) consumption increase, thus not allowing for an interpretation of the results.",c423bee9-910c-4dcd-a991-980db81c21d2
27,methods27," Another hypothesis may suggest that among the most consumed Ultra processed food (UPF)s have been reported fast foods (intended as ultra-processed meats), which are typically overloaded with sodium both to improve the taste and durability of the products [56]. As there is a huge discrepancy across quintiles of Ultra processed food (UPF) consumption in fast food consumptions, ranging from 1.1% to 7.5% of energy share, it may be hypothesized that most of the sodium intake related to Ultra processed food (UPF) consumption is related to their share in fast foods. A final conclusion cannot be drafted from the observed data and further studies are needed to investigate whether dietary sodium intake would, in fact, increase whether a rise in Ultra processed food (UPF) consumption is observed in the Italian population.",3a8e3a5b-917c-43a1-8435-4c4bee343d16
28,methods28," Consistently, when comparing the average consumption of Ultra processed food (UPF)s in individuals by rate of compliance with nutritional recommendations, individuals meeting the recommendations for sodium, fiber, total fats, vitamin C, and potassium reported consuming less Ultra processed food (UPF)s, suggesting that in this Southern Italian sample, these were the dietary factors more negatively affected by preference of Ultra processed food (UPF)s over the other categories of NOVA food groups.  Irrespective of the relation between dietary energy share of Ultra processed food (UPF)s and compliance with nutritional recommendations examined, there is agreement in the scientific literature (including the results in the present study) that individuals with higher adherence to the Mediterranean diet tend to consume less Ultra processed food (UPF)s [18,37,57].",e4494800-3fbd-4199-b557-7730368d9245
