,chunk_label,chunk_text,uuid
29,methods29, It is noteworthy to emphasize that the energy shares of various food groups across the NOVA categories by level of adherence to the Mediterranean diet displayed in this study shows that the percentage from groups NOVA 2 culinary processed and NOVA 3 processed did not substantially changed across categories of adherence to the Mediterranean diet while the main differences relied on an alternate consumption of NOVA 1 unprocessed/minimally processed at expenses of NOVA 4 Ultra processed food (UPF)s with increasing adherence to the Mediterranean diet.,48622885-f8a8-4311-bd39-28d1ed66e8dd
30,methods30," Albeit it may seem rather obvious that increased consumption of foods characterizing this dietary pattern may lead to higher intake of fruit and vegetables, whole grains, legumes, and olive oil, accompanied with lower consumption of meat, a traditional Mediterranean diet as could be observed in southern Italian islands may also reflect a higher availability of fresh and locally produced foods and a preference for home cooking as dictated by a long-standing cultural heritage. However, results from this study also depicted a background profile of individuals consuming higher shares of Ultra processed food (UPF)s characterized by younger age, smokers, average physically active and often eating out, reflecting a modern active lifestyle.",4de3163a-e89a-41d8-96c1-01583a21397d
31,methods31," Thus, the changes in behaviors toward more stressful and work-based lifestyles, the rise in availability of Ultra processed food (UPF)s which provide the commodity for out-of-home eating and ready-to-eat foods in a context where time for conviviality is limited, is slowing shaping a new scenario in several Mediterranean countries and might, in the near future, impact also more remote locations, such as Mediterranean islands. Importantly, from the additional analyses we conducted by age groups, we reported that although the absolute average intake of Ultra processed food (UPF)s was higher among younger individuals, the extreme consumption was actually not higher; moreover, we also found that the consumption of certain unprocessed foods was higher in younger than in older participants in the lowest category of Ultra processed food (UPF) consumption.",9b8246fc-e735-4e0a-b0d6-ea3298575d69
32,methods32," These observations suggest that the contribution of Ultra processed food (UPF)s to the dietary patterns in younger and older adults may substantially differ: on one side, younger individuals consume more Ultra processed food (UPF)s (possibly as a result of their lifestyle) with a large variety of foods, including unprocessed ones; on the other side, older individuals may consume less Ultra processed food (UPF)s, but those with higher intake also tend to have a lower consumption of unprocessed foods and a less varied diet. Assuming that the associations between Ultra processed food (UPF) consumption and higher risk of obesity and other various health issues reported in the scientific literature are convincing, it is important to monitor the consumption of Ultra processed food (UPF)s in all age groups and populations, especially those with traditionally low consumption, to predict potential rise in non-communicable diseases.",f84432d7-907c-47b7-8526-4845325ae97f
33,methods33,"  The present study is important to provide further information regarding the consumption of Ultra processed food (UPF)s in the Italian population, particularly individuals living in Sicily (in which a higher adherence to traditional dietary patterns compared to northern regions is generally registered). Compared to previous studies, we also provided in-depth analysis for diet quality testing for Ultra processed food (UPF) consumption by various a priori defined dietary patterns and putting in relation Ultra processed food (UPF) consumption with meeting national and international nutritional guidelines. However, potential limitations of this study should be considered when interpreting the results.",0ce3db2d-1885-41f7-8b66-64b0951f5372
34,methods34," First, the FFQ was not specifically designed to capture the level of processing of its items; although we followed a procedure widely used in other cohort studies REF, we cannot rule out the possibility of an under-estimation of Ultra processed food (UPF) intake failing to identify the consumption of specific food items not listed or identified in the FFQ. However, certain Ultra processed food (UPF) groups are rather not or poorly consumed in the population (i.e., frozen foods), thus we may hypothesize that the findings represent a reliable proxy of Ultra processed food (UPF) consumption in this sample. In addition, this study relies on self-reported dietary data, which may suffer from recall bias and over/underestimation of quantities. Finally, the NOVA classification aims to provide a proxy of the level of food processing, rather than being based on unequivocal, distinct physical/chemical aspects of foods, thus it may not entirely capture the expected exposure.  5.",09d664c3-f4f1-4e99-bb55-9373f5ef0984
35,methods35," Conclusions  In conclusion, consumption of Ultra processed food (UPF) in southern Italy is in line with those reported in some other Mediterranean countries, with preferences toward certain unprocessed or minimally processed foods (such as fresh vegetables, legumes, and pasta) that somehow may displace the rise in interest for Ultra processed food (UPF)s. As for the relation with diet quality, increase in Ultra processed food (UPF) consumption negatively impacted the nutrient profile, although with a lesser extent compared to other studies. Notably, different patterns of Ultra processed food (UPF) consumption have been registered for younger and older individuals. Considering the current scenario, it is important to monitor the intake of Ultra processed food (UPF)s in the general population and provide targeted education programs by age groups to inform on what are Ultra processed food (UPF)s before their availability and popularity put the grounds on general dietary habits.",4c440362-91c1-4b86-9de1-6e9894e260aa
36,methods36,  Supplementary Materials  The following supporting information can be downloaded at: https://www.mdpi.com/article/10.3390/ijerph191811360/s1. Table S1: Percent distribution and standard deviations of food group consumption by level of processing across background variables. P-values indicate statistical differences in ultra-processed food (Ultra processed food (UPF)) consumption between groups. Table S2: Percentage of energy shares of NOVA food groups across quintiles of the daily energy share of Ultra processed food (UPF)s by age groups. Table S3: Mean (and standard deviation) total energy intake and nutrient content of the overall diet according to quintiles of the energy share of Ultra processed food (UPF)s by age groups. Table S4: Percentage (and standard deviations) of Ultra processed food (UPF) consumption in individuals meeting and not meeting the European and Italian nutritional recommendations for selected macro- and micro-nutrients.,ee8f576a-f5a7-4402-a7bc-ed768f28e638
37,methods37," Table S5: Percent distribution and standard deviations of food group consumption by level of processing across level of adherence to selected a-priori defined healthy dietary patterns. P-values indicate statistical differences in ultra-processed food (Ultra processed food (UPF)) consumption between groups.  Click here for additional data file.  Author Contributions  Conceptualization, J.G., F.G. and G.G.; methodology, J.G., F.G. and G.G.; formal analysis and investigation, J.G., F.G. and G.G.; writing—original draft preparation, J.G., F.G. and G.G.; writing—review and editing, J.G., F.G., W.H.A.-Q., F.S., M.B. and G.G. All authors have read and agreed to the published version of the manuscript.  Institutional Review Board Statement  The study was conducted in accordance with the Declaration of Helsinki, and approved by the Institutional Review Board (or Ethics Committee) of CE Catania 2 (protocol code 802/23 December 2014).",daf412cf-8b59-46bc-907d-a509c95553d3
38,methods38,  Informed Consent Statement  Informed consent was obtained from all subjects involved in the study.  Data Availability Statement  The data that support the findings of this study are available upon reasonable request.  Conflicts of Interest  The authors declare no conflict of interest.  Figure 1 Percent distribution of food group consumption by level of processing across background variables. Green color stands for unprocessed/minimally processed foods; blue color stands for processed culinary ingredients; brown color stands for processed foods; red color stands for ultra-processed foods.  Figure 2 Percentage of Ultra processed food (UPF) consumption in individuals meeting and not meeting the European and Italian nutritional recommendations for selected macro- and micro-nutrients.  Figure 3 Percent distribution of food group consumption by level of processing across level of adherence to selected a-priori defined healthy dietary patterns.,ecf24a0a-8906-40cd-b3c7-025a4920f2e9
39,methods39," Green color stands for unprocessed/minimally processed foods; Blue color stands for processed culinary ingredients; yellow color stands for processed foods; red color stands for ultra-processed foods.  ijerph-19-11360-t001_Table 1 Table 1 Mean absolute and relative daily energy intake according to NOVA food groups in the study sample (n = 1936).  NOVA Food Groups	Kcal	% of Total Energy Intake	 Unprocessed or minimally processed foods			 Red meat and poultry	73.2	3.0	 Fish and sea foods	90.8	3.6	 Milk and unprocessed dairy	69.0	2.8	 Eggs	3.8	0.2	 Grains and pasta	249.1	9.9	 Fruits	162.5	6.8	 Vegetables	84.4	3.4	 Potatoes	16.0	0.6	 Nuts	81.1	3.3	 Legumes	124.8	4.6	 Processed culinary ingredients			 Vegetable oils	74.0	3.0	 Animal fats	7.1	0.3	 Table sugar	14.7	0.6	 Fruit juice (natural)	11.4	0.5	 Processed foods			 Breads	387.1	15.9	 Cheese	104.8	4.2	 Beer, wine and liquors	60.9	2.5	 Processed meats (cured)	30.0	1.2	 Ultra-processed foods			 Fast foods	87.8	3.4	 Ultra-processed dairy	32.",ebdbf510-39f5-47bf-883b-0d65b15dce14
