,chunk_label,chunk_text,uuid
0,methods0," Raw materials preparation  Fully ripened figs belonging to Ficus carica L. “El Qoti Lebied” cultivar, one of the most locally cultivated clones, were collected during the first week of September 2020 from an orchard in the rural township in Chefchaouen, northern Morocco. Selected fruits had uniform size and maturity, with no diseases and visual blemishes. Initial moisture content was determined using the oven-dried method as described by AOAC (30) and was noted to be 78 ± 1% wet basis (w.b.). Afterward, all figs were blanched by immersion in boiling water containing 1 kg Na Cl (99.5°C at normal atmospheric pressure) in 20 L for 15 s, 30 times; Blanching water to fruit ratio was 2 kg: 1 L. Subsequently, fruits were dried in an industrial hybrid dryer (50°C: 20–24% relative humidity; 4 h). The drying was stopped at a moisture content of 25% according to the dried fig commercial quality standards developed by the United Nations Economic Commission for Europe (31).",d529a50b-5566-4426-8cdd-32325c7b52da
1,methods1," All dried figs, with the same level of water activity of 0.42, were packaged and sealed in polyethylene terephthalate (polyethylene terephthalate (PET)) bags (size: 10 × 6 cm L/W; permeability: 50–100 and 245.83–408.64 cm3.μm/m2.h. atm for O2 and CO2, respectively; permeability to water vapor: 16.25–21.25 g.μm/m2.h) to serve as replicates; each bag was 250 g. All samples were stored at room temperature, ~22°C before being treated by gamma irradiation and analyzed for their adsorption isotherms.  Gamma irradiation  Dried figs irradiation was carried out at the Ionization Center of Boukhalef relevant to the National Institute for Agricultural Research (Institute of Agricultural Research (INRA)) of Tangier, Morocco. polyethylene terephthalate (PET) bags prepared as described above were divided into four groups each one placed inside a carton box (22.7 cm length by 19 cm width and 5 cm thickness), one of which was chosen as a control.",a29177ea-0e57-4b5c-bae4-3eebee6160e7
2,methods2," The three boxes left were treated by gamma rays at increasing doses: 1.0, 1.5, and 2.0 kGy of Cobalt radioisotopic source (60Co) with a maximum dose rate of 10.87 Gy/min and a minimum dose rate of 9.64 Gy/min. Each treatment was performed in triplicates. Immediately, after the end of the irradiation, control and irradiated samples were stored at room temperature, ~22°C before the investigation of water adsorption isotherms and thermodynamic properties.  Prior to gamma irradiation, the dosimetry was carried out according to a specific protocol, in which the dried figs were presented as described above with four bags (250 g) in each box (1 kg). The source of irradiation is Cobalt 60 COB9 type. The active material is confined inside two successive stainless steel tubular envelopes. These cylinders with a diameter of 10 mm and an active length of 450 mm are closed by massive plugs welded at their ends. The source holder used is made of stainless steel and can hold 22 COB9-type source pens.",400dc4cd-6a97-417b-8f27-c57c1404f1a5
3,methods3," The unit sources are distributed over a diameter of 140 mm. This source holder allows reloading and use of the sources for several years. The storage container, which is used for the transport of the sources, is type B (U) with a diameter of 870 mm and a height of 1,160 mm. It is made of lead and provides the required protection during transport of the source and during the intervention inside the ionization room. The sources are stored in dry conditions. The ionization cell with a parallelepiped shape 6.1 m long, 5.8 m wide, and 2.6 m high is delimited by walls that ensure the biological protection of operators and the environment (Figure 1A). The concrete walls with a maximum thickness of 1.63 m make it possible to attenuate the radiation up to the limit required by the radiation protection regulations.",4bde1370-cd7f-4449-a3c1-1a94a166f4d6
4,methods4," The location of the three alanine dosimeters placed separately in randomly chosen carton boxes is shown in Figure 1B, which were placed within a 47-cm radius from the ionization source. To ensure that the irradiation of the dried figs was indeed homogeneous and uniform, so as not to have parts irradiated more than others, it was necessary to know the dose uniformity which is in our case 1.129.  Figure 1 Ionization cell equipped with COB9-60 Cobalt source (A) and positioning of the alanine dosimeters in the box of dried figs (B).  Determination of equilibrium moisture content  The procedures for obtaining absorption isotherms for agri-food products are described by several authors (32–34). In this study, the gravimetric static method at 30, 40, and 50°C with six saturated salt solutions (KOH, MgCl2, K2CO3, NaNO3, KCl, and BaCl2) was used to determine the equilibrium moisture (Xeq) values of samples as described by Hssaini et al. (38) and Ouaabou et al. (35) (Table 1).",3eb705e3-7d8b-44cd-a0c8-b9383398189a
5,methods5," One of the advantages of this procedure is that it allows these salt solutions to generate a well-defined surrounding relative humidity inside the experimental jars and continuously obtain all the relative humidity values in the range from 5 to 90% (36, 37). Each sample was weighted every 2 days until they reached a constant weight value recorded on two consecutive weightings, which were supposed to be the equilibrium. Ten days were required to reach the equilibrium state. The difference of mass before (Mi) and after equilibrium state (Mf) at 105°C (±0.1°C) during 24 h gives the equilibrium moisture content (equilibrium moisture content (EMC)) at hygroscopic equilibrium (Xeq). It was determined using Equation (1) and reported on a dry weight basis (g water/g dry solid):  (1) equilibrium moisture content (EMC)=Xeq=Mi - MfMf  Table 1 Standard values of the water activities of the six saturated salts as a function of temperature used for the determination of the adsorption curves (35–37).",40c16b3d-661d-43d7-ace1-aa5aed03f5ce
6,methods7," Generally, the problem of modeling the adsorption isotherms consists in finding a function checking the following Equations (2) and (3):  (2) Xeq=f[PvpPvs]=f(aw,T)  (3) aw=PvpPvs=RH (%)100  where Pvp: Partial pressure of water vapor in air (Pa), Pvs: Partial pressure of saturated vapor (Pa), and RH: Relative air humidity (%).  Table 2 Moisture sorption isotherm models selected to analyze data for dried figs.  Models	Mathematical expressions	References	 Peleg	Xeq=A(aw)C +B(aw)D	(39)	 Enderby	Xeq=[A(1-Baw)+C(1-Daw)]aw	(40)	 Guggenheim–Anderson–De Boer (Guggenheim–Anderson–De Boer (GAB))	Xeq=ABC aw[1-Baw][1-Baw-BCaw]	(41)	 A, B, C and D are the models constants.  Xeq : Equilibrium moisture content [dry basis (kg/kg d.b.)].  aw : Water activity.  If the product is in hygroscopic equilibrium with the surrounding air, the water activity (aw) is identical to the equilibrium relative humidity (aw = ERH).",2a0face9-9020-4f01-aba2-8f5690d1c3db
7,methods8,"  The aforementioned models are compared based on the correlation coefficient (R2) and the standard error of estimated moisture (SE) (42). Curve Expert 3.1 and Originlab pro 8.1 software were used to determine the parameters of selected models using non-linear regression. R2 (Equation 4) (27) and SE (Equation 5) (38) were used to determine the prediction accuracy of each model to the experimental equilibrium moisture content and water activity data. The best-fitted equation was considered to be the one giving the smallest SE coupled to the highest R2 value (2, 38, 43–45):  (4) R=∑i=1N(MRpre,i-MR¯exp,i)2∑i=1N(MRexp,i-MR¯exp,i)2   (5) SE=∑i=1N(MRpre,i-MRexp,i)2df  where MRexp: The ith experimental equilibrium moisture content, Mipre: The ith predicted equilibrium moisture content, N: The number of observations, and df: The number of degrees of freedom of regression model.",9fcc79ed-9f58-4a0f-b610-cbbee0a6e3e0
8,methods9,"  Adsorption-specific surface area (S0)  By using the values of the monolayer moisture contents obtained by Guggenheim–Anderson–De Boer (GAB) model, the values of the water-specific surface area of adsorption can be calculated using Equation (6), and this is expressed in m2.g−1 of solids (4):  (6) S0=Mm×1PMH2O×No×AH2O=3.5×103×Mm  where So: Water-specific solid surface area of adsorption (m2.g−1 solids); Mm: Monolayer moisture content (g/100 g, d.b); No: Number of Avogadro (6 × 1023 molecules per mole); AH2O: Area of a water molecule (10.6 x 10−20 m2); and PMH2O: Molecular weight of the water (18 g.mol−1).  Optimal water activity [aw (op)] for storage  Food preservation by dehydration is based on the principle to maintain the water activity (aw) below the critical threshold where microbial growth along with some undesirable chemical reactions occur (46). It is well-known that each microorganism has a critical aw below which growth cannot occur.",31267ebe-43da-4b4c-ae15-04da2b908482
9,methods10," For instance, pathogenic microorganisms cannot grow at aw < 0.86; yeasts and molds are more tolerant but usually, no growth occurs at aw < 0.62. The so-called intermediate moisture foods (intermediate moisture foods (IMF)) have aw values in the range of 0.65–0.90. Generally, with aw between 0.4 and 0.2, the product is most stable with respect to lipid oxidation, non-enzymatic browning, and enzyme activity (41, 47). Among the objectives of the moisture isotherms study of a dehydrated agri-food product, is that it provides precise information on the equilibrium moisture content to be reached at the end of drying, and how to handle the product during packaging and storage for proper preservation. For this purpose, the optimal water activity values for conservation [aw (op)] of irradiated and control dried figs were determined. Indeed, the adsorption isotherms curves can be described as a polynomial equation of the third degree (48).",8a4b4dfc-9938-4d05-9490-fd8751ebb10f
10,methods11," The zone of better stability of the products corresponds to the central part or “plate.” This calculation method consists of making a polynomial decomposition of equilibrium moisture content, for all the experimental results of each sample, according to the water activity. Therefore, the optimum relative humidity for storage can be determined by calculating the value for which the second derivative of Xeq is canceled or “inflection point” (7, 49).  Net isosteric heat of adsorption (qst) and differential entropy of adsorption (ΔS)  The calculation of the isosteric heat of adsorption is defined by the sum of the net isosteric heat of adsorption (qst) and the latent heat of condensation of pure water vapor at system temperature (Hv) (50) and is given by Equation (7):  (7) Qs=qs+Hv  From the experimental data of the adsorption isotherms,",11d605a0-0e84-448f-9d8f-80488b84457c
11,methods12," the net isosteric heat of adsorption at constant humidity (Xeq) can be calculated using the Clausius–Clapeyron equation (Equation 8) (51):  (8) qst=-R [d (ln(aw))d(1θ)]Xeq  where aw: Water activity, θ: Absolute temperature (K), and R: Ideal gas constant (8,314 × 10−3 kJ.mol−1.K−1).  The value of water activity as a function of a fixed equilibrium moisture content can thus be determined from this equation using adsorption isotherms at different temperatures. For this, we assume that the net isosteric heat of adsorption is independent of temperature, and so Equation (8) can be integrated to give Equation (9):  (9) ln(aw)=-qstR1T+ΔSR  where ΔS : Differential entropy of sorption (J.mol−1.K−1).  Gibbs energy (ΔGβ)  From the slope of the curve ln(aw)= f (1T), the net isosteric heat of sorption (qst) was determined. The deduced slope qstR and the constant of ΔSR displayed a linear relationship.",e960c5d0-9bb7-4ef5-85b4-c7a74ac65c3f
12,methods13," Indeed, referring to Equation (10) below, Gibbs specific energy can be calculated:  (10) ΔGβ=-RTLn(aw)  Between qst and ΔS, the theory of enthalpy–entropy compensation proposes a linear relationship given by Equation (11) (52):  (11) qst=TβS+ΔGβ  where Tβ: Isokinetic temperature is the temperature at which all sorption reactions proceed at the same rate, ΔGβ : Gibbs energy which helps to determine whether the adsorption process is spontaneous or not. The system is spontaneous if ΔGβ is negative (–ΔGβ) and conversely if ΔGβ is positive (+ΔGβ).  The validation of the compensation theory is tested by comparing the isokinetic temperature to the harmonic mean temperature (Thm). The Thm was determined as follows:  (12) Thm=n∑1n(1T)  The enthalpy–entropy compensation theory can be applied only if Tβ ≠ Thm.",89581d86-2618-483f-813d-4652aa23dd44
13,methods14,"  Results and discussion  Moisture adsorption isotherms  Figure 2 illustrates the effect of temperature on the equilibrium moisture content (equilibrium moisture content (EMC)) of control and irradiated dried figs. At each water activity, the equilibrium moisture content (EMC) plotted in the Figure 2 represents the average of triplicate measurements. Since it was difficult to read the moisture equilibrium content kinetic as a function of aw (because of some overlapping points), we thought that it would be important to support that with numerical data. Thus, Table 3 reports the experimental data for the equilibrium moisture contents of control and gamma-irradiated dried figs. With the reference to the data reported in Table 3, we notice that at constant water activity, moisture adsorption at the different temperatures applied displayed significant decreases in equilibrium moisture levels Xeq (% d.b) for all dried fig samples as the temperature rises.",07a2566b-fe93-48da-9650-cb33a5dfc3ef
14,methods15," This trend becomes more important as water activity decreases. For instance, at a constant aw, the equilibrium moisture content for 1 kGy irradiated sample on a K2CO3 supersaturated saline solution were, respectively, 36.60, 21.71, and 17.89 g water/g d.b at 30, 40, and 50°C. Likewise, equilibrium moisture content (EMC) levels for 1.5 kGy irradiated samples on BaCl2.2H2O solution were, respectively, 57.41, 50.20, and 47.28 for the following aw values 0.898, 0.891, and 0.882 (Table 4). However, it is noteworthy that, at 30°C it was observed a sharp increase in equilibrium moisture content (EMC) within the range of aw between 0.32 and 0.43, which is equivalent to 3 times the equilibrium moisture content (EMC) increase that occurred under 40 and 50°C. This irregular increase trend was for both control and irradiated samples but was not observed under other temperatures.",c952c45b-066f-42c7-844d-26025342db32
15,methods16," This could be linked probably to the higher active state of water molecules at high temperature levels, thus the attractive forces between them decreased. Thus, the equilibrium moisture content (EMC) increased with decreasing temperature at constant relative humidity. The same pattern was observed in the study by Hssaini et al. (38) over fig samples (c.v “Nabout” and “Sarilop”). Regarding the overall equilibrium moisture content (EMC) trend following variant aw and temperature, Hidar et al. (49) reported that it means that the material becomes less hygroscopic as the attraction strength between water molecules is reduced. Farahnaky et al. (2) reported with reference to Chowdhury et al. (44) and Jamali et al. (45) that as the temperature increases, water molecules become less stable and dissociate from the water binding sites of the food material, thus reducing the moisture content of the monolayer.",57cad997-60e1-4a06-b48e-8979a674c4e3
16,methods21,"83	  According to Brunauer's classification (53) and the International Union of Pure and Applied Chemistry (International Union of Pure and Applied Chemistry (IUPAC)) classification, data in this study obtained for both controlled and irradiated dried figs adsorption isotherms are classified as type II, which is most likely close to the sigmoidal shape. In this sense, Figure 3 illustrates the equilibrium moisture content of 1 kGy treated samples under all investigated temperatures and perfectly shows the s-shaped curve. More interesting, data in this study reported displayed a remarkable influence of gamma irradiation on the equilibrium moisture contents and the adsorption isotherms of samples within the entire range of water activity and temperature. In this sense, a boxplot graph of data under each tested temperature has been plotted and illustrated in Figure 4.",753f71da-a0d0-41ae-af85-26d5702a974a
17,methods22," Thus, gamma irradiation impacted very significantly the equilibrium moisture contents values and the adsorption isotherms, of which the equilibrium moisture content decreased proportionally as the irradiation dose increased. Indeed, irradiated samples had a smaller water adsorption capacity compared to control dried figs due to the possible influence of the gamma rays. This behavior can be explained by the fact that gamma rays probably interact with atoms and/or molecules in the cell considering the penetrating depth and radiolysis capabilities (27, 54, 55). In addition, it is possible that this interaction is a threshold event as a function of the gamma irradiation dose. As irradiation dose increases, water molecules and other structural macromolecules are affected. The less stable products break away from the water-binding sites of the food material, reducing the moisture content of the monolayer or even multilayer and interstitial (27).",37ea6147-f2da-41dd-89db-9164345be024
18,methods23,"  Figure 3 Equilibrium moisture content of 1 kGy treated samples under all investigated temperatures with the perfect s-shaped curve of adsorption isotherm.  Figure 4 Boxplots showing the decreasing pattern of equilibrium moisture content (% d.b) with the increase of irradiation dose under each investigated temperature.  However, because this is the first time that this very particular aspect has been highlighted and that unfortunately there is no report to our knowledge on irradiated dried figs isotherms or other similar biological commodities, the behavior and response to gamma irradiation of biological matrices different from dried figs were analyzed due the fact that the behavior and the response of these matrices could be likely to present similar behaviors vis-à-vis gamma irradiation. Thus, our results are slightly different from the study by Mghazli et al. (27), which reported that control and irradiated samples had the same hygroscopic behavior.",8971bc07-1687-4230-9e67-4efe2325e9c7
19,methods24," Also, in that investigation, in water activity ranging between 0.2 and 0.7, the equilibrium moisture content of control samples was higher than the irradiated samples. Moussaoui et al. (7) and Lahnine al. (28) have observed the same findings. However, these results can be explained by the low 60Co γ irradiation dose (< 1 kGy) applied, which may have no significant impact on the stability of the product.  Adsorption isotherms modeling  The results of fitting the experimental data into Peleg, Enderby, and Guggenheim–Anderson–De Boer (GAB) sorption equations are shown in Table 4. The values of the correlation coefficient (R2) and the standard error (SE) of estimated moisture are compared for each model to provide the best-fit model. From Table 4, tested models have generally expressed an average value of R2 of 0.98 coupled with an average SE of 3.96 for all samples.",94212051-2c4d-4191-aab7-ad475e6407bd
20,methods25," According to SE, the values showed that the models used were in agreement with the experimental data with the exception of Enderby, which showed errors >5, with regard to equilibrium points of the control. After analyzing the statistical parameters in Table 4, the fit using Guggenheim–Anderson–De Boer (GAB) model was the most suitable for describing the adsorption isotherms of the control. On the one hand, the model has combined the highest R2 (0.99) and the lowest SE (2.98) within the temperature range investigated in this study. On the other hand, the model Peleg displayed the best fit for irradiated dried figs at the first two irradiation doses 1 and 1.5 kGy. Obviously, this model displayed the highest R2 (0.99), which was similar for both doses coupled with the lowest SE levels (3.2 and 3.34, respectively). The fit using the Enderby model was most appropriate to describe the adsorption isotherms for dried figs irradiated at the 2 kGy doses.",b5d8f532-fac1-4cb7-b3a6-a89bd899818c
21,methods26," The performance of the model selected for control and gamma-irradiated dried figs at different temperatures is illustrated in Figure 2.  These results join other previous studies which reported that from the criteria indices R2 and SE, the aforementioned models could be useful for the ERH prediction of dried figs with the highest fit resolution (56). However, these results are slightly opposite to those reported by Hssaini et al. (38) who found that Enderby and Peleg showed the best prediction of adsorption isotherms for two varieties of figs “Kadota” and “Sarilop.” In addition, the gamma irradiation used in this study displayed a remarkable effect on the fig adsorption isotherms modeling within the entire range of temperature investigated in this study.",df3dd9f8-bb23-4ff9-ab15-243c84d680c6
22,methods27," Thus, considering the fitting statistics parameters, it appears that at 50°C, R2 increases and the SE decreases with increasing irradiation dose, particularly in the case of the Guggenheim–Anderson–De Boer (GAB) model experimental data. From the fact that the combination of higher R2 and lower SE determines the goodness of data modeling, the quality of the fit of the three models was slightly greater than those of the control at 40 and 50°C considering increasing doses of irradiation. Nevertheless, despite the multitude of mathematical models used to describe the adsorption isotherms of several foods, none of them can accurately predict moisture isotherms over the entire range of water activity and for all food matrices (44, 57).",7714d5c5-8be5-4557-b486-b63cff5c2a9d
23,methods28,"  Water-specific surface area of adsorption (S0)  Adsorption is the phenomenon of the attraction and retention of molecules from a liquid or gas “adsorbate” by a solid “adsorbent” at its surface, which leads to a higher concentration of molecules at the surface. Several factors will therefore influence this phenomenon, among others: particle size, mass of adsorbent, pH, and temperature of the solution. The particle size of the adsorbent is a parameter closely related to the specific adsorption surface area; small particles have a large specific adsorption surface area and therefore work much better than large particles. In addition, if the adsorption is favored by the low temperatures of the solution, it is exothermic, otherwise, it is endothermic (58). Table 5 reports the values of the water-specific surface area of adsorption calculated using Equation (6), and the monolayer moisture contents obtained by Guggenheim–Anderson–De Boer (GAB) model.",31346e1d-4f6d-4b6b-b09e-f07c6437d4e4
24,methods29," According to the literature, the value of the water sorption–specific surface area of a food product is ranged between 100 and 250 m2.g−1 and is associated with the amount of polymers present in the food (4, 59). Considering those mentioned above, and after analyzing the statistical data in Table 5, we can conclude that the temperature significantly affects the interaction between the water and solid surface area. Indeed, most likely, the increase in temperature is able to change the structure of proteins and improve the interaction of proteins with other components, such as carbohydrates and fats; therefore, the available water adsorption sites have decreased due to the hydrophobicity of the proteins (60). Furthermore, based on the results, gamma irradiation has impacted very significantly the water-specific surface area between the control and treated samples. Thus, as the gamma irradiation dose increases, the effect tends to be more pronounced.",b80e5701-c5da-4672-ba30-721227230be5
25,methods30," Indeed, at a constant temperature, the S0 has significantly decreased as the gamma irradiation dose increased, until it reaches approximately half the water-specific surface area of control samples. This trend becomes more important as the temperature increases. In fact, both temperature and gamma rays effectively contribute to dimmish the S0 of dried figs in comparison to untreated samples.  Table 5 Water specific surface area (S0) of control and gamma irradiated (1, 1.5, and 2 kGy) dried figs at 30, 40, and 50°C.  T (°C)	Control	1 kGy	1.5 kGy	2 kGy	 30	271.32	235.55	200.3715	143.465	 40	266.07	230.65	185.4475	138.88	 50	265.79	231.7	177.135	112.42	  These findings join the other previous studies reported by Lahnine et al. (28) and Moussaoui et al. (29), who stressed the same patterns as described above. Likewise, according to Calzetta Resio et al.",b8cb3507-9e09-418a-af75-3bbe660be492
