,chunk_label,chunk_text,uuid
26,methods31," (61), the existence of an intrinsic microporous structure in the matrix of many biopolymers is probably behind the large adsorption surface. As reported in Table 5, as the temperature increases the value of S0 decreases. Considering this hypothesis mentioned by Calzetta Resio et al. (61), it can be assumed that gamma irradiation probably decreases intrinsic microporous structures depending on the intensity of the dose. Indeed, at higher temperatures, water molecules easily dissociate from water-binding sites. Moreover, the distance, attraction, and states of molecules also vary as the temperature changes (60). These behaviors could be more pronounced as the intensity of the irradiation dose increases assuming that physicochemical changes can occur strongly in the product, which very strongly reduces the number of active sites for the binding of the water. There is, however, great complexity in the response that a matrix can generate to gamma radiation.",7f902863-3113-4977-bf36-2fc5b281943a
27,methods32," This can affect both the specific surface area and the cells to varying degrees depending on the dose of irradiation applied (62).  [aw (op)] for storage conditions  Table 6 reports adsorption curves experimental data of control and gamma-irradiated dried figs according to a polynomial model of 3rd degree. The optimal water activity found in this study concords very slightly with the studies conducted by Moussaoui et al. (7), Mghazli et al. (27), and Lahnine et al. (28). Thus, the control sample presents the higher optimal water activity values (0.4243) compared to irradiated samples. Indeed, the irradiation dose significantly influenced the optimal values of water activity between the applied doses, particularly between 1 and 1.5 kGy treated figs, where the deduced values were 0.2865 and 0.2636, respectively. These doses were half those found in the control (0.4243). It is noteworthy that a very slight difference was spotted between 1.",3f9b7ffa-b9ad-46da-86f2-85030ad5bac5
28,methods33,"5 and 2 kGy irradiated, which aw have barely changed (0.2636 and 0.2634, respectively). The findings are slightly different from the investigation conducted by Mghazli et al. (27) who reported opposite results. Thus, the control samples presented less water activity (0.39) than the irradiated samples (0.40). This behavior could be associated with the low gamma irradiation dose (< 1 kGy) applied, which may have not expressed any significant impact on the stability of the product.  Table 6 Analysis of the curves of adsorption according to a polynomial model of 3rd degree.  Samples	[aw (op)]	 Control	0.42	 1 kGy	0.29	 1.5 kGy	0.26	 2 kGy	0.26	  Among the main components of food matrices, besides water, carbohydrates, proteins, fats, vitamins, and minerals, also play a crucial role in human nutrition with essential major interest (63).",49c0d71c-a970-441a-9581-6dc7e362780b
29,methods34," For many years, the effects of irradiation on these components have been studied and are still explored today in a wide range of food products because the ionizing effects of radiation on food are highly dependent on the composition of the matrix and cannot be assumed similar to those observed in each individual component irradiated separately (64). This technology induces certain primary effects in food matrices that occur in particular due to the presence of water molecules by ionization and/or excitation, which increases exponentially by the secondary action of free radicals which can result from stress on the matrix (65). These chemically highly reactive species have the ability to interact with each other and/or with other food components, leading to the formation of new molecules which are not present in unirradiated foods (66).",3fe644a4-4bcc-4aa3-b8f6-677f89676615
30,methods35,"  In addition, among the various parameters which modify the radical species yield, probably the dose rate, the nature and energy of the irradiation, more generally the irradiation dose could hold a major role. Thus, these chemically highly reactive species are thus likely to add their effects to those of irradiation on cells and to modify probably the metabolism and the water retention capacity and potentially water activity on the matrix. As described by Farkas (67), food preservation is generally based on the removal of moisture which inhibits the development of pathogenic microorganisms and also minimizes fruit spoilage reactions triggered by moisture, among other enzymatic and Maillard browning reactions. However, the moisture content alone is not sufficient to predict the stability of foods, as it is not the total moisture content, but rather the water activity that determines the shelf life of food (47).",ede32584-15a4-4669-b27c-e3ad5f5c621f
31,methods36," Knowing as mentioned above that the aw requirements of the various microorganisms vary considerably, our results in this study reported showed a significant effect of gamma irradiation on the decrease in the activity of water as a function of the dose absorbed, from 0.4 (untreated dried figs) to 0.2 (irradiated dried figs). This may suggest the preservative effect of the gamma irradiation technology in extending the shelf life of dried figs in relation to the water activity, since at aw between 0.4 and 0.2, the product is also the most stable with regard to lipid oxidation, non-enzymatic browning, and enzymatic activity (41).  Net isosteric heat of adsorption (qst)  To fix water molecules to the food product, net isosteric heat (qst) represents the energy required at system temperature (68).",364fa2cf-03fd-4949-826b-e7ae81d0178c
32,methods37," Figure 5 illustrates the net isosteric heat of adsorption for control and gamma-irradiated dried figs and shows strong relationships between equilibrium moisture content (Xeq) and net isosteric heat of adsorption (qst). Indeed, with increasing equilibrium moisture content, the strength of water molecules binding with the solid material decreases; therefore, as the moisture content increases, the net isosteric heat of adsorption decreases (69). As shown in Figure 5, at the lowest values of the Xeq, the qst takes the highest values. Additionally, as the Xeq increases, the qst decreases for all samples, illustrating the strong bond of water with the matrix. This result is similar to that reported by Lahnine et al. (28). Once again, the gamma irradiation effect over dried fig net isosteric heat of adsorption displayed significant differences in qst patterns following the increasing irradiation doses.",b9f919bc-bb96-400c-89af-a96879e8988a
33,methods38," Thus, at a constant temperature, as the gamma irradiation dose increase, the energy required for moisture adsorption increases, and therefore, the samples become more humidified. Nevertheless, the energy required for control samples is lower than for irradiated dried figs. This result is in agreement with the hypothesis of Moraes et al. (70), according to which the energy connecting water molecules to primary sorption sites becomes greater than the energy connecting water molecules when humidity is low. This behavior suggests that irradiated samples will have probably a great storage ability compared to control samples. Indeed, 2 kGy treated samples needed almost twice the energy needed by the control sample to absorb moisture.  Figure 5 Relationships between equilibrium moisture content (Xeq) and net isosteric heat of adsorption (qst).  Among the molecules of a plant matrix, those of water interact greatly with gamma rays due to the ubiquity of water in the plant cell (65, 71).",b4192b91-0f5a-4959-b572-b2d1fb4c1252
34,methods39," Ionization, dissociation, and excitation are the main effects of gamma radiation. Low interaction can result from excitation, while ionization and dissociation are likely to result in strong interaction. This results in the production of radical species described as the primary effect of radiation (63). Due to the high reactivity of these chemicals' species, side effects will occur probably to potentially modify the structure and the stability of the matrix at different levels depending on the irradiation dose (64, 71). These radical species can damage or modify important components of the matrix, such as chloroplasts, and also modify biochemistry in carbohydrate transport mechanism (72), starch–sugar interconversion (73), dilation of thylakoid membranes and altered photosynthesis in cell structure (65), and texture change of some foods where polysaccharides such as pectin can be broken down leading to the release of calcium, causing the product softness increase (64, 65).",71f2d37a-c7dd-4f06-b467-6c83b55da18c
35,methods40," Owing to these effects, alongside others, it is probably possible that the natural resistance of certain cells and irradiated membrane tissues increases, necessitating greater fixing energy for the water to the food matrix.  Differential entropy of adsorption (ΔS)  Figure 6 illustrates the relationships between equilibrium moisture content (Xeq) and differential entropy (ΔS) of control and gamma-irradiated dried figs at doses 1, 1.5, and 2 kGy. According to Madamba et al. (74), at a given energy level, the differential entropy of a material is proportional to the number of sorption sites available. From Figure 6, as the humidity increases, the differential entropy decreases for all samples. This behavior of the differential entropy shows once again, a strong dependence on humidity and on the dose of gamma irradiation applied. Thus, the differential entropy of 2 kGy treated samples is twice that of control samples.",e769b096-9aef-49a4-ab00-24ab1a2dff20
36,methods41," Obviously, further analysis is required to deepen our understanding of changes occurring at the molecular scale according to irradiation with regard to dried products' differential entropy of adsorption.  Figure 6 Relationships between equilibrium moisture content (Xeq) and differential entropy of adsorption (ΔS).  Gibbs energy (ΔGβ)  Within a confidence interval of 0.95, the Gibbs energy (ΔGβ) was determined from Equation (10) by linear regression. According to Alpizar-Reyes et al. (75), positive values of Gibbs energy (+ΔGβ) are an indicative criterion that sorption is non-spontaneous, while negative values (–ΔGβ) provide information on the spontaneity of sorption. Thus, the values of ΔGβ present in Table 7 suggest that the sorption process was non-spontaneity for all the samples. In addition, by analyzing the Gibbs energy data (ΔGβ) reported in Table 7, a significant effect of gamma irradiation remarkably appears.",8a15ce2f-ddc4-45d0-a2a2-fe0b73309c65
37,methods42," Indeed, the control samples presented lower free energy (ΔGβ) compared to the irradiated samples. In addition, as the irradiation dose increases, the free energy decreases. Whereas, high Gibbs free energy values indicate high availability of water adsorption and high hydrophilic properties, the study of thermodynamic properties for agro-products such as the free energy (ΔGβ) is of major importance since it generally generates new data on the association and energy between water molecules in the system (76).  Table 7 Gibbs energy (ΔGβ) for control and gamma irradiated (1, 1.5, and 2 kGy) dried figs.  Samples	ΔGβ (J.mol−1)	Tβ (K)	 Control	137.1	326.41	 1 kGy	498.4	310.59	 1.5 kGy	277	300.45	 2 kGy	259.4	297.12	  Enthalpy–entropy compensation theory  A simple thermodynamic argument suggests that the enthalpy–entropy compensation is a general property of weak intermolecular interactions and that the two free energy contributions should almost equilibrate for hydrogen bonding at 300 K.",0bee273f-1f86-4829-adbd-97bf330b0089
38,methods43," This statement from Dunitz (77) also drive him to ask how can we estimate the contributions of entropy and enthalpy to the free energy of association at varying binding forces. Thus, according to Liu and Guo (78), if there is a linear correlation between the logarithm of pre-exponential factors and activation energies, between enthalpies and activation entropies, or between changes in enthalpy and entropy of a series of similar reactions, the compensation effect is true. However, this definition is proposed based on the assumption that the data used in the correlation is error-free. Nevertheless, in real experiments, measurement errors are inevitable and the data used in the correlation are the estimators of the corresponding parameters. Therefore, it is possible that although the true values of the parameters do not correlate, their estimators do, and this is the cause of false compensation.  Figure 7 illustrates the graphs of net isosteric heat of sorption (qst) vs.",363af3e1-56cf-48c0-a4d8-3e1d2909db9e
39,methods44," differential entropy (ΔS) for each sample category, control and irradiated. A high degree of linearity between (qst) and (ΔS) is observed, which assumes that the theory of compensation exists (38, 74). By examining the illustrations in Figure 7, the realization of the compensation theory implies that a single reaction mechanism is followed by all members of the series of reactions; therefore, the existence of a single mechanism suggests that the microstructure of food is stable and does not undergo any change during moisture sorption (69, 79, 80). This observation joins that of Beristain et al. (81), concluding that the linear plot of compensation between qst and ΔS correlates well with water adsorption in starchy and sugar-rich foods, such as dried figs. In addition, with our results, it can be assumed that the gamma irradiation treatment did not modify this compensation.",e2598dcc-68ee-4508-a1f2-8758181e0930
40,methods45," With regard to the compensation enthalpy–entropy theory, the isokinetic temperature (Tβ) and the harmonic temperature (Thm) are significantly, at a certain distance, different from one another. The calculated harmonic temperature (Thm) was 312.94 K, while the observed isokinetic temperature values were 310.59 K, 300.45 K, and 297.12 K for 1, 1.5, and 2 kGy, respectively. This difference supports the enthalpy–entropy compensation theory. Therefore, data, presented in this study, showed that (Thm) is higher than (Tβ), suggesting that the adsorption process of dried fig samples is entropy-driven (35, 38, 82, 83).  Figure 7 Enthalpy–entropy compensation theory for the water adsorption processes.  Conclusion  Stability of dried foods, as easily accessible snacks, continues to be a major concern for the agri-food industry.",33f08a9a-d9d5-4383-a899-edd6cfe437ab
41,methods46," Therefore, studying the effect of gamma irradiation, as being a non-heating and non-toxic processing technology, and environmentally friendly, on dried food adsorption isotherms can be very useful to particularly assess it could probably modify the metabolism and the water retention capacity and potentially water activity of the matrix. In this study, the thermodynamic properties derived from dried figs' moisture adsorption isotherms provided relevant information about the influence of irradiation at increasing doses on samples' hygroscopic properties under different storage conditions. The magnitude of 60Co γ-rays effect becomes more important as the irradiation dose increases. At the end of this study, gamma irradiation optimized the maximum temperature thresholds and the final water contents used for storage to ensure the stability of the dried figs during storage.",d8064b3f-2b76-4e80-ac7c-fae00661dda2
42,methods47," As the application of gamma irradiation in the food industry is generally framed on each side by minimum value allowing the desired objective to be achieved, and a maximum value depending on the cost of treatment, and on the other hand, the product's tolerance to radiation, this study, which remains the first, suggests the use of gamma rays at a dose up to 2 kGy as a promising approach to extend the shelf life of dried figs in terms of food stability linked to water activity.  Data availability statement  The original contributions presented in the study are included in the article/supplementary material, further inquiries can be directed to the corresponding author/s. ",87e8ea05-d178-42f9-b2ab-0616eea8cc4a
