,chunk_label,chunk_text,uuid
0,methods0,"Experimental animals All mice used in this study were of the FVB/NJ background. Animal procedures were conducted in accordance with the Guide for the Care and Use of Laboratory Animals (Directive 2010/63/EU of the European Parliament), with the experimental protocols approved by the Institutional Animal Care and Use Committee of Shanghai, China [SYXK(SH)2011-0112]. Generation of ultra violet radiation resistance associated gene (UVRAG)-deficient mice was described previously2324.  Acute DOX-induced cardiotoxicity was induced in 2-month-old WT and ultra violet radiation resistance associated gene (UVRAG)-deficient mice by a single intraperitoneal injection of DOX (20 mg/kg, BBI, Toronto, Canada) dissolved in saline. Chronic DOX-induced cardiotoxicity was induced in eight-week-old WT and ultra violet radiation resistance associated gene (UVRAG)-deficient mice by intraperitoneally injected 6 doses of DOX (4 mg/kg, dissolved in saline) at weekly intervals.",2c382235-be15-4a66-a09a-175191b88ed9
1,methods1," Mice were observed for another 2 weeks before assessment of cardiac function.  In both acute and chronic DOX cardiotoxicity, mice were anaesthetized by isoflurane inhalation and euthanized by rapid cervical dislocation at the indicated time points and left ventricles were dissected from the excised hearts for western blot and Reactive oxygen species (ROS) analysis. For histological and immunohistochemical staining, mice were anaesthetized by isoflurane inhalation and the entire hearts were used to prepare paraffin-embedded serial sections in four-chamber view. Generally time-course analysis of vacuolar degeneration and fibrosis in LVs were performed in acute and chronic DOX cardiotoxicity. Reactive oxygen species (ROS) and apoptosis were assessed 5 days after DOX treatment in acute DOX-induced cardiotoxicity and at 4 weeks of DOX treatment in chronic DOX-induced cardiotoxicity.",bbbf1431-d7f2-4162-a228-15ea866711d5
2,methods2,"  In the fasting experiments, mice were subjected to intermittent (alternate-day) fasting, starting from one day before the initial DOX treatment. Fasted mice had free access to water. LVs or the perfusion-fixed hearts from the fasted group were dissected during the day of feeding after fasting treatment as indicated. In this study, we dissect left ventricle to make consistent tissue sampling to exclude the possible impacts of different hemodynamics between left ventricle and right ventricle on the experimental results.",8cb0d76c-436b-4555-8dae-41e6076fb41b
3,methods3,"  Antibodies Mouse anti-LC3 monoclonal antibody (M152-3), Rabbit anti-LC3 polyclonal antibody (PM036) and rabbit anti-Beclin 1 polyclonal antibody (PD017) were from MBL International Corporation (Nagoya, Japan), rabbit anti-p62 polyclonal antibody (#5114), rabbit anti-Atg5 monoclonal antibody (#12994) and rabbit anti-ultra violet radiation resistance associated gene (UVRAG) monoclonal antibody (#13115) were purchased from Cell Signaling Technology (Danvers, MA, USA), mouse anti-tubulin monoclonal antibody (628802) was obtained from Gene Tex, Inc (Irvine, CA, USA), rat anti-LAMP-1 monoclonal antibody (sc19992), rat anti-LAMP-2 monoclonal antibody (sc19991), mouse anti-ubiquitin monoclonal antibody (sc8017), rabbit anti-X linked inhibitor of apoptosis protein (XIAP) polyclonal antibody (sc5550) and rabbit anti-GAPDH polyclonal antibody (sc25778) were from Santa Cruz Biotechnology (Dallas, TX, USA),",82246f2b-2a79-4816-b60f-cefc1f80c03f
4,methods4," rabbit anti-α-smooth muscle actin (α-SMA) polyclonal antibody was obtained from Abcam Limited (Cambs, UK), and mouse anti-β-actin monoclonal antibody (AM1021B) was purchased from ABGENT (Suzhou, China).  Histology and immunohistochemistry Following anesthesia, mouse hearts were perfused with ice cold PBS followed by fixation by 4% paraformaldehyde in PBS. Fixed hearts were embedded in paraffin and cut into serial sections in four-chamber view at 5 μm in a Leica RM2255 rotary microtome (Leica Microsystems, Wetzlar, Germany). Heart sections were stained with H&E or picrosirius red for evaluation of routine morphology and collagen accumulation. Immunohistochemistry was performed on the paraffin sections using the VECTASTAIN® Elite ABC Kit (Vector Laboratories, Burlingame, CA, USA) as previously described23. TUNEL assay was performed on the paraffin sections using an ApopTag® Plus Peroxidase In Situ Apoptosis Detection Kit (Millipore, MA, USA) according to the manufacturer’s instructions.",a7cd70fd-a4a9-463a-b826-59c38641032e
5,methods5," For quantification of vacuolar degeneration of cardiomyocytes, fibrosis and α-SMA expression, around 20 microscopic fields randomly selected in LVs per section, 3 sections from each of 3–5 mice were assessed. For quantification of apoptotic cells in the heart, 20–25 microscopic fields randomly selected per section, 3 sections from each of 3 mice were evaluated by TUNEL assay.  Measurement of lactate dehydrogenase (LDH) and CK-MB Serum lactate dehydrogenase (LDH) activity was assayed by means of reflectance spectroscopy using lactate dehydrogenase (LDH) detection kit (Nanjing Jiancheng Bioengineering Institute, Nanjing, China). Serum CK-MB activity was determined using mouse CK-MB ELISA kit (Nanjing Jiancheng Bioengineering Institute, Nanjing, China). Determination of lactate dehydrogenase (LDH) and CK-MB were performed according to the manufacturer’s instructions.  Autophagic flux assessment In vivo autophagic flux assessment was evaluated as described previously23.",e7da01b7-36de-453e-97c6-c1dffc2f7103
6,methods6," In brief, mice were intraperitoneally injected with vehicle (ddH2O) or chloroquine (CQ, 50 mg/kg, Sigma-Aldrich, St. Louis, MO, USA) and LVs from excised hearts were harvested for analysis of LC3 II and p62 protein levels by western blot. Immunohistochemical staining for LC3 II was performed on paraffin-embedded heart sections.  Reactive oxygen species (ROS) measurement Analysis of Reactive oxygen species (ROS) was performed as described previously52. Briefly, 10 mg of fresh left ventricular tissue was homogenized in 1 ml of ice cold 40 mM Tris–HCl buffer (pH 7.4) and the homogenate was diluted to 0.25% with the same buffer. Samples were then loaded with 40 μL 1.25 mM 2′,7′-dichlorofluorescin-diacetate (DCFH-DA, Sigma-Aldrich, St. Louis, MO, USA) at 37 °C for 30 min. The fluorescence intensity was measured by a fluorescent microplate reader with excitation wave length at 488 nm and emission wave length at 535 nm.",d374f2a4-1c7c-4cb7-aef8-a55147f8ed5a
7,methods7," Results were expressed as relative fluorescence unit (relative fluorescence unit (RFU)) per mg protein.  Assessment of inflammatory cytokines TNFα, IL-6 and IL-1β were assessed in heart homogenates using ELISA kits (Nanjing Jiancheng Bioengineering Institute, Nanjing, China) according to the manufacturer’s instructions.  Western blot Proteins extracted from left ventricular tissues were separated by SDS-PAGE gel and transferred to nitrocellulose membrane. The membranes were then blocked for 1 hour at room temperature with 5% skim milk powder in Tris-buffered saline with Tween 20 (Tris buffered saline with Tween 20 (TBST)) buffer and incubated with primary antibodies overnight at 4 °C. After washing with Tris buffered saline with Tween 20 (TBST) buffer, the membranes were incubated with secondary antibodies conjugated to horseradish peroxidase for 1 hour at room temperature and again washed with Tris buffered saline with Tween 20 (TBST) buffer.",ad5a3dd2-eab3-4c2b-80f2-73ad5ddce8c0
8,methods8," The protein bands were detected by using ImmobilonTM Western Chemiluminescent HRP Substrate (Millipore, MA, USA). All western blot quantifications were performed using the Image J software.  Echocardiography Echocardiography was performed as described previously53. Briefly, mouse chests were shaved one day before the measurement. Mice were placed on a heating plate for anesthesia by inhaled isoflurane. Echocardiographic imaging was conducted using a Vevo 770 platform (VisualSonics Inc., Toronto, ON, CAN) equipped with a 45 MHz imaging transducer. Measurements were carried out at least in triplicate.  Statistics All data were expressed as mean ± S.E.M. Statistical differences were analyzed by one-way ANOVA followed by Bonferroni’s test for multiple comparisons using GraphPadPrism software. Values of P < 0.05 were considered statistically significant.  Additional Information How to cite this article: An, L. et al.",c4c28459-388f-4a1c-83cf-50621f794766
9,methods9," ultra violet radiation resistance associated gene (UVRAG) Deficiency Exacerbates Doxorubicin-Induced Cardiotoxicity. Sci. Rep. 7, 43251; doi: 10.1038/srep43251 (2017).  Publisher's note: Springer Nature remains neutral with regard to jurisdictional claims in published maps and institutional affiliations.  Supplementary Material Supplementary Information  This work was supported by Natural Science Foundation of Shanghai (16ZR1418200) and the National Nature Science Foundation of China (81421061). We acknowledge Institute of Developmental Biology and Molecular Medicine of Fudan University for providing ultra violet radiation resistance associated gene (UVRAG)-deficient mice.  The authors declare no competing financial interests.  Author Contributions L.A., L.H., and H.Z. conception and design of research; L.A., X.H., S.Z., X.H., Z.S., A.N., Z.Z., and J.W. performed experiments; L.A., J.W., and H.Z. analyzed data; L.A., and H.Z. interpreted results of experiments; L.A., C.L., Y.Z., L.H.",bfa9661f-b80b-4a2d-aae8-da66f619583c
10,methods10,", and H.Z. wrote the manuscript; All authors approved final version of manuscript.  Figure 1 ultra violet radiation resistance associated gene (UVRAG) deficiency exacerbates acute DOX-induced cardiotoxicity. (a) Survival curves of WT and ultra violet radiation resistance associated gene (UVRAG)-deficient mice after acute DOX treatment were created by Kaplan-Meier method (*P < 0.05 using the Log-rank test). n = 7 mice for saline+/+, n = 8 mice for saline−/−, n = 10 mice for DOX+/+, n = 10 mice for DOX−/−. (b) Representative H&E images of degenerative vacuoles in LVs on heart sections from WT and ultra violet radiation resistance associated gene (UVRAG)-deficient mice 3 or 5 days after acute DOX or vehicle treatment. Scale bar: 40 μm. (c) Quantification of degenerative vacuoles in LVs in the experiments as illustrated in (b). n = 3 mice for each group.",04e4a910-44f4-462c-94c4-7bb9db26575c
11,methods11," (d) Representative images of fibrosis stained with picrosirius red in LVs on heart sections from WT and ultra violet radiation resistance associated gene (UVRAG)-deficient mice 3 or 5 days after acute DOX or vehicle treatment. Scale bar: 40 μm. (e) Quantification of fibrosis in LVs in the experiments as illustrated in (d). n = 3 mice for each group. (f) Serum lactate dehydrogenase (LDH) activity in WT and ultra violet radiation resistance associated gene (UVRAG)-deficient mice 3 days after acute DOX or vehicle treatment. n = 4 mice for each group. (g) Serum CK-MB activity in WT and ultra violet radiation resistance associated gene (UVRAG)-deficient mice 3 days after acute DOX or vehicle treatment. n = 4 mice for each group. *P < 0.05 vs. WT + vehicle, #P < 0.05 vs. WT + DOX.  Figure 2 ultra violet radiation resistance associated gene (UVRAG) deficiency exacerbates chronic DOX-induced cardiotoxicity.",d453744e-fdf0-47e0-9ba3-918ed782da8c
12,methods12," (a) Survival curves of WT and ultra violet radiation resistance associated gene (UVRAG)-deficient mice after chronic DOX treatment were created by Kaplan-Meier method (*P < 0.05 using the Log-rank test). n = 6 mice for saline + / + , n = 6 mice for saline−/−, n = 12 mice for DOX + / + , n = 13 mice for DOX−/−. (b) Representative H&E images of degenerative vacuoles in LVs on heart sections from WT and ultra violet radiation resistance associated gene (UVRAG)-deficient mice after chronic DOX or vehicle treatment over the indicated time. Scale bar: 40 μm. (c) Quantification of degenerative vacuoles in LVs in the experiments as illustrated in (b). n = 3–5 mice for each group. (d) Representative images of fibrosis stained with picrosirius red in LVs on heart sections from WT and ultra violet radiation resistance associated gene (UVRAG)-deficient mice after chronic DOX or vehicle treatment over the indicated time. Scale bar: 40 μm.",be0517a6-bd31-4dbe-aaf5-597be23bb05b
13,methods13," (e) Quantification of fibrosis in LVs in the experiments as illustrated in (d). n = 3–5 mice for each group. (f) Serum lactate dehydrogenase (LDH) activity in WT and ultra violet radiation resistance associated gene (UVRAG)-deficient mice 2 weeks after chronic DOX or vehicle treatment. n = 4 mice for each group. (g) Serum CK-MB activity in WT and ultra violet radiation resistance associated gene (UVRAG)-deficient mice 2 weeks after chronic DOX or vehicle treatment. n = 4 mice for each group. (h) Left ventricular EF of WT and ultra violet radiation resistance associated gene (UVRAG)-deficient mice after chronic DOX or vehicle treatment. n = 4–5 mice for each group. (i) Left ventricular FS of WT and ultra violet radiation resistance associated gene (UVRAG)-deficient mice after chronic DOX or vehicle treatment. n = 4–5 mice for each group. *P < 0.05 vs. WT + vehicle, #P < 0.05 vs. WT + DOX.",a0c6fa84-b6aa-43a9-8fe9-fbbf05c8f336
14,methods14,  Figure 3 ultra violet radiation resistance associated gene (UVRAG) deficiency increases Reactive oxygen species (ROS) production and apoptosis in DOX-induced cardiotoxicity. (a) Reactive oxygen species (ROS) levels in LVs detected using DCFH-DA 5 days after acute DOX or vehicle treatment. n = 3 mice for each group. (b) Reactive oxygen species (ROS) levels in LVs detected using DCFH-DA at 4 weeks of DOX or vehicle treatment in chronic DOX cardiotoxicity. n = 3 mice for each group. (c) Quantification of apoptotic cells 5 days after acute DOX or vehicle treatment. n = 3 mice for each group. (d) Quantification of apoptotic cells at 4 weeks of DOX or vehicle treatment. (e) Western blot analysis of X linked inhibitor of apoptosis protein (XIAP) in LVs from WT and ultra violet radiation resistance associated gene (UVRAG)-deficient mice 3 days after acute DOX or vehicle treatment. (f) Quantification of X linked inhibitor of apoptosis protein (XIAP) as illustrated in panel (e).,eef9e489-7999-4534-9652-627509aff553
15,methods15," (g) Western blot analysis of X linked inhibitor of apoptosis protein (XIAP) in LVs from WT and ultra violet radiation resistance associated gene (UVRAG)-deficient mice at 4 weeks of chronic DOX treatment or vehicle treatment. (h) Quantification of X linked inhibitor of apoptosis protein (XIAP) as illustrated in panel (g). n = 3 mice for each group. *P < 0.05 vs. WT + vehicle, #P < 0.05 vs. WT + DOX.  Figure 4 Autophagic flux is impaired in acute and chronic DOX-induced cardiotoxicity. (a) Western blot detection of LC3 II and p62 protein abundance in LVs from mice 5 days after acute DOX treatment and further elicited by CQ treatment. (b) Quantification of LC3-II protein abundance as illustrated in panel (a). n = 3 mice for each group. (c) Quantification of p62 protein abundance as illustrated in panel (a). n = 3 mice for each group. (d) Western blot detection of LC3 II and p62 protein abundance in LVs from mice treated with DOX over 4 weeks and further elicited by CQ treatment.",4bef2572-1f7f-4dcb-8e2a-1fe8ceb4e256
16,methods16, (e) Quantification of LC3-II as illustrated in panel (d). n = 3 mice for each group. (f) Quantification of p62 as illustrated in panel (d). n = 3 mice for each group. *P < 0.05 vs. vehicle. #P < 0.05 vs. CQ.  Figure 5 ultra violet radiation resistance associated gene (UVRAG) deficiency aggravates impaired autophagy in DOX-induced cardiotoxicity. (a) Western blot detection of LC3 II and p62 protein levels in LVs from WT and ultra violet radiation resistance associated gene (UVRAG)-deficient mice at the time points as indicated in acute DOX-treated mice. (b) Quantification of LC3 II protein abundance in the experiments as illustrated in (a). n = 3–5 mice for each group. (c) Quantification of p62 protein abundance in the experiments as illustrated in (a). n = 3–5 mice for each group.,55001956-d080-4616-9bc1-17db2cb819d0
17,methods17, (d) Western blot detection of LC3 II and p62 protein levels in LVs from WT and ultra violet radiation resistance associated gene (UVRAG)-deficient mice at 4 weeks of DOX or vehicle treatment in chronic DOX-treated mice. (e) Quantification of LC3 II protein abundance in the experiments as illustrated in (d). n = 3 mice for each group. (f) Quantification of p62 protein abundance in the experiments as illustrated in (d). n = 3 mice for each group. (g) Representative images of LC3 immunohistochemistry in LVs on heart sections from WT and ultra violet radiation resistance associated gene (UVRAG)-deficient mice after acute DOX or vehicle treatment over the indicated time. Scale bar: 40 μm. (h) Quantification of LC3-positive dots in LVs in the experiments as illustrated in (g). n = 3 mice for each group.,8d6c8fdb-e71d-470c-8f84-c7f4c7398142
18,methods18, (i) Representative images of LC3 immunohistochemistry in LVs on heart sections from WT and ultra violet radiation resistance associated gene (UVRAG)-deficient mice after chronic DOX or vehicle treatment over the indicated time. Scale bar: 40 μm. (j) Quantification of LC3-positive dots in LVs in the experiments as illustrated in (i). n = 3 mice for each group. (k) Western blot detection of ubiquitinated proteins in LVs from WT and ultra violet radiation resistance associated gene (UVRAG)-deficient mice at the time points as indicated in acute DOX-treated mice. (l) Quantification of protein ubiquitination in the experiments as illustrated in (k). n = 3 mice for each group. (m) Western blot detection of ubiquitinated proteins in LVs from WT and ultra violet radiation resistance associated gene (UVRAG)-deficient mice at the time points as indicated in chronic DOX-treated mice. (n) Quantification of protein ubiquitination in the experiments as illustrated in (m). n = 3 mice for each group.,a76672b5-d3cf-4ebb-921d-763e6b956d28
19,methods19, *P < 0.05 vs. WT + vehicle. #P < 0.05 vs. WT + DOX.  Figure 6 Intermittent fasting restores autophagy in DOX-induced cardiotoxicity. (a) Representative images of LC3 immunohistochemistry in LVs on heart sections from fed or fasted WT and ultra violet radiation resistance associated gene (UVRAG)-deficient mice 5 days after acute DOX or vehicle treatment. Scale bar: 40 μm. (b) Quantification of LC3-positive dots in LVs in the experiments as illustrated in (a). n = 3 mice for each group. (c) Representative images of LC3 immunohistochemistry in LVs on heart sections from fasted WT and ultra violet radiation resistance associated gene (UVRAG)-deficient mice at 4 weeks of DOX treatment in chronic cardiotoxicity. Scale bar: 40 μm. (d) Quantification of LC3-positive dots in LVs in the experiments as illustrated in (c). n = 3 mice for each group.,c2c807c6-0702-4efe-b2f4-319a3a235110
20,methods20," (e) Western blot detection of LC3 and p62 in LVs from fed or fasted WT and ultra violet radiation resistance associated gene (UVRAG)-deficient mice 5 days after acute DOX or vehicle treatment. (f) Quantification of LC3 II protein abundance in the experiments as illustrated in (e). n = 3 mice for each group. (g) Quantification of p62 protein abundance in the experiments as illustrated in (e). n = 3 mice for each group. (h) Western blot analysis of LC3 II and p62 in LVs from fed or fasted WT and ultra violet radiation resistance associated gene (UVRAG)-deficient mice at 4 weeks of DOX treatment in chronic cardiotoxicity. (i) Quantification of LC3 II protein abundance in the experiments as illustrated in (h). n = 3 mice for each group. (j) Quantification of p62 protein abundance in the experiments as illustrated in (h). n = 3 mice for each gorup. *P < 0.05 vs. WT + DOX + Fed, #P < 0.05 vs. ultra violet radiation resistance associated gene (UVRAG)−/− + DOX + Fed, §P < 0.05 vs.",85128ecc-99b4-4bf2-98ec-9a15fe319922
21,methods21, WT + DOX + Fasted.  Figure 7 Intermittent fasting ameliorates pathology of DOX-induced cardiotoxicity. (a) Representative H&E images of degenerative vacuoles in LVs on heart sections from fed or fasted WT and ultra violet radiation resistance associated gene (UVRAG)-deficient mice 5 days after acute DOX or vehicle treatment. Scale bar: 40 μm. (b) Quantification of degenerative vacuoles in LVs in the experiments as illustrated in (a). n = 3 mice for each group. (c) Representative images of fibrosis stained with picrosirius red in LVs on heart sections from fed or fasted WT and ultra violet radiation resistance associated gene (UVRAG)-deficient mice 5 days after acute DOX or vehicle treatment. Scale bar: 40 μm. (d) Quantification of fibrosis in LVs in the experiments as illustrated in (c). n = 3 mice for each group.,bc7f1fc8-efb9-482e-b078-d757bde18499
22,methods22," (e) Representative H&E images of LVs on heart sections from fed or fasted WT and ultra violet radiation resistance associated gene (UVRAG)-deficient mice at 4 weeks of DOX treatment in chronic cardiotoxicity. Scale bar: 40 μm. (f) Quantification of degenerative vacuoles in LVs in the experiments as illustrated in (e). n = 3 mice for each group. (g) Representative images of fibrosis stained with picrosirius red in LVs on heart sections from fed or fasted WT and ultra violet radiation resistance associated gene (UVRAG)-deficient mice at 4 weeks of DOX treatment in chronic cardiotoxicity. (h) Quantification of fibrosis in LVs in the experiments as illustrated in (g). n = 3 mice for each group. Scale bar: 40 μm. *P < 0.05 vs. WT + DOX + Fed, #P < 0.05 vs. ultra violet radiation resistance associated gene (UVRAG)−/− + DOX + Fed, §P < 0.05 vs. WT + DOX + Fasted.",0ec5c9b3-44be-4d89-9478-799a67be8282
23,methods23,  Figure 8 Intermittent fasting attenuates enhanced Reactive oxygen species (ROS) levels and increased apoptotic cell death in ultra violet radiation resistance associated gene (UVRAG)-deficient mice treated by DOX. (a) Intermittent fasting rescued enhanced Reactive oxygen species (ROS) levels in LVs from ultra violet radiation resistance associated gene (UVRAG)-deficient mice measured 5 days after acute DOX treatment. n = 3 mice for each group. (b) Intermittent fasting attenuated increased apoptotic cell death in the hearts from ultra violet radiation resistance associated gene (UVRAG)-deficient mice assessed 5 days after acute DOX treatment. n = 3 mice for each group. (c) Intermittent fasting rescued enhanced Reactive oxygen species (ROS) levels in LVs from ultra violet radiation resistance associated gene (UVRAG)-deficient mice at 4 weeks of DOX treatment in chronic DOX cardiotoxicity. n = 3 mice for each group.,46bd5d3b-0512-4676-94a8-cad8ff4522e3
24,methods24," (d) Intermittent fasting attenuated increased apoptotic cell death in the hearts from ultra violet radiation resistance associated gene (UVRAG)-deficient mice at 4 weeks of DOX treatment in chronic cardiotoxicity. n = 3 mice for each group. *P < 0.05 vs. WT + DOX + Fed, #P < 0.05 vs. ultra violet radiation resistance associated gene (UVRAG)−/− + DOX + Fed, §P < 0.05 vs. WT + DOX + Fasted. =",e7315c80-0989-480d-9530-ee6e6664d499
25,results0,"ultra violet radiation resistance associated gene (UVRAG) deficiency exacerbates acute DOX-induced cardiotoxicity Young adult ultra violet radiation resistance associated gene (UVRAG)-deficient mice we obtained have normal cardiac morphology and function23. ultra violet radiation resistance associated gene (UVRAG) protein was not detected in the hearts from ultra violet radiation resistance associated gene (UVRAG)-deficient mice after vehicle or DOX treatment (Fig. S1). In acute DOX-induced cardiotoxicity, the survival rate of DOX-treated ultra violet radiation resistance associated gene (UVRAG)-deficient mice was significantly lowered compared with DOX-treated wild type (WT) control mice (Fig. 1a). We then examined cytoplasmic vacuolization, a hallmark of cardiomyocyte degeneration5, in left ventricles (LVs) in DOX-induced cardiotoxicity.",3d428a49-5c1c-4e3b-a297-55beb1683a0c
26,results1," We barely detected vacuolar degeneration of cardiomyocytes from vehicle-treated WT and ultra violet radiation resistance associated gene (UVRAG)-deficient mice. As expected, DOX-treated WT mice showed significant increase in degenerative vacuoles (Fig. 1b,c). Importantly, ultra violet radiation resistance associated gene (UVRAG)-deficient mice showed more degenerative vacuoles compared with WT controls after DOX treatment (Fig. 1b,c). No fibrosis was detected in vehicle-treated WT and ultra violet radiation resistance associated gene (UVRAG)-deficient mice. After DOX treatment, fibrosis was present in WT and ultra violet radiation resistance associated gene (UVRAG)-deficient mice (Fig. 1d). However, ultra violet radiation resistance associated gene (UVRAG)-deficient mice developed more pronounced fibrosis 5 days after DOX treatment (Fig. 1d,e).",10377df5-9ea5-4eb8-be88-f54baff70870
