,chunk_label,chunk_text,uuid
27,methods27," Indeed, Joslin and colleagues [18] demonstrated greater changes in body composition, in fact, weight loss, following 35 fasting days within a 10-week ADF protocol. Notwithstanding, it is evident from the current study and others that IF is an effective method of reducing body weight and fat mass in mice consuming either standard chow or a high fat and sugar diet. The results are most likely a reflection of the substantial physiological and biochemical changes created by the negative energy balance following fasting periods.  It should be highlighted that despite the intermittent fasting group with or without exercise demonstrating reduced weight gain compared to HF/S diet group only, only modest changes in weight occurred within each group.",ce1eee80-958d-449a-a592-8e2a9aca1807
28,methods28," This could be explained by the recent findings of the MATADOR study which demonstrated greater weight loss efficiency when intermittent energy restriction was interrupted with periods of energy balance ‘rest periods’ to potentially reduce any compensatory metabolic responses that can occur to return the body to its original weight [31]. Whether such compensatory mechanisms explain the modest weight changes observed in the current study requires further investigation.  Another strategy to create a negative energy balance is to increase energy expenditure greater than energy intake [32]. In the current study, mice completing 10-weeks of high intensity interval training (HIIT), 3 times a week displayed less body mass and fat mass by approximately 5% and 8% and 6% and 10% in male and female mice, respectively compared to control (OBC) (2) no intervention (CON) mice.",863c2db4-ec3c-4faa-a1f7-e64e783c2bb8
29,methods29," Greater changes in weight and fat mass have been observed in other studies with up to 16% and 45% prevention in weight and fat gain, respectively [22,33]. However, such differences are most likely due to the training volume, with other studies undertaking 10–12 bouts of high intensity interval training (HIIT), five days a week for 8 to 10-weeks [22,33] compared to the present study of eight bouts, three days per week. Furthermore, the high intensity interval training (HIIT) group in the present study concurrently consumed a diet high in fat and sugar during the intervention period and thus, any change in appetite (i.e., increase) because of the exercise training would have resulted in increased consumption. Consuming a standard chow diet may have attenuated weight gain or perhaps led to weight loss.  Glucose intolerance, insulin resistance and elevated Triacylglycerol (TAG) and low density lipoproteins (LDL) levels have been noted in animal models of diet-induced obesity [22,26,34].",3920ed7a-5e2c-4084-90ac-e98d2a21e478
30,methods30," In the current study, high fat feeding resulted in hyperglycaemia and hyperlipidaemia, insulin resistance and glucose intolerance in both male and female ‘Obese’ baseline control mice, with elevated glucose levels indicating diabetes onset. Despite previous studies demonstrating improved glycaemic control and reduced diabetes risk following even modest weight reduction [26,33], the present study was unable to confirm such findings following the diet and/or exercise interventions. Lower low density lipoproteins (LDL) and Triacylglycerol (TAG) levels following the combined interventions in both males and female mice, respectively, compared to controls was observed at the end of the intervention period. The effect of IF on glucose metabolism and glycaemic control was unexpected. Both male and female IF groups exhibited significant increases in fasting glucose and plasma insulin and glucose tolerance and insulin resistance at either 10- or 12-weeks.",ed9a4825-4114-4317-8954-9c4b6effe72e
31,methods31," Although these results are contradictory to the commonly reported view that IF lowers fasting blood glucose levels and improves glycaemic control [6], it has been reported that long term (32-weeks) of IF, but not CR, can lead to redox imbalances, insulin receptor nitration, and thus glucose intolerance in rats [35]. Reduced glucose tolerance is usually a result of lower insulin release [36], however, in the current study, insulin levels were significantly higher than the ‘obese’ controls at the end of the intervention period. It is difficult to make comparisons to other animal and human IF studies since the mice in the current study concurrently consumed a HF/S diet, rather than a typical standard chow or ‘healthy’ diet often prescribed in animal and human studies, respectively [37,38]. A study by Joslin et al., [18] did report improved glucose tolerance and lower circulating insulin levels following ADF with concurrent HF feeding. The improvements observed in the Joslin et al.",29cd3e24-38ae-4301-b6ed-6cbcc20552cb
32,methods32," study could be due to the greater weight loss reported (~16 g) compared to the current study (1.14 g), with evidence suggesting the amount of weight loss may drive the benefits in glucose handling in obesity [39].  Finally, the attrition rate reported in the current study was unforeseen. All mice underwent necropsy by the animal house technical staff with no obvious cause of death. This strain of mice (C57BL6) are a well-established model for investigating diet-induced obesity and type II diabetes. There is some evidence to suggest that male mice are more prone to the adverse effects of HFD, and that dietary and so-far-unidentified environmental factors can combine to induce obesity and diabetes of variable severity [40]. Whether this susceptibility contributed to the death of some of the male mice is unknown.",f1b2f00b-837b-447c-a87e-ebd10ba48885
33,methods33," Furthermore, given the quality of reporting in animal research, especially in regards to attrition rates, has been quite poor [41], it is difficult to compare our attrition rate to others of similar design.  5. Conclusions Current evidence suggests that as little as 10 min of high intensity exercise can improve metabolic health and aerobic capacity [42] and alternative day fasting can reduce obesity-associated changes in body composition, fasting insulin and glucose concentrations [43,44]. The current study wanted to confirm the aforementioned findings by mimicking similar protocols in animal models. Secondly, to investigate the combined effects of such regimes and its long-term impact, and thirdly, unlike human studies which typically don’t change the research participant’s diet, we wanted to observe the effects of these diet and exercise regimes while concurrently consuming a high fat and sugar diet.",9cb7c0b8-3de1-49e6-86dd-181f09d261dc
34,methods34," The present study is the first study to demonstrate superior effects on body composition and lipid profiles following combined IF and high intensity interval training (HIIT) compared to either diet or exercise intervention alone while concurrently consuming a high fat and sugar diet. These observations are likely due to the physiological and biochemical changes that occur when creating a negative energy balance shift. An observation of interest was the gender specific responses to the same diet and/or exercise intervention and could indicate potential hormonal differences influencing metabolic control/adaptation in mice. The results of the present study suggest that the combination of diet and exercise are most effective at attenuating the negative impact that high fat and sugar diet has on body weight, composition and lipid levels.  6. Limitations A number of limitations exist in the current study.",02429e12-eabb-405c-a7b8-2d015de6f121
35,methods35," Firstly, due to limitations in obtaining adequate blood from the tail of the mice, only blood glucose and and Glucose Tolerance (AUC) were measured before and after 10-weeks of diet and/or exercise intervention. Plasma insulin, glucose, HOMA-IR and lipid panels were only measured at the end of the 12-week intervention period and subsequently compared to the average ‘obese’ baseline controls rather than the true baseline (0-week) for each individual intervention group to analyse changes over time. Given starting weights for all intervention groups and the ‘obese’ baseline group were not significantly different, we can only speculate that the hormonal and lipid levels would be similar.",0855463f-b588-4def-a212-6eab4ac034e6
36,methods36," Secondly, due to housing constrains of ethical approval, mice from different intervention groups were housed together, more specifically, mice undergoing fasting (IF and IF + high intensity interval training (HIIT)) were housed together and mice undergoing no fasting (high intensity interval training (HIIT) and control (OBC) (2) no intervention (CON)) were housed together. Thus, food intake of individual mice could not be attained. ",6acf4a97-0ce8-4d4a-90ab-e5648ef5e01e
