,chunk_label,chunk_text,uuid
28,discussion5," In our study, we have not been able to detect the parasitization effect on the Th2 response. However, matching the lower levels of Mtb load, these mice did present a reduction in the pro-inflammatory response in lungs. This was also observed with the oral administration of hkMm, which additionally reduced IL-17 levels, as already described (49). PLS pathway modeling supported the role of helminths and hkMm in the reduction of exudative lesions, and thus reduction of the BL. The levels of IL-10 were also lower in parasitized animals, suggesting a reduction in the regulatory response, as in Nel et al. (42). Furthermore, levels of IFN-γ did not experience significant differences between experimental groups, thus dismantling the idea of a Th2-based response in parasitization competing for the Th1 immune response. The acute-phase protein haptoglobin was reduced in sera of parasitized animals, once again pointing to an anti-inflammatory effect.",1cdfc2d2-9676-457d-baa1-5475002db3c0
29,discussion6,"  Recent estimates of hunger and food insecurity are that 821 million people are undernourished, more than 10% of the world population. This appears to be increasing in almost all regions in Africa and South America, while it is stable in most regions of Asia. A more striking fact is that the number of undernourished has been rising since 2014 (9). A low Body mass index (BMI) is a risk factor for TB development (10), supported by several experimental models. BALB/c mice receiving 80% of the usual amount of food consumed had an impaired response to a TB vaccine (50). The administration of a low-protein-diet in Mtb infected mice increased lung BL, both in bacille Calmette Guérin (BCG)-vaccinated or control animals (51). Another approach to this issue has been the study of Mtb infection in mice not expressing leptin, an adipokine reduced in malnutrition and fasting (52).",94d89c5c-3477-47a8-b04d-058b7c40f5a8
30,discussion7," This Th1 inducer increases with Mtb infection and mice lacking leptin have higher BL in advanced stages of infection (53). This was accompanied by increased numbers of PMNs in lungs. Little is known of the impact of intermittent fasting, a circumstance resembling an aspect of food insecurity. Food deprivation experiments have been carried out in mice. In our case, 48 hours deprivation induced weight reduction, which was recovered with a normal diet for five days, and an increase in oxidative stress. This regimen did not cause a reduction in albumin levels, suggesting that reduction of protection was not due to protein deprivation. Interestingly, intermittent fasting was related to a cortisol increase, probably caused by stress. Elevated levels of cortisol are linked to neutrophilia (54), which can increase neutrophilic infiltration in Mtb lesions, as has already been described in asthma patients (55).",b6904635-01fc-47b1-8f23-b947d9e72981
31,discussion8," However, hkMm appears to balance this reaction as hkMm-Parasitized-Fasting animals had the same levels of cortisol as control mice.  ADA has a proinflammatory effect, by inducing Th1 response and reducing extracellular levels of adenosine (56). Parasitized-Fasting animals were the only ones that did not present lower levels of ADA than control. This matches the results in lung pathology and BL, but once again animals treated with hkMm had a distinct outcome. It appears that hkMm gave some level of protection against intermittent fasting, although it was not strong enough to be evidenced in the progression of TB in this model.  Even though the goodness of fit our PLS-PM model could be considered moderate (28, 29), it is enough to evidence the causal relationship among starvation, parasite load, environmental mycobacteria, exudative lesions (ExL), and bacillary load. Heat-killed M.",243844c5-6a51-473d-a017-46d6e6a71632
32,discussion9," manresensis and helminths contributed equally to diminish exudative lesions and thus bacillary load as suggested by previous research in mice (57) and cattle (58). Further investigation, however, should be conducted to elucidate the drivers of this protective effects beyond the immunological pathway used in our research.  To our knowledge, this is the first time that the impact of parasitization by intestinal helminths in the progression of active TB has been studied in an experimental model, considering important factors like food fasting and exposure to environmental mycobacteria. Our data shows an unprecedented protective impact of intestinal parasitization, which is abrogated by intermittent food fasting. This data should be considered when contemplating deworming policies and highlights the importance of good nutrition in the fight against TB.",e3b7f8b7-295a-44f5-8925-459ac4804303
33,discussion10,"  Data Availability Statement  The raw data supporting the conclusions of this article will be made available by the authors, without undue reservation.  Ethics Statement  The animal study was reviewed and approved by Animal Experimentation Ethics Committee of the Hospital Universitari Germans Trias i Pujol (registered as B9900005).  Author Contributions  Conceptualization: ES and P-JC. Data Curation: CG-A, PC, DG, LA, RV, and AT. Formal Analysis: CG-A, PC, ES, and P-JC. Funding Acquisition: P-JC. Investigation: CG-A, PC, DG, LA, RV, and AT. Methodology: ES and P-JC. Project Administration: ES and PJC. Visualization: PC. Writing – Original Draft Preparation: CG-A, PC, ES, and P-JC. Writing – Review & Editing: CG-A, PC, DG, LA, RV, AT, ES, and P-JC. All authors contributed to the article and approved the submitted version.  Funding  The project leading to these results has received funding from la Caixa Foundation (ID 100010434), under agreement LCF/PR/GN16/10290002.",e3e67c01-b34b-40fa-940a-a521e18fe1bf
34,discussion11, This work was supported by the Plan Nacional I + D + I co-financed by ISCIII-Subdirección General de Evaluación and Fondo-EU de Desarrollo Regional (Fondo EU de Desarrollo Regional (FEDER)) through PC contract IFI14/00015. LA was supported by the European Commission Horizon 2020 research and innovation program under grant agreement TBVAC2020 No. 64338.  The Experimental Tuberculosis Unit is accredited by the Catalan Agency for Management of University and Research Grants (Agency for Management of University and Research Grants (AGAUR)) with code 2017 SGR500 and the IGTP is a member of the CERCA network of institutes.  ES and AT are supported by the Spanish Ministerio de Ciencia Innovación y Universidades (Ministerio de Ciencia Innovación y Universidades (MICINN)) through a Ramon y Cajal agreements (RYC-2016-21120; RYC-2017-22992). The research activities of CG-A are supported by a research fellow linked to the RYC-2016-21120. ,850d387e-0436-4441-9f10-e89f959719a9
