,chunk_label,chunk_text,uuid
0,introduction0,"Continuous interplay between the circadian clock system and homeostatic mechanisms regulates core body temperature (Tb) within a narrow range in homeothermic animals including mammals, and maintains it independently of the environmental temperature. The circadian rhythm of Tb that increases during activity and declines during rest is governed by the master clock located in the suprachiasmatic nucleus (suprachiasmatic nucleus (SCN)) of the anterior hypothalamus1, 2. Neurons located in the preoptic area of the hypothalamus are believed to contain the central thermostat for the homeostatic control of Tb. It receives and integrates information about peripheral (cutaneous and visceral) and local brain temperatures and provides appropriate command signals to peripheral thermoregulatory effectors that control heat dissipation and production3–5.  Adaptive thermogenesis is defined as heat production in response to environmental temperature or diet6.",179aa9f4-dd2f-4524-b42c-fc8e9237ba35
1,introduction1," Neurons in the preoptic area trigger thermogenesis during exposure to cold by activating descending signals through hypothalamic and medullary sites to drive repetitive contractions of skeletal muscle (shivering)4. However, continuous muscle shivering leads to exhaustion and muscle damage. Therefore, non-shivering thermogenesis is activated during chronic cold exposure to sustain heat production through descending output from the hypothalamus to the raphe pallidus nucleus that in turn innervates sympathetic preganglionic neurons3. Brown adipose tissue (Brown adipose tissue (BAT)) is extensively innervated by sympathetic fibers and thus is an important site of non-shivering thermogenesis in most mammals6. The important molecule involved in cold-induced thermogenesis in Brown adipose tissue (BAT) is UCP1, which is a mitochondrial inner-membrane protein that uncouples proton entry from ATP synthesis6.",6ab1f3cf-f9fa-4fba-a2a2-7ab2dd943b8c
2,introduction2," Feeding acutely increases metabolic rates in mammals, and thus diet is also a potent regulator of adaptive thermogenesis. On the contrary, when faced with a harsh climate with inadequate food, some mammals periodically turn down their internal thermostat and enter torpor (controlled decrease of the metabolic rate, Tb and physical activity). Torpor is considered a means of survival during periods of low food availability. When food becomes available, such animals can rewarm to return to a normal level of activity7. Although the metabolic rate during torpor is strikingly decreased, Tb is regulated above a species-specific minimum by a proportional increase in heat production that compensates for heat loss8. The circadian system controls torpor timing that allows some mammals to stay entrained with the light-dark cycle, which facilitates continued foraging9.",a2338614-06bf-4364-8bdb-98a67e3c88f2
3,introduction3," We previously reported that chronic feeding with a ketogenic diet (KD) comprising high fat with low carbohydrate and protein contents induces torpor and significantly decreases core Tb in mice10. We also found that KD induces a decrease in Tb particularly late in the dark (active) period, and increases Tb during the light-to-dark transition to a level like that of a normal diet in mice10. Several molecules such as PPARα and FGF21 might regulate time-dependent torpor11, although we found that both KD and fasting induce hypothermia in FGF21-deficient as well as in wild-type mice12. The underlying mechanism that regulates Tb under hypothermia induced by KD remains unknown, although Brown adipose tissue (BAT) has been considered a major thermogenic organ against exposure to cold.  The circadian oscillator in the suprachiasmatic nucleus (SCN) is driven by transcription/translation-based autoregulatory feedback loops consisting of the periodic expression of clock genes2.",ffdb1d89-e230-4f2b-a746-fdd227b2f669
4,introduction4," Studies of clock genes in mammals have revealed that oscillatory mechanisms function in various peripheral tissues such as the heart, lungs, liver, kidneys, adipose tissues and skeletal muscles, and that they are entrained to the suprachiasmatic nucleus (SCN) by systemic time cues including neural, humoral and other signals such as feeding and body temperature2. Hundreds of circadian clock-controlled genes that regulate a remarkable diversity of biological processes have been identified in peripheral tissues including skeletal muscle using DNA microarray technology13–16. The significance of clock and clock-controlled genes in the skeletal muscle has been demonstrated in animal models of molecular clock disruption. For example, muscle force is reduced, mitochondria are dysfunctional and myofilament architecture is disrupted in Clock mutant and Bmal1-deficient mice14, 17. Muscle-specific Bmal1 knockout (KO) mice have muscle fibrosis18 and impaired glucose uptake19.",0a8d56bd-b42b-4793-99a6-58534b64170d
5,introduction5," These facts suggest that the molecular clock can modify skeletal muscle physiology. Here, we focused on the physiological role of Slc25a25 among 478 circadian genes in muscle16. SLC25A25 is a Ca2+-sensitive ATP-Mg2+/Pi carrier in the inner membranes of mitochondria that might be associated with thermogenesis in mice20, 21. We assessed the circadian regulatory mechanisms of Slc25a25, and its putative role in muscle thermogenesis during torpor induced by a KD. ",de38ad58-189e-4b5a-a41c-641a908451d0
6,methods0,"Animal care and surgical procedures All animal experiments proceeded according to the guidelines for animal experiments of the National Institute of Advanced Industrial Science and Technology (and Technology (AIST)). The Animal Care and Use Committees at and Technology (AIST) approved all the experimental protocols described herein (Permission # 2016-166).  Circadian expression of the Slc25a25 gene was measured in C57BL/6J mice seven days after sciatic denervation. The contralateral innervated (sham-operated) muscles of the same animals and the muscles of intact animals served as controls, as described16. Homozygous Clock mutant mice were generated as described48. Global Bmal1 KO mice, muscle-specific Bmal1 KO mice and their control littermates generated as described49 were housed with access to a standard diet (CE2: CLEA Japan Inc., Tokyo, Japan) and water ad libitum under a 12 h light-12 h dark cycle (LD12:12); lights on at Zeitgeber time (ZT) 0 and lights off at ZT12.",c3af0307-4c34-4370-8bea-f0eb1e96c198
7,methods1," After sacrifice at the indicated times, the gastrocnemius muscles were dissected.  We assessed the effect of KD feeding on the expression of thermogenic genes and Tb in nine week-old male Jcl:ICR mice (Japan SLC Inc., Shizuoka, Japan) that were housed and fed ad libitum for two weeks under a 12 h light-12 h dark cycle. The mice were randomly assigned to receive muscle-denervation or a sham operation. The sciatic nerve was bilaterally transected under anesthesia. Sham-operated mice underwent identical dissection without transection. Ten days later, the denervated and sham-operated mice were each divided into two experimental groups and fed with either the AIN-93G (Oriental Yeast Co. Ltd., Tokyo, Japan) normal diet (ND) or the modified AIN-93G ketogenic (KD) diet (73.9% fat, 8.3% protein and 0.73% carbohydrate, w/w; Oriental Yeast Co. Ltd.) for two weeks. The proportions of calories derived from fat, carbohydrate and protein were ND: 12.6%, 58.3% and 29.3%; KD: 94.8%, 0.1% and 4.",99d0b734-d467-4035-bc22-562bc926125a
8,methods2,"8%, respectively. The mice were sacrificed at ZT14 and the gastrocnemius muscle, white (white adipose tissue (WAT)) and brown (Brown adipose tissue (BAT)) adipose tissues were dissected, weighed and frozen in liquid nitrogen.  Mice aged 7–8 (adult) and 23–24 months (aged) were sacrificed to evaluate the effects of aging on thermogenic gene expression in the gastrocnemius muscles.  Seven-week-old male mice were individually housed in cages without running-wheels to mimic sedentary conditions or with running-wheels for four weeks to evaluate the effects of chronic exercise on Slc25a25 mRNA expression in the gastrocnemius muscles.  Real-time reverse transcription-polymerase chain reaction (RT-PCR) Total RNA was extracted using guanidinium thiocyanate followed by RNAiso Plus (Takara Bio Inc., Otsu, Japan). Single-stranded cDNA was synthesized using PrimeScript™ RT reagent kits with gDNA Eraser (Takara Bio).",20249500-e02c-49e4-a23e-1fbe441247c4
9,methods3," Real-time RT-PCR proceeded using SYBR® Premix Ex Taq™ II (Takara Bio) and a LightCycler™ (Roche Diagnostics, Mannheim, Germany). The amplification conditions comprised 95 °C for 10 s followed by 45 cycles of 95 °C for 5 s, 57 °C for 10 s and 72 °C for 10 s. Supplemental Table 1 shows the primer sequences. Amounts of target mRNA were normalized relative to that of Actb.  Monitoring core body temperature Mice were surgically implanted intra-abdominally with TempDisk TD-LAB data loggers (Labo Support Co. Ltd., Suita, Osaka, Japan) that were programmed to record body temperature (Tb) ± 0.1 °C every 15 min. Data obtained from each logger were analyzed using RhManager Ver.2.09 (KN Laboratories Inc., Ibaraki, Osaka, Japan) and hourly Tb values were averaged. We measured two-hour averaged Tb values between ZT13 and 15 during the experimental period to determine variations in peak Tb. ",2fc0de9f-70b6-4b23-83c9-81b6ad619939
10,analysis0,"All values are expressed as means ± SEM. Levels of mRNA expression in denervated and sham-operated mice fed with a normal diet or KD were statistically evaluated using a two-way analysis of variance (a two way analysis of variance (ANOVA)) and the Tukey multiple comparison test using Excel-Toukei 2010 software (Social Survey Research Information Co. Ltd., Osaka, Japan). The value of Tb in mice fed with the KD and the mRNA levels in clock gene-mutant mice at corresponding ZT were compared between groups using Student’s t-test. The mRNA levels of Slc2a25 in sciatic denervated mice and intact mice at corresponding ZT were compared between groups using one-way a two way analysis of variance (ANOVA). The effects of time on Slc25a25 mRNA expression were determined by one-way a two way analysis of variance (ANOVA) in denervated and Clk/Clk mice, and by Student’s t-test in M-Bmal1 KO and G-Bmal1 KO mice.",01d1bef2-6148-4efa-957a-76d9d1360f73
11,analysis1," The circadian amplitude of Slc25a25 expression was set at half of the total peak-trough variation. Differences were considered significant at P < 0.05. Supplemental Tables 2–8 show the results of the statistical analysis.  Electronic supplementary material  Supplementary Information      Electronic supplementary material   Supplementary information accompanies this paper at doi:10.1038/s41598-017-03119-8    Publisher's note: Springer Nature remains neutral with regard to jurisdictional claims in published maps and institutional affiliations.  Acknowledgements This study was supported by operational subsidies from and Technology (AIST), and JSPS KAKENHI to R. Nakao (JP15K16499) and K. Oishi (JP16K00940) from the Ministry of Education, Culture, Sports, Science, and Technology (Ministry of Education Culture Sports Science and Technology (MEXT)) of Japan. We thank Dr. Hideaki Oike (National Agriculture and Food Research Organization) and Dr.",a0acc8ac-b7f9-4494-9e75-571de942affd
12,analysis2," Tetsuya Shiuchi (The University of Tokushima) for valuable comments. We are also grateful to Ms. Saori Yamamoto, Ms. Sayaka Higo-Yamamoto (and Technology (AIST)), Mr. Yuki Yasumoto (and Technology (AIST), Tokyo University of Science), Ms. Haruka Yamazaki (and Technology (AIST), Nihon University), and Mr. Hiroki Okauchi (and Technology (AIST), Tokyo University of Science) for technical assistance.  Author Contributions R.N. and K.O. designed the study protocol. R.N., S.S., and K.O. conducted experiments. S.S. derived the Bmal1 KO mouse strain. R.N. and K.O. analyzed data. R.N. and K.O. contributed to writing the manuscript.  Competing Interests The authors declare that they have no competing interests. =",ce260338-b2e4-487b-9405-e6bb4d946da3
13,results0,"Systemic circadian clock regulates rhythmic expression of Slc25a25 via neural signals Among 478 genes in the gastrocnemius muscles of mice that fluctuate in a circadian manner between day and night16, 313 lost rhythmicity after sciatic denervation and among these, we investigated Slc25a25 that encodes a Ca2+-sensitive ATP-Mg2+/Pi carrier in the inner membranes of mitochondria20. We initially assessed the effect of sciatic denervation on the circadian expression of Slc25a25 mRNA in mouse gastrocnemius muscles. The mRNA expression of Slc25a25 fluctuated in a circadian manner that peaked at zeitgeber time (ZT) 14 in intact and contralateral skeletal muscle (both P < 0.001; one-way a two way analysis of variance (ANOVA)) (Fig. 1a). The circadian amplitude of Slc25a25 expression was decreased by 85% in the gastrocnemius muscle of mice with sciatic denervation relative to that in intact muscle (Fig. 1a), although the rhythmic expression of Slc25a25 was retained (P = 0.",7ea1c711-405f-4745-99bb-324cd1001148
14,results1,"003; one-way a two way analysis of variance (ANOVA)). We investigated the temporal expression profiles of Slc25a25 in homozygous Clock mutant (Clk/Clk), muscle-specific Bmal1 (M-Bmal1) KO, and global Bmal1 (G-Bmal1) KO mice to assess whether or not the molecular clock is involved in the circadian regulation of Slc25a25 expression. The circadian amplitude of Slc25a25 mRNA expression was decreased by 60% in the skeletal muscle of Clk/Clk compared with that of WT mice (Fig. 1b), although its mRNA levels remained rhythmic (P < 0.001; one-way a two way analysis of variance (ANOVA)). The muscle-specific deletion of Bmal1 slightly decreased the peak level of Slc25a25 expression, but day/night expression was essentially retained (WT, P = 0.016; M-Bmal1 KO, P = 0.002; t-test) (Fig. 1c). The peak expression level of Slc25a25 was significantly lower in G-Bmal1 KO, than in WT mice, and day/night oscillation was abolished in G-Bmal1 KO (WT, P < 0.001; G-Bmal1 KO, P = 0.087; t-test; Fig. 1d).",26cd98f2-ed45-421f-a1c6-40bb2e9fccab
15,results2,"Figure 1  Slc25a25 is a circadian gene in skeletal muscle. (a) Circadian expression of Slc25a25 in skeletal muscle seven days after sciatic denervation. Contralateral innervated muscles of same mice and muscles of intact mice served as controls. Gray shading indicates dark period. Data are expressed as means ± SEM (n = 5–6 per group). Maximal value for intact mice is expressed as 1.0. * P < 0.05 and ** P < 0.01 for intact vs. denervated muscle at corresponding Zeitgeber time (ZT). (b) Temporal expression profiles of Slc25a25 mRNA in skeletal muscle of Clock mutant (Clk/Clk) mice. Gray shading indicates dark period. Data are expressed as means ± SEM (n = 4–5 per group). * P < 0.05 for WT vs. mutant mice at corresponding ZT. (c,d) Muscle-specific (M-Bmal1 KO) or global (G-Bmal1 KO) Bmal1 knockout mice. Gray shading indicates dark period. Data are expressed as means ± SEM (n = 4–5 per group). Maximal value for wild-type (WT) mice is expressed as 1.0. * P < 0.05 for WT vs. mutant mice.",35b90423-c944-42d0-a5b1-aecd2ff0d272
16,results3," † P < 0.05 and †† P < 0.01 for ZT2 vs. ZT14. Supplemental Tables 2 and 3 show results of statistical analysis.     Ketogenic diet induces Slc25a25 mRNA expression in skeletal muscle, but not in brown and white adipose tissues A previous study has shown that SLC25A25 might contribute to a thermogenic pathway in mice with defective Brown adipose tissue (BAT) thermogenesis, because Slc25a25 mRNA expression is induced during adaptation to cold stress in the skeletal muscle of Ucp1 KO mice21. On the other hand, normal Tb was maintained in global Slc25a25 KO mice after acute exposure to cold stress, suggesting that SLC25A25 is not essential for the regulation of Tb during exposure to cold21. We investigated the mRNA expression of Slc25a25 in sciatic denervated and sham-operated mice after seven days on a ketogenic diet (KD) that induces time-of-day-dependent hypothermia (torpor)10.",67599476-74b9-4e1a-807d-01039d6d63f1
17,results4," In addition to Slc25a25, we also measured the mRNA expression of other thermogenic genes such as those for Sarcolipin (Sln), Pgc1a, Ucp2, and Ucp3. Sarcolipin regulates sarcoplasmic reticulum Ca2+-ATPase (sarcoplasmic reticulum Ca2+ ATPase (SERCA)) and it is involved in non-shivering muscular thermogenesis during cold stress22. The thermogenic molecule PGC1α functions as a transcriptional co-activator of PPARγ that modulates the expression of Ucp1 and thermogenesis in brown fat23. The KD upregulated mRNA expression of Slc25a25 and Ucp3 by 2.4-fold and 2.7-fold, respectively, in muscle from sham-operated mice compared with mice fed with a normal diet (ND) (Fig. 2a,g). However, the KD did not induce the mRNA expression of Slc25a25 isoforms such as Slc25a23 and Slc25a24 (Fig. 2b,c). The KD also did not affect the mRNA expression of Sln, Pgc1a and Ucp2 in muscle from sham-operated mice (Fig. 2d–f).",ad9299b4-8ffc-4458-8601-b3bf35240374
18,results5," On the other hand, sciatic denervation gene-specifically affected the mRNA expression of these genes; it significantly decreased the mRNA expression levels of Slc25a25, Pgc1a, and Ucp3, but increased those of Slc25a24 and Sln. The expression levels of Sln were increased about 400-fold by denervation independently of the diet (Fig. 2d). Among the thermogenic genes measured herein, KD increased Slc25a25 and Ucp3 expression in sham-operated muscle, and only Slc25a25 abolished the response to KD by denervation. The mRNA expression levels of Nr1d1 that inhibits the thermogenic activity of Brown adipose tissue (BAT)24 were not affected by either the KD or denervation (Fig. 2h).Figure 2 Prolonged ketogenic diet feeding upregulates Slc25a25 expression in skeletal muscle. Messenger RNA expression of thermogenic gene in skeletal muscle of mice fed with ketogenic (KD) or normal (ND) diets for seven days starting from 10 days after sciatic denervation or sham-operation.",7b752b16-810b-424a-b8f8-b983ebf5ed18
19,results6," Data are expressed as means ± SEM (n = 5 per group). Value for sham-operated mice fed with ND is expressed as 1.0. * P < 0.05 and ** P < 0.01 for sham-operated vs. denervated. † P < 0.05 and †† P < 0.01 for ND vs. KD. Supplemental Table 4 shows results of statistical analysis.     Brown adipose fat is thought to be the primary contributor to thermogenesis through the function of UCP16. We examined the effects of the KD and sciatic denervation on the expression of thermogenic genes in Brown adipose tissue (BAT), and found that neither the KD, nor sciatic denervation significantly affected Slc25a25 expression (Fig. 3a). Furthermore, the mRNA expression of the thermogenic genes, Ucp1, Cidea, Ucp3 and Nr1d1 did not significantly differ among all groups (Fig. 3b,c,f,g). Sciatic denervation slightly upregulated Pgc1a mRNA expression, whereas the KD did not (Fig. 3d), although it increased Ucp2 expression in denervated mice (Fig. 3e).",061c6a80-99cf-4661-b77b-d235809cad55
20,results7,"Figure 3 Messenger RNA expression of thermogenic gene in brown adipose tissue. Prolonged ketogenic diet (KD) feeding minimally affects thermogenic gene expression in brown adipose tissues of mice fed with KD or normal diet (ND) for seven days starting at 10 days after sciatic denervation or sham-operation. Data are expressed as means ± SEM (n = 5 per group). Value for sham-operated mice fed with ND is expressed as 1.0. * P < 0.05 for sham-operated vs. denervated. † P < 0.05 for ND vs. KD. Supplemental Table 4 shows results of statistical analysis.     We evaluated the mRNA expression of thermogenic genes in white adipose tissue (white adipose tissue (WAT)), because beige cells in white adipose tissue (WAT) are involved in adaptation to a chronically cold environment25–28. Levels of Slc25a25, Cidea and Pgc1a gene expression did not significantly differ among all groups (Fig. 4a,c,d). The KD slightly induced the mRNA expression of Ucp1 in denervated and sham-operated mice (Fig. 4b).",dbc1d41f-815f-49a4-86fe-7aeed2abc438
21,results8,Figure 4 Messenger RNA expression of thermogenic genes in white adipose tissue. Prolonged ketogenic diet (KD) feeding minimally affects thermogenic gene expression in white adipose tissues of mice fed with KD or normal diet (ND) for seven days starting at 10 days after sciatic denervation or sham-operation. Data are expressed as means ± SEM (n = 5 per group). Value for sham-operated mice fed with ND is expressed as 1.0. † P < 0.05 for ND vs. KD. Supplemental Table 4 shows results of statistical analysis.     Sciatic denervation augments hypothermia induced by a ketogenic diet We assessed the effect of the KD on circadian Tb rhythm in sciatic denervated and sham-operated mice to determine the functional role of the skeletal muscle-specific induction of Slc25a25 mRNA expression in mice fed with the KD. The circadian fluctuation of Tb that peaked during the early night was identical between denervated and sham-operated groups fed with the ND (Fig. 5a).,f700e66f-d25f-4a1e-97cb-4ec56db9751d
22,results9," The KD obviously reduced Tb during the latter half of the dark period as described10 in both denervated and sham-operated mice (Supplemental Fig. 1). Notably, Tb was significantly lower during the early night in denervated, than in sham-operated mice fed with the KD (Fig. 5b), although denervation did not affect the Tb rhythm in mice fed with a normal diet (Fig. 5a). We compared the effect of KD on peak Tb between denervated and sham-operated mice, and found that sciatic denervation obviously augmented KD-induced hypothermia (Fig. 5c). Fourteen days of feeding with the KD decreased peak Tb from 38.1 ± 0.13 °C (on the day before KD feeding) to 37.5 ± 0.09 °C in sham-operated, and from 38.2 ± 0.11 °C to 36.9 ± 0.14 °C in denervated mice (Fig. 5c). These results indicate that skeletal muscle plays an important role in maintaining Tb while under feeding with a KD, although it does not seem essential under normal diet feeding.",113d16c3-802c-436e-ab8e-09b3c89c47ac
23,results10,"Figure 5 Bilateral sciatic denervation exacerbates hypothermia during prolonged ketogenic diet feeding. Core body temperature rhythms for 24 h in mice fed with ketogenic (KD) or normal (ND) diets for two weeks starting at 10 days after sham operation or bilateral sciatic nerve transection. Hourly averaged values of body temperature on the day before starting (a) and after two weeks (b) on ketogenic diet. Gray shading indicates dark period. (c) Peak values of body temperature during experimental period. Body temperatures were averaged every two hours from ZT13 to ZT15. Data are expressed as means ± SEM (n = 5–7 per group). * P < 0.05 and ** P < 0.01 for sham-operated vs. denervated. ZT, zeitgeber time. Supplemental Tables 5 and 6 show results of statistical analysis.     Aging affects thermogenic gene expression in skeletal muscle We assessed the thermogenic gene expression in skeletal muscle to determine the functional role of Slc25a25 on the decrease in Tb induced by aging.",a4b244e3-e428-414a-9e9a-f04af793a98a
24,results11," The levels of Slc25a25 and Sln mRNA expression were significantly decreased and increased, respectively, in the skeletal muscle of aged mice (Fig. 6a and b). Levels of Pgc1a and Ucp3 expression were essentially identical between adult and aged mice (Fig. 6c and d). We also examined the effect of chronic exercise on Slc25a25 expression in skeletal muscle. We found that four weeks of voluntary wheel running29 increased the mRNA expression of Slc25a25 (Fig. 6e), but not of Ucp3 (Supplemental Fig. 2) in skeletal muscle compared with that in sedentary mice.Figure 6 Aging gene-dependently affects thermogenic gene expression. (a–d) Messenger RNA expression of thermogenic gene in skeletal muscles of adult and aged mice (aged 7–8 and 23–24 months, respectively). Data are expressed as means ± SEM (n = 6–10 per group). Maximal value for adult mice is expressed as 1.0. * P < 0.05 for adult vs. aged mice. (e) Effects of voluntary running on Slc25a25 mRNA expression in skeletal muscle.",833d0f1c-8abc-42cb-9098-d11f30bb929c
25,results12, Mice were individually housed in cages with or without (to mimic sedentary conditions) running-wheels for four weeks. Gray shading indicates dark period. Data are shown as means ± SEM (n = 4–5). Maximal value for sedentary mice is expressed as 1.0. * P < 0.05 for sedentary vs. running-wheel. Supplemental Tables 7 and 8 show results of statistical analysis.    ,bd432d4c-680f-4325-98fe-628834e775ab
