,chunk_label,chunk_text,uuid
26,discussion0,"The present study aimed to elucidate the functional role of circadian Slc25a25 expression in mouse skeletal muscle. We found that the circadian amplitude of Slc25a25 expression was decreased by 85% in denervated, compared with intact muscle. The circadian amplitude of muscle Slc25a25 expression was decreased by 60%, 38% and 70% in Clk/Clk, M-Bmal1 KO, and G-Bmal1 KO mice, respectively. These findings suggest that the circadian expression of Slc25a25 is largely dependent on neural signals in a molecular clock-dependent manner. A previous study found that SLC25A25 might contribute to a thermogenic pathway in mice with defective Brown adipose tissue (BAT) thermogenesis, because Slc25a25 mRNA expression was induced during adaptation to cold stress in the skeletal muscle of Ucp1 KO mice21.",d366a9a9-074c-4d8f-9ac6-224640f075a6
27,discussion1," On the other hand, that study also found that Tb remained normal in global Slc25a25 KO mice under acute exposure to cold stress, suggesting that SLC25A25 is not essential for Tb regulation during cold exposure21. The present study evaluated the functional role of Slc25a25 on adaptive thermogenesis in mice fed with a KD, which induces time-of-day dependent hypothermia (torpor). The KD significantly increased the mRNA expression of Slc25a25 in muscle. This was probably muscle-specific and governed by neural signals, because the KD did not induce Slc25a25 mRNA in other tissues such as Brown adipose tissue (BAT), white adipose tissue (WAT) and the liver (Figs 3a, 4a, and Supplemental Fig. 3), and sciatic denervation abolished KD-induced mRNA expression. The mRNA expression of typical thermogenic molecules such as Ucp1 in Brown adipose tissue (BAT) and white adipose tissue (WAT), and of Sln and Pgc1a in skeletal muscles was not affected by the KD.",501700cb-9132-484b-81be-58edf6dd07f2
28,discussion2," To evaluate the functional role of the skeletal muscle-specific induction of Slc25a25 mRNA expression in mice fed with the KD, we investigated the effects of the KD on circadian Tb rhythms in sciatic denervated and sham-operated mice. The Tb was significantly lower in sciatic denervated mice fed with the KD compared with sham-operated control mice, whereas it remained essentially identical between denervated and sham-operated mice fed with the ND, suggesting that muscle thermogenesis is involved in the maintenance of core Tb under KD feeding. The present findings suggest that both the central clock and energy homeostasis regulate muscle Slc25a25 expression via neural pathways, and that SLC25A25 may be involved in muscle thermogenesis under hypothermia induced by KD in mammals.  We assessed the temporal expression profiles of Slc25a25 and the typical clock gene, Per2, in C2C12 myotubes to determine the involvement of peripheral clocks in the rhythmic expression of Slc25a25 mRNA.",30ad6000-3886-47c8-a6f2-7d4f61d9ea8f
29,discussion3," However, we did not find rhythmic Slc25a25 expression in C2C12 myotubes, although the circadian expression of Per2 was robust (Supplemental Fig. 4). These findings suggest that molecular clock components are involved in the circadian expression of Slc25a25 in a systemic manner. On the other hand, day/night fluctuation of Slc25a25 expression was slight, but significantly retained in denervated (P < 0.001; one-way a two way analysis of variance (ANOVA)), Clk/Clk (P < 0.001; one-way a two way analysis of variance (ANOVA)), or M-Bmal1 KO mice (P = 0.002; t-test), but not in G-Bmal1 KO mice (P = 0.087; t-test). All experiments in the present study proceeded under light-dark cycles. Day/night locomotor activity rhythm was evident in denervated, Clk/Clk, and M-Bmal1 KO mice as well as WT animals, the result of a direct masking effect (Supplemental Fig. 5).",dbdebfd7-19ea-4c93-b9ec-ccc2006a4ddd
30,discussion4," Day/night behavioral and physiological rhythms including feeding and body temperature might, at least in part, be involved in the circadian regulation of Slc25a25 expression in muscle.  Muscle mRNA levels of Slc25a25 robustly fluctuated in a circadian manner that peaked at the day-to-night transition and were positively regulated by CLOCK and BMAL1 in a systemic manner through a neural pathway. However, the mRNA levels of Slc25a25 remained almost constant throughout the day in the liver, and upregulated in Clk/Clk mice (Supplemental Fig. 6a). These findings suggest that Slc25a25 transcription is tissue-specifically regulated and that muscle SLC25A25 plays an important role during the active onset.  We exposed mice to time-restricted feeding (diet available for 8 h during either daytime or nighttime) for one week30 to determine whether the circadian feeding schedule is involved in the circadian regulation of muscle Slc25a25 expression.",6c50abac-62bc-4f0d-9581-0cac5d4597ed
31,discussion5," This feeding schedule did not affect the circadian phase of Slc25a25 mRNA expression, which peaked at ZT14 in skeletal muscle (Supplemental Fig. 7a). In contrast, the reversed feeding schedule obviously affected the temporal expression profile of Slc25a25 mRNA in both the liver and white adipose tissue (WAT) of mice (Supplemental Fig. 7b,c). The acrophase of mRNA expression in the liver and white adipose tissue (WAT) corresponded to the feeding phase. These results suggest that feeding-derived signals are important to enforce the rhythmicity of Slc25a25 expression in the liver and white adipose tissue (WAT), but not in skeletal muscle. Feeding schedules do not affect the central clock in the suprachiasmatic nucleus (SCN)31. Therefore, neural signals from the suprachiasmatic nucleus (SCN) clock might be involved in the circadian regulation of Slc25a25 expression in skeletal muscle.",54094f35-a528-4ba1-bc3a-912ffdfd2ab5
32,discussion6,"  We analyzed the effects of a Clock gene mutation on Slc25a25 expression induced by the KD (Supplemental Fig. 8). We found that the KD-induced Slc25a25 expression in Clk/Clk mice, although to a lesser extent than in WT mice. These findings suggest that the molecular clock is dispensable, but partly involved in the KD-induced Slc25a25 expression in muscle.  We did not identify an effect of KD feeding on Ucp1 expression in either muscle or Brown adipose tissue (BAT), although previous studies have demonstrated KD-induced Ucp1 expression in Brown adipose tissue (BAT)32, 33. We analyzed the effects of short-term (7 days) KD feeding, whereas Kennedy et al. and Srivastava et al. assessed the long-term effects (5 and 4 weeks, respectively)32, 33. The effects of KD on metabolic tissues might vary dependently on the experimental period.",7b8a678d-9746-4144-a84c-c1e4e9c32836
33,discussion7,"  The present study found that sciatic denervation significantly decreased nighttime Tb in mice fed with KD, but did not affect Tb in mice fed with a normal diet. Sciatic denervation did not affect starvation-induced endocrine systems since the KD similarly increased plasma FGF21 concentrations in both denervated and sham-operated mice (Supplemental Fig. 9). Importantly, expression levels of the thermogenic genes, Ucp1 and Pgc1a in Brown adipose tissue (BAT) and white adipose tissue (WAT) were insensitive to the KD, although Tb was extremely decreased. These observations suggest that muscle thermogenesis plays an important role in maintaining Tb under KD feeding. Muscle thermogenesis has been explained as burst contractions of skeletal muscle (shivering) in an immediate response to acute cold stress34, 35. However, shivering is not a long-term continuous thermogenic response but rather a transient thermogenic response to maintain the Tb for a few hours36.",91137c4a-4202-4d19-b181-2678bdcb871a
34,discussion8," The KD did not affect the mRNA expression of Sln in muscle, although Sln is thought to be involved in non-shivering muscular thermogenesis during cold stress22. Therefore, SLN does not seem to be a critical contributor to the maintenance of Tb under a KD. Denervation remarkably increased the levels of Sln mRNA expression in muscle. These findings suggest that neural signals negatively and positively regulate the expression of Sln and of Slc25a25, respectively, in muscle.  Circadian amplitude and mean Tb decreases in elderly persons37–39. Changes in Tb rhythms associated with aging are frequently associated with a reduction in nighttime sleep quality40 and cerebral blood flow39. Levels of Slc25a25 mRNA expression were significantly decreased in the skeletal muscle of aged, compared with adult mice (Fig. 6a), whereas the levels of Sln mRNA expression were significantly increased (Fig. 6b).",c60eaf2a-2bbc-41b2-be98-acc7c50f05e8
35,discussion9," Several studies have found denervation in aging muscles41, including a progressive reduction in the number of motoneurons in the spinal cord beginning around the age of 60 years42, a loss of motoneurons in the periphery43, 44, degeneration of neuromuscular junctions45 and loss of motor units46. Aging-induced denervation might cause the downregulation of Slc25a25 in elderly persons, subsequent to a lower Tb. Meanwhile, Sln mRNA expression was significantly upregulated in aged muscle of mice (Fig. 6b). We speculated that aging-induced denervation increases Sln mRNA expression, and that the thermogenic function of Sln seems independent of aging-induced hypothermia. We also examined the effect of chronic exercise on Slc25a25 expression in skeletal muscle, because exercise is considered an effective approach to improve denervation in elderly persons47. We found that four weeks of voluntary wheel running29 increased Slc25a25 mRNA expression in the skeletal muscles of mice (Fig. 6e).",07bd58e9-697e-427f-a230-5828597927bd
36,discussion10," Thus, elderly persons should maintain muscle thermogenic activity to retain Slc25a25 expression and prevent an age-related decrease in Tb. Regular exercise might be a useful approach to maintain muscle thermogenesis through induction of the Slc25a25 gene.  We could not evaluate the effects of aging on KD-induced Slc25a25 expression in mice because such experiments are very time-consuming. Further studies are needed to understand the relationships between aging and decreased Slc25a25 expression, including the effect of KD feeding and sciatic denervation.  The present findings suggest that chronic KD feeding induces expression of the circadian gene, Slc25a25, via a neural pathway in muscle. Moreover, muscle non-shivering thermogenesis seemed important for maintaining Tb under KD feeding, and Slc25a25 and Ucp3 might be involved in muscle thermogenesis (Fig. 7).",a889a396-ce45-4d15-aa69-3df06b94b759
37,discussion11," This is the first report to suggest that thermogenesis derived from skeletal muscle is involved in the maintenance of core Tb under metabolic hypothermia. Sciatic denervation affects the expression of many metabolic genes as we have previously shown16. We believe that several genes are associated with muscle thermogenesis under metabolic hypothermia such as ketogenic conditions. In fact, the expression profiles of Ucp3 and Slc25a25 in skeletal muscle in response to the KD and sciatic denervation were similar. Further studies are needed to uncover the molecular mechanism of muscle thermogenesis under metabolic hypothermia.Figure 7 Summary of present study. Mechanism of muscle thermogenesis starts with shivering as first defense against exposure to cold. Thereafter, Sln 22, 50 and Ucp1 51, 52 are respectively driven to elicit non-shivering thermogenesis in skeletal muscle and Brown adipose tissue (BAT).",ed56668f-b225-46cf-9296-54886b3d3d8b
38,discussion12," Exposure to cold also induces emergence of brown adipocytes in white adipose tissue (WAT) by increasing expression of Ucp1, Cidea, and Pgc1a genes52, 53. Meanwhile, the present study found induced circadian Slc25a25 gene expression in skeletal muscle, but not in Brown adipose tissue (BAT) and white adipose tissue (WAT) of mice fed with ketogenic diet (KD), which induces torpor. Messenger RNA expression of thermogenesis-related genes such as Ucp1 was not affected by KD in Brown adipose tissue (BAT) and white adipose tissue (WAT). Sciatic denervation abolished Slc25a25 expression and augmented KD-induced hypothermia. These results suggest that skeletal muscle is involved in thermogenesis during KD feeding, and that Slc25a25 and Ucp3 are candidates for muscle thermogenesis. Less Slc25a25 was expressed in skeletal muscle of aged, compared with adult mice, whereas Ucp1 expression was not altered by aging at thermoneutrality54. SLC25A25 might help to maintain Tb in aged mammals.    ",0e9369eb-f935-4fbf-8923-30fdb8bb2ce9
