,chunk_label,chunk_text,uuid
54,background57," Athletes should consider individual tolerances and sensitivities. During single-stage races, recommended target ranges are: Energy = ~ 150–400 Kcal·h− 1; carbohydrate (CHO) = 30–50 g·h− 1; PRO = 5–10 g·h− 1; FAT = 1.1–17.7 g·h− 1; Fluid intake = 450–750 mL·h− 1; Sodium = > 575 mg·L− 1    Protein intake Protein ingestion during racing is often neglected, for two possible reasons: i) protein plays a secondary role in energy metabolism under race conditions and athletes, therefore, prioritize the ingestion of carbohydrate (CHO) and fat; and ii) strategic ingestion of protein is difficult when runners rely solely on fixed checkpoints for the supply of energy/fluid and are, therefore, at the mercy of race organizers to supply foods with adequate protein. Nevertheless, it is plausible that protein ingested during an ultra-marathon would mitigate the ill-effects of muscle damage and/or positively influence energy metabolism.",b60028da-7045-4fd4-b692-f660ec7deeb8
55,background58," Indeed, finishers of a 100-mile (161 km) race had a significantly greater protein intake relative to non-finishers (131.2 ± 79.0 versus 43.0 ± 56.7 g) and, when expressed as a relative ratio per hour, race finishers consumed twice the quantity (0.08 versus 0.04 g·kg− 1·h− 1) [15]. Gastrointestinal distress and a lack of appetite in non-finishers may explain their lower overall intake.  Protein is likely an important component for prolonged endurance exercise because of the substantial proteolysis and muscle damage that can manifest before the conclusion of a race. In controlled studies, however, there are conflicting results. Protein co-ingested with carbohydrate (CHO) during 6 h of running and cycling improved net protein balance to a greater extent than the ingestion of carbohydrate (CHO) alone [106]. By contrast, when ultra-marathon runners were supplemented with 52.",30cdde48-29f8-45d3-9153-a08d5a5ace57
56,background59,"5 g of amino acids or a placebo prior to, and during, a 62-mile (100 km) race, there were no significant differences in markers of muscle damage or overall performance [107]. As such, the equivocal findings may result from the co-ingestion of protein and carbohydrate (CHO), and/or differences in the exercise modality used between studies. Irrespective, nutrition strategies should be implemented that mitigate the consequences of prolonged protein abstinence, and a balance of macronutrients should be consumed.  A degree of self-sufficiency when racing may provide an opportunity for runners to follow a more bespoke nutrition strategy to better satisfy individual protein needs (see Table 4 for example foods). Protein-rich foods can be carried in running belts and/or backpacks and consumed ad libitum, but race organizers are also encouraged to provide high-protein options at checkpoints. Runners who are concerned that consuming calories from protein might compromise energy availability (i.e.",48c64ba3-e0f4-4429-8048-bacbe459542a
57,background60,", by necessitating fewer calories from carbohydrate (CHO) and fat) might consider BCAA supplements (as liquid or tablets) as an alternative, particularly when the availability of protein-rich foods is limited. Where possible, ultra-marathon runners should strive to meet the typical dietary guidelines by consuming ~ 20–30 g of protein every 3 h [69].  The central fatigue hypothesis Another means by which amino acid supplementation might provide an advantage during ultra-marathon racing is in offsetting central fatigue. Prolonged exercise increases the synthesis and metabolism of 5-hydroxytryptamine (5-HT; serotonin) in the brain, which is associated with lethargy, drowsiness, and reduced motivation [108].",cc4b1e73-d489-4973-ab58-a300e8386ea3
58,background61," Critically, tryptophan (the 5-HT precursor) competes with BCAAs to cross the blood-brain barrier [109], with the hypothesis that increasing the circulating concentrations of BCAAs might mitigate 5-HT accumulation, attenuate the seretonin:dopamine ratio [110], and potentially offset central fatigue. Indeed, athletes showed reduced effort perceptions when BCAAs were supplemented during submaximal cycle exercise performed in a glycogen-depleted state [111]. Moreover, when trained cyclists undertook several hours of exercise in the heat to exacerbate the central component of fatigue, BCAA supplementation prolonged time to exhaustion [112]. It is feasible that the role of BCAAs in offsetting central fatigue may be further pronounced during the extreme-distance ultra-marathons, the conditions of which are rarely replicated, and difficult to perform reliably, in a laboratory environment.",a26ab58b-6244-4b27-bcf8-e06bfc4e647e
59,background62," The effect of BCAAs on central fatigue is far from certain, and further studies specific to ultra-marathon running are needed to elucidate the mechanisms that might underpin any beneficial effects.  Savory vs. sweet A key consideration for the ultra-marathon runner should be the palatability of food (and fluid), particularly in longer races. Moreover, tastes and food preferences will likely change throughout the course of the race [113]. There are several reports of runners complaining of the unpalatability of sweet foods, particularly energy gels and sports drinks, both in the heat [114] and in ultra-marathons > 60 miles contested in thermoneutral environments [115, 116]. These data indicate that the aversion to simple carbohydrate (CHO) is not exclusively dependent on ambient conditions but is also influenced by race distance and/or duration.",5a864092-ac6f-4815-bd2f-533f83670094
60,background63," The mechanisms underpinning the proclivity for high-fat/salty foods are unclear, but it has been speculated that athlete food preferences are made to maintain a consistent chemical balance in the body [115]. In the aforementioned studies, runners tended to exhibit a penchant for savory food (i.e., flavoursome, non-sweet, and containing greater relative amounts of fat and salt) in the latter stages of ultra-marathon, thereby supporting the notion that changes in food preference may reflect nutrient inadequacies resulting from long-duration activity. An important consideration is to what extent one must rely on food provided by organizers at pre-determined checkpoints, given that the nature of such food is unpredictable and may be in limited supply. Accordingly, it is recommended that runners anticipate food availability, and carry their own food to more accurately fulfil their individual needs.",16adbaec-d576-4b7c-a78f-9c73462209fa
61,background64," Finally, race organizers are encouraged to provide a variety of foods at checkpoints (including a mixture of proteins, carbohydrates, and fats; see Table 4), and to publish in advance the list of foods to be served at feed-stations, so as to aid athletes in their race preparation. In longer races (> 50 miles / 80 km) that require athletes to skip multiple meals, organizers should consider providing at least one hot, calorie-dense meal served at a strategic point in the race. This will break the monotony associated with repetitive feed stations, and afford the runner an opportunity to mitigate caloric deficits that will likely accumulate.  Evidence statement (category C) Athletes should follow a contemporary carbohydrate (CHO)-loading approach in the 48 h prior to racing in order to commence fully-replete. Calorie deficits during racing are expected but can be minimized by consuming 150–400 Kcal·h− 1, pending differences in body mass, race distance/pace, and individual gut tolerance.",c27f0c1a-4ca3-4ed6-a7cc-060eb2524c43
62,background65,"  Evidence statement (category C) Calories should be consumed from a combination of protein (5–10 g·h− 1), carbohydrate (CHO) (30–50 g·h− 1), and fat; however, foods with greater fat content may be preferred in longer races.  Evidence statement (category D) As race duration increases, runners tend to favor savory foods, likely reflecting energy and electrolyte insufficiencies.  Offsetting dehydration Thermoregulation during exercise is largely dependent on the mammalian sweat response to evoke evaporative heat loss. Insufficient fluid replacement, therefore, results in a net loss of body water, the main consequence of which is dehydration-induced cardiovascular drift; i.e., a reduction in plasma volume and a necessary increase in heart rate to maintain cardiac output [117]. The result is a diminished exercise capacity [118], and an increased risk of heat illness and rhabdomyolysis [118]. Dehydration may also diminish cognitive performance [11, 118] and increase perceived exertion [119].",4df8bd42-3214-4ec4-a6c2-2e6527999272
63,background66," All of the above may compromise performance and exacerbate the risk of injury and/or illness during ultra-marathon, particularly in arduous races, those requiring navigation, or those contested on technical terrain. Although dehydration can result from running in cold conditions due to a blunting of the thirst response, dehydration is more of a risk during races in hot and/or humid conditions when sweat rates are increased [120]. Moreover, consideration should be given to whether hot ambient conditions are dry or wet since the latter will compromise evaporative heat loss, increase fluid requirements, and increase the risk of heat illness.  Drinking-to-thirst is an acknowledged means of maintaining hydration during short-duration exercise (<90 min), when environmental conditions are cool, and/or when exercise intensity is low (e.g., < 60% V̇O2max) [121].",48faf22f-0100-435d-bd4b-418395a5180b
64,background67," Moreover, this strategy is considered the most appropriate method of minimizing the risk of hypo- or hyper-hydration during ultra-marathon [16]. However, given that most athletes choose to consume electrolyte formulas by ingesting fluids, drinking-to-thirst may result in the under-consumption of sodium and other vital electrolytes. In long-distance ultra-marathons, the most common hydration plan is drinking according to an individualized schedule [122]. Moreover, finishers tend to consume fluid at a greater rate than non-finishers [92]. Mean fluid ingestion rates of ~ 0.5 L·h− 1 have been observed during a road ultra-marathon of 62 miles (100 km), with a broad range in the total volumes consumed (3.3–11.1 L) [123]. Slightly higher ingestion rates of ~ 0.75 L·h− 1 have been reported in races of 100 miles (161 km [92]).",63240220-a195-4982-b31e-efe7d694aa59
65,background68," Collectively, the available data suggest that there are broad individual intakes among ultra-marathon runners, but that successful runners tend to meet the lower-limits of recommended values.  Fluid ingestion that results in diluted plasma sodium may be indicative that runners are not meeting their sodium needs [92]. Over-hydration, and the consequent dilution of plasma sodium, can have severe adverse effects on health (see Exercise-associated hyponatraemia), and there are case-reports of water intoxication in runners who aggressively rehydrate [124]. Runners contesting ultra-marathon should aim to consume 150–250 mL of fluid approximately every 20 min during exercise [31, 125], but fluid intake should be adjusted pending environmental conditions, race duration, work rate, body mass, the degree of fluid tolerance, and prior gut training. Individuals wishing to optimize performance should determine their individual sweat rates, in advance, under conditions which resemble competition (i.",55008f78-5eb5-41cc-8bf5-79a9169918b8
66,background69,"e., a similar exercise intensity, terrain, environment) [121]. An accessible means of estimating sweat rate is to measure nude body mass pre- and post-exercise; this will allow for an individualized fluid ingestion strategy.  Exercise-associated hyponatraemia (Exercise associated hyponatraemia (EAH)) Sodium is the major ion of the extracellular fluid and contributes to the generation of action potentials for muscle contraction, but it also has an important role in fluid retention [118]. Hyponatraemia, a potentially fatal condition of cell-swelling, is clinically-defined as a serum sodium concentration < 135 mmol·L− 1. Modest symptoms include headache, fatigue, and nausea, but can result in seizures and death in severe cases [9]. Two key, interrelated mechanisms are responsible for hyponatraemia: i) excessive sodium loss from the extracellular fluid resulting from a high sweat rate (e.g., while exercising in the heat) and prolonged sweating (e.g.",bf04ab3d-9bd8-4d6f-b52b-991721824164
67,background70,", during long-duration exercise); ii) aggressive hydration strategies using non- or low-electrolyte-containing fluids, which precipitate overload of the extracellular fluids, thereby diluting serum sodium [9]. Although the condition is rare, and individual susceptibility plays a role in prevalence, the earliest reported cases were observed in ultra-marathon runners and Ironman triathletes [9] (i.e., during ultra-endurance exercise), and the athletes most commonly developing symptomatic hyponatremia typically participate in distance running events of > 26.2 miles (> 42.2 km) [126].  In order to reduce the risk of hyponatremia during long-duration exercise, runners should consume sodium in concentrations of 500–700 mg·L− 1 of fluid [118]. Slightly greater amounts of sodium (and other electrolytes) will be required in hot (e.g., > 25 °C / 77 °F) and/or humid (e.g.",f999e13c-5080-4af7-a66f-4244c470c2b0
68,background71,", > 60%) conditions when sweat rates are elevated; in such conditions, runners should target ~ 300–600 mg·h− 1 of sodium (1000–2000 mg of NaCl). If consumed in fluid, sodium concentrations greater than ~ 1000 mg·L− 1 (50 mmol·L− 1) should be avoided as this may reduce drink palatability [127]. Indeed, there is anecdotal evidence that effervescent (dissolvable) electrolyte tablets, and liquid electrolytes added to water, can compromise drink palatability, particularly during long races or those contested in the heat, thereby resulting in reduced fluid consumption. As such, capsules or tablets that can be swallowed whole are recommended, thus leaving water untreated. The amounts taken should also be offset against the sodium consumed from salt-containing foods, although it should be noted that it is unlikely that the recommended rate of sodium intake will be achieved from foods alone. In addition, the concentrations of some electrolytes (e.g.",d6298de0-a98e-4362-9ea2-235da5bfa551
69,background72,", sodium) in many commercially-available electrolyte replacement products are insufficient to meet the recommended intakes. As such, runners are encouraged to pay close attention to the ingestion method and composition of their electrolyte formula.  Given the inherent risks associated with Exercise associated hyponatraemia (EAH), greater care should be taken to educate ultra-marathon runners on its deleterious consequences. For example, there are data to suggest that although sodium ingestion may help attenuate the likelihood of developing Exercise associated hyponatraemia (EAH), sodium intake is not sufficient for this purpose when simultaneous with excessive fluid ingestion [89]. As a result, runners sometimes adopt a low-volume drinking plan instead of increasing sodium intake congruent with their needs [122]. Such poor practice must be challenged, since it is possible to consume adequate amounts of both fluid and sodium during prolonged exercise, with sufficient practice.",6c7d0c6c-6180-4675-bdb4-975d9500314e
70,background73,"  Evidence statement (category C) Fluid volumes of 450–750 mL·h− 1, or 150–250 mL every 20 min, are recommended during racing. Electrolyte concentrations (particularly sodium) from commercial products may not be sufficient for optimal hydration, especially in hot/humid conditions, and additional sources of sodium should be considered with the aim of ingesting 500–700 mg·L− 1.  Gastrointestinal (GI) distress A common cause of non-completion and/or reduced performance in ultra-marathon racing is GI discomfort or distress. A conservative estimate is that 30–50% of athletes experience GI-related issues during ultra-marathon [128], although values of 70–80% have been reported [129, 130]. The type, duration, and severity of symptoms vary on an individual basis, with upper GI-tract related issues (e.g., nausea, vomiting, heartburn) more common in longer races compared with complaints relating to the lower GI-tract (e.g., bloating, diarrhea) [115].",220c8bcb-4fd3-4812-ba7c-d0033742297a
71,background74," In a large cohort of males and females (n = 272) competing in the Western States Endurance Run (100 mile; 161 km), the majority of athletes (96%) experienced GI symptoms at some point during the race, particularly at the hottest and likely most challenging part of the course, with 44% indicating that GI issues negatively impacted race performance. Nausea was cited as the most common symptom likely to affect race strategy (reported in 60% of athletes) [130], perhaps due to the subsequent impact on the ability to ingest food and fluid.  The pathophysiology of GI distress during ultra-marathon training and racing is multifactorial, but is likely the result of reduced mesenteric blood flow [131, 132], leading to relative GI hypoperfusion [133]. This is often predicated by dehydration and/or increased core temperature, which can further compromise gastric emptying and paracellular transport [134].",f56e330c-6ed2-4ecd-83db-44645043c4dd
72,background75," An increased appearance of systemic lipopolysaccharides (lipopolysaccharides (LPS)) from gram-negative intestinal bacteria may result from acute intestinal tight-junction protein disruption, thereby provoking an immune response, as well as endotoxin-mediated GI distress [134]. In one study, 81% of runners requiring medical attention at the end of a 56 mile (90 km) ultra-marathon (Comrades Marathon, South Africa) were reported to have lipopolysaccharides (LPS) concentrations exceeding 100 pg·ml− 1 [135], with 81% reporting both upper- and lower-GI distress (nausea, vomiting, and diarrhoea). While such post-race endotoxin concentrations are considered severe in athletes, other researchers have noted a ‘bi-phasic’ endotoxin response in 68% of athletes competing in an Ironman triathlon, which corresponded with acute recovery phase cytokinemia [136].",72e0541f-43b7-4a07-be3d-3b25565b6837
73,background76," This ‘low-grade endotoxemia’ may, in part, influence individual recovery responses during the short-term (<12 h) and chronic (>36 h) post-race period.  Strategies to minimize GI distress Symptoms pertaining to exercise-associated GI distress are highly individualized and may be related to predisposition, intestinal microbiome activity (based on bacterial quantity and species diversity), and feeding tolerance [137]. The primary nutritional cause of GI upset during ultra-marathon is the high intake of carbohydrate (CHO), particularly hyperosmolar solutions (e.g., > 500 mOsm·L− 1 and > 8% carbohydrate (CHO) concentration) [128]. Runners experiencing upper-GI discomfort were reported to have a greater energy and carbohydrate (CHO) intake than runners not experiencing symptoms [115]. This supports the notion that high rates of carbohydrate (CHO) ingestion, although being beneficial for race completion, might actually exacerbate symptoms of GI distress.",0129b339-081d-49ce-b978-b2096e6fe904
74,background77," In addition, strategies that could mitigate the likelihood of lipopolysaccharides (LPS) release into the blood and, thus, endotoxin-associated symptoms, include limiting the consumption of saturated fat [138], avoiding the consumption of non-steroidal anti-inflammatory drugs (NSAIDs) [139], and maintaining an adequate water intake [139].  The use of ‘multiple transportable carbohydrate’ solutions (i.e., those containing glucose, fructose, and/or maltodextrin) has been shown in trained individuals to increase overall intestinal absorption, facilitate increased total carbohydrate (CHO) oxidation rates, and limit the degree of gut discomfort typically observed with single carbohydrate (CHO) solutions (e.g., fructose) [104, 140].",bef0c7ff-2913-4c1a-8f45-094e5c90a7ec
75,background78," Although many ultra-marathon runners rarely rely solely on sports drinks for energy and/or carbohydrate (CHO) intake during racing, use of solutions with multiple transportable carbohydrates may be an effective short-term strategy to limit the likelihood of non-completion due to energy under-consumption. Recognizing the early onset of GI distress, and strategizing to maintain energy intake close to target values regardless, may be the key to managing some GI-related issues. Although counterintuitive, there may be some instances when eating regardless of nausea will give the most relief from such symptoms, especially when nausea is caused by hypoglycemia.  Prior race strategies that either ‘train the gut’ or include/omit some food groups may provide a solution to limit the negative impact of GI symptoms during racing. While ultra-marathon training may elicit progressive behavioral changes (e.g.",a1d18447-cfc3-4b19-803b-ee6c88f2976f
76,background79,", greater confidence in trialing personalized nutrition strategies) and physiological adaptations (e.g., increased intestinal tight-junction integrity and enhanced immunological response to endotoxin release [135]), targeted nutrition strategies may confer a degree of individual benefit. It is apparent that well-trained athletes can tolerate higher intakes of carbohydrate (CHO) during running [128], and that habituation to a high carbohydrate (CHO) diet enhances total carbohydrate oxidation rates which may be important for sustained race performance [141] and reduced GI upset. Where symptoms of irritable bowel syndrome (irritable bowel syndrome (IBS)) are present, practicing a low fermentable oligiosaccharide disaccharide monosaccharide and polyol (FODMAP) (fermentable oligosaccharide, disaccharide, monosaccharide and polyol) diet has been shown to reduce GI distress acutely [142, 143].",f3fd8697-4111-4b16-906d-25e4d081e50b
77,background80," While responses to low fermentable oligiosaccharide disaccharide monosaccharide and polyol (FODMAP) diets may be highly individual, strategic implementation (under guidance of a qualified nutrition professional) in the days preceding a race, or during training when acute symptoms occur, may confer GI support. Nevertheless, further research is warranted to confirm whether such benefits are applicable during sustained running.  Finally, the use of probiotic bacteria, particularly including the gram-positive genera Lactobacillus and Bifidobacterium species, has been shown to modify GI microbiota [144] and may provide an adjunct nutritional strategy in cases pertaining to acute GI disruption (e.g., GI dysbiosis, exercise-associated GI permeability). There is evidence of reduced GI symptom prevalence and severity following the administration of probiotics [145, 146] although benefits may be individualized and strain-specific.",2dcc449f-ae12-4012-a6e1-3421b42fa30b
78,background81," Recently, 4 weeks of supplementation with Lactobacillus acidophilus (CUL60 and CUL21), Bifidobacterium bifidum (CUL20), and Bifidobacterium animalis subs p. Lactis (CUL34) was shown to reduce GI symptoms, and may be associated with the maintenance of running speed in the latter stages of marathon [147]. Chronic multi-strain interventions have also been shown to reduce fecal zonulin levels by ~ 25% in endurance-trained athletes, attributed to improved GI epithelial integrity [148]. The inclusion of dietary prebiotic nutrients (e.g., fructooligosaccharides, inulin, pectin) may also play an important role in short-chain fatty acid production, which may support epithelial integrity (for review, see [149]). The use of pre/probiotics has, however, been contested [105] and, at present, there is limited evidence of a beneficial effect in ultra-marathon racing; as such, caution is recommended before implementing a new strategy.",a9636e58-c9ab-4fd5-8571-9162bf058f57
79,background82,"  Evidence statement (category B/C) Symptoms of upper-GI distress, particularly nausea, are commonly reported during ultra-marathons, are a cause of non-completion, and are more prevalent in longer races.  Evidence statement (category C) To mitigate GI distress, runners should avoid highly concentrated carbohydrate (CHO), and minimize dehydration. When symptoms manifest, runners can slow their pace and decrease their calorie intake, although persistent intakes of < 200 Kcal·h− 1 should be avoided in longer races.  Evidence statement (category B) Nutritional strategies should be practiced in training, well in advance of racing, to allow sufficient time for GI adaptations that optimize carbohydrate (CHO) absorption, and mitigate GI distress.",bb093093-31fa-41d6-b41f-7d1f591730f2
