,chunk_label,chunk_text,uuid
28,background30,"  Protein and muscle damage Prolonged or strenuous exercise, particularly that to which the individual is unaccustomed, can result in muscle damage attributed to metabolic overload and/or mechanical strain [56]. Moreover, nitrogen balance can remain below baseline for several days following unaccustomed exercise [57]. The substantial training distances of ultra-marathon are associated with high levels of mechanical stress. This is reinforced by empirical data showing that whole-blood markers of muscle breakdown (e.g., creatine kinase, lactate dehydrogenase, and serum creatine phosphokinase) were higher following ultra-marathons when compared to marathons run at a relatively faster pace [58, 59]. Specifically, creatine kinase concentrations of 274 ± 71 U·L− 1 were observed post-marathon, relative to 2983 ± 1716 U·L− 1 following a 100 km race, and 4970 ± 2222 U·L− 1 after a 308 km race [58].",189b3259-21e6-4830-92cf-f595d54cfd32
29,background31," These data suggest that race distance and/or duration mediate muscle damage more than race intensity, although duration is not the sole determinant of muscle damage during ultra-marathon [60]. The environmental terrain typical of ultra-marathon also deserves consideration in the training program. Downhill running (on mountainous or undulating paths) is associated with greater peak flexion angles relative to level or uphill running; this exaggerates the eccentric component of impact-loading, thereby increasing muscle damage [56]. Indeed, muscle damage resulting from a single bout of downhill running can result in a shortened stride-length in subsequent efforts [61], and this may be pertinent for runners training on consecutive days.  Some authors suggest that the muscle damage and metabolic stress associated with 100 km ultra-marathons, and equivalent exhaustive efforts, represent a danger to human health [62], causing possible hepatic damage which warrants further study [60].",dc3cc4e3-bfe8-4d37-975b-0e623e2ac3bc
30,background32," As such, although prior conditioning of the musculoskeletal system is critical for successful participation in ultra-marathon, participants should be mindful of nutritional strategies which may mitigate muscle damage and the associated inflammation during the training period. Satisfying metabolic demand for protein is, therefore, a prerequisite for both recovery and general health.  Protein dose and timing Contemporary guidelines for athletes engaged in chronic endurance training suggest dietary protein in the amount of 1.2–2.1 g·kg− 1·d− 1 in order to support positive nitrogen balance and metabolic requirements [42, 63]. Current evidence indicates that protein intakes of less than 1.6 g·kg− 1·d− 1 may result in a negative nitrogen balance in endurance athletes who have high training demands [35]. Furthermore, amounts exceeding 2.",5c2d6656-2f23-4868-8528-574bc284069f
31,background33,"1 g·kg− 1·d− 1 are unlikely to have additive effects on muscle protein synthesis, although the protein contribution to energy metabolism (and other structural/functional processes) may be greater in ultra-marathon runners engaged in very high-mileage training. This may, in turn, necessitate slightly higher intakes [64]. Higher protein amounts are also required when carbohydrate (CHO) and/or caloric intakes are low or insufficient [65]. A 20 g bolus of whey protein appears sufficient to maximize fractional synthetic rate after resistance exercise [66], with up to 30 g appropriate for larger athletes (>85 kg). Runners should also be mindful that protein needs may be higher in older adults [67, 68]. With respect to timing, an intermediate protein feeding strategy (~20 g every 3 waking hours) is more effective at stimulating muscle protein synthesis than pulse-feeding (~10 g every 1.5 h), or bolus-feeding (~40 g every 6 h) [69].",1b48117f-3ef5-42fa-8d62-401a9251a460
32,background34," During chronic training, protein ingested before sleep appears to be an effective strategy to increase muscle protein synthesis overnight (for review, see [70]). Ultra-marathon runners who struggle to meet their protein needs through dietary means might choose to supplement, perhaps using whey protein due to its high bioavailability and complete amino acid profile [63].  Selected amino acids The branched-chain amino acids (BCAAs) have been the focus of study for many years. An acute bout of prolonged exercise increases the rate of BCAA oxidation in skeletal muscle [71], suggesting that demands in ultra-marathon runners may be greater, but chronic training significantly attenuates the absolute rate of BCAA oxidation during exercise [71]. Therefore, the primary utility of BCAAs may be in muscle recovery and immune regulation during periods of hard training and racing [72, 73], particularly when consumed in the post-absorptive state [74].",5302971e-f2ca-4ed8-9402-04a858bf8ac1
33,background35," Although meeting absolute protein demand is critical for the ultra-marathon runner, the literature suggests that L-leucine may support the upregulation of muscle protein synthesis, influencing mRNA translation and the mTOR cell-signalling pathway [75]. Although there are no existing studies on the efficacy of L-leucine specifically for ultra-marathon runners, there are reports that a 3–6 g daily dose of L-leucine might be beneficial for those engaged in strenuous endurance and/or resistance training [75]. Furthermore, L-leucine (5g) consumed with a small amount of whey protein (6g) may be as effective at stimulating muscle protein synthesis as a 25 g bolus of whey protein, although the latter may be more practical [76].  Evidence statement (category B/C) Protein intakes of ~ 1.6–2.1 g·kg− 1·d− 1 are sufficient to optimally simulate muscle protein synthesis, which will likely support recovery from training. Intakes of up to 2.",2ad2f9b7-8c58-4954-9ae1-441231ee2a5f
34,background36,"5 g·kg− 1·d− 1 may be warranted during demanding training periods (when caloric requirements may be substantially greater), or when carbohydrate (CHO)/caloric intake is insufficient.  Evidence statement (category B) An intermediate protein feeding strategy of ~20 g every 3 waking hours may provide an optimal strategy to stimulate muscle protein synthesis for ultra-marathon runners.  Daily hydration guidelines A typical training session for the ultra-marathon runner appears sufficient to cause substantial dehydration. Over the half-marathon distance (13.1 miles), mean sweat losses of ~1.4 L were observed in male runners and, when offset against fluid ingestion during exercise, resulted in net fluid losses of ~ 0.3 L [77]. Over longer training distances (marathon), high-level runners exhibited a body weight loss of 0.3 and 1.7%, in cool and warm conditions, respectively, even when consuming fluid at a rate of 1 L·h− 1 [78].",94b6745f-63ca-4612-a5da-d395d2c46b01
35,background37," Furthermore, abstaining from fluid resulted in an average dehydration of 3.3 and 5.3%, respectively [78]. Notwithstanding the commonly-reported effects of mild dehydration on subsequent exercise performance, chronic dehydration can influence health outcomes, with several authors noting dehydration-mediated changes in vasopressin, and markers of metabolic dysfunction or disease [8]. To mitigate carry-over effects from one session to the next, and to maintain general health, there are two components of hydration that warrant consideration in the periodized nutrition program: 1) hydration strategies to facilitate post-exercise recovery; and 2) day-to-day hydration requirements that are independent of training.  Post-exercise fluid intake When recovery time is short, or the extent of fluid loss is great, thirst-driven fluid intake is not adequate to restore water balance [79]. Targeted fluid replacement strategies are, therefore, critical to maximize recovery before a subsequent session.",28c84a1a-e1a6-4420-9445-dbc91fe501c9
36,background38," It stands to reason that runners should replenish the fluid volume lost in training; this can be estimated via pre- to post-exercise body mass weighing. However, even in a hypohydrated state, the obligatory excretion of metabolic waste products allows for continued fluid losses [80]. Consequently, a fluid volume greater than that lost in training is necessary to fully restore water balance. This notion has been demonstrated empirically by both Shirreffs et al. [80] and Mitchell et al. [81], who reported that a low-sodium drink consumed at a volume of 150% of exercise-induced body mass loss resulted in enhanced hydration relative to an identical concentration consumed at 100% body mass loss. Greater fluid volumes up to 200% body mass loss may only lead to greater post-exercise hydration when consumed with higher concentrations of sodium (61 mmol·L− 1; 1403 mg·L− 1) [80], but fluid volumes above this are not recommended.",94416a2f-1564-4b3b-96d8-d28bc9220226
37,background39," As these data indicate, plain water is not likely sufficient to restore fluid balance following training due to the consequent decrease in plasma sodium concentration and osmolality [82] causing diuresis. Unequivocally, post-exercise urine output decreases as the drink sodium concentration increases; sodium intake should, therefore, ideally equal the concentration of sodium lost in sweat. The sodium content of commercial sports drinks (~20–25 mmol·L− 1; 460–575 mg·L− 1) is lower than that typically lost in sweat [83, 84] and should, therefore, be considered a conservative target. There is little research on the suggested rate of fluid intake, but the available data indicate that slow consumption (i.e., over several hours) will maximize the effectiveness of a rehydration strategy.",9fe45e31-f81f-48f0-bcf5-9db642cf7b53
38,background40,"  Day-to-day fluid intake The actual fluid intake necessary to attain euhydration on a day-to-day basis will vary with renal and extrarenal water losses [85]; moreover, the absolute daily fluid intake (from food and drink) will vary widely among individuals. There are also daily fluctuations in total body water, estimated by Cheuvront et al. to have an upper-limit of ±1% of body weight (i.e., 0.6–0.9 kg in an adult of 60–90 kg) [86]. Interestingly, using biochemical measures of blood and urine, average plasma osmolality was found to be similar between groups of low-volume (1.2 L·d− 1) and high-volume (2–4 L·d− 1) drinkers [8]; it is possible, therefore, to attain euhydration with a range of fluid intakes. Indeed, elite Kenyan endurance runners have been shown to exhibit a euhydrated state when consuming fluid ad-libitum [87].",95bf2da4-26b6-46b4-b05b-d70f5004bc4b
39,background41," Moreover, given the sensitivity and reliability of the human thirst sensation to denote dehydration [79], it is reasonable to suggest that drinking-to-thirst is appropriate for responding to daily hydration needs. There are individuals with relatively high plasma osmolality thresholds for thirst [88], which can lead to chronic deviations from a euhydrated state. Accordingly, the thirst sensation may only be appropriate in instances of acute dehydration. For the ultra-marathon runner, hydration monitoring strategies are recommended (see Hydration monitoring strategies). In addition, overuse of fluids that contain insufficient concentrations of electrolytes (e.g., water or hypotonic sports drinks) may cause overhydration, decreased electrolyte concentrations, an increased risk of dilutional hyponatremia, and/or failure of the renal system [89] in extreme cases.",1064863b-cff6-49e2-b083-aeaa68fd3565
40,background42," Ultra-marathon runners are, therefore, cautioned against excessive fluid intakes to placate pseudoscientific claims that high fluid volumes are needed to ‘flush the kidneys’ or ‘remove toxins from the blood’.  Hydration monitoring strategies Only an estimated 20% of endurance runners monitor their hydration status [90]. Although direct measures such as urine osmolality are rarely practical for most individuals, there are several simple and accessible tools that can be used to estimate hydration status. The urine color chart is the most common means of estimating hydration status in runners [90]. This simple technique involves the periodic assessment of urine color, whereby ‘pale-straw’ would indicate that the individual is well-hydrated (assuming this is not measured post-ingestion of a large bolus of fluid).",b4357e68-7fc3-49f4-802f-beb731555167
41,background43," The Venn diagram proposed by Cheuvront and Sawka [91] is a more sophisticated tool (appropriate for healthy, active, low-risk populations) which estimates hydration status by combining measures of nude body mass, thirst perception, and urine color.  Evidence statement (category B/C) General day-to-day hydration can, in most instances, be achieved by following a drink-to-thirst (ad libitum) strategy.  Evidence statement (category A/B) To inform post-training rehydration strategies, athletes should measure pre- to post-exercise body mass losses, and monitor their hydration status.  Evidence statement (category A/B) After key training sessions, ingesting a fluid volume greater than that lost (150%) is necessary to restore water balance. Simultaneously, at least 460 mg·L− 1 of sodium should be ingested, either in food or as a supplement.",8687b78b-c446-45e9-a7a2-ec5c2c2ae714
42,background44,"  Considerations for racing Energy and macronutrient demands Energy expenditure Given the durations typical of ultra-marathon, it is not feasible to meet caloric demands in their entirety. Several scenarios can be examined to reinforce this hypothesis. First, consider that a 50 kg athlete undertaking a 50 mile (80 km) race at 8.0 km·h− 1 (~ 10 h) will expend ~ 3460 Kcal. For the same event contested at the same pace, a 70 kg athlete would expend ~ 4845 Kcal (an approximate Kcal range of 346–484 Kcal·h− 1). Second, a 50 kg athlete undertaking a 100 mile (161 km) ultra-marathon at an average pace of 6.5 km·h− 1 may expend ~ 6922 Kcal in ~ 25 h, whereas at the same pace, a 70 kg athlete would likely expend ~ 9891 Kcal (range of 277–395 Kcal·h− 1). These values are similar to the estimated energy expenditures of 200–300 kJ·km− 1 (47.8–71.7 Kcal·km− 1) reported elsewhere [31].",47e8b1bd-97a3-4b01-bf70-ccbd292e1d5c
43,background45," When offset against the energy intakes observed in a typical ultra-marathon, runners are likely to exhibit a net calorie loss [92]. Accordingly, in addition to implementing an in-race nutrition strategy, an effort should be made to minimize caloric deficits before and after the race, and should be considered part of the overall holistic approach. Indeed, carbohydrate (CHO) availability for racing can be maximized by adhering to a contemporary loading strategy (i.e., ~10 g·kg− 1·d− 1) in the 48 h leading into the event [42, 44], with care taken to avoid GI distress. On race-day, runners are advised to consume a familiar, easily-digestible pre-race meal, rich in low-glycemic index carbohydrate (CHO), while avoiding food with high fat and/or fiber content to minimize gut discomfort during the race.",0b2a7a0a-4a23-4fbe-a487-9342713bb1d8
44,background46,"  Energy intake Field studies indicate that successful completion of ultra-marathon is generally associated with greater energy and fluid intake [14, 15], even when accounting for variations in performance time [15]. A nuance of the longer distance event is that the lower average work rate permits a faster rate of gastric emptying, which tends to be compromised only at exercise intensities > 70% maximal oxygen uptake (V̇O2max) [93]. Consequently, relative to shorter races contested at a higher intensity, ultra-marathon runners can usually accommodate greater energy intake and more calorie-dense foods to the level of individual tolerance [94].  There is variability with respect to the absolute rate of energy intake reported during racing, but a sensible range can be determined. In 213 runners contesting one-of-three race distances (44, 67, or 112 km; Ultra Mallorca Serra de Tramuntana; Spain), mean energy intake was 183 Kcal·h− 1, with no discernible difference among race distances [95].",52e8d007-7b72-4cd7-b99e-bedd431723e1
45,background47," By contrast, in longer races (100 mile, 161 km), caloric intakes of < 200 Kcal·h− 1 tended to result in race non-completion [15], with race finishers consuming a significantly greater number of hourly calories when compared to non-finishers (4.6 ± 1.7 versus 2.5 ± 1.3 Kcal·kg− 1·h− 1). These findings have been reported elsewhere under similar race conditions [92]. Moreover, elite runners contesting a series of sixteen 100 mile (161 km) ultra-marathons, reported average energy intakes of 333 ± 105 Kcal·h− 1 [96]. Greater caloric intakes may, therefore, be necessary for longer races to enable performance.  Based on previous estimates of energy expenditure during running, and the above-mentioned research, the International Society of Sports Nutrition (ISSN) recommends a caloric intake of ~ 150–300 Kcal·h− 1 for race distances up to and including 50 miles (~ 81 km) during which any caloric deficits may be better tolerated.",3a93544a-1350-466c-9234-b2b16566dbb0
46,background48," By contrast, in longer races when the magnitude of caloric deficits is greater and less likely to be well-tolerated, higher intakes of ~ 200–400 Kcal·h− 1 are suggested. Where GI distress is an issue, transient reductions in energy intake to the lower-end of this range are reasonable, congruent with a reduction in race pace. However, persistent calorie intakes of < 200 Kcal·h− 1 are not recommended, and when nausea precludes this rate of intake, a degree of perseverance/stubbornness with respect to feeding (within tolerance levels) may be required. This may be particularly pertinent in the latter stages of a race in order to minimize the risk of hypoglycaemia which can result in race non-completion, and reinforces the importance of progressive gut training during the preparation phase [97].",965f4ac9-0cdb-4b61-ab96-7ddd7dfd19ff
47,background49,"  Carbohydrate versus fat intake The mechanistic link between glycogen depletion in skeletal muscle and liver, and a subsequent early-onset fatigue during prolonged exercise was made in the 1960s [98]. In addition to negatively impacting endurance performance, the reduction in plasma glucose concentration that follows glycogen depletion is associated with acute cognitive decline; this, in turn, can compromise athlete safety on ultra-marathon courses of technical terrain or those requiring navigation. Nevertheless, the absolute carbohydrate (CHO) requirements for ultra-marathon racing are unclear. There is certainly a lower rate of carbohydrate (CHO) utilization during ultra-marathon relative to marathon.",28a834b9-721b-4baf-8a6b-6d6baf6f87d0
48,background50," Laboratory data demonstrate that respiratory exchange ratio (respiratory exchange ratio (RER)) gradually decreases until the 8th hour of a 24 h treadmill run, and plateaus thereafter, reflecting a reduced rate of energy derived from carbohydrate (CHO); moreover, this is congruent with a diminished running velocity [99]. As muscle glycogen diminishes, there is a compensatory increase in fat oxidation, with rates of 0.2–0.5 g·min− 1 typically observed during endurance exercise [100], and higher values of 1.0–1.5 g·min− 1 reported in a single subject after 6 h of running [101, 102]. The prolonged durations and slower relative running speeds that characterize ultra-marathon appear, therefore, to permit increased rates of fat oxidation for adenosine triphosphate (adenosine triphosphate (ATP)) re-synthesis [100]. However, there is still a risk of glycogen depletion during ultra-marathon if work rate is too high, or if nutrition is poorly managed.",ee2c8fd9-e4ef-44e9-9ab4-5c2adeced8eb
49,background51," Worthy of note is that extremes of both temperature and altitude will increase the absolute rate of carbohydrate (CHO) oxidation during exercise [102], and the nutrition strategy should accommodate these variations.  With respect to the absolute amounts of carbohydrate (CHO) and fats to be consumed during ultra-marathon, individual strategies vary greatly. There are reports that amateur runners contesting races of up to 70 miles (112 km) ingested carbohydrate (CHO) at a mean rate of 30 g·h− 1 [95]. In longer races (100 miles, 161 km), similar rates of carbohydrate (CHO) ingestion may be typical for slower finishers (31 ± 9 g·h− 1 [103];), both of which were lower than faster finishers (44 ± 33 g·h− 1); these data reinforce the notion of broad variance in the strategy used pending race pace or duration. Over the same distance, others report greater carbohydrate (CHO) intakes of 65.8 ± 27.0 g·h− 1 (range: 36–102 g·h− 1 [15];) compared to 41.5 ± 23.2 g·h− 1 for non-finishers (range: 13.",124e3592-7eae-4b1b-89cf-64df91fd7491
50,background52,"8–83.8 g·h− 1). When expressed relative to body-mass, finishers consumed nearly double the amount of carbohydrate (CHO) than non-finishers (0.98 ± 0.43 versus 0.56 ± 0.32 g·kg− 1·h− 1). Similar values are reported in elite runners (71 ± 20 g·h− 1) during single-stage races [96]. Although current literature advocates carbohydrate (CHO) ingestion rates up to ~ 90 g·h− 1 for events > 120 min, particularly when using ‘multiple transportable carbohydrates’ containing glucose and fructose [104], such high rates of ingestion may be unrealistic for longer ultra-marathon races (> 6 h). Moreover, this rate of ingestion may lead to nutrient malabsorption and GI distress [105]. Worthy of consideration is that a carbohydrate (CHO) target of 90 g·h− 1 would necessitate a race diet almost exclusively comprising carbohydrate (CHO) (360 Kcal·h− 1) which is typically unsustainable given the greater preference for fat and salt that manifest in longer races.",02698704-9898-406e-9025-3158148272a0
51,background53,"  With increasing race distance, a greater proportion of calories from exogenous fat may be critical for success [95]. Throughout a 100-mile race, finishers consumed a total of 98.1 ± 53.0 g of fat, which was approximately 5-fold greater than that of non-finishers (19.4 ± 21.1 g); moreover, when normalized for body mass and running velocity, this equated to a rate of fat ingestion that was three times greater in finishers (0.06 ± 0.03 versus 0.02 ± 0.02 g·kg− 1·h− 1 [15]). Collectively, these data suggest that successful completion of ultra-marathon likely requires a higher degree of tolerance to both carbohydrate (CHO) and fat intake (either as solids or fluids). Foods with a greater fat content are advantageous during racing in terms of caloric provision per unit of weight, and this is pertinent for minimizing pack weight when running self-sufficient.",9c4aca13-77cb-4cc3-bbce-114e96111a9b
52,background54," Moreover, foods with a greater fat content (see Table 4) often contain more sodium, which may help mitigate the risk of exercise-associated hyponatraemia. Table 4 Example foods consumed by athletesa during single-stage ultra-marathon (35–100 miles, 56–161 km)  Food suggestion/serveb	Energy (Kcal)	carbohydrate (CHO) (g)	PRO (g)	FAT (g)	Na+ (mg)	carbohydrate (CHO)	PRO	FAT	Na+	 Sports drinks (50 g powdered serve)	186	46	0	0	255	✓			✓	 Sports drinks (50 g) with added electrolytes (1 tablet)	186	46	0",d07731ae-ad9b-4a5d-8e19-b375daa5a520
53,background56,"5 g)	113	< 1	5	10	900		✓	✓	✓	 Sports protein bar (64 g)	238	23	20	11	300	✓	✓	✓	✓	 Sports mass gainer bar (120 g)	453	58	30	13	50	✓	✓	✓		 MCT energy bar (45 g)	240	11	10	19	105		✓	✓		 Macadamia nut butter (1 sachet; 28 g)	215	4	2	22	28			✓		 Trail mix (50 g)	224	25	4	11	200	✓		✓		 Salted cashew nuts (50 g)	296	9	11	23	200		✓	✓		 Cheese bites (42 g / 2 portions)	140	0	10	12	320		✓	✓	✓	 Salted potato chips (28 g / 16 chips)	150	15	1	9	150	✓		✓		 Green olives, medium (50 g / 15 olives)	75	3	0	6	285			✓	✓	 aExamples taken from a survey of recreational to elite ultra-marathon runners (n = 12). bBased on typical serving sizes. MCT medium chain triglycerides, carbohydrate (CHO) carbohydrate rich foods, PRO protein rich foods, FAT fat rich foods; Na+ = foods providing relatively greater amounts of sodium (> 250 mg). Amounts are typical serves, based on commercial brands for example purposes only, and will vary pending ingredients and additives.",b1015c30-753b-4d0c-b066-652d47838258
