,chunk_label,chunk_text,uuid
0,introduction0,"Dietary manipulation is an essential component for optimizing the adaptation to physical exercise; therefore, modulating the intake of certain specific nutrients, as is the case with a ketogenic diet (KD), can influence the ability to achieve physical objectives [1]. A KD is based on a marked reduction in carbohydrate consumption (i.e., ≈50 g per day or 10% of total daily caloric intake) and a corresponding increase in dietary fat (≈ 60–80% of total calories) and protein consumption (i.e., ≈ 1.2–1.5 g·kg− 1·d− 1) [2], although protein intake should be even higher during a strength-based training program. This macronutrient distribution leads to an increase in the production of ketone bodies (KB), such as acetoacetate, β-hydroxybutyrate and acetone, and consequently to the state of physiological ketosis (i.e., KB blood levels between 7 and 8 mM and blood pH of ≈7.4) [3].",006381a7-1ea0-4f7c-990d-ff2212c60ca7
1,introduction1," The increase in KB and the subsequent physiological adaptations after following a KD not only have shown positive effects in the reduction of body mass (BM) in obese subjects [4], but also the reduction in blood concentrations of low-density lipoprotein cholesterol, triacylglycerols and glucose while an increase in high-density lipoprotein cholesterol has been reported [5]. Similarly, there is evidence of the benefits of KDs in the treatment or management of neurological diseases such as epilepsy [6–9] and certain types of cancer [10–12]. Therefore, adherence to a KD can be considered part of the therapeutic management of these pathologies.  In the context of physical performance, it can be speculated that KDs do not produce better results than carbohydrate-rich diets, although they could have limited benefits or, at least, not harmful to performance under certain scenarios [13].",92ebd65d-2c09-43d4-a68a-3c0c715b4174
2,introduction2," Thus, a KD conceivably may be a plausible nutritional strategy in specific scenarios, such as: i) during prolonged low-intensity events predominantly reliant on fat oxidation to fuel exercise; ii) during the pre-competition carbohydrate-restriction phase prior to bodybuilding and/or physique competitions when it is advantageous to restrict carbohydrate intake; and/or iii) for individuals who prefer to low-carbohydrate diets [14]. However, recent studies indicate that adherence to KD may impair training adaptations and require additional study [15, 16].  Compared to endurance training, few studies have specifically investigated the effects of a KD on body composition and strength levels in resistance-trained subjects undertaking a resistance training (RT) program. It was previously reported that an eight-week RT program accompanied by a KD reduced fat mass (FM) and preserved fat-free mass (fat free mass (FFM)) in trained men [17].",0135306f-ebf8-497a-b0c2-e78da605dae2
3,introduction3," Similarly, other studies have shown favorable changes in body composition (↑ fat free mass (FFM) and ↓ FM), strength and total testosterone [18]. However, these investigations have been conducted in men. Research investigating the effects of a KD on changes in body composition and cardiovascular risk markers are even less in women, and generally performed with no RT component and with obese and untrained female population [19, 20]. For instance, Jabekk et al. [21] reported positive changes in body composition (FM reduction and preservation of fat free mass (FFM)) during a KD intervention in conjunction with RT in overweight women. Gregory et al. [22] also showed reductions in FM while fat free mass (FFM) was maintained during a cross-training program in non-elite trained individuals (mostly women).",3632a214-8908-4296-8518-61b086677cad
4,introduction4," Even though many studies on RT with different nutritional interventions (including on low-carbohydrate high-protein diets) have been performed in several women populations [23–28], there are a paucity of studies documenting the combined effects of KD and RT, particularly in resistance-trained women.  In view of the current gaps in the literature, the purpose of the present study was to evaluate the effects of a KD on body composition and strength levels in women undergoing a regimented RT program. We hypothesized that FM would be reduced and/or maintained while fat free mass (FFM) and strength levels would be preserved in women undertaking an eight 8-week RT program in conjunction with a KD. ",0228910d-1128-4cee-ab00-329c4257dd6a
5,methods0,"Twenty-one strength-trained women (27.6 ± 4.0 years; 162.1 ± 6.6 cm; 62.3 ± 7.8 kg; 23.7 ± 2.9 kg·m− 2) were randomly assigned to either a non-KD group (n = 11, NKD) or a KD group (n = 10, KD). Study outcomes included body composition as measured by dual-energy X-ray absorptiometry (dual energy X ray absorptiometry (DXA)), strength levels measured using one maximum repetition (RM) in back squat and bench press (BP), and countermovement jump (countermovement jump (CMJ)) measured on a force plate.  Study design This study was conducted as a randomized, parallel arm, controlled, prospective study. The independent variable was nutritional intervention. The primary outcome variables were changes in body composition.  Participants Twenty-one women (age = 27.6 ± 4.0 years; height = 162.1 ± 6.6 cm; body mass = 62.3 ± 7.8 kg; BMI = 23.7 ± 2.9 kg·m− 2) with at least 2 years of continuous RT experience volunteered to participate in this study.",7f24006b-e6a4-4ee3-be4e-93991470670f
6,methods1," All participants committed to following the prescribed diet and RT protocols, monitoring during the eight-week study. Participants were informed of the possible risks of the experiment and provided written informed consent. The study was designed in accordance with the ethical guidelines of the World Medical Association Declaration of Helsinki [29]. The investigation was developed in Málaga (Spain). The first evaluation took place on April 2019 and the second measurement on June of the same year.  Participants who self-reported the use of doping agents (e.g., anabolic-androgenic steroids) during the last 2 years or admitted to taking any dietary supplement during the program were excluded from participation. Women with oligomenorrhea or polycystic ovarian syndrome, as well as those not within the required age range of 18 to 35 years, were excluded.",4274007c-19e6-42eb-a62d-30a826321f6b
7,methods2," Participants were instructed to avoid performing any structured exercise during the study period other than that prescribed for the intervention. Figure 1 presents a diagram of subject enrollment as per the guidelines of the Consolidated Standards of Reporting Trials (Consolidated Standards of Reporting Trials (CONSORT)). Fig. 1 Consolidated Standards of Reporting Trials (CONSORT) diagram    Procedures Participants were randomly assigned to either the KD group (n = 10) or the NKD group (n = 11), and began their training and diet at the end of the familiarization phase. The research assistants logged all training loads performed by participants for each exercise session. Strength measurements were performed 7 days after menstruation, considering this time would coincide with the follicular phase of the menstrual cycle which has been shown to be correlated to strength increases during RT [30].",75c26bd7-4a75-4166-b762-62976f3c273c
8,methods3,"  Body composition Body composition was measured 7 days after menstruation in both the pre- and post-intervention periods to avoid the potential for BM alterations due to water retention caused by hormonal fluctuations [31, 32]. Total body and regional body composition was estimated using dual-energy x-ray absorptiometry (dual energy X ray absorptiometry (DXA)). Each subject was scanned by a certified technician, and the distinguished bone and soft tissue, edge detection, and regional demarcations were calculated by computer algorithms (software version APEX 3.0, Hologic QDR 4500, Bedford, MA). For each scan, participants wore sport clothes and were asked to remove all materials that could attenuate the X-ray beam. This included jewelry items and underwear containing wire.",972294e4-9d5e-407b-9ef6-fbae920d628e
9,methods4," Calibration of the densitometer was checked daily against standard calibration block supplied by the manufacturer (Phantom 21,965 Lumbar Spine with anthropomorphic characteristics of 4 hydroxyapatite vertebrae included in resin. Coefficient of Variation: 0.415%).  The abdominal region was delineated by an upper horizontal border located at half of the distance between the acromion processes and external end of iliac crests, a lower border determined by the external end of iliac crests and the lateral borders extending to the edge of the abdominal soft tissue. All trunk tissue within this standardized height region was selected for analysis. To determine intertester reliability, two different observers manually selected the area for each subject.  Exercise protocol The participants initially completed 3 weeks of familiarization to establish training weights for each exercise, followed by an eight-week intervention period.",ba9c0a6b-7aca-437c-9795-3001524c7861
10,methods5," Cadence of repetitions was controlled by a metronome (Metronome M1, JSplash Apps). All participants performed the same exercises encompassing the major muscles of the body throughout the duration of the program. The upper limb exercises included bench presses, barbell rows, military presses, lat pulldown, incline chest presses, biceps curls and triceps pushdowns. Lower limb exercises included squats, lunges, leg presses, hip thrusts, leg extensions, lying leg curls and standing calf raises.  After familiarization, participants completed four training sessions per week (divided into 2 4-week cycles) for 8 weeks. An upper/lower body split routine was employed, with a 72-h recovery period between sessions for the same muscle complex. Both groups used a nonlinear periodized workout scheme, with the variables manipulated based on the objective of each phase as follows: strength, hypertrophy and muscular endurance.",291109f2-c3d4-4cf8-97cf-2c23dd1e3532
11,methods6," This sequence was followed by a deload whereby the volume was reduced (series x repetition x load) in the last week of each cycle (recovery phase). In total, 2 4-week cycles were completed. Figure 2 provides the specific manipulation of variables for each phase of the training cycle. Fig. 2 Design of strength training. 1–0-1 = a second eccentric phase, zero isometric and 1 second in the concentric and 2–0-1 = 2 seconds eccentric phase, zero isometric and 1 second in the concentric; Training phases (strength, hypertrophy and muscular endurance) and goal repetitions according to established criteria by National Strength and Conditioning Association, NSCA [33]    The loads were adjusted in the hypertrophy and muscular endurance phases starting with the first series of each exercise, and they were modified in subsequent series based on perceived exertion and the number of repetitions completed, to achieve concentric failure in every set and maintain the range of established repetitions.",d47c0b09-a327-44ee-8a8b-cabd527a9d9e
12,methods7," In contrast, during the week focused on strength development, participants were instructed to terminate sets 1-2 repetitions short of failure. All participants increased training loads during the first 3 weeks of each cycle as long as they were able to complete the sets without compromising technical execution.  Training sessions were monitored by RT specialists, adjusting the loads whenever necessary. The lifted loads and perceived exertion in each exercise were monitored by the strength and conditioning specialist using a paper tracking form throughout the experiment. All participants used the same exercises for the duration of the program.  Nutrition intervention Diet planning was based on the participants’ fat free mass (FFM) (g·kg-fat free mass (FFM)− 1·d− 1) considering that they were trained subjects, did not have excess of body fat and that fat free mass (FFM) was obtained through a valid method such as dual energy X ray absorptiometry (DXA).",35184a50-801e-4151-8ecd-76f4311a8234
13,methods8," To avoid low energy availability and consequent changes in the menstrual cycle, the participants energy intake was set at ≈40–45 kcal∙kg-fat free mass (FFM)− 1·d− 1, which is higher than that reported in previous studies (30 kcal∙kg− 1 lean body mass) [34, 35].  In the KD group, participants were instructed to consume 30–40 g·d− 1 of carbohydrates (≈20 g of dietary fiber) with a protein intake higher than the current recommendation of 1.7 g∙kg− 1·d− 1 [36]. The remaining calories were obtained in the form of dietary fats (≈31% saturated; ≈40% monounsaturated; ≈29% polyunsaturated fat). Participants were advised to eat 3-6 meals a day. To assess dietary compliance, urinary ketones concentrations were measured weekly in the early morning using over-the-counter reagent strips (Ketostix, Bayer Vital GmbH, Leverkusen, Germany) [37]. Alternatively, the NKD group was instructed to consume ≥1.",cb3afdb5-eb4f-40f7-9232-371537ee7ee1
14,methods9,"7 g∙kg− 1·d− 1 of protein and 1 g∙kg− 1·d− 1 of fat (≈20% saturated; ≈48% monounsaturated; ≈32% polyunsaturated fat) with the remaining calories obtained from carbohydrates (≈60% starch; ≈25% simple; 15% fiber).  To monitor dietary intake, participants recorded their daily macronutrient intake via a smartphone app (MyFitnessPal, LLC, CA, USA), which has been validated as viable tool for energy and macronutrient assessment [38]. A sports nutritionist with experience in RT instructed participants on proper use of the app and managed dietary consumption over the course of the study.  Strength levels For the strength tests, participants were instructed not to do any type of training during the previous 72 h, in both pre- and post-intervention. Prior to testing, participants performed a general warm-up consisting of joint mobility and 10–12 min of low-intensity aerobic exercise on exercise bike.",794c665e-8a7a-4cb1-99d0-bfaeace96780
15,methods10,"  The Countermovement jump (countermovement jump (CMJ)) test was performed on a jump mat (Smart Jump; Fusion Sport, Coopers Plains, Australia) after instructing participants on proper jump execution. A total of 3-5 attempts were performed for familiarization prior to obtaining measurements. Participants were instructed to initiate the move by reaching 90° of knee flexion while keeping their hands at the waist and their trunk erect. Instructions emphasized that the movement should be performed without interruption from the beginning to the end of the jump. After familiarization, two jumps were recorded with a rest interval of 1 min between each; the highest value was computed.  One repetition maximum (RM) was evaluated in the squat (SQ) and bench press (BP) performed on a Smith machine (Gervasport, Madrid, Spain) exercises both at the beginning and at the end of the study.",f26fcf33-ba8f-4ae3-886f-32c495bd0dbc
16,methods11," Participants reported to the laboratory having refrained from any exercise other than activities of daily living for at least 48 h before baseline testing and at least 48 h before testing at the conclusion of the study. In brief, participants performed a general warm-up before testing that consisted of light cardiovascular exercise lasting approximately 7 to 10 min. A specific warm-up set of the given exercise was performed for 12 to 15 repetitions at ~ 40% of participants’ perceived 1RM followed by two to three sets of two to three repetitions at a load corresponding to approximately 60 to 80% 1RM. Participants then performed sets of one repetition of increasing weight for 1RM determination. Three- to 5-min rest was provided between each successive attempt. Participants were required to reach parallel in the 1RM SQ; confirmation of squat depth was obtained by a research assistant positioned laterally to the subject to ensure accuracy.",1d119a3f-6f39-4baa-bcdf-a3c008fefe19
17,methods12," Successful 1RM BP was achieved if the subject displayed a five-point body contact position (head, upper back, and buttocks firmly on the bench with both feet flat on the floor) and executed full-elbow extension in the concentric phase, and the bar was required to touch the chest in the eccentric phase. 1RM SQ testing was conducted before 1RM BP with a 7-min rest period separating tests. Participants then performed as many attempts as necessary until repetition failure, using the protocol described by McGuigan [39]. Bench placement was set by marking the floor with adhesive tape, to maintain the same placement for both measurements. All testing sessions were supervised by the research team to achieve a consensus for success on each trial. ",e7a1a64c-7e73-4aef-9d31-0bd6ff4bbca1
18,analysis0,"The statistical results are expressed as the mean ± standard deviation. The comparison between the means (pre- vs post-test) was performed with a paired t-test or the Wilcoxon test (according to data normality), and the effect size was determined using Cohen’s d. A repeated-measures general linear model (general linear model (GLM)) was used to evaluate the effect of intrasubject factors (Time: pre and post) and intersubject factors (i.e., the training protocol: Group) and the interaction between them (Time x Group). The difference in the univariate analysis of this model was established with the Greenhouse-Geisser test, also considering the partial-eta squared (ηp2) value as a measure of effect size, and the Bonferroni test was used for the post hoc analysis.",a10a5375-2229-4306-a37a-489a0282c99b
19,analysis1," Additionally, a 95% confidence interval (CI) for the mean of the change from baseline (Δ = pos-test - pre-test) was used to analyze significant changes in the variables, with values above or below a 95% CI denoting significant changes. Likewise, the Mann-Whitney U test (according to data normality) was used to compare the Δ between groups. Data normality was verified with the Shapiro-Wilk test. The level of significance assumed for all tests was P < 0.05. The statistical procedures were performed with the statistical package SPSS version 24 (SPSS Inc., Chicago, USA), and the graphs were developed using GraphPad Prism software version 7.03 (GraphPad Software, California, USA). ",b43ccc3f-354a-42d2-9513-15a665c5a133
20,results1,"5 ± 8.4	39.8 ± 7.1	40.6 ± 7.6	0.63	 Squat (kg)	68.5 ± 11.2	64.5 ± 11.3	66.5 ± 11.1	0.44	 countermovement jump (CMJ) (cm)	20.8 ± 2.7	22.0 ± 4.2	21.4 ± 3.5	0.45	 The values are expressed as average ± standard deviation; KD ketogenic diet group; NKD non-ketogenic diet group; BM body mass; BMI body index mass; FM fat mass; fat free mass (FFM) fat-free mass; BP bench press; countermovement jump (CMJ) countermovement jump    Considering that diet planning was based on the participants’ fat free mass (FFM) (g·kg− 1 fat free mass (FFM)·d− 1), the macronutrient distribution in relation to energy intake in the KD group resulted in < 10% for carbohydrates, ≈65% for fat and ≈26% of protein (see Table 2 for details), which allowed dietary adherence and led to a daily energy intake of 40.1 ± 2.7 kcal·kg-fat free mass (FFM)− 1·d− 1 (1710.4 ± 160.0 kcal/d). On the other hand, the macronutrient distribution of the NKD group (Table 2) resulted in a daily energy intake of 45.5 ± 1.",0291160f-7419-44cd-93fb-57904b97f576
21,results5," Comparison of the Δ between the groups revealed a statistically significant difference (P < 0.01). According to the general linear model (general linear model (GLM)), there was no difference considering the Time (P = 0.08; ηp2 = 0.16) or Group (P = 0.53; ηp2 = 0.02) factors, but there was a difference in the Time x Group interaction (P < 0.01; ηp2 = 0.52) (Table 3, Fig. 2a).  Fat mass A significant post-study decrease in FM with a small effect was observed in the KD group (P = 0.042; d = − 0.2), while the NKD group showed no significant changes (P = 0.225; d = 0.1). In terms of Δ, the KD group showed a decrease of − 1.1 ± 1.5 [− 2.2, − 0.1], and the NKD group showed an increase of 0.3 ± 0.8 [− 0.2, 0.9]. The change was significant only for the KD group according to the CIs. Factor analysis revealed no changes considering Time (P = 0.19; ηp2 = 0.09) or Group (P = 0.74; ηp2 = 0.01), but a Time x Group interaction was observed (P = 0.01; ηp2 = 0.30) (Table 3, Fig. 3a). Fig. 3 a.",c9a8e405-b8fa-40dc-a2fb-6877e0638988
22,results6," Changes from baseline in BM (body mass), FM (fat mass) and fat free mass (FFM) (fat-free mass); b. Changes from baseline in BP (bench press) and Squat; c. Changes from baseline in countermovement jump (CMJ). Legend: The error bar represents the confidence intervals at 95% (95% CI); * when the 95% CI completely exceeds O, it is considered a significant change. The lowercase letters represent the P-value of the comparison between the groups: a = < 0.01; b = 0.012; c = 0.035; d = 0.035; e = 0.003; f = 0.478    Fat-free mass No post-study differences in fat free mass (FFM) were observed for the KD or NKD groups (P = 0.202; d = − 0.1 and P = 0.074; d = 0.2, respectively). However, Δ showed a decrease in the KD group (− 0.7 ± 1.7 kg [− 1.9, 0.5 kg]) and an increase in the NKD group (0.7 ± 1.1 [− 0.1, 1.4 kg]), with significant differences noted between groups (P = 0.03). The general linear model (GLM) analysis revealed no differences in the Time or Group factors (P = 0.94; ηp2 = 0.",c45608b3-ed03-4b58-8366-9257f6969655
23,results7,"00 and P = 0.47; ηp2 = 0.03, respectively), but Time x Group differences were observed (P = 0.04; ηp2 = 0.2). (Table 3, Fig. 3a).  Physical activity intervention Bench press No significant post-study increases in BP were found in the KD group (P = 0.329; d = 0.2), whereas the NKD group showed significant increases of a moderate effect (P = 0.005; d = 0.7). The Δ was 1.5 ± 4.6 kg [− 1.8, 4.8 kg] for the KD group and 4.8 ± 1.8 kg [3.6, 5.9 kg] for the NKD group, with significant differences shown between groups (P = 0.035). The general linear model (GLM) analysis established that there were changes considering the Time factor (P = 0.001; ηp2 = 0.47) but not the Group factor (P = 0.91; ηp2 = 0.00) or the Time x Group interaction (P = 0.05; ηp2 = 0.19) (Table 3, Fig. 3b).  Squat A significant post-study increase in Squat with a moderate effect was observed in the KD group (P = 0.045; d = 0.5), along with a significant increase with a large effect in the NKD group (P < 0.005; d = 1.4).",61c6763d-c267-4816-8044-9178d39d85a3
24,discussion0,"Our study aimed to evaluate the effect of a KD on body composition and strength following an 8-week RT program in strength-trained women. In light of results obtained in men under similar conditions [17], we hypothesized that a KD combined with RT would not alter fat free mass (FFM) or strength-related parameters in strength-trained women; the results obtained partially support our hypothesis.  The use of reagent strips for the qualitative assessment of ketosis state was necessary in this study given the design and resource limitations. There were positive outcomes in every weekly test of the study (no data available since only dietary compliance was assessed, besides the dietary control during the intervention). With respect to fat free mass (FFM), we found no statistical pre- to post-study changes in the KD group, although an absolute decrease of 0.7 kg was observed in this outcome.",cd59fe1e-737f-4078-a737-d6f2fccdde29
25,discussion1," Previous research using the CrossFit® training modality with mixed samples (men and women) generally lends support to our findings. Gregory et al. [40] found no statistical changes in dual energy X ray absorptiometry (DXA)-derived measures of fat free mass (FFM) following a 6-week RT program combined with a KD. However, the KD group was instructed to consume foods ad libitum with a maximum of 50 g of carbohydrates per day, and reported decreasing energy intake by ~ 400 cal across the study period. More recently, Kephart et al. [41] showed decreases in dual energy X ray absorptiometry (DXA)-derived lower limb fat free mass (FFM) and a decrease in vastus lateralis muscle thickness assessed by ultrasound when consuming a KD over a 12-week RT. The nutritional intervention of this study did not consider specific values of total calories or macronutrients used per g∙kg− 1·d− 1, impairing the ability to estimate whether participants were in a state of energy deficiency or surplus.",db48f49a-f51c-4f42-a17e-d519bd649a5f
