,chunk_label,chunk_text,uuid
26,discussion2," Similarly, recent research on male military personnel have shown a reduction on BM (including fat free mass (FFM) loss) in the KD group only, while the NKD group increased this parameter with a significant reduction in FM; notwithstanding, energy intake was not controlled in this study [42]. In contrast, Volek et al. [43] reported a statistically significant increase in fat free mass (FFM) (1.1 kg) in moderately active male participants, some of whom reported routinely performing moderate intensity RT, following a 6-week RT program. Wilson et al. [18] also reported increases in fat free mass (FFM) following a KD combined with intensive RT in trained men. It is important to note that the evaluation of fat free mass (FFM) by dual energy X ray absorptiometry (DXA) includes the intracellular water, which is stored in concert with muscle glycogen in a ~ 3:1 ratio [44].",fb8a70e8-febf-485a-aa5a-67a1a89a6695
27,discussion3," Thus, implementing a carbohydrate refeed to the KD in the post-evaluation conceivably would positively influence the final fat free mass (FFM) results, as demonstrated by Wilson et al. [18].  Physiological differences between sexes can be problematic when attempting to extrapolate data from men to women and vice-versa. The issues are highlighted in a recent study that investigated the effects of a four-week KD on the utilization of fats and carbohydrates during an incremental cycling test in CrossFit®-trained men and men [45]. Results showed that men increased their utilization of fats to a greater extent than women during submaximal intensity exercise, suggesting some adaptations from a KD are sex-specific.  Despite our attempts to create an energy surplus, participants in KD showed signs of satiety from the fifth/sixth week of the protocol.",cbba4994-9b1c-400d-b4dc-d855436195e6
28,discussion4," As shown in Table 2, reported energy consumption for participants in KD was below prescribed amounts, revealing the difficulty of eating in a caloric surplus when carbohydrate intake is severely restricted; notwithstanding, it is important to note that both groups met the daily energy intake of 40–45 kcal∙kg-fat free mass (FFM)− 1. Given that the KD group showed a mean reduction in both FM and fat free mass (FFM), it therefore can be concluded that these participants were in an energy deficit despite claiming adherence to the nutritional prescription. It has been previously established that KDs generate a decrease in appetite [46, 47], which can be conducive to reducing FM. However, if a KD-induced state of satiety prevents individuals from consuming the prescribed caloric intake, it could be suboptimal for increasing fat free mass (FFM) [48, 49].",fa08776d-2fea-430b-ac58-a42f23eb9bec
29,discussion5," Furthermore, it should be noted the possibility that KD induces gluconeogenesis, which might reduce fat free mass (FFM) by breaking down the endogenous proteins in a higher rate.  On the other hand, this study showed significant changes for lower-limb strength (1RM squat) in both KD and NKD groups; however, only the NKD group had significant changes on the upper-body strength (1RM BP). These results partially support the work of Wilson et al. [18] where, considering the difference in sex, the researchers found significant changes when compared to baseline values of both 1RM squat and BP in a KD and NKD group (with no differences between groups). Kephart et al. also found no negative results on the 1RM back squat when compared to a NKD group. Recently, it has been reported similar changes on anaerobic parameters related to lower and upper-limb strength and power between a KD and NKD groups [42].",dee10ddf-e7ea-498e-9f37-a4887c7307df
30,discussion6," In fact, our study also showed similar increases on power (countermovement jump (CMJ)) after the dietary interventions in both groups from baseline. At no time point were there any differences between conditions for peak power.  Limitations This study has several flaws and limitations. First, the use of urine ketone strips may be less sensitive than blood-sample methods, which represents a potential methodological limitation. Also, participants of the KD group displayed signs of reduced appetite that impaired their ability to consume the same number of daily calories in comparison to the NKD group; thus, we cannot confidently extrapolate findings to how an energy surplus affects body composition and strength adaptations in KD combined with regimented RT. However, it should be noted that at both groups met the ⁓40–45 kcal∙kg-fat free mass (FFM)− 1·d− 1.",c928ba8a-0c55-4aac-91ae-eb2d958c71a4
31,discussion7," Moreover, pre-study measures of body composition were performed when glycogen levels were high, whereas post-study measures were conceivably performed in a glycogen-depleted state for KD. Given that each gram of glycogen stores at least ~3 grams of water, this could influence data on fat free mass (FFM) as body water is incorporated into dual energy X ray absorptiometry (DXA)-derived measures. Finally, the relatively small sample size (n = 21) and short intervention time (8 weeks) reduce the ability to draw strong conclusions on studied outcomes.  Conclusions Our results suggest that an 8-week is a viable option for decreasing FM and maintaining fat free mass (FFM) when combined with regimented RT KD in strength-trained women; however, it is suboptimal for increasing fat free mass (FFM).",28fc9f69-0cf7-49a9-835e-d8423ba2fdd0
32,discussion8,"  Abbreviations BMIBody mass index  BPBench press  BMBody mass  CIConfidence interval  CGControl group  countermovement jump (CMJ)Countermovement jump  dual energy X ray absorptiometry (DXA)Dual-energy x-ray absorptiometry  ESEffect size  FMFat mass  fat free mass (FFM)Fat-free mass  general linear model (GLM)General lineal model  KBKetogenic bodies  KDKetogenic diet  NKDNon-ketogenic diet  ηp2Partial eta squared effect size  RMOne maximum repetition  RTResistance training  SQSquat  Publisher’s Note  Springer Nature remains neutral with regard to jurisdictional claims in published maps and institutional affiliations.  Authors’ contributions SV served as study coordinator. SV conceived and designed the experiments. RR and JBP served as lab coordinator and project manager for the study coordination, respectively. SV and RR assisted in data collection. SV designed and oversight the nutritional protocols and training. JLP analyzed the data.",f78be309-0970-4e9d-82ee-16d913e3ab36
33,discussion9," SV, JLP, BJS, RBK, JBP, and DAB assisted in analysis, and manuscript review. SV, JLP, BJS and JBP wrote the paper. RBK, BJS, DAB, JLP and JBP assisted in the statistics advice, discussion analysis, and manuscript preparation. All authors read and approved the final manuscript.  Funding Supported by University of Málaga (Campus of International Excellence Andalucía Tech).  Availability of data and materials The datasets used and analyzed during the current study are available from the corresponding author on reasonable request.  Ethics approval and consent to participate Participation in the study was voluntary, with written consent being obtained from each subject before the initiation of data collection. This study was conducted after review and approval by the Ethics Committee of the University of Málaga (Málaga, Spain). Committee’s reference number: 38–2019-H.  Consent for publication Not applicable.",a57fb99b-9ebe-45cb-a062-6edbcc054f87
34,discussion10,  Competing interests The authors declare that they have no competing interests and do not eat a ketogenic diet. =,811690cc-ac10-4833-869f-3754a7284516
