,chunk_label,chunk_text,uuid
26,results1," Overall, we measured ~2x accuracy in extraction across all tissue types (cecum contents, stool, small-intestine (SI) mucosa) when total 16S rRNA gene input was greater than 8.3 × 104 copies (Supplementary Fig. 2). Normalizing this sample input to the approximate maximum extraction mass (200 mg stool, 8 mg mucosa) yielded a lower limit of quantification (lower limit of quantification (LLOQ)) of 4.2 × 105 16S rRNA gene copies per gram for stool/cecum contents and 1 × 107 16S rRNA gene copies per gram for mucosa. Mucosal samples had a higher lower limit of quantification (LLOQ) because the high host DNA in this tissue type saturates the column, limiting total mass input.Fig. 2 Lower limits of quantification for total microbial DNA extraction and 16S rRNA gene amplicon sequencing.",2d4441cc-046f-44e4-b888-1ba8d3cc5835
27,results2," a A comparison of theoretical and measured copies of the 16S rRNA gene with digital PCR using an eight-member microbial community spiked at a range of dilutions into germ-free (GF) mouse tissue from small-intestine (SI) mucosa, cecum contents, and stool. Each bar plot shows a single technical replicate for each matrix. b Relative abundance of the eight taxa as predicted and measured after 16S rRNA gene amplicon sequencing. c Correlation between the mean (n = 4) relative abundance of each taxon and the coefficient of variation (%CV) using a cecum sample from a mouse on a chow diet with an initial template input of either 1.2 × 107 or 1.2 × 104 16S rRNA gene copies. Each analysis comprised four technical (sequencing) replicates. Taxa found only in the low-input sample were labeled contaminants (red points); taxa found in the high-input sample but not low-input sample were labeled dropouts (yellow points).",19cece8c-4830-40ff-aefa-bed1ae5bdffb
28,results3," Red shading indicates the Poisson sampling 95% confidence interval (10,000 bootstrapped replicates) at a sequencing read depth of 28,000. d Relationship between relative abundance threshold (see text for details) and sequencing read depths at 30%, 40%, and 50% CV thresholds.    Next, to ensure extraction performance was consistent for both Gram-negative and Gram-positive microbes, we performed 16S rRNA gene amplicon sequencing using previously described improved primers and protocol31,33 on a subset of the extracted samples (Fig. 2b). It is important to note that all amplification reactions for 16S rRNA gene library prep were monitored with real-time qPCR and we stopped the reactions when they reached the late exponential phase to limit overamplification and chimera formation30–33,43,44. Extraction appeared less even among microbial taxa at lower total microbial DNA inputs (Fig. 2b).",70ed886f-0108-4451-9e75-627cabac6353
29,results4," This discrepancy from the theoretical profile did not correlate with the presence of chimeric sequences (Supplementary Fig. 3) and was likely a function of the reduced accuracy incurred when diluting complex microbial samples. Additionally, sequencing samples with low total microbial loads (<1 × 104 16S rRNA gene copies) resulted in the presence of contaminants, as confirmed by sequencing of negative control extractions (Supplementary Table 1).  Quantitative limits of 16S rRNA gene amplicon sequencing To establish the precision of relative-abundance measurements, we sequenced four replicates of DNA extractions from cecum samples. Libraries from one DNA extraction were prepared with either an input of 1.2 × 107 16S rRNA gene copies or 1.2 × 104 16S rRNA gene copies to determine the impact of starting DNA amount on sequencing variability. We calculated the coefficient of variation (%CV) for each taxon’s relative abundance from amplicon sequencing the replicate samples.",e56763a8-e311-4cca-a217-accee1de7b21
30,results5," Each taxon’s mean relative abundance (n = 4) was then plotted against its corresponding coefficient of variation of the relative abundance (Fig. 2c). We defined “dropouts” as taxa present only in the high-DNA-input sample whereas we defined “contaminants” as taxa present only in the low-DNA-input sample. The two dropout taxa in the low-input sample corresponded to the lowest abundance taxa from the high-input DNA sample (yellow points, Fig. 2c). Most of the contaminant taxa in the low-input sample had a relative abundance <0.03%, but three taxa (Pseudomonas(g), Acinetobacter(g), Rhizobiales(f)) had relative abundances of 0.38%, 0.35%, and 0.1%, respectively. These three taxa were also the three most common contaminants in our negative control extractions (Supplementary Table 1). The presence of contaminants in the sample containing 1.2 × 104 16S rRNA gene copies was consistent with the input amount at which we observed contaminants in our mixed microbial community dilutions (Fig. 2b).",8f631491-4d1b-4e67-8d27-ff04946d4f96
31,results6," We calculated a bootstrapped Poisson sampling confidence interval at our sequencing depth (28,000 reads) to assess how close our accuracy limits were to the theoretical limits (red shading, Fig. 2c). At the low-DNA input level of 1.2 × 104 16S rRNA gene copies, we began to reach the fundamental Poisson loading limit in our library-preparation reaction (Supplementary Fig. 4a). We expected divergence of the %CV at ~0.01% abundance because at a read depth of 28,000 a relative abundance of 0.01% is a measure of ~3 reads whereas at a total 16S rRNA gene copy input of 1.4 × 104 a relative abundance of 0.01% is ~1 copy. Poisson statistics also helped us define the theoretical lower limits of relative-abundance measurements as a factor of sequencing depth (Supplementary Fig. 4b).",a0bf8f31-33e4-4488-b6e3-1ce63ba83ea4
32,results7,"  We next wished to quantify an approximate threshold that would tell us, for a given sequencing depth, at what percentage of relative abundance we lose accuracy in our measurements (we defined this threshold as “relative abundance threshold”). To determine this threshold, we fit a negative exponential to the replicate data and identified the percentage abundance at which 30% CV was observed. This threshold is a function of the sequencing depth, so we subsampled the data at decreasing read counts and repeated the exponential fitting method to calculate the relationship between the relative abundance threshold and sequencing depth (Fig. 2d). Greater sequencing depths yielded lower quantitative limits with diminishing returns, as expected. We found that the threshold for percentage abundance decreases with increasing sequencing depth with a square-root dependence analogous to the square-root dependence of Poisson noise. This trend follows for %CV thresholds of 40% and 50% as well (Fig.",f0b6cc42-2742-4273-822c-1e717fbb17c5
33,results8," 2d). This analysis provides a framework with which to impose thresholds on relative-abundance data that are grounded on the calculated limits of quantitation.  Absolute quantification of taxa via digital PCR (dPCR) anchoring We calculated absolute abundances of taxa from sequencing data using dPCR measurement of total microbial loads as an anchor. Briefly, relative abundance of each taxon was measured by sequencing and these numbers were multiplied by the total number of 16S rRNA gene copies (obtained using the same universal primers from amplicon sequencing, without the barcodes) from dPCR. Next, we evaluated the accuracy of this quantitative-sequencing approach. Typically, evaluation of quantitative accuracy and precision would involve the use of a mock microbial community (like the one used in Fig. 2).",5ec1f70a-d12d-4482-8184-62a889c7f7e9
34,results9," However, because we computed the absolute instead of relative abundances, we were able to use the actual gut-microbiota samples and compare the results to the dPCR data obtained with relevant taxon-specific primers. The 16S rRNA gene copy amount was then normalized to the mass of each extracted sample after correcting for volume losses (Materials and methods; Eq. 1). We chose four representative taxa to encompass common gut flora of varying classification levels: Akkermansia muciniphila(s), Lachnospiraceae(f), Bacteroidales(o), and Lactobacillaceae(f). Like eubacterial primers, taxon-specific primer sets can (in principle) give rise to non-specific amplification due to overlap with host mitochondrial DNA. To avoid non-specific amplification, we ran temperature gradients with GF mucosal DNA and taxa-specific microbial DNA to identify the optimal annealing temperature for each primer set (Supplementary Fig. 5).",6977f413-1a26-4b3c-ab8f-21707f69b51b
35,results10," Each taxon-specific primer targets a separate region of the 16S rRNA gene than the universal primer set, thus keeping the gene copy-number equivalent across primers. We observed high correlation coefficients between the taxa load determined by quantitative sequencing with dPCR anchoring and the taxa load measured by dPCR with taxa-specific primers (all r2 ≥ 0.97, Fig. 3a) for all four taxa over a range of ~6 orders of magnitude. The ratio of the total load measurements obtained by quantitative sequencing with dPCR anchoring and by dPCR with taxon-specific primers showed unity agreement for three of the four primer sets with twofold deviation from the mean (Fig. 3b and Supplementary Fig. 9). Sequencing quantification was consistently 2.5-fold higher than dPCR quantification for the species Akkermansia muciniphila (Fig. 3b). We cannot confirm amplification bias as a factor because the error did not depend on the number of cycles used in library preparation.",c3643800-6752-4e66-b65b-1550e5cca553
36,results11, An alternative factor could be a discrepancy in coverage/specificity between the taxon-specific and universal primer sets. We next tested the limits of the sequencing accuracy as a factor of input DNA load. A 10x dilution series of a cecum sample was created to cover input DNA loads of 1 × 108 copies down to 1 × 104 copies. Minimal differences in beta diversity (Aitchison distance) between the undiluted and diluted samples were observed with a trend towards increasing difference with decreasing DNA load (Fig. 3c). This negative correlation between beta diversity and microbial load is not unexpected due to the higher presence of contaminant species from our negative controls in the lower input samples (Fig. 2b).Fig. 3 Digital PCR (dPCR) anchoring of 16S rRNA gene amplicon sequencing provides microbial absolute-abundance measurements. Taxon-specific dPCR demonstrates low biases in abundance measurements calculated by 16S rRNA gene sequencing with dPCR anchoring.,d17edbae-20a2-449c-9e12-bbaf83df6aac
37,results12," a Correlation between the Log10 abundance of four bacterial taxa as determined by taxon-specific dPCR and 16S rRNA gene sequencing with dPCR anchoring (relative abundance of a specific taxon measured by sequencing × total 16S rRNA gene copies measured by dPCR). b The Log2 ratio of the absolute abundance of four bacterial taxa as determined either by taxon-specific dPCR or by 16S rRNA gene sequencing with dPCR anchoring (N = 32 samples). Data points are overlaid on the box and whisker plot. The body of the box plot goes from the first to third quartiles of the distribution and the center line is at the median. The whiskers extend from the quartiles to the minimum and maximum data points within the 1.5× interquartile range, with outliers beyond. All dPCR measurements are single replicates. c Analysis of beta diversity in cecum samples at a series of 10× dilutions (n = 1 for each dilution).",142b11f3-4f6b-457c-a5b3-1fec0603011d
38,results13," Mean Aitchison distance for six pairwise comparisons of n = 4 sequencing replicates of the undiluted (108 copies) sample (black) is shown for reference (error bar is standard deviation). Individual data points are overlaid on the replicates bar plot.    Absolute vs. relative abundance analysis in a ketogenic-diet study To test the impact of using a quantitative framework for 16S rRNA gene amplicon sequencing, we performed a ketogenic-diet study. Our goals were twofold. First, we wished to test whether absolute instead of relative microbial abundances can more accurately quantify changes in microbial taxa between study groups. Second, we wished to investigate how using a quantitative-sequencing framework can guide the interpretation of changes in taxa across study conditions.",51548505-309b-43d2-9d16-d6a2ea182203
39,results14," We emphasize that our objective was not to make claims about the effect of a ketogenic diet on the microbiome, but rather to use this model as an illustration of the added benefits of using this quantitative-sequencing framework.  After one week on a standard chow diet, 4-week-old Swiss Webster mice were split into two groups (n = 6 each): one was fed a ketogenic diet and the other a vitamin and mineral-matched control diet (Supplementary Table 3). Stool was sampled immediately before the two diets were introduced (day 0), and again at days 4, 7, and 10. Additionally, on day 10, all mice were euthanized and lumenal and mucosal samples were collected from throughout the GI tract (Fig. 4a). Microbial loads (quantified with dPCR) ranged from ~109 16S rRNA gene copies/g in small intestinal mucosa to ~1012 16S rRNA gene copies/g in stool.",fe4c6838-66fa-4466-a652-8e12613843be
40,results15," On average, we observed lower microbial DNA loads in the mice on the ketogenic diet compared with mice on the control diet, except in the stomach, where loads were similar in mice on both diets (Fig. 4b).Fig. 4 Microbial absolute abundances provide separation between GI locations of mice on ketogenic or control diets. Analysis of data comparing ketogenic and control diets provides changes of total microbial loads, separation of microbial communities by GI location and by diet in principal component analysis, and the top taxa driving the separation of samples along the principal components. a Overview of experimental setup and sample-collection protocol. Gastrointestinal tract (Gastrointestinal tract (GIT)) samples were collected from the stomach, upper small-intestine (SI), lower SI, cecum, colon, and stool. b Comparison of total microbial loads between ketogenic and control diets in lumenal (top) and mucosal (bottom) samples collected after 10 days on each diet.",df48123b-ad58-4fa3-a6ec-fdaa30cd96d5
41,results16," The body of the box plot goes from the first to third quartiles of the distribution and the center line is at the median. The whiskers extend from the quartiles to the minimum and maximum data point within 1.5× interquartile range, with outliers beyond. c Principal component analysis (Principal component analysis (PCA)) on the centered log-ratio transformed absolute abundances of microbial taxa shows separation by GI location (Upper SI, light blue; Lower SI, dark blue; Stomach, yellow; Cecum, red; Colon+Stool, orange) and diet (Ketogenic, circles and triangles; Control, X’s and crosses). d Ranked order of the eigenvector coefficients scaled by the square-root of the corresponding eigenvalue (feature loadings) for the top two principal components. The two most positive and most negative taxa are shown.    All stool samples and roughly half of the samples for all other GI sites (evenly distributed across mice on the two diets) underwent 16S rRNA gene amplicon sequencing.",3f3ece13-9937-4ce5-953c-fd32571ca098
42,results17," Ordination methods (Principal component analysis (PCA), PCoA, NMDS, etc.) are a common exploratory data-analysis technique in the microbiome field. Common transformation techniques based on non-Euclidian distances (e.g., Bray–Curtis, UniFrac) can skew the accuracy of visualizations of relative data (Supplementary Fig. 6a)11. We used the centered log-ratio transformation (CLR, often used to compute the Aitchison distance) to handle compositional effects, and performed Principal component analysis (PCA) on the transformed absolute-abundance data for all samples from the final collection day (Fig. 4c). A clear separation along the first two principal components (PC) was observed. Separation along PC1 was related to the location within the GI tract whereas separation along PC2 was related to the diet.",33af047e-eead-48ab-aafc-798d754d73ac
43,results18," The Principal component analysis (PCA) analysis suggested that stomach samples were distributed somewhere in-between small-intestine and large-intestine samples, possibly resulting from coprophagy in mice32,33. Additionally, the mucosal and lumenal samples from the small-intestine on the control diet seemed to be closer together than on the ketogenic diet (Fig. 4c).  We next investigated which taxa were contributing to separation in our principal component space. We calculated the scaled covariance between each taxon and the first two principal components by multiplying the eigenvectors by the square-root of their corresponding eigenvalues. These values are also known as “feature loadings.",23d4fcc7-ee2e-4a0b-9480-6ff500987997
44,results19,"” Plotting these feature loadings from smallest to highest shows that Lactobacillus(g) and Lactococcus(g) had the greatest impact on separation along PC1 in the direction of the small intestinal samples whereas Ruminiclostridium(g) and Lachnospiraceae(f) separated in the direction of the large-intestine (Fig. 4d). This matches with what we know about the major genera commonly present in the small and large-intestine45. Along PC2 (the “diet axis”), the top two contributing taxa towards the control diet were Turicibacter(g) and Marvinbryantia(g), while towards the ketogenic diet Akkermansia(g) and Enterococcus(g) had the greatest covariance.  Although the CLR transformation preserves distances in principal component space regardless of whether the starting data are relative or absolute, it normalizes out the differences in total loads by looking at log ratios between each taxon’s abundance and the geometric mean of the sample (Fig. 4c; Supplementary Fig. 6b).",ea0d691c-0031-4d95-a689-cddff400930f
45,results20," In many cases, we want to know if the absolute load of a taxon is higher or lower under different conditions (e.g., in mice on ketogenic and control diets). When the total microbial load varies among samples, analyses of relative abundance cannot determine which taxa are differentially abundant (Fig. 1). To assess the impact of using absolute quantification in analyses, we analyzed microbiomes of stool samples from mice on ketogenic and control diets. Principal component analysis (PCA) analysis on the CLR-transformed relative abundances of microbial taxa showed separation between the two diets (Fig. 5a). Feature loadings were analyzed as before, but this time total impact of each taxon on the PC space was plotted, which was defined as the sum of the feature loading vectors in PC1 and PC2 (Fig. 5b). The same analysis was performed on the log-transformed absolute-abundance data (Fig. 5a).",70c697d6-9cde-45ca-b59c-db53e0582670
46,results21," Separation between diets is clear in both relative and absolute-abundance analyses, but the contribution of each taxon to the separation differed in direction and magnitude. Comparing the magnitude of feature loadings for two taxa, Akkermansia(g) and Acetatifactor(g), between the relative and absolute Principal component analysis (PCA) plots showed obvious differences in the contribution of a given taxon to the separation in principal component space. Analysis of relative-abundance data implies that Akkermansia(g) has the biggest contribution on separation between diets in PC space whereas the absolute-abundance data implies that ~40% of the taxa in the sample have a greater contribution than Akkermansia(g) to the separation between the diets in PC space.Fig. 5 Analyses of relative and absolute microbial abundances from the same dataset result in different conclusions.",d527af1f-a774-435b-887e-72e2566987a0
47,results22," a Principal component analysis (PCA) on centered log-ratio transformed relative abundance data and log-transformed absolute-abundance data (only the vectors of the five features with the largest magnitude are shown). b The impact of each taxon in the principal component space (see text for details), with two taxa indicated to illustrate the comparison. c A comparison of the taxa determined to be significantly different between diets using relative vs. absolute quantification (N = 6 mice per diet). P-values were determined by Kruskal–Wallis. Each point represents a single taxon; blue points indicate taxa with the absolute value of P-value ratios greater than 2.5; red points indicate two taxa that disagreed significantly between the relative and absolute analyses.",1cab1ea4-b426-4653-93e4-679482f7138f
48,results23," d For illustrative purposes, a comparison of Akkermansia(g) relative abundance (percentage of Akkermansia), absolute abundance (Akkermansia load), and total microbial load between stool samples from one mouse on each diet (Ketogenic, orange; Control, red). Gray bars indicate loads prior to the diet switch when all mice were on the chow diet.    Principal component analysis (PCA) is only an exploratory data-analysis technique, so we next used a non-parametric statistical test to test for differentially abundant taxa in stool samples from mice on control and ketogenic diets (Fig. 5c)46. We performed separate analyses of the relative and absolute-abundance data. We plotted the –log10 P-value for each taxon’s relative abundances against the corresponding –log10 P-value for that taxon’s absolute abundances. Points along the diagonal indicate congruence between the predictions from the relative and absolute-abundance data.",e902575b-d814-427f-a42d-f593ea8a8890
49,results24," Points in the upper left corner indicate taxa that differed between the diets in the analysis of relative abundance but not in the analysis of absolute abundance. Conversely, points in the lower right corner indicate taxa that do not differ between diets in the analysis of relative abundance but do differ in the analysis of absolute abundance. Akkermansia(g) is an example of a microbe that appears to differ (P = 6.49 × 10−3, Kruskal–Wallis) between mice on the two diets in the relative-abundance analysis but not in the absolute-abundance analysis (P = 3.37 × 10−1, Kruskal–Wallis). Lachnospiraceae(f) showed the opposite trend; in the relative-abundance analysis it appears unchanged (P = 6.31 × 10−1, Kruskal–Wallis) but in the absolute-abundance analysis it differs (P = 3.95 × 10−3, Kruskal–Wallis) between the two diets.",2424f32c-2707-4ce2-aac7-c2138a5b9522
50,results25," Neither of these analyses is wrong, they are simply asking two different questions: with relative data, the question is whether the percentage of that microbe is different between two conditions whereas with absolute data, the question is whether the load of that microbe is different between two conditions.  To explore one example of how different interpretations of how taxa differ between study conditions occur when using relative vs. absolute abundance, we analyzed Akkermansia(g) in stool across each of the three time points on experimental diets (days 4, 7, and 10) and day 0 on chow diet. For simplicity in this illustration, we compared data from one mouse on each diet (Fig. 5d), but the trends hold on average between all mice on the two diets (Supplementary Fig. 7). Analysis of relative microbial abundance demonstrated ~3X higher abundance of Akkermansia(g) in samples from the ketogenic compared with the control diet on days 7 and 10.",de82f545-f4a6-4c38-a51c-fab85d6b11fa
51,results26," However, when analyzing the difference in absolute abundance, more nuanced conclusions emerged. The rise in Akkermansia(g) results from switching mice from chow to experimental diets. The resulting Akkermansia(g) loads are similar in the two diets on days 7 and 10. However, the ketogenic diet reduces the total microbial load relative to both chow and control diets, therefore leading to the observed higher % of Akkermansia(g) in samples from mice on ketogenic diet.  Absolute abundances allow for quantitative differential taxon analysis We next analyzed the absolute microbiota abundances in stool and lower small intestinal mucosa samples from day 10. A volcano plot, akin to those used in gene expression studies, was used to represent the overall changes in taxa abundances between the two diets, and the absolute abundance of each taxon was indicated by the size of its symbol (Fig. 6a).",652c215b-cd77-4711-bac5-869fe2b53f5b
52,results27," P-values from the Kruskal–Wallis tests were corrected for multiple hypothesis testing with the Benjamini–Hochberg method, resulting in q-values46,47. A false-discovery rate (false discovery rate (FDR)) of 10% was labeled on the volcano plot and q-values < 0.1 were used as a cutoff for designating differential taxa for downstream analyses. Comparisons between the two GI locations showed substantial differences in microbial response to diet by location. In stool, ~66% of the differential taxa were lower on the ketogenic diet vs. the control diet whereas in the lower SI mucosa, >80% of the differential taxa were more abundant in the ketogenic diet than control diet (Supplementary Tables 4 and  5).Fig. 6 Incorporating quantification limits enhances differential taxon analysis as shown in stool and SI mucosa.",e23930c5-3ae5-45dd-8ef5-3fdb3bd9f7b7
