,chunk_label,chunk_text,uuid
0,introduction0,"One main goal of microbiome studies is to determine which taxa, if any, drive phenotypic changes among study groups1–3. The first step in this process is often to survey which microbial taxa differ in abundance between study groups (differentially abundant taxa). This survey is commonly performed by amplifying the 16S ribosomal RNA (rRNA) gene amplicon with “universal” primer sets before high-throughput sequencing4. The output of these studies provides the relative, not absolute, abundance of each taxon in each sample. Researchers often then use standard statistical tests or microbiome-specific packages to determine which taxa are differentially abundant5,6.  Relative-abundance analyses are effective for determining the major microbial taxa in an environment (e.g., the human Microbiome Project). However, several researchers have pointed out the inherent limitations of comparing relative abundances between samples7–10.",08fc0c15-ac43-465d-89d8-c297551a31d1
1,introduction1," In analyses of relative data, every increase in one taxon’s abundance causes an equivalent decrease across the remaining taxa. Thus, the measurement of a taxon’s relative abundance is dependent on the abundance of all other taxa, which can lead to high false-positive rates in differential taxon analyses8,11–13 and negative correlation biases in correlation-based analyses14,15. Several methods (e.g., ALDEx216, Ancom17, Gneiss18, Differential Ranking10) acknowledge these biases and aim to address them by using the ratios among taxa, which are conserved regardless of whether the data are relative or absolute. These methods are particularly valuable because they enable improved re-analysis of existing datasets reporting relative abundances10,16–18.  Despite such methodological advancements, analyses of relative abundance cannot fully capture how individual microbial taxa differ among samples or experimental conditions. Using the simple example of a community containing two taxa (Fig.",1a172e91-f857-411d-b1ad-17e7acf2906e
2,introduction2," 1), we see that an increase in the ratio between Taxon A and Taxon B could indicate one of five scenarios: (i) Taxon A increased (Fig. 1a), (ii) Taxon B decreased (Fig. 1b), (iii) A combination of 1 and 2, (iv) Taxon A and Taxon B increased but Taxon A increased by a greater magnitude, or (v) Taxon A and Taxon B decreased but Taxon B decreased by a greater magnitude (Fig. 1c). Knowing which of these five scenarios occurs when analyzing experimental data could drastically alter the interpretation of which taxa are positively or negatively associated with phenotypes. Thus, an inherent limitation of methods that use relative abundance is that they cannot determine whether an individual taxon is more abundant or less abundant (the direction of the change) or by how much (the magnitude of the change) between two experimental conditions or samples.Fig. 1 The value of absolute (compared with relative) quantification illustrated by three hypothetical scenarios.",b5340db4-6ceb-4c4f-8878-c0af8a5cc5a7
3,introduction3," In this hypothetical, two taxa (Taxon A and Taxon B) are found in equal abundance (50:50) in a “healthy” state but in an 80:20 ratio in the “disease” state. Three possible scenarios arise: a Taxon A increases in abundance while Taxon B remains the same; b Taxon A remains unchanged while Taxon B decreases in abundance, and c Taxon A and Taxon B both decrease, but Taxon B decreases by a greater magnitude.    To overcome these limitations, several important methods have been developed for quantifying the absolute abundance of microbial taxa by using known “anchor” points to convert relative data to absolutes. Spiked standards are commonly used in method calibration and have recently been applied to quantifying taxa in microbiome research19–23. These methods require a purified DNA sequence of known concentration from an organism not present in the sample and an estimate of the initial sample concentration to determine the amount of exogenous DNA to spike-in.",c09081e3-f0d8-4d76-95c5-ae2845284432
4,introduction4," Another group of anchoring methods, such as those that use flow cytometry24, total DNA25, or quantitative PCR (qPCR)26–28, measure the total concentration of cells, DNA, or amplicons to transform the relative abundances to absolute numbers. These methods have already demonstrated the value of quantitative microbiome analysis, yet microbiome researchers have not yet uniformly adopted these methods. One may speculate that this lack of adoption is because of real or potential limitations of these methods. For example, flow cytometry-based methods require dissociating the sample into single bacterial cells, which could require complex sample preparation and have not been validated with complex samples such as from gut mucosa. Total-DNA-based methods are limited to samples only containing microbial DNA (no host DNA), and spike-in or qPCR-based methods can be limited by amplification biases29,30.",68f21990-371e-4e38-aaab-92e563eae749
5,introduction5," To increase utilization of quantitative microbiome analyses, the following capabilities and validation need to be demonstrated: (i) performance across samples with microbial loads ranging from high, as in stool, to low, as in the small-intestine; (ii) performance across biogeographically diverse sample types, from microbe-rich stool and colonic contents to host-rich mucosal samples; (iii) explicit evaluation of limits of quantification of the method, and how these limits depend on the starting microbial load, relative abundance of a specific target taxon in the sample, and sequencing depth.  To address this challenge, in this paper we establish a rigorous, absolute quantification framework based on digital PCR (dPCR) anchoring. We chose dPCR as our anchoring method because PCR is already part of sequencing protocols and has been extensively validated as a quantitative method in nucleic-acid measurements.",8174df9c-4d5c-4d79-9415-c65b807ff7de
6,introduction6," To achieve precise measurements of absolute abundance from diverse sample types, we assessed the efficiency and evenness of the DNA extraction protocol. To minimize and quantify bias resulting from potentially uneven amplification of microbial 16S rRNA gene DNA, or non-specific amplification of host DNA, we utilized dPCR in a microfluidic format31–33. dPCR is an ultrasensitive method for counting single molecules of DNA or RNA34–36. By dividing a PCR reaction into thousands of nanoliter droplets and counting the number of “positive” wells (those with amplified template), dPCR yields absolute quantification without a standard curve. To understand the quantitative limits of our methodology, we measured the accuracy of each taxon’s absolute abundance as a factor of both input DNA amount and individual taxon relative abundance37–39. We then evaluated this absolute quantification workflow by performing a murine ketogenic-diet study that illustrates how the selection of relative- vs.",7c9c18c1-d7c6-48e7-a2cc-242f3c8e5230
7,introduction7," absolute-quantification analyses can result in different interpretations of the same experimental results. Many studies have shown that ketogenic diets can induce substantial compositional changes in gut-microbiota40–42, so, we predicted it would serve as a good illustrative model for our workflow. Finally, we applied this workflow to an analysis of microbial loads along the entire gastrointestinal (GI) tract to highlight the importance of judicious selection of sample location when evaluating the impact of diet on host phenotype, and to highlight the applicability of this workflow to GI sites with diverse microbial loads. ",eb4ad59b-7ce5-442f-b7d4-601c97235ec8
8,methods0,"Mice All animal husbandry and experiments were approved by the Caltech Institutional Animal Care and Use Committee (IACUC protocols #1646 and #1769). Male and female germ free (GF) C57BL/6J mice were bred in the Animal Research Facility at Caltech, and 4-week-old female specific-pathogen-free (specific pathogen free (SPF)) Swiss Webster mice were obtained from Taconic Biosciences (Germantown, NY, USA). Mice were housed on heat-treated hardwood chip bedding (Aspen Chip Bedding, Northeastern Products, Warrensburg, NY, USA) and provided with tissue paper (Kleenex, Kimberly-Clark, Irving, TX, USA) nesting material. Experimental animals were fed standard chow (Lab Diet 5010), 6:1 ketogenic diet (Envigo TD.07797, Indianapolis, IN, USA; Supplementary Table 3) or vitamin- and mineral-matched control diet (Envigo TD.150300; Supplementary Table 3). Diet design and experimental setup were taken from a recently published study40.",39af26fc-9c24-4e76-a037-3383ecdf8ac5
9,methods1," To minimize cage effects, mice were housed two per cage with three cages per diet group. Custom feeders, tin containers approximately 2.5 inches tall with a 1-inch diameter hole in the top, were used for the ketogenic diet as it is a paste at room temperature. Autoclaved water was provided ad libitum and cages were subjected to a daily 13:11 light:dark cycle throughout the study. Mice were euthanized via CO2 inhalation as approved by the Caltech IACUC in accordance with the American Veterinary Medical Association Guidelines on Euthanasia57.  Microbial samples The mock microbial community (Zymobiomics Microbial Community Standard; D6300) was obtained from Zymo Research (Irvine, CA, USA). This community is stored in DNA/RNA Shield, which could interfere with extraction efficiency at high concentrations. We found that a 100 µL input of a 10x dilution of the microbial community stock is the maximum input that the Qiagen DNeasy Powersoil Pro Kit can handle without recovery losses.",ef51b074-f9af-49c7-bfe7-b754e66d4859
10,methods2," Negative control blanks were also used, which included 100 µL of nuclease free water instead of mock community.  Fresh stool samples were collected immediately after defecation from individual mice and all collection occurred at approximately the same time of day. For intestinal samples, the Gastrointestinal tract (GIT) was excised from the stomach to the anus. Contents from each region of the intestine (stomach, upper half of SI, lower half of SI, cecum, and colon) were collected by longitudinally opening each segment with a scalpel and removing the content with forceps. Terminal colonic pellets are referred to as stool. After contents were removed the intestinal tissue was washed by vigorously shaking in cold sterile saline. The washed tissue was placed in a sterile petri dish and then dabbed dry with a Kimwipe (VWR, Brisbane, CA, USA) before scraping the surface of the tissue with a sterile glass slide. These scrapings were collected as the mucosa samples.",ccd50f45-cb2d-4e5e-ae6d-c344c652e1dd
11,methods3," All samples were stored at −80 °C after cleaning and before extraction of DNA.  DNA extraction DNA was extracted from all samples by following the Qiagen DNeasy Powersoil Pro Kit protocol (Qiagen; Valencia, CA, USA). Bead-beating was performed with a Mini-BeadBeater (BioSpec, Bartlesville, OK, USA) for 4 min. To ensure extraction columns were not overloaded, we used ~10 mg of scrapings and ~50 mg of contents. Half of the lysed volume was loaded onto the column and elution volume was 100 µL. Nanodrop (NanoDrop 2000, ThermoFisher Scientific) measurements were performed with 2 µL of extracted DNA to ensure concentrations were not close to the extraction column maximum binding capacity (20 µg).  Absolute abundance The concentration of total 16S rRNA gene copies per sample was measured using the Bio-Rad QX200 droplet dPCR system (Bio-Rad Laboratories, Hercules, CA, USA).",52e810fe-3c0e-4884-a40a-156351eb4f67
12,methods4," The concentration of the components in the dPCR mix used in this study were as follows: 1x EvaGreen Droplet Generation Mix (Bio-Rad), 500 nM forward primer, and 500 nM reverse primer. Universal primers to calculate the total 16S rRNA gene concentrations were a modification to the standard 515F-806R primers4 to reduce host mitochondrial rRNA gene amplification in mucosal and small-intestine samples (Supplementary Table 6)31–33. Thermocycling for universal primers was performed as follows: 95 °C for 5 min, 40 cycles of 95 °C for 30 s, 52 °C for 30 s, and 68 °C for 30 s, with a dye stabilization step of 4 °C for 5 min and 90 °C for 5 min. All ramp rates were 2 °C per second. The concentration of taxon-specific gene copies per sample was measured using a similar dPCR protocol, except with different annealing temperatures. Annealing temperatures during thermocycling for taxon-specific primers can be found in Supplementary Table 6.",4bcf0116-4293-4e9e-a53c-d8ce1f0051fa
13,methods5," The concentration of the components in the qPCR mix used in this study were as follows: 1x SsoFast EvaGreen Supermix (Bio-Rad), 500 nM forward primer, and 500 nM reverse primer. Thermocycling was performed as follows: 95 °C for 3 min, 40 cycles of 95 °C for 15 s, 52 °C for 30 s, and 68 °C for 30 s. All dPCR measurements are single replicates.  Concentrations of 16S rRNA gene per microliter of extraction were corrected for elution volume and losses during extraction before normalizing to the input sample mass (Eq. 1). 1 MicrobialLoad=dPCRconcentration*elutionvolume*deadvolumeextractionvolume*1samplemass   Absolute abundance of individual taxa was calculated either by dPCR with taxon-specific primers or multiplying the total microbial load from Eq. 1 by the relative abundance from 16S rRNA gene amplicon sequencing.  16S rRNA gene amplicon sequencing Extracted DNA was amplified and sequenced using barcoded universal primers and protocol modified to reduce amplification of host DNA31–33.",fbceb928-7e5e-43ff-bba0-ef95b8d93d6c
14,methods6," The variable 4 (V4) region of the 16S rRNA gene was amplified in triplicate with the following PCR reaction components: 1 × 5Prime Hotstart mastermix, 1X Evagreen, 500 nM forward and reverse primers. Input template concentration varied. Amplification was monitored in a CFX96 RT-PCR machine (Bio-Rad) and samples were removed once fluorescence measurements reached ~10,000 RFU (late exponential phase). Cycling conditions were as follows: 94 °C for 3 min, up to 40 cycles of 94 °C for 45 s, 54 °C for 60 s, and 72 °C for 90 s. Triplicate reactions that amplified were pooled together and quantified with Kapa library quantification kit (Kapa Biosystems, KK4824, Wilmington, MA, USA) before equimolar sample mixing. Libraries were concentrated and cleaned using AMPureXP beads (Beckman Coulter, Brea, CA, USA). The final library was quantified using a High Sensitivity D1000 Tapestation Chip.",9a36b2d3-9d49-4178-9b2c-0c4fac020353
15,methods7," Sequencing was performed by Fulgent Genetics (Temple City, CA, USA) using the Illumina MiSeq platform and 2×300 bp reagent kit for paired-end sequencing.  16S rRNA gene amplicon data processing Processing of all sequencing data was performed using QIIME 2 2019.158. Raw sequence data were demultiplexed and quality filtered using the q2-demux plugin followed by denoising with DADA259. Chimeric read count estimates were estimated using DADA2. Beta diversity metrics (Aitchison distance9, Bray–Curtis Dissimilarity) were estimated using the q2-diversity plugin after samples were rarefied to the read-count level observed in the sample that had the smallest number of reads. Rarefaction was used to force zeros in the dataset to have the same probability (across samples) of arising from the taxon being at an abundance below the limit of detection. Although rarefaction may lower the statistical power of a dataset60 it helps decrease biases caused by different sequencing depths across samples12.",5a038386-d152-48ae-91c2-8f70bc239b61
16,methods8," Taxonomy was assigned to amplicon sequence variants (ASVs) using the q2-feature-classifier61 classify-sklearn naïve Bayes taxonomy classifier against the Silva62 132 99% OTUs references from the 515F/806R region. All datasets were collapsed to the genus level before downstream analyses. All downstream analyses were performed in IPython primarily through use of the Pandas, Numpy, and Scikit-learn libraries.  Data transforms and dimensionality reduction For dimensionality reduction techniques requiring a log transform, a pseudo-count of 1 read was added to all taxa. With relative abundance data, the centered log-ratio transform was used (Eq. 2) to handle compositional effects, whereas a log transform was applied to the absolute-abundance data to handle heteroscedasticity in the data. 2 xclr=logx1Gx,logx2GX,…,logxDGXwhereGX=x1*x2*…*xDD   For comparative purposes, principal co-ordinates analysis (PCoA) was also performed using the Bray–Curtis dissimilarity metric.",2e6679f6-94c5-447a-b117-8aa60c49de29
17,methods9, Principal component analysis (Principal component analysis (PCA)) and PCoA were performed using scikit-learn decomposition methods. Feature loadings for each principal component were calculated by multiplying each eigenvector by the square-root of its corresponding eigenvalue. All data were visualized using matplotlib and seaborn.  Taxa limits of quantification Poisson confidence intervals were calculated by bootstrapping Poisson samples for rate parameters across the percentage abundance range (0–1) corresponding to either the input DNA copies or number of reads. We took 104 bootstrap replicates with a Poisson sample size of 4 to match the number of replicates we sequenced. The %CV for each replicate was calculated and the middle 95th percentile was shown as the confidence interval.  Thresholds for percentage abundance were calculated by first fitting a negative exponential curve y = ax−b to the plot of %CV vs. percentage abundance using SciPy.,5afd3659-31e8-473c-a863-ca4678cb6d2e
18,methods10," Then the percentage abundance at a given %CV threshold was determined. This process was repeated after subsampling the data at decreasing read depths to find the relationship between percent abundance accuracy limits and sequencing depth.  Measurement uncertainty When measuring the absolute abundance of a given taxon in a sample, many factors contribute to the uncertainty of the measurement. Two primary factors, extraction efficiency and average amplification efficiency for each taxon, should be equivalent for each taxon across samples processed under identical conditions and thus neither should impact the discovery of differential taxa. However, other factors contributing to the uncertainty of an absolute-abundance measurement vary among samples and can impact the discovery of differential taxa.",82e9d852-fb6c-47a4-bdd3-2d4cef9d04a2
19,methods11," At least six independent errors can contribute to the overall uncertainty of a taxon’s absolute abundance: (i) extraction error (ii) the Poisson sampling error of dPCR, (iii) the Poisson sampling error of sample input into an amplification reaction to make a sequencing library, (iv) the uncertainty in the amplification rates among sequences, (v) the Poisson sampling error of the sequencing machine, and (vi) the uncertainty in taxonomic assignment resulting from different software programs that differ in how they convert raw sequencing reads to a table of read counts per taxon.  To measure the total error in our absolute-abundance measurements, we compared the true absolute load value of four “representative” taxa (taxa that are common gut flora from different taxonomic ranks) as measured by taxon-specific dPCR, with the value obtained from our method of quantitative sequencing with dPCR anchoring (Fig.",b24a7d58-3a2e-46b8-8767-73a53ed11393
20,methods12," 3b) and then analyzed the relative error in these measurements, defined as the log2 of the observed taxon load over the true taxon load. We constructed a quantile–quantile (Q–Q) plot (Supplementary Fig. 9) of the mean-centered log2 relative errors and found that the errors appeared normally distributed. We confirmed this by running a Shapiro–Wilk test (P-value = 0.272) on the mean-centered log2 relative errors, which uses a null hypothesis that the dataset comes from a normal distribution. The standard deviation of the mean-centered log2 relative errors was 0.48, which results in a 95% confidence interval of ~(−1,1), indicating a 2x precision on each individual measurement. However, as seen with Akkermansia(g) (Fig. 3b), accuracy offsets may exist for specific taxa. It is important to note that all samples used in this analysis had relative abundances above the 50% CV threshold defined in Fig.",6fa53995-0271-4fd1-9220-dc745ccd66e5
21,methods13," 2d, and thus we do not make any conclusions about the precision of absolute-abundance measurements for taxa with relative abundances below the 50% CV threshold.  Biological uncertainty and statistical inference methods When measuring the absolute abundance of a taxon from a defined population (e.g., healthy adults, mice on a ketogenic diet) it is unlikely this abundance comes from a well-defined statistical distribution. Given this inherent limitation, we used non-parametric statistical tests, which do not rely on distributional assumptions, for our differential abundance analyses.  Statistical comparisons between diet groups were analyzed using the Kruskal–Wallis46 rank sums test with Benjamini–Hochberg47 multiple hypothesis testing correction. All statistical tests were implemented using SciPy.stats Kruskal function and statsmodels.stats.multitest multipletests function with the fdr_bh option for Benjamini–Hochberg multiple-testing correction.",bc75f9a7-1c44-49c7-ab80-95d237324f40
22,methods14," When calculating differentially abundant taxa, only taxa present in at least 4 out of 6 mice in a group were considered to remove fold-change outliers when plotting (Fig. 6a, b).  Correlation analysis Samples were separated by diet (ketogenic and control) and only stool samples were used (days 4, 7, and 10). The total microbial load and top 30 taxa with the highest average absolute abundance were selected for analysis. Spearman’s rank correlation coefficient and corresponding P-values were calculated for all pairwise interactions using the scipy.stats.spearmanr function. Benjamini–Hochberg procedure was to calculate q-values, which account for multiple hypothesis testing. A heatmap of the diagonal correlation matrix was plotted (Supplementary Fig. 8) for q-values <10% false discovery rate (FDR).  Reporting summary Further information on research design is available in the Nature Research Reporting Summary linked to this article.",e42ca6f5-57d5-46cf-8165-e17921a369c9
23,methods15,"  Supplementary information  Supplementary Information    Reporting Summary      Source data  Source Data     Peer review information Nature Communications thanks the anonymous reviewers for their contribution to the peer review of this work.  Publisher’s note Springer Nature remains neutral with regard to jurisdictional claims in published maps and institutional affiliations.  Supplementary information Supplementary information is available for this paper at 10.1038/s41467-020-16224-6.  Acknowledgements This work was supported in part by the Kenneth Rainin Foundation (2018–1207), the Army Research Office (Army Research Office (ARO)) Multidisciplinary University Research Initiative (MURI #W911NF-17-1-0402), and a National Institutes of Health Biotechnology Leadership Pre-doctoral Training Program (Biotechnology Leadership Pre doctoral Training Program (BLP)) fellowship from Caltech’s Donna and Benjamin M. Rosen Bioengineering Center (T32GM112592, to J.T.B.).",739a73d9-3f55-4160-a930-806597ef61c5
24,methods16, We thank Elaine Hsiao and Christine Olson for helpful discussions and input on the experimental design and diets; we thank the Caltech Bioinformatics Resource Center for assistance with statistical analyses; we acknowledge the Caltech animal facility for experimental resources; we thank the Caltech Office of Laboratory Animal Resources and the veterinary technicians at Caltech for technical support; and Natasha Shelby for contributions to writing and editing this manuscript. ,ec3c8f53-1091-4331-b39a-de612bb96e37
25,results0,"Efficient DNA extraction across microbial loads and sample types To estimate the maximum quantity of sample we could extract before exceeding the capacity of a 20-µg column, we measured total DNA and microbial DNA load across small-intestine and large-intestine lumenal and mucosal samples (Supplementary Fig. 1). We then evaluated extraction efficiency across three tissue matrices (mucosa, cecum contents, and stool) to assess whether variation in levels of PCR inhibitors and non-microbial DNA interfered with microbial quantification. We spiked a defined 8-member microbial community into GI samples taken from germ-free (GF) mice. To assess quantitative limits, we performed a dilution series of microbial spike-in from 1.4 × 109 CFU/mL to 1.4 × 105 CFU/mL. dPCR quantification showed near equal and complete recovery of microbial DNA over 5 orders of magnitude (Fig. 2a).",fd744e38-d367-452d-a082-43dc750438d4
