,chunk_label,chunk_text,uuid
54,discussion5," However, we found no signs of mTORC1 activation in the brain of TwKOastro, which otherwise robustly up-regulated ISRmt components. Rapamycin treatment did not affect brain pathology of TwKOastro but caused accelerated body weight loss leading to a premature cessation of the experiment. The harmful effect was not expected, as previous reports suggested beneficial effects of rapamycin on different mouse models with mitochondrial dysfunction: in NDUFS4-KO (Johnson et al, 2013, 2015; Felici et al, 2017), thymidine kinase-2 knock-in (Siegmund et al, 2017), and muscle-specific COX15-KO (complex IV assembly deficiency) (Civiletto et al, 2018) mice. Recently, rapamycin failed to rescue the brain pathology of mice with coenzyme Q deficiency, characterized by spongiotic encephalopathy and astrogliosis, similar to TwKOastro mice (García-Corzo et al, 2013; Barriocanal-Casado et al, 2019). In chow-fed TwKOastro, the levels of ubiquinone-1 and ubiquinone-2 are decreased at the age of 3.",fec33317-0976-4b60-84a7-bfcd5711aa8b
55,discussion6,"2 mo, suggesting a secondary coenzyme Q deficiency (Supplemental Data 2). Whether similar metabolic changes in astrocytes underlie spongiosis and negative rapamycin effect in CoQ deficiency and TwKOastro remains to be studied. These results indicate that the effect of rapamycin depends on the underlying primary defect and may be deleterious in mitochondrial spongiotic encephalopathy. Rapamycin has profound effects on organismal metabolism in general, which may also contribute to the worsening of the phenotype, even in an encephalopathic model.  KD was also poorly tolerated by TwKOastro, and different from rapamycin, it accelerated the brain pathology progression. Astrocytes ensure nutrient uptake from the blood flow and are believed to survive rather severe mitochondrial dysfunction because of their capacity to up-regulate glycolysis (Supplie et al, 2017). KD, however, minimizes glucose availability for glycolytic ATP production.",62aeb987-9ea8-4a92-b5dd-069fd97f0a1e
56,discussion7," Despite this knowledge, KD has been used to treat epilepsy in mitochondrial diseases (Wexler et al, 1997; Kang et al, 2007; Joshi et al, 2009). Our findings present a proof-of-principle that KD worsens spongiotic encephalopathy caused by mitochondrial dysfunction in astrocytes.  In conclusion, the exceptional heterogeneity and tissue specificity of different mitochondrial diseases indicate that mitochondrial functions are cell type specific. Therefore, also the pathophysiological changes may drastically vary in different diseases, and require specific treatments. Promising results of interventions, such as rapamycin and KD in some mitochondrial diseases, are not automatically generalizable to the whole disease group. Our preclinical data indicate deleterious effects of rapamycin and KD in brain-related Mitochondrial DNA (mtDNA) depletion syndrome (MDS), with rapid deterioration of general condition and/or brain pathology of the mice.",187e9e08-3192-4866-b85e-40db6217cfdb
57,discussion8," Therefore, our evidence does not support the use of these intervention strategies for mitochondrial spongiotic encephalopathy or epilepsy linked with mtDNA depletion. Our results indicate that metabolic modifier therapies and diets are potent modifiers of disease progression.  Limitations of the study Usage of genetically modified mouse models with cell type–specific gene knockouts provided important insights into the physiology of tissues in normal and pathological conditions. However, comparing different Cre-induced knockouts with each other is limited by the absence of strict temporal control of the effect of knockout, that is, different rates of loss of the targeted product in different cells or tissues, as well as differently tolerated thresholds of such loss. Most, if not all, genes showing exclusive or highly enriched expression in astrocytes in brain tissue are also expressed at some level by peripheral organs. Glial fibrillary acidic protein (GFAP)73.",02459cb0-3d5a-46fc-b625-9e1da95879ed
58,discussion9,"12-Cre used to generate TwKOastro is expressed by subpopulations of neurons in the mouse cortex, and by specific peripheral tissues (Bush et al, 1998; Smith et al, 2019). Such expression was unlikely to affect the findings, as TwKOneuro showed no responses even in the terminal stage, as these were found in the TwKOastro soon after symptom manifestation, and the spongiotic encephalopathy observed in TwKOastro is a very distinct finding. Future studies are needed to study the relevance of our findings for human Mitochondrial DNA (mtDNA) depletion syndrome (MDS) manifesting with morphologically similar spongiotic pathology.  ",1ab34224-639d-40df-b956-2332d240b349
