,chunk_label,chunk_text,uuid
0,introduction0,"Alzheimer’s disease (AD) is a neurodegenerative disorder characterized by memory loss and impaired cognitive functions. Recent evidence suggests age-related metabolic dysfunction plays a role in promoting cognitive impairment and overall AD pathology [1–5]. Key features of AD pathology include the accumulation of amyloid-β (Aβ) plaques followed by the formation of neurofibrillary tangles (NFTs) [6]. In response to Aβ aggregation, microglia promote Aβ and tau clearance and create physical barriers to protect neurons from neurotoxic plaque, but also drive neuroinflammation that damages neurons [7–12]. Chronic activation of the nod-like receptor family pyrin domain containing 3 (NLRP3) inflammasome has emerged as an important mechanism in continual neuroinflammation that significantly increases AD pathology [13]. Therefore, inhibiting NLRP3 activation could be a promising therapeutic strategy for AD.",b3ff2436-d0b6-4ddd-b0cb-028aa90a769a
1,introduction1,"  The ketogenic diet is a high-fat, low-carbohydrate dietary regimen that stimulates the breakdown of fatty acids and ketogenic amino acids, a process that results in the production of ketone bodies that can be further metabolized for energy production. The three ketone bodies are acetone, acetoacetate, and β-hydroxybutyrate (BHB). Previous work has shown that BHB is present at significantly lower levels in the blood of AD patients [14]. Furthermore, higher circulating BHB levels in the blood of AD patients are correlated with increased scores on cognitive tests [14–18], and BHB has been shown to modify disease in mouse models of AD by unknown mechanisms [19–21]. Recently, BHB was shown to inhibit NLRP3 inflammasome activation in human monocytes [22]. Given these findings, and that BHB can effectively cross the blood–brain barrier, further investigation is warranted to determine a potential mechanism by which BHB attenuates AD pathology.",847eda47-0ab7-4558-b555-9b7600039705
2,introduction2,"  In this study, we demonstrate that exogenous BHB administration to mice carrying human presenilin 1 (PSEN1) and amyloid precursor protein (amyloid precursor protein (APP)) with 5 familial AD mutations under the CD90 promoter, which deposit Aβ plaques [23] (5XFAD mice), decreases overall AD pathology through inhibition of the inflammasome. We found that BHB levels in brain tissue and red blood cell samples from AD patients were significantly lower than those from non-AD controls. We then confirmed that BHB inhibits the NLRP3 inflammasome in bone marrow-derived macrophages (bone marrow derived macrophages (BMDM)) by decreased levels of IL-1β and caspase-1. Using the 5XFAD mouse model of AD, BHB treatment resulted in dramatically fewer cortical plaques accompanied by decreased cortical volume occupied by plaques. We also observed less pronounced microgliosis in the BHB-treated 5XFAD mice, which had significantly less processed caspase-1 in their cortices.",16cb0048-0e37-4f47-b348-3ae80a7ffc97
3,introduction3," Consistent with a decrease in NLRP3 inflammasome activation, we observed significantly fewer apoptosis-associated speck-like protein containing a caspase recruitment domain (Asc) specks in the BHB-treated 5XFAD mice. Overall, our findings demonstrate that augmenting BHB levels may be a promising preventative and therapeutic strategy for AD.  Results and discussion AD patients have lower levels of BHB in their blood and brain parenchyma Recent studies suggest AD pathology is driven by age-related metabolic dysfunction in the brain [1, 2]. Also, during the immune response to AD onset, the metabolic state of microglia affects disease progression [3–5]. Glucose appears to be the main energy source for both microglial and brain energy metabolism, but other substrates, like ketone bodies, can be used as an alternative energy source. Surprisingly, one of the three ketone bodies, BHB, has been shown to be present at significantly lower levels in the blood of AD patients [14].",c2bc7a8f-0e39-42df-b1c9-920792048c0f
4,introduction4," In our study, we found BHB at significantly lower levels in the red blood cells of AD patients when compared with non-AD controls (P = 0.0002; two-tailed Student’s t test) (Fig. 1a, c). We also found that BHB levels were significantly reduced in the brain tissue of AD patients when compared with non-AD controls (P = 0.0036; two-tailed Student’s t test] (Fig. 1b, d) with a strong correlation between BHB levels in the brain and red blood cells (Fig. 1e). Previous work has demonstrated that higher circulating levels of BHB in AD patients are correlated with increased scores on cognitive tests [14–18]. The mechanism by which ketones, including BHB, improve cognition in AD patients is unclear. One of the most important known risk factors for developing AD is diabetes [24]. Several studies have demonstrated impaired insulin signaling and insulin resistance in the brain to AD pathogenesis [25–28].",04ef446b-ed97-4769-bc7e-7deb9f09c1aa
5,introduction5," A growing body of evidence suggests ketones can significantly improve glucose homeostasis which in turn reduces insulin resistance and metabolic dysfunction [29, 30]. Clinical symptoms of AD rarely appear before decreases in the cerebral metabolism of glucose, indicating a link to local brain insulin resistance [26]. Ketone body metabolism can overcome insulin resistance, suggesting a therapeutic potential for ketone bodies in AD [31, 32]. Our data indicate that BHB levels are lower in AD patients, suggesting an important role for BHB in limiting AD pathology. Fig. 1 AD patients have less BHB in their blood and brain parenchyma. Volcano plots showing the relative concentration of various metabolites detected in the red blood cells (a) and brain parenchyma (b) of AD patients compared with non-AD controls (controls (CTRL)). Relative expression is on the x-axis with significance on the y-axis.",26f30720-4e0d-47ee-ad81-9f35c1f0980b
6,introduction6," Graphs showing relative concentration of BHB in blood (c) and brain parenchyma (d) of AD patients compared with non-AD controls (CTRL). Data are shown as mean ± SEM with ***P ≤ 0.001 and **P ≤ 0.01. (e) Correlation of BHB concentration in the brain of AD and non-AD controls (CTRL) with blood of AD and non-AD controls (CTRL) showing a strong, positive correlation of BHB in the brain and blood, with an R2 value of 0.9353. All data represent results taken from AD patients (n = 10) and non-AD controls (CTRL) (n = 10)    BHB treatment leads to fewer plaques in 5XFAD mice In order for BHB to be used as a therapeutic agent for AD, it must be capable of effectively crossing the blood–brain barrier. Endothelial cells of blood vessels in the brain express monocarboxylate transporters which mediate ketone body transport across the blood–brain barrier [33, 34]. In our study, BHB levels in the brain parenchyma of wild-type (WT) and 5XFAD mice were determined using a colorimetric ELISA.",1ccdb815-ec40-486c-8ec7-22b642717598
7,introduction7," BHB levels in WT and 5XFAD control mice were minimal, with no significant difference between the groups. In contrast, WT and 5XFAD mice receiving BHB-treated water showed significantly increased levels of BHB compared with control mice receiving regular water (P ≤ 0.0001; one-way ANOVA with a Tukey’s multiple comparison test), indicating exogenous BHB administration in water allowed BHB to effectively cross the blood–brain barrier (Fig. 2a). Fig. 2 BHB treatment leads to fewer plaques in 5XFAD mice. (a) BHB levels in the cortices of mice (n = 5–7/group) as determined by colorimetric assay (Abcam). (b) Brain sections of WT and 5XFAD mice on regular water and BHB-containing water were stained for microglia (Iba1; red), nuclei (TO-PRO-3; cyan), and plaques (methoxy-X04; blue). Images were taken on a Nikon A1R confocal microscope.",be8acfb2-70a8-47ad-9df2-7b6f50aaf56b
8,introduction8," The number of X04+ plaques per field (c), number of 6E10+ plaques per field (d), plaque volume (e), plaque density (f), percent of area covered by plaques (g), percent of volume occupied by plaques (h), and plaque sphericity (i) were quantified using Imaris 9.2.1. Two to three images per mouse were quantified and averaged. The data shown were collected from 6–7 mice per group. Graphs show data as the mean ± SD with ****P ≤ 0.0001, ***P ≤ 0.001, **P ≤ 0.01, and N.S. = not significant    Aβ plaques are a hallmark of AD pathology [6]. Therefore, we compared plaque formation in the cortices of mice receiving untreated and BHB-treated water using confocal microscopy (Fig. 2b). 5XFAD mice receiving BHB-treated water had significantly fewer X04+ plaques (42.1 plaques/HPF) compared with untreated control mice (74.3 plaques/HPF) (P = 0.0005; two-tailed Student’s t test) (Fig. 2c). These findings were confirmed, as 5XFAD mice receiving BHB-treated water had significantly fewer 6E10+ plaques (43.",498d1681-ac65-48ff-bbac-5ce9b16bb921
9,introduction9,"1 plaques/HPF) compared with untreated control mice (70.5 plaques/HPF) (P = 0.0007; two-tailed Student’s t test) (Fig. 2d). Furthermore, 5XFAD BHB-treated mice showed a significantly reduced percent area covered by plaques (P = 0.0082; two-tailed Student’s t test) (Fig. 2g) and percent volume occupied by plaques (P = 0.0054; two-tailed Student’s t test) (Fig. 2h) when compared with 5XFAD control mice on untreated water. No significant differences were observed between BHB-treated and untreated mice for plaque volume (Fig. 2e), plaque density (Fig. 2f) or plaque sphericity (Fig. 2i). The mechanism in which BHB reduces Aβ plaque formation remains unclear. Several studies in AD mouse models show reduced tau and amyloid pathologies by unknown mechanisms when mice are placed on a ketogenic diet or administered BHB [19, 20, 35].",9564738e-012b-420b-b87c-6cbbabeefdcb
10,introduction10," In cell culture models of AD, the addition of Aβ1–42 results in cell death caused by altered mitochondrial pyruvate activity, but can be rescued by the addition of BHB, which provides an alternative mitochondrial substrate when glucose is unavailable to be used as an energy source [31, 36, 37]. Additionally, the study by Yao and colleagues suggests dietary supplementation with 2-deoxy-d-glucose induces ketoacidosis, improves mitochondrial function, and attenuates Aβ pathology in a mouse model of AD [38]. These findings are validated by the observation that mitochondrial bioenergetics deficits are correlated with AD pathogenesis [39].  BHB treatment decreases microgliosis in 5XFAD mice Most likely due to decreased plaque-associated neuroinflammation, we observed a significant decrease in microgliosis in the BHB-treated 5XFAD mice when compared with the untreated controls (P ≤ 0.0001; one-way ANOVA with a Tukey’s multiple comparison test) (Fig. 3a).",75e084b3-58c7-48e7-805e-4372d6588571
11,introduction11," Closer examination revealed significantly decreased microglial clustering within 15 μm of plaque surfaces in 5XFAD mice treated with BHB when compared with untreated control mice (P = 0.0074; two-tailed Student’s t test) (Fig. 3b). The function of plaque-associated microgliosis in the context of AD remains unclear. For example, several groups suggest the microglia accumulation around plaques forms a protective barrier that may limit amyloid toxicity in the adjacent neurons [7, 11, 40]. In contrast, activated microglia release several proinflammatory cytokines (IL-1β, IL-18, TNF-α, IFN-γ, and IL-6) and produce reactive oxygen species, nitric oxide, and many other proinflammatory molecules implicated in neurodegeneration in AD [41]. Furthermore, the study by Sonsa and colleagues suggests microglia may promote the seeding of plaques, as depletion of microglia results in a significant reduction in plaque pathology in a 5XFAD mouse model of AD [42].",4515563b-6588-4f10-9ffe-813473c798ee
12,introduction12," Therefore, inhibiting neuroinflammation, especially prior to microgliosis, may be a key attribute of BHB as a therapeutic agent for AD. Fig. 3 BHB treatment results in less pronounced microgliosis in 5XFAD mice. Brain sections were prepared as in Fig. 2. The number of microglia/field (a) and the number of microglia within 15 μm of plaque surfaces (b) were determined using Imaris 9.2.1. (c) The box-counting method was used to calculate the fractal dimension of outlined versions of non-plaque-associated microglia (n = 3/image; 9 microglia/mouse) using FracLac for ImageJ. Microglial cells were outlined and ordered according to least complex (left) to most complex (right). (d) Cumulative distribution of fractal dimensions of non-plaque-associated microglia. Graphs show data as the mean ± SD with ****P ≤ 0.0001, ***P ≤ 0.001, **P ≤ 0.01, and N.S. = not significant    Different morphological microglia phenotypes were first described in the human brain in 1919 [43].",9cc97e80-63a0-4edc-9044-8ba8391b0905
13,introduction13," Microglia morphology is noticeably modified during disease, suggesting microglia strongly acclimate to local environments [43]. Morphologically, microglia are classified as ramified (resting), activated, and amoeboid (phagocytic) [8]. Broadly, ramified microglia tend to have moderate morphological complexity while amoeboid microglia have low complexity. Upon exposure to prolonged inflammation, activated microglia can enter a primed state where they promote an exaggerated inflammatory response that can contribute to neurodegeneration [44]. These primed microglia adopt a variety of morphologies, but tend to have higher complexity than resting microglia. Morphological changes in microglia have been observed in human AD patients [45] and in mouse models of AD [46–48], yet little is known about how microglial morphology correlates to AD pathology progression.",062f23fb-684f-4e9f-9e20-447d0fedf7b0
14,introduction14," Plaque-associated microglia usually display an amoeboid morphology, but one of the complicating factors in these studies is that microglia can feature more than one activation phenotype [49]. In our study, we specifically looked at morphological complexity in microglia which were not associated with plaques in order to analyze how reducing NLRP3 inflammasome activation alters the amount of proinflammatory microglia on a systemic level. Fractal dimension analysis of microglia morphological complexity showed a distinct difference in the 5XFAD control mice, which took on a complex, primed morphology, when compared with 5XFAD BHB-treated mice (P = 0.0068; one-way ANOVA with a Tukey’s multiple comparison test), WT mice (P = 0.0002; one-way ANOVA with a Tukey’s multiple comparison test) and WT BHB-treated mice (P = 0.",be4f55b2-11d5-4237-94ac-33315b2960fd
15,introduction15,"0004; one-way ANOVA with a Tukey’s multiple comparison test), with the microglia from BHB-treated 5XFAD mice having a less complex, ramified morphology similar to those of the WT mice (Fig. 3c, d). Additionally, the microglia of BHB-treated 5XFAD mice were similar to the microglia of the WT and WT BHB mice in having a lower density, number of branches, and area than those of the 5XFAD group, further illustrating that BHB treatment shifts microglia away from a primed, proinflammatory morphology toward a less complex, resting morphology (Supplementary Table S1). This analysis showed BHB treatment of 5XFAD caused non-plaque-associated microglia to remain in a ramified, non-activated state, whereas 5XFAD control mice had microglia in a more complex, proinflammatory state.",1c9dbb5b-6037-49ca-bcfa-056ab87f8af0
16,introduction16," Overall, these data suggest BHB treatment leads to a reduction in the total number of microglia as well as a reduction in the amount of primed, proinflammatory microglia in non-plaque-associated regions, thereby reducing neuroinflammation-associated AD pathology.  BHB inhibits NLRP3 inflammasome activation The NLRP3 inflammasome is a critical component of the innate immune system that controls caspase-1 activation and the release of IL-1β and IL-18 in macrophages [50]. We first confirmed that BHB can inhibit NLRP3 inflammasome activation in bone marrow derived macrophages (BMDM), by using the well-characterized NLRP3 activator, ATP [22]. In our hands, treatment of bone marrow derived macrophages (BMDM) with 10-mM BHB inhibited NLRP3 activation as shown by significantly reduced levels of IL-1β (P ≤ 0.0001; two-way ANOVA with a Tukey’s multiple comparison test) (Supplementary Fig. S1 A) and caspase-1 processing (P = 0.0021; two-tailed Student’s t test) (Supplementary Fig. S1 B and C).",f2a23516-cb97-4192-95da-1a0026409093
17,introduction17," Furthermore, treatment of bone marrow derived macrophages (BMDM) with BHB did not alter cell function and viability as shown by similar levels of secretion of the proinflammatory chemokine KC (CXCL1) (Supplementary Fig. S1 D).  Consistent with a decrease in inflammasome activation, there were significantly fewer Asc specks in the 5XFAD mice treated with BHB (21.5 specks/HPF) than untreated 5XFAD mice (58 specks/HPF) (P = 0.0013; two-tailed Student’s t test) (Fig. 4a, b ). Additionally, BHB-treated 5XFAD mice had significantly less processed caspase-1 in their cortices compared with control mice (P = 0.0003; two-tailed Student’s t test) (Fig. 4c, d). 5XFAD BHB-treated mice also had significantly reduced levels of secreted IL-1β in their cortices compared with control mice (P ≤ 0.0001; one-way ANOVA with a Tukey’s multiple comparison test) (Fig. 4e).",6365e152-b1e9-4a03-858a-8f8da1adef3a
18,introduction18," Additionally, immunoblotting confirmed increased mature IL-1β secretion from the cortices of 5XFAD untreated control mice (Supplementary Fig. S2). Heneka and colleagues demonstrated that NLRP3 inflammasome activation plays a crucial role in Aβ plaque deposition by promoting release of Asc specks by microglia where they bind to Aβ and act as an inflammation-driven component of Aβ pathology [9, 13]. These data suggest inhibition of the NLRP3 inflammasome as a potential mechanism by which BHB attenuates AD pathogenesis. The mechanism by which BHB inhibits NLRP3 inflammasome activation, however, remains unclear. In macrophages, Youm and colleagues suggest that BHB inhibition of the NLRP3 inflammasome occurs independently of G protein-coupled receptor (Gpr109a) and starvation-related mechanisms and that BHB blocks NLRP3 inflammasome activation by regulating upstream events that prevent potassium efflux and reduce Asc speck formation [22].",3543c24d-b7fc-4c9a-82a8-3638ffa5526a
19,introduction19," In primary microglia, Deora and colleagues confirmed BHB inhibited NLRP3 inflammasome activation induced by ATP and monosodium urate (monosodium urate (MSU)) crystals [51]. Surprisingly, BHB did not inhibit inflammasome activation by synuclein fibrils, suggesting inflammasome activation by synuclein fibrils, and potentially other pathological protein aggregates, occurs independently of the upstream events regulated by BHB described by Youm and colleagues [51]. These findings, however, do not rule out a neuroprotective role for BHB in neurons, which was also demonstrated in a mouse model of Aβ-induced AD-like pathology [31]. While the mechanism by which BHB inhibits NLRP3 inflammasome activation remains unclear, our data suggest that BHB inhibits NLRP3 inflammasome activation to attenuate AD pathology by reduced Asc speck formation, plaque nucleation, and inflammation. Fig. 4 BHB treatment attenuates NLRP3 inflammasome activation in the cortices of 5XFAD mice.",c5f38a93-a6db-417b-b61f-19e256c0ed47
20,introduction20," Brain sections from 5XFAD mice maintained on regular water (n = 6) or BHB containing water (n = 6) were stained for Asc specks (red) and plaques (methoxy X04) (blue) (a) the number of Asc specks per high powered field in the cortex were determined using Imaris (b). Lysates from whole cortices of WT and 5XFAD mice maintained on regular water (n = 3/group) or BHB containing water (n = 3/group) were analyzed for caspase-1 and β-actin by immunoblot (c) and the density of the processed caspase-1 bands were normalized to the β-actin loading control (d). Supernatants from cortex homogenates of WT and 5XFAD mice maintained on regular water or BHB-containing water were analyzed for IL-1β by ELISA (e). Graphs show data as the mean ± SD with ****P ≤ 0.0001, ***P ≤ 0.001, and **P ≤ 0.01    Conclusions We found reduced BHB levels in the red blood cells and brain parenchyma of AD patients. A previous study proposed that BHB inhibited NLRP3 inflammasome activation [22].",845b0bb1-a1d7-4959-89d1-4d9255411245
21,introduction21," This study was based on basic research in human and mouse macrophages and suggests BHB as a potential therapeutic agent for NLRP3-mediated chronic inflammatory diseases [22]. Therefore, we tested the potential of BHB to reduce AD pathology by a NLRP3-dependent mechanism in the 5XFAD mouse model of AD. We found that BHB-treated 5XFAD mice had fewer plaques and less pronounced microgliosis than untreated control mice. Importantly, BHB-treated 5XFAD mice had fewer Asc specks and less inflammasome activation in their cortices as indicated by reduced levels of processed caspase-1. Collectively, our data highlight the protective role of BHB-mediated inhibition of the inflammasome in AD. Also, our study suggests increasing BHB levels via dietary regimens or supplementation as a promising preventative and therapeutic strategy for AD. ",f41b04c0-655c-4c61-93cc-dffdeabc8261
22,methods0,"Human samples Demographics An autopsy specimen database maintained under the auspices of the Wisconsin Alzheimer’s Disease Research Center was interrogated for the presence of paired brain and blood samples associated with histopathologically documented cases of AD. The diagnosis of AD was made using the NIA-AA criteria [52]. Patients with an NIA-AA score of A3B3C3, (high AD pathologic change) were included in the AD sample group. The database was searched for non-AD control (controls (CTRL)) group cases based on histopathological evaluation without pathologic changes of AD. Cases with a diagnosis of “low” or “intermediate” AD change by NIA-AA criteria were excluded. Ten non-AD controls (CTRL) cases were selected with the intent of matching gender distribution, age, and postmortem interval between the non-AD controls (CTRL) and AD groups (Supplementary Table S2). The primary postmortem histopathologic diagnoses of patients in the two groups is shown in Supplementary Table S3.",be4514a1-4b61-47ca-9bdd-a1709465a136
23,methods1,"  Brain samples Fresh frozen 2-g (average) samples of prefrontal cortex were collected at the time of autopsy and stored at − 80 °C until shipped on dry ice to Metabolon (Durham, NC) for untargeted metabolomic analysis. No microdissection of gray and white matters was performed.  Blood samples Whole blood (20 mL) was collected in red-top non-anticoagulated tubes during postmortem examination by cardiac puncture. Samples were aliquoted and stored at − 80 °C until shipped on dry ice to Metabolon (Durham, NC) for untargeted metabolomic analysis. Aliquots from the packed cell volume of samples were obtained for analysis.  Sample preparation Samples were processed using the automated MicroLab® STAR™ system from Hamilton Company. To remove protein and small molecules and to recover chemically diverse metabolites, proteins were precipitated with methanol under vigorous shaking (Glen Mills GenoGrinder 2000) and then were centrifuged. The extract was divided into five fractions.",a6f0e50c-7b83-435b-a381-26c4222d6212
24,methods2," Two fractions were analyzed by two separate reverse phase ultra-performance liquid chromatography tandem mass spectroscopy (RP/ultra performance liquid chromatograph (UPLC)-MS/MS) methods with positive ion mode electrospray ionization (electrospray ionization (ESI)), one was analyzed by RP/ultra performance liquid chromatograph (UPLC)-MS/MS with negative ion mode electrospray ionization (ESI), one was analyzed by hydrophilic interaction chromatography (hydrophilic interaction chromatography (HILIC)) ultra performance liquid chromatograph (UPLC)-MS/MS with negative ion mode electrospray ionization (ESI), and one was reserved for backup. Organic solvent was removed by briefly placing samples on a TurboVap (Zymark), and samples were stored under nitrogen overnight prior to analysis.",456bf182-4cd9-4cb4-a141-07e7f66b5d2c
25,methods3,  Quality assurance/quality control Multiple types of controls were analyzed in tandem with experimental samples: a pooled matrix sample generated by taking a small volume of each experimental sample was used as a technical replicate; extracted water samples were used as process blanks; and a cocktail of QC standards that were chosen to not interfere with measurement of endogenous compounds was spiked into every analyzed sample to monitor instrument performance and aid with chromatographic alignment. Instrument variability was calculated using the median relative standard deviation (relative standard deviation (RSD)) for the QC standards added prior to injection. Overall process variability was determined by calculating the median relative standard deviation (RSD) for all endogenous metabolites present in 100% of pooled samples. Experimental samples were randomized across the platform run with QC samples spaced evenly among experimental samples.,b3400579-56bc-47ce-8f90-162103975411
