,chunk_label,chunk_text,uuid
26,methods4,"  Mass spectrometry parameters All analysis utilized a Waters ACQUITY ultra-performance liquid chromatograph (ultra performance liquid chromatograph (UPLC)) and a Thermo Scientific Q-Exactive high-resolution/accurate mass spectrometer, interfaced with a heated electrospray ionization (Helectrospray ionization (ESI)-II) source and Orbitrap mass analyzer at 35,000 mass resolution. Four methods were used in order to identify as many metabolites as possible.  In the first method, sample aliquots were analyzed using acidic positive ion conditions and were chromatographically optimized for hydrophilic compounds. The extract was eluted from a C18 column (Waters ultra performance liquid chromatograph (UPLC) BEH C18-2.1 × 100 mm, 1.7 μm) using a gradient of water and methanol, containing 0.05% perfluoropentanoic acid (PFPA) and 0.1% formic acid (FA).  In the second method, sample aliquots were analyzed with the same mass spectrometry conditions, but were optimized for hydrophobic compounds.",2ff6ec21-c308-472c-922a-b60f8c1f3610
27,methods5," The extract was eluted from the same column mentioned previously using methanol, acetonitrile, and water, with 0.05% PFPA and 0.1% FA. This gradient was operated at an overall higher organic gradient.  A third aliquot was analyzed using basic negative ion mode using a separate C18 column. These extracts were eluted using a gradient of methanol and water with 6.5 mM ammonium bicarbonate at pH 8.  The fourth aliquot was also analyzed via negative ion mode, following an elution from a hydrophilic interaction chromatography (HILIC) column (Waters ultra performance liquid chromatograph (UPLC) BEH Amide 2.1 × 150 mm, 1.7 um) using a gradient of water and acetonitrile with 10 mM ammonium formate at pH 10.8. The scan range varied between methods but covered a range of 70 to 1000 m/z.  Identification of features Raw data was extracted, peak-identified, and QC processed using a LAN backbone and a database server running Oracle 10.2.0.1 Enterprise Edition.",238b9507-bd32-464e-b9c8-920b36bfce85
28,methods6," These systems are built on a web-service platform utilizing Microsoft’s .NET technologies. Compounds were identified by comparison to a library of purified standards or recurring unknown entities; this library is maintained by Metabolon and contains the retention time/index (RI), mass to charge ratio (m/z), and chromatographic data (including MS/MS spectral data). Biochemical identifications are based on three criteria: retention index within a narrow RI window, accurate mass match to the library ± 10 ppm, and the MS/MS forward and reverse scores between the experimental data and authentic standards. These MS/MS scores are based on a comparison of ions present in the experimental spectrum to ions present in the library spectrum. More than 3300 commercially available purified standard compounds have been acquired and registered into Metabolon’s Laboratory Information Management System (Laboratory Information Management System (LIMS)) for analysis on all platforms.",c398abce-5976-42bb-906d-f15f64fd3287
29,methods7," Additional mass spectral entries have been made for structurally unnamed biochemicals, identified due to their recurrent nature.  Mice WT (C57BL/6J) and 5XFAD (Tg6799) mice were purchased from Jackson Laboratory. All mice were bred and housed in specific-pathogen-free conditions. At 8 weeks of age, groups of male and female WT and 5XFAD mice were administered BHB (Sigma, Cat. No. H6501)-supplemented water until 16 weeks of age. The target intake of BHB was approximately 3 g/kg of body weight/day. BHB was administered in drinking water at a final concentration of 0.01875 g/ml. The BHB dose was estimated using previous studies which showed effective ketosis induction without causing side effects [22, 53–55]. The Institutional Animal Care and Use Committee at the University of Wisconsin approved all protocols used in this study.  Preparation of mouse brain samples and confocal microscopy Brain samples were processed as previously described [3].",9a8ea7fa-a8aa-4d05-9637-9b5c7ba70ee0
30,methods8," Briefly, mice were anesthetized with isoflurane and perfused with ice-cold PBS containing 1 U/ml of heparin. Brains were fixed in 4% PFA for 48 h at 4 °C, rinsed with PBS, and incubated for 48 h at 4 °C in 30% sucrose before freezing in a 2:1 mixture of 30% sucrose and optimal cutting temperature compound. Brain samples were sectioned (40 μm) on a cryostat and stained with anti-Iba1 (Wako, Cat. No. 019-19741) and incubated overnight at 4 °C. Sections were washed with PBS and incubated with anti-rabbit IgG DyLight 549 (Vector Laboratories, Cat. No. DI-1549), methoxy-X04 (Tocris Bioscience, Cat. No. 4920) and TO-PRO-3 (Thermo Fisher Scientific, Cat. No. T3605) for 1 h at room temperature. The methoxy-X04 plaque staining was confirmed by staining with purified anti-β-Amyloid 1–16 (BioLegend, Cat. No. 803001, clone 6E10). Sections were washed and mounted using Fluoromount G (SouthernBiotech, Cat. No. 0100-001).",47492fab-8f6b-4dff-b2c7-17f58e406750
31,methods9," Random images were taken of the cortices immediately dorsal to the hippocampus as previously described [3, 56]. Images were taken using a Nikon A1R confocal microscope at the University of Wisconsin Optical Imaging Core. Images were then processed with Imaris 9.2.1 (Bitplane).  Image analyses Quantification of plaque data was performed using the surface feature in Imaris. A complex three-dimensional surface object was created by defining an intensity threshold within the channel containing methoxy-X04. Defined surfaces were inspected to determine if they truly represented plaques. The average volume, sphericity, intensity, and number of these surfaces were calculated in Imaris. The percent of the image volume that these surfaces occupied was calculated by dividing the total volume of the surfaces by the total volume of the image. Two-dimensional maximum intensity projections of these images were exported to ImageJ [57, 58] where a binary threshold was set for the plaques.",44b4684a-27b7-45a8-8c52-cf64ce24658d
32,methods10," The percent of the image area that these plaques occupied was calculated using the “Particle Analysis” function.  Analysis of microglial position and localization around plaques was performed in Imaris using scripts from MATLAB (Mathworks). A colocalization channel was created between microglia in the Iba1 channel and the nuclei in the TO-PRO-3 channel. A spots object was then created by defining the intensity threshold within the colocalization channel. The total number of these spots were calculated in Imaris and represented the total number of microglia nuclei in the image. The average number of spots whose center fell within either 15 or 30 μm of the three-dimensional intensity-defined plaque surface were calculated using a modified version of the “Find Spot Close to Surface” MATLAB script.  To quantify the morphological differences in microglia between 5XFAD and WT mice with and without BHB treatment, fractal dimensions were calculated using the ImageJ plug-in FracLac.",d774b587-d955-4045-b591-79d39200f202
33,methods11," The fractal dimension is a value that is used to quantify complexity in a binary image by measuring how detail changes with a change in scale. For each mouse, there were three images taken and for each of those images, three microglia were selected (9 microglia analyzed per mouse). The three microglia that were selected were representative of the non-plaque associated microglia in an image. There were three parameters for selecting microglia for analysis: (1) The microglia must be greater than 30 μm away from the nearest plaque (to ensure that the microglia selected were non-plaque associated). (2) The microglia must be clearly distinguishable from its background (to make proper image analysis more accurate). (3) The selected microglia must be representative of the microglia population that meets the previous two criteria (so that abnormally complex or simple microglia are not selected).",2a729263-d09d-489a-8839-15363e44f9d2
34,methods12," Microglia from the population that met all three parameters were randomly chosen and further analyzed. Then, two-dimensional max intensity projections of these microglia were exported to ImageJ. A binary threshold was set for each microglia, and background interference was removed from the images. Outlined versions of each microglia were analyzed in FracLac (http://rsbweb.nih.gov/ij/plugins/fraclac/FLHelp/Introduction.htm) using the box-counting method to determine their fractal dimension. The averages of these fractal dimensions were used to compare the morphological differences between mice and their treatment. The “Skeletonize” function in ImageJ was used to obtain data regarding microglia processes characteristics that was also used to quantify morphological changes based on treatment groups.",53abfcf6-1256-4511-97a6-fbe972aa7da7
35,methods13,"  Cell culture assays To prepare bone marrow derived macrophages (BMDM), tibias and femurs were removed from WT (C57BL/6J) mice, and flushed with RPMI 1640 supplemented with Glutamax, non-essential amino acids, sodium pyruvate, penicillin/streptomycin, and 10% heat-inactivated FBS (complete RPMI) and 20% L-cell conditioned medium (L cell conditioned medium (LCCM)). Cells were plated in petri dishes and cultured for 4–7 days prior to use. For inflammasome activation assays, 5 × 105 bone marrow derived macrophages (BMDM) were seeded per well in a 24-well tissue culture plate, primed with LPS (50 ng/ml) from Escherichia coli 0111:B4 (Invivogen) for 4 h and stimulated with the NLRP3 activator, ATP (5 mM), for 1.5 h. BHB (Sigma, Cat. No. H6501) (10 mM) was added 4 h prior to inflammasome activation.",67432caf-0e0d-4afb-a7cc-c4cf5e27042b
36,methods14," Following treatment, bone marrow derived macrophages (BMDM) were lysed with RIPA buffer (50 mM Tris, 150 mM NaCl, 1% SDS and 1% Triton X-100) containing PMSF, sodium orthovanadate, and Halt™ Protease Inhibitor Single-Use Cocktail (Thermo Fisher Scientific, Cat. No. 78425). Supernatants and lysates were flash frozen on dry ice and stored at − 80 °C until use.  ELISAs bone marrow derived macrophages (BMDM) supernatants were assayed for IL-1β and KC by ELISA. Antibody pairs for the IL-1β (MAB401 and BAF401; clone 30311 and polyclonal) ELISA were purchased from R&D Systems. The KC ELISA was performed using the Mouse CXCL1/KC DuoSet ELISA (R&D Systems, Cat. No. DY453) according to the manufacturer’s instructions.  For the BHB ELISA, 10 mg of cortex was removed from the brains of mice. The tissue was disrupted, and the proteins were precipitated with perchloric acid.",049d9f3e-a5a6-4261-9f78-5b79b9343169
37,methods15," The samples were centrifuged, and the cleared supernatants were analyzed using the colorimetric β-hydroxybutyrate Assay Kit (Abcam, Cat. No. ab83390) according to the manufacturer’s instructions.  Supernatants from mouse brain cortex homogenates were assayed for IL-1β by ELISA as described above. The supernatants were prepared by homogenizing 2.5 mg of cortex in 0.25 ml of sterile PBS. Cells and debris were removed by centrifugation, and supernatants were collected for analysis.  Immunoblotting bone marrow derived macrophages (BMDM) supernatants, bone marrow derived macrophages (BMDM) lysates, whole cortex brain lysates, and PBS soluble brain supernatants were prepared by adding NuPAGE LDS sample buffer (Invitrogen) and 10% β-mercaptoethanol and boiling for 10 min at 85 °C. Samples were run on NuPAGE 4-12% Bis–Tris precast gels (Invitrogen), transferred to nitrocellulose membranes, and blocked with 5% milk in PBS plus 0.",a0ddeba2-98c7-470c-8a31-fe1ce3c55b3a
38,methods16,"05% Tween 20 (plus 0 05% Tween 20 (PBST)) for 1 h at room temperature. Membranes were probed with anti-Caspase-1 (p20) (mouse), mAb (Casper-1) (Adipogen, Cat. No. AG-20B-0042) or anti-IL-1β (Abcam, Cat. No. ab234437) in 5% milk in plus 0 05% Tween 20 (PBST) overnight at 4 °C. Membranes were subsequently washed and incubated with IR Dye® 800 CW goat anti-mouse antibody (LI-COR, Cat. No. 926-32210) for 2 h at room temperature, washed, and scanned with the Odyssey CLx (LI-COR) imaging system. For lysates, membranes were washed and stripped using Restore™ Western Blot Stripping Buffer (Thermo Fisher Scientific). Membranes were subsequently reprobed with β-actin antibody (Cell Signaling Technology, Cat. No. 4970), incubated with IR Dye® 800 CW goat anti-rabbit antibody (LI-COR, Cat. No. 926-32211) and imaged as described above. The densities of the caspase-1 bands were normalized to the β-actin loading control using Fiji/ImageJ software [57, 58].",e81e23d2-3aba-42dc-8224-479cb306d8a5
39,methods17,"  Statistical analyses Statistical analysis was performed using Prism 8.3.1 (GraphPad). Data in figures are presented as mean ± SEM, or mean ± SD, as indicated in the figure legends. Quantification of immunoblots and confocal microscopy images were performed using Imaris, MATLAB, Fiji and ImageJ. A two-tailed Student’s t test was used to compare one variable across two conditions. For experiments in which one variable was compared in more than two conditions, one-way ANOVA with a Tukey’s multiple comparison test was used. Two-way ANOVA with a Tukey’s multiple comparison test was used to compare two variables across multiple conditions. For the fractal dimension analysis, a Kruskal–Wallis test with a Dunn’s multiple comparison test was used to determine differences amongst each group. A P value ≤ 0.05 (*P ≤ 0.05, **P ≤ 0.01, ***P ≤ 0.001, and ****P ≤ 0.0001) was used as the significance cutoff.  Supplementary information  Additional file 1: Figure S1.",2981c3a3-6642-42a2-a87c-4c88e7232bb6
40,methods18, BHB inhibits NLRP3 inflammasome activation in bone marrow derived macrophages (BMDM). Fig. S2. BHB treatment reduces mature IL-1β secretion in the cortices of 5XFAD mice. Table S1. Summary of microglial morphology data. Table S2. Demographics data of AD versus Non-AD controls (CTRL). Table S3. Primary neuropathologic diagnosis in AD versus Non-AD controls (CTRL)     Abbreviations AβAmyloid-β  ADAlzheimer’s disease  AscApoptosis-associated speck-like protein containing a caspase recruitment domain  BHBβ-Hydroxybutyrate  bone marrow derived macrophages (BMDM)Bone marrow-derived macrophages  NLRP3Nod-like receptor family pyrin domain containing 3  WTWild-type  Publisher’s Note  Springer Nature remains neutral with regard to jurisdictional claims in published maps and institutional affiliations.  Supplementary information Supplementary information accompanies this paper at 10.1186/s12974-020-01948-5.,cb5a15b4-1e23-48fb-9463-a9d9fb88df8b
41,methods19,"  Acknowledgements We would like to thank the Wisconsin Alzheimer’s Disease Research Center for providing human samples. We would also like to thank the University of Wisconsin Biomedical Research Model Services and Jody Peter for the care of our mice. Finally, we would like to thank the University of Wisconsin Optical Imaging Core and Lance Rodenkirch for providing confocal microscopy training, services, and instrumentation.  Authors’ contributions DCS and TKU were responsible for conceptualizing the project, designing, executing, analyzing the results from, and ensuring the validity of the experiments, drafting, and editing the manuscript. CW was responsible for confocal imaging and image analysis. PAV and TJR obtained human samples and analyzed resulting data from the untargeted metabolomics analyses. The authors read and approved the manuscript.",5d23b7f9-15b0-4ceb-b9e4-b2570a59417c
42,methods20,"  Funding This work was supported by startup funding from the University of Wisconsin Graduate School, the University of Wisconsin School of Medicine and Public Health, and the University of Wisconsin Department of Pathology and Laboratory Medicine awarded to TKU. Additional support for this work was provided by the University of Wisconsin Department of Pathology and Laboratory Medicine to TJR.  Availability of data and materials All data generated or analyzed during this study are included in this published article (and its supplementary information files).  Ethics approval and consent to participate  The Institutional Animal Care and Use Committee at the University of Wisconsin approved all protocols used in this study.  Consent for publication Not applicable  Competing interests The authors declare that they have no competing interests. =",9c20a939-0afb-4ca8-b46c-edc79565ead5
