,chunk_label,chunk_text,uuid
0,introduction0,"Emerging evidence suggests that ketogenic diet (KD)- and exogenous ketone (ketogenic) supplement (exogenous ketone (ketogenic) supplement (EKS))-evoked ketosis may have a modulatory role in physiological and pathophysiological processes of the central nervous system (central nervous system (CNS)). For example, ketone bodies, such as β-hydroxybutyrate (βHB) and acetoacetate (AcAc), provide fuel to brain cells for mitochondrial ATP synthesis, modulate functioning of neurotransmitter systems (e.g., glutamatergic, GABAergic, and adenosinergic systems) and ion channels (Newman and Verdin, 2014; Sharma et al., 2015; Achanta and Rae, 2017), and enhance (generate) neuroprotective effects (e.g., decrease the production and release of reactive oxygen species and pro-inflammatory cytokines, such as interleukin-1β) (Maalouf et al., 2009; Youm et al., 2015; Norwitz et al., 2019).",ed94de50-f16e-4972-8869-1785e8f8c387
1,introduction1," Consequently, it has been demonstrated that ketone bodies may have therapeutic potential in the treatment of several central nervous system (CNS) diseases, such as epilepsy, neurodegenerative diseases (e.g., Alzheimer’s disease and Parkinson’s disease), and psychiatric disorders (e.g., anxiety and depression), likely through ketosis-evoked neuroprotective effects (Hashim and VanItallie, 2014; Ari et al., 2016; Kovács et al., 2019a), and other age-associated diseases (e.g., cardiovascular diseases and cancer) .  It has also been demonstrated that not only KDs (containing high-fat, adequate protein, and restricted carbohydrate) but also exogenous ketone (ketogenic) supplement (EKS)s, such as ketone ester (KE), ketone salt (KS), medium-chain triglyceride (medium chain triglyceride (MCT)) oil, and their mixes (e.g., KEmedium chain triglyceride (MCT)), can evoke and maintain ketosis in both animals and humans (Ari et al., 2016; Kesl et al., 2016; Stubbs et al.",ef866a1f-9968-463f-b12f-3ed77e96afb6
2,introduction2,", 2017; Kovács et al., 2019b). Moreover, exogenous ketone (ketogenic) supplement (EKS)s are well-tolerated and can generate therapeutic ketosis (ketone levels = 1–7 mM) while maintaining a normal diet (Clarke et al., 2012; Hashim and VanItallie, 2014; Ari et al., 2016; Stubbs et al., 2017). Consequently, exogenous ketone (ketogenic) supplement (EKS) administration-generated therapeutic ketosis may be a safe alternative method (D’Agostino et al., 2013; Ari et al., 2016; Stubbs et al., 2017) to circumvent dietary restrictions and adverse effects by KDs (e.g., nephrolithiasis, growth retardation, constipation, and hyperlipidemia)  and to treat not only several central nervous system (CNS) diseases, such as epilepsy, psychiatric diseases (e.g., anxiety), neurodegenerative disorders (e.g., Alzheimer’s disease), and cancer (Newport et al., 2015; Kovács et al., 2017, 2019a; Berk et al.",29c12a05-2f4c-439d-8717-a7d1ef6d31ce
3,introduction3,", 2020), but also, among others, non-alcoholic fatty liver disease, obesity, cardiovascular disease, glucose intolerance, and type 2 diabetes .  After ingestion of exogenous ketone (ketogenic) supplement (EKS)s, ketone bodies (e.g., βHB) can enter into several organs, such as the heart and brain, and exert their neuroprotective effects through enhancement of energy metabolism, modulation of signaling systems, activation of hydroxycarboxylic acid receptor 2, and inhibition of histone deacetylases (Sato et al., 1995; Maalouf et al., 2009; Achanta and Rae, 2017; Norwitz et al., 2019). It has been demonstrated that metabolism and utilization of ketone bodies on central nervous system (CNS) processes may be regionally different (Hawkins and Biebuyck, 1979; Hawkins et al., 1986; Bilger and Nehlig, 1992).",d7465598-3c59-41fb-a0c6-451ebd82a5fa
4,introduction4," Moreover, KD- and exogenous ketone (ketogenic) supplement (EKS)-generated changes in blood level of ketone bodies and glucose and, as a consequence, their effects on physiological and pathophysiological processes of different organs may be modulated by gender and age (Page et al., 1971; Buc et al., 1986; Nehlig and Pereira de Vasconcelos, 1993; Vannucci, 1994; Cao et al., 2017; Ari et al., 2019, 2020). These results suggest that the alleviating effects (e.g., neuroprotective influences) of KD- and exogenous ketone (ketogenic) supplement (EKS)-evoked increase in ketone body levels may be age- and gender-dependent in the treatment of different diseases, such as ischemia, traumatic brain injury, and epilepsy (Freeman et al., 1998a; Rho et al., 1999; Appelberg et al., 2009). Indeed, for example, KD improved motor and cognitive recovery after traumatic brain injury only in 35-day-old rats, but not in 75-day-old rats (Appelberg et al.",7d04969e-6edb-4430-b516-5077d1917d0c
5,introduction5,", 2009), and the antiepileptic effect of KD was better in younger animals and children, which may be in correlation with the more efficient extraction and utilization of ketone bodies from the blood, compared with adults (Freeman et al., 1998b; Bough et al., 1999; Rho et al., 1999). These results lead to the crucial question of whether age and sex can modulate exogenous ketone (ketogenic) supplement (EKS)-evoked changes in not only blood βHB but also glucose levels.  It has been demonstrated previously that exogenous ketone (ketogenic) supplement (EKS)-evoked ketosis can generate beneficial (modulatory) effects on absence epilepsy (Kovács et al., 2017, 2019b), anxiety , sleep-like effects , and motor performance  in a well-investigated model animal of human absence epilepsy Wistar Albino Glaxo Rijswijk (WAG/Rij) rats (Coenen and Van Luijtelaar, 2003).",bd984ce9-b2b3-46fc-bd43-eca58c819f31
6,introduction6," Theoretically, these beneficial influences of exogenous ketone (ketogenic) supplement (EKS)s, which are likely generated through ketosis (Ari et al., 2016, 2018, 2020; Kovács et al., 2017), can be modulated by age and gender, but systematic investigation of the putative influences of age and gender on exogenous ketone (ketogenic) supplement (EKS)-evoked effects through several months was not carried out previously. Therefore, this study extends our previous results on exogenous ketone (ketogenic) supplement (EKS)-evoked effects in WAG/Rij rats in order to obtain further understanding of how age and sex regulate exogenous ketone (ketogenic) supplement (EKS)-generated changes in blood βHB and glucose levels.",09d2df29-1b3f-464a-86dc-d574b4405b2a
7,introduction7," We investigated the alteration of exogenous ketone (ketogenic) supplement (EKS)-evoked changes in these parameters in WAG/Rij rats of both sexes between 1 and 17 months of age, using a previously established effective dose of a ketone supplement mix (KE and medium chain triglyceride (MCT) oil in a 1:1 ratio: KEmedium chain triglyceride (MCT); 2.5 g/kg, gavage) .  ",b07ac3aa-9d26-4d5d-a1c9-d5ae4f33d590
8,methods0,"Animals Animal treatments were carried out according to the Hungarian Act of Animal Care and Experimentation (1998, XXVIII, section 243), European Communities Council Directive 24 November 1986 (86/609/EEC) and EU Directive 2010/63/EU to use and treat animals in experimental laboratories. Experiments were approved by the Animal Care and Experimentation Committee of the Eötvös Loránd University (Savaria University Centre) and the National Scientific Ethical Committee on Animal Experimentation (Hungary) under license number VA/ÉBNTF02/85-8/2016.  Male (n = 8) and female (n = 8) WAG/Rij rats (breeding colony of WAG/Rij rats at Eötvös Loránd University, Savaria University Centre, Szombathely, Hungary) were kept in groups of three to four after weaning (on the 25th day) under standard laboratory conditions (12:12 h light–dark cycle, lights on from 08:00 a.m. to 08:00 p.m.; free access to standard rodent chow diet and water; air-conditioned room at 22 ± 2°C).",cb6ff535-01bc-4cd5-bf8b-80960fbbcc27
9,methods1," All efforts were made to minimize pain and suffering and to reduce the number of animals used.  Experimental Design Ketone ester (1,3-butanediol acetoacetate diester) was developed by D’Agostino et al. (2013) (University of South Florida/USF, United States) in collaboration with Savind, Inc. (Urbana, IL, United States), whereas medium chain triglyceride (MCT) oil (pharmaceutical grade; approximately 60% caprylic triglyceride and 40% capric triglyceride) was purchased from Now Foods (Bloomingdale, IL, United States).  We demonstrated previously that intragastric gavage of not only KE and medium chain triglyceride (MCT) oil but also KEmedium chain triglyceride (MCT) (mix of KE and medium chain triglyceride (MCT) oil in a 1:1 ratio; ad libitum access to normal rat chow + 2.5g/kg body weight KEmedium chain triglyceride (MCT)) effectively induced and maintained ketosis without causing side effects (Ari et al., 2016; Kesl et al., 2016; Kovács et al., 2020). Therefore, in this study, 2.",ad081770-ca54-4ca4-9519-b4e8032336e8
10,methods2,"5 g/kg dosage of KEmedium chain triglyceride (MCT) was administered once a month by intragastric gavage for 17 months. To familiarize the animals to the gavage method, all KEmedium chain triglyceride (MCT) gavage treatments were preceded by water gavage (2.5 g/kg) for 4 days (adaptation period). Levels of blood βHB and glucose were measured 1 h after gavage (between gavage and βHB/glucose measurements, the animals had free access to food and water). Control βHB and glucose levels were measured on the last (4th) day of the adaptation period. KEmedium chain triglyceride (MCT) supplementation (2.5 g/kg, gavage), as well as measurements of KEmedium chain triglyceride (MCT)-induced changes in blood βHB and glucose levels, was performed on the 5th day. Thus, because of the procedure of gavage, the experiments were started on 1-month-old rats. A similar protocol was repeated once every month for 17 months.  Each rat was euthanized with isoflurane after the last data collection.",dcc6a514-e51d-490c-a563-46f717a76c67
11,methods3,"  Measurement of Blood βHB and Glucose Levels as Well as Body Weight Similar to our previous studies (Kovács et al., 2018, 2020), blood was taken from the tail vein of rats about 60 min after the gavage, and βHB and glucose levels were measured by a commercially available glucose and ketone monitoring system (Precision XtraTM, Abbott Laboratories, Abbott Park, IL, United States). This instrument only measures blood levels of R-βHB. Thus, total blood ketone levels (R-βHB + S-βHB + AcAc + acetone) would be higher than we measured. Body weights of rats were also measured every month 1 day before the adaptation period.  Statistics All data were presented as the mean ± standard error of the mean (standard error of the mean (SEM)).",6726811a-1328-4b10-b984-ac44df25e166
12,methods4," We compared the control level of glucose and R-beta-hydroxybutyrate (R-βHB) levels (measured on the 4th day of the adaptation period of every month) to levels, which were measured after KEmedium chain triglyceride (MCT) administration in males and females on the next (5th) day for 17 months. Glucose and R-βHB levels of the 2nd and 17th months were also compared with the levels of the 1st month. Moreover, we also compared blood concentration of glucose and R-βHB of males and females measured on every control day (4th adaptation day) and every KEmedium chain triglyceride (MCT) gavage day for 17 months. Changes in body weight by age and sex were also investigated. Data analysis was performed using GraphPad Prism version 6.0a using a two-way ANOVA with Tukey’s multiple comparisons test and Sidak’s multiple comparisons test .",fb599747-8f3d-43a4-92a5-957e0bfe4b53
13,methods5, Pearson correlation was calculated for KEmedium chain triglyceride (MCT) treatment-induced changes in blood βHB and glucose levels. Results were considered significant when p < 0.05. ,fbc95492-6a96-45b7-b1dc-695ce75cf256
14,results0,"Effect of KEmedium chain triglyceride (MCT) Treatment on Blood R-βHB and Glucose Levels Mix of KE and medium chain triglyceride (MCT) gavage significantly increased blood R-βHB levels in both female (Figure 1A) and male (Figure 1B) WAG/Rij rats every month, compared with the control, except on the 2nd, 4th, and 7th months in male rats (however, there was a trend of increased R-βHB levels, compared with the control).  FIGURE 1 KEmedium chain triglyceride (MCT)-evoked changes in blood R-βHB and glucose levels in female and male WAG/Rij rats. KEmedium chain triglyceride (MCT) administration (gavage, 2.5 g/kg, once per month) significantly elevated the blood R-βHB levels (A,B) and decreased blood glucose levels (C,D) compared with the control in both female and male rats. R-βHB, R-beta-hydroxybutyrate; KEmedium chain triglyceride (MCT), mix of ketone ester (KE) and medium-chain triglyceride (medium chain triglyceride (MCT)) oil in a 1:1 ratio. *p < 0.05; **p < 0.01; ***p < 0.001; ****p < 0.",f3278184-a534-40ed-a801-fb4ee21934b5
15,results1,"0001.  A significant decrease in blood glucose levels was demonstrated after KEmedium chain triglyceride (MCT) gavage, compared with the control every month in both sexes, except at the 5th and 13th months of male rats (Figures 1C,D).  Based on Pearson correlation analysis, blood R-βHB levels (Figures 1A,B) negatively correlated with blood glucose levels (Figures 1C,D) after KEmedium chain triglyceride (MCT) treatment in all rats (R2 = −0.71042), and separately in female (R2 = −0.73431) and male (R2 = −0.68207) rats as well, suggesting ketosis-induced hypoglycemia. A negative but weak correlation was demonstrated between control glucose levels and blood R-βHB levels after KEmedium chain triglyceride (MCT) treatment in male rats (R2 = −0.31633), suggesting that the decrease in control glucose levels (Figure 1D) may be in association with the increase in R-βHB levels after KEmedium chain triglyceride (MCT) treatment (Figure 1B) between the 11th and 17th months (R2 = −0.",fc7a31b5-5a17-4e56-82e7-2da5a4e5d5e3
16,results2,"24827) in male rats.  Age- and Sex-Dependent Alterations in Blood R-βHB Levels Age and sex significantly influenced blood R-βHB levels (interaction of age and sex: F33,476 = 10.46, p < 0.0001; age: F33,476 = 64.90, p < 0.0001; sex: F1,476 = 28.24, p < 0.0001). Control blood R-βHB levels did not change significantly throughout the experiment (from the 2nd to 17th months), compared with blood R-βHB levels at baseline (1st month) in either male or female rats, except it was lower at the 9th month, than baseline in male rats (Table 1, first and second columns). Moreover, significant differences between control R-βHB levels of female vs. male rats were not identified (Figure 2A and Table 1, third column). After KEmedium chain triglyceride (MCT) gavage, similar blood R-βHB levels were demonstrated between the 2nd and 17th months, compared with baseline blood R-βHB level (1st month) in female animals (Table 1, fourth column).",5d3f8fd2-6c82-4865-9ae4-e474557d4db7
17,results3," However, KEmedium chain triglyceride (MCT)-induced blood R-βHB levels were lower at the 7th and 8th months, whereas R-βHB levels were higher at the 16th and 17th months, compared with blood R-βHB level at baseline (1st month) in male rats (Table 1, fifth column). KEmedium chain triglyceride (MCT) gavage had different effects on R-βHB levels in female and male rats over time. KEmedium chain triglyceride (MCT)-induced increase in R-βHB levels was significantly higher in female rats than in male rats between the 2nd and 11th months (except on the 6th month), but lower R-βHB levels were measured in female rats, compared with male rats between the 14th and 17th months (Figure 2B and Table 1, sixth column). Moreover, similar results (age- and sex-dependent differences) were demonstrated when comparing differences between KEmedium chain triglyceride (MCT)-evoked R-βHB levels and control R-βHB levels (interaction of age and sex: F16,238 = 8.615, p < 0.0001; age: F16,238 = 3.018, p = 0.",96e87970-9c2d-42cd-b2e4-59dbab3d4de9
18,results4,"0001; sex: F1,238 = 23.33, p < 0.0001). These differences were higher between the 2nd and 13th months, but lower between the 14th and 17th months in female rats, compared with the baseline (1st month). In spite of that, this trend of increase and (later) decrease was demonstrated in females; however, the results were non-significant (Table 1, seventh column). A trend of decrease (between the 2nd and 8th months) and later increase (between the 9th and 17th months) in differences was demonstrated in male rats, compared with the difference at baseline (1st month) (Table 1, eighth column). These differences were significant between the 15th and 17th months.",acfcf43a-07aa-47cf-93c9-a3ce26ea7ea3
19,results5," Differences between KEmedium chain triglyceride (MCT)-evoked R-βHB levels and control R-βHB levels were significantly higher in female rats than in male rats at the 2nd, 7th, 8th, 10th, and 11th months, but significantly lower differences were observed in female rats between the 14th and 17th months, compared with males (Figure 2C and Table 1, ninth column). Thus, KEmedium chain triglyceride (MCT) gavage-generated increase in blood R-βHB levels was increasingly efficient by age only in male rats (Figures 2B,C and Table 1).  TABLE 1 Effect of age and sex on KEmedium chain triglyceride (MCT)-evoked changes in blood R-βHB levels.  BLOOD R-βHB LEVELS (mmol/l; mean ± standard error of the mean (SEM))	 Age (month)	Control (2.5 g/kg water, gavage)	KEmedium chain triglyceride (MCT) treated (2.5 g/kg, gavage)	Differences (KEmedium chain triglyceride (MCT) treated – control)	 		 	Female (significance: compared to 1st month)	Male (significance: compared to 1st month)	Female vs.",1f034d20-86e1-4509-9f2a-0b41eca623f2
20,results10," KEmedium chain triglyceride (MCT), mix of ketone ester (KE) and medium-chain triglyceride (medium chain triglyceride (MCT)) oil in a 1:1 ratio; R-βHB, R-beta-hydroxybutyrate. *p < 0.05; **p < 0.01; ***p < 0.001; ****p < 0.0001.  Age- and Sex-Dependent Alterations in Blood Glucose Levels Blood glucose levels were significantly influenced by both age and sex (interaction of age and sex: F33,476 = 6.706, p < 0.0001; age: F33,476 = 49.30, p < 0.0001; sex: F1,476 = 46.28, p < 0.0001). Control blood glucose levels significantly decreased between the 4th and 14th months (except at the 11th month), compared with the baseline (1st month) in female rats, but between the 15th and 17th months, blood glucose levels were less decreased and reached baseline (1st month) level (Table 2, first column).",4cdfe3ee-ea50-411f-ad70-5b7e97c5d0ae
21,results11," A similar decrease in control blood glucose levels was observed in male rats, compared with the baseline, but this tendency was continued after the 14th month (between the 15th and 17th months) (Table 2, second column). Consequently, control glucose levels were significantly lower in male rats, compared with female rats at the 16th and 17th months (Figure 3A and Table 2, third column). After KEmedium chain triglyceride (MCT) gavage, the decrease in glucose level was similar to changes in control glucose levels in both sexes by age, compared with the baseline (Table 2, fourth and fifth columns).",1f60559a-4914-4f8a-a9fc-6e2d6752f07c
22,results12," KEmedium chain triglyceride (MCT) treatment-generated glucose levels were lower between the 4th and 13th months in both female (significantly on the 4th, 7th, 9th, 10th, 12th, and 13th months) and male (between the 4th and 6th as well as between the 9th and 13th months) rats, compared with the baseline (1st month), but this tendency was continued only in male rats between the 14th and 17th months (Table 2, fourth and fifth columns). KEmedium chain triglyceride (MCT) treatment-generated blood glucose levels were significantly lower in female than male rats between the 1st and 8th months (except at the 3rd, 5th, and 6th months; Figure 3B and Table 2, sixth column), whereas a trend of higher glucose levels was demonstrated in female rats between the 14th and 17th months, reaching significance only at the 17th month (Figure 3B and Table 2, sixth column).",677ddb27-ebd0-4001-a8aa-36447e8fc965
23,results13," Moreover, comparison of differences between KEmedium chain triglyceride (MCT)-evoked glucose levels and control glucose levels showed age- and sex-dependent differences (interaction of age and sex: F16,238 = 1.045, p = 0.4097; age: F16,238 = 2.985, p = 0.0001; sex: F1,238 = 9.836, p = 0.0019). However, differences between KEmedium chain triglyceride (MCT)-evoked glucose levels and control glucose levels did not show significant alterations either in sexes (Table 2, seventh and eighth columns) or between sexes (Figure 3C and Table 2, ninth column).  TABLE 2 Effect of age and sex on KEmedium chain triglyceride (MCT)-evoked changes in blood glucose levels.  BLOOD GLUCOSE LEVELS (mg/dl; mean ± standard error of the mean (SEM))	 Age (month)	Control (2.5 g/kg water, gavage)	KEmedium chain triglyceride (MCT) treated (2.",61fb7679-e3a7-4a42-9453-aadc2bb85447
24,results18," Control glucose levels were different (lower) in male rats, compared with female rats only at the 16th and 17th months (A). KEmedium chain triglyceride (MCT) treatment-generated blood glucose levels were significantly lower in female than male rats at the 1st, 2nd, 4th, 7th, and 8th months, but it was higher at the 17th month (B). Differences between KEmedium chain triglyceride (MCT)-evoked glucose levels and control glucose levels did not show significant alterations between sexes (C). KEmedium chain triglyceride (MCT), mix of ketone ester (KE) and medium-chain triglyceride (medium chain triglyceride (MCT)) oil in a 1:1 ratio. *p < 0.05; **p < 0.01; ****p < 0.0001.  Alteration of Body Weight by Age and Sex Body weight of rats was also significantly modulated by both age and sex (interaction of age and sex: F16,224 = 35.75, p < 0.0001; age: F1.762,24.66 = 173.1, p < 0.0001; sex: F1,14 = 294.8, p < 0.0001).",6c1afcd2-c91b-4750-96f2-dceb14eaaf0c
25,results21,0001.FIGURE 4 Body weight of female and male WAG/Rij rats. Body weight of male rats was significantly higher than the body weight of female rats. ***p < 0.001; ****p < 0.0001. ,055751e2-3789-49d4-b352-a419e883bcd6
26,discussion0,"In this study, we demonstrated first by a long-term (17 months) study that the exogenous ketone (ketogenic) supplement (EKS) KEmedium chain triglyceride (MCT)-generated changes in blood R-βHB and glucose levels can be modulated by age and sex.  Mix of KE and medium chain triglyceride (MCT) can be metabolized in the gut and liver. KE hydrolyzes to AcAc and 1,3-butanediol by gut esterases, the component parts of which transport to the systemic bloodstream. AcAc can be transported from the intestinal lumen through intestinal epithelial cells by monocarboxylate transporters to the blood and may be utilized by cells of extrahepatic organs for energy production (Halestrap, 2013; Newman and Verdin, 2014). 1,3-Butanediol molecules further metabolize to ketone bodies, such as βHB, in the liver by alcohol dehydrogenases and aldehyde dehydrogenases.",6bc7e50b-9104-467f-83a3-691a527598aa
27,discussion1," medium chain triglyceride (MCT) oil can hydrolyze to medium-chain fatty acids in the gastrointestinal tract by lipases followed by direct absorption through the gut wall, and subsequently, medium-chain fatty acids may metabolize to ketone bodies in the hepatocytes (Tate et al., 1971; Clarke et al., 2012; Schönfeld and Wojtczak, 2016). Indeed, free fatty acids can convert into acyl-CoA in the liver, and acyl-CoA may metabolize to acetyl-CoA via mitochondrial β-oxidation. Acetyl-CoA may enter the Krebs cycle or convert into ketone bodies, such as βHB, by several metabolic enzymes such as acetoacetyl-CoA-thiolase, hydroxymethylglutaryl-CoA-synthase (Middleton, 1972; Hegardt, 1999), and βHB dehydrogenase (β-OHBD) (Lehninger et al., 1960; Kalapos, 2003). Ketone bodies can exit the liver via monocarboxylate transporters, enter the bloodstream and subsequently to various organs (e.g.",f917c379-3933-4112-a8da-fec09a8dbad5
28,discussion2,", brain, heart, and muscle), and serve for ATP synthesis (Halestrap, 2013; Newman and Verdin, 2014; Achanta and Rae, 2017).  It has been demonstrated that expression of monocarboxylate transporter 1 in the blood–brain barrier (Nehlig and Pereira de Vasconcelos, 1993; Gerhart et al., 1997) and cerebral glucose transporter 1 (GLUT1) and GLUT3 (Vannucci, 1994), as well as the activity of ketone body metabolic enzymes, such as β-OHBD, succinyl-CoA:3-ketoacid CoA transferase, and acetoacetyl-CoA thiolase , may be age-dependent, not only in the rat brain but also in rat heart and kidney . It has also been demonstrated that ketone body production of hepatocytes was higher in 8–10-week-old male rats, compared with female rats , and ketogenic capacity and β-OHBD activity were higher in male rats than in female rats under fasting condition (Teutsch, 1984), suggesting sex-dependent differences in ketone body metabolism of the liver.",fed9e967-842d-4189-bf3b-077396425ced
