,chunk_label,chunk_text,uuid
29,discussion3," Testosterone was found to increase the expression of monocarboxylate transporter 1 and monocarboxylate transporter 4 in skeletal muscles, but not in the heart . Female sex hormones can downregulate the hepatic expression of monocarboxylate transporter 1, whereas hepatic monocarboxylate transporter 4 expression may be modulated by testosterone . However, the levels and generation of ketone bodies increased more markedly in females than in males, not only in mice but also in humans under fasting conditions , likely by the modulatory effects of sex hormones . More rapid and greater decrease in blood glucose level was also demonstrated in women, compared with men during starvation, whereas the basal level of glucose and βHB was similar in both sexes , and higher hepatic glucose output was revealed in male rats during starvation .",abc183e1-6964-4566-b499-b1b676dc50a8
30,discussion4," Expression of hypothalamic GLUTs (e.g., GLUT1) increased by age in male, but not in female rats, and male adolescent rats had lower GLUT1 expression, than female adolescent rats .  Previous studies show that WAG/Rij rats spontaneously develop absence epileptic seizures (spike-wave discharges: SWDs) after about 3 months of their age (Coenen and Van Luijtelaar, 2003). SWD number gradually increases by age, but significant sex differences in changes in SWD number were not demonstrated in WAG/Rij rats (Coenen and Van Luijtelaar, 1987, 2003). It was suggested that glucose metabolism may be higher in absence epileptic animals, such as GAERS rats (Genetic Absence Epilepsy Rats from Strasbourg), compared with non-epileptic control rats (Depaulis and Van Luijtelaar, 2006), but it may correlate with interictal periods, but not with the occurrence of SWDs . Moreover, glucose release from hepatocytes may increase by age in WAG/Rij rats (Teillet et al.",4362efc4-ed2e-4108-ab13-770ddc27a778
31,discussion5,", 2001). However, we found that the control level of glucose (and its changes) was similar until approximately 14 months of their age in both sexes of WAG/Rij rats, but subsequently, glucose levels were gradually increased and decreased in female and male rats, respectively (Figure 3A). These results suggest that changes in blood glucose levels may be independent from changes in SWD number, and there may be sex-dependent differences in glucose utilization at least in older than 1-year-old WAG/Rij rats. Moreover, body weights of female and male WAG/Rij rats were significantly different (Figure 4 and Table 3), but similar control R-βHB and glucose (except between the 15th and 17th months) levels were demonstrated in both sexes (Figures 2A, 3A).",06bb948f-52d8-4487-8a89-5f9fe270a40a
32,discussion6," These results suggest that likely there is no relationship between differences in body weight of female and male animals and alterations in not only the control but also KEmedium chain triglyceride (MCT)-evoked changes in blood R-βHB and glucose levels. However, the influence of body weight differences between sexes on KEmedium chain triglyceride (MCT)-generated effects cannot be ruled out entirely.  It has been demonstrated that ketosis and changes in the rates of ketone body utilization do not evoke changes in the relatively high activity and amount of ketone body metabolic enzymes in adults . Moreover, short periods of fasting or KD are not able to change blood–brain barrier permeability to ketone bodies likely because prolonged and high ketone body levels are needed for increased transport processes (Hawkins et al., 1971; Nehlig and Pereira de Vasconcelos, 1993; Morris, 2005).",7046271b-8a49-46d0-a22f-95b20515eb02
33,discussion7," Based on these results, administration of exogenous ketone (ketogenic) supplement (EKS)s (such as KEmedium chain triglyceride (MCT)) once a month for 17 months likely may not be able to change the activity of ketone body metabolic enzymes and blood–brain barrier permeability to ketone bodies. Thus, theoretically, changes in KEmedium chain triglyceride (MCT)-evoked increase in blood R-βHB levels by age and differences between female and male rats (Figures 2B,C and Table 1) may result likely from altered expression and activity of ketone body metabolizing enzymes and/or monocarboxylate transporters in different organs between the 1st and 17th months (but not from direct and acute effects of KEmedium chain triglyceride (MCT) on ketone body metabolism or transport).",90b0b1d5-fdba-4d36-b5cc-6e773faab5e4
34,discussion8," Theoretically, similar to ketone bodies, changes by age and sex in glucose utilization month by month (but not an acute effect) may result in KEmedium chain triglyceride (MCT)-generated decrease in blood glucose concentrations (Figure 3B and Table 2). However, more studies are needed to find the exact links between the KEmedium chain triglyceride (MCT)-evoked changes in blood R-βHB and glucose levels and changes in the activity of metabolic enzymes and transporters of different organs during aging (as putative background of KEmedium chain triglyceride (MCT)-generated effects) in animals with different ages and in both sexes.  The influence of age- and sex-generated effects on glucose and ketone body metabolic enzymes and transporters under normal physiological and pathophysiological conditions, as well as after exogenous ketone (ketogenic) supplement (EKS) administration through a wide age range of rats (month by month), has not been well studied.",2a777733-0fa5-429f-bac1-231ea8283713
35,discussion9," Moreover, actual βHB and glucose levels and utilization may reflect alterations not only in the liver but also in extrahepatic tissues by age (Page et al., 1971; Edmond, 1974), and the mechanism of digestion and absorption of fat (and, theoretically, exogenous ketone (ketogenic) supplement (EKS)s) can be changed in the gut by age (Henning and Kretchmer, 1973). Thus, interpretation of our results and the explanation of the complex background processes leading to modulation of KEmedium chain triglyceride (MCT)-evoked changes in blood R-βHB and glucose concentrations by age and sex are difficult. However, our results strengthened the conclusions of previous studies above (Hawkins et al., 1971; Page et al., 1971; Merimee et al., 1978; Gerhart et al., 1997; Buc et al.",17dc4c71-d0cf-4a99-b53e-21b7394f00a2
36,discussion10,", 1986), suggesting that (i) ketone body and glucose production and utilization is maintained during the lifetime in rats, which may be modulated by age and sex; (ii) the level of both ketone bodies (R-βHB) and glucose may decrease by age after weaning; and (iii) basal levels of R-βHB and glucose are similar in females and males (Figure 2A, 3A and Tables 1, 2). In addition, our recent study markedly extends the previous results on exogenous ketone (ketogenic) supplement (EKS) administration-generated effects on blood R-βHB and glucose levels pointing out that (i) KEmedium chain triglyceride (MCT)-evoked increase in blood R-βHB levels was significant in both sexes over 17 months, compared with the control (Figures 1A,B); (ii) the rate of increase was sex-dependent (Figures 2B,C and Table 1); iii) KEmedium chain triglyceride (MCT)-generated effects on blood R-βHB levels changed by age only in male rats,",75c38d79-a88e-4150-a894-d9c632a6cba5
37,discussion11," compared with the baseline (1st month) (Table 1); (iv) KEmedium chain triglyceride (MCT) administration not only significantly increased blood R-βHB levels but also significantly decreased the blood glucose levels in both sexes between the 1st and 17th months, compared with the control (Figures 1C,D), suggesting ketosis-induced hypoglycemia; (v) the rate of decrease in blood glucose levels was also sex-dependent (Figure 3B and Table 2); and (vi) KEmedium chain triglyceride (MCT)-generated influences on blood glucose levels changed by age in both sexes, compared with the baseline (1st month) (Table 2). Based on these results, we speculated that various influences could be generated on physiological and pathophysiological processes by the same doses of exogenous ketone (ketogenic) supplement (EKS)s via distinct alteration of ketone body and/or glucose levels in males and females at different ages.",9424f76d-3f4e-409e-ac37-70c4004e5618
38,discussion12," However, blood levels of ketone bodies may not accurately reflect their levels in the brain (or in other organs) and their effect (efficacy) on physiological and pathophysiological processes, because ketone body transport could be saturated ; thus, alleviating effects of ketone bodies (ketosis) on different diseases may not be necessarily increased by a higher level of ketosis, for example, in females compared with males (Figure 2B) and in adult males compared with younger ones (Table 1). In addition, a very low level of exogenous ketone (ketogenic) supplement (EKS)-evoked ketosis may be ineffective and an exaggerated level of ketone bodies may not only be inefficacious but also harmful. Indeed, our previous study showed that, for example, to evoke an alleviating effect on impaired motor functions, generation of a certain range of blood ketone body levels is needed .",741546ee-85e8-4775-a5f0-4d83e56ca1ab
39,discussion13," However, these results suggest that different doses of exogenous ketone (ketogenic) supplement (EKS)s may be needed for safe and effective treatment of different age groups and in both genders.  Conclusion In conclusion, emerging science on metabolic therapies, such as exogenous ketone (ketogenic) supplement (EKS)s, suggests the potential of these compounds to enhance quality of life and for the treatment of different neurometabolic and age-related diseases. The present study suggests that the exogenous ketone (ketogenic) supplement (EKS)-evoked effects on blood R-βHB and glucose levels may be modulated by both age and sex. Thus, the age- and gender-dependent modulatory effects of exogenous ketone (ketogenic) supplement (EKS)s on blood R-βHB (ketosis) and glucose concentrations should be taken into consideration during the administration of metabolic-based therapies for the treatment of different diseases.",31e2cea7-59d6-4759-ad8a-6bb90d216fc7
40,discussion14," Moreover, monitoring of blood ketone body and glucose levels of exogenous ketone (ketogenic) supplement (EKS) users may be important in order to find safe and effective doses of exogenous ketone (ketogenic) supplement (EKS)s for different age groups and in both genders. However, further studies are needed to reveal the exact mechanism(s) of action of ketone body and glucose production (metabolism) and utilization during aging and the potential gender-evoked modulatory processes on exogenous ketone (ketogenic) supplement (EKS)-induced blood βHB and glucose levels not only in animals but also in human subjects.  Data Availability Statement The raw data supporting the conclusions of this article will be made available by the authors, without undue reservation.  Ethics Statement The animal study was reviewed and approved by the Hungarian Act of Animal Care and Experimentation.",251c7a3b-9abb-4e69-8e32-f1a0652ef661
41,discussion15,"  Author Contributions ZK designed the experiments, acquisition, analysis, and interpretation of the data, and wrote the manuscript. BB contributed to the acquisition of the data. DD’A revised the manuscript. CA analyzed the data and wrote the manuscript. All authors read and approved the final manuscript. ",44cd5b81-9dc5-4259-8976-6195c091babf
