,chunk_label,chunk_text,uuid
0,abstract0,"  The ketogenic diet (KD), which can induce changes in gut microbiota, has shown benefits for epilepsy and several neurodegenerative diseases. However, the effects of a KD on glucose and lipid metabolism remain inconclusive. Using two formulas of ketogenic diets (ketogenic diets commonly used in mouse trials type 1 (KDR) with 89.5% fat and KDH with 91.3% fat), which are commonly used in mouse trials, we found that ketogenic diets commonly used in mouse trials type 1 (KDR) but not KDH induced insulin resistance and damaged glucose homeostasis, while KDH induced more fat accumulation in mice. Further study showed that KD impacted glucose metabolism, which was related to the sources of fat, while both the sources and proportions of fat affected lipid metabolism. And the KD widely used in human studies still induced insulin resistance and fat accumulation in mice.",3b578a70-5d08-484f-ac0c-0c28fb6f65a6
1,abstract1," Moreover, KDs changed the gut microbiota and metabolites in mice, and the sources and proportions of fat in the diets respectively changed the abundance of specific bacteria and metabolites which were correlated with parameters related to glucose intolerance and lipid accumulation. Overall, our study demonstrated that the metabolic disorders induced by KDs are closely related to the source and proportion of fat in the diet, which may be associated with the changes of the gut microbiota and metabolites.  KEYWORDS  ketogenic diet gut microbiota fecal metabolites glucose and lipid metabolism National Natural Science Foundation of China (Natural Science Foundation of China (NSFC)) https://doi.org/10.13039/501100001809 31922003 81871091 Zhang Chenhong National Key Research and Development Project 2019YFA0905600 Zhang Chenhong cover-dateMarch/April 2021 ==== Body",abe10c39-ca95-49b6-b90f-13e613918dee
2,introduction0,"  Ketogenic diet (KD) refers to an extremely high-fat, very low-carbohydrate diet, which has shown its value in treating epilepsy and its increasing application to other diseases, such as autism spectrum disorder, Alzheimer’s disease, and metabolic syndrome (1, 2). However, reports about the effects of a KD on glucose and lipid metabolism in rodents and humans remain inconclusive. Previous clinical trials showed the effectiveness of weight loss and improvement in glucose tolerance and serum lipids in overweight/obese subjects (3–6). However, a 3-day KD increased postprandial plasma glucose in healthy men (7). Although it decreased triglycerides, a KD increased cholesterol and inflammatory markers in overweight/obese subjects after 4 weeks of dietary intervention (8). In a rodent trial, a KD reduced circulating glucose and lipids in both normal-weight and ob/ob mouse models (9) and improved glucose tolerance in diet-induced obese mice (10).",7ebde8d9-c52c-4997-9bd7-d3e6e11596cf
3,introduction1," Nevertheless, several studies found that a KD has negative effects, including hepatic steatosis, insulin resistance, and glucose intolerance (11–17), and a recent study showed that 2 to 4 months of KD feeding depleted adipose-resident γδ T cells, which could restrain inflammation, resulting in impaired glucose homeostasis (18). Although the diets mentioned above are all called a “ketogenic diet,” the differences in ingredients and dietary composition even in more controlled and standardized animal studies still exist. Therefore, clearly exploring the impact of a KD on glucose and lipid metabolism is needed.  The gut microbiota is critically influenced by diet and has been considered a key mediator linking diet and host physiology (19).",b9b313e4-cfcd-42d7-afb7-cfb90fac3095
4,introduction2," Previous work found that a KD altered the structure of gut microbiota, and specific KD-associated bacteria could protect against seizures in mouse models of intractable epilepsy, which was further confirmed because the protective effects disappeared when mice were treated with antibiotics or reared germfree (20). Furthermore, a recent study showed that a KD decreased the abundance of Bifidobacterium, and KD-associated gut microbiota reduced the levels of intestinal proinflammatory Th17 cells (21). Therefore, whether the gut microbiota altered by a KD affects host glucose and lipid metabolism became an interesting question, as did whether microbe-associated metabolites also play a role.  Here, to evaluate the effects of KD on host glucose and lipid metabolism, gut microbiota, and microbe-associated metabolites, two kinds of ketogenic diets commonly used in mouse trials, type 1 (ketogenic diets commonly used in mouse trials type 1 (KDR)) and type 2 (KDH), were investigated in mice.",ccc3ff4d-51ed-440d-9e20-666b51660b69
5,introduction3," We found that ketogenic diets commonly used in mouse trials type 1 (KDR) but not KDH induced insulin resistance and damage to glucose homeostasis, while KDH induced more fat accumulation in mice, which was associated with their distinct effects on the gut microbiota and metabolite profiles. Moreover, we showed that the differences in metabolic phenotypes in mice induced by these two kinds of KD may be due to the sources and proportions of fat in the diet. ",2cee02ca-abd3-4aba-b13b-9c72f788189c
6,methods0,"  Ethical approval.  All animal experimental procedures were approved by the Institutional Animal Care and Use Committee (Institutional Animal Care and Use Committee (IACUC)) of Shanghai Jiao Tong University (no. 2018043 and 2018106).  Animal trial.  The mice were purchased from SLAC, Inc. (Shanghai, China), and the experiments were performed at the animal center of Shanghai Jiao Tong University. All mice were kept under a standard 12-h light/dark cycle (lights on at 7:00 a.m.) and a temperature of 22°C ± 3°C.  (i) Trial 1.  After 2 weeks of accommodation, 8-week-old specific-pathogen-free (specific pathogen free (SPF)) C57BL/6J male mice were randomly assigned into four groups (9 mice per group) and fed two kinds of ketogenic diets or their control normal chow for 5 weeks: (i) fed ketogenic diet type 1 (ketogenic diets commonly used in mouse trials type 1 (KDR); Research Diets D12369B, 0.1% carbohydrate, 10.4% protein, 89.5% fat, 6.",1bcf0520-868c-437f-9e38-e912f794ad8f
7,methods1,"76 kcal/g), (ii) fed control normal chow of ketogenic diets commonly used in mouse trials type 1 (KDR) (NCR; Research Diets D12450J; 70% carbohydrate, 20% protein, 10% fat, 3.85 kcal/g), (iii) fed ketogenic diet type 2 (KDH; 1% carbohydrate, 7.7% protein, 91.3% fat, 6.77 kcal/g, produced by Fbile salt hydrolase (BSH) Biotechnology Ltd., Shanghai, China), or (iv) fed control normal chow of KDH (normal chow (NCH); 64.5% carbohydrate, 20% protein, 15.5% fat, 4 kcal/g, produced by Fbile salt hydrolase (BSH) Biotechnology Ltd., Shanghai, China). The formulas of these diets are shown in Table S1. The mice were allowed ad libitum access to water and food. Both the ketogenic diets commonly used in mouse trials type 1 (KDR) and KDH mice were fed freshly prepared ketogenic diets every day because of the perishability of ketogenic diets. The body weight of the mice and food intake per cage (3 mice per cage) were measured every 3 days.  (ii) Trial 2.",98e03c08-85fd-4ed2-87e6-65053bd514bc
8,methods2,"  After 2 weeks of acclimation, 8-week-old specific pathogen free (SPF) C57BL/6J males were randomly assigned into three groups (9 mice per group) and fed ketogenic diets with two different proportions of fat or normal chow for 5 weeks: (i) fed normal chow (normal chow (NCH)), (ii) fed KDH, or (iii) fed a ketogenic diet containing 89.5% fat [KD(89.5%); 0.1% carbohydrate, 10.4% protein, 89.5% fat, 6.57 kcal/g; produced by Fbile salt hydrolase (BSH) Biotechnology Ltd., Shanghai, China]. The formulas of these diets are shown in Table S1. The mice were allowed ad libitum access to water and food. Both the KDH and KD(89.5%) mice were fed freshly prepared ketogenic diets every day. The body weight of the mice and food intake per cage (3 mice per cage) were measured every 3 days.  (iii) Trial 3.",c60dd801-6336-4fca-8b71-97c9847d20ad
9,methods3,"  After 2 weeks of accommodation, 8-week-old specific pathogen free (SPF) C57BL/6J males were randomly assigned into two groups (9 mice per group) and fed a ketogenic diet or normal chow for 5 weeks: (i) fed normal chow (NC; same as normal chow (NCH) in the above-mentioned trial) or (ii) fed a ketogenic diet containing 72% fat [KD(72%); 8% carbohydrate, 20% protein, 72% fat, 5.65 kcal/g; produced by Fbile salt hydrolase (BSH) Biotechnology Ltd., Shanghai, China]. The formulas of these diets are shown in Table S1. The mice were allowed ad libitum access to water and food. The KD(72%) mice were fed a freshly prepared ketogenic diet every day. The body weight of the mice and food intake per cage (3 mice per cage) were measured every 3 days.  Histopathology of eAT, liver, pancreas, and ileum.",eec02c33-5ea4-4010-b381-56aadae69578
10,methods4,"  For epididymal adipose tissue (eAT) and liver, fresh tissue was fixed with 4% paraformaldehyde, embedded in paraffin, sectioned (4-μm thickness), and stained with hematoxylin and eosin (H&E) (Wuhan Servicebio Technology Ltd., Wuhan, China). Adipocyte size of eAT sections was assessed using Image-Pro Plus v6.0 (Media Cybernetics Inc., Silver Spring, MD, USA), and the mean cell area of adipocytes was determined in at least three discontinuous scans (>300 total adipocytes) in five random mice from each group. The histologic scores (nonalcoholic fatty liver disease (NAFLD) activity score) of liver sections were assessed as described previously (42). For the pancreas, fresh tissue was fixed with 4% paraformaldehyde, embedded in paraffin, sectioned (4-μm thickness), and stained for insulin (green) after standard indirect immunofluorescence staining.",4a0818b8-a446-4ef6-94b9-254ccbdc1381
11,methods5," The islet areas were determined in at least three discontinuous scans under ×400 magnification and examined as the total islet areas divided by the total number of islets. For the ileum, immunohistochemistry staining for ZO-1 was performed as previously described (29).  Blood ketone measurement.  After 6 h of fasting, blood ketone (β-hydroxybutyrate) levels were measured in blood samples collected from the tip of the tail vein with a blood ketone meter (FreeStyle Optium Neo; Abbott, USA).  Oral glucose tolerance test.  After 6 h of fasting, mice were administered glucose (2 g/kg body weight) by oral gavage, and blood samples were collected from the tip of the tail vein at 0, 15, 30, 60, 90, and 120 min after glucose administration for assessment of glucose concentrations using a blood glucose meter (Accu-Chek Performa; Roche, USA). Blood samples were collected from the tail vein into tubes at 0, 15, and 60 min after glucose administration to determine insulin concentrations.",5e41814f-2631-4481-bb84-0666e7196f71
12,methods6," The degree of insulin resistance was estimated by calculating the HOMA-IR (homeostatic model assessment for insulin resistance, glucose × insulin/22.5 × 21.2 from fasting samples) index and insulin resistance index (the product of the 0- to 60-min area under the curve [areas under the curve (AUC)] of blood glucose and that of serum insulin in oral glucose tolerance test (OGTT)).  Serum lipopolysaccharide (LPS) binding protein (LBP) and insulin measurement.  After blood was placed at room temperature for 40 min, the samples were centrifuged at 3,500 rpm for 15 min at 4°C, and the supernatant was collected and then stored at −80°C until further analyses. According to the manufacturer’s instructions, enzyme-linked immunosorbent assays (ELISAs) were used to quantify lipopolysaccharide (lipopolysaccharide (LPS))-binding protein (lipopolysaccharide (LPS) binding protein (LBP)) (PCDBM0177; P&C Biotechnology Ltd., China) and insulin (90080; Chrystal Chem, USA).  Hepatic lipid measurement.",a1140c7b-fa60-4062-bbd9-4b78cebd1343
13,methods7,"  Semithawed liver tissue samples were cut to approximately 0.1 g and homogenized in a corresponding volume (1/9, wt/vol) of homogenizing buffer (pH 7.4; 0.01 mol/liter Tris-HCl, 0.1 mmol/liter EDTA-Na2, 0.8% NaCl) in screw tubes. Next, the tubes were shaken for 5 min at 25 Hz/s with a TissueLyser (Qiagen, Germany) and then put into an ice water mixture for 5 min, and the above steps were repeated again. Afterward, the supernatant was collected after being centrifuged at 2,500 rpm for 10 min at 4°C and used to measure concentrations of hepatic total cholesterol (A111-1-1; Nanjing Jiancheng Bioengineering Institute, Nanjing, China) and triglyceride (A110-1-1; Nanjing Jiancheng Bioengineering Institute, Nanjing, China) using the assay kits. The hepatic lipid results were corrected by calculating the total protein concentration (20202ES76; Yeasen Biotechnology Ltd., China).  Colon RNA isolation and reverse transcription qPCR (RT-qPCR).",dd032779-d6c6-4a4d-a147-baef22356f17
14,methods8,"  According to the manufacturer’s protocol, total RNA was extracted from the colon using an RNeasy minikit (74804; Qiagen, Germany) and reverse transcribed into cDNA using a SuperScript kit (18080-051; Invitrogen, USA). Quantitative real-time PCR (qPCR) was performed in an 20-μl reaction system containing template, forward and reverse primers, and SYBR green I PCR Supermix (Bio-Rad) on a LightCycler 96 system (Roche Applied Sciences) and used to assess the expression of Zo-1, Occludin, Muc1, Muc2, and Muc3. The PCR conditions were 95°C for 3 min, followed by 40 cycles of 95°C for 20 s, 56°C for 30 s, and 72°C for 30 s, and plate reads for 5 s. Gene expression levels were determined using the cycle threshold (2−ΔΔCT) method, with Beta-actin serving as the reference gene.",b0526863-1949-4bb5-91c4-2510217361cc
15,methods9," Forward (F) and reverse (R) primer sequences (43) are as follows: Zo-1, F-ACCCGAAACTGATGCTGTGGATAG and R-AAATGGCCGGGCAGAACTTGTGTA; Occludin, F-ATGTCCGGCCGATGCTCTC and R-TTTGGCTGCTCTTGGGTCTGTAT; Muc1, F-TACCCTACCTACCACACTCACG and R-CTGCTACTGCCATTACCTGC; Muc2, F-CACCAACACGTCAAAAATCG and R-GGTCTCTCGATCACCACCAT; Muc3, F-CTTCCAGCCTTCCCTAAACC and R-TCCACAGATCCATGCAAAAC; Beta-actin, F-GGCTGTATTCCCCTCCATCG and R-CCAGTTGGTAACAATGCCATGT.  Statistical analysis for animal trials.  Statistical significance for physiological and biochemical data of mice in different groups was analyzed with one-way analysis of variance (analyzed with one way analysis of variance (ANOVA)) followed by a Tukey post hoc test using the “stats” and “multcomp” packages in R (v3.6.1) (www.r-project.org). Differences were considered statistically significant when P was <0.05.  qPCR of total fecal bacteria.",82bf443d-bee4-4f32-90c2-0c0bc0fc17c4
16,methods10,"  A plasmid of the 16S full-length positive Akkermansia muciniphila strain (n = 109 copies/μl) was diluted according to different gradients successively to 108, 107, 106, 105, 104, 103, and 102 copies/μl. qPCR was performed in a 20-μl reaction system containing template (20 ng), primer Uni331F (5′-TCCTACGGGAGGCAGCAGT-3′), primer Uni797R (5′-GGACTACCAGGGTATCTAATCCTGTT-3′) (44), and supermix (Bio-Rad) on a LightCycler 96 system, with 2 replicates for standard and sample DNA. The PCR conditions were 95°C for 3 min, followed by 40 cycles of 95°C for 15 s, 60°C for 60 s, and 80°C for 5 s, and plate reads for 5 s. A standard curve was determined though a linear fit of the copy number and CT value of the plasmid in different gradients. The copy number of sample DNA was calculated through a standard curve using Opticon Monitor 3.1. Data were analyzed with one-way analyzed with one way analysis of variance (ANOVA) followed by a Tukey post hoc test.",5d5227b4-06e5-4f6d-89d2-2858e6658d1e
17,methods11,"  16S rRNA gene V3-V4 region sequencing and data analysis.  During the animal trial, fresh feces were collected weekly and stored at −80°C until analysis. DNA was extracted from fecal samples collected at the 5th week using a previously described method (45). A sequencing library of the V3-V4 regions of the 16S rRNA gene was constructed according to the manufacturer’s instructions (part no. 15044223 Rev. B; Illumina Inc., CA, USA) with some modifications as previously published (46) and sequenced on the MiSeq system (Illumina, Inc., CA, USA) with the MiSeq reagent kit v3 (2 × 300 cycles, no. MS-102-3033).  The raw paired-end reads were submitted to Quantitative Insights Into Microbial Ecology2 (QIIME2, v 2018.11) (47) for analysis. Sequence quality and primer removal were processed using the “Demux” and “cutadapt” plugins, respectively, and DADA2 (48) was used to obtain a quality-filtered, denoised, chimera-free, and merged amplicon sequence variants (ASVs) (49).",34e27e17-c683-494a-a9cc-1ebe7f235766
18,methods12," Representative sequences for each ASVs were built into a phylogenetic tree by FastTree and assigned taxonomic classifications using the SILVA132 16S rRNA database (50). Alpha diversity metrics (observed ASVs and Shannon index), beta diversity metrics, and principal-coordinate analysis (PCoA) were calculated using the “core-metrics-phylogenetic” plugin after sequencing depth was downsized to 20,000 (trial 1) and 13,000 (Trials 2 and 3) sequences per sample. The statistical significance of gut microbiota among different groups was assessed by permutational multivariate analysis of variance (PERManalyzed with one way analysis of variance (ANOVA); 9,999 permutations). PERManalyzed with one way analysis of variance (ANOVA) clustering analysis was performed with Bray-Curtis distances. Differences were considered significant when Q was <0.05.  Sparse partial least-squares discriminant analysis (sPLS-DA) (51) was performed using the “mixOmics” (v6.8.",ffab6120-72f6-4a68-9450-17be23f7589c
19,methods13,"2) package (52) in R to identify the discriminative ASVs between different groups (NCR and ketogenic diets commonly used in mouse trials type 1 (KDR), normal chow (NCH) and KDH, and ketogenic diets commonly used in mouse trials type 1 (KDR) and KDH). The optimal classification performance of the sPLS-DA model was assessed with the perf function using leave-one-out cross-validation with the smallest error rate. Variations in the relative abundance of selected ASVs in different groups were analyzed by the Mann-Whitney U test in MATLAB (R2017b). Differences were considered significant when P was <0.05.  The visual presentation of the heatmap showing the relative abundance of selected ASVs in different groups was performed using the “pheatmap” package in R. Spearman correlations between ASV abundance and host parameters related to glucose and lipid metabolism were calculated using MATLAB.",bb33f364-440e-4397-b5a8-677c29b01037
20,methods14," The P values were adjusted by false discovery rate (false discovery rate (FDR)) estimation using the Benjamini-Hochberg method (53). The visual presentation of correlations was performed using the “ggcorrplot” package in R. Correlations were considered significant when false discovery rate (FDR) was <0.05.  Untargeted metabolomics study and data analysis.  Cecum content samples (60 mg) were homogenized in 200 μl distilled water and vortexed. Next, 800 μl of methanol-acetonitrile solution (1:1, vol/vol) mixture was added to precipitate protein, pulverized by ultrasonic wave at low temperature for 30 min, and then kept at −20°C for 1 h. Next, samples were centrifuged at 14,000 relative centrifugal force (rcf) for 20 min at 4°C and stored at −80°C after removing the supernatant and vacuum drying. Quality control (QC) samples were prepared using the same methods.",682da190-fee4-46da-9016-d4beb640eb26
21,methods15," Ultra-high-performance liquid chromatography–quadrupole time-of-flight mass spectrometry (UHPLC-Q-TOF-MS) analysis of cecal contents in mice was performed by Shanghai Applied Protein Technology Ltd. (Shanghai, China) on the 1290 Infinity ultrahigh-performance liquid chromatography system (Agilent, Germany) coupled with a Triple TOF 5600 system (AB Sciex, USA). The raw data were converted into mzXML format using Proteo Wizard software, and peak alignment, retention time correction, and peak area extraction were performed using the XCMS program. Details of the data processing and analysis were performed as described previously (54).  Variable importance in projection (Variable importance in projection (VIP)) scores obtained from the orthogonal projection to latent structure-discriminant analysis (OPLS-DA) model were used to assess the contribution of variables.",9438cd71-889a-4ca3-a502-be037b020d28
22,methods16," Metabolites that had a Variable importance in projection (VIP) of >1 between different groups (NCR and ketogenic diets commonly used in mouse trials type 1 (KDR), normal chow (NCH) and KDH, and ketogenic diets commonly used in mouse trials type 1 (KDR) and KDH) were defined as discriminating metabolites, and then these discriminating metabolite levels were compared between different groups using Student’s t test statistical analysis. Only discriminating metabolites that had P of <0.05 were defined as significant discriminative metabolites and identified by searching an in-house standard MS/MS library (using exact mass data [mass error ≤ 25 ppm] or MS/MS spectra matching).  The visual presentation of the heatmap showing the standardized concentration of significant discriminative metabolites in different groups was performed using the “pheatmap” package in R.",71a65ede-78bf-4a40-8233-98741c585643
23,methods17," Spearman correlations between metabolite concentration and host parameters related to glucose and lipid metabolism were calculated using MATLAB. The P values were adjusted by false discovery rate (FDR) estimation. The visual presentation of correlations was performed using the “ggcorrplot” package in R. Correlations were considered significant with an false discovery rate (FDR) of <0.05.  The “effect size” analysis strategy (55) was used to determine the biomarker metabolites affecting the gut microbiome. The adonis function of the “vegan” package in R was used to estimate the “one-to-all” effect size (R2) between each single variable of metabolites to the whole gut microbiome. Only variables with significant (P < 0.05, 999 permutations) effects and R2 > 0.09 on the gut microbiome were considered later.  Targeted fatty acid quantitation.",ceb486a1-bea8-4957-b817-07764478b0dc
24,methods18,"  Gas chromatography-mass spectrometry (GC-MS) analysis of fatty acids in the three ketogenic diets [ketogenic diets commonly used in mouse trials type 1 (KDR), KDH, and KD(89.5%); 3 replicates for each diet] was performed by BioNovoGene Technology Ltd. (Suzhou, China) on a GC-MS-QP2010 Ultra system (Shimadzu, Japan). Data were analyzed with one-way analyzed with one way analysis of variance (ANOVA) followed by a Tukey post hoc test. Samples (200 to 400 mg) were homogenized in a 1-ml N-hexane–isopropanol solution (3:2, vol/vol) mixture with 3-mm-diameter zirconia/silica steel beads, pulverized by ultrasonication for 30 min, and then centrifuged at 12,000 rpm for 5 min. Then, 500 μl of supernatant was added to 1 ml N-hexane. After repeating centrifugation for 5 min, 900 μl of supernatant was added to 400 μl methanol. After pulverizing in an ultrasonic wave for 5 min, 40 μl diazomethane was added and kept at room temperature for 15 min, and then centrifugation was repeated.",c971e289-ac81-4e3e-893d-407a1066da6e
25,methods19," Two hundred microliters of N-hexane was added after collecting the supernatant (200 μl) and vacuum drying, and the samples were centrifuged. Finally, the supernatant was collected and transferred into a GC vial for GC-MS analysis.  Targeted short-chain fatty acid (short chain fatty acid (SCFA)) quantitation.  GC-MS analysis of short chain fatty acid (SCFA)s in the cecal contents of mice was performed on an Agilent 6890 (Agilent Technologies, CA, USA) with flame ionization, thermal conductivity detectors, and capillary columns. Data were analyzed with one-way analyzed with one way analysis of variance (ANOVA) followed by a Tukey post hoc test. Then, 50 mg cecal contents was homogenized with 250 μl phosphate buffer and centrifuged at 16,000 × g for 15 min at 4°C. The supernatants were filtered through 0.22-μm filters. Eighty microliters of supernatant was acidified by adding 40 μl of 50% (vol/vol) sulfuric acid.",476f68b7-31e0-417a-a3d6-9bfe2d547e7d
26,methods20," After vortexing and standing for 2 min, the organic acids were extracted by adding 160 μl of diethyl ether. Finally, the supernatant was collected for GC-MS analysis.  Targeted bile acid quantitation.  Ultra-high-performance liquid chromatography–mass spectrometry (UPLC-MS) analysis of bile acids in the cecal contents of mice was performed on a Waters Acquity UPLC using an ethylene-bridged hybrid (bridged hybrid (BEH)) C18 column (1.7 μm, 2.1 × 100 mm) coupled with a Triple TOF 4000 system equipped with an electrospray ionization (electrospray ionization (ESI)) source operating in negative mode (AB Sciex, USA). Data were analyzed with one-way analyzed with one way analysis of variance (ANOVA) followed by a Tukey post hoc test. Ten milligrams of cecal contents from mice was preweighed, mixed with 1 ml precooled methanol (−20°C) and 100 mg glass beads, and shaken for 1 min at 25 Hz/s, and this process was repeated at least two times.",fd3289fb-7b32-429f-9fac-5fcee8fc4635
