,chunk_label,chunk_text,uuid
27,methods21," Next, samples were pulverized by ultrasonic wave for 30 min and then centrifuged at 12,000 rpm for 10 min at 4°C. Methanol (580 μl) was added after collecting the supernatant (20 μl) and vortexed for 30 s. Finally, the supernatant was collected for LC-MS analysis.  Targeted tryptophan metabolite quantitation.  UPLC-MS analysis of tryptophan metabolites in the feces of mice was performed on a Waters Acquity UPLC using an HSS T3 column (1.8 μm, 2.1 × 100 mm) coupled with a Q Exactive mass spectrometer equipped with an electrospray ionization (ESI) source operating in negative mode (Thermo, USA). Data were analyzed with one-way analyzed with one way analysis of variance (ANOVA) followed by a Tukey post hoc test. Thirty milligrams of feces from mice was preweighed and mixed with 500 μl of 50% acetonitrile, followed by thorough homogenization. Next, samples were kept on ice for 30 min and centrifuged at 12,000 rpm for 10 min at 4°C.",f1f0cccc-3f06-4c4d-b3c1-75e7943d8594
28,methods22," The supernatant was collected, and the above steps were repeated three times. Two hundred microliters of 50% acetonitrile was added after collecting the supernatant and vacuum drying and centrifuged at 12,000 rpm for 10 min. Finally, the supernatant was collected for LC-MS analysis.  Data availability.  The raw Illumina sequence data generated during the current study have been deposited to the NCBI under BioProject accession no. PRJNA674951.  ACKNOWLEDGMENTS  This work was supported by the grants from the National Natural Science Foundation of China (31922003, 81871091) and the National Key Research and Development Project (2019YFA0905600).  C.Z. conceived and designed the study. Y.L., X.Y., J.Z., T.J., and Z.Z. conducted the animal trial 1 and sample collection. Y.L., Z.W., and M.G. carried out the animal trials 2 and 3 and sample collection. Y.L. conducted the physiological data analysis. Y.L., X.Y., Z.W., and M.G. prepared the DNA and conducted the sequencing of 16S rRNA genes. Y.",3cb21a3e-62e3-43bb-b076-6f7175f13710
29,methods23,"L. analyzed the sequencing data analysis and performed the metabolomics analysis. Y.L. and C.Z. wrote and revised the manuscript. All authors read and approved the final manuscript.  We declare no conflicts of interest.  This article is a direct contribution from Liping Zhao, a Fellow of the American Academy of Microbiology, who arranged for and secured reviews by Jun Wang, Max-Planck Partner Group for Bioinformatics and Computational Biology, Institute of Microbiology, Chinese Academy of Sciences, and Peng Chen, Southern Medical University, China.  Citation Li Y, Yang X, Zhang J, Jiang T, Zhang Z, Wang Z, Gong M, Zhao L, Zhang C. 2021. Ketogenic diets induced glucose intolerance and lipid accumulation in mice with alterations in gut microbiota and metabolites. mBio 12:e03601-20. https://doi.org/10.1128/mBio.03601-20. =",07dc7a30-ff98-4306-b4ab-b4223024c30c
30,results0,"  Ketogenic diets induced glucose intolerance and lipid accumulation in mice.  To observe how two kinds of ketogenic diets impacted physiological and metabolic consequences in mice, 8-week-old male C57BL/6J mice were randomly assigned into four groups: (i) fed ketogenic diet type 1 (ketogenic diets commonly used in mouse trials type 1 (KDR), caloric ratio of 89.5% fat, 0.1% carbohydrate, and 10.4% protein), (ii) fed control normal chow of ketogenic diets commonly used in mouse trials type 1 (KDR) (NCR, caloric ratio of 10% fat, 70% carbohydrate, and 20% protein), (iii) fed ketogenic diet type 2 (KDH, caloric ratio of 91.3% fat, 1% carbohydrate, and 7.7% protein), and (iv) fed control normal chow of KDH (normal chow (NCH), caloric ratio of 15.5% fat, 64.5% carbohydrate, and 20% protein). Details of these diets are shown in Table S1 in the supplemental material.",1bfa2431-1751-4770-896b-38db84d3ac21
31,results1," β-Hydroxybutyrate concentrations in blood significantly increased in the mice fed the two kinds of KD, and there was no difference between the ketogenic diets commonly used in mouse trials type 1 (KDR) and KDH groups (Fig. S1a).  10.1128/mBio.03601-20.1 FIG S1 The effects of KDs on β-hydroxybutyrate, weight, and intestinal barrier in mice. (a) Blood ketone (β-hydroxybutyrate) levels. (b) Curves of blood glucose levels during oral glucose tolerance test (OGTT) and areas under the curve (AUC) after 2 weeks of dietary intervention. (c) The body weight of each group after 5 weeks of dietary intervention. (d) Relative expression of Occludin, Muc2, Zo-1, Muc1, and Muc3 in the colon. Differences are analyzed using t test. (e) Representative immunohistochemistry-stained (brown) sections for ZO-1 of ileum (scale bar = 100 μm) and calculated average integrated optical density (integrated optical density (IOD)). (f) Serum level of lipopolysaccharide (LPS) binding protein (LBP).",d5cc7851-03a4-4abd-92e3-7ea9243a47a0
32,results2," Data are presented as the mean ± SEM and analyzed using one-way analyzed with one way analysis of variance (ANOVA), followed by a Tukey post hoc test, except for panel d. *, P < 0.05; **, P < 0.01; ***, P < 0.001. n = 8 to 9 for both groups for all analyses. Download FIG S1, PDF file, 2.9 MB.  Copyright © 2021 Li et al. 2021 Li et al. https://creativecommons.org/licenses/by/4.0/ This content is distributed under the terms of the Creative Commons Attribution 4.0 International license.  10.1128/mBio.03601-20.8 TABLE S1 The formulas of diets in animal trials. Download Table S1, DOCX file, 0.01 MB.  Copyright © 2021 Li et al. 2021 Li et al. https://creativecommons.org/licenses/by/4.0/ This content is distributed under the terms of the Creative Commons Attribution 4.0 International license.  First, we observed how these two kinds of KD affected glucose metabolism.",07c4f03c-64df-49ff-9c47-fe632f2f43dd
33,results3," We did oral glucose tolerance test (oral glucose tolerance test (OGTT)) after 2 and 5 weeks of dietary intervention and found that the ketogenic diets commonly used in mouse trials type 1 (KDR) mice showed significantly higher fasting blood glucose levels than the NCR mice, but there was no significant difference between the mice in the KDH and normal chow (NCH) groups (Fig. 1a). Moreover, we found that the ketogenic diets commonly used in mouse trials type 1 (KDR) mice but not KDH mice had slower glucose clearance than their control group during the oral glucose tolerance test (OGTT) (Fig. 1b and Fig. S1b). Although the secretion of insulin was similar among the four groups of mice, which was confirmed by fasting blood insulin levels and immunofluorescence staining for insulin in the pancreas (Fig.",89293edf-53af-4b9e-91ea-dc53ed05be72
34,results4," 1c and d), the homeostatic model assessment for insulin resistance (HOMA-IR) index and insulin resistance index were significantly increased in the ketogenic diets commonly used in mouse trials type 1 (KDR) mice (Fig. 1e to g). These results suggested that ketogenic diets commonly used in mouse trials type 1 (KDR) but not KDH induced insulin resistance and damage to glucose homeostasis in mice.  FIG 1 KD induced glucose intolerance and lipid accumulation in mice. (a) Fasting blood glucose. (b) Curves of blood glucose levels during oral glucose tolerance test (oral glucose tolerance test (OGTT)) and areas under the curve (areas under the curve (AUC)). (c) Fasting serum insulin. (d) Representative insulin immunofluorescence-stained (green) histological sections of pancreas (scale bar = 200 μm) and calculated mean area of islet. (e) Serum insulin levels during oral glucose tolerance test (OGTT) and areas under the curve (AUC).",b670f227-4dc0-4280-9e2e-bfa40dae07e6
35,results5," (f) Homeostasis model assessment of insulin resistance (HOMA-IR). (g) Insulin resistance index (the product of the 0- to 60-min areas under the curve (AUC) of blood glucose and that of serum insulin in oral glucose tolerance test (OGTT)). (h and i) Epididymal and retroperitoneal fat mass (% body weight), respectively. (j and k) Concentrations of total cholesterol and triglyceride in liver, respectively. (l) Representative H&E-stained histological sections of epididymal adipose tissue (eAT) (scale bar = 200 μm) and calculated mean cell area of adipocytes (n = 5 per group). (m) Representative H&E-stained histological sections of liver (scale bar = 200 μm) and calculated histologic score (nonalcoholic fatty liver disease (NAFLD) activity score). Data are presented as the mean ± SEM and analyzed using one-way analyzed with one way analysis of variance (ANOVA), followed by a Tukey post hoc test. *, P < 0.05; **, P < 0.01; ***, P < 0.001.",5b01a4a6-eb85-4eb9-aab6-0d6173bc645b
36,results6," n = 8 to 9 for both groups for all analyses except n = 5 for panel l.  Next, we observed how these two kinds of KD impacted lipid metabolism. After 5 weeks of dietary intervention, the KDH mice had lower body weights (Fig. S1c) and higher weights of epididymal and retroperitoneal fat mass (Fig. 1h and i) than the normal chow (NCH) mice. Furthermore, the KDH mice also exhibited excessive lipid accumulation in the liver with increased concentrations of liver total cholesterol and triglyceride compared to the normal chow (NCH) mice (Fig. 1j and k). However, there was no significant difference in the above parameters between the mice in the ketogenic diets commonly used in mouse trials type 1 (KDR) and NCR groups.",f51473ee-6370-467a-9278-4b5c6059acb0
37,results7," Both the adipocyte size and nonalcoholic fatty liver disease (nonalcoholic fatty liver disease (NAFLD)) activity score significantly increased in the mice fed the two kinds of KD compared to their respective control groups, which were estimated by hematoxylin and eosin (H&E)-stained epididymal fat and liver, and the KDH mice had significantly higher values than the ketogenic diets commonly used in mouse trials type 1 (KDR) mice (Fig. 1l and m). These results suggested that KDH induced more fat accumulation in mice than ketogenic diets commonly used in mouse trials type 1 (KDR).  Previous studies have shown that metabolic diseases, including type 2 diabetes (T2D) and nonalcoholic fatty liver disease (nonalcoholic fatty liver disease (NAFLD)), which disrupt glucose and lipid metabolism, are characterized by an impaired and defective intestinal barrier (22).",f3e373f9-e089-48b9-8e6d-da9b20bfac75
38,results8," To determine whether intestinal permeability was impacted by two kinds of KD, we measured the expression of Zo-1, Occludin, Muc1, Muc2, and Muc3 in the colon. The ketogenic diets commonly used in mouse trials type 1 (KDR) and KDH mice showed significantly lower expression of Occludin and Muc2 than their control groups, implying that the intestinal barrier was damaged in the mice fed with the two kinds of KD (Fig. S1d), which was further confirmed by immunohistochemistry staining for ZO-1 in the ileum (Fig. S1e). Moreover, we found that the serum level of lipopolysaccharide (lipopolysaccharide (LPS))-binding protein (lipopolysaccharide (LPS) binding protein (LBP)) was significantly enhanced in the mice fed with the two kinds of KD, implying increased intestinal permeability to lipopolysaccharide (LPS), and there was no difference between the ketogenic diets commonly used in mouse trials type 1 (KDR) and KDH mice (Fig. S1f).",266da742-54ac-4366-8f37-431112371f5e
39,results9," These results suggested that both ketogenic diets commonly used in mouse trials type 1 (KDR) and KDH impaired intestinal barrier function in mice.  Two kinds of ketogenic diets molded disparate gut microbiota in mice.  By quantitative real-time PCR (qPCR) targeting the 16S rRNA gene, we found that the total bacterial loads in feces were similar among the four groups of mice (Fig. S2a). To analyze whether the structure of gut microbiota was modulated by these two kinds of KD, we sequenced the 16S rRNA gene V3-V4 region of fecal samples collected at the 5th week. After 5 weeks of intervention, the richness and diversity of gut microbiota, which were reflected by the numbers of observed amplicon sequence variants (ASVs) and the Shannon index, were significantly increased only in the KDH mice but not in the ketogenic diets commonly used in mouse trials type 1 (KDR) mice compared to their control groups (Fig. S2b).",be061884-f9da-4696-8070-537a2bd942d6
40,results10," Principal-coordinate analysis (PCoA) and permutational multivariate analysis of variance (PERManalyzed with one way analysis of variance (ANOVA)) based on Bray-Curtis distances showed clear separations of gut microbiota structure between the mice in the ketogenic diets commonly used in mouse trials type 1 (KDR) and NCR groups, as well as the KDH and normal chow (NCH) groups (P < 0.01 with PERManalyzed with one way analysis of variance (ANOVA), 9,999 permutations). Although the gut microbiota structures were more similar in the mice fed the two kinds of KD than in mice fed the two control diets, there was still a significant difference between the ketogenic diets commonly used in mouse trials type 1 (KDR) and KDH mice (Fig. 2a and b).  FIG 2 Two kinds of KD molded disparate gut microbiota in mice. (a) Principal-coordinate analysis (PCoA) plot of gut microbiota based on the Bray-Curtis distance.",a54ba72a-1a6f-4266-9526-4523e648429a
41,results11," (b) Clustering of the gut microbiota between different groups calculated with permutational multivariate analysis of variances (PERManalyzed with one way analysis of variance (ANOVA); 9,999 permutations) using Bray-Curtis distances. **, P < 0.01. (c) Left, the heatmap represents the normalized and log2-transformed relative abundance of the 87 ASVs in each sample. These ASVs were clustered by the ward.D method. Right, Spearman correlations between the relative abundance of 87 ASVs and the host parameters related to glucose and lipid metabolism. P values of correlations were adjusted by false-discovery rate (false discovery rate (FDR)). Only where false discovery rate (FDR) was <0.05, red and blue denote significant positive and negative correlation, respectively.  10.1128/mBio.03601-20.2 FIG S2 Total fecal bacterial concentrations, observed ASVs, and Shannon index of each group after 5 weeks of dietary intervention.",88e09ed5-778e-4f07-8913-607ddc24d8bc
42,results12," For panel a, data are presented as the mean ± SEM and analyzed using one-way analyzed with one way analysis of variance (ANOVA), followed by a Tukey post hoc test. For panel b, data are analyzed using Kruskal-Wallis test. *, P < 0.05. n = 9 for both groups for all analyses. Download FIG S2, PDF file, 0.9 MB.  Copyright © 2021 Li et al. 2021 Li et al. https://creativecommons.org/licenses/by/4.0/ This content is distributed under the terms of the Creative Commons Attribution 4.0 International license.  We constructed sparse partial least-squares discriminant analysis (sPLS-DA) models to identify members of the gut microbiota responding to these two kinds of KD intervention. We found that 44 ASVs were shifted in the ketogenic diets commonly used in mouse trials type 1 (KDR) mice compared to the NCR mice, while 40 ASVs showed differences between the KDH and normal chow (NCH) mice (Fig. S3a and b).",864e7b5d-b2dc-4035-976c-f5cf36180a3c
43,results13," Notably, only 16 ASVs showed the same changes in both the ketogenic diets commonly used in mouse trials type 1 (KDR) and KDH mice. Of these, the abundances of ASVs, including Ruminococcaceae (ASV208, ASV291), Intestinimonas (ASV43, ASV96, ASV272), and Lachnospiraceae (ASV44, ASV18, ASV159, ASV164, ASV165), were significantly enriched by both types of KD, and all these ASVs positively correlated with parameters related to glucose intolerance and lipid accumulation. Furthermore, 6 ASVs, including Enterococcus (ASV5), Blautia (ASV31), Turicibacter (ASV38), Lachnoclostridium (ASV56), and Lachnospiraceae (ASV59, ASV65), were significantly decreased by both KDs, and all these ASVs negatively correlated with parameters related to glucose intolerance and lipid accumulation. Next, we compared the gut microbiota in mice with the two types of KD and identified 38 significantly different ASVs (Fig. S3c).",aa1a62ed-cd27-49d9-8a66-e1c18db10b86
44,results14," Among these 38 ASVs, Bacteroides (ASV8, ASV36, ASV42), Lachnospiraceae (ASV313), and Ruminococcaceae (ASV60, ASV73) were significantly enriched in the ketogenic diets commonly used in mouse trials type 1 (KDR) mice and only positively correlated with parameters related to glucose intolerance. Moreover, Roseburia (ASV9, ASV63), Negativibacillus (ASV112), Acetatifactor (ASV22), Oscillibacter (ASV202), Lachnoclostridium (ASV285), and Lachnospiraceae (ASV25, ASV157, ASV159, ASV160, ASV169, ASV279, ASV286, ASV316) were significantly increased in the KDH mice and only positively correlated with parameters related to lipid accumulation (Fig. 2c). Taken together, the results suggested that two types of KD introduced different changes in the gut microbiota.  10.1128/mBio.03601-20.3 FIG S3 ASVs differentiating gut microbiota structure between the mice of different groups.",b9611b95-2c81-4eae-a12c-d4013dfd8935
45,results15," The sPLS-DA plot of gut microbiota, the classification error rate of one component across the leave-one-out cross-validation for maximum distance, and the heatmap of selected ASVs. (a) NCR versus ketogenic diets commonly used in mouse trials type 1 (KDR). (b) normal chow (NCH) versus KDH. (c) ketogenic diets commonly used in mouse trials type 1 (KDR) versus KDH. Download FIG S3, PDF file, 1.1 MB.  Copyright © 2021 Li et al. 2021 Li et al. https://creativecommons.org/licenses/by/4.0/ This content is distributed under the terms of the Creative Commons Attribution 4.0 International license.  Changes in the metabolome in mice fed two kinds of ketogenic diets.",474dddea-3f87-40b0-8d4e-af40f52d5ca0
46,results16,"  To identify how these two kinds of KD affected metabolites of the gut microbiota in mice, the untargeted metabolome of the cecum content was analyzed by liquid chromatography-mass spectrometry (LC-MS), and principal-component analysis (principal component analysis (PCA)) showed that the metabolome profiles of the gut microbiota in the ketogenic diets commonly used in mouse trials type 1 (KDR) and KDH mice were significantly different from those of their control groups. Notably, the metabolite profiles of the ketogenic diets commonly used in mouse trials type 1 (KDR) and KDH mice clearly segregated in the first principal component (Fig. 3a).  FIG 3 Changes of the metabolome in mice fed with two kinds of KD. (a) Principal-component analysis (principal component analysis (PCA)) plots of metabolic profiles. Top, electrospray ionization (ESI)+; bottom, electrospray ionization (ESI)−.",ef8a283b-e0f1-45d6-8949-9c4374f540e9
47,results17," (b) The fold ratio (log2-transformed) of the abundance of 226 identified metabolites in the ketogenic diets commonly used in mouse trials type 1 (KDR) to NCR mice, and the KDH tonormal chow (NCH) mice. The red spots represent the metabolites that enriched or decreased in both the ketogenic diets commonly used in mouse trials type 1 (KDR) and KDH groups, and the rose red, orange, blue, and mint green spots represent the metabolites that enriched in the ketogenic diets commonly used in mouse trials type 1 (KDR), NCR, KDH, and normal chow (NCH) mice, respectively. (c) Left, the heatmap represents the abundance of the 85 metabolites in each sample. Right, Spearman correlations between the abundance of 85 metabolites and the host parameters related to glucose and lipid metabolism. P values of correlations were adjusted by false discovery rate (FDR). Only where false discovery rate (FDR) was <0.05, red and blue denote significant positive and negative correlation, respectively.",d901a70e-6f4b-48a6-9e9f-56b60824277c
48,results18,"  From orthogonal projection to latent structure-discriminant analysis (OPLS-DA) models (Fig. S4), we identified differential metabolic features (variable importance in projection [Variable importance in projection (VIP)] > 1, P < 0.05) that included 127 metabolites between the ketogenic diets commonly used in mouse trials type 1 (KDR) and NCR mice, 125 metabolites between the KDH and normal chow (NCH) mice, and 117 metabolites between the KDH and ketogenic diets commonly used in mouse trials type 1 (KDR) mice (Data Set S1). A total of 156 of these metabolites were significantly correlated with host parameters related to glucose and lipid metabolism (Data Set S2). In addition, 85 of these 156 metabolites were significantly correlated with gut microbial variations (R2 > 0.09, P < 0.05 of PERManalyzed with one way analysis of variance (ANOVA)) (Data Set S2).",88132182-e708-4739-b2b5-c10006eed2d7
49,results19," Among these 85 metabolites, suberic acid was significantly enhanced in both the ketogenic diets commonly used in mouse trials type 1 (KDR) and KDH mice, and it positively correlated with parameters related to glucose intolerance and lipid accumulation. Moreover, nervonic acid and batyl alcohol, which were significantly decreased by both KDs, were negatively correlated with parameters related to glucose intolerance and lipid accumulation. Besides, two bile acids, deoxycholic acid (deoxycholic acid (DCA)) and chenodeoxycholate (Cdeoxycholic acid (DCA)), were positively correlated with glucose intolerance. They were increased in both the ketogenic diets commonly used in mouse trials type 1 (KDR) and KDH mice, but the ketogenic diets commonly used in mouse trials type 1 (KDR) mice had significantly higher levels than the KDH mice.",5a3d97de-b8cb-4783-9a8c-92597c9a5ca0
50,results20," 1H-indole-3-propanoic acid (indole 3 propanoic acid (IPA)) and indole acetic acid (indole acetic acid (IAA)), which are the products of the bacteria metabolizing tryptophan, were negatively correlated with lipid accumulation. They were decreased in the ketogenic diets commonly used in mouse trials type 1 (KDR) and KDH mice, respectively. Furthermore, trans-2-hydroxycinnamic acid, which increased only in the ketogenic diets commonly used in mouse trials type 1 (KDR) mice, was positively correlated with glucose intolerance, while isobutyric acid, which decreased in the KDH mice, was negatively correlated with lipid accumulation (Fig. 3b and c). Taken together, these results suggested that KD intervention changed the metabolites in the gut, and two types of KD also had different influences.  10.1128/mBio.03601-20.4 FIG S4 The OPLS-DA score plots of metabolic profiles in cecum content of mice. (a) NCR versus ketogenic diets commonly used in mouse trials type 1 (KDR).",660e4f86-5551-4002-b89a-7346456ac7cd
51,results21," (b) normal chow (NCH) versus KDH. (c) ketogenic diets commonly used in mouse trials type 1 (KDR) versus KDH. Download FIG S4, PDF file, 0.9 MB.  Copyright © 2021 Li et al. 2021 Li et al. https://creativecommons.org/licenses/by/4.0/ This content is distributed under the terms of the Creative Commons Attribution 4.0 International license.  10.1128/mBio.03601-20.9 DATA SET S1 The differentiation of metabolites between NCR and ketogenic diets commonly used in mouse trials type 1 (KDR), normal chow (NCH) and KDH, or ketogenic diets commonly used in mouse trials type 1 (KDR) and KDH mice. Download Data Set S1, XLSX file, 0.03 MB.  Copyright © 2021 Li et al. 2021 Li et al. https://creativecommons.org/licenses/by/4.0/ This content is distributed under the terms of the Creative Commons Attribution 4.0 International license.  10.1128/mBio.03601-20.",79026bcd-acfa-4daf-b277-1e107ead35f5
52,results22,"10 DATA SET S2 One hundred fifty-six metabolites were significantly correlated with at least one host parameter related to glucose and lipid metabolism, and 85 of these 156 metabolites were significantly correlated with gut microbial variations. Download Data Set S2, XLSX file, 0.04 MB.  Copyright © 2021 Li et al. 2021 Li et al. https://creativecommons.org/licenses/by/4.0/ This content is distributed under the terms of the Creative Commons Attribution 4.0 International license.  The sources and proportions of fat in the ketogenic diet affected the metabolic phenotypes in mice.  The two kinds of KD induced different damage to metabolic phenotypes in mice, which was associated with gut microbiota and metabolite changes, although the components of macronutrients were virtually identical in ketogenic diets commonly used in mouse trials type 1 (KDR) and KDH. Then, we customized a ketogenic diet called KD(89.",08ef7100-2143-493b-8780-784e3681b928
53,results23,"5%) with the same proportions of fat as ketogenic diets commonly used in mouse trials type 1 (KDR) and the same sources as KDH in nutrients to evaluate the influences of sources and proportions of fat in the diets on the metabolic phenotypes in mice. We obtained comparable results for parameters related to glucose and lipid metabolism for the mice fed KDH and normal chow (NCH) to those in the above-mentioned trial. Unlike the mice in the ketogenic diets commonly used in mouse trials type 1 (KDR) group, which had dramatic damage to glucose metabolism, the KD(89.5%) mice had fasting blood glucose levels, glucose clearance, and insulin resistance indices similar to the KDH mice (Fig. 4a to f). Furthermore, the KD(89.5%) mice exhibited an increase in epididymal and retroperitoneal fat mass compared to the normal chow (NCH) mice (Fig. 4g to i), which was not observed between the mice in the ketogenic diets commonly used in mouse trials type 1 (KDR) and NCR groups. Interestingly, the KD(89.",32afb1b9-fb3c-409b-a94f-20e1dccddddb
