,chunk_label,chunk_text,uuid
54,results24,"5%) mice did not develop excessive lipid accumulation in the liver like the KDH mice (Fig. 4j to l), indicating that only KDH, which contained 91.3% fat, induced lipid accumulation in the livers of mice. Taken together, these results suggested that the sources but not proportions of fat in the KD induced differences in metabolic phenotypes related to glucose metabolism, while both the sources and proportions induced differences in metabolic phenotypes related to lipid metabolism.  FIG 4 The sources and proportions of fat in KDs affected the metabolic phenotypes in mice. (a) Fasting blood glucose. (b) Curves of blood glucose levels during oral glucose tolerance test (OGTT) and areas under the curve (AUC). (c) Fasting serum insulin. (d) Serum insulin levels during oral glucose tolerance test (OGTT) and areas under the curve (AUC). (e) HOMA-IR. (f) Insulin resistance index. (g and h) Epididymal and retroperitoneal fat mass (% body weight), respectively.",25c262d9-48ab-47b8-b063-938f6020ffe5
55,results25," (i) Representative H&E-stained histological sections of eAT (scale bar = 200 μm) and calculated mean cell area of adipocytes (n = 5 per group). (j and k) Concentrations of total cholesterol and triglyceride in liver, respectively. (l) Representative H&E-stained histological sections of liver (scale bar = 200 μm) and nonalcoholic fatty liver disease (NAFLD) activity score. Data are presented as the mean ± SEM and analyzed using one-way analyzed with one way analysis of variance (ANOVA), followed by a Tukey post hoc test. *, P < 0.05; **, P < 0.01; ***, P < 0.001. n = 8 to 9 for both groups for all analyses, except n = 5 for panel i.  Based on the above results, we concluded that the sources of fat in ketogenic diets had important and significantly different effects on metabolic phenotypes in mice. Therefore, we quantified the concentrations of fatty acids in the three different ketogenic diets [ketogenic diets commonly used in mouse trials type 1 (KDR), KDH, and KD(89.",ca2016fe-247b-48ba-91de-1cd63cf50768
56,results26,"5%)] and found that trans-fatty acids (TFAs) were dramatically increased in ketogenic diets commonly used in mouse trials type 1 (KDR), which was confirmed by the concentrations of trans-6-octadecenoic acid, trans-9-octadecenoic acid, and trans-11-octadecenoic acid, and there was no significant difference between KDH and KD(89.5%) (Fig. S5). Combining the results that ketogenic diets commonly used in mouse trials type 1 (KDR) but not KDH induced insulin resistance and damaged glucose homeostasis in mice, we speculated that the trans-fatty acids (TFAs) in ketogenic diets commonly used in mouse trials type 1 (KDR) may be an important suspect.  10.1128/mBio.03601-20.5 FIG S5 The concentrations of trans-6,9,11-octadecenoic acid in three different ketogenic diets [ketogenic diets commonly used in mouse trials type 1 (KDR), KDH, and KD(89.5%)]. Data are presented as the mean ± SEM and analyzed using one-way analyzed with one way analysis of variance (ANOVA), followed by a Tukey post hoc test.",7856e475-fb58-4a51-9f51-e4d80c85bafa
57,results27," ***, P < 0.001. Download FIG S5, PDF file, 0.9 MB.  Copyright © 2021 Li et al. 2021 Li et al. https://creativecommons.org/licenses/by/4.0/ This content is distributed under the terms of the Creative Commons Attribution 4.0 International license.  The gut bacteria and metabolites affected by the sources and proportions of fat in ketogenic diets.  By 16S rRNA gene sequencing, we found that there were still significant differences in the gut microbiota between the mice in the KDH and KD(89.5%) groups (P < 0.05 with PERManalyzed with one way analysis of variance (ANOVA), 9,999 permutations) (Fig. 5a). Next, we observed how the abundances of 87 ASVs affected by two kinds of KD in the above-mentioned trial changed. Of the mice fed these two ketogenic diets with the same proportion but different sources of fat, the KD(89.",fecbe1aa-2626-4787-b061-940bf7076220
58,results28,"5%) mice had an almost negligible abundance of Bacteroides (ASV8, ASV36, ASV42) and Ruminococcaceae (ASV60, ASV73), similar to the normal chow (NCH) mice but unlike the ketogenic diets commonly used in mouse trials type 1 (KDR) mice, which showed significant enrichment in these microbes. However, the KD(89.5%) mice exhibited a significant increase in the abundance of Lachnospiraceae (ASV25, ASV160, ASV169), Intestinimonas (ASV96), and Oscillibacter (ASV202), and there was no significant difference between the ketogenic diets commonly used in mouse trials type 1 (KDR) and NCR mice (Fig. 5b and Fig. S6a). In addition, for these two ketogenic diets with the same source but different proportions of fat, although the abundances of most ASVs were similar between the KDH and KD(89.5%) mice, differences still existed. KD(89.",d7bb2ad5-3136-4e8e-9285-240017ced279
59,results29,"5%) significantly increased the abundance of ASVs, including ASV25 (Lachnospiraceae), ASV26 (Lactococcus), and ASV63 (Roseburia), and decreased the abundance of ASV202 (Oscillibacter) compared to the KDH mice (Fig. 5c and Fig. S6b). Taken together, we identified 10 ASVs and 4 ASVs that responded to the sources and proportions of fat in ketogenic diets, respectively. Thus, these 14 ASVs were considered key members that were affected by the sources and proportions of fat in the two kinds of KD.  FIG 5 The gut microbiota and metabolites affected by the sources and proportions of fat in KDs. (a) Left, PCoA plot of gut microbiota based on the Bray-Curtis distance. Right, clustering of the gut microbiota between different groups calculated with PERManalyzed with one way analysis of variance (ANOVA) (9,999 permutations) using Bray-Curtis distances. **, P < 0.01. (b) The fold ratio (log2 transformed) of the relative abundance of 87 ASVs in the KD(89.",8dd0579a-fea8-4ad1-b27a-6abe198f74b5
60,results30,"5%) to normal chow (NCH) mice, and ketogenic diets commonly used in mouse trials type 1 (KDR) to NCR mice. The red spots represent the ASVs significantly different between two KD groups fed KDs with the same proportion but different sources of fat. (c) The fold ratio (log2 transformed) of the relative abundance of 87 ASVs in the KD(89.5%) to normal chow (NCH) mice, and KDH to normal chow (NCH) mice. The red spots represent the ASVs significantly different between two KD groups fed KDs with the same source but different proportions of fat. (d) The concentrations of tryptophan metabolites in fecal samples of mice. (e) The concentrations of short chain fatty acid (SCFA)s in cecum content of mice (n = 5 to 6 per group). (f) The concentrations of bile acids (BAs) in cecum content of mice. For panels d to f, data are presented as the mean ± SEM and analyzed using one-way analyzed with one way analysis of variance (ANOVA) followed by a Tukey post hoc test. *, P < 0.05; **, P < 0.",0ce0ef69-37b8-4007-b721-d0d0191f4da5
61,results31,"01; ***, P < 0.001. n = 8 to 9 for both groups for all analyses, except n = 5 to 6 for panel e.  10.1128/mBio.03601-20.6 FIG S6 The gut microbiota affected by the sources and proportions of fat in KDs. (a) The heatmap represents the normalized and log2-transformed relative abundance of the 83 ASVs (the abundance of 4 ASVs was zero) in mice. The mice of these two KD groups were fed KDs with the same proportion but different sources of fat. The ASVs were clustered by the ward.D method. (b) The heatmap represents the normalized and log2-transformed relative abundance of the 63 ASVs (the abundance of 24 ASVs was zero) in mice. The mice of these two KD groups were fed KDs with the same source but different proportions of fat. The ASVs were clustered by the ward.D method. Download FIG S6, PDF file, 1.6 MB.  Copyright © 2021 Li et al. 2021 Li et al. https://creativecommons.org/licenses/by/4.0/ This content is distributed under the terms of the Creative Commons Attribution 4.",878da2b4-de23-405c-9239-2fcbb9a48de7
62,results32,"0 International license.  From untargeted metabolome data, we showed that KDs affected many of the gut microbiota-related metabolites, such as short-chain fatty acids (short chain fatty acid (SCFA)s), tryptophan metabolites, and bile acids (BAs). Thus, we quantified the concentrations of 4 main tryptophan metabolites, 6 short chain fatty acid (SCFA)s, and 40 BAs with LC-MS or gas chromatography (GC)-MS. Consistent with the results in untargeted metabolome, we also observed decreased tryptophan metabolites in both the KDH and KD(89.5%) mice (Fig. 5d). Moreover, we found that the concentrations of short chain fatty acid (SCFA)s significantly decreased in the KDH and KD(89.5%) mice, and there was no significant difference between the mice of these two groups. This suggested that decreased short chain fatty acid (SCFA)s may be related to lack of carbohydrates in the KD (Fig. 5e).",9fbe6b95-3bbb-445a-860c-7c547b84b0a0
63,results33," Furthermore, we observed the concentrations of 10 BAs were significantly different in the mice of different groups. Among them, deoxycholic acid (DCA), which belongs to secondary BAs, was significantly increased in both the KDH and KD(89.5%) mice. Notably, the ketogenic diets commonly used in mouse trials type 1 (KDR) mice had significantly higher deoxycholic acid (DCA) and Cdeoxycholic acid (DCA) levels than the KDH mice in untargeted metabolome, but there was no significant difference between the mice in the KD(89.5%) and KDH groups, suggesting that the differences of deoxycholic acid (DCA) and Cdeoxycholic acid (DCA) levels in the ketogenic diets commonly used in mouse trials type 1 (KDR) and KDH mice may be due to different fat sources in the KD (Fig. 5f).  The ketogenic diet used in human studies still impaired metabolic health, gut microbiota, and metabolites in mice.",b62ed7a1-8d13-4d4e-85d8-5abcaa22e5a9
64,results34,"  Considering that the ketogenic diets used in the above two trials were nearly devoid of carbohydrates, the ketogenic diets used in human studies permit low carbohydrate consumption (approximately 5% to 10% of total caloric intake or below 50 g per day) (19). Thus, we customized another ketogenic diet called KD(72%) with 72% fat, 20% protein, and 8% carbohydrate. Notably, to eliminate the influence of TFAs in diet, KD(72%) used the same sources of nutrients as KDH. We observed increased β-hydroxybutyrate concentrations in the KD(72%) mice [NC, 0.44; KD(72%), 0.8 mmol/liter; P < 0.001]. Moreover, KD(72%) damaged metabolic health, which was mainly reflected in two aspects. First, although the fasting blood glucose level and glucose clearance during oral glucose tolerance test (OGTT) in the KD(72%) mice were similar to those in the NC group (Fig. 6a and b), the secretion of insulin was significantly higher in the KD(72%) mice (Fig.",bd3d0f89-89c1-484a-a9e8-b459440d6251
65,results35," 6c and d), and the KD(72%) mice also had a higher HOMA-IR index and insulin resistance index (Fig. 6e and f). This suggests that insulin sensitivity was reduced in the KD(72%) mice. Second, the KD(72%) mice showed significantly higher fat mass and larger adipocyte size than the NC mice (Fig. 6g and h). To summarize, these results showed that KD(72%) induced insulin resistance and fat accumulation in mice.  FIG 6 KD(72%) impaired metabolic health in mice. (a) Fasting blood glucose. (b) Curves of blood glucose levels during oral glucose tolerance test (OGTT) and areas under the curve (AUC). (c) Fasting serum insulin. (d) Serum insulin levels during oral glucose tolerance test (OGTT) and areas under the curve (AUC). (e) HOMA-IR. (f) Insulin resistance index. (g) Fat pad mass (% body weight). (h) Representative H&E-stained histological sections of eAT (scale bar = 200 μm) and calculated mean cell area of adipocytes (n = 5 per group).",6b5099cd-45b4-472e-86cf-7a6e364dee4a
66,results36," Data are presented as the mean ± SEM and analyzed using t test. *, P < 0.05; **, P < 0.01. n = 8 to 9 for both groups for all analyses, except n = 5 for panel h.  By 16S rRNA gene sequencing, we found that the KD(72%) mice displayed significantly altered gut microbiota compared to the NC group (P < 0.01 with PERManalyzed with one way analysis of variance (ANOVA), 9,999 permutations) (Fig. 7a). Although selected specific ASVs were not exactly the same (Fig. S7), KD(72%) still enhanced the abundance of Roseburia, Ruminococcaceae, and Lachnospiraceae and reduced the abundance of Turicibacter similarly to the KDs in the above-mentioned trials (Fig. 7b). Furthermore, significantly decreased short chain fatty acid (SCFA)s and increased BAs levels were also observed in the KD(72%) mice (Fig. 7c and d).",a49bdcca-3033-4dfc-857e-df265238c208
67,results37," Although the concentration of 3-indoleacrylic acid was significantly decreased in the KD(72%) mice, there was no significant difference in the concentrations of other tryptophan metabolites compared to those in the NC group (Fig. 7e). Taken together, these results suggested that KD(72%) impaired metabolic health, gut microbiota, and metabolites in mice.  FIG 7 KD(72%) altered the gut microbiota and metabolites in mice. (a) Top, PCoA plot of gut microbiota based on the Bray-Curtis distance. Bottom, clustering of the gut microbiota between different groups calculated with PERManalyzed with one way analysis of variance (ANOVA) (9,999 permutations) using Bray-Curtis distances. (b) The heatmap represents the normalized and log2-transformed relative abundance of the 29 ASVs significantly different between two groups. These ASVs were clustered by the ward.D method. (c) The concentrations of short chain fatty acid (SCFA)s in cecum content of mice (n = 5 to 6 per group).",f2faa34b-423e-465d-8a21-11dfe7604b56
68,results38," (d) The concentrations of BAs in cecum content of mice. (e) The concentrations of tryptophan metabolites in fecal samples of mice. Data are presented as the mean ± SEM and analyzed using t test. *, P < 0.05; **, P < 0.01. n = 8 to 9 for both groups for all analyses, except n = 5 to 6 for panel c.  10.1128/mBio.03601-20.7 FIG S7 Thirty-eight ASVs differentiating gut microbiota structure between NC and KD(72%) mice. (a) The sPLS-DA plot of gut microbiota. (b) The classification error rate of one component across the leave-one-out cross-validation for maximum distance. (c) The heatmap of selected 38 ASVs between NC and KD(72%) mice. Download FIG S7, PDF file, 0.3 MB.  Copyright © 2021 Li et al. 2021 Li et al. https://creativecommons.org/licenses/by/4.0/ This content is distributed under the terms of the Creative Commons Attribution 4.0 International license.  ",96e87ff3-4132-4dde-aea9-0ac2dc283e4d
69,discussion0,"  In the current study, we showed that the impaired glucose and lipid metabolism in mice induced by KDs may be due to the sources and proportions of fat in these diets, which are associated with their distinct effects on gut microbiota and metabolites.  The KDs, regardless of the proportions and sources of fat, impaired glucose and lipid metabolism in mice in our study, which is in agreement with previous reports that KDs caused glucose intolerance, insulin resistance, hepatic steatosis, and fat accumulation (11–17). Several studies had reported the possible mechanisms of glucose intolerance and insulin resistance induced by KDs, such as the reduction in γδ T cells that can restrain inflammation (18), or the decreased cell surface expression of GLUT4 in skeletal muscle, which reduces glucose uptake in the periphery (11). Regarding the hepatic lipid accumulation induced by KD, Schugar et al.",e7926d76-a129-4c32-a546-66ee2a70b883
70,discussion1," reported that the synergistic effects of protein restriction and choline deficiency may be potential contributors (23). Notably, an impaired colonic mucus barrier has been suggested as one of the causes of metabolic damage (24), and the expression of genes related to the intestinal barrier (Occludin, Muc2) was significantly reduced by 5 weeks of KD consumption in our work. Although improved serum glucose and reduced weight were reported in short-term (1-week) KD studies (6, 18, 20), our work observed that extending feeding time with KD impaired host metabolism, especially in glucose tolerance and hepatic lipid accumulation. The glucose and lipid metabolism disorders are a gradual accumulation process, and our work emphasizes that there is a risk of metabolic disorders on a long-term KD. Future work is still needed to identify the overall mechanism by which KDs impair glucose and lipid metabolism.",64c22421-deb9-48db-a7f0-3746ecbc01a7
71,discussion2,"  The destruction of glucose and lipid metabolism induced by KDs may be partly related to the changes in the gut microbiota and metabolites. In the current work, both two types of KD induced the changes of gut microbiota and metabolites. For example, we found that the increase in the abundance of many ASVs belonging to Ruminococcaceae and Lachnospiraceae was correlated with impaired lipid metabolism induced by two formulas of KD. Previously, a strain belonging to Lachnospiraceae was reported to induce the development of obesity and diabetes in germfree ob/ob mice (25). However, we also observed that the abundance of few ASVs belonging to Lachnospiraceae decreased in KD-fed mice, indicating that the response of gut microbiota to KD is species and strain specific, and this may explain our inconsistency with other studies (21).",e39a7b5f-2373-4114-a8af-4e3cf9da4915
72,discussion3," Furthermore, 3 ASVs belonging to Bacteroides were enriched only in our ketogenic diets commonly used in mouse trials type 1 (KDR) mice, which could convert primary BAs into secondary BAs through the production of bile salt hydrolase (bile salt hydrolase (BSH)) (26). Recent studies reported that transplantation of Bacteroides vulgatus resulted in insulin resistance in recipient mice (27). In addition, a high secondary bile acid deoxycholic acid (DCA) level was observed in our ketogenic diets commonly used in mouse trials type 1 (KDR) mice. deoxycholic acid (DCA) could bind to farnesoid X receptor (farnesoid X receptor (FXR)), and the activation of farnesoid X receptor (FXR) could induce metabolic disorders (28). Thus, ketogenic diets commonly used in mouse trials type 1 (KDR) induces severe glucose intolerance and insulin resistance in mice, which may be due to increased abundance of Bacteroides and high deoxycholic acid (DCA) level.",221b98b0-3f01-4148-b043-da574f41fe40
73,discussion4," Notably, we found that the abundance of Lactobacillus murinus was decreased in the mice with KD. In our previous studies, we found abundant Lactobacillus murinus in the mice with calorie restriction (CR) (29, 30), which was significantly correlated with the improvement of midlife metabolic phenotypes. Moreover, we isolated a strain, L. murinus CR147, from the feces of CR mice and showed that this strain reduced intestinal permeability and systemic inflammatory markers in old microbiota-colonized mice (30). The beneficial effects of Lactobacillus murinus on glucose and lipid metabolism may be related to the ability to produce short chain fatty acid (SCFA)s and convert tryptophan into indole derivatives (31). short chain fatty acid (SCFA)s can protect the intestinal barrier by increasing the secretion of glucagon-like peptide-2 (GLP-2) (32) and exert anti-inflammatory effects by binding the G-protein-coupled receptor 41/43 (GPR41/43) (33).",0865b750-8c07-42ab-86a9-4d1280c4e745
74,discussion5," indole acetic acid (IAA) was reported to play a role as aryl hydrocarbon receptor (AhR) in regulation of intestinal health (34). indole 3 propanoic acid (IPA) can decrease intestinal permeability mediated by the pregnane X receptor (pregnane X receptor (PXR)) (35). The impaired intestinal barrier and an inflammatory condition have been regarded as a crucial pathological process underlying metabolic disorders (22, 36). In our work, decreased levels of short chain fatty acid (SCFA)s and tryptophan metabolites were observed in the mice with KD. Therefore, the decreased abundance of Lactobacillus murinus induced by two formulas of KD may contribute to the impaired glucose and lipid metabolism. Our studies pointed out that candidate bacteria and their potential metabolites correlated with KD-induced metabolic disorders. In future studies, we should use these specific bacteria and their metabolites responding to KD to investigate its causality in metabolic disorders and involved mechanism.",a47c4de5-af46-42c2-a08c-65be4998d5e1
75,discussion6,"  More importantly, we showed that both the sources and proportions of fat in the KDs modified glucose and lipid metabolism in mice, suggesting that the controversial results from previous reports may be due to neglect of the composition of the KD. We found that ketogenic diets commonly used in mouse trials type 1 (KDR) but not KDH induced glucose intolerance and insulin resistance. A recent study using the same KD as our ketogenic diets commonly used in mouse trials type 1 (KDR) demonstrated that long-term KD feeding depleted adipose-resident γδ T cells, leading to obesity and the loss of glycemic regulation in mice (18). Previous studies using a diet consistent with our KDH showed that KD reduced serum glucose in animal models (20, 37). In our study, we analyzed the composition of these two formulas of KD and found that their sources of fat are very different.",87bec2b6-0a8b-4bf4-b6ba-ac3775616bd7
76,discussion7," Therefore, future work in animal and clinical studies related to diet and nutritional intervention should consider not only the proportion of nutrients but also the source.  For the diets used in animal trials, the source of them may have an impact on the experimental results, especially in metabolic phenotypes. For example, ketogenic diets commonly used in mouse trials type 1 (KDR)-induced severe glucose intolerance in mice may be due to high TFAs levels in fat. In epidemiological investigations, TFA intake was associated with an increased risk of cardiovascular disease and incidence of obesity and type 2 diabetes mellitus (38, 39). And in a mouse model, high TFA intake resulted in decreased sensitivity of insulin receptor substrate 1 (IRS1) and downregulation of adipose triglyceride lipase (adipose triglyceride lipase (ATGL)) expression in the liver (40).",b3b135fc-0e4e-4041-bbba-f59912e104da
77,discussion8," In an in vitro model, trans-9-octadecenoic acid may reduce the glucose uptake by cells through suppressing insulin-induced elevations of phosphorylated Akt levels and the fusion of GLUT4 storage vesicles (41). Our ketogenic diets commonly used in mouse trials type 1 (KDR) (Research Diets D12369B) is a KD commonly used in animal trials, and the experimental results of the previous studies using this diet cannot be attributed to high fat content completely but may also be related to TFAs in fat.  Overall, our study demonstrated that the metabolic disorders induced by KDs are closely related to the source and proportion of fat in the diet, which may be associated with the changes of the gut microbiota and metabolites. Although KDs have beneficial effects on epilepsy and neurodegenerative diseases (1), according to our findings, KDs truly impair glucose and lipid metabolism.",7a1dc2bd-1ad3-411f-a472-ad61d2679717
78,discussion9," Thus, when using these diets for weight loss and the treatment of other conditions, the risk of glucose and lipid metabolism disorders should be kept in mind, and the sources and proportions of fat in these diets need to be further evaluated.  ",33d5d3c6-f243-4f99-91bc-4ae5424f8cfb
