,chunk_label,chunk_text,uuid
26,results7,"Figure 4 NeuN+ changes in the cortex and hippocampus of control (n = 5), KD (n = 5), mTraumatic brain injury (TBI) (n = 5), and mTraumatic brain injury (TBI) + KD (n = 5) mice. (A,B) mTraumatic brain injury (TBI) induction led to a significant decrease in the density of NeuN+ neurons compared to sham tissues in all regions tested. With KD, there were significantly greater numbers of NeuN+ neurons than in the untreated mTraumatic brain injury (TBI) mice, suggesting an increase in neuronal survival following the injury. (C) Representative images of immunohistochemical staining in the DGH and the temporal cortex are presented. NeuN positive cells are shown in red, and nuclei in blue; the scale bars are 50 μm in the DGH and 20 μm in the temporal cortex.",668478a2-8132-45de-adbb-bbbdaf406302
27,results8,"  Ketogenic Diet mitigates Traumatic brain injury (TBI)-induced neuroinflammation by reducing reactive astrocytes  GFAP Intensity in the cortex and dentate gyrus- one-way ANOVA revealed significant between-group differences in GFAP intensity in the dentate gyrus [F (3, 16) = 3.14, p = 0.055, η2 = 0.37], but not in the cortex [F (3, 16) = 2.60, p = 088, η2 = 0.33]. Gabriel’s post‐hoc analysis demonstrated that the GFAP intensity in the dentate gyrus was higher in the mTraumatic brain injury (TBI) group than in the mTraumatic brain injury (TBI) + KD group (p = 0.043). See Fig. 5A,B.Figure 5 Microglia and astrocyte changes in the cortex and hippocampus of control (n = 5), KD (n = 5), mTraumatic brain injury (TBI) (n = 5), and mTraumatic brain injury (TBI) + KD (n = 5) mice. KD reduces the mTraumatic brain injury (TBI)-induced elevation in active astrocyte expression in the DGH only and not in activated microglia expression at 30 days post-injury.",940c94b0-897d-47e6-b795-df4556a63510
28,results9," Graphs present quantification of the total surface labeled with (A) GFAP in the DGH (B) GFAP in the temporal cortex (C) Iba-1 in the DGH (D) Iba-1 in the temporal cortex. In addition, (E,F) Astrocyte morphology in the DG Hilus region displayed approximately twice the ramification as the control samples. (G) Representative images of immunohistochemical staining in the DGH and the temporal cortex are presented. GFAP positive cells are shown in green, Iba-1 positive cells are shown in yellow, and NeuN+ cells in red. The scale bars are 20–25 μm.  GFAP Morphology in the cortex and dentate gyrus-one-way ANOVA revealed significant between-group differences in GFAP Morphology in the dentate gyrus DGH- [F (3, 16) = 3.28, p = 0.048, η2 = 0.38], but not in the cortex [F (3, 16) = 0.52, p = 0.674, η2 = 0.09]. Gabriel’s post‐hoc analysis revealed marked alterations in astrocyte morphology in the dentate gyrus of mTraumatic brain injury (TBI) mice versus controls (p = 0.042). See Fig. 5(C,D).",1454283e-965d-4049-b152-516c2b782686
29,results10,"  Activated microglia expression in the cortex and dentate gyrus-one-way ANOVA revealed no significant differences between groups in the number of activated microglia within the cortex [F (3, 16) = 2.37, p = 0.108, η2 = 0.31] or dentate gyrus [F (3, 16) = 2.15, p = 0.134, η2 = 0.29]. See Fig. 5E,F.  Images of immunohistochemical staining in the DGH and the temporal cortex with GFAP positive cells shown in green, Iba-1 positive cells shown in yellow, and NeuN + cells in red. See Fig. 5G. ",69c87a8e-f078-44c4-95d6-178f539af170
30,discussion0," Traumatic brain injury (TBI) is a leading cause of death and long-term disability in the developed world, with more than 10 million people suffering worldwide every year37. The majority of these Traumatic brain injury (TBI)s (80–95%) are mild in nature7,8. Traumatic brain injury (TBI) symptoms can occasionally resolve within the first year after injury, but up to 70–90% of patients continue to manifest prolonged and often permanent neurocognitive dysfunction. In light of the growing reports suggesting beneficial effects of KD in many neurological disorders13–15, the primary goal of this study was to assess the benefits of KD in mTraumatic brain injury (TBI). Our results suggest that KD may be a vital treatment modality, mitigating Traumatic brain injury (TBI)-induced cognitive impairments, neuronal loss, and neuroinflammation in the closed-head mTraumatic brain injury (TBI) mouse model.  We delivered a mild Traumatic brain injury (TBI) to mice followed by up to 30 days of KD or SD.",9fec2506-a81a-4961-bac0-0c24b5d61012
31,discussion1," We were able to confirm that mice who received KD (with or without mTraumatic brain injury (TBI)) demonstrated a prominent increase in ketone bodies compared to mice fed SD at 3, 7, and 30 days after the diet. Previous studies have demonstrated that mice challenged with mTraumatic brain injury (TBI) show cognitive impairments in visual and spatial memory10,38. Our previous published studies as well as the present study, ruled out the possible involvement of anxiety (as assessed by elevated plus maze (EPM)) in the cognitive performance of the injured mice. This study's results replicated the previous findings regarding both visual and spatial memory while demonstrating that KD significantly ameliorated these cognitive deficits.",dd86be25-afdf-42a0-9898-597312e5431a
32,discussion2," These results support previous studies on the benefits of KD on brain injury in the short-term (7 days); rats who were fed KD exhibited evidence of neuroprotection after head trauma in the cortex and hippocampus39 and improvement in motor performance in Beam balance and Beam walk tests18, KD administration has also been shown to reduce brain edema and cellular apoptosis 72 h after Traumatic brain injury (TBI)40 and has demonstrated anti-tumor effects within the brain in rodent models41.  To better understand the molecular effects of Traumatic brain injury (TBI) and KD, we evaluated SIRT1 levels in two brain regions, cortex and hippocampus, which play crucial roles in memory formation. Traumatic brain injury (TBI) reduced the levels of SIRT1 in cortex and in the hippocampus 30 days post-injury which was ameliorated by KD, suggesting a potential mechanism contributing to cognitive impairment and improvement in cognitive symptoms when given KD42.",49148bf9-fc33-43c4-a052-f1a1da045b9a
33,discussion3," In contrast, at 7 days post-injury SIRT1 levels were not reduced in the cortex and hippocampus. This supports past findings showing an elevation in SIRT1 levels 1 day prior to ischemia that gradually decreased over a period of 7 days36. Our study's results align with prior studies of intermittent fasting and caloric restriction for 30 days post-injury28 and with research involving KD and SIRT1 in health-enhancing, aging, longevity, and neurodegeneration in animal models43,44.  We have previously reported that our mTraumatic brain injury (TBI) model decreases the neuronal survival 3 weeks post injury45. Similarly, in the present study, we have shown a significant increase in neuronal cell death that persists 30 days following injury in both cortex and hippocampus. KD prevented this neuronal cell death. These results are consistent with an in vitro study that found the ketone body beta-hydroxybutyrate reduced axonal degeneration in diffuse axonal injury46.",c2379466-3bda-49cb-b9e4-0cabf484b687
34,discussion4," Additionally, we saw a marked increase in reactive astrocytes in hippocampus 30 days following injury, which was ameliorated by KD. We have previously reported that our mTraumatic brain injury (TBI) model induces fundamental neuroinflammatory changes, including elevations in astrocyte reactivity, pro-inflammatory cytokine TNF-α levels, and expression of genes involved in inflammatory processes in several regions of the brain44,47–50. We can conclude that KD prevented the injury-induced neuro-inflammation, which is in agreement with previous studies that reported KD inhibited NLRP3 inflammasome activation, thus exerting neuroprotective effects17.  Our closed head injury mouse model of mild Traumatic brain injury (TBI) was able to recapitulate the cognitive deficits observed in human Traumatic brain injury (TBI) patients51,52 and showed that ketogenic diet beginning following injury could protect against injury-induced memory loss.",cd011c18-f5f0-495d-8e7e-d9f1f1587dd7
35,discussion5," At the cellular level, we have demonstrated that mTraumatic brain injury (TBI) induced neuronal cell death, astrocyte and microglial activation (neuro-inflammation), which were prevented in injured mice treated with KD. Our analysis of changes in SIRT1 suggests a viable molecular mechanism by which KD may be improving cognitive outcomes. Our results support accumulating evidence that KD may represent an important non-pharmaceutical treatment against the long-term molecular and cellular impacts of mTraumatic brain injury (TBI), which may ultimately improve cognitive symptoms and quality of life for Traumatic brain injury (TBI) patients. ",c92b110c-8aa9-4e4d-bb39-1441b638b889
