,chunk_label,chunk_text,uuid
0,methods0," Experimental procedures  Mice were subjected to mTraumatic brain injury (TBI), and a ketogenic diet (KD) was initiated immediately for the following three timelines: 3 days, 7 days, and 30 days. Ketone bodies in the blood were measured 0, 3, 7, and 30 days post-injury. Behavioral tests were performed at 7 or 30 days following mTraumatic brain injury (TBI) in separate groups of animals. Western blot analysis was carried out on brain tissue collected from 7 and 30 days post mTraumatic brain injury (TBI). Immunohistochemical staining assessments were performed on brains that were collected 30 days post-injury. The timeline of the experimental procedures following exposure to mTraumatic brain injury (TBI) is shown in Fig. 6.Figure 6 Study timeline. Animals were exposed to mTraumatic brain injury (TBI) or sham and checked for ketone bodies in the blood at days 0, 3, 7 and 30. Mice were then fed KD/SD for 3, 7, or 30 days.",8e5be7c6-6069-40dc-9235-be51680d2c34
1,methods1," Behavioral tests to assess behavior and cognitive abilities were carried out at 7 and 30 days following mTraumatic brain injury (TBI) in separate cohorts. Western blot analysis to assess changes in SIRT1 levels following mTraumatic brain injury (TBI) and diets management was performed at 7 and 30 days post-mTraumatic brain injury (TBI). Immunohistochemical staining to evaluate neurodegeneration and neuroinflammation was performed at 30 days following the mTraumatic brain injury (TBI) challenge.  Animals  The Sackler Commission on Animal Experimentation ethical committee approved the study and animal protocol 01-19-058 according to the Guidelines for Animal Experimentation of the National Institutes of Health (DHEW publication 23-85, revised, 1995). The study complies with ARRIVE guidelines.  Male ICR mice, aged 6–7 weeks, 30–40 g body weight, were acquired from Envigo RMS Israel.",e928d2d1-f862-442d-9389-3de4465f32a5
2,methods2," Mice were housed at 4–5 per home cage under a constant 12 h light/dark cycle, at room temperature (22 ± 2 °C) in a standard plastic cage (32 × 21.5 × 12 cm3). Water and food was provided ad libitum, and the cages bedding, sterile sawdust, was replaced once per week. All mice were acclimatized to the facility for three days following transport and then moved into the experimental testing room for three days prior to experimentation. Animals were utilized only once throughout the study in either behavioral, biochemistry, or immunocytochemistry tests. Each animal in a given group was tested only once in order to avoid the possible confounding effect of behavioral testing. The number of animals evaluated in each assessment group and the measurement times performed was based on analysis of variance in our previous studies.",3f56b3c0-1c8d-4a1e-b7f5-a906b36beb14
3,methods3,"  Mouse closed-head mild traumatic brain injury  Mild Traumatic Brain Injury (mTraumatic brain injury (TBI)) was induced according to the closed-head weight-drop model, as employed in our previous studies53,54. The device consisted of an aluminum tube (80 cm in length and 13 mm in diameter). In the pre-injury stage, mice were anesthetized by inhalation of isoflurane and placed under the device on a sponge, the sponge supported the head of the mouse allowing some anterior–posterior motion, but no rotational head movement at the moment of impact. A metal weight (50 g) was dropped from the top of the tube to strike the head on the right temporal side between the ear and corner of the eye. Sham mice received anesthesia and were placed on the sponge for an equivalent length of time, but no weight was dropped. This model was chosen because it simulates traumatic head injuries such as road accidents or falls, as it imposes a diffuse and non-specific injury.",ddef8360-ab7f-4fa2-94d6-02730de67ec4
4,methods4," Our model, while subject to a certain amount of variability due to the natural anatomic variation, still maintains a high degree of Traumatic brain injury (TBI) injury similarity among all mice as seen in previous neuronal loss models53–56.  Ketogenic Diet  The macronutrient composition of the Ketogenic Diet (TD.96355; Harlan Teklad Laboratories, Madison, WI) was 9.2% protein, 0.3% carbohydrate, and 90.5% fat (% kcal) (Table 1)57–59. The corresponding components of the standard diet (SD) (TD.00606; Harlan Teklad Laboratories, Madison, WI) were 10.1% protein, 77.4% carbohydrate, and 12.5% fat (% kcal)57. The diets and water were provided ad libitum for 3, 7, and 30 days after the injury. Both diets were stored at 4 °C, KD, which had a solid, butter-like texture, was changed every day, and SD pellets were changed twice per week.Table 1 Macronutrient information of each diet.  % Kcal from	Standard diet	Ketogenic diet	 Fat	12.5	90.5	 Carbohydrate	77.4	0.3	 Protein	10.1	9.",5e74ce52-252b-45c4-be30-65fd0b26c4d8
5,methods5,"2	  Measurement of Ketone Bodies  Ketone bodies in the blood were measured using the Precision Xtra Blood Glucose and Ketone Monitoring System (Abbott, Columbus, OH)60. Mice were anesthetized with isoflurane and tails were cut approximately 0.2 mm from the end, a drop of blood was squeezed directly into a testing strip attached to the measuring instrument. Group sizes were as follows: control (n = 8), mTraumatic brain injury (TBI) (n = 6), KD (n = 6), and mTraumatic brain injury (TBI) + KD (n = 5).  Elevated plus maze  The elevated plus maze (elevated plus maze (EPM)) was used to evaluate anxiety-like behavior61. This assessment relies on the natural anxiety-like behavior exhibited by rodents when placed in brightly lit, open environments. The maze is plus-shaped (+), with arms extending from the center at 90° angles from each other. Opposite arms in the plus formation are identical, with two open arms and two closed (walled) arms measuring 30 × 5 × 1 cm each.",5109c41b-8793-4b48-8d16-a11446058613
6,methods6," During testing, each mouse was placed at the maze's center, facing one of the open arms, and was allowed to explore the maze for 5 min. The amount of time the mice spent in the open arms and the number of entries to the closed and open arms was counted. A longer duration of time spent within the open arms has been associated with lower anxiety levels61,62. Group sizes were as follows: control (n = 19), mTraumatic brain injury (TBI) (n = 18), KD (n = 23), and mTraumatic brain injury (TBI) + KD (n = 24).  Novel object recognition  The novel object recognition (novel object recognition (NOR)) task assesses recognition and visual memory63. This paradigm relies on rodents' natural tendency to investigate novel objects within their environment rather than known ones. novel object recognition (NOR) evaluates whether a mouse is able to discriminate between a familiar and a novel object. The testing arena is a square surface (60 cm × 60 cm) with high walls (20 cm).",e1b55238-bbfc-4881-bfae-6b501b85c28b
7,methods7," The test consists of three 5 min sessions, separated by 24 h. On the first day, mice were individually put in the empty arena for habituation for 5 min. On the second day, the mice were exposed to 2 identical objects within the arena for 5 min. On the third (experimental) day, one of the familiar objects was replaced with a novel object, and mice were allowed to explore the arena again for 5 min, during which time spent near familiar and novel object was measured. The arena was cleaned with 70% ethanol between subjects. An Aggelton index was calculated as follows: (time near new novel object − time near familiar object)/(time near new novel object + time near familiar object)64. A higher Aggelton index indicates advancement in recognition memory. Animals near the objects less than 10% of the total test time (i.e.",801b431d-d486-46b6-a662-87c0624f8bb3
8,methods8,", less than 30 s next to the two objects together) were excluded from statistical calculations, as exploration under this amount of time does not allow estimation of subjects' visual memory. Group sizes were as follows: control (n = 19), mTraumatic brain injury (TBI) (n = 18), KD (n = 23), and mTraumatic brain injury (TBI) + KD (n = 24).  Y-maze  The Y-maze paradigm was used to evaluate spontaneous exploration, responsiveness to novel environments, and spatial memory function, as previously described65. This test relies on the preference of rodents to explore new environments rather than familiar ones. The Y-maze consists of a three-armed black plexiglass maze with arms separated by 120°. Each arm was identical (8 × 30 × 15 cm); however, different spatial cues were placed in each arm (i.e., a triangle, a square, or a circle).",bfc5de8f-9f63-4160-956f-683c89f2e05f
9,methods9," In the first session of the test, the mouse was put in the arena's start arm (chosen randomly) and allowed to explore another arm while the third arm was blocked for 5 min. The mouse was then returned to its home cage for 2 min. In the second session, all arms were open for exploration for 2 min and time spent in each arm was recorded. The arena was cleaned with 70% ethanol between subjects. The time the mouse spent in the familiar arm and the new arm was measured. An Aggelton index was calculated as follows: (time in the new arm − time in the familiar arm)/(time in new arm + time in the familiar arm)64. A higher Aggelton index indicates improved spatial memory. Group sizes were as follows: control (n = 20), mTraumatic brain injury (TBI) (n = 19), KD (n = 24), and mTraumatic brain injury (TBI) + KD (n = 26).",0bfb1570-9743-482c-abf3-d206eab581ee
10,methods10,"  Immunohistochemistry  Immunohistochemistry studies were performed hippocampal (dentate gyrus) and temporal cortex tissue sections obtained from animals euthanized on day 30 post-injury. Mice were anesthetized with ketamine (100 mg/kg) and xylazine (10 mg/kg) and underwent transcardial perfusion with 10 ml phosphate-buffered saline (phosphate buffered saline (PBS)) followed by 20 ml of 4% paraformaldehyde (paraformaldehyde (PFA)) in 0.1 M phosphate buffer, pH 7.4. Brains were removed, fixed overnight in 4% paraformaldehyde (PFA), and then placed in 1% paraformaldehyde (PFA). Neuroscience Associates (Knoxville, TN) oriented the brains into a multiblock, collected 35 μm sections sequentially through the brains, and performed the floating section staining and mounting (antibodies detailed in Table 2). Microscopy was performed with a Fluoview 3000 laser scanning confocal microscope (Olympus, Waltham, MA).",ceb90da6-76c1-4be8-8769-19862140dd03
11,methods11," Target locations were determined on a stitched map with only Hoechst 33342 staining captured. For all analyses, regions of interest were selected on the map depicting only the nuclear staining and blinded with respect to groupings. These regions were then collected by multi area time lapse in sequence with the Fluoview 3000 software without intervention. Images, centered on coronal sections at approximately − 2.9 mm from Bregma, were collected as Z stacks and maximum Z projections with constant illumination (405, 488, 561, and 640 nm diode lasers) and detection parameters. Automated analysis for morphology, intensities, and numbers of cells was conducted using cellSens (Olympus, Waltham, MA, USA) and ImageJ66,67.Table 2 Immunohistochemistry reagents.",bd59fd78-aea3-46bc-811b-829432bec8c2
12,methods12,"  Target/fluorochrome	Primary/secondary	Probe	Manufacturer	Catalog	Dilution	 Nuclei		Hoechst 33342	ThermoFisher			 Astrocytes	Primary	Chicken anti-GFAP	Encor	CPCA-GFA	1:1500	 Alexa488	Secondary	Donkey anti-chicken	Jackson	703-545-155	1:500	 Microglia	Primary	Goat anti-Iba1	ThermoFisher	PA5-18039	1:1500	 Alexa555	Secondary	Donkey anti-goat	ThermoFisher	A21432	1:500	 NeuN + Neurons	Primary	Rabbit anti-NeuN	Abcam	Ab104225	1:5000	 Alexa647	Secondary	Donkey anti-rabbit	ThermoFisher	A31573	1:500	  Changes in the architecture of astrocytes were determined by batch processing of all images collected with the aid of ImageJ. All of the following steps were iteratively executed for each micrograph in a single macro. Each image was analyzed for the channel containing GFAP staining. Background was subtracted with ImageJ’s built-in rolling ball process, automated thresholding was accomplished with the built in RenyiEntropy algorithm, and noise was removed using the ImageJ despeckle routine.",d75ba0fb-ae94-4eff-a247-68f254e367ab
13,methods13," The image was then skeletonized with the ImageJ plugin andfeatures that were too small to be relevant were removed by the particle remover plugin. The analyze skeleton plugin generated the process lengths per cell. These routines have previously been shown to identify reactive morphology66,67.  Frames included in figures are correct concerning orientation, i.e., dorsal at the top, left, and right. Confocal scanning was rotated 30° to optimize the framing of regions of interest. Group sizes were as follows: control (n = 5), mTraumatic brain injury (TBI) (n = 5), KD (n = 5), and mTraumatic brain injury (TBI) + KD (n = 5).  Western blotting  To assess the cortical and hippocampal SIRT1 levels, brains were dissected following cervical dislocation at 7 and 30 days post-injury. The cortex and hippocampus were separated and frozen in liquid nitrogen, then stored in − 80 °C.",e380fcf0-4e4f-444c-90b0-39ca4568326b
14,methods14," Prior to analysis, brains were homogenized in lysis buffer (Tissue Protein Extraction Reagent, Pierce, Waltham, MA, USA) supplemented with a protease inhibitor cocktail (Halt Protease Inhibitor Cocktail, Sigma Aldrich, St. Louis, MO, USA) using a Teflon pestle homogenizer. Homogenates were centrifuged for 15 min at 4 °C 14,000 r/min, supernatant liquids were separated from the precipitates and stored at − 80 °C. Sample buffer was added to the samples and then stored at − 18 °C. Prior to analysis, samples were heated to 90 °C for 3 min and 30 µl of each sample was then loaded and run on 4–20% Mini-Protean TGX gels (Bio-Rad, Hercules, CA, USA) followed by transfer onto nitrocellulose membranes (Bio-Rad, Hercules, CA, USA) by a transfer system (Trans-Blot Turbo, Bio-Rad, Hercules, CA, USA). Afterward, blots were blocked for 1 h at room temperature, with Tris-buffered saline, containing 0.01% Tween-20 and 5% BSA or powdered milk.",2cea02f5-ef52-4573-9c64-b6c8b6163e35
15,methods15," Membranes were then incubated overnight at 4 °C with a mouse primary anti-SIRT1 antibody (Abcam, Cambridge, UK, ab10304, 1:500) and washed with TBS. Membranes were then incubated at room temperature for 1 h with goat anti-mouse antibody (Jackson ImmunoResearch Laboratories, Inc., West Grove, PA, 115-035-003, 1:10,000). Bands were then exposed using enhanced chemiluminescence with ECL (Millipore, Billerica, MA, United States) for 1 min by Viber Fusion FX7 imaging system (Viber Lourmat, France). Densitometry analysis of the detected signal was performed using ImageJ software. Uniform loading was verified by stripping and re-probing with a mouse primary α-tubulin antibody for 30 min at room temperature (Santa Cruz Biotechnology, Dallas, TX, sc-53030, 1:10,000), then conjugated goat anti-mouse antibody (Jackson ImmunoResearch Laboratories, Inc., West Grove, PA, 115-035-003, 1:10,000). The ratio of SIRT1 and α-tubulin (tubulin (TUB)) determined the value of each sample.",d6320333-d1a1-4d6e-8a71-c1d6a3cb1fa6
16,methods16," Averages of control values in each membrane were set to 1, and all other samples were calculated accordingly28. Figure 3A,B shows cropped blots, the membrane was cropped immediately after the transfer stage due to the usage of two different antibodies on the same blot membrane, SIRT1 band size was at 110 kDa and α-tubulin band size was at 55 kDa, enabling the process of cropping and incubating two different antibodies due to the distantness from each other without risk of damaging the membranes pristine state. Full-length blots/gels are presented in Supplementary Figs. 1–4. Group sizes were as follows: control (n = 7), mTraumatic brain injury (TBI) (n = 6), KD (n = 5), and mTraumatic brain injury (TBI) + KD (n = 7). ",f7e832dc-1d58-450f-9da7-e8a2ddb81654
17,analysis0," Statistical analysis was carried out using IBM SPSS version 24.0. All values are presented as the mean ± standard error of the mean (standard error of the mean (SEM)). Statistical analysis included data imputation in order to maximize power, followed by one-way ANOVA, repeated measures ANOVA, or two-way ANOVA where appropriate. Gabriel and Sidak (α = 0.05) tests were used as post hoc tests. Partial eta squared (η2) was calculated to show effect size. Significance was determined as a two-sided p < 0.05. Descriptive statistics for blood ketones are provided in supplementary files, Table 1. Descriptive statistics for SIRT1 expression, Immunohistochemistry, and behavioral data are provided in supplementary files, Table 2.  Ethical approval  The Sackler Commission on Animal Experimentation approved the animal protocol 01-19-058 according to the Guidelines for Animal Experimentation of the National Institutes of Health (DHEW publication 23-85, revised, 1995).",2691e4f3-a159-4286-a913-b677dca1452b
18,analysis1,"  Supplementary Information  Supplementary Information.  Supplementary Information  The online version contains supplementary material available at 10.1038/s41598-021-02849-0.  Acknowledgements  This research was supported in part by the Ari and Regine Aprijaskis Fund at Tel-Aviv University and the Dr. Miriam and Sheldon G. Adelson Chair for the Biology of Addictive Diseases in Tel-Aviv University, Tel-Aviv, Israel. The contents do not represent the views of the Department of Veterans Affairs or the United States Government and the opinions, interpretations, conclusions and recommendations are those of the authors and are not necessarily endorsed by the Department of Defense. ",21f2dcd1-33bf-4a8b-955d-6678ae0db88c
19,results0," KD increased the level of ketone bodies in blood  One-way repeated ANOVA revealed a significant main effect of time [F (3,63) = 28.31, p = 0.000, η2 = 0.57] and group [F (3,21) = 49.24, p = 0.000, η2 = 0.88] as well a time by group interaction [F (9,63) = 9.81, p = 0.000, η2 = 0.58]. Consecutive simple effects analysis with Sidak test indicated that the level of ketone bodies in the blood of KD mice was significantly higher than the level in mTraumatic brain injury (TBI) and control mice at the 3-day time-point (both p = 0.000), 7-day time-point (both p = 0.000), and 30-day time-point (both p = 0.001). Similarly, the blood ketone levels in the mTraumatic brain injury (TBI) + KD group were persistently higher than that of the mTraumatic brain injury (TBI) and control groups at the 3-day time-point (both p = 0.000), 7-day time-point (both p = 0.001), and 30-day time-point (p = 0.022 and p = 0.018, respectively). See Fig. 1.",b6cb32b9-9309-4514-878b-8b75f325be26
20,results1,"Figure 1 Levels of blood ketone bodies of control (n = 8), mTraumatic brain injury (TBI) (n = 6), KD (n = 6), and mTraumatic brain injury (TBI) + KD (n = 5) mice. Mice that received KD (with or without mTraumatic brain injury (TBI)) demonstrated a prominent increase in ketone bodies compared to mice fed SD at 3, 7, and 30 days after the diet was initiated.  mTraumatic brain injury (TBI) exposure and KD management does not affect anxiety  The elevated plus maze (EPM) test was applied to assess anxiety-like behavior. Two-way ANOVA demonstrated no significant main effect of group [F (3, 76) = 1.61, p = 0.194, η2 = 0.06] or time-post injury [F (1, 76) = 3.33, p = 0.072, η2 = 0.04], and no interaction between the two factors [F (3, 76) = 0.55, p = 0.649, η2 = 0.02].  The mice's anxiety-like behavior was not affected either by the injury or diet management. See Fig. 2A.Figure 2 Behavioral tests scores.",b8e5a87b-b93f-4d08-8913-71156796a21b
21,results2," (A) elevated plus maze (EPM) test—the time spent in open arms did not differ between mice in the control (n = 19), KD (n = 23), mTraumatic brain injury (TBI) (n = 18), and mTraumatic brain injury (TBI) + KD (n = 24) groups, indicating that mTraumatic brain injury (TBI) did not affect anxiety-like behavior. (B) novel object recognition (NOR) test—differences in visual recognition memory performance between mice in the control (n = 19), KD (n = 23), mTraumatic brain injury (TBI) (n = 18), and mTraumatic brain injury (TBI) + KD (n = 24) groups. (C) Y-maze test- differences in spatial memory performance between mice in the control (n = 20), KD (n = 24), mTraumatic brain injury (TBI) (n = 19), and mTraumatic brain injury (TBI) + KD (n = 26) groups.  KD ameliorates cognitive deficits  The novel object recognition (NOR) test was used to assess visual recognition memory. Two-way ANOVA revealed a significant main effect of group [F (3, 76) = 17.11, p = 0.000, η2 = 0.40].",3f56b5cf-84a3-48d4-916c-b5088bb5a608
22,results3," Gabriel’s post‐hoc analysis demonstrated that the mTraumatic brain injury (TBI) group performed significantly worse as compared to the controls, KD, and mTraumatic brain injury (TBI) + KD groups (all p = 0.000). There was no main effect of time-post injury [F (1, 76) = 0.60, p = 0.442, η2 = 0.01] or group by time-post injury interaction [F (3, 76) = 2.30, p = 0.084, η2 = 0.08]. See Fig. 2B.  The Y-maze test was used to assess spatial memory. Two-way ANOVA showed a significant main effect of group [F (3, 81) = 19.49, p = 0.000, η2 = 0.42]. Gabriel’s post‐hoc analysis showed that mice in the mTraumatic brain injury (TBI) group performed significantly worse than mice in the control, KD, and mTraumatic brain injury (TBI) + KD groups (all p = 0.000). There was no main effect of time-post injury [F (1, 81) = 0.46 p = 0.498, η2 = 0.01] nor a group by time-post injury interaction [F (3, 81) = 0.75, p = 0.526, η2 = 0.03]. See Fig. 2C.",8966af23-93b1-455e-9b67-06307ffef2d1
23,results4,"  KD prevents the reduction of SIRT1 expression following mTraumatic brain injury (TBI)  SIRT1 expression within the hippocampus- one-way ANOVA revealed significant between-group differences in SIRT1 expression [F (3,21) = 5.45, p = 0.006, η2 = 0.44]. Gabriel’s post‐hoc analysis showed that the mTraumatic brain injury (TBI) group had significantly lower SIRT1 levels than the control (p = 0.009), KD (p = 0.038) and mTraumatic brain injury (TBI) + KD (p = 0.025) groups. See Fig. 3A.Figure 3 Changes in SIRT1 expression after mTraumatic brain injury (TBI) in the cortex and hippocampus of control (n = 7), KD (n = 5), mTraumatic brain injury (TBI) (n = 6), and mTraumatic brain injury (TBI) + KD (n = 7) mice. (A) The levels of SIRT1 were significantly reduced in the hippocampus of mTraumatic brain injury (TBI) mice compared with all groups.",e79a1901-c14b-421b-ad62-222cb8976c1a
24,results5," (B) The levels of SIRT1 were significantly reduced in the cortex of mTraumatic brain injury (TBI) mice compared with all mTraumatic brain injury (TBI) + KD group. The membrane was cropped immediately after the transfer stage due to the usage of two different antibodies on the same blot membrane, SIRT1 band size was at 110 kDa and α-tubulin band size was at 55 kDa, full-length blots/gels are presented in Supplementary Figs. 1–4.  SIRT1 expression within the cortex-one-way ANOVA revealed significant between-group differences in SIRT1 expression [F (3,21) = 6.26, p = 0.003, η2 = 0.47]. Gabriel’s post‐hoc analysis showed that the mTraumatic brain injury (TBI) group had significantly lower SIRT1 levels than the mTraumatic brain injury (TBI) + KD group (p = 0.002). In addition, the mTraumatic brain injury (TBI) group showed a marginally significant trend toward lower SIRT1 levels than the than the control (p = 0.090) and KD (p = 0.077) groups. See Fig. 3B.",248c9818-ddde-4ef0-a99c-e36cc8817fa4
25,results6,"  Ketogenic Diet prevents mTraumatic brain injury (TBI)-induced neuronal loss  The number of NeuN + neurons in the cortex and dentate gyrus-one-way ANOVA revealed significant between-group differences in the number of NeuN + neurons both within the cortex [F (3, 16) = 5.06, p = 0.012, η2 = 0.49] and the dentate gyrus [F (3, 16) = 8.51, p = 0.001, η2 = 0.61]. Gabriel’s post‐hoc analysis demonstrated that the total number of NeuN + neurons within the cortex was significantly lower in the mTraumatic brain injury (TBI) group than in the control (p = 0.018) and mTraumatic brain injury (TBI) + KD groups (p = 0.028). The total number of NeuN + neurons within the dentate gyrus was significantly lower in the mTraumatic brain injury (TBI) group than in the control (p = 0.008), KD (p = 0.012), and mTraumatic brain injury (TBI) + KD (p = 0.002) groups. See Fig. 4(A–C).",2fd56b2e-998d-40fa-a87c-f012060bb0c9
