,chunk_label,chunk_text,uuid
0,methods0," 2.1. Animals and Diets  The in vivo schema and all manipulations performed on living rodents followed the rules of the European Union Directive (2010/63/EU) for animal studies, and the experiment was conducted with the Local Institutional Animal Care and Use Committee’s permission (No. 34/2019; Olsztyn, Poland). The study was also carried out in compliance with the ARRIVE guidelines. Every effort was made to minimize the suffering of the animals used in the experiment.  The nutritional intervention was conducted on 34 male Wistar rats (Rattus norvegicus Cmdb:WI), which were allocated to three experimental groups housed individually in balance cages under a constant temperature (22 ± 1 °C) and a 12/12 h light/dark cycle. Group S (n = 12) was fed a standard diet (SD) containing 8% soy oil as a fat source and 8% cellulose as a source of dietary fibre for the whole experiment (initial and experimental periods).",2b871e91-200d-41ae-aad5-17b1805d27a8
1,methods1," Rats in groups RKD and RSD were initially fed a high-fat diet (high fat diet (HFD)) for 8 weeks, where the diet contained 23% lard (at the expense of corn starch). After 8 weeks, animals were randomly assigned into RKD and RSD groups, which were fed with KD, and a standard diet with 20% caloric restriction compared to SD, respectively. The RKD group was fed for 4 weeks with TD.96355 Ketogenic diet (Harlan Laboratories, Madison, WI, USA), which consisted of 91.6% of calories from fat, 8.4% calories from protein and 0% calories from carbohydrates. The design of the study is presented in Figure 1.  The planned number of animals was set with the size of one experimental group n = 6, which is the minimum number of laboratory animals with a uniform genotype, which ensures obtaining reliable, reproducible and statistically significant results without the need to repeat the procedure due to high intra-group variability.",8e0426e9-d1eb-409c-937a-1fc981da5cb5
2,methods2," Taking into account the adopted methodology, the desired test power should be 80% (taking into account the most important parameters that were analysed in the blood and parameters from the nuclear magnetic resonance (NMR) test). Statistical algorithms developed by Columbia University Medical Center (www.biomath.info) were used. Based on the variables (predicted parameter values with the highest predicted variability based on previous own research, i.e., nuclear magnetic resonance (NMR) and redox status) and online software, it was calculated, assuming the use of a parametric test, that the number of animals in the group should be just 6 [31].  After the initial period (standard and high-fat diets) and after each week of feeding regimens with reduction or standard diets, animals were subjected to time-domain nuclear magnetic resonance (nuclear magnetic resonance (NMR)) using the minispec LF90II Body Composition Analyzer (Bruker. Karlsruhe. Germany) to determine fat and lean body mass.",70ccca1c-9277-462c-a777-963fe428a0f8
3,methods3,"  2.2. Sample Collection  Before the reduction diets (6 rats each of SD group and restrictive groups) and at the end of the experiment, the rats fasted for 12 h and were anaesthetized i.p. with ketamine (K) and xylazine (X) (K, 100/kg BW; X, 10 mg/kg BW) according to recommendations for anaesthesia and euthanasia of experimental animals. Following laparotomy, blood samples were taken from the caudal vena cava into heparinized tubes, and finally, the rats were euthanized by cervical dislocation. The blood plasma was prepared by solidification and low-speed centrifugation (350× g, 10 min, 4 °C). Plasma samples were kept frozen at −70 °C until being assayed.  2.3.",ae9c70f3-46bc-4b6d-8192-0aee2823147f
4,methods4," Biochemical and Haematological Analyses  The following haematological parameters were determined in whole heparinized blood using the ABACUS Jr VET Analyzer (DIATRON MI PLC, Budapest, Hungary): WBC—total white blood cell; LYM—lymphocyte; MID—medium-sized cell; GRA—granulocytes; RBC—red blood cell; HGB—haemoglobin; HCT—haematocrit; MCV—mean corpuscular volume; MCH—mean corpuscular haemoglobin; MCHC—mean corpuscular haemoglobin concentration; RDWc—red cell distribution width; PLT—platelet count; PCT—platelet percentage; MPV—mean platelet volume; PDWc—platelet distribution width.",36f30c05-1c24-4871-9649-ac4e06101214
5,methods5,"  The level of glucose, total cholesterol, HDL cholesterol, triglycerides (Tg), uric acid, urea, creatinine and bilirubin, as well as activity of alanine aminotransferase (aminotransferase (ALT)), aspartate aminotransferase (aminotransferase (AST)), alkaline phosphatase (alkaline phosphatase (ALP)) and gamma-glutamyl transferase (gamma glutamyl transferase (GGT)) were measured using an automatic biochemical analyser (Pentra C200, Horiba, Kyoto, Japan). The atherogenic index of plasma (atherogenic index of plasma (AIP)) was calculated as the log value of the ratio between Tg and HDL.  The leptin plasma concentration was analysed using a commercial ELISA kit, code: EM0129 (FineTest, Wuhan, China). The detection range of the test was 62.5–4000 pg/mL, the sensitivity was <37.5 pg/mL, and the coefficient of variation was below 10%.  The ketone body content was estimated using Keto DiasticksTM (Bayer, Leverkusen, Germany).  2.4.",97ef8ba6-3a8f-4112-99bd-4642724e472b
6,methods6," Oxidative Stress Markers  Malonaldehyde was analysed using a commercial ELISA kit, code: EM1723-1 (FineTest, Wuhan, China). The detection range of the test was 7.813–500 ng/mL, the sensitivity was 4.688 ng/mL, and the coefficient of variation was below 10%.  Superoxide dismutase (Superoxide dismutase (SOD)) was analysed using a commercial ELISA kit, code: EM0419 (FineTest, Wuhan, China). The detection range of the test was 0.781–50 ng/mL, the sensitivity was 0.469 ng/mL, and the coefficient of variation was below 10%.  AGEs were analysed using an ELISA kit ER0268 (FineTest, Wuhan, China). The detection range of the test was 0.313–20 ng/mL, the sensitivity was 0.188 ng/mL, and the coefficient of variation was below 10%.  2.5. Statistical Analyses  All the analyses were conducted in triplicates.",27365d00-d82e-49e4-84f3-8f6c982e2318
7,methods7," The differences between the study groups were compared using one-way ANOVA with Fisher’s least significant difference (LSD) test as a post hoc or using the Kruskal–Wallis test, depending on normality evaluated by the Shapiro–Wilk test. The results are presented as mean ± standard deviation or by median (Q1; Q3), depending on normality. The differences with a p-value < 0.05 were considered significant. Differences in body composition were compared using two-way ANOVA to assess the effect of time (T) and type of diet (D), and interactions thereof (T × D). Correlations between parameters were analysed using Spearman’s rank correlation coefficient test, separately for each group and each study interval. All the statistical analyses were performed using STATISTICA version 13.3 (TIBCO Software Inc., Palo Alto, CA, USA) software.  3. Results  3.1.",6b75b692-ab29-435d-9d38-6569fead368f
8,methods8," The Effect of the Ketogenic Diet on Body Weight and Composition  The effect of KD and SD on body weight, weight gain and the percentage of lean and fat mass is presented in Figure 2. The rats from the SD group, which were fed the same diet for the duration of the experiment, had significantly lower body weight at the beginning of the study. However, their body weight gradually increased with time. The biggest gain in weight was observed after 1 week of the diet. Rats from the RSD and RKD groups also gained weight, but much more slowly than the SD group. The weight gain was initially slightly higher in the RSD than the RKD group; however, after 3 weeks, this trend was the opposite. The lean mass was initially slightly higher in the SD group compared to the rats with obesity-inducing high fat diet (HFD). However, when the reduction was initiated, the percentage of lean mass was increased in RSD, while for RKD, a tendency similar to the SD group was observed.",d7edf224-0d3b-47bb-8b9b-5d6240e2ec62
9,methods9," The high fat diet (HFD) prior to the reduction had no effect on the fat mass. A stable level of fat mass was observed for the SD group, while for restrictive groups the opposite changes were noted. The fat percentage in RKD increased with the prolongation of KD, while the standard diet incorporated after high fat diet (HFD) in the RSD group resulted in the reduction of fat mass. Interestingly, the results of the two-way ANOVA showed that type of diet and time had a significant effect on body weight and weight gain, while time had no significant effect on lean and fat mass. The significant interaction between time and type of diet was noted for all analysed parameters.  3.2. The Effect of the Ketogenic Diet on Blood Haematology  The results of the haematological parameters are presented in Table 1. The initial high fat diet (HFD) resulted in significant changes in blood haematology. After HDF, lower HGB and MCH levels were observed.",ea674dec-9b84-4c25-a3ec-a74f47ac534f
10,methods10," Moreover, lower MID, both in concentration and in percentage were noted. Finally, high fat diet (HFD) resulted in an elevated level of PLT.  After the next 4 weeks of growth, higher RBC and PDWc with simultaneous lower MCH were noted for rats in the SD group. In the RKD group, the highest RDWc and HCT were observed. In comparison to SD, the restrictive diets after high fat diet (HFD) resulted in lower white blood cell system parameters, as well as MPV and PDWc, irrespectively of the type of diet. Comparing the two restrictive diets, significantly higher HBG and HCT were noted for RKD compared to RSD.  3.3. The Effect of KD on the Biochemical Parameters  The level of ketone bodies measured in urine appeared to be elevated in the RKD group from the second week till the end of the restriction. The results of parameters associated with lipid profile, liver and kidney functioning are presented in Table 2.",256b00a6-d11b-4470-a8d1-3180195d0d5f
11,methods11," The lipid profile was affected by the initial high fat diet (HFD)-altering triglycerides, HDL, LDL and atherogenic index of plasma (AIP). In the SD group, no changes were observed in the lipid profile at the end of the experiment. The rats from the RSD group had the lowest level of cholesterol, triglycerides, HDL and atherogenic index of plasma (AIP) after 4 weeks of reduction. In the RKD diet, the highest level of HDL was noted at the end of the experiment. LDL level normalized in all analysed groups at the end of the experiment. atherogenic index of plasma (AIP) level in RKD was the highest among all groups at the end of the experiment; however, it was significantly reduced compared to the high fat diet (HFD) group. Interestingly, the glucose level was the highest in both restrictive diets.  Liver parameters, namely aminotransferase (AST) and aminotransferase (ALT), were significantly elevated after initial high fat diet (HFD).",393e2a0e-a8e3-4c26-be2a-16e0bb25f4d1
12,methods12," In the SD diet at the end of the experiment, a significant reduction in aminotransferase (ALT) and alkaline phosphatase (ALP) was observed. After 4 weeks of a restrictive diet, the level of aminotransferase (AST) and alkaline phosphatase (ALP) was the highest in the RKD group, and the level of aminotransferase (ALT) was the highest among the rats at the end of the experiment. None of the groups reported an elevated level of gamma glutamyl transferase (GGT) or bilirubin.  Finally, the kidney parameters, namely uric acid and urea, were elevated in the rats on initial high fat diet (HFD). After 4 weeks, in the RKD group, the lowest level of these parameters was observed. The highest level of creatinine was reported in the RSD group.  The plasma concentration of leptin was slightly higher in groups after initial high fat diet (HFD) than in the SD group at the baseline (Figure 3).",c72ab49c-7cd3-43b1-9f2f-a9837391c012
13,methods13," After the restrictive diet, a significantly higher level of this hormone was observed in the RKD group, while the lowest concentration was observed in RSD. In the SD group, leptin level increased 5 times after 4 weeks of growth.  3.4. The Effect of the Ketogenic Diet on the Oxidative Status  In this study, the plasma concentration of malonaldehyde and Superoxide dismutase (SOD) were detected to evaluate the oxidative stress and the results are presented in Figure 4. Although no significant differences were observed for malonaldehyde (Figure 4), clear tendencies could be noticed. At the baseline, a much lower content of malonaldehyde was observed for the SD group compared to rats on an high fat diet (HFD). After 4 weeks, the level of malonaldehyde remained at a similar level in the SD group. After restrictive diets, in RKD the malonaldehyde level decreased compared to baseline and was similar to the SD group.",0a79b2d1-b7c1-4fb6-8ec7-e3a1c0de10b0
14,methods14," At the same time, in the RSD group, the plasma concentration of this marker remained similar to the baseline in high fat diet (HFD) group.  Much more pronounced changes were noted for Superoxide dismutase (SOD) (Figure 4). At baseline, no changes were observed between the studied groups. In the SD and RSD groups, the level of this marker remained unchanged. However, in the RKD group, a significant increase in Superoxide dismutase (SOD) was observed.  The results regarding AGEs are presented in Figure 5. Neither the initial high fat diet (HFD) nor the restrictive diet afterwards influenced AGEs. A small decrease in AGEs was noted after 4 weeks but was similar for all study groups.  3.5. Correlations between Body Composition and Biochemical Parameters  The results of the correlation analysis in all studied groups before and after the intervention are presented in Figures S1–S5.",48b9dceb-f617-4d84-83c0-02f399fd3283
15,methods15," In the SD group at the baseline, significant positive correlations were detected between body weight and MDA (r = 0.886) and Superoxide dismutase (SOD) (r = 0.829); alkaline phosphatase (ALP) and HDL (r = 0.841); and cholesterol and HDL (r = 0.812). The negative correlations in the SD group were found between fat mass and lean mass (r = −0.943); aminotransferase (ALT) and leptin (r = −0.900); and urea and Tg (r = −0.886).  In the group fed with high fat diet (HFD) at the baseline, positive significant correlations were observed between body weight and fat mass (r = 0.886); cholesterol and glucose (r = 0.829) and AGEs (r = 0.943); Tg and atherogenic index of plasma (AIP) (r = 0.829); and glucose and AGEs (r = 0.943). In this group, negative significant correlations were detected between body weight and lean mass (r = −0.886); aminotransferase (ALT) and creatinine (r = −0.829) and cholesterol (r = −0.829); and HDL and atherogenic index of plasma (AIP) (r = −0.928).",ee79e86d-becb-4a03-8fa3-abdfe372f1da
16,methods16,"  After the intervention, in the group fed with the SD diet for the duration of the experiment, positive significant correlations were detected between body weight and leptin (r = 0.943); fat mass and leptin (r = 0.943); alkaline phosphatase (ALP) and creatinine (r = 0.829); Tg and atherogenic index of plasma (AIP) (r = 0.943); and glucose and AGEs (r = 0.943). At the same time, negative significant correlations were observed between fat mass and lean mass (r = −0.943); aminotransferase (ALT) and glucose (r = −0.829); and cholesterol and glucose (r = −0.886).  In the RKD group, positive, significant correlations were detected between fat mass and Superoxide dismutase (SOD) (r = 0.786); lean mass and aminotransferase (ALT) (r = 0.714) and alkaline phosphatase (ALP) (r = 0.762); aminotransferase (AST) and aminotransferase (ALT) (r = 0.855); aminotransferase (ALT) and alkaline phosphatase (ALP) (r = 0.655); uric acid and MDA (r = 0.714); urea and Tg (r = 0.",7e9f4130-6fc9-4fd9-b19d-476d2727f4be
17,methods17,"627); cholesterol and AGEs (r = 0.779); and Tg and atherogenic index of plasma (AIP) (r = 0.973). Negative significant correlations in the RKD group were detected between: fat mass and aminotransferase (ALT) (r = −0.714) and alkaline phosphatase (ALP) (r = −0.762); lean mass and Superoxide dismutase (SOD) (r = −0.786); Tg and MDA (r = −0.782); atherogenic index of plasma (AIP) and MDA (r = −0.800); and Superoxide dismutase (SOD) and AGEs (r = −0.636).  In the RSD group, positive significant correlations were detected between body weight and urea (r = 0.762); lean mass and HDL (r = 0.790); aminotransferase (ALT) and alkaline phosphatase (ALP) (r = 0.661); Tg and atherogenic index of plasma (AIP) (r = 0.927); and Superoxide dismutase (SOD) and AGEs (r = 0.842). In the RSD group, negative significant correlations were noted between body weight and aminotransferase (ALT) (r = −0.810) and HDL (r = −0.743); fat mass and lean mass (r = −0.976) and HDL (r = −0.",09340fe2-f7a4-4916-9cd3-20bfb36de5fc
18,methods18,"838); aminotransferase (ALT) and urea (r = −0.855); alkaline phosphatase (ALP) and cholesterol (r = −0.687); urea and HDL (r = −0.718); Tg and MDA (r = −0.661); and atherogenic index of plasma (AIP) and MDA (r = −0.685).  4. Discussion  In the current investigations, we were able to confirm and extend the existing knowledge on the effects of a restrictive KD on body weight and composition as well as haematological and biochemical parameters, in addition to highlighting the effect of a restrictive KD on oxidative stress.  In the young Wistar rats, the restrictive KD resulted in a slowdown in the gain of body weight, similar to the restrictive SD. This suggests that caloric intake seems to have more importance than diet type. However, the body composition differed significantly between the analysed restrictions. Rats fed with KD had more fat mass and less lean mass compared to the RSD group.",a69ca542-b954-405e-bc60-ebd7a042db22
19,methods19," This is in agreement with previous reports, which also observed an increase in body fat percentage after KD intake [29,32,33]. It is probably a consequence of the composition of KD, leading to the deposition of fat in various tissues, including the liver, which in turn can lead to the development of non-alcoholic fatty liver disease (non alcoholic fatty liver disease (NAFLD)) [34]. The lower lean mass in rats fed with KD observed in this study can be explained by lower protein intake, which is required to maintain muscle growth, especially in young organisms. The concerning fact is that the reduction of body weight in rats from the RKD group resulted mainly from losing the lean mass due to the lower protein intake. The appropriate amount of muscle is of particular importance in the young, still-growing organisms. Therefore, this must be kept in mind before the introduction of KD. Another explanation can be related to the deficiency in the growth hormone as reported by Caton et al.",ac945530-65cf-4e6f-b70b-79020fda8e56
20,methods20," [26]. However, the growth hormone was not analysed in this study and therefore cannot be confirmed. Further studies on this topic are required. A limited number of reports focused on the effect of KD in immature animals with obesity. In this case, a decrease in body weight is not expected after introducing the restrictive diet, since the animals are still growing. In the study of Caton et al. [26], who examined the effect of KD in non-obese, young rats, the lack of body weight gain was reported, contrary to the reduction in body mass in adult rats. This is in accordance with this investigation, since in our study, rats with high fat diet (HFD)-induced obesity were analysed, and the differences between the rats from the RKD and SD groups were significant. The cited authors underlined that the initial body weight has a crucial impact on the response to KD [26].  In this study, an elevated concentration of leptin was observed in rats fed with a KD.",b9901c78-5e68-4c4c-8fbc-0a34166cf03d
21,methods21," Leptin is considered an indicator of higher fat mass [35], which is consistent with the findings of the body composition determined in this study. However, the significant positive correlations between leptin and fat mass were observed only in the SD group after the intervention. Leptin is controlled by the hypothalamus and is focused to reduce food intake and limit adiposity [36]. In the animals with high fat diet (HFD) and non-KD-induced obesity, the anorectic effect of leptin was suppressed [37]. However, the study of Kinzig et al. [35] showed that although the fat mass percentage was elevated in the rats fed with KD, the loss of sensitivity to leptin was not observed like in high fat diet (HFD). Moreover, the level of peripheral leptin was reported to be dependent on the triglyceride level [38]. Triglycerides inhibit the transport of leptin through the blood–brain barrier, participating indirectly in the resistance to leptin.",c759ae06-9ecd-4986-8d40-821a0f0ca36d
22,methods22," In our study, although rats from the RKD group had an extremely high level of dietary fat, the concentration of triglycerides was not higher compared to other groups. Additionally, we did not observe the correlation between the level of leptin and Tg in any of the groups. It may be speculated, taking into account the lack of triglyceride elevation with the known lack of loss in sensitivity to leptin despite high adiposity after KD intake, that a following KD in obesity can preserve the beneficial effects of leptin, supporting the limitation of the food intake and increased satiety. However, this requires a confirmation in the experimental studies. A similar observation regarding the lack of triglycerides increasing after KD was reported by Kinzig et al. [35].  The positive effect of KD on the lipid profile was repeatedly reported in clinical trials [9,39,40].",fc161005-2ff9-4ad0-bf25-1f46d936958b
23,methods23," For instance, only two weeks of low-calorie KD were enough to reduce the cholesterol, triglycerides and LDL cholesterol in individuals with obesity [39]. In the current investigation, KD did not have a substantial effect on the lipid profile. Notably, the level of HDL cholesterol was elevated after KD intake. Contrary to other investigations [41,42] which reported a decrease in glucose level after KD, in this study, elevated glucose concentration was noted for both restrictive groups. It is difficult to explain, especially in rats fed with KD where the carbohydrate level was extremely low, why the glucose level increased. The possible explanation of this phenomenon could be associated with potential inhibitory effect of insulin on gluconeogenesis in the liver due to insulin resistance. This could explain the increased glucose level in rats from the RKD group.",ed57185a-25b1-4d50-b795-de25d88da2e2
24,methods24," Another possible explanation is related to the fact that, since KD resulted in the decrease in the lean mass and consequently less muscles to take up glucose, this could lead to a higher level of “unconsumed” glucose in the bloodstream. This issue requires further elucidation in future. In this investigation, atherogenic index of plasma (AIP) was calculated to estimate the risk of the development of cardiovascular diseases. atherogenic index of plasma (AIP) was found to be a useful marker of coronary and metabolic syndrome [43]. In rats fed with high fat diet (HFD), atherogenic index of plasma (AIP) doubled compared to the rats fed with SD. For humans, it is considered that atherogenic index of plasma (AIP) > 0.21 represents a high risk of atherosclerosis [44]. However, this range was never adjusted to the animal model. In our study, atherogenic index of plasma (AIP) = 0.",b73411aa-e3ad-43c3-9879-bd3a06256373
25,methods25,"21 was reported in young, healthy rats fed with SD, for which the elevated risk of cardiovascular diseases is not expected. The restrictive KD, similarly to RSD, resulted in a decrease in this parameter. This suggests that only the calorie restriction, not the type of diet, has a stronger effect on the reduction of the development of cardiovascular diseases. At the end of the experiment, in rats fed with KD, the optimal atherogenic index of plasma (AIP) value was slightly exceeded, which would suggest a higher risk of atherosclerosis. However, considering that in the SD group before the intervention, the atherogenic index of plasma (AIP) was 0.21, then the increased risk of coronary problems caused by KD (atherogenic index of plasma (AIP) = 0.23) was not expected. In our study, atherogenic index of plasma (AIP) was positively correlated with Tg in all analysed groups and negatively correlated with HDL in the group with initial high fat diet (HFD) and with MDA in the RKD and RSD groups.",3f4583e2-695b-43a3-875a-f68047e90ba3
