,chunk_label,chunk_text,uuid
26,methods26,"  Obesity can lead to the development of liver impairment, being the consequence of the accumulation of lipids in the liver [34]. In the current study, the initial obesity-inducing high fat diet (HFD) resulted in an elevated level of the activity of liver enzymes. The restrictive KD, despite the inhibiting effect on the body weight similar to RSD, resulted in a maintaining of a high level of all liver-related parameters. This is in agreement with previous studies, which showed that KD intake can induce hepatic steatosis in mice [45]. Moreover, the KD was found to induce liver changes, which could potentially result in insulin resistance despite the prevention of body weight gain and increased energy expenditure [46]. The elevated level of liver enzymes, which may suggest the development of non alcoholic fatty liver disease (NAFLD) in future, may have an important clinical implication in carefully selecting KD for obesity treatment, especially in young organisms.",9b1b9e7d-1f16-4a53-a94d-61f464afb6d1
27,methods27,"  Long-term adherence to KD has been suggested as a risk factor for the development of kidney stones and increased level of circulating uric acid [47,48]. Since KD as a therapy for obesity is usually followed for a few weeks, the negative effect of this diet on the kidneys has not been confirmed in clinical trials with individuals with obesity, even with mild kidney failure [49]. In spontaneously hypertensive rats, the reduction in renal autophagy levels and elevated renal parenchymal damage were reported after a 4-week KD intervention [50]. The authors detected elevated creatinine levels in the rats fed with KD. In the current study, no negative effects on kidney-associated parameters were reported. The creatinine level in RKD was higher than at the baseline; however, it was at the same level as in rats fed with SD for the whole experiment, thus the increase in creatinine could be a result of the growth of rats. Only in rats from the RSD group was elevated creatinine noted.",ff52a9bf-552b-4196-9549-95b33e773585
28,methods28," The discrepancies between our study and other trials with rodents, which reported an increase in creatinine [50,51], can be associated with age, since in these studies the adult rats were analysed, while in ours the adolescent rats with diet-induced obesity were treated with a restrictive diet in adulthood. Based on this, it can be assumed that KD is a safe therapy for obesity in youths, which does not cause the aggravation of kidney functioning. It has to be kept in mind that uric acid can also be considered as an important marker of metabolic syndrome and can be involved in insulin resistance, dyslipidaemia and abdominal obesity [44]. As presented and summarized in the study of Mazidi et al. [44], a lower circulating level of uric acid is associated with lower risk of diabetes, insulin resistance and better cardiovascular health. In our study, KD resulted in the lowest level of uric acid, which can be considered a positive effect.",9bc2fb32-cf0d-4145-a421-aa284b5a098e
29,methods29," Moreover, the lower level of urea detected in rats fed with KD can be easily explained by the lack of proteins in the diet, which are the main source of urea in the circulation.  Another potential risk suggested after long-term adherence to KD is anaemia [48]. However, in the clinical trials with individuals with obesity, usually, no effect on the blood haematology and iron metabolism was reported [40,52,53]. In a clinical trial with 35 adults with obesity, no significant changes in the iron level were reported, suggesting that KD had no effect on anaemia [40]. Moreover, the clinical trial with patients treated with a KD due to drug-resistant epilepsy showed that 12-month adherence to KD resulted in an increase in HBG, HCT and MCV, while no effect on other haematological parameters (red blood cell, white blood cell and platelet counts, serum iron, total iron-binding capacity, transferrin saturation, and ferritin and folic acid levels) was observed [54].",586c97a6-c7ec-4b99-b648-1ca593af2453
30,methods30," On the contrary, the study with healthy Wistar rats showed a decrease in erythrocytes, HBG and HCT [24]. In the current investigation, similar findings were noted with an increase in HBG and HCT after KD adherence. Moreover, KD did not have a tremendous effect on the white cell and platelet systems. After restrictive KD, a reduction in WBC, LYM, and MID was reported. The observed changes in the WBC system were not varied to a high extent in any of the groups; thus, it can be assumed that no inflammatory state occurred in young rats, irrespective of the diet. However, to claim that there is no effect on the inflammation caused by KD or high fat diet (HFD), an additional study with analysis of cytokines has to be conducted. In addition, a restrictive KD normalized the results of the platelet system, which was elevated after the initial high fat diet (HFD).  Obesity is associated with chronic low-grade inflammation and, consequently, permanently increased oxidative stress [3].",1a0b9c49-c5eb-49ff-af0e-85f0e78b5b80
31,methods31," The long-lasting oxidative stress damages cellular structures leading to the development of obesity-related diseases. The measurement of enzymatic antioxidant activity reflects the quality of antioxidant protection and is a commonly used marker for oxidative status measurement [55]. Fat metabolism requires more complex processes, such as reduction, oxidation, hydroxylation, and conjugation, which may elevate the production of reactive oxygen species (ROS) [45], therefore it can be hypothesised that KD would elevate oxidative stress. The previous studies were not conclusive about the effect of KD on oxidative stress. Arsyad et al. [24] reported that Superoxide dismutase (SOD) decreased significantly after 60 days of KD in healthy Wistar rats. On the other hand, 3 weeks of KD in Taekwondo players were able to prevent the oxidative stress caused by exercises [56]. Nazarewicz et al.",a793213d-3c2e-4b84-a902-da0621f9cfb3
32,methods32," [53] did not observe any changes in the antioxidant enzymes; however, total oxidative status was improved in healthy women following KD for 2 weeks. In addition, KD was found to attenuate oxidative stress after traumatic brain injury in an animal model [23]. No effect on oxidative stress was reported in patients with obesity following very-low-calorie KD [57]. In this study, a decreasing tendency was observed for malonaldehyde, which is produced as the result of the degradation of polyunsaturated fatty acid peroxidation products and has been commonly used as a marker of oxidative stress [58]. Moreover, a clear increase in Superoxide dismutase (SOD), which is an enzyme of the antioxidant defence system, was noted. This together might implicate that KD does not stimulate oxidative stress, but reduces it.  Among the sources of reactive oxygen species (ROS), AGEs are increasingly formed under hyperglycaemic conditions [6].",c270750b-b31b-46a0-9790-a8e2b47552ab
33,methods33," The damaging potential of AGEs have been assumed to be involved in the pathogenesis of obesity-related complications. KD have been suggested to promote the production of reactive oxygen species (ROS) and to be involved in protein glycation to produce N(epsilon)-(carboxyethyl)lysine, one of the AGEs [59,60]. In non-obese mice, KD resulted in a decrease in AGEs in kidneys, despite the negative changes in kidney morphology [60]. In the present study, no effect of KD on AGEs was found, suggesting that KD may be a safe option for obesity treatment in young subjects.  5. Conclusions  In summary, in this investigation, we demonstrated that introducing the restrictive diet in adult rats with high fat diet (HFD)-induced obesity in adolescence resulted in a slowing down of weight gain. Our study suggests that the composition of the diet (KD vs.",32ec65b2-8631-4845-b47b-27e2a0d8043f
34,methods34," SD) has no effect on body weight gain/loss, but has a substantial effect on the body composition, with KD contributing to the fat mass accumulation in young animals. Increased adiposity resulted in an deterioration of liver parameters, suggesting negative changes in this organ. Therefore, KD followed as a body weight-reducing therapy should be vigilantly monitored to prevent the development of non alcoholic fatty liver disease (NAFLD). No adverse effects of KD were determined in haematological parameters in young rats. KD did not affect AGEs; however, a decrease in oxidative stress was observed. Based on the presented results, it can be concluded that KD, applied as a method for weight loss, may reduce oxidative stress without compromising the nutritional status; however, caution is required to control adiposity, high circulating glucose level and liver health.",b57339af-86c1-406b-b10e-13cc6d62db93
35,methods35," The efficiency of losing weight was similar, irrespective of the diet composition, and therefore the potential metabolic consequences of KD have to be carefully considered. Thus, KD applied as a weight-loss therapy should be carefully controlled, especially in young subjects. ",9d412dd5-b21b-4bac-83f9-d6b72cd9c73a
